,date,title,contents
1211,2020.02.18.,"성동구 성수동 지속가능발전구역, 임대료 인상률 '하락’ 안정…지역상생 공감...","임대료 인상률을 구역별로 살펴보면 서울숲길 4.00%, 방송대길 2.31%, 상원길 1.45%로, 이는 성수동 일대가 최근 서울에서 가장 주목받는 상권 중 하나로 임대료가 치솟는 지역이라는 점을 고려할 때 놀라운 결과이다...."
1212,2020.02.09.,"이낙연 ""총리로서 제대로 일했다"" 황교안 ""그동안 경제실정 엄청났다""",1번지' 서울 종로에 출마한 더불어민주당 이낙연 전 국무총리와 자유한국당 황교안 대표가 9일 각각 지역구를... 황 대표가 첫 지역구 방문으로 젠트리피케이션(임대료 급등에 따른 원주민 이탈)과 경기 불황으로 상권이...
1213,2020.02.21.,"소자본 배달 전문 가맹점창업, 업종변경 문의 활발…'싸움의고수' 120호점 돌...","한 예로 매장 평수가 10평에 불과한 서울의 한 가맹점은 빠른 테이블 회전에 배달 판매가 더해져 월... 이에 대해 브랜드 관계자는 ""기존 매장들의 배달 매출 비중을 분석한 결과 상권에 따라서는 배달전문 가맹점으로..."
1214,2020.02.21.,[7문 7답] 명동 VIP 자산관리사가 말하는 ‘부자되는 법’,"명동 상권의 흥망성쇠를 함께하며 아무것도 없는 바닥에서부터 시작해 수백억 원대, 수천억 원대 자산을... 과연 그들은 어떻게 대한민국 서울의 한복판 명동에서 부자가 되었으며, 왜 그들 중에는 유독 자수성가한..."
1215,2020.02.13.,[코로나19] 부동산시장 영향은?… 메르스 당시는 어땠나 보니,윤 수석연구원은 아파트 매매가격은 오히려 지난해 12·16부동산대책 발표 후 서울 지역 고가주택과 재건축... “다만 상권시장은 현재 국면이 예상보다 길어질 경우 관광객 감소로 인한 매출 타격과 수익성 축소로 인해...
1216,2020.02.13.,"한화건설, 포레나 완판 단지 3곳 상업시설 분양",특히 신축 아파트 8000여 가구가 들어서 있는 신(新) 두정지구의 중심지에 위치해 상권 선점 효과도... 단지는 1128가구 규모로 인천 2호선 가정역 역세권에 위치하고 있을 뿐만 아니라 서울지하철 7호선 연장(예정) 호재...
1217,2020.02.15.,코로나19 부동산 시장 영향은?…메르스 땐 어땠나 보니,다만 상권(상가) 시장은 현재 국면이 예상보다 길어질 경우 관광객 감소로 인한 매출 타격과 수익성 축소로... 윤지해 부동산114 리서치팀 수석연구원 “아파트 매매가격은 지난 해 12‧16대책 발표 후 서울 지역...
1218,2020.02.25.,[세종시에서] 공무원 외식 독려하더니…코로나19 확산에 '스탭 꼬인' 정부,이달 초 신종 코로나바이러스(코로나19)로 침체된 지역상권을 살리기 위해 공무원 외식을 독려했던 정부의... [서울=뉴스핌] 민경하 기자 = 서울시 영등포구 한 스타벅스 매장. 직원들이 마스크를 착용한 채 근무하고...
1219,2020.02.18.,관악구 도림천 생태복원 재탄생…22년까지 331억원 투입,▲관천로 초록풍경길 조감도 서울 관악구(구청장 박준희)는 도림천 서울대 앞 구간의 생태복원사업에... 관악구는 도림천을 중심으로 신림역 일대에 올해부터 5년간 80억 원을 투입해 지역상권을 활성화하는 '별빛 신사리...
1220,2020.02.17.,"경의중앙선 신촌역사, 지역 특화 상업시설 탈바꿈 추진","SM그룹(회장 우오현) 계열사 SM신촌역사가 서울시 서대문구 경의중앙선 신촌역사를 지역 특화 상업시설로... 것""이라며 ""주변 상권 활성화 및 신촌 지역의 복합문화 랜드마크로 자리매김하기 위해 현재 MD 구성을 추진 중..."
1221,2020.02.17.,서초방역단 “상점 소독 걱정마세요”,구민 300명 이달초 자발적 구성 / ‘코로나19’ 지역내 확산 방지 총력 서울 서초구의 주민들로 구성된 ‘서초방역단’이 코로나19의 지역사회 확산을 막기 위해 힘쓰면서 잔뜩 위축된 골목상권 살리기에도 앞장서고...
1222,2020.02.12.,[공시지가] 명동 ‘네이처리퍼블릭’ 17년째 1위… 1㎡당 2억 눈앞,서울 중구 명동 네이처리퍼블릭 부지 땅값이 1㎡당 2억원 돌파를 눈앞에 뒀다. 12일 국토교통부가... 반면 명동 상권이 포함된 중구는 전년 대비 상승폭이 크게 축소(21.93→5.06%)된 것으로 나타났다.
1223,2020.02.18.,관악구 도림천 생태복원 재탄생...2022년까지 331억원 투입,서울 관악구는 도림천 서울대 앞 구간의 생태복원사업에 착수한다고 18일 밝혔다. ▲ 2022년 도림천 정비... 관악구는 도림천을 중심으로 신림역 일대에 올해부터 5년간 80억 원을 투입해 지역상권을 활성화하는 '별빛...
1224,2020.02.14.,위례신도시 중흥S-클래스 사이버모델하우스 열고 분양 시작,"약 1.5km 거리에 서울 지하철 5호선 마천역이 위치한다. 서울외곽순환도로 송파IC와 송파대로, 동부간선도로... 위례신도시 중심상권인 트랜짓몰, 휴먼링 등이 인접하며, 스타필드 시티 위례도 지구 내 위치해 쉽게..."
1225,2020.02.14.,구윤철 기재차관 “코로나19 대응 지방재정 297억 지원”,구윤철(왼쪽 첫번째) 기획재정부 제2차관이 14일 오후 서울 광화문 정부서울청사에서 열린 ‘2020년 제3차... 구 차관은 “지역상권의 회복을 위해 공무원 맞춤형 복지제도 등을 활용한 온누리 상품권과 지역사랑상품권...
1226,2020.02.11.,세종대 캠퍼스타운조성단 제3기 서포터즈 모집…21일까지,자세한 내용은 캠퍼스타운 지원센터로 문의하면 된다. 캠퍼스타운은 대학을 중심으로 청년 창업을 확산하고 지역 상권과 경제를 활성화하기 위해 서울시가 추진하는 사업이다.
1227,2020.02.11.,"“요기요서 만나요” 세븐일레븐, 편의점 먹거리 배달 서비스 시작","중심으로 상권별 주요 거점 10개 점을 선정해 시범 운영을 시작하고, 향후 주문 채널과 운영 점포를 순차적으로 확대할 계획이다. 우선 시작하는 점포는 소공점, 세종대로카페점, 시그니처타워점, 이태원중앙점, 서울이..."
1228,2020.02.17.,"춘천시의회, '제2경춘 국도 최적노선 선정' 촉구","주도로로, 서울~양양간 고속도로는 수도권 주민의 영동지역 주이용 도로로 이격거리를 둠으로써 상권 침체를 막고 물류비용을 최소화 하는 것이 이 사업의 상생 방안임을 잊지 말아 달라""고 주문했다. 또 ""이에..."
1229,2020.02.17.,[트렌드] 3000만원으로 창업하는 언택트 비즈니스,서울시 우리마을가게 상권분석서비스에 따르면 서초2동의 1층 점포 평균 임대료는 3.3㎡당 15만677원으로 서울시 평균(13만3363원)보다 2만 원 가까이 높다. 하지만 공유주방의 초기 창업비용은 대략 3000만~3500만 원 선....
1230,2020.02.14.,"이병훈 예비후보, 혁신 통한 골목상권 부활 복안 제시","골목상권의 부활을 이뤄야 한다""며 문화경제에 대한 복안을 내놨다. 이병훈 예비후보는 ""쇠락한 골목길을... 카페거리와 서울 익선동 한옥거리를, 해외사례로는 중국 상하이의 '텐쯔방'을 예로 들었다. 이 후보는 ""과거..."
1231,2020.02.23.,반려동물 메디컬·헬스케어 전시회 CAMEX 2020 현장 모습은？,"반려동물 메디컬&amp;헬스케어 전시회 카멕스 2020(CAMEX 2020)이 22일(토) 서울 코엑스 D홀에서 개막했다. 행사는... 동물병원 개원입지에 대해 발표한 김형준 헬로우벳 팀장은 신도시와 구도심의 장단점, A~C급 입지와 특수상권..."
1232,2020.02.18.,"[아유경제_사회] 다시 흐르는 도림천, 331억 들여 복원","서울 관악구의 오늘(18일) 발표에 따르면 2월부터 도림천 서울대 앞 구간의 생태복원사업에 착수한다. 이번... 관악구 관계자는 ""도림천을 중심으로 신림역 일대 지역상권을 활성화하는 '별빛 신사리' 사업도 함께..."
1233,2020.02.20.,"탐앤탐스, 파드 커피 전문 성수 1호점 오픈","사진=탐앤탐스 커피전문점 탐앤탐스가 오는 19일 서울 성수동 카페거리에 '탐앤탐스 성수 1호점'을 오픈했다고 20일 밝혔다. 성수동 카페거리는 20-30대 젊은 층을 중심으로 주목받고 있는 상권으로, 독특한 분위기와 이색..."
1234,2020.02.18.,학교시설 개선하고 동네 주차장 확보,은평구 갈현초등학교 복합화 … 다목적체육관도 건립 서울 은평구 갈현동 갈현초등학교 학생들이... 은평구는 2011년부터 학교와 지역상권 상생방안으로 복합화사업을 통한 지하 공영주차장 건설을 추진해왔다. 교육청도...
1235,2020.02.11.,"‘요기요’서 한판 붙자...세븐일레븐 가세로 편의점 빅5, 배달서비스 개시","먼저 수도권을 중심으로 상권별 주요 거점 10개점을 선정해 시범 운영하고, 향후 주문 채널과 운영 점포를... GS리테일이 운영하는 GS25 역시 지난해 4월 ‘요기요’와 함께 현재 서울 강남권에서 총 10곳을 시범 운영..."
1236,2020.02.11.,"CJ올리브영, 색조 화장품 시험용 종이 비치…“신종 코로나 예방”",CJ올리브영이 신종 코로나바이러스 감염증(신종 코로나) 확산을 막기 위해 11일 서울 명동 상권 5개 매장에 방역 작업을 했다고 밝혔다. 또 고객이 화장품을 구매하기 전에 안심하고 써볼 수 있도록 전 매장에 테스트용...
1237,2020.02.09.,"[포착] 종로 찾은 황교안, 떡볶이 먹고 시민과 주먹 인사",4·15 총선에서 서울 종로 출마의 승부수를 던진 황교안 자유한국당 대표가 밑바닥부터 종로 민심 다지기에... 공실 상가를 첫 방문지로 택한 것은 경기 침체로 어려움을 겪는 삼청동·혜화동·종로3가 등 종로의 상권을...
1238,2020.02.13.,지역 상권 현황 보고 받는 정세균 총리,정세균 국무총리가 13일 서울 신촌 명물거리를 방문해 문석진 서대문구청장에게 신종코로나 바이러스 감염증(코로나19)로 인한 서대문구 지역 상권 현황을 전달받고 있다. 2020.2.13
1239,2020.02.20.,"현대백화점면세점, 동대문점 오픈 ""강북 상권 공략 본격화""","현대백화점면세점이 들어서는 동대문 상권은 서울 명동과 함께 서울 강북을 대표하는 관광 명소로, 연간 700만명의 외국인이 찾고 있다. 주변에 동대문 패션타운 관광특구, 동대문디자인플라자(DDP), 광장시장 등 풍부한..."
1240,2020.02.13.,지역 상권 현황 보고 받는 정세균 총리,정세균 국무총리가 13일 서울 신촌 명물거리를 방문해 문석진 서대문구청장에게 신종코로나 바이러스 감염증(코로나19)로 인한 서대문구 지역 상권 현황을 전달받고 있다. 2020.2.13
1241,2020.02.20.,"현대백화점면세점, 동대문점 오픈 ""강북 상권 공략 본격화""","현대백화점면세점이 들어서는 동대문 상권은 서울 명동과 함께 서울 강북을 대표하는 관광 명소로, 연간 700만명의 외국인이 찾고 있다. 주변에 동대문 패션타운 관광특구, 동대문디자인플라자(DDP), 광장시장 등 풍부한..."
1242,2020.02.22.,"[전문가칼럼]2020년 부동산 전망, 서해안 시대 오나",장기간의 경기침체로 상권의 위축이 불가해 투자금액이 많이 드는 상가보다는 소액으로도 투자가 가능한... 최근 서울 및 수도권 부동산시장이 이달 초 정부의 ‘민간택지 분양가 상한제 개선방안’ 발표 이후 다소 교착...
1243,2020.02.20.,20대 마지막 임시국회…젠트리피케이션·아청법 등 대기,(검역법·감염병예방법·의료법) ▲공공의료대학법 ▲지역상권 상생발전법 ▲미세먼지관리특별법... [서울=뉴스핌] 이형석 기자 = 김세연 보건복지위원장이 18일 오후 서울 여의도 국회에서 열린 보건복지위원회...
1244,2020.02.24.,"월드타워 상가의 성공행진, 운정역 중심상업지구 ‘월드타워12’에서도 계속된...",서울·경기지역을 기반으로 12년여의 수익형 부동산개발과 건설사업 노하우를 갖추고 있는 기업인 월드타워... 운정역 중심상업지구는 연면적 약 20만평 위에 조성되는 파주시 최고의 상권이다. 인근에는 복합행정타운과...
1245,2020.02.24.,"국민체육진흥공단, 코로나 19 ‘심각’단계 격상에 따른 긴급 종합대책 마련",한편 공단은 코로나 19 확산으로 매출에 어려움을 겪는 서울시 송파구 올림픽공원 인근 상권에 도움을 주기 위해 사태가 오는 5월까지 매주 금요일마다 주 1회 직원식당을 휴무한다. 올림픽공원에 위치한 공단...
1246,2020.02.19.,[충청브리핑] 대전?충남 혁신도시 국회통과 ‘사활’,"‘천정부지’…서울 아파트값 양극화 사상 최대 상위 20%, 하위 20%의 6배 넘어 5분위 배율 ‘6.1’…조사 이후... 비율 감당 못해 대학들 근심, 대학 평가지표에 실적도 포함 “인근 상권 등도 타격 예상” 뉴데일리 김정원"
1247,2020.02.13.,"엘레쎄, 아웃도어 프로덕트와 손잡고 신학기 가방 출시","스타필드하남, 서울대학로, 강릉 등 총 8개 오프라인 매장에서 이뤄지며 엘레쎄 온라인 공식스토어를... 수 있도록 주요 상권에 팝업스토어를 오픈해 브랜드 가치를 높이는데 최선을 다할 것""이라고 말했다. [디지털뉴스국 ]"
1248,2020.02.20.,탐앤탐스 성수 1호점 그랜드 오픈,"커피전문점 탐앤탐스가 오는 19일 서울 성수동 카페거리에 ‘탐앤탐스 성수 1호점’을 오픈했다고 20일 밝혔다. 성수동 카페거리는 20-30대 젊은 층을 중심으로 주목받고 있는 상권으로, 독특한 분위기와 이색 콘셉트의..."
1249,2020.02.20.,[위기의 대구수제화골목] 홍보 중심 활성화대책만으론 한계… 실질 지원책 절...,"서울, 부산 등 전국 손님은 물론, 대구 근대골목투어 제1코스 경상감영달성 길에 편입되며 대만, 일본 등... 관광객은 유치했지만 상권활성화로 이어지지 못하고 있다. 1층 전시공간에 골목 상인들이 만든 수제화를..."
1250,2020.02.20.,[위기의 대구수제화골목] 홍보 중심 활성화대책만으론 한계… 실질 지원책 절...,"서울, 부산 등 전국 손님은 물론, 대구 근대골목투어 제1코스 경상감영달성 길에 편입되며 대만, 일본 등... 관광객은 유치했지만 상권활성화로 이어지지 못하고 있다. 1층 전시공간에 골목 상인들이 만든 수제화를..."
1251,2020.02.12.,“공동구매와 커뮤니티로 커피 거품 해결”..‘원두(ONEDO)’ 런칭,"소상공인 상권정보시스템에 따르면, 그 동안 카페 시장은 70% 이상이 개인 영세 사업자로 대형 프렌차이즈... 6월에는 독자적 알고리즘 개발 및 특허 출원, 서울앱비즈니스센터 지원 사업 선정을 잇따라 받으며 7월 정식..."
1252,2020.02.21.,"서대문구, 코로나19로 침체된 지역경제 살리기 총력",서대문구가 코로나19로 침체된 지역상권을 회복시키기 위해 ‘전통시장과 골목상권 살리기’에... 또 서울신용보증재단 서대문지점과 연계해 코로나19로 직접 피해를 입은 음식업과 숙박업소 등에 대한...
1253,2020.02.17.,관악구 “코로나로 휴관했던 공공시설 신속 재개”,"서울 관악구(구청장 박준희)는 코로나19 우려로 휴관했던 도서관 등 다중이용 공공시설을 신속히 재개할... 회의 결과 구는 시설별 운영 재개가 구민의 안전과 주변 상권에 미치는 파급효과, 시설의 안전성 확보 여부 등..."
1254,2020.02.21.,"보수단체, 24일 구미서 대규모 집회 예정…""코로나 사태에 집회라니"" 시민 반...","자수연 측은 ""무너지고 있는 대한민국을 살리기 위한 집회""라고 설명했다.하지만 문제는 서울·대구·부산 등... 정모씨는 ""경북경제를 살리기 위한 집회라고 하지만 정작 집회가 열리면 인근 골목상권은 심각한 피해를..."
1255,2020.02.16.,편의점 배달서비스 경쟁 불붙었다,"우선 서울 소공점, 세종대로점 등 수도권을 중심으로 상권별 주요 거점 10개점을 선정해 시범 운영을 시작하고, 향후 주문 채널과 운영 점포를 순차적으로 확대할 계획이다."
1256,2020.02.21.,"서영교의원, ‘코로나19 피해 중소기업 지원법”대표발의","서영교 국회의원(더불어민주당·서울 중랑구갑)은 20일, 중소벤처기업부 장관이 감염병 등 재난의 발생으로... 위축된 상권 활성화를 위해 노력했다. 이에 음식점 측은 “의원님을 비롯해 문재인대통령의 영부인이신 김정숙..."
1257,2020.02.20.,"양천구, 구내식당 닫아 지역상권 살리는 ‘상생휴일’ 주 1회로 확대",김수영 양천구청장은 “코로나19 여파로 발생하는 지역상권 침체로 인한 상인들의 고통을 분담하고 지역 경제에 힘을 싣기 위해 800여 명의 구청 직원이 솔선수범하기로 했다”고 전했다. [신아일보] 서울
1258,2020.02.20.,‘힙지로’ 파고든 코오롱의 공간실험,18일 오후 서울 을지로4가 공구거리. 지하철역을 나와 골목길로 들어서니 어깨를 맞댄 작은 공업사들 사이로... 낡은 것과 새 것이 공존하는 을지로 상권이 오랜 역사를 지닌 코오롱 브랜드를 알리기 적합한 장소라고...
1259,2020.02.21.,"진중권 ""기득권은 기생충, 젊은이들이여 기득권을 죽여라""",""" 진중권 전 동양대 교수(이하 진 교수)가 21일 서울 프레스센터에서 개최된 규제개혁당 시·도당 창당발기인... 특히, 그는 젊은이들이 창의성을 발휘해서 콘텐츠가 쌓이고 상권이 형성되면, 어김없이 땅값 집값이 오르며..."
1260,2020.02.13.,"""부동산, 코로나19보다 정부정책에 영향…메르스 때도 단기위축 그쳐""","아파트 매매가격은 지난해 12·16 대책 발표 후 서울지역 고가주택과 재건축을 중심으로 호가가 떨어지며... 어렵다""며 ""다만 상권(상가) 시장은 현재 국면이 예상보다 길어질 경우 관광객 감소로 인한 매출 타격과..."
1261,2020.02.12.,2억 테크노마트 상가 1000만원에 팔렸다,"오 연구원은 “온라인쇼핑 선호에 따른 상권침체로 임대수익을 기대하기 어려워진 만큼 집합상가 경매 매물은 낙찰가율 하락세가 예상된다""고 했다. 서울 상업시설 경매시장도 전반적으로 움츠러든 분위기다...."
1262,2020.02.19.,"""이 맛이다, 이맛""…황교안의 '종로 맛집' 탐방",4·15 총선에서 서울 종로에 출사표를 던진 뒤 연일 '뚜벅이'로 종로 골목골목을 누비는 황 대표의 현장 방문... 여의도 정가에선 지역구 내 전통시장이나 소상공인들을 매일 찾아다니며 민심을 청취하고 상권을...
1263,2020.02.18.,은평구 ‘갈현초 복합화’ 시동… 공영주차장·체육관 설치 추진,"서울 은평구가 지역 내 갈현초교에 학교 건물과 지하 공영주차장, 다목적체육관을 함께 건립하는 내용의... 구는 이에 학교와 지역사회가 상생하고 주변 상권의 활성화도 이끌 수 있는 방향으로 사업을 구상했다...."
1264,2020.02.20.,"저녁식사 일곱차례나 한 최태원 회장 ""우리주변 함께 돌아보자""","또 SK㈜와 SK이노베이션, SK E&amp;S가 입주한 서울 종로구 서린사옥, SK텔레콤이 입주한 서울 중구 T타워와... 국내 임직원 수가 10만4000여명에 달하는 SK그룹이 외부 점심을 독려하면 주변 상권 활성화에 실질적인 도움을 줄..."
1265,2020.02.20.,회식도 전통시장서… 코로나 넘는 중구,아울러 직원들은 지역 상인들을 위해 서울중구사랑상품권과 전통시장상품권을 일정액 이상 구매하고 있다. 모든 직원이 동참할 경우 2억 8570만원의 혜택이 지역상권에 돌아간다. 또한 구는 골목상권 활성화를 위해 월...
1266,2020.02.26.,"쌍용건설, 3월 '더 플래티넘 잠실' 분양…""잠실새내역서 도보 1분""",특히 아파트 약 1만5000여 세대를 배후 수요로 품고 있는 것은 강남역이나 홍대입구 상권과의 차별점이다.... '쌍용 플래티넘 잠실'의 견본주택은 서울특별시 강남구 역삼동 708-41번지에 오는 3월 들어설 예정이다....
1267,2020.02.14.,"""손님 적으니 편하시겠네""...정세균 ""농담이었다"" 해명","정 총리는 오늘(14일) 세종시에서 연 기자간담회에서 어제 서울 신촌 명물거리에서 한 발언은 ""식당 주인이... 위축되지 말고 철저한 방역아래 상권을 활성화시켜 나가겠다는 정 총리와 정부의 입장에 크게 반겼다""고 밝혔다."
1268,2020.02.18.,"성동구 성수동, 임대료 인상률 평균 0.16% 하락... 평당 평균 9.8만원","임대료 인상률을 구역별로 살펴보면 서울숲길 4.00%, 방송대길 2.31%, 상원길 1.45%로, 이는 성수동 일대가 최근 서울에서 가장 주목받는 상권 중 하나로 임대료가 치솟는 지역이라는 점을 감안하면 놀라운 결과다. 특히..."
1269,2020.02.20.,"금천구, 코로나19 피해 기업지원 대책회의","서울 금천구(구청장 유성훈)가 코로나19 확산으로 침체된 지역경제를 활성화 하기 위해 2월 19일(수) 오후 3시... 구매 연계 지원, 인근 상권 활성화를 위한 구내식당 휴무일 확대 운영 등 지역경제 활성화 계획을 밝혔다."
1270,2020.02.18.,이제는 진천·아산을 돕자,"김홍민 서울취재본부장 충북 진천 국가공무원인재개발원과 충남 아산의 경찰인재개발원에서 격리 생활 중인... 충북혁신도시 상권 활성화를 위해 배려해 달라""고 요청했다. 문 대통령은 이날 ""심리적인 위축 때문에..."
1271,2020.02.10.,이낙연·황교안 ‘종로대전’ 시작,정치 1번지 서울 종로에 출사표를 던진 이낙연 전 국무총리와 황교안 자유한국당 대표가 본격적인 선거전을... 공실 상가를 방문해 현 정부의 경제 정책 탓에 어려움을 겪는 상권을 자신이 살려내겠다고 약속했습니다....
1272,2020.02.18.,"고병수 ""코로나19, 보건‧경제 망라된 종합대책 필요""",서울시에서 시행 중인 자영업자 유급병가제도 확대를 비롯해 △지역사랑상품권 활성화를 위한 정부 지원예산 조기 집행 △사회보험료 한시적 경감 △전기‧수도‧가스 등 공공요금 지원 △전통시장 뿐 아니라 골목상권...
1273,2020.02.19.,‘양주옥정 유림노르웨이숲’ 등 겹호재 프리미엄 예상 단지 잇단 분양,"- 인프라 확충, 인구 유입, 상권 발달, 지역 가치 상승 등 이점 풍부 - 향후 시너지 효과 및 미래가치... 지난해 11월 서울시 용산구 효창동 일대에서 분양한 '효창 파크뷰 데시앙'은 1순위 청약에서 52가구 모집에 9..."
1274,2020.02.20.,[부산상권분석] 온라인성장에 꺼져가는 부산상권…생존 모색 필요,상가정보연구소와 소상공인진흥공단 상권분석시스템에 따르면 서면 주거인구는 2만3212명으로 서울 대표상권인 강남역 주거인구 2만8653명과 비슷했다. 반면 직장인구는 7만7086명으로 강남역(16만4725명)의 2분의 1에...
1275,2020.02.18.,"“자영업자 이달이 고비, 자금지원 속도와 타이밍이 필요하다”…코로나19 피...",대책이 상권의 의견을 적극적 반영해 현실성 있게 추진돼야 한다”고 밝혔다. 김남수 중소기업중앙회 서울중소기업 회장은 “코로나19 확산으로 인해 경제활동이 위축됐다”며 “경영난으로 이어지는 악순환에 있다....
1276,2020.02.16.,"위례신도시 중흥S-클래스 사이버모델하우스 오픈, 본격 분양","중흥S-클래스가 들어서는 위례신도시는 서울 송파구 장지동과 거여동, 성남시 수정구 창곡동, 하남시... 중흥S-클래스는 위례신도시 중심상권인 트랜짓몰, 휴먼링 등이 인접하며 '스타필드시티위례'도 지구 내..."
1277,2020.02.18.,"새길따라 부동산 투자, 신규단지 '(가칭)석남미소지움' 주목","뿐만 아니라, 주변 정비 및 상권이 발달해 생활여건의 개선을 가져온다. 올해도 서울•수도권의 주요도시를 잇는 광역교통망 확충계획이 잇따라 발표되면서, 인근 주택시장에 대한 기대감이 커지고 있다. 특히 인천에서..."
1278,2020.02.20.,"CJ올리브영, 미혼한부모 가정에 건강위생용품 기부","CJ올리브영은 20일 서울 마포구 합정동에 위치한 홀트아동복지회 본사에서 미혼한부모 가정을 위한 후원... 의무화했으며, 지난 11일에는 명동 플래그십 스토어를 포함한 명동 상권 주요 매장에 방역 작업을 실시한 바 있다."
