,date,title,contents
1888,2020.02.14.,[코로나19] 삼성·현대차·SK '지역경제 지원' 팔걷었다,침체한 상권을 살리겠다는 취지다. 구체적인 방안은 사업장별로 수립할 예정이다. 전국의 지방자치단체도 코로나19 대응 지역경제 활성화에 적극 나서고 있다. 서울시는 코로나19 확진자가 다년간 곳 중 방역이 끝난...
1889,2020.02.17.,2020년 2월 17일(월) 전국 주요 신문 톱뉴스,그림자' ▲ 서울신문 = 감자 5개 훔친 죗값 50만원 지명수배된 80세 폐지 노인 ▲ 세계일보 = 국내서도 감염... 지역상권 '붕괴'…재난급 침체 현실화 ▲ 한라일보 = 교차 확인에도 실수 못 잡아…검증 한계 ▲ 메트로신문...
1890,2020.02.09.,"'밸런타인 대목인데 예약이 없어요""…식당가 강타한 '신종코로나'",회식·외식 안한다…한산한 강남·명동 거리 신종코로나바이러스 확진자가 계속 늘어나면서 서울 시내 주요 중심가 식당들이 직격탄을 맞고 있다. 오피스 상권의 경우 점심 손님은 유지되지만 회식이나 저녁 모임 수요는...
1891,2020.02.04.,"[박종인의 땅의 歷史] ""왜 말로만 백성 구제한다고 떠드는가""","이지함은 '본래 오래 있을 생각이 없었기에 곧바로 돌아갔다.'('석담일기' 상권 1574년) 가난은 만성적이었고... 두어 달 사이에 의식이 모두 충족되었다.(정약용, '목민심서' 진황 6조 규모) '서울에 있는 창고는 한계가 있고..."
1892,2020.02.05.,"양홍규 예비후보, 월평동에 KT&G ‘상상마당’ 유치 공약","양 후보는 “연 방문객 180만 명에 이르는 서울 홍대 앞 ‘상상마당’은 젊음의 상징인 홍대 주변 문화예술 랜드마크이자 ‘작은 퐁피두’로 불린다”면서, ‘상상마당’을 유치해 지역상권 활성화, 일자리 창출, 시민..."
1893,2020.02.20.,"양천구, 골목상권 살리는 '상생휴일' 확대",서울 양천구(구청장 김수영)가 오는 21일부터 '상생휴일'을 주 1회로 확대한다. 구청 구내식당은 다양하고... 그러나 인건비 및 물가 상승에 따른 운영난을 겪고 있는 인근 골목 상권(소상공인∙자영업자)를 위해 월 1회...
1894,2020.02.11.,[전북브리핑] 전북 신종코로나 자가격리자 대거 해제…17명 남아,지역상권 활성화를 위해 지난달 17일 출시한 지역화폐인 '익산다이로움'의 인센티브 10% 적용기간도 2월... 또 서울시 서대문구 220개소의 공공 급식을 통해 16억원의 판매실적을 기록했다. 송방원 전주시 농업기술센터...
1895,2020.02.12.,"스프링온워드, 모바일 커피 플랫폼 ‘원두’ 론칭","소상공인 상권정보시스템에 따르면, 그 동안 카페 시장은 70% 이상이 개인 영세 사업자로 대형 프렌차이즈... 출원, 서울앱비즈니스센터 지원 사업 선정을 잇따라 받으며 7월 정식 법인을 설립했다. 이어, 8월에..."
1896,2020.02.18.,"정부, 코로나19 피해 소상공인 자금 지원···소상공인 ""결국 빚인데 무슨 소...","지난 16~18일 서울 서초구와 종로구, 경기도 시흥과 안산 상권을 취재한 결과 상권 침체로 인한 소상공인의 우려가 커지고 있는 것으로 나타났다. 외국인 관광객이 줄어듦과 동시에 국내 소비자들이 외출을 자제하고..."
1897,2020.02.14.,“소비자 권익 지키는 자유시장경제 파수꾼이죠”,“소비자 이익 보호 위해 경쟁 촉진 필요…사회 구성원 모두가 소비자” 컨슈머워치를 만나기 위해 서울... 일례로 월마트가 미국 전역으로 뻗쳐나갈 때 유통시장을 독점하고 인근 상권을 파괴할 것이라는 우려가...
1898,2020.02.03.,제로페이 신청 절차 간편해져 가맹 신청 증가,"정부, 공공기관, 지자체, 일반 기업 등에서의 제로페이를 통한 업무추진비 결제가 지속적으로 증가할 것으로 예상돼 제로페이 가맹 소상공인을 중심으로 한 지역 상권 활성화도 기대되고 있다. 특히 최근 서울시는 각..."
1899,2020.02.03.,'한집 건너 편의점'…결국 점포당 매출 줄었다,다만 서울을 포함한 수도권 중심으로 골목 상권 곳곳에 점포가 들어섰다는 사실은 부정할 수 없다. 일각에선 지방에 신규 출점이 몰리면서 평균 매출액이 줄고 있다고 분석한다. 수도권 시장이 한계에 몰리자 지방으로...
1900,2020.02.16.,"류경기 중랑구청장, '코로나19'로 침체된 지역 소상공인 사업장 방문 격려","지역상권 살리기에 앞장섰다. ▲ 류경기 중랑구청장(오른쪽) 봉제업체(성림어패럴)방문 현장의견을 청취... 중랑구청지점, 서울신용보증재단 중랑구지점에 자금지원 전담창구를 운영하여 신속히 대응하고 있다...."
1901,2020.02.10.,"찝찝함 안고 출근한 GS홈쇼핑 직원, 텅빈 명동거리…신종 코로나 주말 풍경",9일 서울 영등포구의 GS홈쇼핑 본사. 직원 중 신종 코로나바이러스감염증(우한폐렴) 확진자가 발생한... 롯데백화점 본점이 휴점하자 인근 상권도 타격을 받았다. 명동 거리는 주말이라고는 믿기 어려울 만큼 유동 인구가...
1902,2020.02.13.,인천·부천·김포 코로나19 관리 대상 현황은?,이에 대중국 수출기업의 해외 마케팅 지원금 국비 5억 원과 지역 골목 상권 활성화를 위해 지역사랑상품권... 이는 33.6%인 서울이나 16.7%인 부산보다 월등히 높은 수치입니다. 그만큼 인천의 중국 관광객 의존도가 다른...
1903,2020.02.11.,"우후죽순 창업하지만 카페 폐업률 14%, 치킨집보다 높아","전국 시·군·구 지자체 중 커피집이 가장 많은 곳은 역시 서울 강남구(1739개)였다. 2위는 경남 창원시... 동일 상권 내에서도 장사가 잘되는 매장과 그렇지 않은 매장의 차이가 커 상권과 입지, 수요의 특성 등에 대한..."
1904,2020.02.18.,"코로나19에 '비상경제시국' 선포… ""강력한 지원책 준비""","[서울=뉴시스]박영태 기자 = 문재인 대통령이 18일 오전 청와대 본관에서 열린 국무회의에 참석해 국민의례를... 골목상권, 지역경제 활력을 위해 필요하다면 파격적 수준의 지원 방안을 적극적으로 고려해 주기 바란다""고..."
1905,2020.02.19.,"[단독] 경찰, 文정부 비판시위하던 김현진씨 체포...좌파성향 단체의 일방적인...",19일 서울 종로 일본대사관 앞에서 시위를 하던 김현진씨가 경찰에 강제연행되고 있다./촬영 = 박순종 기자... 김씨는 지난 1월 12일부터 39일째 문재인 정부의 경제 파탄에 항의할 목적으로 퇴락 상권을 순회하며 나 홀로...
1906,2020.02.04.,"상가시장 큰손으로 떠오른 약국... ""과열경쟁 우려""","강서구 화곡역 8개 출구 주변에 10여개의 약국이 모여 소위 약국 상권을 형성하고 있는데, 작년 이 중 3곳이 연달아 폐업 신고를 했다. 조현택 상가정보연구소 연구원은 ""일부 서울 아파트 단지 내 상가의 경우 입점한..."
1907,2020.02.06.,"반도건설, 주요 건설사 마수걸이 단지 분양 잇따라","단지인근에 핵심상권인 백화점, 대형마트, 상남시장, 창원시청, 법원 등이 가깝고 KTX 창원중앙역, 창이대로... 서울지하철 5호선 마천역이 가깝고, 서울외곽순환도로 송파IC와 송파대로, 동부간선도로 등 광역도로..."
1908,2020.02.05.,"양홍규 예비후보 ""월평 화상경마장에 KT&G 상상마당 유치"" 공약","그는 ""연 방문객 180만 명에 이르는 서울 홍대 앞 '상상마당'은 젊음의 상징인 홍대주변 문화예술 랜드마크이자 '작은 퐁피두'로 불린다""고 말했다. 그러면서 ""상상마당을 유치해 지역 상권 활성화, 일자리 창출, 시민..."
1909,2020.02.03.,"한국간편결제진흥원 ""제로페이가맹점 온라인 신청 증가""",지역 상권 활성화도 기대되고 있다. 제로페이 가맹점에서 사용 가능한 모바일 상품권이 늘어남에 따라... 최근 서울시는 각 자치구를 통해 2000억원의 서울사랑상품권을 발행했다. 영등포사랑상품권의 경우 판매 시작...
1910,2020.02.03.,"한국간편결제진흥원 ""제로페이가맹점 온라인 신청 증가""",지역 상권 활성화도 기대되고 있다. 제로페이 가맹점에서 사용 가능한 모바일 상품권이 늘어남에 따라... 최근 서울시는 각 자치구를 통해 2000억원의 서울사랑상품권을 발행했다. 영등포사랑상품권의 경우 판매 시작...
1911,2020.02.13.,청와대가 금요일 점심 때마다 구내식당 문을 닫기로 한 이유,신종 코로나바이러스 감염증(코로나19) 여파로 매출에 타격을 입은 주변 상권을 활성화하자는 취지다.... 문 대통령은 이날 한국의 대표적 전통시장인 서울 남대문시장을 방문해 상인들의 목소리를 청취하기도 했다. 이는...
1912,2020.02.03.,집 나서기 꺼리는 소비자들 ‘방콕 쇼핑’,서울 시내 주요 상권도 마스크나 손세정제를 판매하는 곳을 제외하면 손님들의 발길이 뚝 끊긴 상태다. 지난달 31일 서울 중구 명동 메인대로에 위치한 한 화장품 로드숍은 평소와 달리 화장품 무료 테스팅 코너마저...
1913,2020.02.10.,李·黃 ‘바닥 표심’ 훑기… 총선경쟁 ‘정치1번지’서 조기 점화,"초유의 대권 1·2위 종로 대결 李, 걸어서 이동 상인과 대화 문제해결 ‘일꾼’ 이미지 주력 黃, 성균관대 등 연고지 방문 상권침체 지적 ‘文 실정’ 강조 이정현 “黃에 양보” 출마 철회 21대 국회의원 총선거 서울 종로..."
1914,2020.02.11.,중랑구 ‘신종코로나’ 지역경제 피해 대응 총력,서울 중랑구가 ‘신종코로나바이러스 감염증 사태’로 인한 관내 중소기업과 소상공인의 피해를... 지역 상권을 살리기 위한 각종 긴급 대책을 추진한다는 계획이다. 류경기 중랑구청장은 “신종 코로나바이러스로 인해...
1915,2020.02.04.,분양시장까지 덮친 신종 코로나 공포…다시 드리워진 불황의 그림자,"서울 핵심지와 과천 일대에서도 견본주택 개관을 조심스러워하는 분위기가 감지되고 있다. 서울 강서구... 조현택 상가정보연구소 연구원은 ""직장인들이 밀집한 업무지구 상권을 제외하고 대부분의 지역이 큰 타격을..."
1916,2020.02.05.,역세권은 기본… 특화 설계·입지 갖춘 오피스텔 공급↑,"위치해 서울 전역으로 빠르게 이동할 수 있는 초역세권이다. 또한, 핵심업무지구(CBD)인 종로와 광화문이 인접하고, 대한민국 대표 오피스상권인 종로와 광화문 지역에는 대기업 본사와 공공기관이 밀집해 있다. 단지..."
1917,2020.02.10.,"[박정규의 작살]이재명 대법원 판결, 4·15총선 뒤로 넘어갈까","서울고법에서 드루킹 댓글조작에 관여한 혐의로 재판에 넘겨진 김경수 경남지사의 선고도 예정된... 이 지사는 휘청거리는 경기경제를 바로잡고, 골목상권을 되살려내기위해 고군분투(孤軍奮鬪)중이기 때문이다. fob140..."
1918,2020.02.16.,"규제 벽 높은 주택시장… 투자자, 수익형 부동산 관심 ↑",인근 지역의 배후수요를 활용해 꾸준한 입주와 상권 활성화가 보장되는 만큼 투자자들은 안정적인 수익을... 남해종합건설은 서울 구로구 구로동에서 '구로 오네뜨시티'를 공급 중이다. 단지는 지하 4층~지상 20층...
1919,2020.02.11.,[4·15 총선 나요 나!-안양 동안을]수성이냐 물갈이냐 '민심 초접전',"심 의원은 한국당이 내세우는 '문재인 정부 심판'에 더해 서울과 연동된 개발계획을 이슈로 삼아 지지를... ""농수산물센터와 터미널부지 등을 합해 개발함으로써 안양 동남권의 핵심 상권과 교통의 요지로 성장..."
1920,2020.02.11.,[4·15 총선 나요 나!-안양 동안을]수성이냐 물갈이냐 '민심 초접전',"심 의원은 한국당이 내세우는 '문재인 정부 심판'에 더해 서울과 연동된 개발계획을 이슈로 삼아 지지를... ""농수산물센터와 터미널부지 등을 합해 개발함으로써 안양 동남권의 핵심 상권과 교통의 요지로 성장..."
1921,2020.02.14.,"엘레쎄, '아웃도어프로덕트'와 콜라보...신학기 '가방' 5종 출시","스타필드하남, 서울대학로, 강릉 등 총 8개 오프라인 매장에서 판매되며 엘레쎄 온라인 공식스토어를... 주요 상권에 팝업스토어를 오픈해 브랜드 가치를 높이는데 최선을 다할 것""이라고 말했다...."
1922,2020.02.10.,"성수 용답동, 전통시장 연계형 도시재생사업 시범사업 선정",서울 성동구는 전통시장과 저층주거지를 연계한 새로운 형태의 도시재생 사업인 ‘전통시장 연계형... 전통시장 연계형 도시재생사업은 전통 재래시장이 대형마트 등에 밀려 낙후되는 것을 막기 위해 상권 활성화와 주변...
1923,2020.02.17.,"이병훈 광주 동남을 후보, “창조 혁신 통한 골목상권 부활” 복안 제시","골목상권의 부활을 이뤄야 한다고 문화경제에 대한 복안을 내놨다. 이 예비후보는 보도자료를 내고 “쇠락한... 카페거리와 서울 익선동 한옥거리를, 해외사례로는 중국 상하이의 ‘텐쯔방’을 예로 들었다. 이 후보는 과거..."
1924,2020.02.07.,"원투씨엠, ‘코로나 바이러스’ 분석 추진","및 상권 분석 등에 활용하는 사업을 추진해 왔다. 이번 1차 결과 분석에서는 방한 중국인들이 기존의 단체 관광객의 이용 행태는 급격히 줄어드는 반면, 개인 자유 여행 행태가 늘어나고 있으며, 방문지는 서울..."
1925,2020.02.14.,"조달청, 30억 이상 정부공사계약 조기 발주 지원","구 차관은 이날 정부서울청사에서 2020년도 제3차 재정관리점검회의를 주재하면서 ""경제 충격을 최소화하고... 지역상권의 회복을 뒷받침하기 위해 공무원 맞춤형 복지제도 등을 활용한 온누리 상품권 및 지역사랑상품권..."
1926,2020.02.04.,경북지역 중대형 상가 공실률 지난해 4분기 17.7% 전국최고,"높은 임대료에도 불구, 상권 비활성화로 임차인 수익이 악화된 것이 원인으로 분석된다. 이어 계명대(26.6... 서울(8%), 경기(9.1%), 강원(11.1%), 부산(11.3%)이 뒤를 이었다. 조현택 상가정보연구소 연구원은 ""내수 경기..."
1927,2020.02.10.,"'종로 대첩' 이낙연·황교안, 앞다퉈 민생 행보…치열한 유세 경쟁",뉴스토마토 = 조현정 기자 | 더불어민주당 후보로 서울 종로 출마를 선언한 이낙연 전 국무총리와 자유한국당... 공실 상가를 첫 방문지로 택한 것은 경기 침체로 어려움을 겪는 삼청동·혜화동·종로 3가 등 종로의 상권을...
1928,2020.02.13.,"[로컬거버넌스] 중랑구, 우한폐렴 피해 최소화 대책 총력전",(사진제공=중랑구청) 서울 중랑구(구청장 류경기)가 신종 코로나바이라스 감염증(이하 신종코로나) 확산에... 지역 상권을 살리기 위한 각종 긴급 시책을 지속적으로 추진할 예정이다. ■ 자가격리 대상 가구 모니터링...
1929,2020.02.10.,[삼척]11개 방역반 가동·경기위축 차단 역점,"그는 지난달 22일 서울에서 강릉까지 KTX를 타고 이동하면서 강릉을 다녀간 12·14번 신종 코로나 확진자... 지역 상권 이용에 솔선수범하도록 했다. 또 삼척사랑상품권 사용 촉진을 위한 경품권 행사, 군장병 할인업소 안내..."
1930,2020.02.10.,"[신종코로나] ""초콜릿 사먹겠나""… '밸런타인데이 특수' 실종",“집 밖에 나오는 사람이 없으니 초콜릿을 사먹겠어요?” 지난 7일 서울 마포구 홍대 인근의 한 편의점주는... 오피스 상권 매출을 기대해봐야 할 것 같다”고 귀띔했다. 이 같은 상황을 감안해 배달 서비스를 강화한 곳도...
1931,2020.02.06.,"주요 건설사, 푸르지오-자이-반도유보라 등 마수걸이 분양 잇따라","단지인근에 핵심상권인 백화점, 대형마트, 상남시장, 창원시청, 법원 등이 가깝고 KTX 창원중앙역, 창이대로... 서울지하철 5호선 마천역이 가깝고, 서울외곽순환도로 송파IC와 송파대로, 동부간선도로 등 광역도로..."
1932,2020.02.19.,"성동구, 성수 지속가능발전구역 '임대료 인상률' 하락 안정화","임대료 인상률을 구역별로 살펴보면 서울숲길 4.00%, 방송대길 2.31%, 상원길 1.45%로, 이는 성수동 일대가 최근 서울에서 가장 주목받는 상권 중 하나로 임대료가 치솟는 지역이라는 점을 고려할 때 놀라운 결과다. 특히..."
1933,2020.02.17.,양주옥정신도시의 첫 브랜드 오피스텔 '양주옥정신도시 THE M CITY 엘리움','양주옥정신도시 THE M CITY 엘리움'은 양주옥정 중심상권 내 첫 브랜드 소형 오피스텔로서 지하 4층... 2km의 거리를 개통할 예정으로 양주에서 서울까지의 교통 선택의 폭이 넓어졌다. '양주옥정신도시 THE M CITY 엘리움...
1934,2020.02.05.,"서구을 양홍규, 화상경마장 이전 등 1호 공약 발표","양홍규 후보는 ""연 방문객 180만명에 이르는 서울 홍대 앞 `상상마당' 은 젊음의 상징인 문화예술 랜드마크"" 라면서, ""상상마당을 유치해 지역상권 활성화, 일자리 창출, 시민 문화예술 수준 향상 등의 일석 삼조 효과를..."
1935,2020.02.07.,만지고 느끼고…공간 체험의 힘 | 오프라인 유통 매장의 반격,지난해 10월 서울 성수동에 문을 연 아모레성수는 화장품 대신 ‘경험’을 파는 100% 체험형 뷰티 라운지... 쇼룸이 생기면 온오프라인 상관없이 해당 상권의 최초 구매자가 7% 이상 증가했다. 온라인 채널의 신규 구매자...
1936,2020.02.10.,사스ㆍ메르스 충격 합친 듯… 수출ㆍ내수 ‘코로나發 복합 몸살’,서울 성신여대 인근의 한 개업 식당 사장은 “확진자가 다녀갔다는 소문에 행인조차 사라졌다. 2월 1일로... 명동 지역 한 상인은 “롯데백화점과 면세점이 영업을 중지하면서 사실상 명동도 죽은 상권이 됐다”고...
1937,2020.02.11.,아침논단…‘공포 바이러스’가 더 위험하다,대구에서는 꽤나 알려진 신흥 상권인데다 가장 핫한 저녁시간대임에도 불구하고 한두 테이블을 제외하고는... 대한예방의학회·한국역학회 신종코로나바이러스감염증 대책위원회가 10일 서울의대 기초연구동에서...
1938,2020.02.06.,"신림동 랜드마크 쇼핑몰 ‘포도몰’, 이달 새주인 찾기 돌입","특히 DWS가 2017년부터 대대적인 MD(관리·운영) 개선 작업을 벌이면서 방문객 수요 맞춤형 임차인을 구성해 서울 서남부권역 대표 상권인 신림역의 랜드마크로 자리잡았다. 건물 상층부에 영화관(롯데씨네마), 대형 서점..."
1939,2020.02.15.,"이병훈 광주 동구남구을 예비후보, 창조적 혁신을 통한 골목상권 부활 복안 제...","골목상권의 부활을 이뤄야 한다고 문화경제에 대한 그의 복안을 내놨다.사진은 이병훈 더불어민주당 광주... 카페거리와 서울 익선동 한옥거리를, 해외사례로는 중국 상하이의 '텐쯔방'을 예로 들었다. 이병훈 더불어민주당..."
1940,2020.02.16.,"과도한 공포·우려, 지역경제 '악영향'","서울 강남 집값 트라우마에 대해 실체도 모호한 '투기'라는 허수아비를 세워놓고 때리는 배경이다. '내가... 여기에 대기업들이 자본력을 앞세워 외식업 등 골목상권에 무차별하게 침투, 시장을 잠식해 나가며 자영업자의..."
1941,2020.02.10.,[르포] 동반휴업에 百 인근상권 '마비'…소비자 공포심만 자극,"하루빨리 상황이 나아졌으면 좋겠습니다."" 10일 오후 서울 신촌 현대백화점 인근 음식점에서 만난 점주 A 씨(45... 인근 상권에까지 악영향을 끼치는 모습이다. 이에 업계와 학계는 단발적 휴점은 방역에 큰 도움이 되지..."
1942,2020.02.03.,"안산시, 신종코로나 경제 위축 우려 대처…소상공인·기업 지원대책 추진",(제공=안산시청) [안산=스포츠서울 신영철 기자] 신종 코로나바이러스 감염증 확산으로 국내 경제 위축이... 12개 상권(전통시장 7·상점가 5)에 손세정제와 보건용 마스크를 배부한다. 시장 상인회와 협력해 자체방역 확대...
1943,2020.02.18.,소자본 배달창업 아이템 '싸움의고수'...반포삼호가든점 등 9개 가맹점 오픈 ...,"상권 분석을 비롯해 아이템 선정, 마케팅, 오픈 준비 이외에도 신경 쓰고 준비해야 할 일들이 한두 가지가... 브랜드 측에 따르면 대다수의 가맹점들이 10평대의 소규모 평수이며 서울 관악구에 위치한 한 매장의 경우..."
1944,2020.02.06.,"원투씨엠, 한-중 연계 O2O 빅데이터로 ‘코로나바이러스’ 분석 추진","및 상권 분석 등에 활용하는 사업을 추진해 왔다. 이번 1차 결과 분석에서는 방한 중국인들이 기존의 단체 관광객의 이용 행태는 급격히 줄어드는 반면, 개인 자유 여행 행태가 늘어나고 있으며, 방문지는 서울..."
1945,2020.02.06.,소프트테니스 꿈나무선수단 순창서 '구슬땀',"전지훈련팀 유치는 지역에서 머물며 숙식을 해결하기 때문에 지역 상권 활성화에도 큰 도움이 된다는... 한편 지난 2일부터 30일간 서울시청 소프트테니스팀이 전지훈련중에 있으며, 고등부 소프트테니스팀도 전지훈련..."
1946,2020.02.05.,"양홍규 ""월평동 화상경마장에 KT&G '상상마당' 유치""","그는 ""연 방문객 180만 명에 이르는 서울 홍대 앞 '상상마당'은 젊음의 상징인 홍대 주변 문화예술 랜드마크이자 '작은 퐁피두'로 불린다""면서 ""상상마당을 유치해 지역상권 활성화, 일자리 창출, 시민 문화예술 수준..."
1947,2020.02.17.,"밀레니얼·X세대·58년 개띠 모두 '핫플'…코오롱FnC, '을지다락' 오픈",코오롱인더스트리FnC부문(이하코오롱FnC)이 14일 서울 을지로에 멀티 플래그십 스토어 '을지다락'을... 간판도 주변 분위기에 맞게 무채색으로 디자인하여 상권과 어우러지도록 했다. 내부 인테리어와 집기 또한 오래된...
1948,2020.02.03.,"방송으로 식사 시간 알리고 도시락 방문 앞에, 운동·빨래 등 방에서… 폐기물...",국가공무원인재개발원과 경찰인재개발원에 근무 중인 정부합동지원단 관계자들은 2일 서울신문과의... 지역상권에 조금이라도 보탬이 됐으면 하는 바람”이라고 설명했다. ●방마다 TV·인터넷… 정신과 전문의 등 배치...
1949,2020.02.14.,"""부동산시장 위축, 코로나19보다 12·16대책 영향 커""","최근 서울 지역 고가주택과 재건축 중심으로 호가가 떨어지며 가격 상승세가 크게 둔화됐으며 강남3구는... 보인다""면서도 ""다만 상권(상가) 시장은 현재 국면이 예상보다 길어질 경우 관광객 감소로 인한 매출 타격과..."
1950,2020.02.14.,용산공원 확장 등 호재 품은 이태원 럭셔리 주거시설 '어반메시',최근 용산공원 조성 사업 추진이 빠르게 진행됨에 따라 서울 용산구 일대에서 분양하는 매물에 관심이... 어반메시가 위치한 이태원동은 유명한 상권을 안고 있는 데다 평균 10년 이상 노후된 주거 건물이 많아 신규 분양...
1951,2020.02.09.,우한 교민 품은 아산 SNS 중심 응원 릴레이 이어져,"및 서울명성교회) 등을 전달했다. 아산시도 동참하고 있다. 시는 낮선 임시생활의 평온함 속에 심리적... 지역 상권을 이용하도록 독려하고 있다. 시 관계자는 ""신종 코로나바이러스 감염증 여파로 어려움을 겪고 있는..."
1952,2020.02.03.,"가평군, 제2경춘국도 군 노선(안) 관철 '발 빠른 행보'","이는 제2경춘국도 노선이 국토부안으로 최종 결정될 경우, 46번 경춘국도를 따라 형성된 기존 상권이... 9km 4차로 간선도로를 구축하는 사업으로모두 국고로 지어지며 서울과 춘천을 연결하는 광역교통망 구축이 목적이다...."
1953,2020.02.14.,수많은 박새로이들이 사랑에 빠진 '진짜 이태원'의 클라쓰 [김지나의 문화로 ...,"서울 안에서만도 핫한 상권들이 넘쳐 나지만, 어떤 이유에서인지 주인공은 이태원의 매력에 한눈에 반했다. 2000년대까지만 해도 이태원은 한국에서 경험하기 어려운 외국 음식, 외국 문화를 접할 수 있는 '한국 속의 외국..."
