,date,title,contents
543,2020.01.24.,"'다큐멘터리 3일' 문래동 철강골목, 철과 예술 '공존'의 비밀","형성한 서울특별시 영등포구 문래동 철강 골목. 평생 뜨거운 불꽃을 피워내며 철과 함께 살아온 철강... 거기에 더해 예술가들이 둥지를 틀고, 사람들을 따라 새로운 상권이 형성되고 있다. 문래동 사람들이 이 '공존'을..."
544,2020.01.22.,"성동구 사근동, ‘마을호텔 특화도시’로",서울 성동구에 저층 주택밀집지 사근동이 도시재생을 거쳐 ‘마을호텔 특화도시’로 조성된다. 성동구... 정원오 구청장은 “사근동이 재생사업으로 관광객에겐 개성 있는 숙박시설을 제공하고 주변 상권을...
545,2020.01.21.,"한샘 강승수 회장, 7년 내 매출 10조 달성 선언 ""글로벌 도전기반 다질 것""","강승수 한샘 회장이 21일 서울 마포구 한샘 사옥에서 기자간담회를 열고 중장기 사업구상에 대해 설명하고... 한샘은 리하우스 사업본부를 전국 50개 상권으로 확대하고, 모든 공정을 책임지는 리하우스 디자이너(RD)도..."
546,2020.01.29.,"[분양 하이라이트] 여의도 해링턴 타워 196, 임차수요 풍부 영등포 新중심",임차 수요가 풍부한 데다 최근 상권이 역세권과 중심상권으로 재편되는 가운데 시세가 오를 가능성도 커졌기 때문이다. 정부의 부동산 규제로 지방은 물론 서울 아파트 시장까지 냉각기에 접어드는 분위기지만...
547,2020.01.23.,"[오늘의 유통가] 오비맥주 카스, '2020 대한민국 브랜드 명예의전당' 맥주 1위...",백화점 이용고객의 불편함을 최소화 할 수 있도록 상권 특성을 반영해 점포별로 설 전날과 당일 또는 설... 1층 전시공간에서 열리는 이번 '프린트 베이커리' 팝업 스토어 행사는 국내 최대 미술품 경매회사인 서울옥...
548,2020.01.24.,설 연휴 백화점·대형마트 휴무일은 언제?,"서울 지역 롯데슈퍼는 26일에 송파점, 잠실3동점, G은평점, 범서점을 빼고는 모두 문을 닫는다.... 현대백화점도 점포별로 상권 특성을 반영해 이틀씩 휴무에 들어간다. 무역센터점과 킨텍스점, 판교점, 대구점, 울산점..."
549,2020.01.22.,"이해찬 “임종석, 모시려고 한다…정당 속에서 함께 했으면”","곽 변호사는 충북 보은·옥천·영동·괴산, 강 전 부시장은 서울 용산, 박 전 편집장은 충북 증평·진천·음성에 각각 출마할 예정이다. 한편 민주당은 이날 온누리상품권과 지역사랑상품권 등 골목상권 전용 화폐 발행을..."
550,2020.01.24.,"'다큐멘터리 3일' 문래동 철강 골목 72시간, 철과 함께 그리는 미래","형성한 서울특별시 영등포구 문래동 철강 골목. 평생 뜨거운 불꽃을 피워내며, 철과 함께 살아온 철강... 거기에 더해 예술가들이 둥지를 틀고, 사람들을 따라 새로운 상권이 형성되고 있다. 문래동 사람들이 이..."
551,2020.01.24.,설 연휴 백화점·대형마트 휴무일은 언제?,"서울 지역 롯데슈퍼는 26일에 송파점, 잠실3동점, G은평점, 범서점을 빼고는 모두 문을 닫는다.... 현대백화점도 점포별로 상권 특성을 반영해 이틀씩 휴무에 들어간다. 무역센터점과 킨텍스점, 판교점, 대구점, 울산점..."
552,2020.01.22.,"이해찬 “임종석, 모시려고 한다…정당 속에서 함께 했으면”","곽 변호사는 충북 보은·옥천·영동·괴산, 강 전 부시장은 서울 용산, 박 전 편집장은 충북 증평·진천·음성에 각각 출마할 예정이다. 한편 민주당은 이날 온누리상품권과 지역사랑상품권 등 골목상권 전용 화폐 발행을..."
553,2020.01.29.,[기고 칼럼] 유망 상권이 되려면 SNS를 잡아라,SNS를 통해 유명해진 대표적인 상권은 3곳이다. 첫 번째는 서울 중구에 위치한 '을지로 2가 상권'이다. 을지로 2가 상권은 시대가 변함에 따라 어느새 낡은 인쇄소 건물만이 남겨졌었다. 하지만 이러한 낡은 상권에 젊은...
554,2020.01.20.,달콤커피 로봇카페 '비트2E' 이마트 청계천점 입점,제공| 다날[스포츠서울 동효정 기자] 로봇카페 ‘비트’가 이마트에 2020년 첫 신규 매장을 오픈하고 본격적인 로드 상권 입점 확대에 나선다. 다날의 프랜차이즈 커피 전문 브랜드 달콤커피는 서울 중구 황학동...
555,2020.01.23.,"""팍팍해도 밝게 살아야죠""","서울 잠실에서 프랜차이즈 편의점을 운영하는 봉달호 씨는 손님이 없는 시간을 쪼개 에세이 ‘매일 갑니다, 편의점’을 썼다. 점주의 시각으로 동네 상권과 유흥가, 오피스 상권 편의점의 장단점, 특가 세일 진행 과정 등..."
556,2020.01.28.,"한국중부발전, 文정부 핵심과제 '양질의 일자리 창출'에 앞장","더 나아가 발전소가 위치한 지역의 전문기관인 제주여성인력개발센터, 서울중부여성발전센터와... 골목상권에 활력을 주기 위한 여러 가지 마케팅 전략을 펼쳐나갈 예정이다. 중부발전은 이번 프로젝트를 통해 일자리..."
557,2020.01.30.,[추니박과 함께 걷는 그림여행⑥]여행의 깊이를 깨닫게 해준 따뜻한 남쪽 고향...,"육지와의 왕래가 쉬워진 만큼 남해의 상권도 많이 없어진 상황이라 남해의 구석구석에 있던 작은 가게나... 그는 2010년 중앙일보 주최 평론가가 뽑은 3040작가 10인에 선정되기도 하였고 국립현대미술관, 서울시립미술관 등..."
558,2020.01.29.,'미사 뉴욕프라자' 상가 분양 중…병의원·할리스커피 입점 확정,"항아리 상권에 위치해 있다. 오는 4월 5호선 미사역 개통과 9호선 연장계획 확정으로 주변가치 상승효과와 더불어 올림픽대로, 서울외곽순환도로, 서울양양고속도로, 중부고속도로 등 서울 강남권으로의 접근성이..."
559,2020.01.22.,"與, 총선 3호 공약 ‘소상공인·자영업자 대책’","민주당은 구체적으로 온누리상품권과 지역사랑상품권 등 골목상권 전용화폐를 오는 2024년까지 현행 5조... 관련 예산은 이미 올해 예산안에 일부분 반영됐고, 이후에도 전액 국비로 편성될 예정이다. 서울= 김현수"
560,2020.01.22.,"與, 총선 3호 공약 ‘소상공인·자영업자 대책’","민주당은 구체적으로 온누리상품권과 지역사랑상품권 등 골목상권 전용화폐를 오는 2024년까지 현행 5조... 관련 예산은 이미 올해 예산안에 일부분 반영됐고, 이후에도 전액 국비로 편성될 예정이다. 서울= 김현수"
561,2020.01.22.,스타벅스 옆 블루보틀…광화문 커피 대전,커피계의 '애플' 블루보틀 커피가 서울 광화문에 진출한다. 대한민국 커피의 최대 격전지에서 스타벅스커피... 과거 이 구역에서는 SPC 그룹의 커피앳웍스가 단독매장을 열었다 임대료 부담과 치열한 상권 경쟁에 밀려...
562,2020.01.21.,금융정보 사고팔 수 있는 `데이터 거래소` 3월 개장,금융위원회는 21일 서울 여의도 금융보안원에서 '금융 분야 데이터 유통 생태계 구축 협의회' 첫 회의를 열고... 공공기관이 가진 지역별 유동인구 정보와 카드 매출 정보를 결합해 상권 분석 서비스를 제공할 수도 있다....
563,2020.01.20.,"[현장르포] '잔치 분위기' 호매실, 수원 영통만큼 오를까","서울 중심지에서 지하철로 1시간10분, 또 버스로 30분을 더 타야한다. 신분당선 광교~호매실 노선이 예비타당성조사(예타)를 통과했으니 2023년까지 힘들어도 버텨보려고 한다.""(호매실 가온마을3단지 거주자) ""학군과 상권..."
564,2020.01.30.,[현장르포]신종 코로나바이러스에 북적대던 명동길 썰렁,"""있던 중국 관광객도 이제 다 나갔어요"" 30일 오전 9시, 서울 중구 소공동에 위치한 롯데백화점 본점 앞... 백화점을 벗어난 명동 길거리 상권에도 불똥은 튀었다. 이 지역은 화장품·의류 등을 파는 점포와 오후부터..."
565,2020.01.24.,설 연휴 백화점·마트 하루나 이틀 휴무…대형 쇼핑몰 정상 영업,"서울 지역 롯데슈퍼는 26일에 송파점, 잠실3동점, G은평점, 범서점을 제외하고 모두 문을 닫는다.... 현대백화점도 점포별로 상권 특성을 반영해 이틀씩 휴무에 들어간다. 무역센터점과 킨텍스점, 판교점, 대구점..."
566,2020.01.19.,"신격호 회장의 뚝심 어록 ""언제까지 고궁만 보여주나""","이를 통해 서울올림픽이라는 국제적인 행사를 성공적으로 치루는 데에 일조했다는 평가를 받았다. 지난... 지금은 허허벌판이지만 오픈을 하고 1년만 지나면 교통 체증이 생길 정도로 상권이 발달할거야""라며 독려하기도..."
567,2020.01.20.,달콤커피 로봇카페 '비트2E'. 이마트 청계천점 입점,"↓ 다날의 프랜차이즈 커피 전문 브랜드 달콤커피가 서울 중구 황학동 이마트 청계천점에 로봇카페 비트(b;... 다양한 상권 입점을 통해 누구나 손쉽게 로봇카페 서비스를 경험할 수 있도록 할 예정이다""고 말했다. 한편..."
568,2020.01.22.,"한샘 강승수 신임 회장 ""디지털 진출로 미래 기업으로 성장""","지난달 취임한 강 회장은 서울 한샘 상암 사옥에서 첫 기자 간담회를 열고 한샘의 지난 50년은 국내 홈... 사업본부를 전국 50개 상권으로 확대하고, 리하우스 디자이너도 2천500명까지 육성하겠다고 덧붙였습니다. 박소정"
569,2020.01.21.,"""문 열고 난방영업 STOP""…설 앞두고 단속반 떴다",""" 20일 서울 마포구 홍대입구역 9번출구 근처. 산업통상자원부와 한국에너지공단, 마포구청이 합동으로... 에너지공단은 2012년부터 매년 여름과 겨울 전국 18개 주요 상권의 냉난방 영업 행위를 계도ㆍ점검하고 있다...."
570,2020.01.28.,[EE칼럼] 올해 수익형부동산 꼼꼼한 투자전략 필요,"신규로 분양하는 상가의 경우 상권의 안정화까지 많은 시간이 필요하고, 고분양가 논란에서도 자유롭지... 이는 경기불황에 따른 공실증가가 임대료 하락으로 이어졌고, 특히 서울, 경기, 인천 등 수도권의 경우 최근..."
571,2020.01.25.,이마트 장보며 ‘로봇 바리스타’ 커피 마신다,"로드 상권 입점 확대에 나선다. 다날의 커피 전문 브랜드 달콤커피는 서울 중구 황학동 이마트 청계천점에 로봇카페 비트(b;eat) 60호점을 오픈했다. 해당 매장은 기존 동탄점과 연수점, 킨텍스점, 동탄카림애비뉴점에..."
572,2020.01.15.,독립문로에서 경기대로 걷기좋은 길로…2년후 완공,"특히 서대문구는 이 도로를 '과거, 현재, 미래'를 상징하는 테마거리로 디자인하고, 사업 구간 내 서울미래유산인 석교감리교회와 영천시장 등을 활용해 아카이브 자료를 전시하는 등 상권 활성화를 위해 다양하게 노력할..."
573,2020.01.21.,`데이터거래소` 3월 시범운영 … 분석 플랫폼 형태 판매방식 지원,금융위원회는 21일 오전 서울 여의도 금융보안원에서 '금융 분야 데이터 유통 생태계 구축 협의회'의 첫... 데이터 거래소가 문을 열면 암호화된 공공정보를 카드매출 정보와 결합해 상권분석 서비스를 개발·제공하는...
574,2020.01.31.,"요즘뜨는1인소자본창업아이템 '플랜에이 스터디카페', 폐점률 0%, 재계약률 1...","최근에는 스포츠서울 주관 '소비자 선호도 1위 브랜드 대상' 수상에 이어 한국경제 비즈니스 주관 '2019... 창업 시 주 이용자의 특성과 상권 등을 고려해 플랜에이 스터디카페, 플랜에이 독서실, 플렌에이 스터디센터 등..."
575,2020.01.19.,"최태원 ""살고싶음 공헌해라""… 新기업 트렌드 된 '사회가치경영'",""" 지난달 3일 서울 대치동 포스코센터의 행사장을 찾은 최 회장은 ‘기술 혁신 시대 기업시민의 역할’을... 신한은행도 지난해 ‘성공 지원센터’를 열고 자영업자와 창업 준비생들에게 금융·경영·상권·창업 관련..."
576,2020.01.26.,"bhc치킨, 주요 상권에 직영점 오픈으로 소비자 접점지역 확대",치킨 프랜차이즈 bhc치킨이 서울 및 수도권 핵심 상권에 직영점을 연이어 내고 고객과의 스킨십 강화한다고 밝혔다.  bhc치킨은 지난해 8월과 11월에 각각 종로점과 홍대서교점을 열었다. 이어 올해 들어 첫 직영점인...
577,2020.01.20.,丁총리 첫 민생 현장으로 전통시장 간 까닭,경제 활성화 다짐… 온라인 판매 등 권유 정세균 국무총리는 설 연휴를 앞두고 지난 18일 서울 중랑구... 그는 이어 주차장 등 현대화된 시장 시설을 언급하고 “전통시장의 시설을 잘 만들어 놓으면 자연히 상권이...
578,2020.01.21.,"데이터 거래소 3월 개장…""금융정보 거래·유통 가능""",금융위원회는 21일 서울 여의도 금융보안원에서 ‘금융 분야 데이터 유통 생태계 구축 협의회’의 첫 회의를... 거래소를 이용하면 공공기관의 지역별 유동인구 정보와 카드 매출 정보를 결합해 상권분석 서비스를 개발할...
579,2020.01.19.,맨손으로 재계 5위 롯데 일군 신격호 명예회장의 경영 철학,제공| 롯데그룹[스포츠서울 동효정 기자] 19일 롯데그룹 창업주 신격호 명예회장이 99세의 나이로 별세했다.... ◇상권은 주어지기만 하는 것이 아니다. 좋은 제품과 좋은 서비스로 만들어 나가야 한다. 롯데백화점 잠실점...
580,2020.01.19.,맨손으로 재계 5위 롯데 일군 신격호 명예회장의 경영 철학,제공| 롯데그룹[스포츠서울 동효정 기자] 19일 롯데그룹 창업주 신격호 명예회장이 99세의 나이로 별세했다.... ◇상권은 주어지기만 하는 것이 아니다. 좋은 제품과 좋은 서비스로 만들어 나가야 한다. 롯데백화점 잠실점...
581,2020.01.30.,도심 속 파고든다 단독주택 '운정신도시 라피아노' 402가구 분양,"교통, 교육, 상권, 자연 등 주거 편의성을 높여주는 환경일수록 선호도가 높게 나타나기도 한다. 이 같은... 해당 단지가 들어서는 운정신도시는 GTX A노선의 최대 수혜지로, 개통하면 서울 도심권의 업무지구까지..."
582,2020.01.20.,"명동, 세계 10대 쇼핑거리 중 임대료 나홀로 ‘하락’",- 연간 임대료는 전년 대비 1.5% 하락 - 임대가격지수 하락추세·공실률 늘어 서울 명동 거리 모습.(사진=상가정보연구소)[이데일리 박민 기자] 전 세계에서 임대료가 가장 비싼 10대 상권 중 지난해 서울 명동만...
583,2020.01.16.,미세먼지 계절제 시행 한달…14곳 행정처분·41건 과태료,서울 강남과 부산 서면 등 전국 18개 주요 상권 2902개 업소에 대해선 문을 열어둔 채 난방을 틀고 영업(개문난방)하지 않도록 계도를 실시하고 있다. 정부에 따르면 지난해 12월 공공기관 실내온도 유지 미이행률은 5.3...
584,2020.01.18.,"정 총리, 전통시장 찾아 설 물가 점검 ""경제 활성화 최선""","정세균 국무총리는 오늘 취임 후 첫 현장 방문으로 서울 중랑구의 우림골목시장을 찾아 설 명절 물가를... 만들어놓으면 상권이 살아난다""며 ""재래시장이 잘 안 된다고 방치하지 말고, 시장을 잘 만들어서 장사가 잘되도록..."
585,2020.01.22.,"창업 뛰어든 청춘, 빗자루로 30억 쓸었다",좋은 상권에서 고급 미용 장비를 나눠 쓰는 공유 미용실까지 등장했다. 최근 서울 강남역에 688㎡(약 208평) 규모 공유 미용실 팔레트에이치가 문을 열었다. 강남에서 200평 미용실을 창업하려면 최소 6억원이 필요하고...
586,2020.01.21.,강승수 한샘 회장 “7년내 매출 10조 달성”,전용매장을 구축해 전국 50개 상권으로 확대한다는 계획입니다.  [인터뷰] 강승수/한샘 회장 “7년이라면... 시장에서 입지를 공고히 할 수 있을지 주목됩니다. /서울경제TV 김혜영입니다. [영상편집 이한얼/영상취재 김서진]
587,2020.01.21.,[7문 7답] 빅데이터로 ‘핫’한 소비 트렌드 읽기,"BC카드 빅데이터센터는 서울부터 제주까지 고르게 분포하는 회원들을 기반으로 서울과 수도권뿐만 아니라 지역 특화 분석에도 강점을 가지고 있다. 또한 금융, 지자체, 정부 기관, 유통, 관광?축제, 상권, 맛집, 부동산..."
588,2020.01.28.,"강풀만화거리, 주민이 직접 꾸민‘걷고 싶은 문화거리’로",이곳이 지난해 서울시 2020 경관 개선사업 대상지로 확정되면서 올해 1월부터 사업이 본격 시작돼 2021년... 골목상권도 활성화 됐다. 구는 이러한 변화를 지속적으로 유지하고 강풀만화거리 브랜드 가치를 한 단계...
589,2020.01.22.,"민주당, 설 민심 공략 소상공인·자영업자 총선 공약 발표","민주당, 설 민심 공략 소상공인ㆍ자영업자 총선 공약 발표 골목상권 상품권 2배로ㆍ보증규모 연... 자생력 기반 강화는 물론, 내수 경제 전반에 새로운 성장 동력 또한 창출될 것이라 전망된다""고 밝혔다. 서울"
590,2020.01.28.,[한눈에 보는 전국 이슈] 1월 28일 전국 주요신문 1면 뉴스 요약,"골목상권 활성화 지역상품권 1872억 발행 진주 축제 새로운 활로 모색 나선다 경남도 '신종코로나' 24시간... 대응 ▲ 서울신문 ""부동산이 계급"" 90% 육박… 좌절하는 2030 무증상 입국자에 또 뚫렸다… 文대통령 ""우한 입국자..."
591,2020.01.20.,"까사미아, 부산 `롯데광복점` 오픈…새해에도 매장 출점 속도 낸다",리빙 상권이 형성될 것으로 예상된다. 여기에 부산 서부상권의 랜드마크로 자리 잡은 롯데백화점 광복점의... 서울 수도권 외에도 잠재적인 홈퍼니싱 수요가 예상되는 전국 주요 도시 출점에 속도를 내 연내 20여 개의 신규...
592,2020.01.29.,돈까스창업 미스터빠삭 SBS 파워FM ‘김창열의 올드스쿨’에 식사이용권 협찬,"현재 서대문구 독립문점, 삼척점, 영등포 신길점, 당산점, 을지트윈타원점, 광명역사점, 서울화곡점... 아파트상권 등 B급지에도 적합 ▲불황에도 버티는 수익구조 ▲원팩 조리 시스템 ▲감성을 자극하는 카페형..."
593,2020.01.28.,"강동구, 강풀만화거리 주민이 직접 꾸민다",서울 강동구가 강풀만화거리를 걷고 싶은 문화거리로 만들기 위한 경관개선사업을 본격 시작한다.... 골목상권도 활성화 됐다. 구는 이러한 변화를 지속적으로 유지하고 강풀만화거리 브랜드 가치를 한 단계...
594,2020.01.25.,불확실성 클수록 대단지…올해 수도권 1000가구 이상 59곳 분양,"인천(18곳, 3만9562가구), 서울(12곳, 3만5883가구)이 뒤를 이었다. 1000가구 이상 대단지는 지난해... 지역 내 대단지가 들어서게 되면 이를 중심으로 상권과 교통망이 형성되고, 랜드마크로 자리잡게 된다. 1000가구 이상..."
595,2020.01.25.,"""700만 표심 잡아라""...총선 이슈 중심에 선 소상공인","◆與 ""2024년까지 골목상권상품권 10.5조"" = 여당인 더불어민주당은 설 명절을 앞둔 지난 22일 4·15 총선... 소상공인·자영업자를 중심으로 한 '소상공인당'은 경기도당에 이어 서울시당을 창당하는 등 창당 작업을 진행..."
596,2020.01.21.,"bhc치킨, 연이은 직영점 오픈으로 고객과의 스킨십 강화",치킨 프랜차이즈 bhc치킨이 서울 및 수도권 핵심 상권에 직영점을 연이어 내고 고객과의 스킨십 강화에 나서고 있어 화제다.bhc치킨은 지난해 8월과 11월에 각각 종로점과 홍대서교점을 열었다. 이어 올해 들어 첫 직영점인...
597,2020.01.31.,역대 최저 금리에 '똘똘한 상가' 포레나 루원시티 인기,특히 중심상업지구에 위치하는데다 서울지하철 7호선 청라 연장선이 개통되면 강남권을 비롯해 수도권 대부분 지역 접근성이 크게 향상돼 상권 확대와 활성화를 견인할 것으로 전망된다. 한화건설의 새로운 브랜드...
598,2020.01.17.,이효리 '58억 한남동 빌딩' 샀다…이상순과 '공동명의'로 절세,"[임대수익률 3.47%…""절세 고려해 부부 공동명의로 등기""] 가수 이효리가 작년 10월 서울 용산구 한남동에... 빌딩이 위치한 한남동 일대는 2010년대 초반부터 고급 상권이 형성됐다. 한강진역에서 이태원역..."
599,2020.01.19.,화려한 전성기에서 쓸쓸한 퇴장까지…신격호 어록,"신년사) ▲ ""상권은 만들 수도 있는 것"" (2010년 7월 14일 이철우 롯데백화점 대표가 공개한 어록. 롯데백화점... 변호사가 서울가정법원에서 열린 '성년후견 개시 심판 청구' 첫 심리에 출석한 뒤 취재진에 공개한 내용)..."
600,2020.01.21.,"bhc치킨, 종로·홍대·부천 등 직영점 오픈… 핵심 상권 확대",뉴데일리 임소현 기자 = 치킨 프랜차이즈 bhc치킨이 서울 및 수도권 핵심 상권에 직영점을 연이어 내고 고객과의 스킨십 강화에 나서고 있다. bhc치킨은 지난해 8월과 11월에 각각 종로점과 홍대서교점을 열었다. 이어 올해...
601,2020.01.20.,"젠트리피케이션, 주거 지역에 어떤 영향 미쳤나","서울의 젠트리피케이션 발생 지역들을 보면, 연남동, 해방촌과 같이 기존의 상권과 인접한 주택지역에 분위기 좋은 카페, 음식점이 들어서면서 급격한 변화를 경험하고 있는 경우들을 심심찮게 볼 수 있다. 그렇다면 과연..."
602,2020.01.27.,소비자 아닌 민주노총 이익 대변하는 한상총련,"지난 21일 전국민주노동조합총연맹 서비스연맹·마트산업노동조합과 함께 서울 서초구 서초3동... 이동주 한상총련 상임부회장은 ""명절에 대형마트 법정 의무휴업일 변경을 시도하는 것은 노동자와 골목 상권의 생존권을..."
603,2020.01.20.,"인공지능 적용 로봇카페 ‘비트 2E’, 대형마트 첫 입점",eat)’가 서울 중구 이마트 청계천점에 60호점을 열었다고 20일 밝혔다. 해당 매장은 기존 경기 동탄점과... 있게 됐다”며 “다양한 상권 입점을 통해 누구나 손쉽게 로봇카페 서비스를 경험할 수 있게 하겠다”고 말했다.
604,2020.01.22.,"민주당, 21대 총선 소상공인 관련 민생 공약 발표","확충 ◁상권 르네상스 프로젝트 확대 및 시군구 특화거리 신규 조성 ◁소상공인 컨설팅 강화 및 성공모델... 공약을 발표할 예정이며, 설 명절 이후 청년층을 대상으로 한 핵심 공약을  발표할 것으로 전망된다. 서울 ="
605,2020.01.22.,"민주당, 이낙연 앞세워 제1당 목표...야당 심판론 강조",이낙연 전 총리가 예상대로 서울 종로에 출마하고 이해찬 대표와 함께 민주당 선거를 이끌 것으로 보입니다.... 골목상권 전용화폐 발행 규모를 10조 5천억 원으로 현재보다 2배가량 늘리겠다는 등의 소상공인 공약을...
606,2020.01.21.,금융정보 사고파는 '데이터 거래소' 3월 출범,금융위원회·금융감독원·금융보안원은 21일 서울 여의도 금융보안원에서 '금융 분야 데이터 유통 생태계 구축... 거래소를 이용하면 공공기관의 지역별 유동인구 정보와 카드 매출 정보를 결합해 상권분석 서비스 개발할 수...
607,2020.01.20.,"까사미아, 부산 ‘롯데광복점’ 오픈..'연내 20개 목표'",신흥 리빙 상권으로 주목 받고 있는 부산 지역에서의 입지를 강화한다는 취지에서다. 또한 올해에는 20개의... 서울 수도권 외에도 잠재적인 홈퍼니싱 수요가 예상되는 전국 주요 도시 출점에 속도를 내 연내20여 개의 신규...
608,2020.01.14.,2층 침대가 호텔에… '가심비' 신경 쓴 비즈니스 호텔의 변신,"라마다 서울, 베네키아 호텔 아카시아 등 비즈니스 호텔들이 자리했다. 모두 쇼핑과 관광을 목적으로 동대문을 방문하는 20~30대 해외 관광객이 주 고객층이다. 나인트리호텔 동대문은 해당 지역이 동대문과 명동상권을..."
609,2020.01.19.,"""2년안에 명동만큼 번화한 곳 될 것""…신격호 어록(종합)","롯데는 무차입 경영 원칙 덕에 1990년대 후반 IMF 사태를 극복할 수 있었던 것으로 알려짐) ▲ ""상권은... 변호사가 서울가정법원에서 열린 '성년후견 개시 심판 청구' 첫 심리에 출석한 뒤 취재진에 공개한 내용) ▲""롯데..."
