,date,title,contents
1013,2020.01.02.,[인사] 소상공인시장진흥공단,◇ 본부장 ▲ 소상공인본부장 김수암 ▲ 시장상권본부장 전우소 ▲ 금융사업본부장 김성근... 센터장 ▲ 서울동부센터장 강임순 ▲ 서울서부센터장 김선희 ▲ 창원센터장 조기숙 ▲ 안양센터장 김철호 ▲ 진주센터장...
1014,2020.01.21.,"강동구도시관리공단, 설 연휴 공영주차장 무료개방","이용뿐만 아니라, 주차장 주변 상권과 지역경제 활성화에 기여할 수 있을 것으로 기대한다”고 말했다. 무료 개방 기간 동안 주차장 근무자가 부재하므로 공영주차장 이용 시 주의해야 한다. [신아일보] 서울/김두평 기자"
1015,2020.01.08.,10% 할인되는 중랑사랑상품권 100억 발행,중랑구(구청장 류경기)는 17일부터 소상공인 매출향상을 통한 지역 상권 활성화와 지역공동체 상생기반... 특히 발행 직후 서울시 전체 300억 원 소진시까지 10% 할인된 금액으로 구매가 가능하다. 이와 더불어 소득공제 30...
1016,2020.01.06.,"[국회감시K] “의원님, 상 왜 받으셨어요?”…수상한 시상식","[리포트] 서울 프레스센터, 작은 언론사가 연 국회의원 시상식입니다. [시상식 주최자/음성변조 : ""올해는... [홍OO/수상자 추천인/음성변조 : ""(장항선을) 직선화하는데, 우리 광천 상권하고도 멀어지고. 박사님(국토부 과장)..."
1017,2020.01.21.,"[경계인 신격호]④""절대 국민에 폐 끼치지 말라""","서울 잠실의 롯데월드타워를 세계 최대의 관광 명물로 만드는 것이 내 일생의 소원이다. 신 명예회장은... 잠실 개발 당시 배후 상권 부재를 염려하던 임직원들에겐 ""상권은 주어지는 것이 아니라 좋은 상품과 서비스로..."
1018,2020.01.15.,"박영선 ""올해 소상공인 정책 본격화…스마트상점 프로젝트 중점 추진""","박 장관은 이날 서울 여의도 CCMM 빌딩에서 열린 ‘2020년 소상공인 연합회 신년하례식’에서 이같이 밝히며... 상권 활성화와 관련해 상권 르네상스와 관련된 골목상권, 특화된 곳에 상점이 몰린 곳에 지원된다”며..."
1019,2020.01.16.,마이스·지역축제·수학까지…'각양각색' 지역상생 기업들,"지역 축제를 빛낼 뿐 아니라 주변 상권 조성에도 기여했다는 평이다. 아울러 분수, 연못 등 관리 어려움을 겪는 수경시설에 유지관리 서비스를 제공해 문화공간 안정성을 높이고 지역 일자리 창출에도 힘을 보탰다...."
1020,2020.01.09.,"은평구, 4억 투입해 자영업자 'LED간판 설치' 지원…경관 개선",서울 은평구(구청장 김미경)는 경기 불황 등으로 어려움을 겪고 있는 자영업자들의 경제적 부담을... 지역상권을 활성화하는데 조금이라도 보탬이 되기 위한 사업이다. 옥외광고발전기금 4억원을 투입하는 이번 사업은...
1021,2020.01.21.,직장인 올해 설 평균 지출액 `41만원',서울의 한 중소기업에 재직 중인 최모(30·속초시)씨는 부모님 용돈과 친지 선물비용이 국내여행 경비와... 경기 불황 여파로 소비침체가 심화된 탓으로 대목을 노렸던 지역상권의 한숨도 깊어지고 있다. 20일 구인구직...
1022,2020.01.17.,"브랜드엑스, 이제 글로벌로 GO!","서울 마포구 홍대 상권에 위치한 플래그십스토어 ‘핏스토어’ 홍대점을 시작으로 현대백화점 6개점, 신세계백화점 센텀시티점, 롯데몰 수지점, 신세계면세점 인천점, 롯데월드타워몰과 롯데백화점 소공동점..."
1023,2020.01.17.,여성 안전 비용은 여성 몫인가요?,근처에 대학교가 위치한 서울 종로구 명륜동 일대 보증금과 월세는 천차만별이다. 번화가로 CCTV 설치가 많은 명륜1가 일대는 보증금 2000만원에 월세가 60만원까지 올라갔다. 반면 상대적으로 인적이 드물어 상권이...
1024,2020.01.02.,[인사]소상공인시장진흥공단,또한 △비상안전실 설치를 통한 소상공인·전통시장 안전 관리 기능 △상권정보시스템과 연구기능을... 김관호 ◇센터장 △서울동부센터장 강임순 △서울서부센터장 김선희 △창원센터장 조기숙 △안양센터장 김철호...
1025,2020.01.16.,2년간 2배 수익 올린 '철든책방' 인근에 ‘홍철책빵’ 연 재테크 고수 노홍철,연합뉴스 땅집GO는 노홍철이 건물을 매입한 2016년을 특정해 ”해방촌 신흥시장 상권이 막 서울시 주도의 도시재생지 사업으로 형성되던 시기였다”며 “이 때문에 해당 상권이 부상하자 ‘노홍철 효과’라는 말이...
1026,2020.01.18.,"조산구 위홈 대표 ""한국판 에어비앤비 이제 현실이 됩니다""",서울 지하철역 반경 1㎞ 내에 있는 주택의 남는 방을 내국인에게도 빌려주는 ‘한국판 에어비앤비’ 사업의... 호스트들은 주변 상권과 결합해 숙박비 외에 다른 부가적인 수익도 얻을 수 있다. 또 호스트들에게 서비스...
1027,2020.01.20.,"까사미아, 부산 ‘롯데광복점’ 오픈…매장 출점 속도낸다",리빙 상권이 형성될 것으로 예상된다. 여기에 부산 서부상권의 랜드마크로 자리 잡은 롯데백화점 광복점의... 서울 수도권 외에도 잠재적인 홈퍼니싱 수요가 예상되는 전국 주요 도시 출점에 속도를 내 연내 20여 개의 신규...
1028,2020.01.20.,배후수요 확실한 더블역세권 상가 ‘포레나 루원시티’,"인근 청라국제도시, 가정지구와 연계가 가능해 시너지 효과가 극대화될 것으로 보이는 루원시티 상권의 가장 큰 특징은 서울지하철 7호선 연장으로 루원시티역과 인천지하철 2호선 가정역을 아우르는 더블역세권이라는..."
1029,2020.01.15.,"다방, CF공개 효과 톡톡…앱 이용자 52% 증가해","다방은 원룸 시장 성수기인 3월까지 TV CF는 물론, 서울·경기·부산 지역의 버스 광고와 부산·대전 지하철... 박성민 다방 마케팅 총괄 본부장은 “요즘 밀레니얼 세대들은 방 시설 못지않게, 스세권(스타벅스 상권)..."
1030,2020.01.22.,생계위기 내몰린 서민 자영업자들 “소득주도성장 꿈 깨라”,"사진은 강남역 일대 상권 거리 전경. ⓒ스카이데일리 경기침체, 최저임금 인상 등으로 700만 자영업자들이... 서울 신촌거리서 음식점을 운영하고 있는 이영화(여·가명) 씨는 “정부가 자영업자들을 위해 정책을 내놓는다..."
1031,2020.01.20.,[미리보는 이데일리신문]신사업 일단 허용 후 점유율 오르면 규제하자,"10대 상권 중 서울 명동 임대료만 `나홀로 하락` △사회 -中 최대 명절 춘제 앞두고, 韓국경 뚫은 `우한 폐렴`…당국, 확산 차단 총력 -秋 “대검 상갓집 추태 개탄” 경고…檢, 중간급 인사후 갈등 폭발하나 -“비닐 녹여..."
1032,2020.01.19.,"정세균 총리, 첫 현장일정은 '시장으로'","정 총리는 지난 18일 서울 우림골목시장을 방문, 설 성수품 수급상황과 장바구니 물가를 점검하고 시장... 정 총리는 ""우림골목시장 사례와 같이 전통시장의 구매 조건을 잘 만들어 놓으면 상권이 살아날 수 있다""면서..."
1033,2020.01.19.,“데이터 모아 맞춤형 미용서비스”…공유미용실 퓨처살롱 가보니,이달 서울 강남구 역삼동에 공유미용실 '쉐어스팟' 1호점을 낸 송기현 퓨처살롱 대표의 주장이다. 쉐어스팟은 강남 지역이긴 해도 역세권에서 제법 떨어진 상권에 입지를 잡았다. 유동인구가 많으면 방문객 자체는 많지만...
1034,2020.01.18.,"정 총리, 전통시장서 민생 행보…""경제 활성화에 최선""","정 총리는 18일 서울 중랑구의 전통시장인 우림골목시장을 찾아 설 명절 물가를 점검했다. 정 총리 취임 후 첫... 나아가 주차장 등 현대화된 시장 시설을 언급하고 ""이렇게 전통시장의 조건을 잘 만들어놓으면 상권이..."
1035,2020.01.06.,[국회감시K] 국회에 넘쳐나는 상잔치…“왜 받는지는 몰라요”,"국회의원 수상자만 39명…시상식엔 1명만 참석 2019년 12월 13일, 취재진은 서울 프레스센터를 찾았습니다. 한... 장항선을 직선화하는 2단계 개량 공사가 진행 중인데, 임 과장이 광천역 위치를 지역 상권과 가까운 현재의..."
1036,2020.01.14.,물건 골라서 나가면 '자동 결제'…AI로 진화한 편의점,&lt;기자&gt; 새로 개업한 서울 을지로의 한 편의점입니다. 물건은 빼곡히 진열돼 있는데 직원은 보이지 않고... 협소한 공간에도 적은 비용으로 운영할 수 있지만 줄어드는 일자리와 위협받는 골목 상권은 고민거리로 떠오르고...
1037,2020.01.15.,걷기 불편했던 천연·충현동 일대 30억 들여 안전조명·새 횡단보도,이외에도 지역 구간별 도로를 과거·현재·미래를 주제로 해 특색있게 디자인하고 서울 미래유산으로 지정된 석교감리교회와 영천시장 등을 활용한 아카이브도 구축해 상권 활성화를 적극 도모할 방침이다. 문석진...
1038,2020.01.14.,[밀착카메라] 노량진역 앞 '생선 노점'…상인들은 왜?,"[강하서/서울 동부이촌동 : 이거는 얼마예요? (1만원.) 이거 한 봉지요? (네, 이거 1만원, 이거 2만원. 살아... [임현우/수협노량진수산 경영기획부 : 말씀드린 대로 두 개 상권에서 하나 상권으로 합쳐지니 다시 흑자..."
1039,2020.01.05.,조정지역 일시적 2주택자 1년내 팔아야 양도세 '0',"이어 ""수익형 부동산 시장은 매수 수요가 늘어 서울 주요 '먹자상권' 핵심위치의 빌딩 호가가 오를 가능성이 높지만, 1가구 1주택자의 고가 상가주택은 양도세가 강화돼 개정 전보다 수요가 떨어질 수 있다""고 덧붙였다."
1040,2020.01.02.,"[신년사]강승수 한샘 회장 ""10조 경영시스템 구축, 세계 최고 기업으로""","강 회장은 2일 오전 서울 마포구 한샘 본사에서 열린 시무식에서 신년사를 통해 ""세계 초일류 기업... '리하우스사업본부'는 연 매출 5조원을 목표로 전국 50개 상권에 건재스타일 패키지를 판매할 수 있는 표준매장을..."
1041,2020.01.07.,"신세계 강남점, 국내百 최초 ‘2조 점포’ 등극..이세탄과 어깨 나란히","강남점도 청담동 등 인근의 트렌디한 패션거리는 물론 시내 면세점(신세계면세점 강남점), 특급호텔(JW메리어트), 센트럴시티(교통)까지 같은 상권을 공유하며 서울을 대표하는 글로벌 쇼핑·관광 메카로 떠올랐다...."
1042,2020.01.13.,신세계센트럴시티 '청년커피 LAB' 3호점 청년 창업자 모집,하루 100만명 이상의 유동인구를 자랑하는 강남 센트럴시티는 서울의 대표 맛집 거리로 통하는... 고씨는 “안정적인 매장 위치와 국내 최대 상권에서의 경험을 통해 막연했던 카페 사장이라는 꿈이 한층 가까워진 것...
1043,2020.01.07.,김포시 새해 화두는 '평화 '환경',"골목상권 활성화, 주민참여 예산 확대, 주민자치회 전환 등 세부 목표를 세웠다. 이에 시는 ▲자가용보다... 또, 서울지하철 5호선, 인천지하철 2호선, 김포골드라인 연장 국가계획 반영을 위해 노력하고 광역급행철도(GTX..."
1044,2020.01.22.,"초저금리시대, 배후수요 갖춘 역세권 복합상가 '은평 미드스퀘어'",역세권 상권은 지하철을 이용하는 유동인구를 원활하게 흡수한다는 큰 장점이 있고 아울러 편리한 교통... 통해 서울 도심과 경기지역으로 이동이 편리하다. 향후 GTX 개통 시 연신내역에서 강남까지 10분대로 단축된다.
1045,2020.01.19.,[미리보는 이데일리 신문]'롯데신화' 신격호 명예회장 별세,38조..서울 집값 상승 부추길 것 -‘구의역’ 일대 18만㎡ 지역 상권 되살린다 -수도권 재개발·재건축 규제에..‘리모델링’ 바람 -현대엔지니어링 ‘울산 B-05구역 재개발’ 시공권 따냈다 △사회 -“중간간부 전원...
1046,2020.01.19.,'새로운 프리미엄 콘텐츠' 갤러리아 광교점 2월말 '그랜드 오픈',"■수원 최초의 백화점, 추억 속으로 지역 최초 백화점으로 수원 인계동을 경기 남부의 중심 상권으로... 또 지난 3년간 서울 갤러리아면세점 사업이 1천억 원 이상 손실을 내는 바람에 한화갤러리아는 새로운 성장..."
1047,2020.01.22.,'불확실성'에도 웃는 부동산시장…대단지 분양 앞두고 기대감 상승,"지역별 분양물량은 경기(29곳, 4만7,677가구)가 가장 많고 인천(18곳, 3만9,562가구), 서울(12곳, 3만5,883가구)가... 지역 내 대단지가 들어서게 되면 이를 중심으로 상권과 교통망이 형성되고, 랜드마크로 자리잡게 된다...."
1048,2020.01.15.,‘e편한세상 부평역 어반루체’ 일반분양 100% ‘완판’,"등 서울과 수도권 접근성이 뛰어난 우수한 광역 교통 인프라를 보유했다. 더불어, 단지에서 도보 통학이 가능한 초등학교 등 교육시설과, 인근에 근접한 상권, 병원, 공원 등의 편리한 생활 인프라를 갖췄다. 한편..."
1049,2020.01.21.,난방 중 문 열고 영업하면 과태료 최대 300만 원,단속은 20일부터 나흘간 서울 전역 주요 상권을 대상으로 진행됩니다. 서울시 25개 자치구별로 점검반을 편성해 단속합니다. 단속에 적발되면 1차 경고 조치가 내려지고요 두 번째 적발되면 과태료 150만 원 4회 이상...
1050,2020.01.22.,"마사회 ""월평 화상경마장 폐쇄, 예정대로 절차 진행""","매주 금요일과 주말 경기도 과천 서울경마장과 제주 경마장에서 열리는 경마를 생중계한다. 하루 평균 이용객은 2400여명 수준으로 폐쇄 이후 주변 상권 침체를 우려하는 시각도 있다. 또 건물관리, 보안 등을 위해 200명을..."
1051,2020.01.07.,"신세계, 제주 면세점 사업 진출 공식화…‘빅3’ 경쟁시대 오나","정부는 지난해 5월 대기업 면세점 특허를 서울 3곳, 인천 1곳, 광주 1곳에 내줬다. 제주지역은 면세점... 무엇보다 소상공인을 중심으로 한 지역상권의 반발도 만만치 않을 것으로 예상된다. 제주도 역시 지난해 4월..."
1052,2020.01.06.,"수원시, 총 405억원 수원페이 발행··· 지난해 대비 45% 증가","지역화폐‘수원페이’제공=수원시[수원=스포츠서울 좌승훈 기자]경기 수원시는 지난해 보다 114억원(45... “소상공인들에게 도움을 주고, 골목상권에 활력을 불어넣을 수 있도록 노력을 다하겠다”고 말했다."
1053,2020.01.09.,새해 '시민감동의 해'로 만들 것,"3월에는 세종시 지역화폐인 여민전(與民錢)을 발행하고, 지역상권 활성화 사업을 추진하겠다. 2023년... 결과 서울역과 세종청사를 70분 내외로 이동할 수 있는, 좋은 대안이다. 세종~포천 고속도로 공사..."
1054,2020.01.24.,12.16부동산정책에 수익형부동산 반사이익 '세종 리더스포레' 상업시설 주목,"세종시 랜드마크인 중앙공원(1단계)이 올해 4월 개장할 예정이며, 서울 광화문광장의 기능을 수행할 세종... 세종시의 중심상권으로 설계된 만큼 상권의 성장세도 가파르다. KB리브온 상권분석보고서에 따르면 세종시..."
1055,2020.01.13.,"신세계센트럴시티, '청년커피LAB' 매장 운영할 청년 창업가 모집","신세계센트럴시티는 4월 중순부터 서울 강남 센트럴시티 안에 있는 '청년커피LAB' 매장을 운영할 청년... 박주형 신세계센트럴시티 대표이사는 ""1기 청년 사장이 카페 운영경험을 바탕으로 실제 본인이 원하는 상권에..."
1056,2020.01.14.,"유태열 GKL 사장 ""올해는 사회적 책임경영에 집중""","또 인바운드 여행사, 면세점, 공연장 등과 업무 제휴를 통해 대규모(MASS) 고객 유치는 물론 도심관광 활성화를 위한 공동 마케팅과 함께 서울과 부산의 세븐럭 영업장 주변 상권의 활성화도 지원할 계획이다. 또한..."
1057,2020.01.07.,"[전문] 문재인 대통령 신년사 ... ""포용·혁신·공정 확실한 변화 체감토록 할...",어려움을 겪는 자영업자와 소상공인을 위해서는 금융·세제 지원과 상권 활성화 지원을 더욱... [서울=뉴스핌] 문재인 대통령.[사진=청와대] photo@newspim.com '안전한 대한민국'은 국민 모두의 바람입니다. 우리 정부는...
1058,2020.01.19.,[MHN 성동구] 소상공인 살리는 '성동사랑상품권' 10%할인,"출처 : 서울 성동구, '성동사랑상품권'이 오는 15일 제로페이 모바일 앱에서 구매 가능 성동구가 지역소비... 정원오 성동구청장은 ""성동사랑상품권이 대기업의 골목상권 진출, 온라인 매출 급증 등으로 어려움을 겪는..."
1059,2020.01.02.,"공유주방 고스트키친, 3호점 송파점 개점",서울 송파구 석촌호수효성해링턴타워에 들어선 송파점은 5~6평 규모의 풀옵션 프라이빗 키친 25곳을 갖추고... 최정이 단추로끓인수프 대표는 “송파구는 배달 수요가 많은 상권 지역으로 배달 전문 음식점을 창업하기에...
1060,2020.01.09.,'역세권 오피스텔' 규제 피해 수요 몰려,"한국감정원에 따르면 지난해 4분기 기준 서울 오피스텔 값은 전 분기보다 0.40% 상승했다. 서울 오피스텔... 권 팀장은 “지하철 역세권은 지하철 외에도 버스 등 대중교통이 잘 형성돼 있고, 유동인구도 많아 상권..."
1061,2020.01.15.,"다방, 혜리 덕 톡톡히 봤다…앱 트래픽 50% 증가","다방은 원룸 시장 성수기인 3월까지 TV CF는 물론, 서울·경기·부산 지역의 버스 광고와 부산·대전 지하철... 다방 마케팅 총괄 박성민 본부장은 ""요즘 밀레니얼 세대들은 방 시설 못지않게, 스세권(스타벅스 상권)..."
1062,2020.01.14.,동대문에 활력 불어넣는다… 2030세대 겨냥한 ‘나인트리호텔 동대문’ 첫 선,"서울의 쇼핑 중심지로 꼽히는 동대문에 ‘나인트리호텔 동대문’ 4호점이 문을 열었다. 호텔 전문기업... 나인트리호텔 인사동은 주변 상권을 고려해 패션에 관심이 많은 20∼30대 여성과 중국, 홍콩, 대만 일본 등 다양한..."
1063,2020.01.06.,"시몬스침대, '시몬스 맨션' 청담점 오픈","[이데일리 권오석 기자] 시몬스침대가 서울시 강남구 청담동에 ‘시몬스 맨션 청담점’을 오픈했다고 6일... 청담점은 혼수를 준비하는 신혼 고객층의 방문이 잦은 대표 상권임을 고려해, 지하 1층에서 지상 1층까지 대표..."
1064,2020.01.16.,"3·1만세운동길, 100년 넘은 성당… 근대로 떠나는 '시간여행'",매력에 서울 부산 울산 전주 등 전국에서 사람이 몰리고 외국인 관광객도 크게 느는 추세”라며 “2020년... 도심공동화로 퇴락하던 거리는 새로운 상권으로 되살아났다. 관광객 수가 그 증거다. 중구는 근대골목과...
1065,2020.01.12.,"성남시, 새해인사회 '소통을 위한 새로운 시도' 평가 받아",제공=성남시[성남=스포츠서울 좌승훈 기자] 경기 성남시의 새해인사회가 시민들의 눈 높이를 적절히... 또 아시아실리콘밸리 성남 프로젝트와 상권활성화 및 일자리 창출 등 올해 역점 추진할 시정 주요시책과 사업 등을...
1066,2020.01.14.,"이승로 성북구청장, 2020년 구정 운영 틀 '균형·공존·풍요' 제시","그에 따라 골목상권과 전통시장, 그리고 사회적경제조직에 대한 지원을 약속, 캠퍼스타운 사업 등... 사업도 서울시와 긴밀히 협력하여 조기착공을 위한 기반을 마련하였습니다. 함께 살아가는 공동체를 복원하는 노력도..."
1067,2020.01.13.,"유태열 GKL 사장, ""올해 일자리 5,500개 창출""","인바운드 여행사, 면세점, 공연장 등과 업무 제휴를 통해 MASS 고객 유치는 물론 도심관광 활성화를 위한 공동 마케팅과 함께 서울과 부산의 세븐럭 영업장 주변 상권의 활성화도 지원할 계획이다.아울러 기술협력을..."
1068,2020.01.06.,기능성+핏 살리니..K2 '다이나핏' 메가브랜드로,지난 2018년에는 강남 스포츠 브랜드 상권에 자리잡기 위해 서울 강남역에 플래그십 스토어를 열었다. ‘고기능성’이라는 브랜드 콘셉트에 어울리는 마케팅도 눈에 띈다. 지난해에는 방송사와 협력해 ‘더 스트롱맨...
1069,2020.01.15.,"고양시의회, 제238회 임시회‘5분 자유발언’","한편, GTX, 3호선, 경의선, 교외선, 고양선, 대곡-소사선 등 6개의 철도 노선과 서울외곽순환도로, 자유로... 지역 상권 활성화에 기여할 수 있을 것이라고 했다. 이미 여러 지자체에 음식 문화 특화거리가 조성되어 있는..."
1070,2020.01.07.,"""연매출 2조원 첫 돌파""… 신세계 강남점, 글로벌 백화점으로 우뚝","강남점도 청담동 등 인근의 트렌디한 패션거리는 물론 시내 면세점(신세계면세점 강남점), 특급호텔(JW메리어트), 센트럴시티(교통)까지 같은 상권을 공유하며 서울을 대표하는 글로벌 쇼핑·관광 메카로 떠올랐다...."
1071,2020.01.09.,"박원순 시장, CES서 기조연설… '사람 중심 혁신' 전세계에 화두 던져","‘우리마을가게 상권분석 서비스’ 등 서울시의 혁신 정책들도 함께 소개했다. ━ 서울시, 새로운 모빌리티 사업단 추진도 검토 ━ 박 시장은 스페셜 세션을 마친 후 CES 유레카파크에 마련된 ‘서울관’(Tech West)에서..."
1072,2020.01.09.,"은평구, 자영업자 위한 LED간판 설치 지원",서울 은평구(구청장 김미경)는 소규모 점포를 대상으로 ‘LED 간판 설치 지원사업’을 이 달부터 시행한다고... 구 관계자는 “이 사업이 경기 불황 등으로 침체된 지역 상권을 살릴 수 있는 귀중한 디딤돌의 역할이...
1073,2020.01.21.,[이창석의 직격인터뷰] 정순균 강남구청장 인터뷰,"-기분좋은 변화, 품격있는 강남을 만드는데 정성을 쏟고 있는 정순균 강남구청장 인터뷰 -서울 시민이... 소상공인 상권 활성화를 위해 만든 '우리가게' 콘텐츠가 대표적입니다. '우리가게'는 비용과 시간이 없어 홍보를..."
1074,2020.01.23.,"중구, 설 명절 맞아 전통시장 상인 격려","서양호 서울 중구청장을 포함해 국장, 과·동장, 관계자들이 지난 22일 설을 맞아 백학, 중앙시장을 방문해 상인들의 목소리를 듣고 소상공인골목상권 활성화를 위한 사업 추진에 힘쓸 것을 다짐했다. 이어 23일에는 인현..."
1075,2020.01.20.,공권력 압박 이겨낸 청년 진심에 시민·상인 응답했다,"경기침체·부동산폭등·친노동 정책에 신음하는 ‘대한민국 상권1번지’ 서울 강남역 서울시 강남역 일대 상권은 서울특별시 강남구와 서초구의 경계선에 자리한 곳이다. 강남역은 서울역, 고속터미널역, 신도림역..."
1076,2020.01.12.,"[뉴스터치] 금천구, 독산동우시장 홈페이지 오픈","서울 금천구가 독산동 우시장 상권 활성화를 위해 ‘독산동우시장’ 홈페이지(사진)를 만들었다. 독산동우시장 홈페이지는 우시장에서 판매하는 저렴하고 품질 좋은 상품을 소개하고, 우시장에서 진행하는 다양한 행사..."
1077,2020.01.18.,[앵커의 시선] 원주민 내쫓는 '젠트리피케이션'의 어두운 단면,"하지만 치솟는 임대료에 '기존 상인'들은 떠나가고, '대형 프랜차이즈'들이 들어서며 지역 상권이 무너지고 있다는 지적이 많습니다. 도시재생사업의 대표적인 예인 서울 서촌과 대구 김광석 거리 역시 마찬가지로..."
1078,2020.01.20.,"[현장] '강남은 명품대기, 지방은 구조조정' 백화점도 양극화","지난 주말 서울 강남에 위치한 신세계백화점의 샤넬 매장 앞은 물건을 구경하고 사려는 사람들로 긴 줄이... 주요 상권에 위치한 백화점은 연매출 1조 원을 무난히 넘긴 것으로 추정된다. 반면 신세계 마산점, AK 원주점..."
1079,2020.01.15.,"다방, CF 오픈 2주 만에 트래픽 ‘급증’…혜리 효과 ‘톡톡’",앞으로 다방은 원룸 시장 성수기인 3월까지 TV CF는 물론 서울·경기·부산 지역의 버스 광고와 부산·대전... 다방 마케팅 총괄 박성민 본부장은 “요즘 밀레니얼 세대들은 방 시설 못지않게 스세권(스타벅스 상권)...
1080,2020.01.07.,신세계百 강남점 연매출 '2조원' 달성… 단일 점포 최초,"강남점은 청담동 등 인근의 트렌디한 패션거리는 물론 시내 면세점(신세계면세점 강남점), 특급호텔(JW메리어트), 센트럴시티(교통)까지 같은 상권을 공유하며 서울을 대표하는 글로벌 쇼핑 ·관광 메카로 떠올랐다...."
