,date,title,contents
605,2020.02.24.,"국민체육진흥공단, 코로나19로 주요사업장 휴관…지역상권 지원책도 마련","서울 송파구 올림픽공원 내 스포츠센터, 올림픽수영장, 스포츠교실 및 분당·일산스포츠센터 등 주요... 한편 공단은 코로나19 확산으로 어려움을 겪는 올림픽공원 인근 지역 상권에 도움을 주고자 오는 5월까지 매주..."
606,2020.02.25.,"현대건설, '힐스테이트 청량리역' 3월 분양",서울 동대문구 청량리동 235-6번지 일원에 들어서는 이 단지는 지하 7층~지상 20층 규모이다. 전용면적 20~44... 단지 내 독점상가로 고정 수요를 확보하고 있는데다 청량리역 상권 중심지인 왕산로 대로변에 위치해...
607,2020.02.28.,"익명 기부부터 임대료 인하 운동까지···· 마포구, 코로나19 극복 노력 확...",익명의 기부자가 코로나19 극복을 위해 써달라며 마포구에 전달해온 응원편지와 기부금./ 마포구 서울... 마포구 최대 상권인 홍대 지역에서는 코로나19 확산으로 위축된 경제상황 극복을 위한 자발적인 임대료 인하...
608,2020.02.20.,종로상권 살리기…저녁 일곱번 먹은 최태원,신종 코로나바이러스 감염증(코로나19) 확산으로 침체된 골목 상권을 활성화하기 위해서다. 20일 SK그룹에 따르면 최 회장은 이날 오후 6시부터 11시까지 서울 종로 일대 식당 여섯 곳과 호프집 한 곳을 들른 것으로...
609,2020.02.23.,"국민은행, 대구·경북지역 비대면 수수료 면제",서울 여의도에 위치한 KB국민은행 본점 전경. 사진=KB국민은행  KB국민은행은 23일 '코로나19' 관련 감염병... 지역사랑상품권 등으로 대구경북지역 전통시장에서 1억원 상당의 생필품을 구입해 침체된 지역상권...
610,2020.02.21.,과천시 신천지 본당-교육관 5곳 폐쇄조치,"이는 20일 코로나19 확진자로 판정된 서울 서초구 거주 신도가 16일 과천 신천지 교회에서 열린 예배에... 또한 중심상권지역 및 다중이용시설, 신천지 신도 이동경로 등에 대한 지속적인 방역을 위해 경기도에..."
611,2020.02.26.,(참고자료)겨울철 공공기관 에너지수요관리 이행실태 점검결과 발표,"8 서울특별시농수산식품공사 □ 한편, 산업부는 올 겨울철 공공기관 뿐만 아니라 민간 에너지다소비건물... * 2.21일 기준, 전국 주요상권을 대상으로 총 7회에 걸쳐 10,960개소 계도 및 점검 ** 2.21일 기준, 전국 43개..."
612,2020.02.16.,"정부, 코로나19발 상권 침체에 '공무원 외식' 늘린다",[청사 구내식당은 최소 한 주에 하루 휴무] 정부가 코로나19 사태로 침체된 지역상권을 살리기 위해... 정부청사가 세종·서울 등 11개 지역에서 위탁 방식으로 운영하는 구내식당 28곳은 점심 이용자 수가 하루 평균...
613,2020.02.19.,용산 등 국유지 5곳에 청년·신혼부부 공공주택 2000호 공급한다,청년층의 기호를 고려해 대중교통 접근성과 거주 여건이 양호한 서울시와 수도권 내 지역을 선정했다고 기재부는 설명했다. 장기간 사용되지 않는 유휴 부지나 활용도가 낮은 시설의 활용도를 높여 주변 상권이...
614,2020.02.20.,"현대백화점면세점, 동대문에 2호점 오픈","현대백화점면세점이 들어서는 동대문 상권은 서울 명동과 함께 서울 강북을 대표하는 관광 명소로, 연간 700만명의 외국인이 찾고 있다. 실제로 문화체육관광부가 발표한 ‘2018년 외래관광객 실태조사’에 따르면..."
615,2020.02.19.,용산유수지 등에 '행복주택' 등 공공주택 2000호 공급,"서울 용산유수지와 동작구 본동 수방사 군시설 부지 등에 행복주택 등 공공주택 2000호가 건설된다.... ""주변 상권 활성화 및 생활 환경 개선 등에 따른 2조 3000억 원 규모의 직간접적 생산유발효과가 기대된다""고..."
616,2020.02.25.,코로나19 예방에 제일 관심 많은 대기업 총수는?,13일 서울 중구 대한상공회의소에서 주최한 '코로나19 대응 경제계 간담회' 관련 포스팅은 통계에서... 향후 상권을 최대한 많이 이용하도록 하겠다고 약속도 했다. 이재용 부회장은 코로나19로 어려움을 겪고 있는...
617,2020.02.26.,"""주문 후 1시간내 배송""…롯데마트, 내달 풀필먼트 스토어 시작",3월말 서울 중계점과 경기도 수원 광교점에서 선보인다고 26일 밝혔다. 풀필먼트(fulfillment)는 고객의... 기존 점포 기반 온라인 배송이 점포 반경 15km의 광역 상권을 기준으로 하고 원하는 시간대를 설정해 주문한 물건을...
618,2020.02.25.,잠실 롯데월드몰 스윗드림샵 가면 나도 디즈니 공주 된다,"(스윗드림샵)'을 서울 잠실 롯데월드몰 지하 1층에 오픈했다고 25일 밝혔다. 스위트스팟은 지난해 11월부터... 쇼핑몰, 랜드마크타워, 대형 오피스 등의 상권 데이터를 분석해 최적의 장소를 찾아 중개하고 단기에서..."
619,2020.02.25.,3월 분양 앞둔 ‘힐스테이트 청량리역’...초역세권 대학가 단지 ‘눈길’,이 단지는 서울시 동대문구 청량리동 235-6번지 일원에 조성되는 지하 7층~지상 20층 규모의 주거형... 단지 내 독점상가이면서 청량리역 상권 중심지인 왕산로 대로변에 위치해 유동인구 유입에도 유리하다는 게...
620,2020.02.25.,3월 분양 앞둔 ‘힐스테이트 청량리역’...초역세권 대학가 단지 ‘눈길’,이 단지는 서울시 동대문구 청량리동 235-6번지 일원에 조성되는 지하 7층~지상 20층 규모의 주거형... 단지 내 독점상가이면서 청량리역 상권 중심지인 왕산로 대로변에 위치해 유동인구 유입에도 유리하다는 게...
621,2020.02.24.,막다른 주택시장 탈출구가 없다,"문재인정부 출범 2년 반, 국민 주거안정을 목표로 한 각종 부동산세금 인상과 대출 규제로 서울 집값이... 역세권 상권분석 ⑥ 화곡동 - 직장인 사로잡은 ‘알짜 상권’ BUSINESS ◆ 보톡스 제약사 화장품에서..."
622,2020.02.20.,"CJ올리브영, ‘신종 코로나’ 관련 취약계층 지원… 마스크·물티슈 1만개 전...",CJ올리브명은 20일 서울 마포구 합정동 소재 홀트아동복지회 본사에서 미혼한부모 가정을 위한 후원 물품... 지난 11일에는 명동 플래그십 스토어를 포함해 명동 상권 주요 매장에서 방역 작업을 실시한 바 있다. 동아닷컴
623,2020.02.25.,"하나은행, 코로나19 피해 기업‧소상공인에 총 4천억 긴급 금융지원",서울 을지로 하나은행 본점 전경. 사진=하나은행 제공 하나은행이 '코로나 19' 피해 확산에 따라 조속한 피해... 하나은행은 침체된 지역상권 활성화를 위해 임직원들을 대상으로 전통시장 소비 독려 등의 소비촉진 방안을...
624,2020.02.24.,올해 수도권 분양시장 키워드는 '수도권·비규제·대단지',"지역상권이나 교통환경 등 지역을 발전시킬 수 있는 긍정적인 변화도 기대할 수 있다""고 말했다. 이어 ""올해 서울 등 특정지역을 중심으로 규제가 강화되면서 비규제지역들이 직·간접적인 영향을 받는 만큼 올..."
625,2020.02.20.,"현대백화점면세점, 동대문점 신규 오픈…3년내 매출 2조원대 목표","현대백화점면세점이 들어서는 동대문 상권은 서울 명동과 함께 서울 강북을 대표하는 관광 명소로, 연간 700만명의 외국인이 찾고 있다. 특히 트렌드에 민감한 20~30대 외국인 관광객들이 주로 찾는 곳으로 알려져 있다...."
626,2020.02.13.,"문대통령 ""대기업 너무 잘해줘""…재계 발맞춰 '코로나극복' 의지(종합)","찾기 (서울=연합뉴스) 임형섭 기자 = ""대기업들이 앞장서 주시니 더욱 든든하다는 감사 말씀을 드립니다.... 최태원 SK 회장이 ""SK는 (상권 활성화를 위해) 구내식당을 닫는다""고 소개하자, 문 대통령도 ""청와대 역시 일주일에..."
627,2020.02.23.,"인천시, '코로나 19' 부평구 확진자 동선 공개",A씨는 지난 17일 동대구역에서 KTX를 이용해 서울역에 도착했다. 서울역에서 지하철을 타고 부평역으로... 시는 이번 임시휴장에 따른 상권위축 지원책으로 2020년 전통시장 지원사업 공모평가에 시가점반영 등...
628,2020.02.18.,서울대 앞 도림천 생태복원 착수…2022년까지 331억원 투입,서울 관악구(구청장 박준희)는 도림천 서울대 앞 구간의 생태복원사업에 착수한다고 18일 밝혔다. 이 사업의... 관악구는 도림천을 중심으로 신림역 일대에 올해부터 5년간 80억 원을 투입해 지역상권을 활성화하는 '별빛...
629,2020.02.26.,개학 연기에 괴로운 중기들…“코로나19에 체력 밑바닥”,"코로나19 사태와 이에 따른 대학의 개강 연기로 대학가 주변 상권의 소상공인ㆍ자영업자들도 직격탄을 맞고 있다. 이근재 외식업중앙회 서울시 종로구 지회장은 ""성균관대, 건대 등 대학가들 주변으로 모인 식당, 카페..."
630,2020.02.23.,"국민은행, 대구·경북지역 '코로나19' 확산 관련 긴급 지원",KB국민은행 서울 여의도 본점 전경. 사진=국민은행.  KB국민은행은 23일 '코로나19'관련 감염병 특별... 지역사랑상품권 등으로 대구·경북지역 전통시장에서 1억원 상당의 생필품을 구입해 침체된 지역상권 활성화에...
631,2020.02.25.,코로나엔 관심없는 회장님들…사태 조기종식 차질 우려,단 문재인 대통령이 지난 13일 서울 중구 대한상공회의소에서 주최한 ‘코로나19 대응 경제계 간담회’... 향후 상권을 최대한 많이 이용하도록 하겠다는 약속도 했다. 글로벌빅데이터연구소는 “상당수 20대그룹...
632,2020.02.24.,"국민체육진흥공단, 코로나 19 ‘심각’ 격상에 따른 긴급 종합대책 마련",한편 공단은 코로나 19 확산으로 매출에 어려움을 겪는 서울시 송파구 올림픽공원 인근 상권에 도움을 주기 위해 사태가 오는 5월까지 매주 금요일마다 주 1회 직원식당을 휴무한다. 올림픽공원에 위치한 공단...
633,2020.02.28.,"The space you need is just around the corner: In Huam-dong, you can rent...","서울 용산구 후암동에 가면 해답이 있다. 물론 나의 소유는 아니지만 말이다.... 이어 ""아직 후암동은 젠트리피케이션(둥지 내몰림)을 논할 정도로 뜨거운 상권은..."
634,2020.02.24.,"김경욱 민주당 충주 예비후보 ""모두 포용.. 총선승리 이끌 것""",김경욱 예비후보는 지역 문제로 ▲빈 점포가 즐비한 원도심 상권 공동화 ▲전통시장과 상가 매출 급락... 그는 서울대학교 경제학과를 졸업하고 제33회 행정고시를 통해 공직에 입문했으며 국토교통부 건설정책국장...
635,2020.02.26.,"얌샘김밥, 200호점 달성… 3월에도 전국 5개 매장 오픈 예정","또 이번 2월에는 구미원호점, 동탄석우점, 양재하나로마트점, 부산재송점, 구로역점 등 서울과 부산에 걸쳐... 그중 2월에 오픈한 양재하나로마트점은 특수 상권에 속한 매장으로, 얌샘김밥만의 특수 상권 최적화 매출..."
636,2020.02.18.,"이연복 셰프와 '코로나19' 피해 시장 간 김정숙 여사…""이겨내자""","안채원 홍지은 기자 = 문재인 대통령 부인 김정숙 여사가 18일 서울 중랑구 면목동 소재의... 골목상권, 지역경제 활력을 위해 필요하다면 파격적 수준의 지원 방안을 적극적으로 고려해 주기 바란다""고 주문했다...."
637,2020.02.26.,“매출 80% 줄었다”…‘식당포비아’ 확산,상권의 경우 그나마 점심 손님은 유지되지만 저녁 모임이나 회식은 급감했다. 업주들은 코로나19 이후 매출이 30~50% 감소했다고 입을 모은다. ‘유산슬(유재석)’이 직접 찾아 방송을 타면서 한창 인기를 모았던 서울...
638,2020.02.28.,대형매장 구조조정과 농산물 유통,현재 서울ㆍ수도권은 물론 지방 중소도시까지 점령해 지역 영세 상권은 설자리를 잃을 만큼 위축됐다. 농산물도 지역 도매시장과 함께 이들 대형업체 의존도가 높은 것이 사실이다. 이런 가운데...
639,2020.02.25.,남대문상가 2000여명 임대료 3개월간 20% 인하,침체된 지역상권을 살리고자 남대문시장 상가 건물주들이 자발적으로 2000여명의 상인들에게 임대료를 한시적으로 20% 인하한 것이다. 25일 서울 중구에 따르면 지난 3일 남대문시장 내 대형상가인 'C동 남대문중앙상가...
640,2020.02.28.,대형매장 구조조정과 농산물 유통,현재 서울ㆍ수도권은 물론 지방 중소도시까지 점령해 지역 영세 상권은 설자리를 잃을 만큼 위축됐다. 농산물도 지역 도매시장과 함께 이들 대형업체 의존도가 높은 것이 사실이다. 이런 가운데...
641,2020.02.25.,남대문상가 2000여명 임대료 3개월간 20% 인하,침체된 지역상권을 살리고자 남대문시장 상가 건물주들이 자발적으로 2000여명의 상인들에게 임대료를 한시적으로 20% 인하한 것이다. 25일 서울 중구에 따르면 지난 3일 남대문시장 내 대형상가인 'C동 남대문중앙상가...
642,2020.02.21.,"2·20 이후 첫 분양, '위례 중흥S-클래스' 청약접수","서울 ‘쌍용 더 플래티넘 서울역’과 경기도 ‘위례신도시 중흥S-클래스’, 인천 ‘뷰그리안 구월’을... 도보 거리에 황령산, 금련산 등이 위치해 자연환경이 쾌적하며 경성대가 가까이 있어 대학가 상권을..."
643,2020.02.19.,"고민정 맞이한 오세훈 ""치열한 마음으로 선거에 나설 것""","21대 총선에서 서울 광진을에 출마하는 오세훈 전 서울시장은 19일 고민정 전 청와대 대변인이... 그러면서 ""오랫동안 한몸이었던 이웃 성동의 인구는 최근 5년간 늘고 있으나 광진은 줄고 있고 상권 역시 마찬가지""라며..."
644,2020.02.25.,"부산 우한 코로나 확진자, 25일 현재 6명 추가 총 44명 집계",40번 확진자(76)는 서울에 거주중인 부인이 확진자와 식사를 함께 한 것으로 알려졌으며 41번 확진자(27)는... 29번 확진자는 동래구에 거주하는 21세 남성으로 지난 22일 부산진구와 동래구 사직동 일대 상권을 주로...
645,2020.02.26.,"[코로나19]""고통 나누자"" 전국 곳곳에서 상생 물결",25일 서울 남대문시장 상가 건물주들은 자발적으로 2000여명 상인들에게 임대료를 20% 깎아주기로 했다. 대구... 전주의 주요 상권 건물주들은 14일 '코로나19 극복과 지역 경제 활성화를 위한 상생 협력 선언식'을 열고 5...
646,2020.02.18.,핫한 성수동 임대료 급등 막은 성동구 ‘젠트리피케이션 방지 대책’,"주목받는 상권인 서울 성수동 일대에서 성수1가 제2동의 서울숲길과 방송대길, 상원길로의 상가 임대료 인상률이 평균 0.16%포인트 떨어진 것으로 나타났다. 임대료가 무섭게 치솟고 있는 성수동에서도 유독 이..."
647,2020.02.24.,"권진택 진주·을, 원도심 동양의 파리 샹젤리제 거리 공약","권 예비후보는 ""한해 우리나라를 찾는 외국인 관광객은 1500만명으로, 그 중 97%가 서울과 수도권에 편중돼... 조성 △지역 상권 보호와 거리 활성화를 위한 공용주차장 대폭 확충 △특색 있고 다양한 문화·관광 콘텐츠..."
648,2020.02.20.,"현대백화점면세점, '쇼핑1번지' 동대문에 2호점 오픈…""2030 공략""","현대백화점면세점이 들어서는 동대문 상권은 서울 명동과 함께 서울 강북을 대표하는 관광 명소다. 연간 700만명의 외국인이 찾고 있다. 주변에 동대문 패션타운 관광특구, 동대문디자인플라자(DDP), 광장시장 등..."
649,2020.02.20.,"양천구, 구내식당 상생휴일 확대…월 1회→주 1회",서울 양천구(구청장 김수영)는 21일부터 '상생휴일'을 월 1회에서 주1회로 확대 시행한다고 20일 밝혔다.... 구는 인건비와 물가 상승에 따른 운영난을 겪고 있는 인근 골목 상권(소상공인·자영업자)을 위해 월 1회...
650,2020.02.26.,지속가능한 스마트 도시 만드는 스마트시티 챌린지 사업,"수영, 서울 성동 등이다. 스마트 챌린지 사업은 국토교통부가 2019년부터 전국지자체를 대상으로 진행한... 지역 상권과 연계 운영으로 지역경제 활성화에도 크게 기여할 것”이라고 말했다.[()]www.boannews.com) 무단전재..."
651,2020.02.25.,"""오세훈, 고민정에게 지면 정치생명 좌초"" [여론끝짱]","'여론 전문가' 배종찬, 서울 광진을 선거구 집중분석 ""민주당 강세 지역…코로나19·검찰개혁 등도 영향 끼칠... 지역 상권이 타격을 입는 부분 등을 집중 공략할 필요가 있다""고 덧붙였다. 오 전 시장과 고 전 대변인의..."
652,2020.02.26.,[인터뷰] ‘천안갑’ 문진석 “원도심 부활…천안 경제지도 바꿀 것”,"셋째, 천안터미널과 역세권에 청소년 아르떼 거리를 조성하여 일자리 창출과 지역상권 활성화를... ©시사뉴스24 &lt;학력&gt; ∙ 중앙대학교 정치외교학과 학사 ∙ 고려대학교 정책대학원 행정학 석사 ∙ 서울과학기술대학교..."
653,2020.02.27.,"공유주방 개러지키친, 등촌점·롯데마트 권선점 오픈 입점 설명회 개최","이번 설명회는 서울 마포구에 위치한 개러지키친 본사에서 진행되며, 개러지키친 등촌점, 롯데마트와 협업으로 최초 특수상권에 입점되는 권선점 관련 상권분석, 특장점, 컨설팅전략, 운영방식에 관련한 내용으로..."
654,2020.02.21.,"현대百, 동대문에 시내면세점 2호점",동대문점은 서울 중구 두산타워 6∼13층에 위치해 있다. 과거 두산이 두타면세점을 운영했던 자리다. 지난해 10월 현대백화점면세점은 두산과 해당 면세점 부지를 5년간 임차하는 계약을 맺었다. 동대문 상권은 인근에...
655,2020.02.18.,"서대문구, 코로나19로 침체된 지역경제 살린다",서울 서대문구(구청장 문석진)는 '신종 코로나바이러스 감염증(코로나19)'으로 침체된 지역상권을 회복시키기 위해 전통시장과 골목상권 살리기에 총력을 기울이고 있다고 18일 밝혔다. 구는 코로나19 발생 이후...
656,2020.02.26.,"[코로나19]""어려울 때 서로 도와야죠""…임대료 인하 '릴레이'","임대료 인하 대상 점포는 서울 남대문시장의 1,851곳과 동대문 상권의 209곳을 포함해 전국 3,319곳이다.부산평화도매시장의 경우 지난 추석부터 경기가 안 좋아 임대료를 내렸는데 이번 코로나19 사태로 상황이 더욱..."
657,2020.02.23.,"직원 500명 대형마트, 폐점땐 지역민 450명 거리 나앉을듯",마트에 찾아오는 유동인구를 중심으로 형성된 상권은 마트 영업이 생계에 절대적 영향을 끼친다. 최근 매출 부진으로 구조조정 가능성이 예상되는 서울 소재 한 대형마트 인근에서 15년째 세차장을 운영하는 업주 B씨는...
658,2020.02.25.,종로에 랜드마크 오피스텔 ‘종로 한라비발디 운종가’ 들어 선다,"대표 오피스상권인 종로와 광화문 지역에는 대기업 본사와 공공기관이 밀집해 있고, 인근에 고려대, 한양대, 덕성여대, 성신여대 등 대학교와 서울대학병원이 위치해 관련 종사자들의 수요가 풍부하다. 서울 종로구..."
659,2020.02.21.,"도봉구, 지역·온누리상품권 2억원 구입 ""소상공인 지원""","서울 도봉구(구청장 이동진)는 산하기관, 유관단체와 함께 코로나19 때문에 침체된 전통시장과 골목상권 살리기에 총력을 기울인다고 21일 밝혔다. 소상공인 피해파악과 대응방안 마련을 위해 전통시장 상인회 등이..."
660,2020.02.18.,"문대통령 ""사스·메르스때보다 큰 충격""…정책·입법 '총동원령'","중국 경제상황 악화 따른 경제충격 및 총선 악영향 우려한 듯 ""모든 특단 대책 필요""…기업부터 골목상권까지 전방위 대책 주문 ""국회도 비상경제상황 극복에 협조해 달라""…야당 동참 요청 (서울=연합뉴스) 박경준 기자..."
661,2020.02.25.,"현대건설, 총 954실 규모 오피스텔 상업시설 '힐스테이트 청량리역' 3월 분양...",힐스테이트 청량리역 조감도 [사진=현대건설 제공] 서울특별시 동대문구 청량리동 일원에 들어서는 이... 단지 내 독점상가이며 청량리역 상권인 왕산로 대로변에 위치해 있다. 단지 내에는 청랑리동 주민센터...
662,2020.02.20.,"CJ올리브영, 미혼한부모 가정에 '코로나 예방' 건강위생용품 기부",CJ올리브영은 20일 오전 서울 마포구 합정동 홀트아동복지회 본사에서 미혼한부모 가정을 위한 후원 물품... 의무화했으며 지난 11일에는 명동 플래그십 스토어를 포함한 명동 상권 주요 매장에 방역 작업을 실시한 바 있다.
663,2020.02.20.,"현대백화점면세점, 동대문 2호점 오픈 “강북 상권 공략 본격화”","현대백화점면세점이 들어서는 동대문 상권은 서울 명동과 함께 서울 강북을 대표하는 관광 명소로, 연간 700만명의 외국인이 찾고 있다. 주변에 동대문 패션타운 관광특구, 동대문디자인플라자(DDP), 광장시장 등 풍부한..."
664,2020.02.19.,"라카(LAKA), 일본서 론칭… 글로벌 시장 본격 공략","제공|라카[스포츠서울 양미정 기자] 뉴트럴 메이크업 브랜드 ‘라카(LAKA)’가 일본 공식 론칭을 시작으로... 지난해 12월 일본 메인 뷰티 상권인 신주쿠 로프트, 시부야 플라자, 하라주쿠 엣코스메에서 테스트 론칭을..."
665,2020.02.27.,"여의도 증권가 상권 어느 정도인가......""하루 유동인구 21만명에 고깃집 월평...","카카오맵) 서울 여의도 증권가 상권을 방문한 유동인구가 지난해 하루 평균 21만여명, 월 평균 650만여명인 것으로 나타났다. 특히 여의도 증권가 상권 내 고깃집 월평균 매출은 영등포구 전체 평균치의 두 배가..."
666,2020.02.27.,총선성적 부진 '이재명 경기도지사의 남자들'… 감염병 대처 '후광 효과' 받을...,김경표 경기콘텐츠진흥원 이사장이 뛰고 있는 광명갑도 임오경 전 서울시청 핸드볼팀 감독 등의 전략공천 가능성이 거론된다.'이재명의 남자들' 중 가장 마지막으로 수원무에 도전장을 던진 임진 전 경기도시장상권진흥원...
667,2020.02.18.,"불황·불매에 `불안`도 덮쳐…""오늘까지만 영업합니다""",주변 식당과 유통 매장 등이 잇달아 사라지면서 지역 상권 기반까지 흔들리고 있다. 일본 패스트패션 브랜드 유니클로의 서울 엔터식스 상봉점은 18일을 마지막으로 폐점했다. 이날 문을 닫은 매장은 환불 장소와...
668,2020.02.25.,"대우건설, '이케아·스타필드·롯데몰'...대형 복합쇼핑몰 따라 분양 러시","서울 고덕과 인천 송도, 충남 계룡, 경남 창원 등으로 집 근처에서 쇼핑과 여가를 즐길 수 있는 ‘알짜’... 창원의 강남이라 불리는 성산구 핵심상권 입지로 백화점, 대형마트, 상남시장, 창원시청, 법원 등이 가깝다...."
669,2020.02.26.,"롯데마트, 내달 풀필먼트 스토어 시작…""주문 후 1시간내 배송""",3월말 서울 중계점과 경기도 수원 광교점에서 선보입니다. 풀필먼트(fulfillment)는 고객의 주문부터 상품... 기존 점포 기반 온라인 배송이 점포 반경 15km의 광역 상권을 기준으로 하고 원하는 시간대를 설정해 주문한...
670,2020.02.26.,"롯데마트, 내달 풀필먼트 스토어 시작…""주문 후 1시간내 배송""",3월말 서울 중계점과 경기도 수원 광교점에서 선보입니다. 풀필먼트(fulfillment)는 고객의 주문부터 상품... 기존 점포 기반 온라인 배송이 점포 반경 15km의 광역 상권을 기준으로 하고 원하는 시간대를 설정해 주문한...
671,2020.02.24.,"김원이 예비후보, 시민접촉 선거운동 전면중단, 코로나19 극복 동참","문재인 대통령은 지난 23일 정부서울청사에서 연 코로나19 범정부대책회의 발언을 통해 “정부는 감염병... 특히, 모든 선거운동 일정을 코로나19 여파로 침체된 골목상권과 자영업자 살리기를 통한 지역 경제 활기 찾기에..."
