,date,title,contents
1081,2021.02.10.,"스타필드 안성, 직결도로 전면 개통…‘접근성 강화’","또, 오산, 천안 등 광역 상권과의 접근성 역시 더욱 높아져 원거리의 고객들도 가까워진 스타필드 안성을 만나볼 수 있다. 직결도로는 서울 오산 방면에서 오는 안성IC 하행, 천안 방면에서 오는 상행 이용객 모두 진입..."
1082,2021.02.11.,與野 후보들 시장 찾고 봉사하고…설 민심 잡기 잰걸음,"골목상권을 살리고 서민의 삶을 지키는 그런 시장이 되겠다는 다짐을 한다. 신축년 새해 복 많이 받으세요""라고 적었다. 야권 후보들도 분주하게 움직였다. 안철수 국민의힘 대표는 이날 오전 설 연휴 첫 일정으로 서울역..."
1083,2021.02.09.,美 럭셔리 브랜드 '릭 오웬스' 신세계 강남점 오픈,"릭 오웬스 마케팅 담당자는 ""릭 오웬스는 자신만의 독창적이고 개성 있는 패션을 추구하는 2030 세대에게 꾸준히 좋은 반응을 얻고 있다”며 “더 많은 고객들이 브랜드를 경험할 수 있도록 서울 핵심 상권에 신규 매장을..."
1084,2021.02.23.,"광운대, 가장 '혁신적인 대학'으로 ICT 시너지 극대화",우선 국내 대학 중 유일하게 서울시 캠퍼스타 운 사업 '프로그램형'과 '종합형'에 동시 선정돼 총 130억원을... 지역 상권 침체 및 대학가의 고유한 청년문화 쇠퇴 문제 등을 해결할 예정이다. 학생당 창업지원액 및...
1085,2021.02.18.,"상업시설 분양시장 ‘활기’… 유림개발, ‘펜트힐 루 논현’ 분양","아울러 서울 지하철 7호선 학동역이 도보 3분 거리, 강남구청역 · 언주역 등은 도보 10분 거리에 위치해 있다. 아울러, ‘패션 · 뷰티’ 중심인 압구정 로데오 · 가로수길 상권은 물론, 피부과 · 성형외과 등이 밀집해..."
1086,2021.02.14.,명동상인 만난 안철수,서울시장 보궐선거에 출마하는 안철수 국민의당 대표가 14일 오전 서울 중구 명동 상권을 찾아 상인과 이야기를 나누고 있다.
1087,2021.02.14.,명동 찾은 안철수 대표,서울시장 보궐선거에 출마하는 안철수 국민의당 대표가 14일 오전 서울 중구 명동을 찾아 상권을 둘러보고 있다.
1088,2021.02.09.,"KT, 지난해 영업익 1조1841억·전년비 2.1%↑…연매출 감소",지난해 11월 오픈한 국내 최대 용량의 서울 용산 IDC는 예약률 70%를 달성했다. 클라우드 사업은 공공... 블록체인 매출은 신종 코로나바이러스 감염증(코로나19) 이후 지역상권 강화를 위한 지자체의 지역화폐...
1089,2021.02.14.,명동상권 둘러보는 안철수,서울시장 보궐선거에 출마하는 안철수 국민의당 대표가 14일 오전 서울 중구 명동을 찾아 상권을 둘러보고 있다.
1090,2021.02.19.,"마리오아울렛 홍성열 회장, '2021 한국소비자평가 최고의 브랜드 대상' 3년 연...",1990년대 말 외환위기로 서울 구로공단에서 매물이 쏟아져나오자 공단부지에 대규모 패션아울렛을 짓겠다는... 멈춰버린 공장지대에 세워졌던 마리오아울렛 주변은 하루 평균 유동인구 20~30만 명에 달하는 거대한 상권이...
1091,2021.02.16.,"나뚜루, 아이스크림 전문점 리뉴얼…'나뚜루 시그니처'로 개편","'나뚜루 시그니처' 1호점은 지난 15일 서울 강서구 마곡나루역 인근에서 개점했으며 내달 중으로 경북 포항에 2호점 오픈을 계획하고 있다. 나뚜루는 추후 '나뚜루 시그니처'를 중심으로 주요 상권에 매장을 확대, 자사..."
1092,2021.02.17.,사업진행 빠르고 탄탄한 인프라…도시개발사업 분양 ‘주목’,"김포도시철도를 통해 서울, 여의도로 빠르게 접근이 가능한 배후주거지이며, 김포 한강시네폴리스 사업도... 업무지구, 상권 등의 인프라 형성에 신중을 가하는 편”이라고 전했다. 이런 가운데 올 상반기 도시개발사업..."
1093,2021.02.18.,탄탄한 수요에 대형 키즈파크까지 더한 포레나 루원시티 단지 내 상가 분양,붐비는 상권 형성이 기대된다. 인천 2호선 가정역과 7호선 연장 루원시티역(예정)의 더블역세권을 편리하게 이용할 수 있는 사통팔달의 교통환경을 완비한 포레나 루원시티 단지 내 상가는 향후 서울지하철 7호선 청라...
1094,2021.02.17.,"부안형 푸드플랜, 생산 농가 기본 교육과 작부 체계 컨설팅 시작!","기존 로컬푸드는 상권이 협소하고, 생산 농가 확대의 한계 등 활성화에 어려움이 있었다. 부안군 푸드플랜은... 서울시와 도농공공급식상생협약을 맺는 등 추가적인 판로도 계속해서 확보하고 있다. 향후 전주 등에..."
1095,2021.02.14.,[포토]명동 찾은 안철수,"4·7 서울시장 보궐선거에 출마하는 안철수 국민의당 대표가 14일 오전 코로나19로 무너진 서울 중구 명동 상권을 방문, 지난 새벽에 화재가 발생한 한 화장품 가게를 살펴보고 있다. 방인권"
1096,2021.02.17.,정부 실수요자 요건 강화…'슬세권' 아파트 각광,지난해 7월 서울시 성북구 길음동 일대에 공급된 '길음역 롯데캐슬 트윈골드'(2024년 4월 입주 예정)도... 이 단지는 1호선 온천장역을 걸어서 이용할 수 있는데다 부산 주요 상권인 온천장 상권과 부산대 앞 상권을...
1097,2021.02.10.,코스트코 피하던 이마트 트레이더스…부산서 '한판 붙자' 도전장,"유통업계 한 관계자는 ""일산·하남 신도시 등 주요 상권에 트레이더스와 코스트코가 매장을 낸 적이... 롯데쇼핑은 2012년 서울 금천구에 빅마켓 1호점을 내며 창고형 할인점 사업을 시작했다. 이후 서울 도봉, 영등포..."
1098,2021.02.14.,코로나19로 무너진 명동 둘러보는 안철수,안철수 국민의당 대표가 14일 오전 서울 중구 명동을 찾아 코로나19로 무너진 명동 상권을 둘러보고 있다. 2021.2.14/뉴스1
1099,2021.02.04.,설 맞아 전통시장 주변도로 2시간 무료주차…내일부터 14일까지,"행정안전부와 경찰청은 설맞이 전통시장 활성화를 위해 이달 5일부터 14일까지 열흘 간 서울 경동시장 등... 골목상권에 도움이 되길 바란다""고 말했다. 행안부는 이 밖에도 지역경제의 활력 회복을 위해 1분기..."
1100,2021.02.16.,"롯데제과 나뚜루의 진화, 디저트 숍 '나뚜루 시그니처' 론칭","'나뚜루 시그니처' 1호점은 이달 15일 서울 강서구 마곡나루역 인근에서 개점했으며 내달 중으로 경북 포항에 2호점 오픈을 계획하고 있다. 나뚜루 관계자는 ""'나뚜루 시그니처'를 중심으로 주요 상권에 매장을 확대, 자사..."
1101,2021.02.04.,설 맞아 전통시장 주변도로 2시간 무료주차…내일부터 14일까지,"행정안전부와 경찰청은 설맞이 전통시장 활성화를 위해 이달 5일부터 14일까지 열흘 간 서울 경동시장 등... 골목상권에 도움이 되길 바란다""고 말했다. 행안부는 이 밖에도 지역경제의 활력 회복을 위해 1분기..."
1102,2021.02.17.,'섹션오피스 분양대전'…수도권 분양단지는?,오는 3월 서울 은평구에서는 '은평뉴타운 파크앤타워'가 분양에 나선다. ㈜파크앤홀딩스가 시행하고... 핵심상권인 대형복합시설 '롯데몰'과 은평성모병원·산업인력공단·소방학교(예정) 등 각종 기관과도 인접하다....
1103,2021.02.09.,"美 럭셔리 브랜드 ‘릭 오웬스’, 신세계百 강남에 입점",릭 오웬스 관계자는 “릭 오웬스는 자신만의 독창적이고 개성 있는 패션을 추구하는 2030 세대에게 꾸준히 좋은 반응을 얻고 있다”며 “더 많은 고객들이 브랜드를 경험할 수 있도록 서울 핵심 상권에 신규 매장을 열게...
1104,2021.02.16.,bhc 창고43 '프리미엄 간편식'으로 고객 공략 나선다,"오피스 상권 내 직장인들에게 인기이며, 특히 평일 점심 주문량이 높은 것으로 나타났다. 창고43 도시락은... 그랜드 인터컨티넨탈 서울 파르나스는 오는 4월까지 호텔 뷔페의 인기 메뉴들로 구성된 ‘그랜드 키친 홈..."
1105,2021.02.24.,충청권 광역철도 청주도심 통과해야,"신탄진~조치원~오송~청주 도심(시내)~오근장(청주공항) 광역철도, 세종청사~조치원(일반철도 신설, 서울... 이 지사는 청주~대전·세종 간 이동 시간 및 교통비 절감, KTX오송역 활성화, 청주 도시재생 효과 및 도시상권..."
1106,2021.02.17.,몸집 키우는 맘스터치… 업계 1위 맹추격,상권 등 틈새 시장을 공략했다. 이 곳에서 25~30평대 중소형 매장을 오픈하는 전략으로 가맹점주 비용 부담을 줄이면서 매장수 증가에 한 몫했다. 더욱이 그동안 지방을 중심으로 매장을 늘려왔기 때문에 최근 서울...
1107,2021.02.20.,'화성동탄1차 대방디엠시티' 풍부한 미래가치 예상,높은 임대료를 감내하면서도 광고효과와 상징성을 감안하여 이러한 대로변 상권에 입점한다고 한다. 경기... 향후 서울역~연신내~킨텍스~운정으로 노선이 연장될 예정이다. 동탄역은 GTX-A∙인덕원선 복선전철∙트램 등...
1108,2021.02.15.,시장도매인제 도입을 가로막는 정부와 '농피아',전 세계적인 코로나19 팬데믹 속에서 대기업부터 골목상권 자영업자들까지 생존을 위한 힘겨운 투쟁을... 청과 6개 도매시장법인 중 농협을 제외하면 서울청과는 고려제강이 지배주주다. 중앙청과는 태평양개발...
1109,2021.02.17.,"두 마리 토끼잡기,지방소멸 방지 전략","김현호 한국지방행정연구원 선임연구위원 2018년 미국 CNN 방송에 이런 퀴즈가 있었다.서울,베이징,도쿄,상해... 이제 인구감소로 대학까지 위기를 맞고 있고 지역상권도 활력을 잃고 있다.보육,요양 등 공공서비스도..."
1110,2021.02.17.,"두 마리 토끼잡기,지방소멸 방지 전략","김현호 한국지방행정연구원 선임연구위원 2018년 미국 CNN 방송에 이런 퀴즈가 있었다.서울,베이징,도쿄,상해... 이제 인구감소로 대학까지 위기를 맞고 있고 지역상권도 활력을 잃고 있다.보육,요양 등 공공서비스도..."
1111,2021.02.08.,"최대호 시장 ""행복이 넘치는 혁신도시로 나아가겠다""","최대호 안양시장[수원=스포츠서울 좌승훈 기자]최대호 안양시장은 8일 온라인 신년기자회견을 통해 스마트... ‘공공배달앱’도입,‘특화상권’육성,‘온라인 동네시장 장보기’등도 진행한다. △안전하고 편리한..."
1112,2021.02.08.,"마포구, 설 연휴 공영주차장 무료","서울 마포구(구청장 유동균)는 설 연휴 중 관내 25개 공영주차장 사용료를 받지 않는다고 8일 밝혔다. 대상... 구는 “연휴 중 고향 방문을 자제해야 하는 구민을 위로하고, 침체한 지역경제와 상권 활성화에 도움이 되기를..."
1113,2021.02.14.,명동 상가 둘러보는 안철수,서울시장 보궐선거에 출마하는 안철수 국민의당 대표가 14일 오전 서울 중구 명동을 찾아 상권을 둘러보고 있다.
1114,2021.02.17.,도시개발사업으로 공급 나서는 단지 눈길,"김포도시철도를 통해 서울, 여의도로 빠르게 접근이 가능한 배후주거지이며, 김포 한강시네폴리스 사업도... 업무지구, 상권 등의 인프라 형성에 신중을 가하는 편""이라고 전했다. 이러한 가운데, 올 상반기 도시개발사업..."
1115,2021.02.22.,"[자영업자 상생 파트너 은행 ③] 지성규 하나은행장, 소상공인 비대면 대출혁...","올해는 당행, 지자체, 민간기업과 소상공인 지원 및 지역상권활성화를 위해 지역신용보증재단에 함께... 하나은행은 작년 7월 경기보증재단을 시작으로 서울보증재단과 협약해 비대면 보증재단보증서 담보대출..."
1116,2021.02.24.,[부동산 특집] '은평뉴타운 파크앤타워' 분양,"'파크앤타워'는 지하철 3호선 구파발역과 도보 3분 거리인 역세권으로, 서울 중심부로의 이동이 수월하다. 일대 핵심상권인 대형복합시설 '롯데몰'이 가깝고, 은평성모병원·산업인력공단·소방학교(예정) 등이 인접해..."
1117,2021.02.16.,"레스토랑 간편식 확대… 유통·외식업계, 프리미엄 도시락으로 고객 공략","오피스 상권 내 직장인들에게 인기이며, 특히 평일 점심 주문량이 높은 것으로 나타났다. 창고43 도시락은... 그랜드 인터컨티넨탈 서울 파르나스는 오는 4월까지 호텔 뷔페의 인기 메뉴들로 구성된 ‘그랜드 키친 홈..."
1118,2021.02.04.,"용인시, 474억 원 투입 소상공인 등 핀셋 지원",백군기 용인시장[용인=스포츠서울 좌승훈 기자]경기 용인시는 코로나19 3차 확산으로 피해가 가중된... 골목상권에 활력을 불어넣기 위해 용인와이페이의 월 50만원까지 10% 상시할인율을 연말까지 적용하며 특히 설을...
1119,2021.02.22.,[데스크 칼럼] 3기 신도시에 가장 필요한 게 무엇인지는 GTX가 말해주고 있다,"춘천의 상권이 무너질 것으로 예상했다. 하지만 두 가지 교통 호재는 현재 춘천 인구를 지탱해주는 중요한 요소가 되고 있다. 대학가 인근에 자취생이나 하숙생이 줄어들긴 했지만, 반대로 서울에서 춘천으로 이동하는..."
1120,2021.02.15.,"코오롱글로벌, 광진구 ‘자양 하늘채 베르’ 분양","코오롱글로벌이 이달 중 서울 광진구 자양동에서 다세권 프리미엄 단지인 ‘자양 하늘채 베르’를... 학군도 우수하며, 건대입구를 비롯한 상권도 잘 발달돼 있다. ‘자양 하늘채 베르’는 도보거리에 2호선 구의역이..."
1121,2021.02.19.,인천검단 상업의 중심지에 ‘인천검단 서영아너시티 플러스’ 금일 견본주택 ...,"중심상권으로 거듭날 것이라는 분석이다. 상업시설의 경우 같은 건물 상층부에 위치한 107실의 오피스... 단지의 섹션오피스는 앞서 언급된 인천 지하철 1호선 검단역(가칭)이 신설과 GTX-D 노선 개발, 서울지하철..."
1122,2021.02.07.,대통령 꿈꾸던 재계 거물... 청와대가 주저앉힌 이유,"1992년 1월 23일 ROTC(학군사관) 1기생 모임인 서울클럽에서 발언한 바와 같이, 박태준은 1980년이 아닌 1990년을... &lt;노태우 회고록 상권&gt;에 이런 대목이 있다. 나는 김대중·김영삼·김종필 3당 총재를 청와대에 초청해 개별..."
1123,2021.02.09.,"""플랫폼사업 급성장"" KT, 지난해 영업익 1.2조...전년比 2.1%↑","지난해 11월 오픈한 국내 최대 용량의 서울 용산 IDC는 이미 예약률 70%를 달성했고, 클라우드 사업도... 블록체인 매출은 코로나19 이후 지역상권 강화를 위한 지자체의 지역화폐 발행량이 증가하면서 2019년 대비..."
1124,2021.02.10.,"관악구, 상반기 중기육성기금 30억 조기 지원","관악구청지점과 서울신용보증재단 관악지점에서 부동산 및 신용보증 담보평가액을 사전 상담 후, 신청서와 사업계획서, 사업자등록증, 최근 3년 부가가치세 과세표준증명원 등을 첨부해 구청 지역상권활성화과로..."
1125,2021.02.16.,"나뚜루, 디저트 숍 '나뚜루 시그니처' 새로 선보인다","‘나뚜루 시그니처’ 1호점은 전날 서울 강서구 마곡나루역 인근에서 개점했으며 내달 중으로 경북 포항에 2호점 오픈을 계획하고 있다. 나뚜루 관계자는 ""추후 ‘나뚜루 시그니처’를 중심으로 주요 상권에 매장을..."
1126,2021.02.10.,'코로나 1년'…시민 이동 급감에 오프라인 상권 타격 컸다,"서울시 발달상권 32개소를 대상으로 전년도 매출액을 1로 가정하고 주요 상권별 평균 매출액을 산출한 결과, 관광상권(이태원, 인사동 등)과 대학상권(홍대, 이대 등)의 매출 타격이 상대적으로 컸다. 반면 문정역 등..."
1127,2021.02.10.,안성IC에서 스타필드 주차장까지 한 번에… 직결도로 개통,"직결도로는 서울~오산 방면에서 오는 안성IC 하행, 천안 방면에서 오는 상행 이용객 모두 진입 가능하다.... 오산이나 천안 등 광역 상권과의 접근성이 높아져 원거리의 고객들도 가까워진 스타필드 안성을 만나볼 수 있다...."
1128,2021.02.18.,용인반도체클러스터 본격화로 눈길 끄는 '힐스테이트 용인 둔전역',"산업단지가 조성되면 대규모 일자리 창출로 주택수요가 꾸준하게 형성되며 교통, 상권, 학군 등 인프라... 단지 주변으로 서울~세종 고속도로와 수도권제2순환고속도로 등이 계획돼 있어 개통 시 주변 지역으로의..."
1129,2021.02.22.,신세계 강남점 2년연속 ‘2조클럽’…정유경의 ‘지역 1번점’ 전략 순황,‘더현대서울’을 오픈하면서 새로운 10년을 향한 발걸음을 시작하고 신세계는 2년 연속 매출 2조원을... 광역상권을 기반으로 한 대형점포는 전년보다 오히려 매출이 늘며 실적 회복을 견인했다. 특히 주 소비층으로...
1130,2021.02.16.,"롯데제과 나뚜루, 아이스크림 전문점 사업 브랜드 리뉴얼... 디저트 카페 변신","‘나뚜루 시그니처’ 1호점은 이달 15일 서울 강서구 마곡나루역 인근에서 개점했으며 내달 중으로 경북 포항에 2호점 오픈을 계획하고 있다. 나뚜루는 추후 ‘나뚜루 시그니처’를 중심으로 주요 상권에 매장을 확대, 자사..."
1131,2021.02.19.,"홍성열 마리오아울렛 회장, '2021 한국소비자평가 최고의 브랜드 대상' 아울렛...",1990년대 말 외환위기로 서울 구로공단에서 매물이 쏟아져나오자 공단부지에 대규모 패션아울렛을 짓겠다는... 멈춰버린 공장지대에 세워졌던 마리오아울렛 주변은 하루 평균 유동인구 20~30만 명에 달하는 거대한 상권이...
1132,2021.02.08.,"박차훈 새마을금고 회장 ""지역상생 추진...리스크관리 시스템 운용""",박 회장은 이날 서울 강남구에 위치한 새마을금고 중앙본부에서 회의를 열고 “올해 경영목표의 중심에는... 이날 박 회장은 신종 코로나 바이러스 감염증(코로나19)로 심각한 위기를 겪고 있는 골목상권 현황에 대한...
1133,2021.02.17.,"예술가에겐 일감, 가게엔 대박 예감… 관악 아트테리어 사업, 참 예술이네",골목상권에 단돈 1원이라도 도움이 된다면 뭐든 하고 싶은 마음입니다.”(박준희 관악구청장) 서울 관악구 행운동의 한 도자기 공방. 과거 노후 철제벽면이 그대로 드러나고 간판도 없던 곳이 지난달 감각적인 공방으로...
1134,2021.02.15.,오세훈·나경원 '상암行'…금태섭 장애인단체 간담회,"안철수 국민의당 대표가 14일 오전 서울 중구 명동을 찾아 코로나19로 무너진 명동 상권을 둘러 본 뒤, 취재진의 질문에 답하고 있다.(사진=국회사진기자단)안 대표는 이날 오전 9시 국회 본청에서 최고위원회의에..."
1135,2021.02.16.,"유림개발, 강남 학동역 인근 ‘펜트힐 루 논현’ 분양","학동역 상권의 경우, 서울 지하철 7호선 학동역을 중심으로 각종 근린생활시설이 밀집해, 연중무휴 사람들로 붐비는 발달상권으로 평가된다. 이밖에도 압구정 로데오거리 ? 청담동 명품거리 ? 신사동 가로수길 등 강남..."
1136,2021.02.19.,"용인의 허파, 대형 공원 품은 '용인 드마크 데시앙' 분양 예정","특히 신설되는 GTX-A노선(예정)과 서울-세종고속도로(예정)가 개통되면 서울 및 수도권 접근성이 더욱 개선될 전망이다. 여기에 지역 핵심 로데오거리 상권과 함께 고림지구, 역북지구가 인접해 있는 것도 강점이다. 또한..."
1137,2021.02.17.,울산 신규 아파트 분양가 '고공행진',"같은 기간 서울은 5.48%, 부산은 9.53%, 상승했으며, 대전은 11.74% 하락했다. 전국평균 변동률은 8.85%다.... 젊음의거리 상권, 뉴코아 아울렛, 현대백화점, 홈플러스,롯데마트 쇼핑시설과 울산시청, 울산병원 등의..."
1138,2021.02.05.,[뉴스터치] 오늘부터 전국 전통시장 주변 주차 허용,"이달 10일까지 서울 시내 전통시장에서는 설 제수용품과 농축산물을 최대 50% 할인된 가격으로 판매하고... ◀ 앵커 ▶ 네, 전통시장 주변도로 주차 허용이 지역골목상권에 도움이 됐으면 좋겠습니다. ◀ 나경철 아나운서..."
1139,2021.02.18.,"코로나 시기, 중구 생활인구 크게 줄고 강동·은평은 늘어나","서울시 발달상권 32곳에서 매출액이 증감한 패턴을 분석해보면, 상권별 경제 충격 정도가 다른 것으로 나타났다. 전년도 매출액을 1로 가정해 주요 상권별 평균 매출액을 산출한 결과, 관광 상권(이태원, 인사동 등)과..."
1140,2021.02.18.,"코로나 시기, 중구 생활인구 크게 줄고 강동·은평은 늘어나","서울시 발달상권 32곳에서 매출액이 증감한 패턴을 분석해보면, 상권별 경제 충격 정도가 다른 것으로 나타났다. 전년도 매출액을 1로 가정해 주요 상권별 평균 매출액을 산출한 결과, 관광 상권(이태원, 인사동 등)과..."
1141,2021.02.18.,"양천구, 청년 디지털 서포터즈 활약에 골목상권 ‘웃음 활짝’",골목상권 ‘사장님’들 이마에는 주름살도 늘어났다. 그렇다고 손 놓고 있을 수만은 없는 노릇이었다. 대면... 구는 지난해 12월 소상공인의 디지털 영업 환경 구축을 돕기 위해 서울시 제로배달 유니온 참여 배달업체...
1142,2021.02.20.,"부동산 시장을 이끄는 고급주거문화 바람, '루시아도산208' 하이엔드 주거상품...","서울 강남 도산대로변은 국내 경제의 중심지로, 명실상부 부촌 1번지로 평가된다. 고급 주택이 밀집해 있고, 상권 발달에 따른 생활 인프라가 잘 갖춰져 있어 고소득 수요층 사이에서 선호도가 높다. 이러한 장점 덕에 정..."
1143,2021.02.14.,보궐선거 본격 경쟁 앞두고...여당은 '견제'·야당은 '삐걱',[오세훈 / 전 서울시장 : 청년 월세지원 확대입니다. 지금 연간 5천 명 지원하는 것을 10배로 늘려서….] 안철수 국민의당 대표는 명동 상권을 찾아 민심 달래기에 나섰습니다. [안철수 / 국민의당 대표 : 주먹구구식이 아니라...
1144,2021.02.04.,5일부터 전국 전통시장 주변 도로 주차 허용,행정안전부와 경찰청은 설맞이 전통시장 활성화 등을 위해 이달 5일부터 14일까지 열흘 간 서울 경동시장... 구본근 행정안전부 지역경제지원관은 “전통시장 주변도로 주차 허용이 지역골목상권에 도움이 되길...
1145,2021.02.17.,"중기부 ""여러 사업체 운영해도 재난지원금 각각 지급…매출 한도 4억 이상으로...","권칠승 중소벤처기업부 장관은 지난 16일 정부서울청사 브리핑룸에서 새해 업무계획을 밝히면서 ""당정이... 하나의 상권에 디지털 특화 거리와 온라인 판매 시스템 등을 종합적으로 지원하는 '디지털 상권 르네상스'도..."
1146,2021.02.16.,나뚜루 아이스크림 전문점 전면 개편...디저트 숍 ‘나뚜루 시그니처’ 론칭,‘나뚜루 시그니처’ 1호점은 이달 15일 서울 강서구 마곡나루역 인근에서 개점했으며 내달 중으로 경북 포항에 2호점 오픈을 계획하고 있다. 나뚜루는 추후 ‘나뚜루 시그니처’를 중심으로 주요 상권에 매장을 확대...
1147,2021.02.18.,산업단지 수혜 누리는 직주근접 아파트 ‘용인 드마크 데시앙’ 분양,"특히 신설되는 GTX-A노선(예정)과 서울-세종고속도로(예정)가 개통되면 서울 및 수도권 접근성이 더욱 개선될 전망이다. 용인 드마크 데시앙은 지역 핵심 로데오거리 상권과 함께 고림지구, 역북지구가 인접해 이들..."
1148,2021.02.14.,"""생활밀착형 복지 힘써 코로나 파고 넘겠다""","14일 서울경제신문과 만나 “참여와 소통, 현장 중심의 행정으로 행복공동체를 만들겠다”며 이같이... 엄 시장은 “이천사랑 지역화폐를 지난해보다 3배 늘어난 300억원을 목표로 발행해 골목상권의 미세 혈관까지 온기가..."
1149,2021.02.09.,"이종석, ‘똑똑한 빌딩 재테크’는 계속",부동산업계에 따르면 이종석은 2018년 3월 매입한 서울 용산구 한남동 꼬마 빌딩을 지난달 8일 매도했다.... 이종석이 매도한 꼬마 빌딩은 한남더힐 인근 상권에 있다. 한남동 자체의 특수성으로 인해 입지 조건은...
