,date,title,contents
538,2021.02.24.,"현대백화점, 적극적인 외형 확장 지속-IBK투자증권","이어 “여기에 여의도는 서울 3대 상권으로 1일 유동인구 30만명, 3Km 내에 144만명 거주 5Km내에 5개 뉴타운 개발로 기존 3만 세대에서 5만9000세대로의 확장성을 고려한다면 판교 이상의 모멘텀을 가지고 있는..."
539,2021.02.26.,공실률 낮은 부평서 섹션오피스 'e편한세상 시티 부평역' 분양,노선이 개통되면 부평역(예정)에서 여의도역까지 10분대 이동이 가능해지는 등 서울 도심으로 이동이 더욱 편리해질 전망이다. 대규모 상권이 모여있는 부평역 인근에 위치해 있어 롯데마트와 부평역 지하상가 쇼핑몰...
540,2021.02.24.,"""벚꽃 피는 순서대로 망한다"" 7등급도 '지거국' 합격…'정원 미달' 위기 지방...","2024년까지 서울·인천·경기 외 지역의 지방대학 220곳 중 신입생 정원의 70%를 못 채우는 학교가 85곳에 이를 것""이라고 지적했다. 이어 ""특히 지방대는 수입을 등록금에 의존하는 면이 크고, 지역 상권에도 지대한 영향을..."
541,2021.02.22.,"SK가 선택한 공유킥보드 씽씽, 전국 140곳서 달린다",서울에서 주로 이용했던 공유 킥보드 '씽씽'을 올해 스마트시티를 포함해 전국 140여 곳에서 이용할 수 있게... 면밀한 상권 분석과 사업자 면담을 통해 우선 40개 지역을 선정했다고 설명했다. 씽씽은 연내 100개 지역에...
542,2021.02.25.,"GS25, 주류 스마트오더 시스템 '와인25플러스' 1호점 오픈","사진제공=GS리테일  GS리테일이 운영하는 편의점 GS25는 25일 서울시 강남구 역삼동에 위치한 GS25... 시간대별 주문건수는 점심시간인 오후 12시와 1시 사이, 오후 8시부터 10시 사이에 급증했으며 주택가와 오피스상권에..."
543,2021.02.23.,"현대百, 여의도에 ‘자연 담은 백화점’ 연다…내년 매출 7천억 목표","현대백화점은 입지적 강점과 편리한 교통망 등을 바탕으로 반경 3km 내 핵심 상권인 서울 영등포구·동작구·마포구·용산구는 물론, 서울 및 수도권 전 지역 고객까지 적극 유치하겠다는 전략이다. 이를 감안할 때..."
544,2021.02.17.,을지로 지하도-청계천 대림상가 지하통로 개통,"9월에는 세운상가 일대 1km '공중보행길' 완성 서울시는 을지로 지하도와 청계천 대림상가를 연결하는 지하... 지역 상권에도 큰 활력이 찾아오기를 기대한다""고 말했다. 시는 지하 연결통로 개통에 맞춰 출입구인..."
545,2021.02.22.,"[포토] 양천구, '청년 디지털 서포터즈' 위촉","‘청년 디지털 서포터즈’는 2021년 서울형 뉴딜일자리사업을 통해 민간취업과 연계되는 청년 일자리창출과... 양천구는 올해에도 관내 생활상권, 골목상권 소재 소상공인 120개소를 대상으로 서포터즈를 전담 배정하여..."
546,2021.02.24.,"강서구, 발산역 먹자골목 보행환경 개선",(사진제공=강서구청)  서울 강서구(구청장 노현송) 발산역 먹자골목 일대 생활도로가 보행자를 위한... 이번 사업은 먹자골목 생활도로의 열악한 보행환경을 개선해 보행자 안전을 확보하고 주변 상권도 활성화하기...
547,2021.02.24.,"안철수 ""문 대통령, 후보시절 '동성애 좋아하지 않는다' 말해…심한 혐오발언...","안 후보는 ""이태원이 할로윈 파티의 성지가 돼 있는 것처럼 서울에서 상징성 있는 곳을 찾아 그곳에서 (퀴어축제) 전통을 만들면 외국인도 찾아올 수 있고 상권 활성화에도 도움 되고 좋은 방법 아니겠는가""라며 제안했다...."
548,2021.02.22.,"SGC이테크건설, 3월 ‘가양역 더리브 아너비즈타워’ 분양",입지인 서울 강서구 등촌동 629-1번지 일대에서 ‘가양역 더리브 아너비즈타워(조감도)’를 분양한다고 22일... 반경 1㎞ 권역 내 아파트 및 주거형 오피스텔 1만4473여 가구가 밀집해 외부 수요 흡수를 통한 상권 활성화도...
549,2021.02.21.,올해 서울 첫 분양 '자양 하늘채 베르' 평당 분양가 2580만원,주변 건대입구 상권 이용이 편리하며 학교는 자양초·광양중·광양고·건국대·세종대·한양대 등이 가깝다. 분양회사 관계자는 “현재 서울에서 20평 기준으로 4억~5억원대 아파트는 찾아볼 수 없지 않느냐”며...
550,2021.02.22.,"SGC이테크건설, 3월 ‘가양역 더리브 아너비즈타워’ 분양",입지인 서울 강서구 등촌동 629-1번지 일대에서 ‘가양역 더리브 아너비즈타워(조감도)’를 분양한다고 22일... 반경 1㎞ 권역 내 아파트 및 주거형 오피스텔 1만4473여 가구가 밀집해 외부 수요 흡수를 통한 상권 활성화도...
551,2021.02.21.,올해 서울 첫 분양 '자양 하늘채 베르' 평당 분양가 2580만원,주변 건대입구 상권 이용이 편리하며 학교는 자양초·광양중·광양고·건국대·세종대·한양대 등이 가깝다. 분양회사 관계자는 “현재 서울에서 20평 기준으로 4억~5억원대 아파트는 찾아볼 수 없지 않느냐”며...
552,2021.02.26.,"""제로금리 시대"" 소형 오피스텔 ‘e편한세상 시티 부평역’ 분양","노선이 개통되면 부평역(예정)에서 여의도역까지 10분대 이동이 가능해지는 등 서울 도심으로 이동이 더욱 편리해질 전망이다.   이 밖에 대규모 상권이 모여 있는 부평역 인근에 위치해 있어 롯데마트, 부평역..."
553,2021.02.25.,공유주방 개러지키친 부산 진출 확장 전국구 사업 본격화,"개러지키친은 2019년, 2020년 공유주방 업계 최초로 시도한 서울 수도권 지점인 하남미사점, 광명신도시점... 해운대 반여점의 주 배달 가능 상권인 반여동 및 재송동은 2019년 통계청 자료 기준 인구 평균 연령이 39세로..."
554,2021.02.24.,"발산역 먹자골목, 보행친화거리로 탈바꿈",서울 강서구(구청장 노현송)는 발산역 먹자골목 일대 '보행환경개선사업'을 마무리했다고 밝혔다. 먹자골목 생활도로의 열악한 보행환경을 개선하여 보행자 안전을 확보하고 주변 상권도 활성화하기 위한 취지다....
555,2021.02.24.,"포스트 코로나 다시 컨택트 시대로…""1위 유통 브랜드만 생존""",서울의 6대 상권으로 꼽히는 명동·강남역·가로수길·홍대·이태원·청담 상권의 경우 주요 상권인 대로의 안쪽 골목이나 건물 사이에 새로운 편집숍이나 식당 등이 들어서는 식이다. 이전에는 상권이라고 생각하지 않았던...
556,2021.02.25.,"'인천점' 잃은 신세계, '신도심'서 화려한 복귀 노린다","25일 관련 업계에 따르면 신세계는 최근 송도와 청라 등 인천 신도심을 중심으로 인천상권 복귀 시나리오를... 포화상태인 서울, 경기와 달리 성장 가능성이 남아있다. 신세계가 '인천 유통가 맹주'로서의 지위를..."
557,2021.02.23.,"할리스커피, KG그룹 가족사 된 후 첫 창업설명회 개최",KG그룹의 가족사가 된 이후 처음으로 진행하는 창업설명회는 오는 3월 3일 오후 1시 서울 중구 KG타워 지하 1층... 참석자 전원에게 후보 매장 상권분석 및 출점 예정지를 소개하며 개별 상담시간을 별도로 운영한다....
558,2021.02.24.,[여기는 강릉] 강릉역 이용객 급증…역세권 개발 언제부터?,"[김철기/강릉시 특구개발과장 : ""주변에 공원도 형성되면서 종합상권이 형성될 수 있는 그런 부분들로... 게다가 2025년부터 여주~원주, 수서~광주 구간 등이 신설되면 서울 경기 남부권 관광객이 강릉역을 대거 이용하게..."
559,2021.02.22.,지역화폐 여민전'역외유출 막았다,"세종시민의 역외소비 지역은 1위 서울(하나 47%, 농협 42%), 2위 대전(하나 25%, 농협 16%) 순이었다.... 지역화폐는 백화점이나 대형마트에서는 사용이 불가능하고 동네 상점이나 골목상권에서 사용하여 골목상권..."
560,2021.02.23.,경기도립대학·공영방송·연수원 추진…'공공의료'도 강화한다,"/경기도의회 제공 道 특성맞춤 정책개발·인재양성'광역버스 분담률' 등 정부 압박'서울 철도직결 거부' 철회... 골목상권 활성화, 평화와 번영의 시대, 도민 정체성 제고, 의회 조직 혁신 등을 위해 대담하게 걸어가겠다""고..."
561,2021.02.24.,"GS25, '자율분쟁조정위원회' 발족...""경영주와 상생 강화""","GS25는 24일 서울시 강남구에 위치한 GS타워에서 경영주-본부 간 신뢰 구축과 동반성장 강화를 위한 ‘GS25... 가맹계약 관련 필수서류 미제공, 허위ž과장 정보 제공, 계약 체결 전 지역 상권 정보 부실 제공 등 가맹사업..."
562,2021.02.22.,"씽씽, 올해 공유 킥보드 지역진출 100곳 더 늘린다","이로써 씽씽은 서울을 포함해 인천, 대전, 대구, 울산, 광주, 부산 등 지방 6대 광역시에 모두 진출한 유일한... 최근까지 500명이 넘는 씽씽 지역사업 희망자가 몰렸으며, 이 중 면밀한 상권 분석과 사업자 면담을 통해..."
563,2021.02.18.,을지로3가 제9지구 재개발 본격화..을지로감성 담는다,"서울시 중구 을지로3가 제9지구의 도시형재개발이 본격화된다. 18일 서울시는 제2차도시계획위원회를 개최해... 기능들이 공존하는 공간으로서 을지로일대 지역상권 활성화에 큰 역할을 하게 될 것으로 기대된다""고 밝혔다."
564,2021.02.27.,"강남역 상권에 들어서는 '르피에드강남' 상업시설, 주택 규제로 주목",르피에드 강남 상업시설은 총 27실로 구성되어 있으며 강남역사거리 입지로 서울에서 가장 활동적인... 여기에 경부고속도로 서울 구간(한남IC~양재IC) 약 6.4km 구간을 지하화하고 상부를 공원으로 조성하는 초대형...
565,2021.02.20.,강원도 속살 보여줄 7개 관광도로 조성,"앞서 강릉 KTX와 서울~양양고속도로가 잇따라 개통되면서 국도와 지방도 교통량이 급감하고 일대 상권이 침체된 상황이다. 최문순 강원지사는 ""강원 관광도로는 우수한 자연경관과 지역 역사·문화 유산을 연결시키는..."
566,2021.02.17.,"아모레, ‘이태원 화장실’ 리모델링 나선 이유는",실제 아모레퍼시픽은 지역 상권과 함께하는 사회공헌활동을 진행하고 있다. 2019년에는 ‘우리 가게 전담 디자이너’라는 사업으로 서울 용산구 남영동의 가게들을 리모델링 한 바 있다. 가게를 새롭게 디자인해 사람들이...
567,2021.02.26.,"""브랜드 효과 기대""…'e편한세상 울산역 어반스퀘어' 3월 분양","아파트 가격에 영향을 미치는 요인들이 많지만, 교통·상권·교육 등 여러 기반시설들이 비슷한데도... KTX 울산역을 걸어서 이용할 수 있어 이를 통해 대전역과 서울역까지 각각 1시간대, 2시간대로 이동할 수 있다...."
568,2021.02.23.,이름없는 건물에 지역특색 살린 이름 붙여드립니다,"금천구, 관내 집합건축물 중 명칭 없는 건물에 이름 부여 서울 금천구가 공동주택이나 근린생활시설을... 건물명으로는 지역특색을 살릴 수 있는 ‘문화재’, ‘특화거리 및 상권명칭, 도로명’, ‘지리적 특성’ 등을..."
569,2021.02.26.,"1인 소자본창업 아이템, 수제두부 체인점 '두만사'...로컬 상권 공략 주효","서울 삼성동 코엑스에서는 어제부터 오는 27일까지 '제59회 프랜차이즈 박람회'가 개최되고 있다. 지난해와... 관계자에 따르면, 지난해 초 코로나19 발생 시점에 본격적인 가맹사업을 전개했음에도 로컬 상권에 특화된 1인..."
570,2021.02.19.,"양천구, 불법 주정차 단속 일시 완화 종료",서울 양천구(구청장 김수영)는 3월부터 차량통행과 보행자의 안전을 위해 불법 주정차 차량을... 구는 신종 코로나바이러스 감염증(코로나19) 확산으로 침체된 지역 경기회복과 상권 활성화를 도모하기 위해 지난해...
571,2021.02.25.,"GS25, 온·오프라인 경계 허문다...‘와인25플러스 O4O 매장’ 오픈","편의점 GS25는 25일 서울시 강남구 역삼동에 위치한 GS25 역삼홍인점을 ‘와인25플러스... 시간대별 주문건수는 점심시간인 오후 12시와 1시 사이, 오후 8시부터 10시 사이에 급증했으며 주택가와 오피스상권에..."
572,2021.02.22.,"정부도 '복합쇼핑몰 영업제한'에 동의···당정, 유통규제 '시동'","야권에서는 유통업계 영업 제한 대상을 과도하게 확장할 경우, 복합쇼핑몰 주변 상권에까지 악영향을 미칠... 초고수는 지금]▶ 모르면 손해! 금융맨들의 속사정[발칙한 금융]▶ 네이버 채널에서 '서울경제' 구독해주세요!"
573,2021.02.19.,"루시아 도산 208, 강남 한복판에 하이엔드 주거시설",선봬 서울 강남 도산대로 한복판에 고소득 수요층을 겨냥한 맞춤형 주거상품이 공급돼 눈길을 끈다.... 고급주택이 밀집해 있고 상권 발달에 따른 생활 인프라가 잘 갖춰져 있는 게 장점이다. 또 업무 밀집지역이 조성돼...
574,2021.02.24.,넘치는 시장 유동성에…상업시설 '반사이익',신종 코로나바이러스 감염증(코로나19) 확산으로 야기됐던 상권침체 우려가 완화된 것이다. 다만 지역별... 먼저 현대엔지니어링은 서울 강남구 역삼동 일원에 '원에디션 강남'을 분양 중이다. 해당 상업시설은 과거...
575,2021.02.25.,"DL이앤씨, 'e편한세상 거제 유로스카이' 분양",핵심 상권으로 주목받고 있다. e편한세상 거제 유로스카이와 유로아일랜드는 그 중심의 대규모 브랜드... 예정으로 서울과의 거리를 2시간대로 좁히게 된다. 또한 최근에는 김해신공항 건설사업까지 전면 재검토되는...
576,2021.02.17.,"권영세 ""코로나 등 감염병 발생 시 지방세 감면"" 법안 발의",권영세 국민의힘 의원(서울 용산구)은 이날 이같은 내용을 담은 지방세특례제한법 개정안을 대표 발의했다.... 실제 이태원·홍대·강남 등 주로 9시 이후 영업이 활발한 일명 ‘나이트라이프’ 상권의 식당이나...
577,2021.02.20.,“학생들이 없는데 무슨 장사” 텅빈 거리엔 한숨만,서울 홍익대 주변에서 작은 커피숍을 하는 최모 씨(48)는 “결국 대학가 상권은 대학 정책이 어떻게 결정되느냐에 영향을 받을 수밖에 없다”며 “학생들이 대학에 오지 않아 분위기가 살지 않으면 결국 다른 유동인구의...
578,2021.02.25.,판 커진 백화점 '영등포 대전'…고소득 직장인 vs MZ세대 '누가 더 세나',같은 영등포구지만 더현대 서울과 롯데·신세계백화점이 위치한 지역은 전혀 다른 상권과 소비계층이 형성돼 있다. 더현대 서울이 입성하기 전 영등포에는 롯데백화점 영등포점과 신세계백화점 타임스퀘어점이 일찌감치...
579,2021.02.22.,"공유 킥보드 씽씽, 올해 지역진출 100곳 더 늘린다","22일 씽씽에 따르면, 지난 7월, 공개 모집을 통해 지역운영사업에 나서자, 500명이 넘는 씽씽 지역사업 희망자가 몰렸으며, 이 중 면밀한 상권 분석과 사업자 면담을 통해 40개 지역을 성공적으로 오픈, 안착시켰다. 서울을..."
580,2021.02.25.,화성시 청소년 무상교통 정책에 바라는 두 가지 제언,"화성시는 서울특별시보다 큰 면적을 가진 도시다. 그만큼 동서로 넓게 펼쳐진 도시이다. 하지만 도시 내... 지역상권을 활성화하기 위한 목적도 있으므로 지역화폐 카드로 지급한다'라고 밝히고 있다. 더욱이, 화성시..."
581,2021.02.26.,잇따른 주택시장 규제... 규제 영향 덜한 상업시설 주목,"만큼, 상권확장성도 높게 점쳐진다. 조성 완료 시 모객효과 증대에 따른 시너지 등 인근 상업시설에도... 공항철도 청라국제도시역이 도보 10분 거리에 위치해 있고, 청라국제도시역은 향후 서울 지하철 7호선 및 9호선..."
582,2021.02.26.,[풀뿌리상권 살려내자] 남도의 맛과 문화의 콜라보 `전주 남부시장`,"매년 1000만명 이상의 사람들이 찾는 전주 한옥마을부터 성당,고택 스테이,수목원 등 유명 모바일 온누리상품권으로 10%할인도 받을 수 있어 서울에서 KTX로 1시간 30분.전라북도에 위치한 전주는 매년 1000만명 이상의..."
583,2021.02.27.,"오아시스비즈니스, 현대건설과 업무협약. 창업 시장 발전 위한 협력",창업 비교 견적 플랫폼 스타트업 ㈜오아시스 비즈니스와 현대건설이 23일 서울 종로구 현대건설 사옥에서... 오아시스 비즈니스 측은 이날 “오아시스 비즈니스가 개발한 AI 기반의 상권분석 알고리즘을 토대로 상호 사업...
584,2021.02.26.,최근 주거시설 트렌드... 이사 걱정 없는 '풀퍼니시드',"이밖에 김포국제공항이 가깝고, 공항을 중심으로 남부순환도로 ∙ 서울외곽순환도로 ∙ 88도로 등 도로 교통망 또한 잘 구축돼 있다. 생활환경도 눈여겨볼 만하다. 역세권을 중심으로 상권이 잘 발달돼 있고..."
585,2021.02.23.,"박근철 경기도의회 민주당 대표의원 ""더 큰 경기도 만들 터""","또 서울시와의 연계를 위한 교통망 구축이 아닌 도민중심의 교통체계 구축도 강조했다. 도민중심의 교통체계... 박 대표의원은 “기본 관행에 안주하지 않고, 재난기본소득, 진정한 지방자치 실현, 소상공인 및 골목상권..."
586,2021.02.26.,"치킨매니아, 소자본 치킨창업 지원혜택 강화","전문 SV파견으로 매출증대를 지원하며, 서울, 지방상권에 관계 없이 철저한 사후관리도 강점으로 꼽힌다. 관계자는 “치킨매니아의 SNS 상에서의 인기와 다양한 혜택이 이어지면서 창업 문의가 쇄도하고 있다”며..."
587,2021.02.19.,도산대로변 고급주거시설 '루시아 도산 208' 3월 분양,"19일 분양업계에 따르면 서울 강남구 논현동 을지병원 사거리에 들어서는 '루시아 도산 208'은 지하 6층~지상... 사업지 인근에 압구정 로데오거리와 신사동 가로수길, 청담동 명품거리 등 상권이 있고 강남..."
588,2021.02.26.,제로금리 시대에 관심 받는 소형 오피스텔 ‘e편한세상 시티 부평역’ 눈길,"노선이 개통되면 부평역(예정)에서 여의도역까지 10분대 이동이 가능해지는 등 서울 도심으로 이동이 더욱 편리해질 전망이다. 이 밖에 대규모 상권이 모여있는 부평역 인근에 위치해 있어 롯데마트, 부평역 지하상가..."
589,2021.02.23.,"현대백화점, 26일 여의도 '자연담은 미래 백화점' 그랜드 오픈","현대백화점은 입지적 강점과 편리한 교통망 등을 바탕으로 반경 3km 내 핵심 상권인 서울 영등포구·동작구·마포구·용산구는 물론, 서울 및 수도권 전 지역 고객까지 적극 유치하겠다는 전략이다. 이를 감안할 때..."
590,2021.02.23.,"현대백화점, 26일 여의도 '자연담은 미래 백화점' 그랜드 오픈","현대백화점은 입지적 강점과 편리한 교통망 등을 바탕으로 반경 3km 내 핵심 상권인 서울 영등포구·동작구·마포구·용산구는 물론, 서울 및 수도권 전 지역 고객까지 적극 유치하겠다는 전략이다. 이를 감안할 때..."
591,2021.02.22.,"[단독]정부, 與 유통규제 제동..'백화점 영업제한' 반대","국내 상권과의 경합성이 낮다는 판단이다. 영업제한 대상인 'SSM 확대' 법안에도 동의하지 않았다. 이동주... 확대된다""면서 ""서울 시내 1개 전통시장만을 기준으로 전통상업보존구역을 지정하더라도 서울시 전체 면적(605.25..."
592,2021.02.22.,양천구 청년 디지털 서포터즈 위촉식,‘청년 디지털 서포터즈’는 2021년 서울형 뉴딜일자리사업을 통해 민간취업과 연계되는 청년 일자리창출과 소상공인의 디지털 전환을 지원하는 사업으로 지난해 양천구에서 처음 시도됐다. 올해에도 관내 생활상권...
593,2021.02.26.,[MK 부동산단신] 안성 IC 공동주택 용지 3.3㎡당 350만원,베이커리 카페·치킨전문점 수익형 1층 상가 ▶하남 미사지구 대단지 중심상권 중심상권 삼면 코너에... 종로 구기동 북한산조망 신축 고급 빌라 ▶2억원~4억원 총 7세대 서울시청과 경복궁역으로 이동이 편리한...
594,2021.02.24.,"안철수 ""'동성애 안 좋아한다’ 했던 文, 가장 심한 혐오 발언""","퀴어 축제도 서울의 상징성 있는 곳을 찾아 그곳에서 전통으로 만들면 외국인도 찾아올 수 있고 상권도 활성화될 수 있으므로, (그런 취지의) 제안을 드린 것”이라고 강조했다. 한편 문 대통령의 '백신 1호 접종' 여부를..."
595,2021.02.24.,"GS25, 책임경영 강화 통한 ESG경영 박차...자율분쟁조정위원회 발족","국내 편의점 매출 1위 GS리테일의 GS25는 서울시 강남구에 위치한 GS타워에서 경영주-본부 간 신뢰 구축과... 자율분쟁조정위원회에서는 가맹계약 관련 필수서류 미제공, 허위 과장 정보 제공, 계약 체결 전 지역 상권..."
596,2021.02.26.,부동산 규제 속 틈새상품 '르피에드 in 강남 상업시설' 내달 분양,업무지구가 위치한 곳은 평일 주중 상권활성화에 도움이 되고 번화가에 위치한 경우에는 주말이나 야간 인근지역 주민 외 방문객도 많아 수요가 안정적으로 보장된다는 평가다. 서울에서 가장 많은 유동인구가 지나는...
597,2021.02.23.,"건대 음식점 종사자 전수조사…""상권 살려야죠""","서울 광진구 헌팅포차에서는 80명 이상이 양성판정을 받았는데요. 추가 확산을 막기 위해 음식점 종사자들을... 네, 서울 광진구 건대 맛의 거리에 나와 있습니다. 이곳은 일반 음식점과 유흥주점이 많은 곳인데요. 제 뒤로..."
598,2021.02.26.,"로데오거리 복합상권 '더블하이', ""번화가 입지로 눈길""","일일 유동인구 8천여명의 대규모 상권과 시청, 은행권, 공업단지 등 업무 수요를 배후로 둔 안산... 한국호텔관광 실용전문학교를 비롯하여 서울 예술대학교, 한양대 ERICA캠퍼스, 안산대, 신안산대 등의 대학가가 밀집되어..."
599,2021.02.24.,"안철수 ""'동성애 안 좋아한다'던 文대통령부터 어떤 생각인지 물어야""","예비후보는 ""서울에 상징성 있는 곳을 찾아서 그곳에서 퀴어축제를 열면 전통이 만들어지면서 외국인도 찾아가 볼 수 있고 그러면 상권도 활성화될 것""이라며 ""그런 좋은 방법이 있다고 말한 것""이라고 말했다. 성소수자..."
600,2021.02.24.,"안철수 ""'동성애 안 좋아한다'던 文대통령부터 어떤 생각인지 물어야""","예비후보는 ""서울에 상징성 있는 곳을 찾아서 그곳에서 퀴어축제를 열면 전통이 만들어지면서 외국인도 찾아가 볼 수 있고 그러면 상권도 활성화될 것""이라며 ""그런 좋은 방법이 있다고 말한 것""이라고 말했다. 성소수자..."
601,2021.02.21.,"""백화점 고정틀 깬다""…롯데·신세계·현대 '출점 경쟁'",더현대 서울은 오피스 상권 중심이어서 '유통 무덤'으로 평가받던 여의도에 들어서는 데다 영업면적 8만9천100㎡에 이르는 서울 최대 규모 백화점이라는 점에서 관심이 집중되고 있다. 더현대 서울을 '미래 백화점의...
602,2021.02.21.,명동의 눈물…1층 상가 67곳 중 절반 비었다,"관광명소 명동·이태원, 대학가 신촌·이대 등 서울 주요 상권이 무너지고 있다. 해외 관광객 감소로 침체하던 상황에서 1년째 이어진 신종 코로나바이러스 감염증(코로나19) 확산으로 내국인 발길마저 끊겼다. 거리에..."
603,2021.02.23.,코로나 여파 전국 중대형 상가 평균 임대료 역대 최저치,"2019년 동분기 대비 전국에서 중대형 상가 임대료가 가장 많이 하락한 지역은 4000원 하락한 서울로... 제주의 경우 코로나가 확산으로 해외 여행 수요가 국내 여행, 특히 제주로 몰리면서 관광지 상권을 중심으로..."
604,2021.02.26.,높아지는 아파트 선호도… 'e편한세상 울산역 어반스퀘어' 3월 분양,"아파트 가격에 영향을 미치는 요인들이 다양하지만, 교통, 상권, 교육 등 여러 생활 인프라들이 비슷한데도... 특히 지난해 '문수로대공원 에일린의 뜰'(309대 1) 등 서울 못지 않은 청약경쟁률을 보인 울산광역시에서도..."
