,date,title,contents
1077,2021.10.13.,"현대건설, ‘힐스테이트 과천청사역’ 10월 분양","단지 바로 옆에 지하철 4호선 정부과천청사역이 있는 초역세권 단지로 서울 강남까지 20분대 진입이... 단지는 이러한 입지적 가치를 극대화할 수 있는 MD구성을 선보여 배후 거주세대, 오피스 워커, 중심상권에 유입되는..."
1078,2021.10.14.,관악구 녹두거리 넓고 깨끗해졌다…보행특화거리 조성,이 일대는 과거 고시생들과 인근 서울대학교 학생들이 많이 찾아 음식점과 주점 등이 몰려있었으나 2017년 사법고시 폐지 이후 상권이 침체한 상태다. 관악구는 지역 상권 활성화와 보행환경 개선을 위해 총사업비...
1079,2021.10.19.,곡선지구 상가 `수원 라퍼스트` 분양,"오픈 상권의 신개념 독립상가”로 정의했다. 덕영대로, 동탄원천로, 용인~서울 고속도로 등과 연결되는 곡선지구 유일의 대로변 문주상가라 가시성이 뛰어난 것은 물론, 일대 주민들과 수많은 유동인구를 끌어..."
1080,2021.10.19.,곡선지구 상가 `수원 라퍼스트` 분양,"오픈 상권의 신개념 독립상가”로 정의했다. 덕영대로, 동탄원천로, 용인~서울 고속도로 등과 연결되는 곡선지구 유일의 대로변 문주상가라 가시성이 뛰어난 것은 물론, 일대 주민들과 수많은 유동인구를 끌어..."
1081,2021.10.19.,"""직장인 회식·문화생활 확대 '꿈틀'""…기대 높아진 주요 상권",모처럼 골목상권의 자영업자들이 희망을 품는 분위깁니다. 이유민 기자의 보돕니다. 서울 여의도에서 20년 넘게 음식점을 운영한 이옥자씨. 직장인의 회식 모임이 많은 오피스 지역의 특성상 그동안 사적모임인원...
1082,2021.10.07.,"IT 만난 패션·뷰티, 기술력 뽐내다",7일 서울 양재동 aT센터에서 열린 '디자인코리아 2021' 박람회에서는 스타일테크 유망기업 투자유치 지원을... 실제 동글의 e커머스 플랫폼은 침체된 동대문 의류 상권을 회복하기 위해 소비자와 도매상인을 직접 연결하는...
1083,2021.10.15.,"현대백화점 ""영 앤드 리치 VIP 고객 적극 공략”",현대백화점은 백화점업계 최초로 15일 더현대 서울과 판교점에 30대 이하 VIP 고객을 대상으로 한 ‘클럽... 여의도 상권과 IT기업이 몰려있는 판교 상권의 잠재 구매력이 높은 젊은 고객들을 고정 고객화한다는...
1084,2021.10.05.,"롯데리아, 6일부터 배달료 따로 받는다..배달 최소금액 9000원",▲서울 시내 한 롯데리아 매장에서 배달기사가 주문 제품을 수령하고 있다.(사진=롯데GRS)롯데리아는 주문... 또 가맹점의 경우 시·도별 지역 상권과 위탁 배달 서비스 수수료 등 환경적 요소를 가맹점의 자율적...
1085,2021.10.22.,"[농업이 IT(잇)다] 허요셉 힘난다 “신바이오틱스, 가맹 점주와 함께 건강 10...",디톡스 주스 공장을 세우고 서울 압구정과 경기 분당 등 요지들에 매장도 냈다. 창업 첫 해에만 12억 원... 힘난다 매장뿐 아니라 동네 상권에서도 저희 제품을 쉽게 만나도록 노력하겠습니다. 새로운 프랜차이즈 시대를...
1086,2021.10.15.,"SPC 쉐이크쉑, 19번째 매장 신림동에 연다","사진=SPC 제공 SPC그룹은 서울 신림역 인근에 위치한 타임스트림 1층에 쉐이크쉑 19호점인 '신림점'을 11월 중... 쉐이크쉑 관계자는 ""새로운 변화를 맞이하는 신림동 상권에서 쉐이크쉑만의 뛰어난 맛과 따뜻한 환대..."
1087,2021.10.25.,"""툭 하면 대한민국 뒤흔드는 KT""… 구현모 대표 2년차에도 끊이지 않는 사건...","당시 서울 서대문구 충정로 3가에 위치한 KT 아현지사에서 대형 화재가 나며 인근 마포구와 용산구, 서대문구 등에서 유무선 통신이 모두 두절됐다. 이로 인해 주변 지역 상권이 모두 마비됐고 다음 날까지 인터넷이..."
1088,2021.10.14.,"MZ세대, 백화점 VIP라운지까지 접수","더현대 서울과 판교점 두곳에 낸다. 15일부터 운영한다. 1983년생(한국 나이 39세) 이하 손님 가운데... 이어 ""금융·증권사가 밀집돼 있는 여의도 상권과 IT기업이 몰려있는 판교 상권의 잠재 구매력이 높은 젊은..."
1089,2021.10.05.,"카카오 김범수, “더 많은 상생 계획 발표할 것”","김범수 카카오 의장이 5일 오후 서울 여의도 국회에서 열린 정무위원회의 공정거래위원회·한국소비자원... 이날 정무위 국감에서는 카카오 모빌리티의 수수료 논란, 카카오의 골목상권 침해 논란에 대해 의원들의 질의가..."
1090,2021.10.13.,골목상권 어느 동네가 가장 잘 살렸나…우수사례 발표대회,서울 관악구는 골목상권을 특성별로 구분해 권역별 발전전략을 세우고 지역 예술가와 협력하는 골목사업을 추진했다. 대구 동구는 평화시장 닭똥집골목에 명품 테마로드를 조성하겠다며 상인 커뮤니티 센터를 중심으로...
1091,2021.10.15.,[대한민국 일자리 엑스포] '만세 챌린지' 광주 광산구 등 골목상권 9곳 우수사...,"서울 관악구는 골목상권을 특성별로 10개로 구분, 지원을 체계화하는가 하면 지역예술가 143명과 협업해 골목 점포 467개소에 경관을 개선하는 아트테리어 사업으로 높은 점수를 받았다. 서울산업진흥원은 서울 중구..."
1092,2021.10.08.,"삼성물산 패션부문 '코텔로', 한남동에 첫 팝업 스토어 오픈",패션부문의 '코텔로'가 서울 용산구 한남동에 있는 카페 콘하스 한남점과 비이커 한남점에 첫 팝업 스토어를... 찾는 상권에 오프라인 팝업 스토어를 운영하는 유통 전략을 펼칠 계획이다. 첫 팝업 스토어의 장소는 카페...
1093,2021.10.06.,납작 엎드린 김범수 “모든 논란의 책임은 저에게… 사과드린다”,"공정위원장 “카카오 금산분리 위반 혐의, 신속히 조사"" 김범수 카카오 이사회 의장이 5일 서울 여의도... 김 의장은 골목상권 침해 논란을 비롯해 카카오택시 수수료 문제·콘텐츠 작가 수익 문제·계열사 문제까지 끝없이..."
1094,2021.10.18.,"연수구, 지방자치경영대전 행정안전부 장관상 수상",서울 양재동 aT센터에서 열린 '제17회 대한민국 지방자치경영대전'의 지역경제 부문 중 안전관리 분야에서... 특히 전국 최초 방역 안심 외식 활성화를 통한 지역 골목상권에 활기를 불어넣는 데 기여했다는 높은 평가를...
1095,2021.10.18.,"카카오 김범수, 올해 국감 3번째…'10대그룹' 5년간 0명",김범수 카카오 의장이 지난 7일 서울 여의도 국회에서 열린 산업통상자원중소벤처기업위원회의... 플랫폼 업계가 골목상권까지 사업을 확장하고 플랫폼 노동자에 대한 열악한 처우를 하고 있다는 사실이 드러났다....
1096,2021.10.18.,'도시재생뉴딜' 부지 확보가 활성화 단초,"이는 전남도청 등 관공서 이전으로 인한 물량 감소와 가격 경쟁력 저하에 따른 서울, 대구, 대전으로의... ▲상권 경제력 회복(119억원) ▲기반 시설 정비(160억원) ▲거버넌스 구축(21억원) 등 3개의 단위사업과 14개의..."
1097,2021.10.18.,"[기고] 경제약자 보호하는 지역화폐, 예산 삭감 철회해야","2017년 기준 비수도권 지역의 소득 역외유출 현황을 살펴보면, 충남 -28%, 경북 ?16.7%인 반면, 서울은 54.7%에... 수도권 중심의 소비를 억제하면서 대형마트에 골목상권이 맞설 환경을 만들고 있는 것이다. 중산층과 서민들의..."
1098,2021.10.21.,대규모 배후수요 흡수 기대… 상업시설 '수원 라퍼스트' 이달 분양예정,"분양관계자는 ""인근 상주인구만 약 1만 1000가구 수준""이라면서 ""곡선지구와 영통지구를 넘나드는 가두리형 오픈 상권의 독립상가로 공급된다""고 설명했다. 상가는 덕영대로, 동탄원천로, 용인~서울 고속도로 등과..."
1099,2021.10.22.,"'라포르테 블랑 서현', 서현역 역세권 입지·배후수요로 눈길","경부고속도로, 분당~수서간 도로 등 차량을 이용한 서울 접근성도 좋다. 서현역 상권 및 AK플라자, 현대백화점, 롯데백화점 등 편의시설 이용이 편리하며 분당구청, 분당세무서, 분당제생병원, 판교어린이도서관..."
1100,2021.10.15.,"관악구, '골목경제 지원사업 우수사례' 최우수상 수상",서울 관악구가 행정안전부에서 주관한 ‘2021년 골목경제 지원사업 우수사례 발표대회’에서 ‘10대 골목상권 조성사업’으로 최우수상을 수상했다고 15일 밝혔다.행정안전부가 주관하는 ‘골목경제 지원사업 우수사례...
1101,2021.10.21.,"‘대한민국 대표 상권’ 종로, 임대 빌딩들 수두룩",박미나기자(mina092@skyedaily.com) 기사입력 2021-10-21 18:30:20 ▲ 서울 종각역 일대에는 중대형 상가빌딩 10여개 이상 매물로 나와 있지만 매수자가 없어 수개월째 비어있다. 종로는 강남·명동·홍대 등 전통 상권...
1102,2021.10.19.,송도 중심의 스트리트 상가 '메르디앙 에클라',송도신도시의 가로수길이 제2의 신사동 가로수길로 거듭나면서 송도신도시의 최중심 상권으로 거듭나고 있다. 서울 신사동 가로수길과 분당신도시 정자동 카페거리는 우리나라의 대표적인 상권으로 꼽힌다. 이 두...
1103,2021.10.15.,"단골손님 만드는 꿀팁, 골목상권 지키는 스타트업이 알려준다",매장 고객관리 서비스 '도도 포인트'를 운영하는 스타트업 스포카가 오는 19일 오후 3시 서울 역삼동 스포카 사옥에서 '제1회 도도 포인트 웨비나'를 개최한다고 15일 밝혔다. 이번 행사는 '도도 포인트 마케팅 인사이트...
1104,2021.10.25.,"[10월 4주차 국회에서는] 국회본회의 예산안 정부시정연설, 감사원장 인사청문...","골목상권살리기운동본부 출범식 및 토론회'를 개최한다. 화요일(26일) 오전 8시에는 인재근, 오영훈, 고영인... 더불어민주당 서울시당 강당에서 국회 연속토론회로 '문재인 정부 5년, 성과와 과제 : 내삶을 책임지는..."
1105,2021.10.14.,내포신도시 상권 활성화 박차,도는 이날부터 16일까지 서울 코엑스에서 열리는 `IFS 프랜차이즈 박람회'에 참가해 투자자 및 프랜차이즈 본사를 대상으로 투자 상담 및 투자 제안서 배부 등 투자지로서의 내포신도시를 홍보한다. 신도시 상권 소통 강화...
1106,2021.10.18.,시장에 떠밀린 공영미디어 논의의 출발점은 재원?,"15일 서울 중구 상연재에서 한국방송학회 주최하고 과학기술정보통신부와 KCA가 후원하는 '디지털미디어... 카카오 골목상권 침해, 쿠팡 노동환경, 택배노동자 배달앱 수수료 논란 등""이라며 ""메시지와 콘텐츠를 다루는..."
1107,2021.10.18.,테라스 특화 오피스텔 “구리 삼부르네상스 더 테라스” 11월 분양 예정,"또한, 서울외곽순환도로, 북부간선도로, 구리-포천간 고속도로 등 서울 및 수도권 진출입이 용이한... 사업지 인근에는 구리전통시장 및 남양주.구리 최대상권인 돌다리상권, 롯데백화점, 현대프리미엄아울렛..."
1108,2021.10.09.,외국인 자가격리 면제에 ‘오징어 게임’까지... 활기 되찾는 인사동,"주요 상권들이 힘없이 무너진 가운데, 서울 종로구 인사동은 외국인 자가격리 면제와 넷플릭스 드라마 ‘오징어 게임’ 열풍 등으로 다시 활기를 되찾아가고 있다. 지난 8일 인사동 ‘문화의 거리’에는 이전까지만..."
1109,2021.10.13.,"현대백화점, 업계 최초 ‘영 앤 리치’ 위한 ‘20·30 VIP 전용 라운지’ 오픈","판교 상권의 잠재 구매력이 높은 젊은 고객들을 고정 고객화한다는 구상이다. 이번에 문을 여는 클럽 YP 라운지는 기존 VIP 라운지와 비교해 디자인과 운영 방식에 있어 차별화를 꾀했다. 우선, 더현대 서울과..."
1110,2021.10.14.,김범수의 재산기부 첫 삽 떴다…2023년 'AI 캠퍼스' 구축,8월엔 카카오 판교오피스가 위치한 경기 성남에서 서울 강남구로 사무실을 옮기고 실무진을 채용하는 등... 최근 카카오의 문어발식 사업확장과 골목상권 침탈 논란이 거센 상황이어서 김 의장의 상생행보에 더욱 이목이...
1111,2021.10.07.,"질샌더, 신세계百 강남점 입성..국내 다섯 번째 매장",간결하면서도 우아한 디자인으로 국내에도 마니아층을 보유하고 있다”며 “더 많은 고객들이 브랜드를 경험해볼 수 있도록 서울 핵심 상권에 추가 매장을 열고 브랜드만의 콘셉트를 한눈에 볼 수 있게 했다”고 말했다.
1112,2021.10.21.,"세종시 대학공동캠퍼스, '세종NC캠퍼스타운' 10월 분양 예정",세종NC캠퍼스타운은 명문 캠퍼스 대학가 상권과 신도시 상권을 확보했다. 세종시 4-2생활권 집현동 공동캠퍼스 부지에 서울대학교를 비롯해 충남대·충북대·공주대·한밭대KDI정책대학원 등 10개 대학 입주가 최근...
1113,2021.10.14.,"충남도, 내포신도시 상권 활성화 추진한다",도는 이날부터 16일까지 서울 코엑스에서 열리는 'IFS 프랜차이즈 박람회'에 참가해 투자자 및 프랜차이즈 본사를 대상으로 투자 상담 및 투자 제안서 배부 등 투자지로서의 내포신도시를 홍보한다. 신도시 상권 소통 강화...
1114,2021.10.03.,김건희 저격 논란 '쥴리의 남자들' 건물 240억 매물로…왜,이 건물은 서울 지하철 1호선 종각역 역세권이자 젊음의 거리 중심 상권에 있는 빌딩이다. 건물주가 건물을 매각하는 이유는 신종 코로나바이러스 감염증(코로나19) 여파로 상권이 침체된 데다 임차인을 구하기 어려웠기...
1115,2021.10.13.,강남 '엘프론트 청담' 공급,"서울 강남 청담동에 '엘프론트 청담'이 공급된다. 13일 업체 홍보 관계자에 따르면 단지는 고급 복합시설로... 또한 압구정 로데오와 청담동 명품거리가 가깝고, 코엑스와 현대백화점 무역센터 등도 인근에 있어 상권 간..."
1116,2021.10.08.,"삼성물산 '코텔로', 한남동에 첫번째 팝업 스토어 열어",삼성물산 패션부문의 고가성비 데일리웨어 브랜드 코텔로가 서울 용산구 한남동에 위치한 카페 콘하스... 찾는 상권에 오프라인 팝업 스토어를 운영하는 유통 전략을 펼친다. 첫 번째 팝업 스토어의 장소는 카페 콘하스...
1117,2021.10.15.,태영건설 '신진주역세권 데시앙'…15일 사이버 견본주택 오픈,이내 상권에서 발생한 결제건수의 비중은 21.1%로 2018년 대비 5.1%증가했다. 반면 소비자의 자택에서 5㎞ 밖... 교통여건을 보면 KTX진주역과 가까운 역세권에 위치로 서울역까지 약 3시간 40분이면 이동이 가능하다. 또한...
1118,2021.10.03.,"LX하우시스, 전남순천 '지인스퀘어' 개장…지역상권 공략","마련 [서울=뉴시스] 배민욱 기자 = LX하우시스는 전라남도 순천시에 'LX Z:IN 인테리어 지인스퀘어 순천점'을... LX하우시스는 향후 순천, 여수, 광양 등 인근 지역 상권 공략을 본격화한다. 지인스퀘어 순천점은 연면적 약..."
1119,2021.10.13.,'골목경제 지원사업 우수사례' 발표…14일 최종 순위 결정,"‘서울 관악구’는 골목상권을 특성별로 구분하여 권역별 발전전략을 수립하고, 지역 예술가와 협업하는 골목사업을 추진해 눈길을 끌었다. ‘서울산업진흥원’은 남산 애니타운 상징거리 ‘재미로’를 조성하고..."
1120,2021.10.21.,송도신도시 ‘메르디앙 에클라’ 상가 분양,"월드메르디앙 송도 상업시설 에클라는 900m 가로수길 상권의 3면 대로상가이다. 코스트코, 현대프리미엄... GTX-B노선 이 노선이 2027년 완공되면 송도에서 서울역까지 82분에서 27분으로 이동시간이 크게 단축될 것으로..."
1121,2021.10.15.,"SPC그룹, 쉐이크쉑 19호 '신림점' 개점","박유니 기자, SPC그룹(회장 허영인)은 서울 신림역 인근에 위치한 타임스트림 1층에 쉐이크쉑 19호점인... 쉐이크쉑 관계자는 “새로운 변화를 맞이하는 신림동 상권에서 쉐이크쉑만의 뛰어난 맛과 호스피탈리티..."
1122,2021.10.26.,"KB국민카드, 포항시와 빅데이터 업무 협력 협약 체결",25일 서울 종로구 KB국민카드 본사에서 열린 KB국민카드와 포항시의 '빅데이터 전략적 업무협약식' 후 이동철... 분석과 상권 활성화 방안 모색 등 빅데이터를 매개로 한 민관 협력 관계를 강화할 예정이다. 또 각각 보유한...
1123,2021.10.20.,마곡지구 상업시설 '르웨스트 에비뉴 767' 광역 배후수요 흡수 기대,"분양 관계자는 ""이 상업시설은 인근 서울식물원, LG아트센터, 대규모 유통시설 등 여러 기관·시설들과 시너지 효과를 내며 활발한 상권을 형성할 것으로 기대된다""면서 ""근로자 수요에 거주민 수요, 르웨스트..."
1124,2021.10.14.,"현대백화점, 2030 VIP 전용 라운지 오픈",오는 15일 더현대서울과 판교점에 30대 이하 VIP 고객을 대상으로 한 '클럽 YP 라운지'를 연다. 클럽 YP는... MZ세대 고객을 타깃으로 한 콘텐츠와 마케팅에 집중해 금융·증권사가 밀집돼 있는 여의도 상권과 IT기업이...
1125,2021.10.19.,"정부,이번엔 퀵커머스 규제 나서나?","최근 급증하고 있는 퀵커머스(근거리 즉시배송) 서비스가 골목상권을 죽인다는 우려가 나오면서 정부가 상권... B마트는 서울, 인천, 경기 등 수도권에 30여개 MFC를 운영 중이고, 쿠팡이츠마트는 최근 송파구에서 시범..."
1126,2021.10.10.,"[fn 이사람] ""컵뚜껑에 쓴 손글씨… 손님들 고된 하루에 작은 위로 되길""",서울 명동 서울중앙우체국 옆 골목길에 자리 잡은 카페 모나미커피에는 다른 커피숍에서 볼 수 없는... 오피스 상권에 위치한 모나미커피는 단골손님이 많다. 매일 아침 출근 도장을 찍거나 하루에도 두세 번씩 찾는 고객이...
1127,2021.10.15.,내달 신림에 제2의 타임스퀘어 '타임스트림' 문연다,경방은 내달 서울 관악구 신림동에 도심형 쇼핑플랫폼 ‘타임스트림’을 개장한다고 15일 밝혔다.... “신림 상권을 대표하는 랜드마크로 자리잡을 수 있도록 고객 중심의 콘텐츠를 지속적으로 확대해 나가겠다”고...
1128,2021.10.26.,"주류 업계, 위드코로나에 마케팅 시동…늘어난 홈술족도 놓칠 수 없어",오비맥주가 서울과 수도권 지역 내 약 500개 매장에서 펼치는 '쿨타이머' 프로모션은 카스 2병 주문시 '변온텀블러' 응모 기회를 소비자들에게 제공하는 상권 행사다. 프로모션은 각 매장별로 텀블러 재고 소진시까지...
1129,2021.10.15.,[구구담] 지방자치 부활 30주년…'소통과 혁신'의 도시 마포 (유동균 구청장),코로나 시대 비대면 이동수단으로 각광받고 있는 게 서울시 공공자전거 따릉이입니다. 마포에서는 이 따릉이에 대한 빅데이터를 기반으로 상권지도(따릉이 상권지도)도 개발했습니다. 마포에서의 따릉이 주요...
1130,2021.10.03.,‘쥴리 벽화’ 종로 중고서점 건물 240억 매물로…건물주 “상권 침체로 임차...,그려진 서울 종로구 한 중고서점 외벽 앞을 보수단체 관계자가 차량으로 가리고 있다. 뉴스1 국민의힘의... 중고서점 주인이자 건물주인 여모씨는 연합뉴스에 “신종 코로나바이러스 감염증(코로나19) 장기화로 상권이...
1131,2021.10.14.,내포신도시 상권 활성화 통한 위상 강화 나선다,도는 이날부터 16일까지 서울 코엑스에서 열리는 'IFS 프랜차이즈 박람회'에 참가해 투자자 및 프랜차이즈 본사를 대상으로 투자 상담 및 투자 제안서 배부 등 투자지로서의 내포신도시를 홍보한다. 신도시 상권 소통 강화...
1132,2021.10.27.,"[내일의 경제 일정] 한은, 9월 무역지수 및 교역조건 발표","(16:00 서울중앙우체국 10층) ▲ 중소벤처기업부, 쇠퇴상권 부활을 위한 상권 르네상스의 새로운 시작 ▲ 중소벤처기업부, 전북 탄소융복합산업 규제자유특구, 수소용기제조 등 실증 착수(석 ▲ 중진공, 중진공..."
1133,2021.10.19.,분양방식 차별화 마스터리스 사례 증가…상권활성화 기대,국토교통부 자료에 따르면 서울 중·대형 상가 공실률은 2017년 2분기 6.9%에서 올 2분기 9.5%로 2.6%p의 상승폭을 보였다. 서울 등 대도시 도심지역의 상업용 부동산 수요는 줄어들고 있음에도 공급은 늘고 있는 상황으로...
1134,2021.10.15.,인천 미추2구역 프리미엄 아파트 ‘주안 센트럴팰리스’ 조합원 추가 모집,"되면 서울역 및 강남권까지 20분대 진입이 가능하다. 인천시청과 미추홀구청 등 공공기관이 가깝고 역세권 단지의 입지적 장점으로 주안역과 시민공원역을 잇는 상권이 길게 형성돼 있다. 영화관, 지하상가..."
1135,2021.10.12.,"도봉구, AI로 이상반응 체크 '누구 백신 케어콜' 운영","지난 8일 서울대입구역 인근 패밀리 레스토랑에서는 사회적거리두기 방역수칙 아래 지역 내 1인 가구... 지역 상권에 활력을 불어넣을 것으로 기대된다. 또, 축제의 마지막 날 온라인 라이브로 개최된 ‘선사인 콘서트’는..."
1136,2021.10.18.,‘위드 코로나’ 전환 임박…이달 내 구체적 ‘로드맵’ 마무리,김 총리는 지난 13일 정부서울청사에서 열린 코로나19 일상회복지원위원회 첫 회의에서 “(위드 코로나는)... 지역사회 일상회복과 골목상권 및 소외지역 경제 활성화 지원 방안은 자치안전 분과에서 마련한다. 백신...
1137,2021.10.14.,"'땅주인' 주상복합 추진…이마트 상봉점, 재임대 vs 폐점 운명은?","유통업계 관계자는 ""서울 내 신규 점포 출점은 쉽지 않아 심각한 적자가 아니라면 매장을 유지할 것""이라며 ""상봉역 주변은 더블 역세권 입지와 개발사업까지 예고돼 있어 추후 상권 활성화 가능성이 더 높다""고 설명했다...."
1138,2021.10.01.,'카카오T블루' 상생 나선다…KM솔루션·가맹점주 '맞손',가맹점협의회는 서울지역 138개 가맹택시 운수사 중 103개가 모인 전국 최초의 가맹택시 점주 협의체다. 양... 앞서 카카오모빌리티는 골목상권 침해 비판이 거세지자 지난 14일 가맹택시 사업자와 상생협의회를...
1139,2021.10.08.,"삼성물산 패션 '코텔로', 한남동에 팝업 스토어 오픈","카페 콘하스, 비이커서 브랜드 경험 제공 삼성물산 패션부문의 코텔로가 서울 용산구 한남동에 위치한 카페... 찾는 상권에 오프라인 팝업 스토어를 운영하는 유통 전략을 펼친다. 첫 번째 팝업 스토어의 장소는 카페..."
1140,2021.10.06.,현대건설 '힐스테이트 과천청사역' 이달 분양 예정,"단지 바로 옆에는 지하철 4호선 정부과천청사역이 자리하고 있어 서울 강남까지 20분대 진입이 가능하다.... 단지는 이러한 입지적 가치를 극대화할 수 있는 MD구성을 선보여 배후 거주세대, 오피스 워커, 중심상권에..."
1141,2021.10.07.,"이재명 ""자영업자 손실보상, 기대 못 미칠 것…새롭게 구성해야""","이 후보는 이날 서울 종로구 혜화동에서 열린 코로나19 위기업종 자영업자 현장 간담회에서 ""손실보상 제도가... 이 후보는 ""말 안 듣는 기재부가 최근 그나마 소상공인, 자영업자, 골목상권에 도움을 주고 있던 지역화폐..."
1142,2021.10.17.,[썰물밀물] 수도국산과 '인천 하늘수'',일제 통감부는 1906년 수도국을 신설해 인천 송현동∼서울 노량진 간 상수도 공사를 벌여 1908년 배수지를... 일제 강점기 조선인은 일본인에게 상권과 일자리를 잃으면서 송현동·송림동 등지 마을로 찾아들었다. 가난한...
1143,2021.10.20.,"[시선공감] 최대호 안양시장 ""안양시, 도내 31개 지방정부 중 'ESG' 역량 최고...","석수동에 있는 구 분뇨처리장, 에코센터 조성 추진과 더불어서, 안양천 명소화 공동추진을 위해서 서울 등... 이렇게 되면 인덕원역은 수도권남부 최대 교통허브로 부상하게 됨은 물론이고, 이 일대 상권 활성화에도 크게..."
