,date,title,contents
0,2021.10.29.,"당근마켓, 서울 25개 전통시장 할인쿠폰 쏜다","기사내용 요약서울신용보증재단과 함께 1만2500여개 쿠폰 배부 지역생활 커뮤니티 당근마켓이... 동네 상권이 다시금 활성화되는데 도움이 되기를 바란다""며 ""하이퍼로컬 대표 기업으로서 동네 시장의 가치를..."
1,2021.10.29.,서울사랑상품권 판매대행점 공모…모바일 간편결제 도입,"혜택을 주는 서울의 대표적인 결제시스템""이라며 ""내년에는 소비자들이 더욱 편리하게 사용할 수 있는 혁신적인 플랫폼을 구축해 상품권 사용을 늘리고 이를 통해 골목상권에 활력을 되찾을 수 있도록 하겠다""고 말했다."
2,2021.10.29.,[B tv 서울뉴스] 포토뉴스,"서울 중구, '2021 나도 유튜브 크리에이터 공모전' 개최 (이재원 기자) 중구가 '2021 나도 유튜브 크리에이터... 대상은 한양대 음식문화거리와 성수동 카페거리, 마장축산물시장 등 주요 상권 음식점 2천 7백여..."
3,2021.10.24.,11월1일부터 서울사랑상품권 2445억어치 추가로 나온다,한영희 서울시 노동·공정·상생정책관은 “서울사랑상품권 사용은 소상공인 매출을 높여 골목상권 및 지역경제를 살리는 실천”이라며 “소비심리 개선으로 소상공인들이 한숨을 돌릴 수 있도록 지속해서 지원을...
4,2021.10.27.,강화된 거리두기로 3분기 서울 명동 중대형 상가 공실률 47% 넘어,"서울은 특히 명동 상권에서 외국인 관광객이 급감해 중대형 상가는 공실률이 47.2%, 소규모 상가는 43.3%로 나타났습니다. 홍대/합정 상권도 사회적 거리두기에 따른 상권 침체가 지속되며 중대형 상가는 공실률이 17.7..."
5,2021.10.28.,지역사회 활력소로 뜨는 ‘서울 캠퍼스타운’,서울시가 창업 인재 육성을 위해 운영 중인 ‘캠퍼스타운’이 시내 주요 대학과 지역사회를 유기적으로... 지역 상권 활성화를 위한 활동도 체계적으로 전개하고 있다. 숙명여대는 용문·후암시장 상인을 대상으로...
6,2021.10.28.,"서울 중구, 29일부터 걷기 행사… 누구나 참여 가능","(사진제공=중구청)  서울 중구(구청장 서양호)가 가을축제를 재개하며 '단계적 일상회복' 전환을 준비한다.... 이번 축제에는 총 61가지 프로그램이 준비 되어있으며, 골목상권 상생, 환경보호 등 이색적인 주제도 함께..."
7,2021.10.28.,"'발행 동시 완판' 서울사랑상품권, 가격 및 지역별 일정은?","이어온 '서울사랑상품권'은 소상공인과 자영업자에게 결제수수료 면제 혜택을 주고, 소비자에게는 10% 할인 된 금액으로 상품권을 제공하는 동시에 골목상권을 살리는 착한소비 실천 기회를 제공하고..."
8,2021.10.30.,"강서구, '서울강서사랑상품권' 추가 발행","구 관계자는 ""서울강서사랑상품권이 전통시장, 골목상권 활성화에 큰 힘이 되고 있다""며, ""가계에 도움이 되고 지역경제도 살리는 착한 소비에 많이 동참해 주시길 바란다""고 밝혔다. 한편 구는 지난해부터 올해까지..."
9,2021.10.29.,"[B tv 서울뉴스] ""생존권 사수""...마곡 복합쇼핑몰 저지 총력 투쟁","추귀성ㅣ서울상인연합회 회장 (강서구는 물론 마포, 종로, 서대문, 은평, 구로 등 서울 약 11개 구 이상 지역 상권에 미치는 심각한 위기 상황을 결코 좌시하지 않겠으며, 강서지역 복합쇼핑몰 입점 저지 비상대책위원회와..."
10,2021.10.20.,신도시 새 집 팔고 30년 된 서울 아파트 산 부부에게 벌어진 일,"이들 부부는 서울지하철 4호선과 7호선의 더블역세권인 노원역과 주변의 백화점, 마트, 골목상권 등에 대해 만족했다. A씨는 낡은 집이나 시설은 불만이었지만, 이는 재건축에 대한 기대감으로 맞바꾸기로 했다. 사연의..."
11,2021.10.25.,서울시 11월부터 '서울사랑상품권 10%' 할인 판매,"한영희 시 노동·공정·상생정책관은 ""서울사랑상품권 사용은 소상공인 매출을 높여 골목상권과 지역경제를 살리는 실천""이라며 ""소비심리 개선으로 소상공인들이 한숨을 돌릴 수 있도록 지속적으로 지원을 펼치겠다""고..."
12,2021.10.25.,공공형 키즈카페 추진나선 서울시…뿔난 자영업자 “폐업하란 소리냐”,영등포구에서 키즈카페를 10년째 운영 중인 이수진(가명)씨는 “(공공 키즈카페 취지는 충분히 이해하지만)그나마 버티고 있는 골목상권을 낭떠러지로 떠미는 것이나 마찬가지”라며 “민간에도 서울시가 공동으로...
13,2021.10.24.,“공공형 키즈카페에 폐업 공포”…서울시 “상생 모색”,“골목상권을 정부에서 침해하느냐” “민간과 공영 모두 윈윈하는 정책을 좀 만들자”는 등의 동감 댓글 30여개 달렸다. 서울시 측은 해당 게시글에 “공공형 실내놀이터(키즈카페)는 연차별로 추진하면서 민간...
14,2021.10.20.,"""서울에 약재시장이 있다고?""…동대문구 '서울약령시' 가보니 [르포]",지난 1960년대 인근 청량리역을 중심으로 한약재 상권이 형성되면서 자연스레 상인들이 몰려든 것이 서울약령시의 구체적인 시초다. 지금은 제기동과 용두동 일대 8만여평 부지에 한의학 관련 전문업소 1000여곳이 자리...
15,2021.10.29.,[서울겸용/리포트]형사의 촉..보이스피싱 막았다,"(아파트, 은행 등이) 밀집해있는 상권으로 이동하는 모습을 발견하고"" 택시가 아파트 단지 앞에 멈춰 서자 한 남성이 내리고, 잠시 뒤 아파트 단지에서 종이가방을 손에 든 60대 여성이 누군가와 통화를 하며 걸어옵니다...."
16,2021.10.28.,"서울 중구, 29일부터 걷기 행사… 누구나 참여 가능","(사진제공=중구청)  서울 중구(구청장 서양호)가 가을축제를 재개하며 '단계적 일상회복' 전환을 준비한다.... 이번 축제에는 총 61가지 프로그램이 준비 되어있으며, 골목상권 상생, 환경보호 등 이색적인 주제도 함께..."
17,2021.10.10.,서울 주택 재산세 5년새 갑절 뛰었다…강남·서초·송파 順(종합),"이어 용산구가 23만8천 원이 올랐고, 서울숲을 중심으로 신흥 상권이 형성되고 있는 성동구도 16만5천 원이 증가했다. 재산세 증가액이 가장 적었던 곳은 도봉구(1천 원), 금천구(2천 원), 강북구(4천 원) 순이었다...."
18,2021.10.28.,"비스트로피자, 서울 마곡발산점 오픈… 반값 할인행사 진행","김연경선수가 선택한 피자, 비스트로피자가 28일 서울마곡발산점에 신규 매장을 오픈했다. 오픈 이벤트로 28... 회사 관계자는 ""상권분석, 인테리어, 공사감리 등 체계적인 컨설팅을 진행하고 있으니 많은 관심..."
19,2021.10.28.,"[스브스夜] '골목식당' 백종원, 다음주 아침 '주꾸미 볶음집' 예약…""서울서 ...",27일 방송된 SBS '골목식당'에서는 철원 골목상권에 대한 솔루션이 진행됐다. 이날 방송에서는 백종원은 샤부샤부 집에서 주꾸미 볶음집으로 탈바꿈한 부부 사장님을 찾았다. 지난 방송에서 의욕적으로 주꾸미 볶음으로...
20,2021.10.20.,"‘위드 코로나’ 이후 서울은?…서울연구원, 도시전망 세미나 개최","또 코로나19로 가장 타격이 심한 소상공인의 생계를 짚어보고, 지역별 상권 데이터를 분석해 상권의 변화를 추적하고 그 원인을 분석한 결과도 공유할 예정입니다. 세미나 2부에서는 '전환기 서울의 발전 전략'을 주제로..."
21,2021.10.28.,"[B tv 서울뉴스] 강서구 전통시장, 마곡 복합쇼핑몰 입점 저지 총력 투쟁 예고","이들은 김포공항 주변에 대형마트 등이 들어서면서 인근 공항시장이 한순간에 폐허로 변했고, 마곡지구에 들어서는 여러 복합쇼핑몰로 전통시장과 골목상권이 벼랑 끝에 내몰리고 있다고 지적했습니다. 또 상인들의..."
22,2021.10.27.,도매상인들이 바라는 새 서울시농수산식품公 사장의 자질 '유통리더',"골목 상권이 무너지고 있다. 이미 양곡시장, 수산시장, 축산시장 등 많은 부류의 공영도매시장 기능이 쇠퇴하여 경쟁력이 떨어지고 있는 실정이다. 경매제도와 시장도매인제도를 함께 운영 중인 서울..."
23,2021.10.14.,"서울시, 중화2동 '도시재생' 본격화…2세대 사업 첫 사례","기사내용 요약온세대 어울림터 조성 등 3개 부문 6개 사업 본격 추진 도시재생뉴딜사업지인 서울 중화2동의... 골목상권 경관 리뉴얼 사업 등을 추진한다. 보담 상생 리빙랩은 밀키트 작업장, 마을소극장, 마을식당..."
24,2021.10.21.,서울연구원 “‘위드 코로나 시대’ 변화된 시민 일상·대응 방향 논의”,"서울연구원이 오늘(20일) 오후 서울 중구 페럼타워에서 ‘위드 코로나 시대, 서울의 도시전망’ 세미나를... 동네 상권을 부활시켜야 한다고 제안했습니다. 또 코로나19로 인해 재택 근무가 확산되는 등 디지털 전환 시대가..."
25,2021.10.26.,"대구 ’선착순 분양’에 부산, 서울 사람 몰렸다","중구 A 공인중개업소 관계자는 “최근 ‘힐스테이트 동인’ 선착순 분양에 대구 전역은 물론 부산, 서울... 최고 상권으로 꼽히는 동성로 등도 도보권에 위치한다. 인근으로 국채보상운동기념공원과 2·28기념중앙공원..."
26,2021.10.27.,서울 강동구·충남 천안시 등 6곳 국토장관상…서울 중랑구·경기 하남시 등 ...,"◇국토부장관상 = 서울 강동구(구청장 이정훈)는 과거 관내 핵심 상권이었지만 현재는 쇠퇴한 구천면로를 ‘걷고 싶은 거리’로 조성하고, 문화를 활용한 도시재생의 대표 사례로 ‘강풀만화거리’를 제시해..."
27,2021.10.11.,"서울 주택 재산세, 5년새 2배로 급증","서울숲을 중심으로 신흥 상권이 형성되고 있는 성동구가 16만5000원으로 뒤를 이었다. 주택 전체에 부과된 재산세 총액도 강남구가 3583억 원으로 서울에서 가장 많았다. 올해 강남과 서초, 송파 등 강남 3구의..."
28,2021.10.28.,"서울식물원에 LG아트센터, 대규모 유통시설…광역수요까지 품은 '르웨스트 에...",특히 이 상업시설은 국내 최대 규모의 마이스 시설과 함께 조성돼 더욱 빠른 시일 내에 활발할 상권을 형성할 전망이다. 우선 르웨스트 에비뉴 767은 도보권에 서울식물원이 위치해 있어 쾌적한 공간에서 쇼핑과 여가...
29,2021.10.28.,"[장호성의 BMW] “좀비는 없습니다” 대한민국 교통의 중추, 서울역에 숨은 이...",동네 주민들을 대상으로 하던 장사에서 서울로7017을 찾는 방문객들을 대상으로 한 수제맥주집·이색카페 등이 문을 열며 상권에 활력이 불어넣어진 모습이었다. 서울로7017 개통 이후 1년 만에 보행량이 주말 최대 48.6...
30,2021.10.10.,"""서울 상가 공급 증가, 수요는 감소…관리방안 필요""",이런 경향을 반영하듯 서울 주요 상권 중 하나인 이태원은 2019년 3분기 중대형상가 공실률이 26.5%를 기록해 서울시 평균인 7.5%를 훌쩍 웃돌았다. 연구진은 이런 현상을 코로나19 여파로만 해석하기는 어렵다고 봤다....
31,2021.10.16.,'위드 코로나' 앞둔 내달 서울 서남권 '신상 쇼핑몰' 경쟁,"인테리어와 구성 전반에 요란한 광고나 많은 매장보다는 체험과 휴식, 지역 상권을 겨냥한 콘텐츠를 집중 배치한 게 특징이다. 올해 '더현대서울'에 이어 신규 출점한 대형 유통 매장 모두에서 엿볼 수 있는 흐름이다...."
32,2021.10.25.,"[건설오늘] GS건설, 과천자이 단지 내 상가 공급…포스코O&M, 서울사회복지 걸...","최적의 상권을 갖췄다""고 말했다. 롯데건설, '고양 화정 루미니' 완판 롯데건설은 '고양 화정 루미니'가... 포스코O&amp;M, 서울사회복지걷기대회 동참 포스코O&amp;M은 서울특별시사회복지협의회가 주최하는..."
33,2021.10.22.,서울시 108개 전통시장에 '안심콜 출입명부' 도입..'찾아가는 선별검사소' 40...,"현재 서울시내에는 352개의 전통시장이 있으며, 5만 7천여개 점포에 약 11만 명의 상인들이 종사하고 있다.... 전국상권시장(방산시장, 동대문시장 등), 공동작업시설 운영 시장(마장동 우시장, 독산동 우시장 등) 40곳에..."
34,2021.10.18.,"서울 강동구, 암사1동 일대 '골목길 재생사업' 추진","서울 강동구가 암사1동 일대를 대상으로 골목길 재생사업을 추진한다. 강동구는 18일 서울 골목길 재생사업... 강동구는 노후시설물 정비, 공동체 활성화, 골목환경 개선 등을 통해 골목 상권 회복과 지역경제 활성화를..."
35,2021.10.04.,"서울 단일백화점, 역사의 뒤안길로··이수역 '태평백화점' 30년만에 폐점","핵심요약1992년 '태평데파트'로 개관, 이수역 상권 랜드마크 서울의 사실상 마지막 단일점포 백화점, 코로나19 충격으로 이달 말 폐점 예정 지상 23층 주상복합 건설 예정, 백화점 운영은 하지 않을 계획 서울 지하철..."
36,2021.10.14.,내달 서울 신림에 MZ세대 겨냥한 쇼핑몰 '타임스트림' 개장,"경방 타임스퀘어는 11월 서울 신림에 도심형 쇼핑플랫폼 '타임스트림'을 개장한다고 14일 밝혔다. 기존... (F&amp;B) 브랜드로 구성했다""면서 ""타임스트림이 신림 상권을 대표하는 랜드마크로 자리 잡도록 할 것""이라고 말했다."
37,2021.10.10.,10배 이상 투기 이득... 그러나 떠돌이 신세가 된 집 [서울 근대건축 톺아보기...,"ⓒ 서울역사박물관 이때에 이르러 일본인들 집단 거주지가 남산골 배후를 점령하고, 명동·충무로가 상권을 두고 종로와 맞설 때다. 이곳은 이후 식민도시 경성의 핵심 상권으로 성장한다. ▲ 1930년대 회현동 일원 사진..."
38,2021.10.26.,"서울시 자영업자 생존자금, 경제 효과 1조2770억··· 폐업률 0.9%p 감소","센터는 자영업자 생존자금 수혜업체 중 100대 생활밀접업종 22만4000여개 업체를 대상으로 서울시 우리마을가게 상권분석서비스 사업체와의 폐업률을 비교한 결과 외식업은 0.56%포인트, 서비스업은 0.73%포인트..."
39,2021.10.21.,"정직유부, 10월 서울창업설명회 조기마감… 11월 연장 진행","유부초밥 창업 브랜드 정직유부는 11월 연장 진행하는 서울창업설명회에 참여하는 예비창업자에게는 상권보호구역 2배 보장, 가맹교육비 반값할인, 매출최적화 상권 전문컨설팅, 홍보물품비 200만원 지원, 재계약비..."
40,2021.10.12.,"노원구, 서울에서 가장 깨끗한 자치구로 인정받았다","서울시민이 평가한 ‘2021년 도시청결도 평가’에서 서울시 자치구 1위 서울 노원구가 서울 25개 자치구... △노원역, 상계역 등 주요 상권에 ‘자활근로 주말 청소팀’ 운영 △쓰레기 감시반 ‘노원 스와트’ 운영..."
41,2021.10.22.,[네트워크 특별대담] 문석진 서울 서대문구청장,"오늘은 네트워크 특별 대담 순서로, 문석진 서울 서대문구청장과 이야기 나누겠습니다. 안녕하십니까? 민선... 어떻게 하면 자영업자들이 다시 한번 상권이 활성화될 것인가에 대해서 우리가 함께 노력해야 하기 때문에...."
42,2021.10.11.,"서울사랑상품권, 올해 1조 발행… 소상공인 숨통 틔웠다","코로나19 장기화로 폐업이 속출하면서 명동, 홍대입구 등 서울 주요상권 공실률이 40%에 달하는 상황에서 서울사랑상품권까지 줄게 되면 소상공인들의 어려움은 더욱 커질 것으로 예상된다. 서울시 관계자는..."
43,2021.10.18.,"정직유부, 서울지사에서 창업설명회 개최한다","유부초밥 프랜차이즈 정직유부는 서울지사에서 서울창업설명회를 진행할 예정이라고 18일 밝혔다. 이번... 참가자에게는 상권보호구역 2배 보장, 가맹교육비 반값할인, 매출 최적화 상권 전문 컨설팅 등의 혜택을..."
44,2021.10.07.,"서울 도심 무교동·다동 존치지구, 48년 만에 개발제한 풀려","골목상권을 유지하되 환경정비가 가능하도록 소단위 관리지구로 설정했다. 이곳과 연접한 일반정비지구(15·16지구)에도 저층부 건축지침을 별도로 마련해 기존 골목느낌을 살릴 수 있도록 했다. 서울시 관계자는 ""이번..."
45,2021.10.15.,"SPC그룹, 서울 신림동에 쉐이크쉑 19호점 연다","SPC그룹(회장 허영인)은 서울 신림역 인근에 위치한 타임스트림에 쉐이크쉑 19호점인 '신림점'을 내달 중... 쉐이크쉑 관계자는 ""새로운 변화를 맞이하는 신림동 상권에서 쉐이크쉑만의 뛰어난 맛과 호스피탈리티..."
46,2021.10.06.,서울의 새로운 비전은…서울연구원 14개 시민 연구결과 발표,"2021년 기획주제인 '뉴노멀 시대, 서울의 새로운 비전'과 관련해서는 ▲뉴노멀 시대의 새로운 주거기준과 평면제안 ▲With&amp;Post 코로나19 시대 서울시 소상공인 지원 및 상권 관리 방안 ▲코로나19 팬데믹이 서울시..."
47,2021.10.13.,"백화점, 영앤리치 따로 모신다···더현대 서울·판교점에 전용 라운지",현대백화점 관계자는 “MZ세대의 ‘힙플레이스’로 만들려는 전략에서 더현대 서울과 판교점에 라운지를 도입했다”고 설명했다. 두 지점은 금융·증권사가 밀집돼 있는 여의도 상권과 IT기업이 몰려있는 판교...
48,2021.10.13.,"​현대백화점, 더현대 서울과 판교점에 ‘20·30 VIP 전용 라운지’ 연다","판교 상권의 잠재 구매력이 높은 젊은 고객들을 고정 고객화 한다는 구상이다. 특히, 이번에 문을 여는 클럽 YP 라운지는 기존 VIP 라운지와 비교해 디자인과 운영 방식에 있어 차별화를 꾀했다. 더현대 서울과..."
49,2021.10.11.,서울 마지막 단일 백화점…27년 '이수역 명물' 태평百도 닫는다,지역 상권이 더 활성화될 것”이라고 기대를 표했다. 서울 마지막 민간 단일 점포 백화점 서울 시내 마지막 민간 단일 점포 백화점인 태평백화점은 오는 31일까지만 영업을 하고 문을 닫는다. 1992년 ‘태평데파트’로...
50,2021.10.14.,"서울 관악구, 대학동에 보행특화거리 조성",서울 관악구는 대학동 녹두거리 주변 5개 구간을 보행자 안전과 지역상권 활성화를 위한 보행특화거리로 조성했다고 14일 밝혔다. 구는 지난해 서울시 보행환경개선 공모 사업에 선정된 후 현재까지 총 사업비 8억1000만...
51,2021.10.14.,[현장에서] '정쟁(政爭)'을 위한 서울시 국감은 없다,"오세훈 서울시장이 보궐선거로 당선된 후 첫 국감이다. 시장이 된 후 6개월이라는 짧은 시간이 지났지만 코로나 장기화에 따른 민생안정과 골목상권 활성화, 부동산 규제완화 등 국회가 감사해야 할 현안은 상당수다...."
52,2021.10.13.,"서울서 가장 깨끗한 곳은 노원구, 작년 8위서 1위로","서울 노원구(구청장 오승록)가 서울 25개 자치구 중에서 가장 깨끗한 곳으로 뽑혔다. 노원구는 지난 6~8월... 노원역, 상계역 등 주요 상권 ‘자활근로 주말 청소팀’ 운영, 쓰레기 감시반 ‘노원 스와트’ 운영..."
53,2021.10.15.,"비대면 관광 인조이스트리트, 서울시 뉴노멀 관광콘텐츠 선정","이에 따라 서울 유명 관광지와 인근 골목 상권 콘텐츠를 융합할 방침이다. 서울의 일상을 콘텐츠화해 관광 상품으로 살린다는 것이다. 2022년 초 일본 시장에 '인조이 스트리트'를 론칭하고, 이를 선보일 계획이다. 김범석..."
54,2021.10.11.,文정부 5년간 서울 주택 재산세 2배↑… 강남3구·성동구 순,서울숲과 성수동을 중심으로 인기 상권으로 뜨고 있는 성동구도 16만5000원을 기록해 강남 3구를 바짝 추격했다. 윤 의원은 “문재인정부 출범 이전과 비교하면 5년 만에 서울 시민의 재산세 부담이 두 배 가까운...
55,2021.10.22.,"[비즈마켓] KT&G, 필립모리스, 하이트진로, 오비맥주, 롯데칠성음료, 국순당,...",오비맥주가 서울과 수도권 지역 내 약 500개 매장에서 펼치는 이번 프로모션은 카스 두 병 주문 시 '변온 텀블러' 응모 기회를 소비자들에게 제공하는 상권 행사다. 행사는 각 매장별로 텀블러 재고 소진 시까지...
56,2021.10.07.,서울 상권이 죽고있다?…상업공간 갈수록 느는데 미래수요 '급감' 위기,"부정적인 시장 상황에서도 망원동, 익선동, 을지로 등 서울의 핫플레이스로 꼽히는 골목상권이 발달하고 있다. 건물의 저층에 입지하려는 경향과 기존 상권의 혜택을 누리면서 권리금 부담이 적은 주변 입지를 택하는..."
57,2021.10.05.,서울엔 유통 대기업 백화점만 남는다…태평백화점 폐점,태평백화점은 타 백화점과 달리 지역상권 백화점으로 지역주민들이 애용해 왔던 것으로 알려졌다. 지난 6월 서울시 등은 태평백화점이 포함된 이수3 특별계획구역으로 지정함에 따라 태평백화점은 지하 6층 지상 23층...
58,2021.10.18.,"[2021 대학대상/교육특성화 우수대학] 서울시립대, 서울시 인프라 활용한 인공...",또한 서울디지털재단과 '빅데이터를 활용한 서울시 취약상권 지역 개선 방안 연구' 등 대도시 문제를 빅데이터 기반으로 융·복합 분석을 통한 연구도 수행하고 있다. 특히 지난해에는 '4차 산업혁명 혁신선도대학'에...
59,2021.10.15.,"[풀뿌리상권 살려내자]대한민국 한의약의 중심, 서울약령시","그 중 서울특별시 제기동역2번 출구 앞에는 국내 최대 규모의 약령시인 '서울약령시'가 있다. 국내에 유통되는 한약재의 70%를 서울약령시에서 제공하고 있으며 한의원,한약방,한의약 수출입상 등 한방에 관련된 업종과..."
60,2021.10.14.,"최형두 의원, 문화분야 서울·수도권 중심주의 질타","그는 “전국 미술관의 1/3이 서울과 수도권에 있다”며 “대한민국 인구 20%도 안 되는 서울시민만 국민인가, 정부의 서울·수도권 중심주의에 대해 유감”이라고 했다. 그러면서 “지방에선 극장의 위기가 곧 지역상권..."
61,2021.10.21.,쉐빌로뜨당구대 서울 직영점...노블캐롬클럽 합정점,"쉐빌로뜨 케오마스터 8대를 갖추고 있는 노블캐롬클럽 합정점은 서울 중심 상권 중 하나인 홍대 인근에 위치해 있어 쉐빌로뜨의 대표 로드샵의 역할도 겸하고 있다. 또한, 바로 옆에 최고급 주상복합아파트인..."
62,2021.10.15.,"[B tv 서울뉴스] 강서구 전통시장...""죽을힘 다해 마곡 복합쇼핑몰 저지""","[기사내용] 서울 강서구의 대표 전통시장 가운데 한 곳입니다. 시장 곳곳에 붉은색 현수막이 내걸렸습니다. ""골목 상권을 초토화하는 시설을 반대한다""는 내용입니다. 다른 전통시장에서도 같은 현수막을 찾아볼 수..."
63,2021.10.13.,서울 강남에 들어서는 복합시설 ‘엘프론트 청담’ 공급,"여기에 압구정 로데오, 청담동 명품거리, 코엑스, 현대백화점 무역센터점 등도 인근에 있어 상권 연계를 통한 시너지 효과도 기대된다. 한강과 청담근린공원이 가까워 산책객의 흡수도 가능할 전망이다.   한편, 서울시..."
64,2021.10.18.,"[사람in] 유부임 과천새서울프라자 매니저 ""지역상권 활성화 위해 상가 현대화...","단지 소상공인만의 문제라고 생각해 외면해서는 안 됩니다"" 유부임(54) 과천새서울프라자시장사업협동조합(이하 새서울프라자) 경기시장 매니저는 지역 상권 회복의 중요성을 역설했다. 그는 지난 2005년부터..."
65,2021.10.12.,"서울 마곡지구 ""핫하다 핫해""…서울 4대 업무지구로 '우뚝'","르웨스트 에비뉴 767은 마곡지구 내 입주 기업 근로자 수요와 마곡지구, 강서구 등 거주민 수요를 품고 있어 365일 활발한 상권이 형성될 것으로 기대되며 인근의 서울식물원, LG아트센터(예정) 등 폭 넓은 광역수요를..."
66,2021.10.07.,서울 지하철 메디컬존 10월말 입찰...의원+약국 공고,서울 지하철 역사 내 메디컬존 조성을 위해 의원+약국 입찰 공고가 빠르면 10월말 이뤄진다. 서울교통공사가... 주변 상권 분석 등 검토해야 할 사항이 많다. 공사 측은 이를 기준으로 추가 메디컬존 선정 역을 검토하고...
