,date,title,contents
1627,2021.02.04.,완판 단지 내 상업시설 분양…유림개발 'HDC현산 '현대엔지니어링 등,4일 업계에 따르면 지난해 12월 서울 구로구에서 분양한 ‘힐스 에비뉴 신도림역 센트럴’ 상업시설은 계약... 신한카드 빅데이터센터인 트렌디스(Trendis)가 분석한 상권 유형별 요식업종 소비변화에 따르면 지난해 2분기...
1628,2021.02.08.,[스페셜리포트] 쇼핑몰 하나 짓는데 13년? 규제에 우는 유통가,"이투데이=남주현 기자 | 롯데 상암몰, 골목상권 보호 논란에 지자체 심의만 8년…복합몰 의무휴업 규제 추진에 고심 커져 사회적 거리두기가 계속되면서 서울의 한 대형 쇼핑몰이 비교적 한산한 모습을 보이고 있다...."
1629,2021.02.02.,"소진공 조봉환 이사장, 설 명절 전통시장 장보기 나서","조봉환 이사장은 서울 은평구 연서시장을 방문해 연서시장 상인회와 함께 온라인 장보기를 했다.연서시장은... 한편, 소상공인진흥공단은 전통시장과 상점가의 상권활성화를 위해 설립한 중소벤터기업부 산하..."
1630,2021.02.11.,"[옛날신문 보기] ""나라 망한다""던 주 5일제…월화수목'토토일'은?","서울‧부산 보궐 선거가 야권 단일화에 매몰돼있는 가운데, 한 정책이 주목받기 시작됐다. 서울시장 후보인... 오후부터 상권 공동화가 더 심화될 것으로 보인다. 보건지소가 유일한 의료기관인 시골 무의촌 주민들도..."
1631,2021.02.04.,"중기중앙회, 중기협동조합 지원조례 제정 시흥시에 감사패 전달","[제공=중소기업중앙회] 시흥시에는 한국금형조합, 시화공구상가조합, 시화유통상가조합, 서울경인고압가스... 경쟁력 강화와 소상공인 집적 유통상가 지원 등 상권 활성화를 위한 시흥시의 행정 지원을 바란다""고 말했다."
1632,2021.02.04.,"여당 ""보편+선별"" vs 기재부 ""재정 악화""···전문가들 의견은",바닥 상권을 지원하는 정책이 합리적”이라고 말했다. 재난지원금 소비 진작 효과에 대해서도 보편지급... 5%)의 추가 소비 효과가 소득 하위 구간에 더 많은 지원금이 돌아간 서울(28%)보다 높은 것으로 나타났다. 기왕...
1633,2021.02.03.,"2월, 친환경 ‘숲세권’ 브랜드 아파트 분양 ‘봇물’","한국부동산원 청약홈에 따르면, 지난해 서울시에서 가장 높은 경쟁률을 보였던 서울 강동구 소재... 부산 주요 상권인 온천장 상권과 부산대 앞 상권을 동시에 이용할 수 있고, 허심청, 홈플러스, CGV, 롯데백화점..."
1634,2021.02.08.,“새 건물로 이사갑니다”…감염병센터로 변신하는 자치구청 ‘줄줄이’,"8일 서울시와 각 자치구에 따르면 강서구, 종로구, 광진구, 동작구 등은 신청사 계획을 마련하고 건립... 생활편의가 한층 높아질 뿐 아니라 상권 활성화로 오히려 지역 경제에 활력을 불어넣을 것”이라고 말했다. 김기덕"
1635,2021.02.03.,"코오롱FnC, 글로벌 럭셔리 골프 브랜드 '지포어' 공식 론칭","유통은 현대백화점 무역센터점을 시작으로 2월 내 더 현대 서울점, 신세계 백화점 강남점등 주요 백화점에 입점, 점차 고객들과의 접점을 늘려갈 예정이다. 상반기 주요 상권 내 백화점 입점 이후 하반기 내..."
1636,2021.02.01.,명동 이어 부산도…'노재팬·코로나' 직격탄 유니클로 줄폐점,"1일 업계에 따르면, 유니클로는 명동중앙점과 대규모 상권이 형성된 수원역 내 유니클로 AK수원점, 대전 홈플러스유성점을 지난달 폐점했다. 31일 오후 서울 중구 유니클로 명동중앙점에 영업 종료 안내문이..."
1637,2021.02.02.,"'e편한세상 시티 부평역', 소형 오피스텔로 '주목'","이 단지는 서울지하철 1호선·인천도시철도 1호선·GTX-B노선(예정) 환승역인 부평역을 도보로 이용할 수 있는 트리플 역세권 단지다. 대규모 상권이 모여있는 부평역 인근에 위치해 있어 롯데마트, 부평역 지하상가..."
1638,2021.02.01.,일할 곳 없고 일할 사람도 떠났다… 산업생태계 무너진 지방,■을씨년스러운 대구 대학가 지난 1월 29일과 30일 오후 계명대 주변 상권은 그야말로 오가는 사람 없이... ■‘부자도시’ 실상… 계속되는 '탈울산' 울산은 3년째 서울에 1인당 국민소득 1위 자리를 내줬다. 하지만 여전히...
1639,2021.02.09.,"'국내 7번째 매장' 신세계인터내셔날, 신세계백화점 강남점에 릭 오웬스 매장...",릭 오웬스 마케팅 담당자는 “릭 오웬스는 자신만의 독창적이고 개성 있는 패션을 추구하는 2030 세대에게 꾸준히 좋은 반응을 얻고 있다”며 “더 많은 고객들이 브랜드를 경험할 수 있도록 서울 핵심 상권에 신규...
1640,2021.02.08.,"""설날에도 편의점 불 켭니다""…귀포족ㆍ밸런타인데이 겨냥","오피스 상권은 매출 부진에 아예 문을 닫겠다는 점주도 많아졌다”고 설명했다. CU는 지난달 8일까지 점포... 구두약, 서울랜드 지구별 컬래버 상품을 내놨다. 세븐일레븐은 시멘트 브랜드 ‘천마표 시멘트 팝콘’를..."
1641,2021.02.02.,"천호·성내동, 낙후 이미지 벗고 '제2청량리' 부푼 꿈",노후 주거지가 많은 서울 강동구 천호동·성내동 지역이 도시 개발에 속도를 내고 있다. 일대 재개발... 함영진 직방 빅데이터랩장은 “천호동 로데오거리라고 불릴 만큼 상권과 유동인구가 많고 송파 등 도심과...
1642,2021.02.01.,"태영건설, 1308가구 규모 '용인 드마크 데시앙' 3월 분양","GTX-A노선(예정)과 서울-세종고속도로(예정)가 개통되면 서울 및 수도권 접근성이 더욱 개선될 전망이다. 용인 드마크 데시앙은 지역 핵심 로데오거리 상권과 함께 고림지구, 역북지구가 인접해 이들 지역의..."
1643,2021.02.10.,"관악구, 코로나19 극복 위한 소상공인·중소기업 맞춤형 융자지원","관악구청지점과 서울신용보증재단 관악지점에서 부동산 및 신용보증 담보평가액을 사전 상담 후, 신청서와 사업계획서, 사업자등록증, 최근 3년 부가가치세 과세표준증명원 등을 첨부해 구청 지역상권활성화과로 방문..."
1644,2021.02.10.,걸어서 GTX-B 노선…'e편한세상 시티 부평역' 관심 이어져,"노선이 개통되면 부평역(예정)에서 여의도역까지 10분대 이동이 가능해지는 등 서울 도심으로 이동이 더욱 편리해질 전망이다. 대규모 상권이 모여있는 부평역 인근에 위치해 있어 롯데마트, 부평역 지하상가 쇼핑몰..."
1645,2021.02.10.,"금융권, 설 맞아 따뜻한 나눔활동","함께 서울시 중구 중림동 소재 중림종합사회복지관을 방문해 '우리행복상자'를 전달했다. '우리행복상자'는... 지역상권 활성화를 위해 개최됐다. 이날 행사에서는 시장연합회장, 상인회장 등 시장관계자 환담을 통해..."
1646,2021.02.04.,성북구 골목상권 활성화 프로젝트 추진 성과?,"성북구 소상공인 ?사회적경제 골목상권 활성화 프로젝트는 서울시 사회적경제지원센터로부터 소상공인과 골목경제 위기를 극복하는 방안을 모색, 협력과 연대의 사회적가치를 통해 상생하는 골목상권을 조성하기 위한..."
1647,2021.02.03.,"코오롱FnC, 프리미엄 골프 ‘지포어’ 공식 런칭 현대 무역점 오픈","유통은 현대백화점 무역센터점을 시작으로 2월 내 더 현대 서울점, 신세계 백화점 강남점 등 주요 백화점에 입점, 점차 고객들과의 접점을 늘려갈 예정이다. 상반기 주요 상권 내 백화점 입점 이후 하반기 내..."
1648,2021.02.03.,용인반도체클러스터 사업 본격화…수혜 기대되는 '힐스테이트 용인 둔전역',"산업단지가 조성되면 대규모 일자리 창출로 주택수요가 꾸준하게 형성되며 교통, 상권, 학군 등 인프라... 이 노선을 통해 지하철 수인분당선 환승역인 기흥역까지 20분대로 이동이 가능하며, 환승하여 서울 강남, 경기..."
1649,2021.02.02.,[칼럼]4차 재난금은 선별&증세로…우린 얌체족,"서울 명동과 신촌, 대구 동성로, 광주 충장로 등 전국 대도시에 산재한 대표적인 상권 지역들과 백화점의 명품관을 둘러보면 재난지원금을 왜 맞춤형으로 집행돼야 하는지를 알게 될 것이다. 국회의원님들이시여, 제발 답..."
1650,2021.02.03.,"'확진 43명' 건대 헌팅포차발 집단감염…상인들 ""터질 게 터졌다""","""터질 게 터졌다고 생각했습니다."" 서울 광진구의 한 헌팅포차에서 신종 코로나바이러스 감염증(코로나19)... 골목 상권이 무너질까봐 걱정하는 목소리도 있었다. 먹자골목에서 가게를 운영하는 C씨는 ""헌팅포차..."
1651,2021.02.02.,"영등포구, 지역화폐 흥행시켜 그늘진 골목상권 살렸다","이는 85% 이상의 높은 결제율을 기록한 것으로, 서울 자치구 중 발행액, 결제액 모두 높은 성과를 냈다. 구는 코로나19로 위기에 빠진 지역 골목상권을 위해 구비 7억 원을 투입하며 상품권 발행 및 홍보에 힘쓴 결과..."
1652,2021.02.04.,"성북구, 골목상권 활성화 프로젝트 진행","'성북구 소상공인 – 사회적경제 골목상권 활성화' 프로젝트는 서울시 사회적경제지원센터로부터 소상공인과 골목경제 위기를 극복하는 방안을 모색하고, 협력과 연대의 사회적가치를 통해 상생하는 골목상권을..."
1653,2021.02.17.,빠른 사업진행에 탄탄한 인프라 누린다! 도시개발사업으로 공급 나서는 단지 ...,"김포도시철도를 통해 서울, 여의도로 빠르게 접근이 가능한 배후주거지이며, 김포 한강시네폴리스 사업도... 업무지구, 상권 등의 인프라 형성에 신중을 가하는 편”이라고 전했습니다.올 상반기 도시개발사업으로 공급..."
1654,2021.02.01.,"이재수 춘천시장 ""지역력 높여 살고싶은 춘천 만들 것""","그래서 어르신들 마스크 끊이지 않게 공급해드리고 있고, 서울 수도권 출입하시는 분들이 언제 어느 때고... 저희가 '상권르네상스 사업'이라고 해서 재래시장 소상공인을 위한 프로그램을 예산으로 따온 게 있어요. 그..."
1655,2021.02.10.,"코로나19로 한 번, 임대료로 두 번 우는 자영업자들","커버스토리③ 상한선 없는 임대료, 자영업 경쟁력 약화시킨다 지난해 10월 5일 서울시 홍은동에 개업한... 애정을 담아 몇 년에 걸쳐 공간을 가꾸며 상권 형성에도 기여한 자영업자들은 이에 대한 보상조차 제대로 받지..."
1656,2021.02.10.,KT '4차 산업혁명 원유' 데이터 시대 이끈다,"(부동산ᆞ상권), 경기대(배달이동경로), 한국인터넷진흥원(불법 광고 스팸 콘텐츠) 등 다양한 생활·공공... KT는 지난해 11월 서울시 서초구 KT 연구개발센터에 개인, 기업 등 누구나 빅데이터를 활용할 수 있는 '통신..."
1657,2021.02.09.,"김미경 은평구청장 ""신분당선 연장 추진해야…지역경제 활성화 도모""","다행인 점은 새절역~신촌~여의도~서울대입구 구간을 연결하는 서부경전철이 민자 적격성에 통과됐어요. GTX-A 노선도 착공했고요. 2024년 개통 후 연신내역을 중심으로 지역상권 활력에 기여할 것으로 보입니다."" 신분당선..."
1658,2021.02.04.,동청사에 청년창업센터·주택,송파구 공공부지 복합개발 주민생활 기반시설도 확보 서울 송파구가 낡은 방이2동주민센터를 복합개발해... 공원 지하에는 차량 383대를 주차할 수 있는 공영주차장을 조성해 방이맛골 등 지역상권 활성화와 연계한다. 이...
1659,2021.02.04.,"정부, 전국 501개 전통시장 주변도로 오늘부터 주차 허용","행정안전부와 경찰청은 설맞이 전통시장 이용 활성화와 지역상권 내수 진작을 위해 5일부터 14일까지 인천 종합어시장, 수원 권선시장, 서울 경동시장, 부산 평화시장 등 전국 501개 전통시장 주변도로에 최대..."
1660,2021.02.09.,"용산구, 아트테리어 프로젝트 참여 예술가 15명 모집… 540만원 활동비 지급","모집대상은 서울에 거주 중인 시각 및 조형 관련 예술가이며 현재 구에 거주하거나 창작 활동 기반이... 사업을 벌이고 있다""며 ""특히 아트테리어 프로젝트를 통해 경리단길 일대 상권 경쟁력을 강화할 것""이라고 말했다."
1661,2021.02.10.,"천지개벽 예정된 지역 상업·업무용 부동산에 꾸준한 관심이어져,주목할 만한...","상권이 형성되기 전 비교적 저렴한 가격에 상업시설 매수할 경우 개발이 점차 진행되어 차후 상권이... 인천2호선 검단 연장, 서울지하철 5호선 연장, GTX-D 노선 등이 개발예정이다. 이러한 이유로 인천검단 서영아너시티..."
1662,2021.02.04.,10일간 최대 2시간! 설맞이 ‘전통시장 주변 도로’ 주차 한시 허용,"행정안전부와 경찰청은 설맞이 전통시장 이용 활성화와 지역 상권 내수 진작을 위해 2월 5일(금)부터 14일(일)까지 열흘간 서울 경동시장, 부산 평화시장, 수원 권선시장 등 전국 501개 전통시장 주변 도로에 최대..."
1663,2021.02.15.,"[더벨]코람코, '케이스퀘어 상계' 인수자에 코켐 낙점",노원구 중계동 364-19에 자리잡고 있으며 서울에서 입시학원이 밀집해 있는 대표적 지역인 '중계동 은행사거리 학원가'의 핵심입지다. 덕분에 중계동 학원 상권에서 풍부한 임차수요를 확보하고 있다는 점이...
1664,2021.02.02.,"영등포구, 지역화폐 '영등포사랑상품권' 흥행","이는 85% 이상의 높은 결제율을 기록한 것으로, 서울 자치구 중 발행액, 결제액 모두 높은 성과를 냈다. 구는 코로나19로 위기에 빠진 지역 골목상권을 위해 구비 7억원을 투입해 상품권 발행 및 홍보에 힘쓴 결과..."
1665,2021.02.05.,전남 순천 신대지구에 최대규모 대형마트+오피스텔 세운다,"시행사 측에서는 신대지구 중심상권에 들어서는 만큼 국내 최고의 프리미엄 브랜드를 시공사로 내세울... 있음에도 서울 최고의 건축사를 영입해 설계, 차별화된 외관과 내부시설을 선보이려 준비하고 있다”며..."
1666,2021.02.04.,"중기중앙회, 협동조합 지원 조례 제정 시흥시에 감사패 전달","시흥시에는 한국금형조합, 시화공구상가조합, 시화유통상가조합, 서울경인고압가스조합 등 총 11개의... 경쟁력 강화와 소상공인 집적 유통상가 지원 등 상권 활성화를 위한 시흥시의 적극 행정 지원을 당부한다""고 전했다."
1667,2021.02.12.,"고양시 삼송동·창릉동, 설 명절 앞두고 저소득층에 상품권 지급","삼송서울정형외과, 삼송동상점가상인회, 다함봉사단 온누리상품권 후원…지역상권 활성화 기대 설 연휴를 앞두고 고양시 덕양구 삼송동행정복지센터(동장 이재천)와 창릉동행정복지센터(동장 이병영)에 어려운 이웃을..."
1668,2021.02.17.,"소자본 삼겹살 프랜차이즈창업 '고기원칙', 창업혜택으로 고기집창업 비용에 ...",스포츠 서울에서 주관한 '소비자선호도 1위 브랜드 대상'을 수상하며 삼겹살체인점창업 브랜드로 이목을... 이 외에도 고기원칙창업 시 점포 개설에 들어가면 본사의 철저한 상권 분석을 통해 권리금과 보증금이 높은 S급...
1669,2021.02.01.,"태영건설, ‘용인 드마크 데시앙’ 3월 분양 예고…총 1308가구 규모","특히 신설되는 GTX-A노선(예정)과 서울-세종고속도로(예정)가 개통되면 서울 및 수도권 접근성이 더욱 개선될 전망이다. 용인 드마크 데시앙은 지역 핵심 로데오거리 상권과 함께 고림지구, 역북지구가 인접해 이들..."
1670,2021.02.01.,"태영건설, ‘용인 드마크 데시앙’ 3월 분양 예고…총 1308가구 규모","특히 신설되는 GTX-A노선(예정)과 서울-세종고속도로(예정)가 개통되면 서울 및 수도권 접근성이 더욱 개선될 전망이다. 용인 드마크 데시앙은 지역 핵심 로데오거리 상권과 함께 고림지구, 역북지구가 인접해 이들..."
1671,2021.02.08.,대형 키즈파크에 탄탄한 배후수요 더한 포레나 루원시티 단지 내 상가 분양,일반적으로 키즈 관련 업종이 형성된 상권은 가족 단위의 방문객이 많아 안정적으로 수요를 낼 수 있다.... 향후 서울지하철 7호선 청라 연장선이 개통되면 더욱 큰 미래가치가 기대된다. 분양 관계자는 “키즈파크 입점...
1672,2021.02.04.,"중기중앙회, 중기협동조합 지원조례 제정 시흥시에 감사패 전달","시흥시에는 한국금형조합, 시화공구상가조합, 시화유통상가조합, 서울경인고압가스조합 등 11개의... 경쟁력 강화와 소상공인 집적 유통상가 지원 등 상권 활성화를 위한 시흥시의 행정 지원을 바란다”고 말했다. 오세은"
1673,2021.02.13.,"'화성동탄1차 대방디엠시티' , 동탄대로 골든블럭 핵심상권","35㎞를 계획 중인데, 트램이 지상 노선이기 때문에 지역 상권이 활성화되는 효과까지 있어 상업시설... 향후 서울역~연신내~킨텍스~운정으로 노선이 연장될 예정이다. 동탄역은 GTX-A∙인덕원선 복선전철∙트램 등 4개..."
1674,2021.02.09.,[규제가 낳은 역차별] 토종 유통기업에만 족쇄 … 코스트코·이케아 웃었다,롯데그룹의 상암디지털미디어시티(DMC) 복합쇼핑몰 개발사업이 지난달 마침내 서울시 심의를 통과했다. 지난... 상생법 무시하는 글로벌 유통 공룡 골목상권 보호를 이유로 국내 유통기업이 엄격한 규제를 받고 있는 동안...
1675,2021.02.08.,‘추억 극장’ 정말 추억속에서만 열릴 위기,모르겠어요….” 서울 종로구 낙원상가에서 국내 1호 실버영화관을 운영 중인 ‘추억을파는극장’ 김은주... 하지만 노인들의 폭발적 반응으로 주변 상권도 활성화되면서 반응은 점차 긍정적으로 바뀌었다....
1676,2021.02.04.,"리뷰로 소비자 지갑 활짝, 품질로 단골확보","서울장수주식회사가 지난 9월 출시한 유자맛 막걸리 ‘달빛유자’도 SNS에서 화제가 되며 3개월만에 10만병 판매돌파, 품귀현상 등을 겪은 N차 구매템이다. 전통주 특화상권 활성화를 위해 은평구와 함께 개발한..."
1677,2021.02.02.,"송파구, 설맞이 송파사랑상품권 200억원 발행",이에 서울 송파구(구청장 박성수)는 코로나 경제위기 상황 속에서 소상공인이 어려움을 극복할 수 있도록... 이는 다시 골목상권의 매출로 연결됨으로써 지역경제의 선순환 구조에 건실한 역할을 하였다. 박성수...
1678,2021.02.19.,"불굴의떡볶이, 공식 홈페이지 오픈…떡볶이 창업 가맹사업 본격화","지난해 11월, 서울 신촌에 직영점을 개점하며 떡볶이 창업 브랜드를 론칭한 불굴의떡볶이가 지난 15일... 홍대 상권에 배달 직영점을 운영하며 관련 경험, 특히 배달에 특화된 각종 데이터와 노하우를 축적하였으며 이를..."
1679,2021.02.09.,지역대'업' 총장에 듣는다 <3> 부산외국어대 김홍구 총장,"숙명여대가 서울 용산구 등이 투입한 100억 원대 예산을 지원받아 청년 커뮤니티 활성화를 위한 도시재생에... 지역상인과 부산외대 학생, 청년창업가가 협업해 국내외 관광객이 찾는 특화된 상권으로 변모시키는..."
1680,2021.02.09.,지역대'업' 총장에 듣는다 <3> 부산외국어대 김홍구 총장,"숙명여대가 서울 용산구 등이 투입한 100억 원대 예산을 지원받아 청년 커뮤니티 활성화를 위한 도시재생에... 지역상인과 부산외대 학생, 청년창업가가 협업해 국내외 관광객이 찾는 특화된 상권으로 변모시키는..."
1681,2021.02.02.,"올해도 계속되는 폐점 행렬…유니클로, 2월만 10곳 문 닫아","2일 관련 업계에 따르면 유니클로는 이달 서울과 경상도, 전라도 지역에서 10개 매장을 철수한다. 오는... 것으로 예상되는 상황에서 주요 상권이 붕괴되고 있기 때문에 매장 철수도 계속될 것으로 생각된다""고 말했다."
1682,2021.02.17.,"코로나 불황 속 임대성공 거둔 메디컬빌딩 '스퀘어128', 통매매로 전환","빌딩 전체가 병,의원으로만 입점되는 스퀘어 128은 서울 강남을 대표하는 전통시장인 남성사계시장 내에 위치해 하루 유동 고객 2만명을 상회하는 특급 상권이다. 특히 도로변에 주로 지어졌던 메디컬빌딩의 기존 틀을..."
1683,2021.02.08.,상업용 부동산 투자수익률 4분기 큰 폭 상승… 신표본 집계 이래 신고점,대표하는 상권으로 자리매김할 전망이다. 구리도시공사와 갈매PFV는 2월 경기도 구리시 갈매동 일원에서... 요진건설산업은 서울시 성동구 도선동 2번지 외 4필지에 들어서는 '왕십리역 요진 와이하우스'를 분양...
1684,2021.02.09.,"신세계인터내셔날, 신세계강남점에 미국 럭셔리 브랜드 ‘릭 오웬스’ 매장 오...",릭 오웬스 마케팅 담당자는 “릭 오웬스는 자신만의 독창적이고 개성 있는 패션을 추구하는 2030 세대에게 꾸준히 좋은 반응을 얻고 있다”며 “더 많은 고객들이 브랜드를 경험할 수 있도록 서울 핵심 상권에 신규...
1685,2021.02.15.,"자영업자 상생 파트너 은행 ② 진옥동 신한은행장, 소상공인 ‘경영파트너’ ...","금융·경영·상권·창업 관련 상담과, 외부 전문가를 통한 전문컨설팅을 제공한다. 신한 SOHO성공지원센터는 서울지역에 3개 센터를 운영하고 있으며 각 센터마다 1명의 센터장이 배치돼있다. 센터장은 신한은행..."
1686,2021.02.01.,"백군기 용인시장, “난개발 오명 씻고 세계적 반도체 도시로”","일자리가 없어서 다 서울로 갔다가 밤에는 잠만 자는 도시로 불렸고, 광교산을 중심으로 수지·기흥이... 무엇보다 코로나19로 경제적 타격을 입은 골목상권을 살리기 위해 1561억원 규모의 용인와이페이를 발행하고..."
1687,2021.02.12.,"문석진 서대문구청장, '영천시장 지하주차장' 건립 협조 요청",▲ 문석진 구청장(가운데)이 서정협 서울시장 권한대행(오른쪽)에게 ‘영천시장 지하주차장’ 건립 계획을... 건립되면 상권 활성화는 물론 천연충현도시재생 사업과 연계한 시너지 효과도 기대된다고 강조했다. 구는...
1688,2021.02.01.,"코로나시대, 맞춤형 카드로 '스마트 소비' 하자","현재 서울 기준으로 5인 이상의 사적 모임은 금지되고, 식당이나 술집 등의 매장에선 9시가 넘어선 머물 수... 예이 카드는 ‘홈족, ‘홈코노미 상권’에 특화된 혜택을 구성했다. OTT(실시간 온라인 동영상) 서비스와..."
1689,2021.02.06.,"매출 63% 추락, 극장 줄폐업…먹구름 짙어지는 영화계","영화 촬영지였던 서울 마포구 수퍼와 종로구 자하문 터널 계단, 동작구 피자가게 등은 ‘기생충 탐방... 영화관 주변 상권에 미치는 영향도 작지 않다. 영화관은 유동인구를 끌어주는 ‘샤워효과(shower effect)’로..."
1690,2021.02.10.,용인반도체클러스터 사업 후광 기대…‘용인 드마크 데시앙’ 분양 예정,"특히 신설되는 GTX-A노선(예정)과 서울-세종고속도로(예정)가 개통되면 서울 및 수도권 접근성이 더욱 개선될 전망이다. 지역 핵심 로데오거리 상권과 함께 고림지구, 역북지구가 인접해 이들 지역 생활인프라를 모두..."
1691,2021.02.08.,[포토뉴스] 이토록 낯선 ‘명동’,"팬데믹이 해를 넘겨 장기화되면서 강남, 이태원, 신사동 가로수길 등 서울 시내 핵심 상권의 공실률이 유사 이래 최대치를 기록 중이다. 지난 10일 오후 을지로입구역 방면 명동 초입에도 ‘임대문의’를 내 건 빈..."
1692,2021.02.04.,'완판 단지' 내 상업시설…분양 호조,"지난해 12월 서울 구로구에서 분양한 '힐스 에비뉴 신도림역 센트럴'은 계약 개시 5일만에 52실 점포가... 실제 신한카드 빅데이터센터인 Trendis가 분석한 상권 유형별 요식업종 소비변화에 따르면, 지난해 2분기 기준..."
1693,2021.02.11.,"우상호, 박주민 의원과 설 앞두고 대림시장 민생 살피기","우 의원은 상인들에게 ""코로나19로 위기를 겪고 있는 전통시장과 골목상권이 활력을 되찾길 기대한다""며 ""서울시장에 당선되면 위축된 소상공인의 매출을 끌어올릴 수 있도록 모든 역량을 집중하겠다""고 약속했다...."
