,date,title,contents
1610,2021.10.06.,"카카오 난타 국감...김범수 ""골목상권 손 떼겠다""(종합)",포쓰저널 박소연 기자 김범수 카카오 이사회 의장이 5일 서울 여의도 국회에서 열린 국회 정무위원회 국정감사에 증인으로 출석해 발언하고 있다./사진=연합뉴스 골목상권 침해와 플랫폼 기업의 갑질 등 각종 논란을 사고...
1611,2021.10.14.,'건대입구역 라움 에비뉴' 분양 예정… 유명 프랜차이즈 외식업체 등 입점 ,"'건대입구 맛의거리'를 비롯해 '로데오거리', '스타시티몰', '양꼬치거리', '커먼그라운드' 등 지역 명소로 발돋움한 대형 상권이 인접해 적잖은 수혜 효과가 기대된다. 서울 지하철 2호선과 7호선 더블 역세권 입지도..."
1612,2021.10.14.,"하남시 방미숙 의장 ""시민에게 신뢰받는 의회로 거듭나도록 최선 다할 터""","(김포-부천-서울-하남) 연결 광역급행철도(GTX-D)의 원안 추진 호소문 등 의원 모두가 한목소리로 결의안 및... 그러나 한편으로는 교산신도시 조성에 따른 현안을 비롯해 열악한 교통여건 개선, 골목상권 활성화, 원..."
1613,2021.10.12.,'4대 업무지구' 발돋움하는 마곡지구…어디까지 왔을까?,"르웨스트 에비뉴 767은 마곡지구 내 입주 기업 근로자 수요와 마곡지구, 강서구 등 거주민 수요를 품고 있어 365일 활발한 상권이 형성될 것으로 기대되며, 인근의 서울식물원, LG아트센터(예정) 등 폭 넓은 광역수요를..."
1614,2021.10.05.,"경주시, 오는 12월 새로운 복선전철개통으로 폐역되는 경주역...문화플랫폼으...","공공청사, 상업시설 들어서는 중장기 계획, 폐역 직후 상권 활성화 단기 계획 추진 최주호 기자 cjh@ajunews.com... 한편, 제3차 국가철도망 구축사업에 따라 오는 12월 신설 개통되는 복선전철 운행구간은 KTX 노선(서울-신경주..."
1615,2021.10.21.,"하이엔드 오피스텔 ‘라포르테 블랑 서현’, 우수한 상품성으로 투자가치 UP!","경부고속도로, 분당~수서간 도로 등 차량을 이용한 서울 접근성도 좋다.교통 호재도 많다. 2024년 개통... 이 외에 성남시 내부를 연결하는 성남도시철도 1, 2호선 사업도 계획되어 있다.서현역 상권 및 AK플라자..."
1616,2021.10.15.,"[IT/과학 주간 핫 이슈] 골목상권 침해 인정한 김범수 카카오 의장...""성공에...","◇ 골목상권 침해 인정한 김범수 카카오 의장...""성공에 취해 있었다"" 김범수 카카오 의장이 7일 서울 여의도 국회에서 열린 산업통상자원중소벤처기업위원회의 중소벤처기업부 등에 대한 국정감사에서 얼굴을 만지고..."
1617,2021.10.09.,국감 '플랫폼 때리기'...스타트업 사기 꺾을까 우려,골목상권 침해 논란 등에 대해 집중 질타를 받았다. 특히 3년 만에 국감 증인으로 출석한 김범수 의장에... 7일 서울 여의도 국회에서 열린 산업통상자원중소벤처기업위원회의 중소벤처기업부 등에 대한 국정감사에서...
1618,2021.10.08.,"여주 썬앤빌 더 시그니처 2단지, 분양 예정",시 서울까지 30분대 진입이 가능하다”고 설명했다. 시공사 측에 따르면 여주시청 주변 도심을 연결하는 보도교량인 문화예술교가 2023년 12월 완공 예정이며 조성되면 여주시청 및 강남 상권을 도보로 이동할 수 있게...
1619,2021.10.01.,골동품·한약재에 수목원…동대문 전통시장서 타임머신 타세요,"동대문구에서는 수천 년의 역사를 가지고 있는 서울약령시부터 골동품이 가득한 고미술상가, 풍물시장... 이후 수산시장과 청과물시장까지 갖춰 70년이 넘는 세월 동안 제기동역부터 청량리역 사이의 상권을 형성하는 데..."
1620,2021.10.14.,[책산책] 김일성 진짜 모습은?···해방 전 33년 삶 추적 <김일성 1912~1945...,"유순호(兪順浩)가 쓴 &lt;김일성, 1912~1945&gt; 전 3권(서울셀렉션, 2020)이 바로 그것이다. 이 책은 상권(성장과 시련, 748쪽) 중권(희망과 분투, 885쪽) 하권(역경과 결전, 1220쪽) 등으로 구성돼 있다. 저자는 중국 길림성..."
1621,2021.10.08.,"[국감 2021] 국토위, '독과점' 맹공...류긍선 카카오모빌리티 대표 ""택시업계...","8일 서울 여의도 국회에서 열린 국토교통위원회의 한국도로공사 등에 대한 국정감사에서 류긍선 카카오모빌리티 대표가 증인으로 출석, 플랫폼 독과점 문제와 골목상권 생태계 침해에 관해 집중 질의를 받았다. 박상현..."
1622,2021.10.12., 파주시 공무원 31% 타 지역 주소…인구 늘리기 정책 역행,"지역 상권에 큰 영향을 미치고 있어 비난을 받고 있다. 12일 파주시에 따르면 파주시에 주소를 두고있는 직원은 파주시 1478명(69)%, 고양시 351명(16,4)% 김포시 27명(1,26)% 서울시 122명(5,7)% 기타 시 158명(7,4)% 등이다. 특히 4인..."
1623,2021.10.13.,경쟁사 온라인 집중하는데…오프라인 키우는 '오아시스마켓',서울 주요 상권에 오프라인 직영매장을 갖추고 있고 양질의 신선식품을 최저가에 판매할 수 있는 오아시스마켓이라면 아마존의 방법을 벤치마킹해 '신선식품 무인화 매장' 사업에 진출할 가능성이 열려 있다.
1624,2021.10.09.,[브리핑 충남] 충남도·국토교통부 '충남형 알뜰교통카드' 도입 업무협약 체결,'밤톨 장터'는 얼굴 있는 먹거리와 이야기가 있는 공예품을 판매하는 산성 상권 토요 장터라는 뜻이 담긴... 문정우 금산군수는 지난 7일 소비 판촉 행사가 열리는 이마트 에브리데이 서울 이문점을 찾아 고객들이...
1625,2021.10.05.,"윤석열, 캠프에 민생대책위 출범…""자영업자·소상공인 살릴 터""","이날 윤석열 국민캠프에 따르면 캠프는 직능본부에 민생대책위원회를 신설해 골목상권 회복과 서민경제... 1차 영입으로 민상헌 한국외식업중앙회 전 서울회장, 김선희 한국이용사회중앙회장, 김정학..."
1626,2021.10.15.,홈 어라운드 소비 증가에 따른 단지 내 상가 관심 ‘송도 하늘채 아이비스퀘어...,"외부 활동 시간 줄자 대형 상권보다 주거지가 밀집한 단지 내 상가 강세 코로나19로 집 근처에서 필요한... 해당 상가가 위치한 송도는 GTX-B 노선의 최대 수혜지가 될 예정으로, 서울 강남까지 다이렉트로 연결되는 최적의..."
1627,2021.10.13.,[유통가 24시] 아성다이소·쿠팡·현대백화점 외,"위니아딤채가 기증한 세탁기, 건조기, 공기청정기 등의 가전제품은 서울 성동구 성수동에 새롭게 문을 연... MZ세대 고객을 타깃으로 한 콘텐츠와 마케팅에 집중해 금융·증권사가 밀집돼 있는 여의도 상권과 IT기업이..."
1628,2021.10.11.,[통일로 칼럼] '꼼수와 생색내기' 자영업 손실보상,"서울정부청사 입구에 걸린 소상공인과 자영업자의 손실보상 일대수술 요구 구호 정부가 8일부터 소상공인과... YS 정권은 WTO 가입을 계기로, 정부는 유통법을 개정해 대형마트의 골목상권 침투를 허가제에서 등록제로..."
1629,2021.10.03.,"'쥴리 벽화' 논란 건물 ""매물로""...희망가 '240억원'","이 건물은 서울 종로구 관철동에 위치하고 있으며, 매각 희망 제시 가격은 240억원으로 알려졌다. 건물주인 여모씨는 신종 코로나바이러스 감염증(코로나19)으로 상권이 침체돼 임차인을 구하기 어려워 매각을 결정한..."
1630,2021.10.05.,동탄역 중심상권 대형 상업시설 ‘그란비아스타’ 상가 분양,GTX-A노선은 파주 운정-킨텍스-서울역-삼성역-동탄 83㎞를 잇는 3개 노선 가운데 사업 속도가 가장 빨라 착공이 진행됐고 2024년 말 또는 2025년 초 완공 예정이다. 동탄인덕원선은 지하철 4호선 인덕원역에서 영통역을...
1631,2021.10.12.,수도권 주거형 오피스텔 쏠림 현상 꾸준... 이유는?,"수원역 복합역세권을 중심으로 로데오거리상권 내 편의시설, CGV영화관, AK플라자, 팔달공원 등 다양한 생활편의 인프라를 모두 가깝게 누릴 수 있다.또 서울 용산구 한남동에서는 신영한남동개발PFV이 '브라이튼 한남..."
1632,2021.10.02.,[WE+] 맞닿은 혈맥 뚫리니 바다는 심장이 뛴다,■ 강릉 4주년 맞은 서울~강릉 KTX 서울 중심부 1시간 시대 열어 체류형 등 관광패턴 다양화 '1순위 여행지... 지역상권의 활기도 젊은 상인에게서 나온기 마련이다.속초에서 핫플레이스로 각광 받고 있는 '칠성조선소...
1633,2021.10.08.,"국감 출석한 안성우 직방 대표 ""공인중개사들과 상생 방안 검토""",안성우 직방 대표가 15일 서울 성수동 코사이어티에서 열린 직방 10주년 미디어데이 기자간담회에서 발언하고 있다. 2021.6.15 /직방 제공 대형 온라인 부동산 플랫폼의 영역 확장으로 인한 '골목상권' 침해 논란(10월7일자...
1634,2021.10.08.,신한은행 배달앱 '땡겨요' 12월 출격…혁신 통할까,"신한은행은 강남·서초·송파 등 서울 5개구 1만5천개 가맹점에서 우선 서비스한다. 이를 위해 현재 가맹점... 금융권 관계자는 ""네이버, 카카오, 배달의민족 등 주요 플랫폼 기업들과 관련한 시장 독과점, 골목상권 침해..."
1635,2021.10.06.,"[2021 국감] 중기부, 7일 카카오·중고차 등 골목상권 침해 쟁점 부각","이투데이=고종민 기자 | 골목상권 침해, 소상공인들과 상생안, 독점 구조의 온라인 플랫폼 개선 여부 등의... 정만기 한국자동차산업협회장과 안병열 서울시 자동차매매사업조합 이사장이 각각 완성차업계와 중고차업계를..."
1636,2021.10.08.,지축지구 소형 오피스텔 '라코드' 분양 개시,114 REPS에 따르면 수도권 지역 전용면적 20㎡ 이하 오피스텔 공급은 서울지역 46%(2016년 7016실→2020년 3826실)... 유동인구가 많아 빠른 상권 형성으로 안정적인 생활 인프라 형성이 기대된다. 오피스텔 중심 상권이...
1637,2021.10.13.,[집중점검] '위드코로나' 생각보다 빨리 온다. 로드맵 이달 말 나올 듯,"지역사회 일상회복과 골목상권 및 소외지역 경제 활성화 지원 방안은 자치안전 분과에서 마련한다. 이 분과에는 고길곤 서울대 행정대학원 교수, 대한민국 시도지사협의회 회장인 송하진 전북도지사를 비롯한 민간위원..."
1638,2021.10.19.,"임차수요 꾸준한 불황 없는 대학가 상권, 직장인 상권","이렇게 임차수요가 많은 상권일수록 불황기에도 가격 하락의 위험이 적고 수입이 꾸준하며 환금성 또한 좋다는 것도 장점이다.여기에 수요가 한 개가 아닌 더블이 되면 금상첨화다. 일례로, 서울의 광화문중심업무지구의..."
1639,2021.10.13.,철길 따라 세월 흘러도 추억은 남은 곳,"경제개발이 본격화하면서 서울 등 대도시에 필요한 시멘트, 무연탄, 목재, 석회석 등이 많이 필요했는데... 당시 제천역은 많은 화물과 여객이 오가면서 인근 상권이 활발했다. © 한국철도공사 제천역 한때 제천역의..."
1640,2021.10.14.,"[10월 13일 병원계 이모저모③]고려대의료원, 한림대성심, 한양대류마티스병원...","서울 성북구 소재 7,150평 대지에 위치한 메디사이언스파크는 신종 감염병 시대에 대처하고자 조성된... 이를 통해 보호종료아동들의 자립생활을 지원하고, 경기침체로 어려움을 겪고 있는 골목상권과 전통시장..."
1641,2021.10.04.,신선식품 공략 나선 온라인쇼핑몰…SSM도 코로나 생존전략 활용,4일 유통업계에 따르면 쿠팡은 최근 전남 완도에서 채취한 전복을 다음 날 새벽 서울 지역 고객에게... 편의점이 동네 상권을 흡수하며 매출이 급감 한데 따른 자구책 마련 움직임이다. 산업통상자원부가 지난달 28일...
1642,2021.10.07.,이색 단지 '이비자 가든',"연간 많은 인파가 방문할 것으로 추산되는 만큼, 전체 상권 활성화에 긍정적 영향을 보일 것으로 예측된다. 또한 단지 부근으로 서울 지하철 및 수인선 환승역인 오이도역이 있어, 서울 및 수도권 각지에서의 이동이..."
1643,2021.10.05.,"㈜건영, '라포르테 블랑 서현' 10월 분양 예정","경부고속도로, 분당~수서간 도로 등 차량을 이용한 서울 접근성도 좋다. 교통 호재도 많다. 2024년 개통... 서현역 상권 및 AK플라자, 현대백화점, 롯데백화점 등 편의시설 이용이 편리하며 분당구청, 분당세무서..."
1644,2021.10.05.,"[국감 2021] 골목상권서 나온 카카오...김범수 의장 ""미래 기술 도전에 집중할...","사진=국회 김범수 카카오 의장이 골목상권 침해 논란과 관련한 문제제기에 ""카카오가 할 것과 아닐 것을 구분하고, 미래 기술에 대한 도전 쪽에 집중하겠다""는 입장을 나타냈다. 국회 정무위원회는 5일 서울 여의도..."
1645,2021.10.10.,"""10년 만에 대구로 돌아온 농구열기""...가스공사, KBL 개막 2연승","가스공사의 전신 인천 전자랜드 시절부터 응원해왔다는 양모(37·서울시)씨는 ""어제 울산에서 열린 시즌... 농구 경기를 준비하는 직원들이나 관중들이 주변 식당에서 식사도 하고, 커피도 마시고 하니 상권도..."
1646,2021.10.01.,"낙후된 명동역 뒷골목 '재미로', 만화거리로 도약 꿈꾼다","서울지하철 4호선 명동역부터 남산 케이블카 타는 곳까지 이어지는 길이 450m 남짓한 작은 골목, 명동 재미로.... ""재미로 통해 희망"" 신종 코로나바이러스 감염증(코로나19)에 가장 큰 타격을 받은 상권이기도 한 명동과..."
1647,2021.10.11.,[브리핑 충북] 제43주년 자연보호헌장 선포기념 유공자 표창 수여식 개최,이번 사업은 생계형 상권이 밀집한 구간을 대상으로 노후화되고 원색적인 간판과 창문이용광고물을... 개통으로 서울에서 제천까지 1시간이면 이동할 수 있는 접근성 등 '귀농·귀촌 최적지 제천'을 적극적으로 소개할...
1648,2021.10.05.,"윤석열 국민캠프, '민생대책위원회' 출범","민생대책위원회는 향후 직능단체 중앙회 및 지부와 협력해 골목상권 활성화와 1000만 직능인의 권익보호를 위해 활동할 계획이다. 국민캠프 측은 1차 영입으로 민상헌 한국외식업중앙회 전 서울회장, 김선희..."
1649,2021.10.09.,새 백화점 혁신 콘셉트로 성공 잰걸음,올 2월말 개관한 더현대 서울이 좋은 예다. 개점 전 ‘에루샤가 입점하지 않아서 괜찮을까’. ‘쇠락하는 여의도 상권에서 잘 버틸 수 있을까’하는 회의론이 고개를 들었지만 결과는 완전히 빗나갔다. 개점 200여...
1650,2021.10.08.,"[오늘의 유통가] GS샵, 양방향 '품질 서비스' 오픈 外",서울 용산구 한남동에 위치한 카페 콘하스 한남점과 비이커 한남점에 첫 팝업 스토어를 열었다. 코텔로는 SSF샵과 패션 플랫폼 W컨셉 등 온라인 채널에서 사업을 전개하는 동시에 20~30대 여성들이 즐겨 찾는 상권에...
1651,2021.10.13.,"경기 남부권 라이벌 롯데·신세계·현대·갤러리아百, 고객 유입 경쟁 치열",경기 남부권은 서울시 집값 상승에 대한 풍선효과로 인구가 급증한 지역이다. 부동산업계 관계자는... 현대백화점 판교점에 YP 라운지를 선보이는 이유는 상권 특성 때문이다. IT기업이 밀집돼 고소득 2030세대가 많은...
1652,2021.10.15.,지축지구 역세권 첫번째 소형 오피스텔 '라코드' 분양,연신내역에 2023년 GTX-A노선이 개통되면 서울 주요 지역으로의 이동이 더욱 편리해 진다. 라코드는 지축지구에 지어지는 첫 번째 오피스텔이다. 역세권으로 빠른 상권 형성을 기대할 수 있다. 오피스텔 중심 상권이...
1653,2021.10.05.,"[국감 2021] 글로벌 꿈꾸는 김범수의 약속 ""골목상권 침해, 이제 절대 없을 것...","골목상권은 절대 겨냥하지 않겠다는 입장을 내놨다. 택시부터 대리운전까지, 모빌리티 논란...김범수 ""상생방안 찾을 것"" 김 의장은 5일 서울 여의도 국회에서 열린 공정거래위원회 국정감사의 증인으로 출석해 최근 논란이..."
1654,2021.10.07.,세종시 대학공동캠퍼스에 '세종NC캠퍼스타운' 공급 예정,"실제로 세종시 4-2생활권 집현동 공동캠퍼스 부지에 서울대학교를 비롯해 충남대·충북대·공주대... 주거 상권 1만여 배후단지를 비롯해 명문대학 교육 상권 공동 캠퍼스, 세종을 대표하는 블루존 테마파크 등이..."
1655,2021.10.08.,[눈길끄는전시] 현대시대를 덧입힌 도자 예술 '그릇의 한계를 넘다',"2019년 '확장과 감성'(갤러리이즈, 서울), 2020년 'Construct'(갤러리 바이올렛, 서울), 'Architectural Imagination... 주택과 상가가 뒤섞인 구도심의 쇠락한 상권에 있는 공간으로, 관람객의 문턱도 낮다. 그의 추상적이면서..."
1656,2021.10.05.,신흥 교통요충지 경기 동탄역 중심상권에 대형 상업시설 분양 활발,"중심상권은 더욱 활성화될 전망이다. 이마트 트레이더스 동탄점은 지하 2층, 지상 4층에 연면적 5만1771㎡ 규모로 조성된다. 분양 관계자는 “주로 서울로 출퇴근하는 다른 신도시와는 달리 동탄신도시는 대기업..."
1657,2021.10.05.,비규제 부동산 신바람 … 그 이유는 ?,"중심상권내에 위치하고 신분당선 삼송 연장선(예정)과 GTX-A노선(23년 예정)의 트리플 교통호재, 은평뉴타운·삼송,·지축지구 등 약5만여 배후세대를 둔 서울 생활권내 최적 입지다”라고 관계자는 덧붙혔다. 한..."
1658,2021.10.15.,"[시경초대석] ""카카오, 동네 헤어숍까지 위협... 相生 진심이면 협약 나서라""","골목상권 잠식"" ""카카오, 사전 협의도 없이 상생안 일방 공개"" ""알맹이 없는 면피용 대책... 진정성 의심... 5일 &lt;시장경제&gt;는 서울 영등포구 여의도에 위치한 소상공인연합회에서 오세희 신임 회장을 만났다. 취임 후 그의..."
1659,2021.10.14.,조승래 '억강부약' 민생국감 드라이브,골목상권 보호 등 서민 생활과 직결된 분야에서 강한 자를 누르고 약한 자를 도와준다는 이른바 억강부약... 조 의원이 최근 서울YMCA에서 제출받은 '온라인 플랫폼 이용자 보호와 진흥에 관한 인식조사' 결과에 따르면...
1660,2021.10.13.,"'위드 코로나' 시대 지속 가능한 일자리 창출, 지역이 앞장선다","사흘간 서울 서초구 양재동 aT센터 제1·2전시장에서 열린다. '미래 일자리, 지역이 앞장선다'는 주제에... '골목경제 활성화를 위해 공공부분이 추진한 우수사례 발굴'을 주제로 개최하는 이 행사는 '지역 골목상권 회복..."
1661,2021.10.06.,금융권 국정감사 돌입…'가계부채'부터 '화천대유'까지 뜨거운 공방 예상,금융위원회 고승범 위원장이 6일 서울 여의도 국회에서 열린 정무위원회의 금융위원회의 국정감사에서 의원... 이에 정치권에서는 논란이 되고 있는 빅테크의 문어발식 사업확장에 따른 골목상권 침해와 금산분리 특혜...
1662,2021.10.13.,유동성 풍부한 트리플 역세권 상가 '르웨스트 에비뉴 767',"이 외에도 연간 약 700만명의 방문객이 찾는 서울식물원과 마곡지구로 이전·개관을 앞둔 LG아트센터(2022년 10월 예정), 단지 남측에 위치한 이마트 트레이더스 등과 함께 더욱 큰 상권을 형성할 것으로 기대된다...."
1663,2021.10.07.,"울산시, 이달중 신세계와 실무협의 추진","▲ 박태완 울산 중구청장이 6일 서울 성동구에 위치한 이마트 본사 앞에서 (주)신세계의 약속 이행을... 지역상권 활성화가 가능한지 등을 종합적으로 검토해 입안여부를 결정할 예정""이라고 설명했다. 아울러 송 시장은..."
1664,2021.10.06.,"""굿즈에 이색 콜라보까지""…막걸리가 젊어진다",사진/서울장수 막걸리가 젊어지고 있다. 국내 막걸리 시장 규모가 점점 줄고 있는 가운데 낡은 이미지 대신... 전체 막걸리 제품 가운데 매출 6위에 오른 말표 검정콩 막걸리의 경우 오피스텔 상권에서 매출 3위를...
1665,2021.10.05.,"[피플] 장혜영 ""의료ㆍ교육ㆍ교통 등 모든 공공서비스 영리화 위험""",의원이 서울 여의도 국회 의원회관에서 이투데이와 인터뷰를 하고 있다. 고이란 기자 photoeran... 골목상권부터 거대 플랫폼 기업까지 다 묶이는데 법 하나로 뭉뚱그리는 건 맞지 않다”며 “서비스산업 발전을 위해선...
1666,2021.10.01.,"""코로나로 카카오·쿠팡·네이버·배민 급성장...독과점 국감에서 따져야""","기업 분할 명령 등 조치 필요 ▲  민주노총이 1일 오전 서울 서대문구 서비스연맹 회의실에서 코로나... 골목상권을 보호하는 방안도 도입을 고민해야 한다""라고 주장했다. 한편, 이 자리에서는 재벌총수들이 코로나..."
1667,2021.10.07.,강동구 '에스아이팰리스 길동 센텀' 10월 공급 예정,"천호, 성내 재정비 촉진지구와 천호시장 재개발?정비사업 추진, 천호~길동 2km 구간 개발 계획 서울 강동구에... 대표 상권인 천호대로변을 중심으로 전개된다. 6개의 촉진구역, 1개의 정비구역, 4개의 존치관리구역 등 총..."
1668,2021.10.09.,[나도창업해볼까]‘채소가 신선한 집’ 채선당…24시간 무인 밀키트 매장 관심...,"서울 상암DMC 1호점을 시작으로 8개월만에 전국 가맹점 67호점을 돌파했다. 도시락, 샐러드, 밀키트 다양한... 최적의 상권에만 출점하는 것을 원칙으로 하고 있다. 계약과정에서 먼저 원하는 창업지역을 확인한 뒤 계약..."
1669,2021.10.07.,"이재명 ""판단이 안이하고 경제현실 잘 모르는 것 같다""... 홍남기에 '직격탄'","더불어민주당 대선주자인 이재명 경기도지사가 7일 오전 서울 종로구의 한 코인노래방에서 '코로나19 위기... 골목상권에 도움을 주던 지역화폐를 말 안 듣는 기재부가 내년 예산을 77%나 삭감했다""며 ""결국 자영업자에..."
1670,2021.10.07.,"나일로라, 장윤주 뮤즈로 국내 B2C 본격 돌입",서울 강남구 신사동 압구정로데오거리에 위치한 쇼룸을 운영하는데 이어 지난 6일 현대백화점 본점 지하2층에 팝업 스토어를 오픈했다. 이번 팝업 행사는 오는 17일까지 이어진다. 현대 본점 팝업을 계기로 핵심 상권의...
1671,2021.10.06.,‘쇼핑몰’ 보단 ‘공간’ 추구하는 20·30 트렌드 담은 ‘다산역 파크 애비뉴...,"사례를 살펴보면 올해 2월 26일 오픈한 ‘더현대 서울’, 8월 27일 오픈한 ‘대전신세계 아트앤사이언스’가... 빠른 상권 형성과 ‘다산역 데시앙’ 입주민들이 필요로 하는 다양한 생활 밀착형 업종들이 들어설..."
1672,2021.10.08.,"대장동, 성남FC, 김사랑… 경기도 분당경찰서의 '찜찜한' 이재명 수사","김씨는 2017년 이 지사가 성남시장일 당시 성남 구시가지 상권 개선 사업비 집행이 불투명하다는 의혹을... 의혹', 서울 용산경찰서에서 입건 전 조사하던 '금융정보분석원(FIU) 통보 사안' 등 3건을 이송받았다""고 밝혔다...."
1673,2021.10.05.,"연신 ""죄송하다"" 김범수 카카오 의장, 국감서 ""골목상권, 택시 등 전 부분 개...","김범수 카카오 의장이 5일 서울 여의도 국회에서 열린 정무위원회의 공정거래위원회 등에 대한 국정감사에 출석해 있다. 뉴시스 [세계비즈=권영준 기자] 김범수 카카오 이사회 의장이 문어발 확장, 골목상권 침해..."
1674,2021.10.07.,"홍남기 저격한 이재명, ""경제 현실 너무 몰라""","이 지사는 서울 종로구 한 코인노래연습장에서 가진 자영업자들과의 간담회에서 ""손실보상 제도가 조만간... ""그나마 소상공인과 자영업자, 골목상권에게 도움을 주던 지역화폐 정책을 정부 말 안 듣는 기재부가 내년..."
1675,2021.10.19.,철근값 상승에 분양↑...지축지구 역세권 소형 오피스텔 라코드 분양,연신내역에 2023년 GTX-A노선이 개통되면 서울 주요 지역으로의 이동이 더욱 편리해 진다. 오피스텔 라코드는 지축지구에 지어지는 첫 번째 오피스텔이다. 역세권 첫 오피스텔로 빠른 상권 형성을 기대할 수 있다....
