,date,title,contents
671,2019.12.26.,"우리은행, 소상공인과 예비창업자 지원 ‘우리 공유오피스’입주 시작",우리은행은 서울 명동 가톨릭회관 지하 1층 ‘우리 소상공인 종합지원센터’내에 ‘우리 공유오피스’를... 우리은행 관계자는 “국내외 소비가 활성화된 명동이라는 상권을 활용하여 트렌드를 주도하는 성공 사업자를...
672,2019.12.26.,"인천시 '인천e음', 소상공인의 동반자로 새로운 도약 시작",소비진작 효과에 대해서는 지난 5월~8월을 기준으로 인천e음을 통한 인천시민의 서울경기지역 소비... 소상공인 매출 증대 효과는 지난 5월~8월 기간동안 대형마트와 기업형슈퍼마켓(SSM)에서 골목상권을...
673,2019.12.19.,"""크리스마스 캐럴 트세요""…SKT, 소상공인에 스트리밍 지원",SK텔레콤은 25일까지 서울 주요 상권을 누비며 크리스마스 음악을 틀고 어린이에게 선물을 나눠주는 '캐럴 트럭'을 운영한다. 19일에는 서울 명동 소규모 매장을 대상으로 블루투스 스피커를 제공했다. SK텔레콤...
674,2019.12.22.,"SK텔레콤, 전국 부스트파크서 ‘5G 크리스마스’",SK텔레콤 홍보모델들이 서울 그랜드워커힐호텔에서 ‘점프 AR 동물원’ 등 5G 서비스를 체험 중인 모습.[사진= SKT] 이와 함께 전국 주요 상권의 부스트파크들도 지역 상권 살리기와 고객 혜택 강화에 나선다....
675,2019.12.26.,"""이모님, '테슬라, 테진아' 주세요""","이미 서울 광화문, 여의도, 홍대, 강남 일대 주요 상권에서 테라 점유율이 50~60%에 달한다. 박은정 유안타증권 연구원은 ""하이트진로 맥주 점유율은 핵심 상권에서 현재 50% 이상을 넘어섰다""며 ""2020년 지역 화장..."
676,2019.12.27.,"소상공인, 2곳 중 1곳 '빚'…평균 부채 1억8100만원·고민은 '상권쇠퇴'","경영애로 사항으로는 10명 중 5명이 '상권쇠태'를 꼽았고, 자금지원 수요(67.2%)가 가장 높았다.... 서울을 비롯한 수도권의 임차 비중(86.9%)이 비수도권(72%)보다 10%포인트(P) 이상 더 높았다. 임차비용은 보증부..."
677,2019.12.30.,"요즘 뜨는 체인점 '사계진미 숯불닭갈비', 주방장이 필요없는 가게를 표방하며...","있으며 서울 강남점의 경우 하루 980만원이라는 최고 매출을 달성, 사계진미가 닭갈비 시장에서... 시장 상권에 안착할 수 있도록 '최대 1억 원 무이자 대출', '100% 인테리어 자율화', '가맹비 할인 이벤트..."
678,2019.12.27.,김도진 기업은행장 이임식...'현장 경영' 가치 강조,"""지난 3년을 관통하는 단 하나의 단어는 현장이다"" 김도진 IBK기업은행장은 27일 오전 서울 중구 IBK기업은행... 산업단지와 상권, 주민들의 삶까지 짚어보고 앞으로 무엇을 해야 할지 가늠해 보기 위함이다""고 말했다. 1985년..."
679,2019.12.26.,창업기업에 무료 공간 지원...우리은행 '우리 공유 오피스’,우리은행은 서울 명동 가톨릭회관 지하 1층 ‘우리 소상공인 종합지원센터’내에 우리 공유오피스를... 우리은행 관계자는 “국내외 소비가 활성화된 명동이라는 상권을 활용하여 트렌드를 주도하는 성공 사업자를...
680,2019.12.26.,"인천시, 2020년 “인천e음”의 새로운 도약이 시작되다",소비진작 효과에 대해서는 지난 5월~8월을 기준으로 인천e음을 통한 인천시민의 서울.경기지역 소비... 소상공인 매출 증대 효과는 지난 5월~8월 기간동안 대형마트와 기업형슈퍼마켓(SSM)에서 골목상권을 대표하는...
681,2019.12.28.,‘골목식당’ 최우수 프로그램상 “골목상권 사장님들에 도움되길”[SBS 연예...,"'백종원의 골목식당'이 12월 28일 서울 마포구 상암동 SBS 프리즘타워에서 열린 '2019 SBS 연예대상' 최우수... 골목상권에 계신 사장님들께 실질적으로 도움되는 프로그램 만들겠다""고 밝혔다. (사진=SBS '2019 SBS 연예대상..."
682,2019.12.26.,"인천시, 공직자들이 뽑은 '2019년 인천시책 Best 10' 선정","평균 속도는 시속 100km로 일반 도시철도(30km/h) 보다 세 배가량 빠르며, 개통 뒤 송도에서 서울역... 12월 현재 약 93만이 가입했고, 골목상권 활성화와 역내 소비유입 증대의 효과도 증명된 바 있다...."
683,2019.12.26.,"우리은행, '우리 공유 오피스' 입주 시작…""무료로 사무실 빌리세요""","서울 중구 명동 가톨릭회관 지하 1층 '우리 소상공인 종합지원센터'내에 '우리 공유오피스'가 개설됐다.... 우리은행 관계자는 ""국내외 소비가 활성화된 명동이라는 상권을 활용하여 트렌드를 주도하는 성공 사업자를..."
684,2019.12.26.,"우리은행, '소상공인' 지원 나선다… '우리 공유오피스' 무료 개방","'우리 공유오피스'는 서울 명동 가톨릭회관 지하 1층 '우리 소상공인 종합지원센터' 안에 있다. 특히 다양한... 우리은행 관계자는 ""국내외 소비가 활성화된 명동이라는 상권을 활용해 트렌드를 주도하는 성공 사업자를..."
685,2019.12.27.,"인천시, 공직자들이 뽑은「2019년 인천시책 Best 10」선정","평균 속도는 시속 100km로 일반 도시철도(30km/h) 보다 세 배가량 빠르며, 개통 뒤 송도에서 서울역까지... 12월 현재 약 93만이 가입했고, 골목상권 활성화와 역내 소비유입 증대의 효과도 증명된 바 있다. 관계부서는..."
686,2019.12.28.,삼송 도시재생주민협의체 '첫걸음',이날 총회에서는 사전행사로 최형선 서울시도시재생지원센터 재생사업실장의 도시재생 대학 특강에서... 도시재생뉴딜사업은 낙후된 생활환경을 개선하고 상권 활성화를 통해 지역주민의 삶의 질 향상과 지역 공동체...
687,2019.12.27.,"대림산업, 숲세권 'e편한세상 홍제 가든플라츠' 공급","단지 앞 통일로와 인근에 위치한 서울 내부순환도로 홍제ㆍ홍은 IC를 차량으로 이용하면 통근이 수월하다. 생활편의시설로는 단지 인근에 위치한 유진상가, 홍제시장 등 홍제역 상권과 이마트 은평점, NC백화점..."
688,2019.12.22.,"SKT, 전국 ‘5GX 부스트파크’서 크리스마스 이벤트",서울 워커힐 호텔 부스트파크에서는 ‘자이언트 캣’ 등 SK텔레콤의 점프(Jump) 증강현실(AR) 동물들과... 전국 주요 상권의 부스트파크들도 지역 상권 살리기와 고객 혜택 강화에 나선다. SK텔레콤은 전국...
689,2019.12.26.,"하이트진로 ‘테라’ 돌풍, 맥주업계 지각변동 일으키나","하이트진로 측은 ""여의도, 강남 일대는 테라로 많이 넘어왔다""며 ""현재 서울∙수도권 상권에서는 점유율 80~90% 정도를 차지하는 것 같다""라고 말했다. 핵심 상권에서 점유율이 증가하자 실적으로 이어졌다. 실제로..."
690,2019.12.26.,"하이트진로 ‘테라’ 돌풍, 맥주업계 지각변동 일으키나","하이트진로 측은 ""여의도, 강남 일대는 테라로 많이 넘어왔다""며 ""현재 서울∙수도권 상권에서는 점유율 80~90% 정도를 차지하는 것 같다""라고 말했다. 핵심 상권에서 점유율이 증가하자 실적으로 이어졌다. 실제로..."
691,2019.12.27.,"홍석천도 넘지 못한 젠트리피케이션의 벽, 법안도 폐기 위기",도시를 병들게 하는 젠트리피케이션은 전국 주요 도시 및 상권으로 확산되는 양상이다. 서울 성동구가 젠트리피케이션 폐해를 막기 위해 선도적으로 2015년 9월 조례를 제정했다. 지속가능발전구역을 지정해 주민협의체가...
692,2019.12.26.,"‘황학1010 센터팰리스’, 27일 홍보관 그랜드 오픈","서울시 중구 황학동에 들어서는 주상복합건물 황학1010 센터팰리스가 27일 광진구 중곡동에 홍보관을 열고... 또한 한양대학병원, 국립중앙의료원 등 인근 병의원 관계자 및 동대문 상권, 중앙시장 종사자들도..."
693,2019.12.27.,경기 불황 속 '그들만의 리그'…백화점 명품 매출 증가,제공| 각 사[스포츠서울 동효정 기자] 국내 경기 불황이 이어지는 가운데 백화점을 중심으로 초고가 명품... 백화점 내에 마련된 VIP 전용 공간이 백화점을 벗어나 외부 주요 상권에 오픈하는 업계의 첫 시도로 명확한...
694,2019.12.28.,"[주간브리핑] 2.1억 영통 아파트, 62명 몰려 낙찰가 ↑","인근에 단독·다세대 주택 및 아파트 단지도 다수 들어서 있어 상권은 무난한 편이다. 주차장 용지와 일부... 서울 아파트의 경우 이번 주 낙찰가율이 101.3%를 기록한 가운데, 경매에 나온 4건 중 3건이 낙찰돼..."
695,2019.12.20.,"아디다스, '게임 라이프 월드' 콘셉트 홍대 브랜드 센터 열어","3층 라이프존은 아디다스가 떠올리는 '서울의 모습'을 예술작품으로 시각화한 곳이다. 스트리트 컬처와... 및 상권 활성화에 긍정적인 역할을 할 것으로 기대한다""며 ""우수한 품질의 제품뿐 아니라 최고의 고객 경험을..."
696,2019.12.25.,"대구신세계, 동대구역 상권 활성화 기여","KTX와 SRT, 고속버스, 시내·외버스, 도시철도 등 모든 대중교통 수단이 집결된 복합환승센터를 통해 포항, 구미 등 인근 경북지역은 물론 서울, 수도권 거주자들까지 모여들며 대구시를 대표하는 상권으로 급성장했다...."
697,2019.12.20.,"골목식당 경영난, 저축은행에 맡기면?",저축은행중앙회는 20일 서울 마포구 본사에서 자영업자와의 동반자적 관계 형성을 위한 '저축은행 자영업... 컨설팅 지원 분야는 △상권·입지분석 △사업성분석 △경영진단 △홍보·마케팅 △점포운영 △프렌차이즈...
698,2019.12.29.,국내 소상공인 비중 “도소매·음식숙박·제조업 순”,"5 사업체당 매출액은 연 2억 3,500만원, 영업이익은 연 3,400만원이며 경영상 어려움으로는 상권쇠퇴... 4 서울 519 19.0 1,184 18.7 강 원 100 3.6 213 3.4 부산 198 7.2 447 7.1 충 북 88 3.2 199 3.1 대구 148 5.4 325 5.1 충..."
699,2019.12.27.,중랑구 장미제일시장 전통시장 등록,등록시장으로 전환해 보다 적극적으로 지원함으로써 전통시장과 지역 상권을 살리겠다는 취지다. 특히 구는 서울장미축제가 열리는 장미제일시장을 등록시장으로 지정하기 위해 약 6개월 간 전통시장 현장 여건 검토...
700,2019.12.26.,인천시 공직자들이 뽑은 '2019년 인천시책 Best 10' 선정,"평균 속도는 시속 100km로 일반 도시철도(30km/h) 보다 세 배가량 빠르며, 개통 뒤 송도에서 서울역까지... 12월 현재 약 93만이 가입하였고, 골목상권 활성화와 역내 소비유입 증대의 효과도 증명된 바 있다. 관계부서는..."
701,2019.12.24.,"‘크리스마스 마켓’ 간 장관 5명, ‘깜짝 산타’로",흔히 유럽 거리에서 볼 수 있던 ‘크리스마스 마켓’이 서울 도심 신촌에서 열렸습니다. 이곳에서는... 주변 상권까지 덩달아 활기가 넘칩니다. 행사의 일환으로 북적이는 인파 속 사랑과 나눔을 전할 300 여명의 산타들이...
702,2019.12.27.,공직자들이 뽑은 '2019년 인천시책 Best 10' 선정,"평균 속도는 시속 100km로 일반 도시철도(30km/h)보다 세 배가량 빠르며, 개통 뒤 송도에서 서울역까지... 12월 현재 약 93만이 가입하였고, 골목상권 활성화와 역내 소비 유입 증대의 효과도 증명된 바 있다. 관계부서는..."
703,2019.12.26.,"우리은행, 소상공인·예비창업자 위한 '공유오피스' 입주 시작","우리은행의 공유오피스는 서울 명동 가톨릭회관 지하 1층 '우리 소상공인 종합지원센터' 내에 마련됐다.... 우리은행 관계자는 ""국내외 소비가 활성화된 명동이라는 상권을 활용해 트렌드를 주도하는 성공 사업자를..."
704,2019.12.25.,"경기도, ‘공공기관 맞춤형 회계·감사 교육’ 실시","경기도시장상권진흥원을 비롯해 경기도시공사, 경기도경제과학진흥원, 경기일자리재단 등 공공기관... 회계·지출·계약 분야 교육으로는 최기웅 서울시 강서구청 장애인복지과장이 강사로 나섰다. 최 과장은 15만4000여..."
705,2019.12.19.,SK텔레콤 “거리의 캐럴 되찾아 드려요”,"SK텔레콤은 25일까지 서울 주요 상권을 누비며 크리스마스 음악을 틀고, 어린이에게 선물을 나눠주는 ‘캐럴 트럭’도 운영한다. 이 트럭은 25일 이후 전국 ‘5GX 부스트파크’에서 소상공인과 함께 연말연시 이벤트를..."
706,2019.12.26.,"우리은행 '우리 공유오피스' 지원, 입주 시작",우리은행은 서울 명동 가톨릭회관 지하 1층 ‘우리 소상공인 종합지원센터’내에 ‘우리 공유오피스’를... 우리은행 관계자는 “국내외 소비가 활성화된 명동이라는 상권을 활용하여 트렌드를 주도하는 성공 사업자를...
707,2019.12.20.,포방터 돈가스집도 쫓겨났나…맛집에 '배 아픈' 상인회,"포방터 돈가스 제주도 이전에 갑론을박…""상인회 갑질""VS""사실무근""] 서울 서대문구 홍은동에 위치한 포방터... ━ 골목 상권을 살리자는 취지의 프로그램 '골목식당'에선 백 대표가 선뜻 미소짓지 않는다. 대부분의..."
708,2019.12.27.,개통 앞둔 철도노선 인근 수익형부동산 노려라,뿐만 아니라 교통망을 따라 추가적인 인구 유입이 이뤄지고 사람이 모이는 역을 중심으로 상권이... 신세계건설이 서울 강남구 자곡동 653번지 일원에 선보이고 있는 빌리브 파비오 더 까사가 그 주인공이다. 빌리브...
709,2019.12.27.,"마트부터 럭셔리까지, 요즘 뜨는 오프라인 매장에선 “제품이 아니라 경험을 ...",# 서울 신사동 가로수길의 한 기업에 근무하는 20대 직장인 김영신 씨는 지난 가을 호주 스킨케어 브랜드... 있는 상권밀착형 금융 서비스 점포다. 이대훈 농협은행장은 “하나로미니 인 브랜치가 지역의 대표적인...
710,2019.12.26.,"""공유주방 고스트키친, 2년내 100개로""","26일 서울 서초구 사무실에서 만난 최 대표는 ""2021년까지 서울에 100개의 지점, 2000개의 주방을 확보하겠다""고... 그는 ""상권에 맞지 않는 음식이나 경험 없는 창업은 실패하기 쉽다""며 ""고스트키친은 권리금이 없고..."
711,2019.12.24.,[아파트 미리보기]백련산 자락… 10분 걸으면 지하철역,"서울 ‘e편한세상 홍제 가든플라츠’ 대림산업은 서울 서대문구 홍은1구역 재건축 단지인 ‘e편한세상... 인근에 유진상가, 홍제시장 등 홍제역 상권과 이마트 은평점, NC백화점 불광점 등이 있다. 도심에서 보기 드문..."
712,2019.12.27.,"유니클로 대구 중앙점, ‘대구시 친절 여행상점’ 선정",유니클로 대표 매장인 서울 명동중앙점 내부 모습. 유니클로 제공 글로벌 패션 브랜드 유니클로는 대구 동성로 중앙점이 지역 관광과 상권 활성화에 기여한 공로를 인정받아 ‘친절 여행상점’에 선정됐다고 26일 밝혔다....
713,2019.12.22.,"SKT, 전국 ‘5GX 부스트파크’에서 크리스마스 이벤트 진행",크리스마스를 앞두고 서울 워커힐 호텔도 SK텔레콤의 5G 특화 서비스와 고객 혜택을 즐길 수 있는... 전국 주요 상권의 부스트파크들도 지역 상권 살리기와 고객 혜택 강화에 나선다. SK텔레콤은 전국 부스트파크에서 5G...
714,2019.12.19.,"SKT ""매장용 음원 무료로 쓰세요""","SK텔레콤은 또 오는 25일까지 서울 주요 상권을 누비며 크리스마스 음악을 틀고, 어린이에게 선물을 나눠주는 ‘캐럴 트럭’을 운영한다. 박정호 SK텔레콤 사장은 “음악산업과 경제·사회적 가치를 함께 키워나갈 수..."
715,2019.12.25.,집값 오른 동작구 '젠트리피케이션' 주의단계,25일 국토연구원의 이진희 책임연구원의 ‘서울시 상권분석 시스템을 통한 젠트리피케이션의 정책적 대응’에 따르면 2018년도는 전년에 비해 젠트리피케이션이 전반적으로 완화되는 모습을 보인 가운데 서울시 동북권과...
716,2019.12.23.,"동작구, 2020년 조직개편 단행","서울 동작구(구청장 이창우)는 2020년 1월 1일자로 현행 1의회, 2담당관, 5국 1단(31과), 1소(4과), 15동, 총... 양질의 일자리 확충, 지역상권 활성화 등 지역경제의 힘을 키우기 위한 일자리경제국에는 일자리정책과..."
717,2019.12.20.,"이마트, 사업 재편한다…점포 리뉴얼·삐에로쑈핑 철수","사진 | 권오철 기자[스포츠서울 권오철 기자] 이마트가 기존 점포를 리뉴얼하고 삐에로쑈핑 7개점을... 신규 점포가 증가하고 있는 일렉트로마트는 지난 18일 죽전점과 상권이 겹치는 판교점을 폐점한 데 이어, 대구점도..."
718,2019.12.23.,"""백화점 1층부터 명품 진열하라"" 유통3사 신임 CEO들, 매장 통째로 바꾼다",2021년 초에는 서울 최대 규모 백화점으로 추진하는 '현대백화점 여의도점(가칭)'의 개점도 예정돼 있어 김... 브랜드와 인테리어를 각 상권에 맞게 새롭게 단장할 예정이다. 김 대표는 현대백화점그룹이 한섬을 인수한...
719,2019.12.24.,빅데이터로 본 송파구 ‘한성백제문화제’ 개최 효과는?,"이투데이=설경진 기자 | 서울디지털재단, 지역 상권 매출 전년 대비 5%pㆍ관광객 수 전년 대비 6.5%p 증가 송파구의 지역축제인 한성백제문화제가 송파구의 관광과 지역경제 활성화에 긍정적인 영향을 미치는 것으로..."
720,2019.12.26.,"우리은행, 소상공인·예비창업자 지원 위한 사무공간 '우리 공유오피스' 입주...","우리은행은 서울 명동 가톨릭회관 지하 1층 '우리 소상공인 종합지원센터'내에 '우리 공유오피스'를... 우리은행 관계자는 ""국내외 소비가 활성화된 명동이라는 상권을 활용하여 트렌드를 주도하는 성공 사업자를 배출해낼..."
721,2019.12.26.,[특집]100만 인천시민의 플랫폼 인천e음! …소상공인의 동반자로 새로운 도약...,"2019년 1조 5천억 발행(전국 발행량의 65%), 소상공인 및 골목상권 매출증대 입증 2020년 공동체 가치와 정책... 소비진작 효과에 대해서는 지난 5월~8월을 기준으로 인천e음을 통한 인천시민의 서울･경기지역 소비..."
722,2019.12.26.,"유니클로 대구 동성로중앙점, '친절여행상점' 선정",▲ 16일 오전 서울 중구 명동에 위치한 유니클로 명동중앙점. [문재원 기자] 11월 22일부터 12월 1일까지... 그 예로 유니클로 대구 동성로중앙점은 오픈 당시 유니클로에서 일정 금액 이상 구매한 고객들에게 지역 상권...
723,2019.12.25.,"수원시, 지나친 상권규제 '법 적용도 제 마음대로'",이에 따라 나혜석거리 상인들은 서울 을지로 노가리골목과 여수 낭만포차 골목처럼 옥외영업을 활성화 하는... 바람막이 조차 설치하지 못하는 수원시의 지나친 규제로 상권 악화와 더불어 상인들간 갈등까지 빚어지고 있다.
724,2019.12.26.,[유통가 10대 뉴스-下]예상 뛰어넘는 '테라' 돌풍…전자담배 '진실게임',당장 서울 강남·여의도·광화문·홍대를 포함한 핵심 상권에서 테라가 카스를 넘어선 것으로 알려졌다. 메리츠종금증권의 설문조사 결과 해당 상권의 테라 점유율은 60%에 달했다. 오비맥주는 당황한 기색이다. 테라의...
725,2019.12.28.,"부동산 투자의 블루칩은 명품 오피스텔, '종로 루비온'에 눈길","조선 시대 이래 주요 상권이 위치해 온 서울 사대문 안, 그중에서도 핵심인 종로에 신규 명품 원룸형 오피스텔 ‘종로 루비온’이 시공사 선정 후 개발 탄력을 받으며 수익형 부동산 투자처로 주목받고 있는 것이다...."
726,2019.12.19.,'수도권 공정경제협의체' 출범…'대기업 유통업체' 압박할 듯,최근 서울과 인접한 수도권 내 초대형 복합쇼핑몰의 영향이 해당 지역은 물론 서울 전역까지 미치고 있어 3개 지자체는 지역상권과 여건을 고려해 지구단위계획을 수립하는 등 대규모 점포 입점요건을 마련해 지역 상권은...
727,2019.12.25.,지역경제 활성화 위해 지자체에 디지털 옥외광고 설치지원,최종 선정된 지자체는 서울 동작구·부산 동구·광주 광산구·대전 동구·세종특별자치시·경기 수원시·강원... 일대 상권 활성화를 위해 주변 관광지인 화성행궁 등에 디지털 옥외광고물을 설치·운영할 계획이다. 강원...
728,2019.12.29.,"[최헌규특파원의 금일중국] 찻잔 대신 머그잔을 든 중국인, 14억 소비시장 커...",베이징 시내 산리툰은 서울의 홍대 주변과 같은 유행의 거리다. 주말인 27일 저녁 퇴근 무렵 베이징 산리툰... 그동안 스타벅스 신규 점포가 상권과 소비 활력을 결정하는 잣대였다면 이제 중국시장에서 루이싱 매장이...
729,2019.12.22.,SKT ‘5GX 부스트파크’서 연말 이벤트,"먼저 서울 워커힐 호텔을 ‘부스트파크 워커힐’로 꾸민다. 증강현실(AR) 동물과 트리를 배경으로 사진을... 전국 주요 상권에서도 이벤트를 준비했다. 5G 서비스를 체험한 고객들에게 럭키박스(강남역), 향초..."
730,2019.12.27.,"현대백화점그룹, 면세 사업 확장에 속도… '빅4' 반열 노린다",앞서 현대백화점면세점은 지난 11월 서울 시내면세점 중 두산이 반납한 동대문 두타타워의 면세점 신규 특허권을 따냈다. 롯데·신라·신세계 등 면세점 ‘빅3’가 모두 입찰에 참여하지 않으면서 강북 상권에 홀로...
731,2019.12.29.,신촌 연세로 일대 9일간 '가치·같이·나눔·상생' 물들다,"거둬 '눈길' 서울 신촌 연세로 일대가 크리스마스와 연말을 맞아 9일간 '가치', '같이', '나눔', '상생'으로... 지역상권과 정부가 함께 기획하는 소상공인 살리기 프로젝트로, 매년 정례화해 전국에 확산할 계획""이라고..."
732,2019.12.26.,"세종시, 내년 행정수도 완성, 스마트경제 실현에 힘 기울여.","지역상권 활성화 계획을 수립·추진하고,세종 스마트 국가산업단지를 차질 없이 추진한다. 다함께 즐기는... 세종~포천(서울~세종), 세종~청주 고속도로 건설사업을차질 없이 추진하고 있음 안전하고 쾌적한 도시환경을..."
733,2019.12.23.,[2019 컨슈머마켓 결산] 온·오프 경계 무너져...올핸 'H·A·R·D' 했다,23일 서울경제는 올 한해 유통업계 이슈를 관통하는 키워드를 ‘H.A.R.D’로 정리했다. ‘H’는 온·오프라인... 경우 상권영향 평가의 범위가 확대된다. 유통업계 관계자는 “소상공인을 살리자는 기존 취지와 달리 유통...
734,2019.12.22.,[저널리즘 토크쇼 J] ‘김우중 별세’ 언론이 쓴 위인전?,"하루 종일 땡볕 밭에서 일해도 배가 고팠던 소년 정주영이 서울로 무작정 올라왔을 때 가진 것이라고는 단돈... 전통 상권까지 불황 한파〉라는 기사였습니다. 소제목이 “최저임금 인상, 주52시간제 여파로 끝모를..."
735,2019.12.22.,"SKT, 전국 부스트파크서 ‘5G 크리스마스’",크리스마스를 앞두고 서울 워커힐 호텔도 ‘부스트파크 워커힐’로 탈바꿈했다. 부스트파크 워커힐에서... SK텔레콤 윤재웅 5GX Cluster마케팅담당은 “지역 상권과 연계해 전국 부스트파크별로 다양한 크리스마스...
736,2019.12.30.,항아리 상권•권리금 無 등 '신도시 상가' 투자 대안 주목…'향동 봄 프라자'...,"않은 '닫힌 상권'으로, 상가 내 체류시간도 상대적으로 길다. 신도시 내 신규 상가는 권리금도 없어 기존 상가에 비해 투자에 대한 부담감도 낮다. 이런 가운데 '향동 봄 프라자'가 분양에 나서 순항 중이다. 서울에..."
737,2019.12.27.,"대림산업, 'e편한세상 홍제 가든플라츠' 분양","대림산업이 서울 서대문구 홍은동 104-4번지 일원에 들어서는 'e편한세상 홍제 가든플라츠'의 주택전시관을... 주변으로는 유진상가, 홍제시장 등 홍제역 상권과 이마트(은평점), NC백화점(불광점) 등 편의시설이 있어..."
738,2019.12.27.,경기 지역 10대 뉴스…'이춘재 자백' 外,지역상권을 살리는 데 크게 기여할 것입니다.] 수원고등법원이 고등검찰청과 함께 광교시대를 열었습니다. 경기남부 842만 명을 관할해 규모가 서울고법에 이어 두 번째로 큽니다. 수십 년 간 묵인돼온 불법 시설물이...
