,date,title,contents
2087,2019.12.10.,"중기부, 군산 등 5곳 상권 르네상스 프로젝트 선정",중소벤처기업부와 소상공인시장진흥공단은 지난 9일 심의조정위원회를 열고 '상권 르네상스 프로젝트' 사업... 서울 관악은 도림천·신림역 등 자원을 활용해 도림천 축제·순대타운 특화 프로그램·서원동과 신원동...
2088,2019.12.04.,수색역세권·한문화체험특구 쌍개발… ‘금평구’로 뜨는 은평,"상권, 기반 시설 등이 부족해 저평가받던 서울 은평구가 최근 부동산 시장에서 ‘금(金)평구’로 주목받고 있다. 부지 22만㎡, 사업비 1조 7000억원, 생산 유발 효과 2조 7000억원에 이르는 수색역세권 개발을 비롯해 지역..."
2089,2019.12.13.,"부동산 업계에서도 주목하는 무인여성소자본창업아이템 플랜에이, 남다른 교육...","지역과 상권, 주 이용자의 특성 등을 요소를 고려한 커스텀 디자인으로 기존 스터디카페창업 브랜드와는... 스포츠서울 주관 ‘2019 한국소비자선호도 1위 브랜드대상’에 이어, 최근 한국경제 비즈니스 주관 ‘2019..."
2090,2019.12.12.,[기자수첩] 한국 덮친 150년 전 붉은 깃발법의 망령,"서울시는 지난 2011년 6월 복합쇼핑몰 유치를 위해 마포구 상암택지개발지구 3개 필지를 특별계획구역으로... 지역상권 생태계를 휘젓고 있다""며 ""복합쇼핑몰을 합리적으로 규제할 수 있는 유통산업발전법 개정안을..."
2091,2019.12.18.,"프랜차이즈 뉴욕야시장, 마포구청점 오픈 기념 이벤트 진행","기호일보, KIHOILBO 술집 창업으로 통하는 뉴욕야시장에서 12월 18일 서울 마포구의 마포구청 인근에... 이번에는 마포구청점을 새롭게 오픈, 마포구청 인근 상권의 고객 공략에 나설 전망이다. 이에, 뉴욕야시장..."
2092,2019.12.06.,"서초구 서래마을, '프랑스풍 디자인 거리'로 변신",서울 서초구(구청장 조은희)는 서래마을의 명소화와 상권 활성화를 위해 서래로 530m 구간(서래로 입구~방배중학교)을 프랑스 정취를 느낄 수 있는 '서래마을 디자인 특화거리'로 만들었다고 밝혔다. 먼저 구는 마을...
2093,2019.12.04.,"국토부, 11일부터 올해 마지막 행복주택 입주자 모집…전국 16곳·5838호","또한 대형 쇼핑몰과 로데오 거리 등 대형 상권, 경기도청·세무서 등 다수의 편의시설과 인접해 입주자의 생활 편의성이 높을 것으로 예상된다. 또한 대학생 특화단지인 서울휘경(200호)은 반경 5㎞이내에 서울시립대..."
2094,2019.12.13.,[네이버 ‘D-커머스 리포트 2019’] “100만 디지털 소상공인 육성 시 경제적...,"온라인 플랫폼을 이용해 전국 상권으로 비즈니스가 확대되면서 발생한 지역간 부의 확산 효과다. 네이버 스마트스토어에서 사업장 소재지를 기준으로 전국 배송지 현황을 분석한 결과 서울(76.4%), 경기(72.1%)를 제외하고..."
2095,2019.12.03.,패션사업으로 승부 거는 갤러리아..수입 남성 비즈니스 캐주얼 '간트' 론칭,갤러리아는 내년 2월에 개장하는 광교점 오픈을 시작으로 3월 대전에 위치한 갤러리아백화점 타임월드에 열고 내년 안에 서울 상권을 중심으로 최대 7개 매장을 오픈할 예정이다.'간트'는 갤러리아가 처음으로 진행하는...
2096,2019.12.12.,"중랑구, 16~22일 '살아생전, 사라생展' 전시회 개최","지역상권 활성화 및 일자리 창출, 노후·불량주택 개량, 생활환경 개선 등 본격적인 재생 사업을 추진해 나갈... “올해 서울시 도시재생활성화 지역 선정으로 체계적이고 지속가능한 도시재생 사업을 추진할 수 있는..."
2097,2019.12.16.,S커피에 독주에 타 브랜드 업주들 “어쩌나”,1개 점포만으로도 영향력 있는 브랜드에서 한 상권에 집중 개점하는 것은 ‘따라올테면 따라와 봐’라는... 또 A브랜드사 홍보담당자도 “S브랜드 800여개가 있는 있는 서울과 경기 등 수도권은 이미 생긴 지 오래돼...
2098,2019.12.05.,"에너지절약, 미세먼지 줄이는 실천의 시작","(목), 서울역 오픈콘서트홀에서 ｢2019년 겨울철 국민 절전캠페인 출범식｣을 개최하였음 &lt; 국민절전캠페인... 주요상권의 상점들을 대상으로 「에너지절약 착한가게」캠페인(12.6~2.29)을 전개하고 온라인 이벤트*도..."
2099,2019.12.06.,기로에 선 오비맥주…신규 마케팅으로 '변화' 모색,"일반 음식점용 500ml 병맥주는 내년 1월 말까지 강남, 신촌, 홍대, 건대 등 서울 시내 주요 상권에서 한정 판매된다.오비맥주 관계자는 ""테라가 기존 하이트와의 '세대 교체'를 잘 하고 있는 것은 사실이지만 이로 인해..."
2100,2019.12.06.,기로에 선 오비맥주…신규 마케팅으로 '변화' 모색,"일반 음식점용 500ml 병맥주는 내년 1월 말까지 강남, 신촌, 홍대, 건대 등 서울 시내 주요 상권에서 한정 판매된다.오비맥주 관계자는 ""테라가 기존 하이트와의 '세대 교체'를 잘 하고 있는 것은 사실이지만 이로 인해..."
2101,2019.12.05.,"""에너지, 끄고 닫고 높이고""···절전 캠페인 출범식","에너지 절약을 실천하고, 똑똑한 에너지 소비요령을 알리는 절전캠페인이 서울역에서 열렸습니다. 곽동화... (영상취재: 민경철 / 영상편집: 김종석) 이와 함께 전국 18개 주요상권의 상점들을 대상으로 '에너지절약..."
2102,2019.12.11.,"역세권 상가투자 최적기, 녹번역 8차선 대로변 상가 ‘은평 미드스퀘어’ 분양","인근의 내부순환도로, 올림픽대로, 강변북로 등을 이용하여 서울 도심 및 경기지역 이동이 편리하다. GTX... 녹번역의 대부분 상가가 노후된 주거지역을 배후로 소규모 중심의 상권을 형성하고 있어, 지역 고객과..."
2103,2019.12.17.,"[이슈&트렌드] 명동에 자리잡은 두 '뷰티 공룡'...시코르 vs 세포라, 뷰티 편...","있는 상권이다. 국내 소비자는 물론 막강한 소비력의 외국인 관광객까지 더해지며 K-뷰티를 선보일 수 있는... 세포라 코리아는 국내 '코덕(코스메틱 덕후)'들의 오랜 염원 끝에 지난 2019년 10월, 서울 삼성동 소재에..."
2104,2019.12.02.,"관악구, 창업벤처도시 조성 팔걷는다","명칭으로 서울시 공모사업인 대학캠퍼스타운(종합형) 조성 사업에 응모했다고 밝혔다. 대학캠퍼스타운(종합형) 조성사업은 대학과 지역이 공동으로 지역내 창업을 육성하고 주거안정화, 문화특성화, 상권 활성화..."
2105,2019.12.10.,편의시설 인접 아파트 선호도…편의시설 위치 따라 청약률 차이 뚜렷,"전국 최고 청약 경쟁률을 기록한 ‘르엘 대치’는 서울 대치동 핵심입지에서 공급됐다. 지난달 실시한... 편의시설은 유진상가, 홍제시장 등 홍제역 상권과 이마트(은평점), NC백화점(불광점) 등을 이용할 수 있다...."
2106,2019.12.12.,[허준열의 분양분석 14] 합정역 스퀘어리버뷰 오피스텔,(앱)으로 △상권 △배후인프라 △입지 △경쟁력 △투자 가치 등에 대한 문의가 많이 들어온다. 그 중 '합정역 스퀘어리버뷰'를 선정해 면면을 살펴본다. 144세대 오피스텔로 구성된 '합정역 스퀘어리버뷰'는 서울시 마포구...
2107,2019.12.09.,[기획]전통시장의 대세 '동백꽃 필 무렵' 촬영지 ‘해방촌 신흥시장’,하지만 모든 상인이 땀흘리며 공들여 서울을 대표하는 시장으로 키웠지만 신흥시장 역시 갑작스런 성장 때문에 리스크도 안고 있다. 상권이 일어나 경제가 활성화된 지역에는 젠트리피케이션 (Gentrification) 리스크가...
2108,2019.12.02.,"""방송욕심 NO""…'후계자들', 성현아·조성환·이상원이 식당으로 간 이유(종합...","2일 오후 서울 광화문 씨스퀘어에서 열린 TV조선 새 예능프로그램 '손맛 전수 리얼리티-백년의 맛, 후계자들... 골목상권을 살리는 장수 프로그램이다. 반면에 '후계자들'은 강호의 숨은 장인들, 묵묵히 언론에 노출되지..."
2109,2019.12.18.,"1인 남자 소자본창업아이템 '플랜에이 스터디카페', 대한민국 브랜드 만족도 ...","스포츠서울 주관 '2019 한국소비자선호도 1위 브랜드 대상'을 받을 정도로 높은 고객 만족도와 좌석 점유율을... 이에 더해 남다른 교육 공간 철학을 가지고 있는 브랜드인 만큼, 천편일률적인 교육 공간 대신 지역과 상권..."
2110,2019.12.02.,"현대백화점, 면세 사업 확장에 속도...'빅4' 반열 오르나",현대백화점면세점은 서울 시내면세점 중 두산이 반납한 동대문 두타타워의 면세점 신규 특허권을 따냈다. 롯데·신라·신세계 등 면세점 '빅(big) 3'가 모두 입찰에 참여하지 않으면서 강북 상권에 무혈 입성했다. 내년...
2111,2019.12.06.,조광래의 약속 “내년 대구축구는 더 재미있어진다”,"대구는 지난 2일 서울 홍은동 그랜드힐튼호텔 컨벤션센터에서 열린 2019 K리그 대상 시상식에서 최고의 팬... 새 구장 건설과 함께 인근 시설이 정비되고, 주변 상권도 확 살아나면서 축구가 지역경제에도 한 몫 했다는..."
2112,2019.12.18.,"[시장도매인 재무제표④-진단] 35년 유통맨 曰 ""도매시장이 청개구리처럼 울고...","천만에~ 우리가 한다""...농민 조합이 지분 참여한 시장도매인 서울NH청과(주) [시장도매인 재무제표④-진단]... 전통시장이나 중소형 마트 전부 골목상권이고요. 그런데 요즘 힘들다는 자영업자가 크게 늘고 있어요...."
2113,2019.12.02.,"관악구-서울대, 지역 상생 위해 대학캠퍼스타운 조성 사업 응모","서울시 공모사업인 대학캠퍼스타운(종합형) 조성 사업에 응모했다고 밝혔다. 이번에 응모한 대학캠퍼스타운(종합형) 조성사업은 대학과 지역이 공동으로 지역 내 창업을 육성하고 주거안정화, 문화특성화, 상권 활성화..."
2114,2019.12.11.,"D-커머스 리포트 2019...""스몰비즈니스 디지털 전환, 지역간 부의 확산 효과 ...",디지털 전환을 통한 상권 확대 효과는 네이버 스마트스토어의 지역별 배송지 현황 분석을 통해서도 확인할 수 있다. 네이버 스마트스토어에서 사업장 소재지를 기준으로 전국 배송지 현황을 분석한 결과 서울(76.4...
2115,2019.12.11.,"포도몰, 공개공지 새로 조성··· 신림 대표 만남의 장소",서울 신림역의 랜드마크인 ‘포도몰’이 관악구 최초로 서울시와 함께하는 공개공지 개선 사업을 통해... 대표 상권의 위상과 이미지 개선에 큰 원천이 되고 있다. 앞으로도 더욱 시민들의 편의 증진에 앞장서는...
2116,2019.12.16.,"영등포와 여의도 품은 소형복층 오피스텔 역세권 '신길역 봉주르', 1~2인 가구...",만나는 서울특별시 영등포구 영등포동에서만날 수 있는 오피스텔/도시형생활주택 '신길역 봉주르'다. 미분양 제로에 가까운 영등포구에 들어서는 신길역 봉주르는 인구밀집지역이자 상권 집중지 입지를 갖춰 탄탄한...
2117,2019.12.03.,"삼육대, 제1회 캡스톤디자인 경진대회","이 팀은 공릉동 도깨비시장 상권 활성화를 위해 11월 9일 어린이행사 무대를 기획, 시민과 함께하는 행사를 진행해 바이럴 효과를 얻었다. 특히 삼육대가 서울시와 함께 추진하는 노원구 도시재생사업..."
2118,2019.12.03.,"갤러리아百, 패션사업 본격화…新성장동력 가시화",갤러리아는 내년 2월에 개장하는 광교점 오픈을 시작으로 3월에는 대전에 위치한 갤러리아백화점 타임월드에 오픈하고 ’20년에 서울 상권을 중심으로 최대 7개 매장을 오픈한다. 이번에 전개하는 ‘간트’는 갤러리아가...
2119,2019.12.18.,"국민은행, 자영업자 경영컨설팅 우수기관 표창 수상","13개(서울 5개, 전국 5대 광역시 5개, 수도권 2개, 여의도 HUB 센터 1개)의 컨설팅 센터를 운영하고 있다. 'KB... 외식업자영업자, 재창업 예정자 및 사회적 기업 등을 대상으로 상권·빅데이터 분석, SNS 마케팅 및 세무분석..."
2120,2019.12.13.,청정한 공기 마시는 '365일 숲세권' '시흥장현 유승한내들 퍼스트파크' 눈길,"이어 신안산선이 개통 완료되면, 시흥시청역에서 서울역까지 30분대에 이동이 가능할 것으로 보인다.... 이와 함께 대형마트와 개인병원이 밀집돼 있는 중심 상권이 가까운 것은 물론, 목감지구와 배곧지구 상권과도..."
2121,2019.12.16.,내년 신도시 상가가 뜬다…'향동 봄 프라자' 주목,항아리 상권이 형성되기 때문에 고수익을 기대할 수 있다. 또한 신규 상가는 권리금이 없기 때문에 기존 상가보다 투자 부담감도 현저히 낮다. 이러한 가운데 서울과 바로 인접해 있어 옆세권 신도시라 불리는 향동지구에...
2122,2019.12.20.,"2019년 분양시장 실질적 폐장 , 전국 6200여가구 분양",대림산업이 서울 서대문구 홍은동에 짓는 ‘e편한세상 홍제 가든플라츠’를 분양합니다. 지하철 3호선... 중심 상권이 가깝고 초중교 부지가 가까워 통학하기 쉽습니다.KCC건설이 대구 달서구 두류동에 짓는...
2123,2019.12.03.,"중랑구, 지역상권 활성화를 위한 특화거리 조성에 힘써","그러나 좁은 도로와 쓰레기 무단투기, 불법 주정차 등이 상권 활성화를 가로막는 고질적인 문제점으로 꼽혀왔다. 이에 구는 작년 11월 ‘2019 서울시 역세권 보행환경 개선사업’ 대상지에 선정되는 등 사업 추진을 위한..."
2124,2019.12.13.,청라~부평 904번 급행버스 12월 중 폐선,서울도시철도 7호선의 청라국제도시 연장 전 임시 노선으로 7호선 환승과 부평 상권 이용을 위한 청라 주민들의 이용이 많았다. 이에 904번을 보조하기 위해 노선이 약간 변경된 904-1번 노선이 신설되기도 했다. 하지만...
2125,2019.12.09.,[충청브리핑] 하나로 시험 가동 중 또 ‘정지’…커지는 우려,물건너가나 ‘서울 환승’ 서해선 이대로 좋은가 &lt;상&gt; ◇한겨레신문 -‘동창리 폐기’ 뒤집은 김정은... 세종시 정착 저해 첫 원인으로 꼽혀…상권활성화 위해서도 폐지 목소리 고조 -與 3선단체장 박용갑·황명선...
2126,2019.12.11.,입주 확정! 개포동 아파트 디에이치 아너힐즈,"있는지, 상권의 유동인구는 어떤 수준인지, 배후지 수요의 규모는 어느 정도인지를 하나하나 직접 체크해 볼... 양재천을 비롯해 자연친화적인 환경을 갖춘 도시로 손꼽힐 만큼 특별한 지역이 서울에서도 바로 이..."
2127,2019.12.05.,"""소상공인法 곧 제정, 결집하자"" 결의 다진 소상공聯",5일 서울 여의도 63시티 그랜드볼룸에서 '2019 송년의 밤' 행사를 진행했다. 사진=이기륭 기자... 맞춤양복 부문의 한상권 마스터테일러 등 10명의 각 업종별 최고 기능인들은 손 프린팅 행사를 진행하며 손끝 기술을...
2128,2019.12.09.,"펫용품 전문 펫토리아, 제54회 프랜차이즈 창업박람회 참가... ""기능성 제품 ...",펫토리아(대표 양재걸)가 오는 1월 3일부터 5일까지 서울 코엑스에서 열리는 프랜차이즈 창업박람회에서 자사... 행사 기간 동안 전시 부스를 통해 전국 각 지역 생활권 및 상권에 '펫토리아' 가맹점을 모집한다고 밝혔다....
2129,2019.12.04.,숭실대 창업지원단 ‘2019 동작구 지역문제 해결 해커톤 선정캠프’ 성료,서울 동작구는 주거 중심 비율이 서울시에서 3번째로 높은 84.1%로 비교적 쾌적한 주거환경을 지닌... 지역상권 활성화 방안 △문화 인프라 시스템 구축 방안 △기타 동작구 지역 문제 등이 주제로 다뤄졌다. 전문가...
2130,2019.12.06.,"bhc치킨, 치맥문화 확산을 위해 종로점에 이어 ‘홍대서교점’ 오픈",bhc치킨 송연우 본부장은 “치맥 문화 확산을 위해 외국인 관광객들이 주로 방문하는 서울의 대표 상권을 중심으로 매장을 확장하고 있다”라며 “고객들의 접근성을 높이고 외국인 관광객의 유입을 확대해 홍대의...
2131,2019.12.13.,"여의도·영등포 인프라 갖춘 '신길역 봉주르', 미래가치 시선 집중","구축된 서울특별시 영등포구 영등포동1가 인근에 들어선다. 단지는 지하 2층, 지상 11층 규모의 오피스텔... 따른 상권 집중 및 지가상승 등의 시너지효과까지 기대되고 있다. 따라서 신길역 봉주르는 발전 양상을..."
2132,2019.12.03.,"[게시판] 산업부, 전국 지자체 유통담당 공무원 워크숍",공무원 200여명이 참석한 가운데 열린 이날 행사에서는 지난 9월 '유통산업발전법 시행규칙' 개정에 따라 오는 28일 변경되는 상권 영향평가 제도에 대한 설명 등이 진행됐다. (서울=연합뉴스)
2133,2019.12.20.,[시사금융용어] 라이프 캐싱(life caching),"적은 비용의 마케팅이 가능해 지역 상권을 대폭 확장하는 한편, 광고가 아닌 것처럼 상품을 노출해 신뢰를... (정책금융부 이재헌 기자) (서울=연합인포맥스) 본 기사는 인포맥스 금융정보 단말기에서 07시 30분에..."
2134,2019.12.04.,"11일부터 올해 마지막 행복주택 5,838호 입주자 모집","또한 대형 쇼핑몰과 로데오 거리 등 대형 상권, 경기도청·세무서 등 다수의 편의시설과 인접하여 입주자의 생활 편의성이 높을 것으로 예상된다. 또한 대학생 특화단지인 서울휘경(200호)은 반경 5km이내에..."
2135,2019.12.06.,합리적인 분양가 갖춘 '상업시설 뜬다,"활성화 상권을 기대해 볼 수 있다. 상가는 우수한 교통망도 갖췄다. 지하철 1호선 역곡역과 온수역, 7호선 천왕역 이용이 가능하며 경인로, 서울외곽순환도로, 서부간선도로, 경인고속도로와 인접해 서울 및..."
2136,2019.12.03.,"중랑구, 지역상권 활성화 위한 특화거리 조성 '박차'","그러나 좁은 도로와 쓰레기 무단투기, 불법 주정차 등이 상권 활성화를 가로막는 고질적인 문제점으로 꼽혀왔다. 이에 구는 작년 11월 '2019 서울시 역세권 보행환경 개선사업' 대상지에 선정되는 등 사업 추진을 위한..."
2137,2019.12.11.,연제구 연산교차로 '오방상권' 활성화 사업 탄력받는다,"중소벤처기업부는 지난 10일 상권르네상스 프로젝트 사업대상지로 연제구 오방상권을 비롯해 전라북도 군산, 강원도 정선, 서울특별시 관악, 충청남도 공주 등 5개소를 선정했다. '상권 르네상스 프로젝트'는 낙후된..."
2138,2019.12.10.,인기 키즈 키테넌트 확보한 복합상업시설 ‘판테온스퀘어’ 상권 형성 기대감...,"강남에서 자동차로 30분대, 서울역에서 40분대에 위치해 있어 수도권 핫플레이스로 큰 인기를 누렸다. 이... 서울시 송파구 랜드마크로 꼽히는 ‘잠실 롯데월드타워몰’도 마찬가지. 연면적 80만7615㎡ 규모에 육박하는..."
2139,2019.12.04.,[세이프 포커스] 불법주정차 '주민신고제' 순항하고 있을까,"세이프타임즈는 지난 8월 &lt;세이프 포커스&gt;를 통해 4대 불법 주정차에 대해 서울 용산 등 8곳 지역에서 집중... 않고, 상권 위축을 우려하는 상인이 단속에 불만을 제기하는 경우도 많다""고 말했다. 다양한 민원이 나오고..."
2140,2019.12.04.,기차역 뒷골목 감성 품은 부산 해리단길 ‘골목상권 大賞’,"서울의 경리단길, 경주 황리단길을 본떠 해운대의 ‘해’ 자를 붙여 명명했다. 해운대 해수욕장 인근... 등 상권을 확대시켰다. 2018년 21개에 불과했던 가게들이 1년여 만인 올해 61곳으로 3배 가까이 늘었다. 평일 기준..."
2141,2019.12.05.,정시 확대 방침 북적이는 학원가…대치동 학원가 대입학원만 445곳,이는 대치동 학원가가 속한 서울 강남구 대입학원 평균 매출 3천388만원 대비 210만원 높은 매출이다. 상권 내 기타 학원 평균 매출도 4천71만원으로 강남구 평균 매출 3천199만원 대비 872만원 높았다. 조현택...
2142,2019.12.07.,신선식품 밤샘 배달 ‘치킨게임’…인건·포장비 눈덩이,신세계의 온라인 전담업체인 SSG닷컴도 서울 전지역으로 새벽배송을 확대하기 위해 최근 김포에 수도권... 오프라인 상권 등을 이미 갖추고 있는 신세계·롯데 등이 본격적으로 경쟁에 나설 경우 쿠팡의 성장세가...
2143,2019.12.03.,"갤러리아百, 패션사업 본격화…70년 전통 '간트' 론칭","내년 3월에는 대전에 위치한 갤러리아백화점 타임월드에 오픈하고, 2020년 서울 상권을 중심으로 최대 7개 매장을 오픈한다는 계획이다. 이번에 전개하는 '간트'는 갤러리아가 처음으로 진행하는 트래디셔널 캐주얼 브랜드..."
2144,2019.12.04.,"`원주 유보라 아이비파크`, 원주기업도시 중심…교육특화 시설 눈길","메인 상권이 가까운 중심 생활권에 위치해 풍부한 생활 인프라스트럭처를 누릴 수 있으며 단지 앞 수변공원과 인근에 중앙공원, 어린이공원 등이 위치해 주거 환경이 쾌적하다. 또 원주가 서울과 강원을 잇는 교통..."
2145,2019.12.13.,차별화된 무형의 가치 대형 브랜드 'e편한세상 용인 파크카운티' 인기,"실제로 빠른 상권활성화를 위해 대림산업이 5년간 직접 운영하며 임대하기로 해 화제가 된 바 있다.... 지난해에는 서울세종고속도로 모현∙원삼나들목(IC) 설치도 확정되었다. 한편, 'e편한세상 용인 파크카운티'는..."
2146,2019.12.19.,초저금리 시대에 아파트 규제까지… 풍선효과 누리는 ‘합정역 스퀘어 리버뷰...,"추가로 지난 16일에는 고가 주택에 대한 대출규제의 강도를 더욱 더 높이면서, 9억원 이상의 서울의 아파트를... 홍대 상권 및 합정역 8번 출구 먹자골목과도 가까워 풍부한 배후수요를 누릴 수 있을 것으로 전망된다...."
2147,2019.12.02.,“30장 쌓아올린 크레이프케이크 새벽 배송”,"빌리엔젤은 현재 서울과 수도권 핵심 상권에 약 100여개의 직가맹 매장을 운영하고 있으며, 올해 매출은 300억원으로 예상된다. 최근에는 쿠팡과 케이크 납품 계약을 맺고 이달 중순부터 콜드체인 케이크의 새벽·당일..."
2148,2019.12.11.,1인 가구 600만 돌파 눈앞... 전용 40㎡이하 초소형 아파트 ‘인기 몰이’,"실제로 올해 2월 서울시 서대문구 홍제동 일대에서 분양된 ‘홍제역 해링턴 플레이스’의 전용면적 39... 편의시설은 유진상가, 홍제시장 등 홍제역 상권과 이마트(은평점), NC백화점(불광점) 등을 이용할 수..."
2149,2019.12.16.,"30주년 빛낸 성과, 자리지켜준 단원들 덕이에요",6월 서울에서 열린 제37회 대한민국연극제에서 대상(대통령상)을 받은 일이다. 이 작품은 한 사립 고등학교... 지역 상권의 활성화에 이바지할 예정이다. 공연장상주단체 성과공유대회에서 극단 대표로 발표했던 이삼우...
2150,2019.12.02.,"“링거 투혼까지”…‘후계자들’, 진정성으로 기회 만들까 [종합]","2일 서울 종로구 광화문 씨스퀘어빌딩에서 TV CHOSUN ‘손맛 전수 리얼리티-백년의 맛, 후계자들’... 정 PD는 “‘골목식당’의 포맷은 죽어가는 골목의 상권을 살리는 것”이라며 “우리 프로그램은 숨은 곳에서 장인..."
2151,2019.12.05.,"[일문일답] 프레드릭 요한손 이케아코리아 대표 ""한국에서 공격적으로 확장해...",기흥점은 이케아 주변으로도 상권이 발달한 지역이라 소비자들에게 원스톱 쇼핑 제공 이점이 있다고 본다.... 내년 상반기 서울에도 매장을 여는데 이곳으로 결정한 이유는 무엇인가. 온라인으로 가는 현재 트랜드 상황과...
2152,2019.12.04.,개통 앞둔 철도노선이 개통된 노선보다 가치 있는 이유,뿐만 아니라 교통망을 따라 추가적인 인구 유입이 이뤄지고 사람이 모이는 역을 중심으로 상권이... 우선 신세계건설이 12월 서울 강남구 자곡동 653번지 일원에 선보이는 밀라네제 스타일의 고급 디자인하우스...
2153,2019.12.03.,"삼육대, 제1회 캡스톤디자인 경진대회 개최","이 팀은 공릉동 도깨비시장 상권 활성화를 위해 지난 11월 9일 어린이행사 무대를 기획, 시민과 함께하는 행사를 진행해 바이럴 효과를 얻었다. 특히 삼육대가 서울시와 함께 추진하는 노원구 도시재생사업..."
