,date,title,contents
1351,2019.12.18.,"KB국민은행, 자영업자 경영컨설팅 우수기관 표창 수상","13개(서울 5개, 전국 5대 광역시 5개, 수도권 2개, 여의도 HUB 센터 1개)의 컨설팅 센터를 운영하고 있다. 'KB... 외식업자영업자, 재창업 예정자 및 사회적 기업 등을 대상으로 상권/빅데이터 분석, SNS 마케팅 및 세무분석..."
1352,2019.12.05.,"6년째 표류한 상암 롯데몰, 내년 급물살타나","롯데쇼핑은 해당 부지에 롯데백화점, 롯데마트, 롯데시네마 등이 어우러진 서울 서북권 최대 쇼핑단지로 만들 계획이었다. 그러나 망원시장 등 인근 상인들이 ‘골목상권 보호’를 이유로 대형쇼핑몰 입점을 강력하게..."
1353,2019.12.12.,9호선 등촌·염창·신목동역 일대 건축행위 완화,"서울 지하철 9호선 등촌·염창·신목동역 일부 지역이 특별계획구역에서 해제되는 등 건축 행위가 종전보다... 또 주변상권 활성화를 유도하기 위해 학원, 제과점, 미용실 등을 건축물 권장용도에 새로 추가했다. 시..."
1354,2019.12.19.,"2019년도 군산관광, 시민과 함께한 새로운 변화와 도약의 해","전개해 서울 광화문에서 열린K-Festival 2019 마케팅부문 최우수상, 일산 킨텍스에서 개최된 대한민국... 전통상권과 연계한 지역발전 효과를 창출했다. 지역의 여러 계층과 자원을 활용한 축제관광 콘텐츠 개발을 위해 지난..."
1355,2019.12.12.,"BC카드, '금융 빅데이터 플랫폼' 오픈…AI로 창업성공 가능성 예측","12일 서울 중구 위워크(WeWork) 을지로점에서 ‘금융 빅데이터 플랫폼’ 개소식이 열렸다. 이날 행사에는... 망고플레이트(상권), 닐슨컴퍼니코리아(소비자·미디어 패널), 다음소프트(소셜) 등 비금융데이터가 금융..."
1356,2019.12.23.,'포레나 루원시티' 아파트에 이어 상업시설도 인기몰이 中,특히 중심상업지구에 위치하는데다 서울지하철 7호선 청라 연장선이 개통되면 강남권을 비롯해 수도권 대부분 지역 접근성이 크게 향상돼 상권 확대와 활성화를 견인할 것으로 전망된다. 또 단지 앞 봉수초등학교가...
1357,2019.12.12.,"SKT, 소상공인 지원 유튜브 조회수 300만건 돌파",SK텔레콤은 골목상권의 소상공인과 사회적 기업을 알리기 위해 지난 11월 27명의 유튜버를 선발했다. 이후... 12일 서울 을지로와 대전 서구지점에 개소했다. 이는 SKT의 유통망을 공유인프라로 외부에 공유해 사회적...
1358,2019.12.19.,불안한 세종시 유통경제에 백화점 입점 '하세월'...한시적 활용방안 뿐,시는 기존 계획에 반영된 백화점 광장 부지(5061㎡)와 어반아트리움의 광장 부지(3523㎡)를 연계해 8584㎡ 규모(서울시청광장 1만3000㎡의 3분의 2)의 광장을 조성할 예정이다. 백화점이 들어서기 전에 상권 활성화 차원에서...
1359,2019.12.20.,"[인터뷰] 김종천 대전시의장 ""시민 위한 의정활동 최선""","위해 서울⋅부산국제관광전, 광주세계수영대회 등 전국단위 행사에 현장방문과 홍보를 강화하는 적극적인... 골목상권 활성화와 소상공인의 소득 향상을 도모하고, 시내버스 준공영제 재정지원의 투명성과..."
1360,2019.12.19.,불안한 세종시 유통경제에 백화점 입점 '하세월'...한시적 활용방안 뿐,시는 기존 계획에 반영된 백화점 광장 부지(5061㎡)와 어반아트리움의 광장 부지(3523㎡)를 연계해 8584㎡ 규모(서울시청광장 1만3000㎡의 3분의 2)의 광장을 조성할 예정이다. 백화점이 들어서기 전에 상권 활성화 차원에서...
1361,2019.12.20.,"[인터뷰] 김종천 대전시의장 ""시민 위한 의정활동 최선""","위해 서울⋅부산국제관광전, 광주세계수영대회 등 전국단위 행사에 현장방문과 홍보를 강화하는 적극적인... 골목상권 활성화와 소상공인의 소득 향상을 도모하고, 시내버스 준공영제 재정지원의 투명성과..."
1362,2019.12.13.,"IBK기업은행-소상공인시장진흥공단, 소상공인·전통시장 지원 협약",이번 협약에 따라 두 기관은 온누리 상품권 구입 활성화를 통해 소상공인·전통시장 상권 살리기에... 이사장(왼쪽)이 기념촬영을 하고 있는 모습. [서울=뉴스핌] 한기진 기자 = 2019.12.13 hkj77@hanmail.net
1363,2019.12.12.,"비씨카드, 금융 빅데이터 플랫폼 개소…300만 가맹점 기반 데이터 제공 계획",비씨카드는 12일 서울 중구 위워크 을지로점에서 금융빅데이터 플랫폼 개소식을 개최했다고 밝혔다. 이날... (부동산) ▲망고플레이트(상권) ▲닐슨컴퍼니코리아(소비자·미디어 패널) ▲다음소프트(소셜) 등 주요 기업과...
1364,2019.12.11.,"까사미아, ‘대치한티점’ 오픈",까사미아는 서울 강남 대치동 한티역 인근에 약 661㎡ 3층 규모로 ‘까사미아 대치한티점’을 오픈한다. 대치동은 최근 고가 리빙 브랜드들이 잇달아 들어서며 신흥 프리미엄 리빙 상권으로 이목을 모으고 있다. 지난 달...
1365,2019.12.19.,"""캐롤송이 돌아옵니다""… SKT, 성탄절 캐롤 음원 무료 제공",또한 25일까지 서울 주요 상권을 누비며 어린이에게 선물을 나눠주는 '캐롤 트럭'을 운영할 계획이다. 이 트럭은 25일 이후에 전국 '5GX 부스트파크'에서 소상공인과 함께 연말연시 이벤트를 펼치게 된다. 아울러...
1366,2019.12.20.,"강북구의회, 제230회 제2차 정례회 폐회","이어 최근 제2차 본회의에서는 예산안과 관련된 더욱 심도 있는 논의를 위해 회기를 연장하기로 결정하고, 3차 본회의에서 ▲2020년도 일반·특별회계 사업예산안 ▲서울특별시 강북구 지역상권 활성화 및 특화거리..."
1367,2019.12.12.,SKT 소상공인 지원 프로그램으로 만든 영상 300만 돌파,SK텔레콤은 골목상권의 소상공인과 사회적 기업을 알리기 위해 지난 11월 27명의 유튜버를 선발('소빅 1기... 12일 서울 을지로와 대전 서구지점에 개소했다. 이는 SKT의 유통망을 공유인프라로 외부에 공유해 사회적...
1368,2019.12.18.,"[눈길끄는 분양단지]대림산업, 'e편한세상 홍제 가든플라츠'","홍제초, 홍은중, 인왕중, 상명사대부속여고 등 초중고와 상명대, 명지대, 명지전문대, 서울여자간호대 등이 단지 인근에 있다. 편의시설은 유진상가, 홍제시장 등 홍제역 상권과 이마트(은평점), NC백화점(불광점)..."
1369,2019.12.10.,"교촌치킨, 강남상권 공략…'강남역점' 오픈","강남역 인근은 지난 9월 기준으로 일 평균 유동인구만 64만명이 넘는 명실상부 서울의 대표상권이다. 특히 오피스 및 학원가, 상업시설들이 밀집해있어 2040세대가 가장 많이 찾는 곳 중 하나다. 인근 주거 인프라도..."
1370,2019.12.12.,"SK텔레콤 ""소상공인 지원 유튜브 콘텐츠 '소빅', 조회수 300만건 돌파""",SK텔레콤은 골목상권의 소상공인과 사회적 기업을 알리기 위해 지난 11월 27명의 유튜버를 선발(소빅 1기)... 12일 서울 을지로와 대전 서구지점에 개소했다. 이는 SKT의 유통망을 공유인프라로 외부에 공유해 사회적...
1371,2019.12.10.,"교촌치킨, 강남상권 공략…'강남역점' 오픈","강남역 인근은 지난 9월 기준으로 일 평균 유동인구만 64만명이 넘는 명실상부 서울의 대표상권이다. 특히 오피스 및 학원가, 상업시설들이 밀집해있어 2040세대가 가장 많이 찾는 곳 중 하나다. 인근 주거 인프라도..."
1372,2019.12.06.,"홍석천, 이태원 음식점 1곳 문 닫는다 ""마음이 참 슬퍼""","올해 7월에는 KBS1 '오늘밤 김제동'에 출연해 박원순 서울시장에게 영상 편지로 자영업자의 고충을 털어놓았다. 홍석천은 골목상권이 어려워진 원인으로 폭등한 임대료를 들며, 그래서 특색 있는 가게들이 못 버티고..."
1373,2019.12.12.,"“16개 전통시장, 상암 롯데몰 찬성한 적 없다”","현재 상암 롯데몰은 서울시의 인허가 승인을 얻지 못해 6년째 표류 중이다. 최근 감사원은 “인근 전통시장... 이날 대책위는 “지금의 상권영향 평가는 엉터리”라며 “슈퍼마켓, 시장 정도만 진행하고 있는데, 현실과..."
1374,2019.12.18.,4월 문여는 제주 '랜드마크' 드림타워…“지역상권 변화 이끈다”,이는 서울 63빌딩과 비교하면 1.8배 큰 수준이다. 내부는 더 화려하다. 국내 최초 전체 객실이 전용면적 65... 지역상권이 완벽히 바뀌게 될 것”이라고 봤다. 권대중 명지대 부동산학과 교수는 “드림타워는 규모뿐만...
1375,2019.12.03.,"갤러리아, 패션 브랜드 '간트' 판권 획득…""패션 사업 강화""","앞으로 서울 상권을 중심으로 최대 7개 매장을 오픈한다는 계획이다. 갤러리아는 지난해 프랑스 명품 브랜드 '포레르빠쥬'에 이어 간트 판권을 획득하며 글로벌 브랜드 판권을 강화하게 됐다. 갤러리아 관계자는 ""올해..."
1376,2019.12.05.,"제로페이, 군마트(PX)에도 깔린다",법인카드를 대체하고 지역상권 활력에 기여할 것이라는 취지로 만들어졌다. 중앙부처에서는 아직 도입한 곳이 없고 서울시 등 지방자치단체 중심으로 참여하고 있다. 진흥원은 가맹점 확보에 주력하는 동시에 정부부처...
1377,2019.12.19.,"전동평 영암군수, 6만 군민과 함께 꾸는 꿈...군민행복시대 완성！",미암서울농장은 2020년 개장을 목표로 폐교부지를 철거하는 등 착실하게 공사를 추진 중이다. 우수... 소재지 상권 활성화에 기여하게 된다. 완공된 경비행기 이착륙장에서는 작년 11월 호남권 최초로 제5회...
1378,2019.12.11.,"""분양받고 바로 입주하세요""...'창원월영 마린애시앙' 4298가구 후분양","부영주택은 10일 서울 중구 부영태평빌딩에서 기자간담회를 열고 창원시 마산합포구 월영동에 '창원월영... 남부시외버스터미널, 합포도서관, 롯데시네마, 메가박스, 댓거리상권을 포함한 생활 편의시설도 가깝다...."
1379,2019.12.03.,"세포라, 명동에 2호점 '롯데 영플라자점' 오픈",사진 | 세포라코리아[스포츠서울 권오철 기자] 지난 10월 파르나스몰점으로 한국에 진출한 뷰티 편집숍... 가진 상권이기 때문이다. 외국인 관광객을 중심으로 한국의 뷰티 트렌드를 아시아에 선보일 수 있는 최적의...
1380,2019.12.11.,"""분양받고 바로 입주하세요""...'창원월영 마린애시앙' 4298가구 후분양","부영주택은 10일 서울 중구 부영태평빌딩에서 기자간담회를 열고 창원시 마산합포구 월영동에 '창원월영... 남부시외버스터미널, 합포도서관, 롯데시네마, 메가박스, 댓거리상권을 포함한 생활 편의시설도 가깝다...."
1381,2019.12.10.,교촌치킨 강남역점 오픈…강남 배달·매장 수요 공략,교촌 관계자는 “서울 대표 상권인 강남대로에 교촌의 치맥을 전파하기 위해 강남역점을 오픈했다”며 “교촌치킨 강남역점을 찾아주시는 분들에게 교촌의 차별화된 맛과 서비스로 고객 만족을 제공하는데 노력하겠다”...
1382,2019.12.03.,"세포라, 명동에 2호점 '롯데 영플라자점' 오픈",사진 | 세포라코리아[스포츠서울 권오철 기자] 지난 10월 파르나스몰점으로 한국에 진출한 뷰티 편집숍... 가진 상권이기 때문이다. 외국인 관광객을 중심으로 한국의 뷰티 트렌드를 아시아에 선보일 수 있는 최적의...
1383,2019.12.05.,"이용섭 시장, 광역단체장 최초 '목민상' 영예",이용섭 광주시장이 5일 서울 63빌딩에서 열린 '2019 목민상 시상식'에서 광역단체장으로는 최초로 목민상을... 활성화 ▲'골목상권 특례보증' 등 소상공인 자생력 강화를 위한 정책 추진에 대해 높이 평가했다. 광주지역...
1384,2019.12.23.,1인 좌석에 정기권까지···커피전문점 ‘카공족’ 끌어안기 열기,“오피스 상권에도 콘센트·그룹석 등을 점차 늘려 다양한 고객 니즈를 만족시킬 예정”이라고 말했다. 라운지탐탐 내부.탐앤탐스는 지난 10월 서울 광진구에 코피스족(카페에서 업무를 보는 사람들)을 위한 전용 공간...
1385,2019.12.22.,"유승종합건설, ‘시흥장현 유승한내들 퍼스트파크’ 견본주택 3일 간 3만5000...","단지 주변으로 다양한 학군이 위치하며, 대형마트와 개인병원이 밀집돼 있는 목감지구, 배곧지구 상권과... ‘시흥장현 유승한내들 퍼스트파크’ 분양 관계자는 “시흥 장현지구가 지닌 우수한 서울 접근성과..."
1386,2019.12.19.,"[IT오늘] KT, 부산 지역화폐 '동백전' 운영대행 사업자 최종 선정…LGU+-서울...","다만, 골목상권 활성화라는 지역화폐 도입 취지에 맞게 백화점, 대형마트, 기업형 슈퍼마켓, 사행성업소... LGU+-서울대-크립토랩, 양자내성암호 기술 개발 업무협약 체결 LG유플러스는 미래 보안 기술 확보를 위해..."
1387,2019.12.23.,올 한 해 전국 중대형상가 순영업소득↓ '건물주도 힘들어',"이어 △대구(-27.7%), △서울(-26.9%), △광주(-24.9%), △부산(-23.5%), △세종(-23.4%) △대전(-21%), △경기(-19.2... 영향을 미쳤다”며 “향후 지역, 콘텐츠에 따른 상권 양극화 현상은 심화될 것으로 보인다""고 내다봤다."
1388,2019.12.24.,고객 발길 붙잡는 외관특화! 인천 청라 최중심 상가 '리버사이드 크루즈몰',"◆ 청라호수공원 품은 항아리 상권으로 시선집중!…대규모 개발호재와 배후수요 풍부해 주목! '리버사이드... 청라린스트라우스 A동 106호에 위치하며, 강남 홍보관은 서울 강남구 테헤란로 119에 마련돼 있다. 디지털전략부"
1389,2019.12.02.,시코르 vs 세포라…뷰티 편집숍 ‘한·불전’,‘출범 3년’ 신세계 시코르 30호점 2030 겨냥 홍대 핵심 상권에 세워 신세계가 만든 국내 뷰티 편집숍... 2일 신세계백화점에 따르면 오는 6일 서울 홍대입구에 시코르의 30번째 점포가 문을 연다. 2016년 12월에 1호점을...
1390,2019.12.05.,"서초구 서래마을, '프랑스풍 디자인 거리'로 재탄생",서울 서초구(구청장 조은희) 서래마을이 파리의 색채가 더 짙어진 유럽풍 거리로 재탄생했다. 서초구는 서래마을의 명소화와 상권 활성화를 위해 서래로 530m 구간(서래로 입구~방배중학교)을 '서래마을 디자인 특화거리...
1391,2019.12.16.,“통영 남망산 공원 공토(公土) 아닌 사유지인가”,남산에 서울타워가 있는 것처럼 사업자가 원하는 통영타워뷰 건립 1순위는 남망산 공원이다. 이날 토론회... 남망산을 원하는 것은 남망산 주변의 상권을 끌어들이려는 상업적 이익을 고려한 것으로 보인다. 타워뷰가...
1392,2019.12.12.,"SKT, 소상공인 지원 ‘소빅’ 영상 조회수 300만건 돌파",‘소상공인행복센터’를 서울 을지로와 대전 서구지점에 개소했다. SK텔레콤 지점에 마련된 소상공인 대상 전용 상담창구에서는 ▲각종 지원제도 안내 ▲법무·세무·노무·자금 전문가 연결 ▲상권 분석 제공...
1393,2019.12.17.,"KT, 빅데이터 거래할 수 있는 '통신 빅데이터 플랫폼' 열어","KT는 16일 오후 서울 광화문 S타워에서 개인과 기업이 빅데이터를 거래할 수 있는 통신 빅데이터 플랫폼... BC카드(카드 소비정보), 넥스트이지(관광), 두잉랩(영양정보), 오픈메이트(부동산 상권), 경기대학교..."
1394,2019.12.20.,'주얼리'로 사업 다각화 나선 패션기업,"기획부서는 트렌드와 고객 니즈 분석 및 상품기획을 한다.이 회사는 서울 강남구에 위치한 본사 사옥이... 세정 박정숙 주얼리 사업부장은 ""일리앤은 주요 쇼핑몰 및 백화점, 가두 상권 중심으로 유통망을 점차 확대해..."
1395,2019.12.12.,"BC카드, 금융 빅데이터 무료 플랫폼 열고 고객맞춤 서비스","12월12일 서울 중구 위워크 을지로점에서 '금융 빅데이터 플랫폼' 개설 기념행사에서 기념촬영을 하고 있다.... 망고플레이트(상권), 닐슨컴퍼니코리아(소비자 미디어 패널), 다음소프트(소셜)는 비금융데이터를..."
1396,2019.12.03.,갤러리아百 ‘간트’ 론칭…패션사업 본격화,갤러리아는 내년 2월에 개장하는 광교점 오픈을 시작으로 3월에는 대전에 있는 갤러리아백화점 타임월드에 오픈하고 내년에 서울 상권을 중심으로 최대 7개 매장을 오픈한다는 계획이다. 이번에 전개하는 ‘간트’는...
1397,2019.12.11.,"[동네방네]관악구, 중기부 '상권 르네상스 프로젝트' 선정",박준희 관악구청장은 “상권 르네상스 사업 유치는 관악구를 ‘강한 경제’ 도시로 만들기 위한 노력의 결실”이라며 “별빛 신사리 상권을 서울시의 대표 상권으로 발전시키겠다”고 말했다. 양지윤
1398,2019.12.19.,"배민‧DH 빅딜 '키', 위메프가 쥔다","업계 관계자는 ""우아한형제들이 지목한 쿠팡의 경우 아직 서울 핵심 상권 외 지역으로 뻗어나가지 못하고 기존 업체들의 텃세에 공격적인 사업 확대도 꾀하기 어려운 상황""이라며 ""이러한 상황에 위메프의 공격적인..."
1399,2019.12.21.,"백종원 골목식당 포방터 돈가스집, 제주도 이전한 이유는?",공개됐다.서울 서대문구 포방터시장에 위치한 돈가스집 연돈은 ‘골목식당’에 나오며 전국적으로 이름을... 살아난 상권이 다시 위축될지도 모른다는 우려로 추측된다. 한 인터넷 커뮤니티에서는 포방터 상인회에 속한...
1400,2019.12.21.,"백종원 골목식당 포방터 돈가스집, 제주도 이전한 이유는?",공개됐다.서울 서대문구 포방터시장에 위치한 돈가스집 연돈은 ‘골목식당’에 나오며 전국적으로 이름을... 살아난 상권이 다시 위축될지도 모른다는 우려로 추측된다. 한 인터넷 커뮤니티에서는 포방터 상인회에 속한...
1401,2019.12.12.,"'중화2동의 과거와 현재, 주거공간' 살아생전, 사라생展","서울 중랑구(구청장 류경기)는 오는 16일부터 22일까지 중화2동 주민공동이용시설 신축예정지에서 '살아생전... 지역상권 활성화 및 일자리 창출, 노후·불량주택 개량, 생활환경 개선 등 본격적인 재생 사업을 추진해 나갈..."
1402,2019.12.10.,"대구신세계, 오픈 3년…""대구 소비지도 바꿔 동대구역 핵심상권 부상""","KTX와 SRT, 고속버스, 시ㆍ내외버스, 지하철 등 모든 대중교통 수단이 집결된 복합환승센터를 통해 포항, 구미 등 인근 경북지역은 물론 서울, 수도권 거주자들까지 모여 동대구역 주변 상권이 대구광역시를 대표하는..."
1403,2019.12.03.,"세포라, 명동 롯데영플라자에 2호점 오픈",프랑스 명품 그룹 루이비통모에헤네시(LVMH)가 운영하는 세포라는 지난 10월 서울 강남구 삼성동 파르나스몰에 1호점을 열며 한국에 공식 진출했다. 세포라가 명동 상권을 선택한 까닭은 다양한 화장품 브랜드와의...
1404,2019.12.21.,계속되는 ‘젠트리피케이션’ …해법은 없나?,"임차인은 상권 유지 및 지속적 성장을 위해 노력하도록 하고 있다. 서울시, 광주시, 순천시, 전주시 등 주요 도시들이 상업지역의 급격한 임대료 상승에 대응하기 위해 상생협약을 체결했다. 특히 성동구는 상생협약..."
1405,2019.12.17.,"[IT오늘] LGU+-공군사관학교, 5G 기반 '스마트 軍' 육성 맞손…LG CNS, 병행검...","양 기관은 서울 마곡 LG사이언스파크에서 이 같은 내용의 업무협약(MOU)을 체결하고, 보다 체계적이고... KT, 인공지능 기반 통신 빅데이터 플랫폼 개소 KT는 유동인구·소비·상권·여행 등 생활 데이터를 개인과 기업이..."
1406,2019.12.19.,[티브로드]<인천>소상공인에 갑질 '꼼짝마'…수도권공정경제협의체 출범,박남춘 인천시장은 지역 상권 활성화를 위해 출시한 인천e음에 대해 정부와 여당의 지원을 촉구했습니다. 6% 캐시백 혜택을 내세워 돌풍을 일으켰다가 예산 문제로 제동이 걸린 문제를 제기한 겁니다. [박남춘 / 서울시장]...
1407,2019.12.16.,"""케이크 만들기, 24시간이 모자라""…베이커리 대목 크리스마스 온다","평소 케이크 판매가 상대적으로 적은 오피스 상권도 크리스마스엔 다르다. 출근길 아침 식사 혹은 간식용으로 일반 빵을 찾는 손님도 퇴근 이후 케이크를 사기 위해 매장을 찾는다. 서울역 인근 A 프랜차이즈 직원은 ""평소..."
1408,2019.12.19.,“포방터 돈가스 이사 배경엔 텃세” 폭로에 “시장 안 가” 반응까지,"서울 서대문구에 있는 이 돈가스 맛집은 최근 제주도로 옮겨 재영업하고 있다. 이 식당 주인 내외는 18일... 누리꾼들은 “시장에 안 가는 덴 이유가 있다”(터***), “이제 맛집 빠지면 상권이 주춤할 텐데 이해가 안 간다”..."
1409,2019.12.20.,"소형오피스텔 ‘블루카운티 숭인Ⅰ’, 1월 준공 예정",또한 동대문 패션타운 및 종합시장의 약 15만 명에 달하는 직장인 수요가 상주하는 동대문상권에 인접한 가운데 서울 주요 업무 지역인 광화문과 강남을 각각 20분과 25분 거리에서 누릴 수 있어 직주근접에 최적화된...
1410,2019.12.12.,"BC카드, '금융 빅데이터 플랫폼' 오픈","12일 서울 중구 위워크(WeWork) 을지로점에서 진행된 개소식에는 장석영 과기정통부 정보통신정책실장... 망고플레이트(상권), 닐슨컴퍼니코리아(소비자·미디어 패널), 다음소프트(소셜) 등 비금융데이터가 금융 빅데이터..."
1411,2019.12.12.,"SK텔레콤, 소상공인 지원 영상 인기몰이…총 조회수 300만↑",SK텔레콤은 골목상권의 소상공인과 사회적 기업을 알리기 위해 지난달 27명의 유튜버를 선발(‘소빅 1기’... 12일 서울 을지로와 대전 서구지점에 개소했다. 이는 SKT의 유통망을 공유인프라로 외부에 공유해 사회적...
1412,2019.12.18.,"KB국민은행, 자영업자 경영컨설팅 우수기관 표창 수상","13개(서울 5개, 전국 5대 광역시 5개, 수도권 2개, 여의도 HUB 센터 1개)의 컨설팅 센터를 운영하고 있다. 'KB... 외식업자영업자, 재창업 예정자 및 사회적 기업 등을 대상으로 상권/빅데이터 분석, SNS 마케팅 및 세무분석..."
1413,2019.12.04.,"국토부, 올해 마지막 행복주택 입주자 모집…16곳·5838세대","대형 쇼핑몰과 로데오 거리 등 대형 상권, 경기도청·세무서 등 다수의 편의시설과 인접해 입주자의 생활 편의성이 높을 것으로 예상된다. 대학생 특화단지인 서울휘경은 반경 5㎞이내에 서울시립대, 경희대 등 17개..."
1414,2019.12.20.,"재건축·재개발 가속화로 녹번역 상권 새바람, ‘은평 미드스퀘어’ 주목",이렇다 보니 서울과 수도권에 위치한 역세권 상가에 대한 투자 선호도가 갈수록 높아지기 마련이다.... 신흥상권으로 부상하고 있어 투자가치 또한 매력적이다. 녹번역에서 불과 180여m 거리에 위치하여 유동인구 유입이...
1415,2019.12.19.,‘검단신도시 모아엘가 그랑데’...지하철 연장선 개통 수혜,개발과 상권 활성화가 이뤄지다 보니 자연스럽게 집값 상승률로 이어지고 투자자들에게도 관심을 받는다”며 “지하철 연장 개통 호재 지역 중에서도 특히 수도권은 서울 및 주요 도심의 접근성과 연관이 있기 때문에...
1416,2019.12.21.,중랑구 중화2동 도시재생 ‘희망지 사업’ 신규 선정,"지역이 서울시 2019년도 하반기 도시재생 ‘희망지 사업’ 신규 대상지로 선정됐다고 밝혔다. ‘희망지... 지역상권 활성화 및 일자리 창출, 노후·불량주택 개량, 생활환경 개선 등 본격적인 사업을 추진해 나가고 있다...."
1417,2019.12.19.,"소상공인에 캐럴 선물하는 SKT, 상가 활기 불어넣는다","아울러 SK텔레콤은 25일까지 서울 주요 상권을 누비며 크리스마스 음악을 틀고, 어린이에게 선물을 나눠주는 '캐럴 트럭'을 운영한다. 이 트럭은 25일 이후에 전국 '5GX 부스트파크'에서 소상공인과 함께 연말연시..."
1418,2019.12.03.,세포라는 왜 '명동'에 2호점을 열었나,프레스티지 뷰티 리테일러 세포라 코리아가 3일 서울 중구 명동에 위치한 롯데 영플라자에 2호점을... 세포라는 중국인 고객에 대한 노하우를 가진 롯데백화점과의 파트너십으로 명동 상권 주 타깃을 겨냥한 마케팅을...
