,date,title,contents
1234,2016.03.10.,"[한국산업의 브랜드파워] 롯데슈퍼, 주문후 2시간내 배송 '온라인 프레시센터...","롯데슈퍼는 상권 맞춤형 점포를 적재적소에 열고 있다. 신개념 슈퍼마켓 롯데슈퍼를 비롯, 도심형 고급... 서울 서초센터를 시작으로 상계센터, 장안센터에 이어 올해 1월 용인센터를 열었다. 롯데는 소비 트렌드를..."
1235,2016.03.02.,국민의당 밀양출신 ‘우일식 예비후보’ 출마 공식 선언,"없고 서울에서 공천을 받기 위해 눈치만 보고 있다""고 말했다. 그는 ""지난 2014년 6.4 선거때 '시민이... 그는 “밀양시와 창녕군에 주거, 의료, 상권을 네크워크화시켜 인구가 적어도 잘사는 농촌지역과 재학생 8천명..."
1236,2016.03.10.,올해 뜨는 성공 창업 1순위 유망 창업 아이템은? 소자본 트렌드 디저트카페창...,"지난해, 서울 창업 박람회 출구조사 결과에 따르면 창업시장에서 가장 관심이 높은 성공 창업 아이템으로... 좋은 상권에 입점하여 매출을 극대화 시키는 것.” 이라며 “ 소자본 테이크아웃 카페의 경우 테이크아웃으로..."
1237,2016.03.17.,[CEO 라이벌 매치] '지하철 상권 잡아라' 로드샵 화장품 삼국지,대표로부터 서울 메트로와의 독점 계약 포기를 종용하는 협박 전화를 받았다는 사실을 폭로하기까지... 많은 서울 명동과 대구 동성로에 매장을 내며 더 페이스샵을 성공시킨 정운호 대표. 매장의 위치 선정이 사업...
1238,2016.03.13.,"<르포>첫 주말 맞은 현대아울렛시티, 인산인해","H-키친, 밀탑, 삼송빵집, 부쳐스버거, 서울만두, 오야마, 서울꽈배기, 베브릿지, 고래사, 복희야사랑해... 그러나 동대문 패션 상권의 영업시간이 대부분 10시 이후부터 다음 날 새벽시간대에 운영되고 있어 해당 시간대에..."
1239,2016.03.08.,[김현주의 일상 톡톡] 퇴직자 3명 중 1명 OOO 사장님?,"""서울 도심의 OO치킨과 지방 변두리 OO치킨은 지역 상권 자체의 편차가 커, 매출과 이익률 역시 다른 게 사실입니다. 그렇다 보니 이런 내용이 저 같은 예비창업자에게는 크게 와 닿지는 않습니다. 좀 더 현실적인..."
1240,2016.03.10.,"현대百, 동대문에 도심형 아울렛…""올 매출 1620억""","현대백화점 측은 현대시티아울렛 동대문점의 입지적 강점과 편리한 대중교통망을 통해 서울 강북1차 상권(중구ㆍ종로구ㆍ동대문구ㆍ성북구ㆍ성동구, 140만명)과 2차 상권(마포구ㆍ서대문구ㆍ은평구ㆍ용산구ㆍ중랑구..."
1241,2016.03.05.,1% 초저금리시대! ‘착한 분양가’ 아파트 인기,"또한 100미터 이내에 서울과 구리, 평내 방향 버스정류소가 다수 위치하고 있어 대중교통이 매우 편리하다.... 호평상권을 가깝게 이용할 수 있다. 아울러 이안은 각종 자전거 도로와 산책도로, 문령산, 홍유릉..."
1242,2016.03.04.,얇은 지갑을 위한 미식…푸드코트 전성시대,"그뿐 아니라 ‘미타니야’, ‘부민옥’ 등 서울의 명성 자자한 맛집들까지 진용을 갖췄다. 경리단길 '스핀들... 그는 연남동 상권 발달을 촉발시킨 ‘툭툭 누들타이’로 시작해 현재는 쏘이연남, ‘오파스’ 등 여러 개..."
1243,2016.03.15.,카드사도 인공지능 '붐'…신한·BC 서비스 구축 '총력',"서울 광화문에 위치한 직장에 다니는 B씨. 출근시간 카페에 들러 커피를 결제하고, 퇴근 후 약속도... 222 BC카드는 가맹점 매출 행태와 상권∙업종 정보 등 빅데이터 분석을 토대로 가맹점 폐업 전에 이상 징후를..."
1244,2016.03.08.,"[재테크 인터뷰]""2016년 강남 재건축 분양권에 투자해라""","8일 서울 중구 이데일리 본사에서 만난 김 씨는 “이미 평당 5000만원 선을 넘은 서초구 재건축은 올해도... 평당 4000만원인 서초구 재건축 단지의 가격은 교통, 교육, 상권, 환경 등 기존 아파트가 제공할 수 없는..."
1245,2016.03.18.,판교 테크노밸리 5배 마곡지구 트리플상권 '퀸즈파크' 상가 분양,서울의 대규모 개발지 마곡지구에 들어서는 상업업무 복합시설 '마곡퀸즈파크나인' 조감도 서울의 대규모... 5호선 발산역에 인접할 뿐만 아니라 근처에 9호선 공항철도가 들어설 예정인 트리플상권에 자리를 잡는다.
1246,2016.03.16.,놀부옛날통닭이 신메뉴 출시 기념 현장사업설명회 통해 찾아간다,서울시 강동구 명일동에 위치한 놀부옛날통닭 매장은 동네 상권임에도 불구하고 오픈 한달 만에 5천여 명이 방문하고 예상을 웃도는 일 평균 매출을 기록한 바 있다. 바로 대한민국 대표 외식전문기업 놀부가 고심한 끝에...
1247,2016.03.17.,[CEO 라이벌 매치] '네가 하면 나도 한다' 유통 공룡들의 경쟁,"■ CEO 랭킹쇼 '블루베리 시즌3' ◇ 5위 - 롯데 신동빈 회장 vs 신세계 정용진 부회장 신세계 정용진 부회장이 서울 시내면세점 입성을 확정 지으며 명동 상권을 두고 롯데 신동빈 회장과의 경쟁하게 됐습니다. 이후, 두..."
1248,2016.03.06.,"아이팡코리아-인천투자협업협회, '소상공인 상권 활성화' 상생협약 체결",= ㈜아이팡코리아(대표이사 심재붕와 인천투자협업협회(이사장 전준호)는 최근 서울 강남구 아이팡코리아 본사에서 소상공인 상권 활성화를 위한 나눔 상생 협약을 체결했다고 6일 밝혔다. 이번 협약에 따라 양사는...
1249,2016.03.04.,"수원시, 글로벌 명품시장의 주인공","이후 서류심사, 현장평가, 외국인 평가를 거쳐 수원 남문시장, 서울 평화시장, 부산 자갈치시장, 안동 구시장... 개발, 상권 디자인과 ICT 융합 기반 스마트마켓 구현, 원스톱 지원센터 등 글로벌 수준의 마켓투어 등 다양한..."
1250,2016.03.02.,"광주신세계, 신규고객 유치 적극 나서",광주신세계는 최신 트렌드를 반영한 브랜드를 개점이래 지속적으로 선보이는 등 서울 및 수도권 등지의 주요 상권에만 편중되어 있던 트렌디한 유통채널을 호남권으로 다각화 했다. 이는 지역 내 라이프스타일 트렌드를...
1251,2016.03.01.,"브랜드 리뉴얼 마친 휠라(FILA), 유통망 확대로 애슬레저 시장 ‘정조준’","휠라 오리지날레(FILA ORIGINALE)와 휠라 언더웨어(FILA UNDERWEAR) 두 개의 신규 브랜드도 선보이는데 이어, 서울을 비롯해 부산, 광주 등 전국 주요 도시 중심 상권에 대형 규모의 메가샵(Mega Shop)*을 잇달아 오픈하는 등..."
1252,2016.03.10.,"[실시간 거래]가산디지털단지역 주변 아파트형 공장, 장점 다양해 선호도 높아","강남이나 여의도 등 서울의 주요 업무지구의 오피스에 비해서도 공실률이 적은 편으로, 가산동 오피스의... 주변으로 상권이 잘 형성돼 있으며 건물 뒤쪽으로는 먹거리 촌이 있고, 앞쪽은 지하철과 버스 등..."
1253,2016.03.16.,"IS동서, 청라 센트럴 에일린의 뜰…혁신평면 공간설계","청라국제도시역을 통해 서울까지 30여 분이면 도달 가능해 눈길을 끈다. &lt;출처 : IS동서&gt; 최근 분양하는... 또한 홈플러스와 롯데마트를 비롯해 주민센터, 수변상권 등이 가까이 있으며 1000개 병상 규모의 국제성모병원도..."
1254,2016.03.11.,"현대시티아울렛, 동대문 최초아울렛 첫해 1천620억, 내년 2천억 목표","이 곳은 동대문 상권 내 쇼핑몰 중 가장 크며 영업면적이 3만7,663㎡(1만1,413평), 지하 6층~지상 9층 규모에 총... 가든파이브(서울 송파구)에 도심형 아울렛을 연이어 오픈할 계획이다. 이렇게 되면 현대백화점이..."
1255,2016.03.11.,본사 노하우 전달… 36회 프랜차이즈산업박람회 개최,"10일 서울 학여울역 SETEC 전관에서 개최됐다. 이번 박람회는 올바른 창업정보를 제공하고 실패 없는 안전한... 본도시락은 강점과 가맹 절차, 본사 지원 프로그램, 상권 분석 등 세심한 맞춤 컨설팅을 진행하고 많은..."
1256,2016.03.17.,새누리당 달서구갑 일부당원 송종호 지지선언,지역 상권을 활성화할 수 있는 적임자라며 지지 이유를 밝혔다고 전했다. 송 후보는 성서산단을 서울의 구로공단과 같이 디지털단지로 바꾸고 청년일자리를 창출해 성서를 일터와 쉼터가 공존하는 최적의 정주여건을...
1257,2016.03.09.,"인천시, 지리정보 플랫폼 구축 '앙꼬없는 찐빵'",경기도는 지난해 빅데이터 관련 사업에 예산 52억3천만원을 투입해 '소상공인 주요 업종 상권 분석' '어린이 등·하굣길 안전실태 분석' 등 11개 사업을 추진했다. 서울시도 빅데이터 관련 사업에 올해 38억원을 투입할...
1258,2016.03.03.,[한경매물마당] 강남역 역세권 근생 빌딩 등 9건,"(02)598-9799 서초 지앤지 정성희 ◆서울시 서초구 대로변 근생 빌딩=코너 대지 290㎡, 연면적 1000㎡의 6층 건물. 상권 활발하고 1층 점포 3개 프랜차이즈 입점. 보증금 4억원, 월 1500만원에 임대 중. 임대수익용..."
1259,2016.03.01.,오늘의 주요뉴스,◀ 앵커 ▶ 서울 유명 지하상가 인근에 횡단보도가 없는 도로가 많습니다. 행인들이 지하로 안다녀 상권이 사라질 것을 우려한 상인들의 반발 때문입니다. 횡단보도 설치를 둘러싼 속사정을 알아봤습니다. ◀ 앵커...
1260,2016.03.16.,[르포]中 수입화장품 규제에도…상하이·베이징은 'K뷰티 집합소',"이곳이 상하이인지, 서울인지 헷갈릴 정도다. 아모레퍼시픽 중국법인 직원 왕이징씨는 ""상하이, 베이징 등 대도시 핵심상권 대형 복합쇼핑몰에 출점하는 원칙을 고수하고 있다""며 ""부동산 업계에선 이니스프리 매장이..."
1261,2016.03.17.,"싱가폴 HLS, 부산광복점 등 롯데百 매장 오픈","현재 싱가포르, 홍콩, 대만 등 총 11개국 27개의 매장을 운영 중인 HLS는 한국의 주요 상권으로 손꼽히는... 한편 HLS는 지난 2012년 생산, 디자인, 섬유에서 모두 강점을 갖고 있는 한국의 서울에서 영감을 받아 출범한..."
1262,2016.03.07.,‘테헤란로 오피스’ 옛말… 대세는 수도권 지식산업센터,[서울신문] 서울 강남구 역삼동에 위치한 포스코A&amp;C는 지난해 4월 인천 송도국제도시로 이전했다. 같은 해... 및 상권 시장이 흔들리기 시작했다”며 “삼성 협력업체들도 이전을 앞두고 있어 3월 중순 이후...
1263,2016.03.02.,[분양 하이라이트] 와이즈파크 홍대점,"홍대입구역 8번 출구와 인접해 홍대 인근 지역에서도 역세권 상권으로 꼽힌다. 홍대입구역에는 서울지하철 2호선과 함께 공항철도, 경의선 등이 잇따라 개통돼 수도권 인구와 외국인 관광객의 접근성 높아졌다...."
1264,2016.03.03.,[기고] 경제민주화의 반성적 고찰,"그런데 어느 순간부터 골목상권을 선점했다는 이유만으로 기존상인의 기득권이 보호되기 시작했다.... 최영홍 고려대 법학전문대학원 교수·한국유통법학회장 ▶ 돈이 보이는 뉴스 '서울경제 페이스북' ""좋아요 클릭클릭..."
1265,2016.03.07.,"K-게스트하우스, 게스트하우스 창업 프리미엄 모델 제시",내세우며 서울을 넘어 전국으로 가맹지점 확대에 집중한다고 밝혔다. K-게스트하우스 명동 4호점... 아울러 K-게스트하우스는 △Location Good(상권전략) △Management Good(운영전략) △Marketing Good(마케팅전략) △Score Good...
1266,2016.03.06.,‘지하철역+대형상권’ 우량 역세권 분양단지 어디?,이대및 연대 상권과 연결되는 신촌상권과 가깝다. 대림산업은 서울 동작구 흑석동 흑석7구역에 짓는 흑석7구역 e편한세상을 5월 분양할 예정이다. 1073가구 중 59~84㎡ 403가구를 일반분양이다. 일부에선 한강을 조망할...
1267,2016.03.09.,"[면세 산업, 퀀텀 점프하자③]쇼핑+관광+한류, 면세점 '삼중창'","HDC신라, 한화갤러리아타임월드, SM면세점(하나투어)을 서울 시내 면세점의 신규 사업자로 선정해 외국인... 특수 상권과 연계하는 테마 관광상품을 마련중이다. 만료 예정인 면세점 특허권을 지난해 획득한 신세계와..."
1268,2016.03.08.,"원희목 새누리 예비후보, 강남을 출마…""증세없는 따뜻한 복지 실현할 것""","서울시 강남구을에 출사표를 던진 원희목 새누리당 예비후보는 8일 보건ㆍ사회ㆍ복지분야 8가지 실천... 및 상권활성화 재단 설립 등이다. 지역 공약으로는 개포동ㆍ삼성병원앞(소금재)ㆍ세곡지구 전철역 유치, 학교 및..."
1269,2016.03.10.,시내 50m·1시간 단위 유동인구 통계…창업·정책 성공 높여,"- SKT 모바일 빅데이터 기반- 연령별·성별·빈도 색깔로 표시- 지역별 상권·타깃 분석부터 - 버스 노선·CCTV... 시 관계자는 ""서울시가 운영하는 지능형 도시정보시스템은 서울 1만 개 지점에 조사원이 직접 나가..."
1270,2016.03.21.,"[ 우리동네 유기농 할인점 - 새농푸드마켓] 새농푸드마켓, 가락몰로 새단장 이...",이번 가락몰 이전으로 접근성은 물론 더욱 쾌적해진 환경과 주변 상권으로의 편리성까지 모두 갖춰 온... 새농 서울송파가락점 02-3401-4900 www.saenong.com Copyright ⓒThe Naeil News. All rights reserved. [저작권자ⓒ (주)내일신문....
1271,2016.03.07.,지하철역+대형상권…우량 역세권에 주목,이대 및 연대 상권과 연결되는 신촌상권과 가깝다. 롯데건설은 오는 11월 서울 동대문구 전농동 청량리4구역에 롯데캐슬을 분양할 예정이다. 최고 65층에 달하는 주상복합 아파트 4개동을 짓는다. 아파트 옆에 외국인...
1272,2016.03.03.,커피 프랜차이즈 창업 돌풍 속 국내브랜드는?,"부산 금정구에 있는 ㈜더 벤티코리아와 영등포구 문래동에 있는 서울센터에서는 예비 창업주들을 위해 커피 프랜차이즈 창업희망지역, 운영 형태에 따른 상권선정, 예산규모 등의 선정을 지원하고 있다. 상권분석 및..."
1273,2016.03.18.,"싱가포르 여성복 에이치엘에스, 유통 확보 박차","현재 싱가포르, 홍콩, 대만 등 총 11개국 27개의 매장을 운영 중으로 한국의 주요 상권으로 손꼽히는 지역 입점을 통해 공격적인 행보를 이어간다는 전략이다. ‘에이치엘에스’는 서울에서 영감을 받아 지난 2012년..."
1274,2016.03.02.,아파트 뺨치는 '미사 푸르지오 시티' 오피스텔,향후 서울 강남권 접근성이 한결 나아질 것으로 예상된다. 미사강변도시 인근에 고덕상업업무복합지구ㆍ엔지니어링복합단지ㆍ강동첨단업무단지 등 현재 개발중인 업무지구ㆍ상권이 48만㎡에 달한다. 견본주택(1800...
1275,2016.03.11.,"식품업계, 新먹거리 '카페'에 꽂히다",지역상권이 더욱 발전할 것으로 예상된다. 빙그레는 이러한 지역적 장점을 바탕으로 옐로우 카페를 국내외 소비자들의 바나나맛우유 브랜드 체험공간으로 꾸며나갈 계획이다. 해태제과는 지난해 12월 서울시...
1276,2016.03.15.,광교의 중심상권과 호수공원을 동시에 품다!,"힐 [내일신문] [광교신도시 ‘광교 힐스테이트 레이크’ 상가] 평일 근린·주말 레저상권으로 풍부한 배후... 용인서울고속도로(광교 상현IC), 영동고속도로 (동수원IC), 경부고속도로 등의 우수한 도로교통망을 자랑하고..."
1277,2016.03.07.,무대 말고 객석서만 춤 춰라? 이상한 클럽 규제,한국일보 자료사진 서울 마포구 서교동에 위치한 홍대클럽거리는 3월부터 슬슬 성수기에 돌입한다. 인근... 홍대 상권은 당장 발등에 불이 떨어졌다. 해당 구역이 주거지역이라 일반음식점으로 영업해야 하는 홍대 앞...
1278,2016.03.09.,홍대거리 한 집 건너 사주·타로·궁합집… ‘지푸라기’ 찾는 젊은이들 현혹,서울 마포구 서교동 ‘홍대거리’에 늘어선 사주·타로카페들. 100여m 구간에 무려 20여곳이 성업 중이다.... “타로 카페를 운영하고 싶어 가게를 찾고 있다”는 기자의 말에 “이곳 상권이 워낙 세서 5평(15㎡) 정도...
1279,2016.03.15.,"광명역세권, 수도권 서남부지역 중심 상권으로 급부상","특히 KTX광명역에 생기는 도심공항터미널은 서울역, 삼성동무역센터 도심공항터미널처럼 상권을더욱 활성화시킬 전망이다. 한국도심공항에 따르면 삼성동 도심공항터미널의 연간 이용객은 해마다 꾸준히 늘어 작년..."
1280,2016.03.09.,남양주 금곡역 앞 700만원대 아파트 탄생,"이안 남양주 금곡역 획기적 가격으로 바람몰이 서울 접근성 좋은 탁월한 교통인프라 갖춰 다산, 별내신도시... 호평상권을 가깝게 이용할 수 있다. 이안 남양주 금곡역 아파트는 자전거도로 및 산책로, 문령산, 홍유릉..."
1281,2016.03.02.,봄 창업시즌 활짝.. 창업박람회 열기 후끈,지난해 1월 서울 학여울역 SETEC에서 열린 창업박람회장이 관람객들로 북적대고 있다. 사진=김범석 기자... 골목상권과 소상공인을 살릴 수 있는 시스템을 갖춘 프랜차이즈산업인들이 한자리에 모이는 국내 최대규모...
1282,2016.03.13.,"[성공창업, 상권을 보라] 시흥 배곧신도시 상권","서울대학교, 병원 조성 등 외부효과와 상권에 전반적인 콘셉트, 신규 브랜드 유치 등으로 인구유입을 기대할 수 있다. 임대인 입장에서는 성장하는 브랜드를 유치하고 창업자의 경우 상권을 대표할 수 있는 특색 있는..."
1283,2016.03.04.,"SK D&D, 새 오피스텔 브랜드 'BIEL' 선봬","이를 서울 강남구에서 이달 분양할 '강남역 BIEL 106' 오피스텔에 첫 적용할 계획이라고 4일 밝혔다. SK D... 또 강남역 상권, 신세계백화점, 센트럴시티, 양재 코스트코, 세브란스 병원 등이 멀지 않은 등..."
1284,2016.03.12.,"현대차그룹 부지, 본격 개발절차 착수","[ M이코노미 최종윤 기자 ] 현대차 그룹이 2014년 마지막 남은 강남의 노른자기 땅으로 남아있던 서울 삼성동... 판매시설은 과도한 상업적 색채 및 주변 상권과의 경쟁을 지양하고, GBC를 매개로 주변상권이 동반 성장해..."
1285,2016.03.15.,[4·13 총선 인터뷰]지상욱 중구·성동구(을) 새누리 예비후보,"전통산업의 쇠락과 상권의 이동, 교통과 교육 등 각종 인프라의 미비로 인해 구도심은 낙후되고 공동화현상마저 발생하고 있다. 600년 수도 서울의 중심인 중구 역시 수 십년째 뒷걸음질하고 있다. 특히 남산 고도제한, 각종..."
1286,2016.03.03.,수원 남문시장 '글로벌 명품시장' 주인공으로 우뚝,"이후 서류심사, 현장평가, 외국인 평가를 거쳐 수원 남문시장, 서울 평화시장, 부산 자갈치시장, 안동... 개발, 상권 디자인과 ICT 융합 기반 스마트마켓 구현, 원스톱 지원센터 등 글로벌 수준의 마켓투어 등 다양한..."
1287,2016.03.15.,광교의 중심상권과 호수공원을 동시에 품다!,"광교힐 [내일신문] [교신도시 ‘광교 힐스테이트 레이크’ 상가] 평일 근린·주말 레저상권으로 풍부한 배후... 용인서울고속도로(광교 상현IC), 영동고속도로 (동수원IC), 경부고속도로 등의 우수한 도로교통망을..."
1288,2016.03.14.,"보성산업㈜, '다산신도시 한양수자인(B8블록) 단지 내 상가' 17일 입찰공고 진...","또한, 신도시 내에서 분양될 경우 입주가 본격적으로 시작되면 상권 활성화가 가장 쉬운 단지 내 상가에... 북부간선도로와 강변북로 진입이 용이하고 서울외곽순환도로 남양주나들목도 가깝다. 차로 서울 광화문까지 약..."
1289,2016.03.21.,"[전주 심각한 '주·정차대란' 해법 없나 (하) 대책] ""선진 주차문화 정책·교...","지난 2001년 서울시도 차고지 증명제를 추진했지만 자동차업계와 자동차를 생계수단으로 하는 저소득층이... 영세상권, 교통취약계층, 불법 주·정차 상습지역 등을 상세히 조사해 절대 단속구간을 설정해야 한다""고..."
1290,2016.03.05.,"'골목길의 맛' 연트럴파크, 그곳에도 어김없이…",같은 기간 서울 전체 상권 평균 임대료 상승률 7.15%를 크게 웃도는 수준이다. 특히 연남동의 임대료 상승 속도는 홍대 상권 팽창 영향으로 젠트리피케이션(Gentrification) 우려가 심각한 상수동 상권(9.3%)을 상회했다....
1291,2016.03.18.,[클릭! 전국은 지금] '공사현장식당'ㆍ출퇴근버스 운영중단 촉구 外,이유는 높은 임대료와 상권 분산으로 인해 체감경기가 나빠지고 있기 때문이라고 합니다. 서울-세종 간 공무원 출퇴근 버스 운행에 대한 지적도 이어지고 있습니다. 그동안 아파트 특별분양 혜택이 주어지는 중앙부처...
1292,2016.03.02.,신세계푸드 올반 부산 '출사표'…센텀시티점에 개점,(서울=연합인포맥스) 정선미 기자= 신세계푸드의 한식브랜드인 올반이 부산 최고 상권인 해운대구센텀시티에 신규 점포를 내고 부산 고객들의 입맛 잡기에 나선다. 올반은 국내 최대 백화점인 부산 신세계...
1293,2016.03.10.,"이화여대, '이화 스타트업 52번가' 오픈…학생창업팀 6개팀 입점",최근 서울지역 대학 상권 중 최하위 성장률을 기록한 이화여대 정문 옆 골목 내 점포를 직접 임대해 창업을 희망하는 학생들에게 공간을 제공하는 창업지원 프로젝트다. 이화여대 도로명 주소가 '이화여대길 52'인 점에서...
1294,2016.03.14.,[상권 18] 대형 키즈카페 틈에서 '월 매출 1000만원',"그 3년 사이 수많은 키즈카페가 킨텍스 상권에 도전장을 내밀었다 문을 닫고 사라지길 반복했다. 대형... 윤 대표는 “일산뿐만 아니라 파주'김포 지역, 최근에는 서울 지역에서 오는 손님도 많다”며 “인터넷 커뮤니티를..."
1295,2016.03.09.,아직도 상가 부족해 불편한 세종시…‘세종 강남’ 가보니 투자 열기 고조,등이 있는 복합커뮤니티센터가 바로 앞에 있고 먹자 상권으로 들어가는 초입이면서 대로변에 있어 투자자들의 관심이 높다”면서 “지역경기 활성화로 이어지기를 기대한다”고 말했다. - 저작권자 ⓒ 서울신문사 -
1296,2016.03.10.,"‘단지 내 상가’, 인기 끄는 이유 있었네.. 주목할 곳은?","초기 상권 활성화 쉽고 웃돈도 기대해볼 만 - ‘다산신도시 한양수자인 단지 내 상가’, 다산신도시 내 상권... 북부간선도로와 강변북로 진입이 용이하고 서울외곽순환도로 남양주나들목도 가깝다. 차로 서울..."
1297,2016.03.03.,"미래에셋증권, ISA·해외주식투자펀드 출시 전국 가두캠페인","미래에셋증권 변재상 사장이 3일 서울 을지로입구역에서 출근길 고객에게 'ISA, 해외주식투자전용펀드 출시... 이번 행사에서 미래에셋증권 본사 및 전국 영업점 직원들은 출근 시간대 전국 주요 상권과..."
1298,2016.03.10.,"도상현 위비스 사장, 골프웨어 진출",도 사장은 골프 의류 부문에 대한 라이선스권 획득했으며 양사는 오는 11일 서울 대치동 볼빅 본사에서... 도 사장은 「볼빅」을 중가 골프웨어에 포지셔닝하며 가두상권을 중심으로 유통망을 풀어나갈 계획이다.
1299,2016.03.01.,사람 몰리는 수익형부동산 주목받는 이유,일산 웨스턴돔 앞 ‘웨스턴853’ 상가 오피스 분양 [스포츠서울 왕진오기자] 2016년 2월부터 강화된... 풍부한 배후수요와 안정적인 임대수익을 노리는 투자자들이 점차 늘면서 초역세권과 테마가 있는 상권 그리고...
1300,2016.03.09.,"SK證 ""면세사업 특허기간 연장…제로섬 게임 될 것""","서울 시내면세점은 과거 롯데와 신라의 양강체제였으나 신세계, 한화, 갤러리아, 두산 및 HDC 신라의 진입으로 경쟁강도가 한층 강화됐다. 특히 명동과 동대문 상권을 둘러싼 경쟁 수준은 지리적으로 멀지 않아 업체간..."
1301,2016.03.11.,"[포토] 현대百, 동대문 최대 규모 '현대시티아울렛' 오픈",/이명근 기자 qwe123@ 현대백화점이 서울 도심의 핵심 상권인 동대문에 신개념 '도심형 아울렛'을 개장했다. 현대백화점은 11일 서울 중구 을지로에 도심형 아울렛 2호점인 '현대시티아울렛 동대문점'을 개점하고...
