,date,title,contents
551,2016.05.24.,"이마트, O2O서비스 본격화… ""바코드 스캔 한번에 집까지 배송""",성수점을 우선적으로 시범 실시하며 해당 범위는 성수점 핵심상권인 성수동에서 논현동에 이르는 서울 서남부 권역으로 설정했다. '비콘 서비스'는 고객의 스마트폰 블루투스와 연동 고객의 매장 위치에 따라 해당...
552,2016.05.25.,12개 필지 중 1곳만 응찰..대우조선 마곡부지 매각 난항,- 부지면적 크고 40% 연구시설 제한 - 매각 장기화땐 상권·집값 악영향 서울 강서구 마곡지구 내 대우조선해양 부지가 새 주인을 찾지 못하면서 마곡 산업단지 조성 사업이 지연될 소지가 커지고 있다. 인근...
553,2016.05.25.,"한밭대, ‘창업 아이디어 설계캠프’ 운영","특히 참가자들은 캠프 기간 중 서울 명동 소재 현대시장과 남대문 재래시장을 직접 방문해 주변 인프라와 상권을 조사하고 각 시장별 특성과 수요조사를 분석, 창업전략을 세우는 등의 시간을 갖게 될 예정이다. 또..."
554,2016.05.25.,한샘 '한샘플래그샵 상봉점' 오픈,ⓒ 한샘 [프라임경제] 종합 홈 인테리어 전문기업 ㈜한샘(대표이사 최양하)이 26일 서울시 중랑구 상봉동에... 상봉점은 지난 3월 오픈한 수원 광교점에 이은 전국 아홉 번째 플래그샵이며 중랑구 및 강북 상권 일대를...
555,2016.05.25.,종로 땅속에 신세계… 청진동 지하보행로 뚫렸다,서울 종로구 청진동 일대 현황도. 서울 종로구 청진동 일대 대형 빌딩과 지하철역 등을 잇는 지하보도가... 이 사업은 노후된 도시기능을 회복하고 상권을 활성화시키기 위한 '청진구역 도시환경정비사업'의 일환으로...
556,2016.05.26.,광화문역~종각역 지하로 연결한다,"2016052605_광화문역-종각역 [내일신문] 광화문역~종로구청 개통 사업비전액 민간이 부담 서울 종로구... 것""이라며 ""지하 상권도 만들어지고, 빌딩들의 재산 가치를 높여 지역 경제도 활성화하는기회""라고 설명했다...."
557,2016.05.23.,"[분양]부영, 마산월영·동탄·향남에 대규모 분양","【서울=뉴시스】 경남 마산월영 부영아파트 조감도. = 부영주택이 경남 창원과 경기 동탄·향남... 남부시외버스터미널, 합포도서관, 메가박스, 댓거리상권 등 주민 편의시설이 인접해 있다. 청약은 23일..."
558,2016.05.25.,"시민단체, ""서민생존권··안전위협""…유통재벌·김앤장 비판","경제민주화실현전국네트워크, 참여연대 등은 25일 오후 서울 중구 소공동 롯데그룹 본사 앞에서 기자회견을 열어 대형유통업체의 사회적 책임을 촉구했다. 이들은 ""유통업체가 골목상권, 노동권에 이어 시민안전까지..."
559,2016.05.29.,"""오프라인매장 경쟁력 살리자"" 대형마트, 근거리 배달 재개","최근 서비스를 시작한 서울 은평점과 신도림점은 구매 금액 7만원, 일일 선착순 30~40건 등 제한적 기준을... 대형마트들은 골목상권 침해 논란이 일었던 2013~2014년 배송 서비스를 중단했다. 하지만 최근 온·오프라인..."
560,2016.05.29.,"""오프라인매장 경쟁력 살리자"" 대형마트, 근거리 배달 재개","최근 서비스를 시작한 서울 은평점과 신도림점은 구매 금액 7만원, 일일 선착순 30~40건 등 제한적 기준을... 대형마트들은 골목상권 침해 논란이 일었던 2013~2014년 배송 서비스를 중단했다. 하지만 최근 온·오프라인..."
561,2016.05.24.,"동작구, 장년층 인생 재설계 '동작50＋센터' 수강생 모집","【서울=뉴시스】 동작50＋센터 '아버지 요리교실' 모습. 2016.05.24. (사진 = 동작구 제공) photo@newsis.com... 창업을 준비하는시민은 재무·세무, 상권·아이템 분석 등 교육과정에 참여하면 된다. 문화여가..."
562,2016.05.24.,"이마트, 신규 O2O 서비스 시작",성수점을 우선적으로 시범 실시하며 해당 범위는 성수점 핵심상권인 성수동에서 논현동에 이르는 서울 서남부 권역으로 설정했다. 또 비콘 서비스는 고객의 스마트폰 블루투스와 연동 고객의 매장 위치에 따라 해당...
563,2016.05.28.,[브리핑] 반기문 유엔 사무총장 대권도전 시사,""" 소설 '채식주의자(The Vegetarian)'로 맨부커 인터내셔널상을 수상한 소설가 한강(46·사진)이 지난 24일 서울... ◆'백종원가게' 더본코리아, 규제 그늘서 또 벗어났다 최근 몇 년 사이 급성장하며 '골목상권' 침해 논란이..."
564,2016.05.27.,"정용진, 신세계 편의점 '위드미' 언제 본궤도에 올리나",소상권 내 실속형 구매 고객을 대상으로 노브랜드와 같은 가성비 높은 행사상품을 준비하는 데 주력할 것... 위드미는 SM엔터테인먼트 서울 삼성동 신사옥에 있는 SM아티스트 관련 기념품 매장(SUM마켓)에 숍인숍 형태로...
565,2016.05.27.,"스타벅스, 서촌에 새로 못 들어간다",[서울신문] 전통 색채 보호 차원… 편의점은 허용 이르면 오는 6월 말부터 서울 경복궁 서쪽인 서촌에... 동네 상권 보호와 젠트리피케이션 현상을 방지하기 위해 자하문로와 사직로변을 제외한 전 구역에서 편의점을...
566,2016.05.26.,종각~광화문 지하보행로 개통…인근 4개 대형 빌딩과 연결,"지하보행로는 청진1지구(KT), 2·3지구(대림), 5지구(라이나생명), 8지구(타워8), 12~16지구(그랑서울) 등 5개 구역이다. 이 사업은 노후 된 도시기능 회복과 상권 활성화를 위한 ‘청진구역 도시환경정비사업’의 일환으로..."
567,2016.05.27.,[클릭! 한경] 파리바게뜨 상권불패 비밀 '봉인 해제',7만여명 타임라인 올라 [ 추가영 기자 ] 한국경제신문이 지난 25일 보도한 &lt;폐점률 0%대파리바게뜨 ‘상권불... 1981년 서울 광화문 교보빌딩 1층에 서점을 세운 배경을 소개했다. 네티즌 이모씨는 “교보문고 스토리가...
568,2016.05.24.,초보자에 성공창업 비법 알려준다,조길형 영등포구청장 이에 구는 서울신용보증재단과 손을 잡고 창업 아카데미를 개최해 이런 예비... 마케팅 ▲골목상권 분석서비스 활용과 맞춤형 상권 검색 ▲창업자금 보증지원제도 및 신용관리 등 실제 창업과...
569,2016.05.26.,수익형 부동산 '전성 시대'…어디에 투자할까,"접해 서울 도심권 내에서 우수한 교통요건을 갖췄다. 또한 대기업, 은행 본점, 언론사 등이 인접해 있고, 명동·충무로·동대문·광화문 등 업무지구 및 중심상권과 CJ그룹·동국대·숭의여대·중구청·중부경찰서 등도..."
570,2016.05.27.,[클릭! 한경] 파리바게뜨 상권불패 비밀 '봉인 해제',7만여명 타임라인 올라 [ 추가영 기자 ] 한국경제신문이 지난 25일 보도한 &lt;폐점률 0%대파리바게뜨 ‘상권불... 1981년 서울 광화문 교보빌딩 1층에 서점을 세운 배경을 소개했다. 네티즌 이모씨는 “교보문고 스토리가...
571,2016.05.24.,초보자에 성공창업 비법 알려준다,조길형 영등포구청장 이에 구는 서울신용보증재단과 손을 잡고 창업 아카데미를 개최해 이런 예비... 마케팅 ▲골목상권 분석서비스 활용과 맞춤형 상권 검색 ▲창업자금 보증지원제도 및 신용관리 등 실제 창업과...
572,2016.05.26.,수익형 부동산 '전성 시대'…어디에 투자할까,"접해 서울 도심권 내에서 우수한 교통요건을 갖췄다. 또한 대기업, 은행 본점, 언론사 등이 인접해 있고, 명동·충무로·동대문·광화문 등 업무지구 및 중심상권과 CJ그룹·동국대·숭의여대·중구청·중부경찰서 등도..."
573,2016.05.25.,[현장 행정] 건축가의 ‘촉’… 청진동 지하를 뚫었다,[서울신문] ‘도심 속 고층건물을 지하로 연결하면 건물 가치가 높아지지 않을까.’ 건축가 출신 김영종... 기다란 지하보도를 만들어 각 빌딩을 한 건물처럼 이어주면 유동인구가 늘어 건물 내부와 주변 상권이 활기를 띨...
574,2016.05.24.,넓고 환해진 구로시장…현대화 사업 완료,대형마트의 등장과 시설 노후화로 활기를 잃었던 서울 구로시장이 넓어지고 환해졌다. 구로구(구청장 이성)는 전통시장 경쟁력 강화와 상권 활성화를 위해 낡고 위험한 시설물을 개선하는 구로시장 현대화 사업을...
575,2016.05.30.,"신용보증재단중앙회, ‘소상공인 창업성공 지원을 위한 빅데이터 경진대회’ ...","중소기업청과 서울신용보증재단 공동으로 오는 8월 1일~15월까지 ‘소상공인 창업성공 지원을 위한... 및 상권등급정보 등이며, 이외의 데이터는 참가자가 매시업(Mash up)해 모형을 검증한다. 김순철 중앙회장은..."
576,2016.05.22.,"'범 삼성가' 면세점 격돌…정유경, 이부진 아성 도전","◇ 업계 2위 신라면세점, 수성 '비상' 신세계면세점은 지난해 '면세점 대전'에서 서울 시내면세점 사업권을... 신세계 명동점은 업계 1위인 롯데면세점 소공점과 같은 상권에 있어 롯데와 신세계의 '명동 대전'이 주목받고..."
577,2016.05.25.,"옛 청진동 골목, 땅속에서 재탄생...25일 개통","D-타워, Kt 등 서울 종로구 청진동에 새로 들어선 대형 빌딩과 지하철역 등이 땅속에서 연결되는 지하보도가... 그러면서 김구청장은 ""지하 상권도 만들어지고 살아나 건물주들은 재산 가치를 높여 지역 경제가 활성화될..."
578,2016.05.25.,[분양현장 NOW] 미사강변도시 e편한세상 시티 미사,미사강변도시 중심상권에 오피스텔과 근린생활시설(상가)이 들어선다. 특히 지하철 5호선 미사역(2018년... e편한세상 시티 미사 견본주택은 서울시 강동구 성내로44(성내동 549)에 위치한다. 입주는 2019년 5월 예정이다. [
579,2016.05.26.,종로 새 르네상스 시대…청진동 대형빌딩·지하철 지하보도로 연결,종각역-그랑서울-타워8빌딩을 지하로 연결하는 '청진구역 지하보도 설치 및 지상보도 개선사업'을 마쳤다고 밝혔다. 이번 사업에는 총 586억원이 투입됐다. 이번 개선사업은 노후화된 도시기능을 회복하고 상권을...
580,2016.05.25.,"한샘, 강북 최대 규모 '한샘플래그샵 상봉점' 오픈",한샘은 26일 서울시 중랑구 상봉동에 전시면적 4033㎡(1220평)의 강북 최대 홈 인테리어 유통매장... 상봉점은 지난 3월 오픈한 수원 광교점에 이은 전국 9번째 플래그샵이며 중랑구 및 강북 상권 일대를 아우르는 매장이다....
581,2016.05.26.,"종로구, '청진구역 지하보도 설치 및 지상보도 개선사업' 완료.개통","이번 사업은 노후화된 도시기능을 회복하고 상권을 활성화하기 위해 ‘청진구역 도시환경정비사업’의 일환으로 2011년부터 추진됐다. *청진1지구(kt), 2?3지구(대림), 5지구(라이나생명), 8지구(타워8), 12~16지구(그랑서울)..."
582,2016.05.24.,자투리 면적? 주력평면으로 부상하는 틈새평면!,"부동산114 시세 자료를 분석해 보면 서울 광진구 군자동의 ‘광진동양파라곤’(2007년 11월 입주)... 힐스테이트 동탄은 SRT·GTX 복합환승역인 동탄역(예정) 및 중심상권, 주요 업무지역 등으로의 접근성도 좋다. 올해..."
583,2016.05.25.,"재벌비판 시민단체 ""옥시 사태, 유통사도 엄벌해야""","골목상권에 진출해 중소상인의 생존권을 파괴하는 행위도 중단돼야 한다""고 촉구했다. 참석자들은 서울 종로구 내자동 '법률사무소 김앤장' 본사 앞으로 자리를 옮겨 기자회견을 열고 '김앤장'이 옥시 측 법률대리를 맡은..."
584,2016.05.27.,돈 버는 부동산 리모델링 낡은 건물 새단장하면 가치 UP UP,종잣돈이 넉넉하지 않다면 서울이 아닌 수도권으로 눈길을 돌려봐도 좋다. 동네 상권 중 입지가 괜찮은 곳도 10억원대에서 얼마든지 좋은 매물을 구입할 수 있다. 다만 잘 모르는 지역일수록 중요한 것은 바로 시장 분석....
585,2016.05.26.,"도심 한복판 총 380가구 단지 내 1층 상가, 오피스텔 잔여분 분양","가까워 서울 도심권 내 우수한 교통요건을 갖췄다. 또한, 대기업, 은행 본점, 언론사 등이 밀집돼 있고, 명동·충무로·동대문·광화문 등 업무지구 및 중심상권과 CJ 본사, 동국대, 숭의여대, 중구청, 중부경찰서 등도..."
586,2016.05.30.,"[위기가 기회다]아모레퍼시픽, ‘에뛰드하우스’ 브랜드 리뉴얼, ‘K뷰티’ 해...","서울과 부산 등 핵심 상권에 플래그십 스토어를 지속적으로 운영하고, 플래그십 스토어에서만 파는 전용 제품 등 콘텐츠를 강화하고 있다. 또 온라인몰 전용 상품 개발에도 적극적으로 나선다. 지난해 하반기 10색..."
587,2016.05.24.,"이마트, 전점 O2O 서비스 제공…“바코드 스캔으로 상품정보에서 배송까지”",성수점을 우선적으로 시범 실시하며 해당 범위는 성수점 핵심상권인 성수동에서 논현동에 이르는 서울 서남부 권역으로 설정했다. 또한 비콘 서비스는 고객의 스마트폰 블루투스와 연동 고객의 매장 위치에 따라 해당...
588,2016.05.20.,동대문 면세시대 열렸다…두타면세점 프리 오픈,당초 기대와 달리 명품 브랜드 없이 1차 오픈을 하게 됐지만 국내 최초 ‘심야 면세’로 새벽까지 이어지는 동대문 상권과 올빼미 관광객을 사로잡겠다는 의지다. 두산은 20일 서울 창충단로 두산타워에 두타면세점을...
589,2016.05.23.,공동행동 “대기업의 나팔수 전경련은 해체해야 한다”,시민단체와 민주노총이 23일 서울 여의도 전국경제인엽합회(이하 전경련) 앞에서 이 단체의 해체를... 공동행동은 또 “유통재벌은 대형마트를 앞세워 골목상권을 황폐화하고 재벌 대기업은 노동자 40%를 비정규직으로...
590,2016.05.20.,동대문 면세시대 열렸다…두타면세점 프리 오픈,당초 기대와 달리 명품 브랜드 없이 1차 오픈을 하게 됐지만 국내 최초 ‘심야 면세’로 새벽까지 이어지는 동대문 상권과 올빼미 관광객을 사로잡겠다는 의지다. 두산은 20일 서울 창충단로 두산타워에 두타면세점을...
591,2016.05.24.,"이마트, 모바일 상품정보·스캔배송 등 신규 O2O 서비스 제공",성수점을 우선적으로 시범 실시하며 해당 범위는 성수점 핵심상권인 성수동에서 논현동에 이르는 서울 서남부 권역으로 설정했다. 또한 비콘 서비스는 고객의 스마트폰 블루투스와 연동 고객의 매장 위치에 따라 해당...
592,2016.05.25.,"한샘, 가구부터 생활용품까지…상봉 플래그샵 오픈","(사진=한샘) 한샘이 서울 중랑구 상봉동에 한샘 플래그샵을 오픈한다고 25일 밝혔다. 가구뿐만 아니라 부엌... 한샘 관계자는 ""상봉점은 지난 3월 오픈한 수원 광교점에 이은 전국 9번째 플래그샵으로 강북 상권 일대를..."
593,2016.05.26.,[인터뷰]김영종 종로구청장 “청진동 지하보행로 조성 종로 새 르네상스 열어...,그랑서울~종각역이 지하 통로로 연결됐다. 이에 따라 이 건물에 근무하는 직장인은 물론 통과교통 행인들도 비가 오나 눈이 오나 우산 쓸 것 없이 지하로 이동가능해졌다. 건물 지하 상권도 살아나고 있다. 이는 건축가...
594,2016.05.23.,공동행동 “대기업의 나팔수 전경련은 해체해야 한다”,시민단체와 민주노총이 23일 서울 여의도 전국경제인엽합회(이하 전경련) 앞에서 이 단체의 해체를... 공동행동은 또 “유통재벌은 대형마트를 앞세워 골목상권을 황폐화하고 재벌 대기업은 노동자 40%를 비정규직으로...
595,2016.05.25.,"한밭대, 2016 창업 아이디어 설계캠프 운영",특히 참가자들은 캠프기간 서울 명동시장과 남대문시장을 직접 방문해 주변의 인프라와 상권을 조사하고 시장에 대한 특성과 수요조사를 통해 창업전략을 세우는 기회도 갖게 된다. 또한 ‘창의적 아이디어 발상기법’...
596,2016.05.26.,"주거시스템에 IoT기술 접목, 품격 높인 명품 공간","SRT(수서발 고속철도)·GTX(수도권광역 급행철도, 2021년 개통 예정) 복합 환승역인 동탄역(예정) 및 중심상권, 서울·수도권으로 쉽게 이동할 수 있다. 정수현 현대건설 사장 교육환경도 뛰어나다. 단지와 인접해..."
597,2016.05.28.,[씨줄날줄] 스타벅스와 전통 색채/서동철 논설위원,"동네 상권을 보호한다는 취지라지만, 전통적인 서촌 고유의 분위기를 해치지 않도록 하겠다는 정책 의지가 짙게 깔려 있다. 삼청동을 비롯한 북촌(北村) 일대는 정책적 보호를 받지 못하고 너무나도 빨리 망가졌다. 서울이..."
598,2016.05.26.,"천안역 우방 아이유쉘, 잔여세대 선착순 공급",뿐만 아니라 해당 아파트 단지는 천안 신부동 중심상권과 인접해 편리한 생활 인프라와 교육 여건들이... 여기에 서울-세종 고속도로 건설이 확정되며 광역교통망이 더욱 개선될 전망이다. 천안역 우방 아이유쉘에...
599,2016.05.25.,모르고 지나치던 그곳의 시간…우리 집 옆 문화재,일제강점기 조선 상권을 장악하려는 일본상인들 틈에서도 끝까지 조선인이 소유했던 이 건물은 2016년 현재까지 원위치를 지키고 있는 마지막 2층 한옥 상가가 되었다. 지난 3월 서울시에서 문화재 등록을 추진(4월에...
600,2016.05.25.,모르고 지나치던 그곳의 시간…우리 집 옆 문화재,일제강점기 조선 상권을 장악하려는 일본상인들 틈에서도 끝까지 조선인이 소유했던 이 건물은 2016년 현재까지 원위치를 지키고 있는 마지막 2층 한옥 상가가 되었다. 지난 3월 서울시에서 문화재 등록을 추진(4월에...
601,2016.05.25.,한밭대· 공주대 공학교육혁신센터 '창업아이디어 캠프',"특히 이들은 서울의 현대시장(명동)과 재래시장(남대문)을 직접 방문, 주변 인프라와 상권을 조사하고 창업전략도 세운다. 이와 함께 '창의적 아이디어 발상기법'과 '사업계획서 작성 및 마케팅전략' 등의 특강으로..."
602,2016.05.25.,"""노인들은 고집스럽다? 그렇지 않아요""",""" 한번은 기업형 슈퍼마켓(SSM, Super Super Market)이 지역 상권을 어떻게 죽이는지를 강의했는데, 강의를 들은... 유럽의 모델을 서울이나 일산에서 시도하고 있는데, 삼삼오오 모여 자신들의 재능을 나누는 거죠. 서울에서..."
603,2016.05.25.,종로구 청진동 일대 대형빌딩 지하보도 연결…'종로 르네상스' 연다,민관협력사업으로 사업비 586억원 전액 민간이 부담 [CBS종로구 청진동 지하보도 연결 현황 (사진=종로구청 제공)서울 종로구 청진동 일대 대형 빌딩과 지하철역 등의 지하공간을 연결하는 지하보도가 개통돼 주변 상권...
604,2016.05.26.,"뜨는 서촌, 건축물 높이는 2~4층 제한+동네상권 보호위해 프랜차이즈 가맹점 ...",또 동네상권 보호를 위해 자하문로와 사직로변을 제외한 서촌 전 구역에는 프랜차이즈 가맹점이 들어설 수 없다. 서울시는 도시·건축공동위원회를 열어 이 같은 내용의 경복궁 서측 지구단위계획 재정비(안)을...
605,2016.05.25.,"초저금리 시대, 수익형 부동산 인기 높아","주변 상권은 잘 갖춰져 있는지, 배후수요는 풍부한지, 미래 프리미엄을 노려볼 수 있는지 등 여러 요소들을... 용인서울고속도로(흥덕 IC)와 경부고속도로(수원 IC)도 가까이에 있어 다른 도시로의 이동 또한 편리하다...."
606,2016.05.23.,"""이통사 직영점·대형유통점 늘어 골목상권 붕괴""",전국이동통신유통협회와 참여연대 민생희망본부 등은 23일 오후 2시 서울 종로구 통인동 참여연대에서 기자회견을 열고 이통3사 직영점과 대기업 대형유통점이 골목상권을 심각하게 위협하고 있다고 주장했다....
607,2016.05.25.,"""대형마트 짓기도 전에 상생요구는 월권""",대형마트 점포 건축 전에 상권영향평가를 해 점포 규모와 판매품목을 제한하겠다고 한 ‘박원순표(서울시) 경제민주화 조례’의 위법성을 지적한 것이다. 이 변호사는 “대법원은 ‘건축허가권자는 건축법 등 관계...
608,2016.05.26.,"두타면세점, '더블악재' 속 살아 남을까?…명품유치 실패, 매출불투명 '걸림돌...",= 20일 오전 서울 중구 두타면세점에서 관광객들이 매장을 둘러보고 있다. 이날 개장한 두타면세점은... 반면 명동 상권과 백화점과의 시너지를 업은 신세계면세점이 신규 오픈한데다 기존 롯데백화점 소공점의...
609,2016.05.28.,"[르포]미군없는 동두천 기지촌, 주말 밤 2시간 벌이로 연명","특히 2006년 12월 전철 1호선 보산역이 개통되면서 외박을 나온 미군 장병들이 외국인들이 선호하는 클럽과 식당이 몰려 있는 서울 홍대, 이태원 등을 즐겨 찾으면서 보산동 상권에 균열이 커지기 시작했다. 또 최근..."
610,2016.05.28.,"[르포]미군없는 동두천 기지촌, 주말 밤 2시간 벌이로 연명","특히 2006년 12월 전철 1호선 보산역이 개통되면서 외박을 나온 미군 장병들이 외국인들이 선호하는 클럽과 식당이 몰려 있는 서울 홍대, 이태원 등을 즐겨 찾으면서 보산동 상권에 균열이 커지기 시작했다. 또 최근..."
611,2016.05.27.,광화문ㆍ청계천 등 명소서 릴레이 패션쇼 열린다,서동록 서울시 경제진흥본부장은 “서울 365 패션쇼가 신진디자이너와 모델지망생을 육성함과 동시에 패션상권 활성화에도 도움 되길 바란다”라며 “아시아 패션허브 도시로 서울의 브랜드를 계속...
612,2016.05.25.,"한밭대, '2016 창업 아이디어 설계캠프' 26~28일 운영",특히 캠프기간 서울의 현대시장(명동)과 재래시장(남대문)을 직접 방문해 주변의 인프라와 상권을 조사하고 시장에 대한 특성과 수요조사를 통해 창업전략을 세우는 등 직접 참여하는 체험형 캠프를 체험하는 시간을...
613,2016.05.25.,오래된 아파트 많은 울산 삼산동에 신축아파트가 뜬다,"[스포츠서울 김종철기자] 울산광역시 남구 삼산동에 위치한 ‘삼산동 리버사이드 지역주택조합’이 지난... 롯데백화점, 현대백화점, 이마트, 농수산물시장, 고속버스터미널 등 다양한 상권이 형성돼 있는..."
614,2016.05.26.,[이슈+] '미식 百선생' 노리는 백화점…푸드투어 판 벌였다,서울 반포 고속버스터미널 상권을 중심으로 한 강남점 일대를 한국 먹거리 명소로 만든다는 청사진을 제시한 것이다. 이 같이 백화점이 다양한 식품 관련 기획을 선보이는 이유는 먹거리의 중요도가 커졌기 때문이다....
615,2016.05.26.,[정리뉴스]공인중개사·변호사 ‘부동산 중개업’ 놓고 마찰···그간 무슨 ...,‘골목 상권 침해’라는 말도 나왔죠. 결국 공인중개사협회는 2번에 걸쳐 공승배 변호사를 수사기관에... 서울 송파구 잠실의 한 공인중개사 사무소 벽면에 붙어 있는 아파트 매매 및 전세 시세표를 주민이 살펴보고 있다....
616,2016.05.22.,<게시판> 점포운영 체험 '소상공인학교' 교육생 모집,"교육생은 서울·부산·광주 등 5개 광역시 중심상권에 마련된 19개 체험점포에서 각자 계획한 창업아이템으로 사업을 운영하며 시장 반응을 살펴볼 수 있고, 졸업 후에는 평가를 통해 창업자금과 사업화자금을..."
617,2016.05.27.,업무시설에도 인프라 중요성 강화.. 광교신도시 뜬다,"있어 상권이용 및 업무의 효율성이 높아지게 된다. 기본적인 인프라로는 교통이 있다. 교통망이 편리한... 또 용서고속도로(용인~서울), 경부고속도로, 영동고속도로 등을 통해 서울 수도권 및 전국적으로 이동이..."
618,2016.05.24.,‘55년 전통’ 구로시장 현대화 완료,"서울 구로구(구청장 이성)는 24일 “시장의 경쟁력을 강화하고 상권을 활성화하기 위해 낡고 위험한 시설물을 개선하는 구로시장 현대화 사업을 최근 완료했다”고 밝혔다. 지난 1962년 형성된 구로시장은 신발, 의류..."
619,2016.05.26.,[한경매물마당] 용인시 더블역세권 수익형 빌딩 등 9건,"◆서울 마포구 더블역세권 투자용 빌딩=중심상권 대로변 코너 빌딩=대지 3300㎡, 연면적 1만8000㎡의 14층 건물. 유동인구 밀집지역으로 가시성 및 접근성 우수. 자주식 주차 200대. 보증금 100억원, 월 4억원..."
