,date,title,contents
1103,2016.05.19.,"가로수길 안부럽네… 왕십리뉴타운 스트리트형 상가, 샤인스트리트 2차",왕십리뉴타운 센트라스 상업시설은 동대문·중구·성동구 등 서울 강북 주요 도심 상권들의 중심에 자리잡고 있어 3개의 상권을 하나로 모으는 왕십리의 새로운 랜드마크 복합상권으로 자리매김 할 전망이다. 계약조건도...
1104,2016.05.26.,남양주 브릭스타워 상가분양 진행,"또 서울외곽순환도로와 경의중앙선, 8호선 별내 연장선이 인접해 있다. 남양주 IC로 나와 다산신도시... 이미 확보돼 있다는 점에서 투자 전에 상권 및 임대 활성화 정도를 가늠해볼 수 있다. 이유진 기자 (lyj@ciobiz.co.kr)"
1105,2016.05.17.,대전 원도심 젠트리피케이션 방지 대책은,"서울시의 경우, 홍대 앞과 종로구 북촌ㆍ서촌 등이 대표적이다. 대전에서 젠트리피케이션이 빚어지고 있는... 원룸 신축에 따른 정주인구 증가와 재개발에 대한 기대감으로 상권 임대료도 오르고 있다. 은행동..."
1106,2016.05.22.,'대기업 효과' 인천송도·서초우면 집값·상권 모두 高高,지난 11월 삼성전자 R&amp;D캠퍼스가 문을 연 서울 서초구 우면동 주변도 대기업 특수를 누리고 있다. 삼성전자 연구원 1만여명이 근무할 예정이다. 이 지역에는 삼성전자 뿐 아니라 LG전자 R&amp;D캠퍼스와 KT우면연구센터도...
1107,2016.05.13.,"신촌 이대역 영타운 지웰 에스테이트, 13일 분양","서울시 서대문구 대현동에 들어서는 이 오피스텔은 지상 2층~지상 10층, 1개동, 261실(전용 19㎡ 54실, 20... 신촌·이대상권의 풍부한 생활편의과 문화시설, 현대백화점, 그랜드마트, 신촌세브란스병원, 메가박스, CGV..."
1108,2016.05.23.,"통신유통인, “통신상품판매, 중기적합업종 지정해야”","- KMDA, “대기업, 우회 지원금으로 골목상권 파괴” 이동통신유통인들이 통신상품 유통을... 23일 사단법인 전국이동통신유통협회(KMDA, 회장 조충현)은 서울 종로구 참여연대 아름드리홀에서 기자간담회를 열고..."
1109,2016.05.27.,내포신도시 민간 임대아파트 주목,중흥 S클래스 리버티 1660가구 구성 행정타운·상권 인접… 문화시설 갖춰 충남도청이 이전한 내포신도시 내... 내포신도시는 서해안 고속도로 홍성 IC를 통해 서울·경기등 수도권으로의 이동이 쉽다. 특히 당진-대전간...
1110,2016.05.18.,"인천도시철도 2호선, 7월 30일 개통","또한 공항철도(검암역), 서울도시철도 7호선(석남역, 2020년 예정)과 경인선 1호선(주안역)은 물론... 도시철도건설본부 관계자는 ""인천 2호선 개통은 신·구도심의 지역 균형발전과 함께 역세권 주변 상권과 기업유치 등..."
1111,2016.05.09.,365플러스 상권 최적화 서비스,【서울=뉴시스】 홈플러스의 편의점 브랜드 365플러스는 상권 변화에 따라 매대 및 상품 구성을 리모델해 경영주의 수익성을 높여주는 상권 최적화 서비스를 업계 처음으로 시작한다고 9일 밝혔다. 사진은...
1112,2016.05.23.,"로켓모바일, 유상증자에 대원 참여...베트남 뷰티·헬스케어 시장 진출",로켓모바일은 향후 에이치에스비컴퍼니와 서울리거코스메틱스의 뷰티 및 헬스케어 분야 전문성과 대원의 베트남 시장 이해도를 기반해 도심상권 및 주요개발지역 클리닉 입점을 통해 베트남 시장에 진출한다는...
1113,2016.05.18.,[사회] 을지스타몰 ‘쪽박몰’ 된 이유,서울시설공단은 을지로지하도상가 상권이 침체된 이유로 주요 소비 주체인 젊은 층의 유입이 이뤄지지 않기 때문이라고 밝혔다. 서울시설공단 상가운영처 관계자는 “젊은 소비층의 주요 활동 공간이 강북권에서...
1114,2016.05.16.,"용산구 ""지역주민 일자리 올 4338개 창출""","용산은 현재 이태원, 경리단길, 한남동 등지를 중심으로 세계음식, 패션 관련 상권이 날로 커져 서울의 새로운 관광도시로 부상중이다. 특히 미군기지가 이전하면 용산공원 내 다양한 문화 관광 콘텐츠가 조성돼 용산..."
1115,2016.05.13.,"박원순, 전남대서 광주시민 400명 대상 특강","2박3일 일정으로 광주를 방문 중인 박원순 서울시장은 13일 오전 전남대에서 학생과 교직원, 광주시민 등... 박 시장은 밤에는 상권이 활성화된 '1913송정역시장'을 찾아 청년 상인들을 응원한다. 송정역시장은 1913년..."
1116,2016.05.19.,예산 '한국산업대상' 공공부문 대상,"19일 서울 그랜드힐튼 컨벤션홀에서 개최된 '2016 한국산업대상' 시상식에서 '공공부문' 대상을 수상했다. 국내... 또 상거래 활성화와 소상공인 지원조례 제정, 전통시장 정비를 통한 지역상권 활성화 도모, 전국 최초..."
1117,2016.05.12.,동탄에 첫 ‘힐스테이트’…현대건설 1479가구 6월 분양,"복합 환승역인 동탄역(예정) 및 중심상권, 서울ㆍ수도권 주요 업무지역 등으로 이동이 수월하다. 단지 인근에 초등학교 1개가 예정돼 있다. 중ㆍ고교는 도보통학이 가능하다. 단지 안에 유치원이 들어선다. 단지..."
1118,2016.05.20.,"고수, 조각 외모에 윙크까지 발사…'심쿵사 유발'","현재 고수는 MBC 창사 55주년 특별기획 '옥중화'에서 마포, 삼개나루의 상권을 장악하고 있는 한양상단과... 하와이 화보는 로피시엘옴므 2016년 6월호에서 만나볼 수 있다. [스타서울TV 강다나 인턴기자/사진= 로피시엘옴므]"
1119,2016.05.24.,"가로수길 안부럽네!, 왕십리뉴타운 대표 스트리트형 상가, 샤인스트리트 2차 ...",왕십리뉴타운 센트라스 상업시설은 동대문·중구·성동구 등 서울 강북 주요 도심 상권들의 중심에 자리잡고 있어 3개의 상권을 하나로 모으는 왕십리의 새로운 랜드마크 복합상권으로 자리매김 할 전망이다. 계약조건도...
1120,2016.05.17.,용산 모처럼 아파트 신규분양 줄잇는다,"다만 4구역은 공덕5거리 상권에 더 가깝고, 5구역은 남영역, 서울역, 용산역 상권 접근이 수월하다. 효성은 오는 11월 ‘용산4구역 효성해링턴 플레이스’를 분양한다. 업무시설을 포함한주상복합아파트로 최고 43층..."
1121,2016.05.23.,"오쉐이크, 신개념 디저트 '악마쉐이크'로 디저트카페창업에 새 바람을 일으키...","등 서울 내 핫플레이스를 기점으로 전국 매장을 확장하는 등 브랜드의 뜨거운 인기를 증명하고 있다.... 상담은 지역에 점포 입점 가능 여부를 확인하고 창업 담당자가 직접 실사를 지원, 창업에 적합한 구역인지 상권분..."
1122,2016.05.11.,코엑스 문화축제 C-페스티벌 경제파급효과 1천600억원,"[연합뉴스 자료사진] 지난 4일부터 5일간 서울 삼성동 코엑스 일대에서 열린 문화축제 C-페스티벌의... 지역상권 소득창출 등 지역경제 활성화에 기여했다""고 평가했다. 올해 행사에서는 40개국 주한 대사와 외교관..."
1123,2016.05.23.,[밀착취재] 하루 200t… 백화점·대형마트 식품쓰레기 산더미,"폐점 2시간전에도 진열장 채워…못 팔면 버리지만 '울며 겨자먹기' 지난 19일 오후 7시 서울의 A 백화점 지하... 백화점은 인구 120만∼150만명, 대형마트는 인구 10만∼15만명을 상권으로 보고 출점한다. 대형마트 관계자는..."
1124,2016.05.23.,<분양소식> 출퇴근 스트레스 제로…직주근접형 단지 잡아라,"홈플러스와 롯데마트를 비롯해 주민센터, 수변상권, 국제성모병원 등 생활편의시설 이용이 편하다. 쇼핑... 현대산업개발의 계열사 HDC아이앤콘스는 이달 서울 강남구 대치동 944-21 외 3필지 일원에 위치한 '대치2차..."
1125,2016.05.16.,"골프존, 17일부터 스크린골프 가맹사업 전환 사전신청 접수",골프존의 상권보호와 가격 안정화를 위한 현실적인 대안이라고 결론냈다. 가맹사업본부는... /백주연기자 nice89@sedaily.com ▶ '썸 타는' 특별한 뉴스~ '서울경제썸 페이스북' 바로가기~▶ 돈이 보이는 뉴스 '서울경제...
1126,2016.05.19.,"우리 음식의 대명사 김치찌개, 정직한 재료 정직한 맛 일품",[스포츠서울] 불경기로 소비 심리가 위축된 상황에서도 승승장구하며 창업 시장의 다크호스로 떠오른 한... 및 상권 분석 시스템을 구축하는 등 점주의 창업마인드를 중요시하고 본점 1주일 실무교육으로 서비스...
1127,2016.05.19.,"메뉴 하나로 온 가족이 골라먹는 재미, 통닭의 인기 비결",[스포츠서울] 경기 불황의 여파로 인해 소자본으로 안정적인 수익을 창출할 수 있는 외식업 비즈니스... 실제 으뜸통닭 매장이 핵심 상권을 벗어나 아파트 단지 상가나 주택가에 위치해 있어도 단골고객의 비율이 80...
1128,2016.05.25.,"올가홀푸드, 가맹 브랜드 '바이올가 왕십리 뉴타운점' 오픈",올가)가 서울시 성동구 하왕십리동에 '바이올가 왕십리 뉴타운점'을 오픈했다고 25일 밝혔다. 바이올가(by... 바이올가 왕십리 뉴타운점은 주변상권에 약 4만여 세대가 거주하는 왕십리 뉴타운 지역에 위치해 있다....
1129,2016.05.11.,"악동뮤지션 ""우리 메시지는 공감…힘든 사람 위로하고파""","악동뮤지션 [YG엔터테인먼트 제공] 2년만에 새 앨범 '사춘기 상권'…""하권도 올해 안에 발표"" ""오빠가 생각이... (웃음)"" (수현) 11일 서울 마포구 희우정로 YG엔터테인먼트 사옥에서 만난 악동뮤지션이 자신들의 사춘기에..."
1130,2016.05.16.,복합환승센터 인근 신규 분양 단지 4곳은 어디?,"서울의 대표적 복합환승센터인 서울역의 경우 KTX와 일반열차, 지하철, 시내·외 버스, 택시 등의 복합환승 거점의 역할 외에도 롯데 아울렛 서울역점·영화관·대형마트·식당가 등 상권이 잘 발달돼 있다...."
1131,2016.05.16.,'달리는 식당' 푸드트럭…지역축제 명물됐다,"영업지역이 제한된데다, 지자체들이 기존 상권의 눈치를 보면서 적극 나서지 않은 탓이다. 분위기가 바뀌기... 서울시와 서초구, 부산 영도구, 금정구, 경기도 광주시 등 23개 지자체도 조례 제개정을 통해 푸드트럭의..."
1132,2016.05.20.,"용산구, 앤틱가구거리 한국의 몽마르뜨로 변신",이태원 앤틱가구거리는 80여 개 고(古)가구점이 모여 있는 아시아 최대의 앤틱가구 특화상권이다. 1970년대... 가구거리를 서울의 몽마르뜨로 변신시키고자 한다. 또 구는 이태원 퀴논길 벽화 그리기를 시작으로 본격적인...
1133,2016.05.18.,인천 도시철도 2호선 7월 30일 전면 개통,"인천도시철도 2호선이 개통되면 공항철도(검암역), 서울도시철도 7호선(석남역, 2020년 예정)과 경인선... 구도심의 지역 균형발전과 함께 역세권 주변의 유동 인구 증가로 침체된 상권이 활성화되는 것은 물론..."
1134,2016.05.15.,흔들리지 않는 상권은 바로 C-AUTO,공연장을 갖춘 복합문화공간인 블루스퀘어가 들어선 후 상권이 발달한 서울 한남오거리와 리움미술관 인근이 대표적인 사례다. '아파트(Apartment)' 등 배후 가구도 필요하다고 설명했다. 다만 주변에 대형 유통시설이...
1135,2016.05.20.,"'박원순표' 역세권 개발에 '꼬마빌딩' 호가 껑충…""수억 더 줘도 안팔아""","최근 서울 동작구 지하철 보라매역 인근의 20억원대 초반 '꼬마빌딩'을 실투자금 12억원에 매입했다. 강남... 감췄다""며 ""상권이 형성되지 않은 원룸 위주의 건물인데 1억원을 더 얹어줘도 당장은 안 판다는 분위기""라고..."
1136,2016.05.03.,황금연휴 521개 전통시장 주변로 주차 허용,"= 행정자치부와 경찰청이 5~8일 연휴기간 동안 서울 영천시장, 부산 자갈치시장 등 전국 521개 전통시장... 지역상권을 살려 서민경제에 도움을 주기 위해 실시하는 것으로 국민들의 많은 이용을 기대한다""고..."
1137,2016.05.25.,"[2016착한브랜드 대상]양재하이브랜드몰, 고객-입주사 신뢰받는 ‘랜드마크형...",양재나들목 상권의 중추적인 역할을 하고 있다. 하이브랜드MALL은 복합상가의 운영관리 노하우가 축적되어 체계적인 시설 안전관리로 서울 시내 여타 복합상가의 운영관리 시스템보다 합리적인 시스템을 개발하고...
1138,2016.05.20.,골목상권 살리고 마을기업 육성… ‘희망 2030프로젝트’ 적극 추진,"이를 위해 그는 전통시장 활성화 등 골목상권을 살리고, 사회적 기업, 마을 기업, 협동조합을 적극 육성... 달서구는 인구 61만 명으로 전국 기초자치단체 중 서울 송파구(65만 명) 다음으로 많다. 이 구청장은 “직원..."
1139,2016.05.12.,"신세계 본점, 면세점 개점 앞서 13일 전관 리뉴얼 오픈","[ 신세계백화점은 명동상권에 위치한 본점이 신세계면세점 명동점의 개점을 5일 앞둔 오는 13일, 4개월에... 통해 서울이 세계적인 관광 도시들과 경쟁하는데 일조할 것’이라고 말했다. 한편 신세계면세점 명동점은..."
1140,2016.05.20.,"이천우 두산 부사장, “시간갖고 지켜봐달라 ”","그는 “기본적으로 동대문 상권 자체가 외국인들이 서울을 오면 무조건 방문해야될 장소로, 모객에 문제가 없다”는 설명이다. 또한 주요 여행사 70여개와 제휴 계약을 맺은 상태임을 강조했다. 이 부사장은 “오픈..."
1141,2016.05.01.,"롯데피트인, 2일 군포 산본역에 2호점 열어",롯데피트인 산본점 패션 전문쇼핑몰 '롯데피트인'이 서울 동대문점에 이어 경기도 군포시 산본에 두 번째... 지역 상권에 밀착할 계획이다. 우선 20~30대 인구 비율(30.1%)이 전국 평균(27.9%)보다 높은 지역 특성을 반영...
1142,2016.05.17.,전운 감도는 휴대폰 유통 시장,전국이동통신유통협회 회원들이 지난 2014년 10월 30일 서울 종로 보신각 광장에서 `단통법 개정 및 유통점... 골목 상권 퇴출 프로그램으로 이용당하고 몰락하는 것이 전부”라고 목소리를 높였다. 정부는 상생협력...
1143,2016.05.18.,4개 노선이 만나는 곳 ‘래미안 용산 더센트럴’ 상업시설 분양,"가능해 서울의 중심인 ‘용산역’은 총 4개 노선이 만나는 ‘쿼드러플’ 역세권이 될 전망이다. 특히, 신분당선연장선이 개통되면, 강남과의 접근성이 우수해져 유동인구가 더욱 증가할 것으로 보여, 용산역 일대 상권..."
1144,2016.05.23.,[르포] 문화공간 vs 야간쇼핑…신세계‧두타 면세점 개장 후 첫 주말 둘러보니,"신세계는 쇼핑과 더불어 문화공간의 제공을, 두산은 지역 상권과 결합된 야간 쇼핑을 각각 강점으로 내세웠다. 양측이 다른 전략으로 승부를 건 만큼 서울 시내 면세점의 판도 변화가 주목된다. 21일 신세계 면세점..."
1145,2016.05.19.,면세점 무한경쟁 시대로...신세계·두산면세점도 오픈,"특히 서울시와 중구청, 남대문시장상인회와 손잡고 도깨비 야시장 개설 등 주변 지역 관광상품화를 통해... 면세점을 통한 동대문 상권 활성화를 위해 지난해 동대문 미래창조재단을 출범하고 ‘동대문 미라클..."
1146,2016.05.28.,"계경순대국, 순대국창업 절차 및 가맹점 지원시스템 밝혀…","업체 측 설명에 의하면, 이 10단계 창업 절차 중 희망상권사전예약 단계에는 업체의 독자적인 창업 시스템이... 이 창업설명회는 매주 목요일 오후 3시, 서울 천호동에 위치한 본사 대회의실에서 열리며, 사전 전화예약을..."
1147,2016.05.11.,"악동뮤지션 ""우리 메시지는 공감…힘든 사람 위로하고파"" (종합)","악동뮤지션 [YG엔터테인먼트 제공] 2년만에 새 앨범 '사춘기 상권'…수현 ""내 자작곡도 선보이고 싶어... (웃음)"" (수현) 11일 서울 마포구 희우정로 YG엔터테인먼트 사옥에서 만난 악동뮤지션이 자신들의 사춘기에 대한..."
1148,2016.05.18.,신세계면세점 오늘 개점...롯데와 정면 승부,신세계면세점은 서울 중구 신세계 백화점 본점 신관에 영업 면적 만3천8백여 ㎡ 규모로 오늘 개점합니다.... 신세계면세점은 특히 업계 매출 1위인 롯데 면세점 소공점과 명동 중국인 관광객 상권을 놓고 치열하게...
1149,2016.05.23.,새로운 사업 도전? 소상공인사관학교 가보자,"현재 서울, 부산, 대구, 광주, 대전 등 5개 광역시의 유동인구가 많은 중심상권에 구축된 총 19개 체험점포(브랜드명: 꿈이 커지는 곳, 꿈이룸)에서는 3기 교육생 158명이 점포체험 중이며 교육생들은 체험점포에서..."
1150,2016.05.16.,"중기중앙회, '유통산업 발전방안 마련 토론회' 열어",중소기업중앙회는 중소기업학회와 함께 이달 19일 오후 3시부터 서울 여의도 중기중앙회 제 2대 회의실에서... 시장상권본부장 △김숙경 산업연구원 연구위원 △김익성 동덕여대 교수 △강갑봉...
1151,2016.05.15.,"시내면세점 춘추전국시대 돌입, 승자는?",신세계면세점이 오는 18일 서울 신세계백화점 본점 신관 8∼12층에 들어선다. 남대문 전통시장 활성화... 연 710만명 이상 외국인 관광객이 찾는 지역적 특성을 살려 동대문 상권 활성화와 심야 면세점 운영 등을 추진하고...
1152,2016.05.16.,복합환승센터 인근 단지 시세 견인…분양시장 ‘핫 플레이스’로,"서울의 복합환승센터인 서울역이 대표적인 예다. KTX와 일반열차, 지하철, 시내ㆍ외 버스 등 복합환승 거점의 역할 외에도 아울렛, 영화관, 대형마트 등 상권이 잘 발달돼 있다. 용산역 복합환승센터 인근 단지도..."
1153,2016.05.23.,1~2인 가구를 위한 소형 빌트인 오피스텔 ‘인기’,"풍부해 서울 전역을 비롯한 경기, 인천 등 수도권 전역으로 이동이 수월하다. 여기에 신촌로, 강변북로, 내부순환도로 등이 가까이 있어 차량으로 타 지역 이동도 좋은 편이다. 신촌·이대상권의 풍부한 생활 편의 및..."
1154,2016.05.18.,커지는 '부동산 종합서비스업'…중개법이 발목잡나,그렇지만 중개업을 둘러싼 골목상권 침해 논란으로 시장이 성장하기에는 아직 한계가 있다는 지적도 나오고... 이 회사는 서울 강남구 자곡동에 부동산 중개사무소도 운영하면서 개인 고객들을 현장에서 만나고 있다....
1155,2016.05.20.,[한경 미디어 뉴스룸-한경닷컴] 3만8000여개 데이터 비교분석…'꼬마빌딩' 건...,이런 투자자의 갈증을 해소하겠다는 취지로 한경닷컴의 부동산채널 한경부동산에서는 3만8000여건의 중소형 빌딩 데이터를 보유한 원빌딩부동산중개와 협력해 매주 서울 시내 지하철역을 중심으로 한 기초적인 상권...
1156,2016.05.19.,[예산군] 예산 한국산업대상 공공부문 '대상',"그랜드힐튼 서울호텔 컨벤션홀에서 개최된 '2016 한국산업대상' 시상식에서'공공부문' 대상을 수상했다.... 아울러 상거래 활성화 및 소상공인 지원조례 제정과 전통시장 정비를 통한 지역상권 활성화 도모, 전국 최초..."
1157,2016.05.12.,"강남구, 13일 음식문화축제 열어","= 서울 강남구(구청장 신연희)는 지역경제 활성화 일환으로 오는 13일 일원동 맛의 거리 일대에서... 'RED DAY, FOOD FESTIVAL'은 올해 강남구의 지역상권 및 특화산업 활성화 지원사업 공모에 선정된 사업이다. 이날..."
1158,2016.05.17.,"현대건설, '힐스테이트 동탄' 1479세대 분양","SRT(수서발 고속철도)·GTX(수도권광역 급행철도, 2021년 개통 예정) 복합 환승역인 동탄역(예정) 및 중심상권, 서울․수도권 주요 업무지역 등으로의 접근성이 좋다. 올해 11월 개통을 준비하고 있는 SRT 이용 시..."
1159,2016.05.21.,대단지의 품격 ‘DMC2차 아이파크’로 수요자 몰린다,"이렇게 생활인프라가 잘 발달되어 있다 보니 대단지를 중심으로 상권이 발달하게 되고, 자연스럽게... 특히 단지와 인접한 상암DMC는 IT와 문화를 통해 가치를 창출하는 서울 서북권 대표 업무지구로, 현재 CNS, 팬택..."
1160,2016.05.18.,"[유통업계 핫이슈 핫현장(17)] ""면세점이야, 미술관이야"".. 면세쇼핑 시장에 ...","한국관광의 심장부인 명동상권인 서울 충무로의 신세계백화점 본점 신관 8~12층에 문을 연 신세계면세점 명동점은 쇼핑과 문화,체험을 융합한 복합쇼핑문화공간으로 꾸며져 면세쇼핑의 새로운 패러다임을 제시했다는..."
1161,2016.05.16.,중기중앙회 '유통산업 발전방안 마련 토론회' 개최,"중소기업학회와 공동으로 진행하는 이번 토론회는 5월 19일 목요일 오후 3시, 서울 여의도 중소기업중앙회... 시장상권본부장, 김숙경 산업연구원 연구위원, 김익성 동덕여자대학교 교수, 강갑봉..."
1162,2016.05.17.,"""규제 발목 벗어나 '프랜차이즈' 해외로 눈돌려야""",""" 17일 서울 서초구 한 식당에서 열린 기자간담회에서 조동민 한국프랜차이즈산업협회장은 협회의 진출... 조 회장은 ""국내에는 프랜차이즈 상점이 들어서면 각종 골목 상권 문제가 발생한 데다 온갖 규제들이 많아 어려운..."
1163,2016.05.18.,[fn스트리트] 신세계 본점,"1930년대 서울, 즉 경성은 일제의 도시계획에 따른 새 도로로 크게 두 부분으로 나뉘었다. 북촌이라고... 그리고 북촌과 남촌을 중심으로 종로와 본정(명동)이라는 두 상권이 형성됐다. 우리가 영화 '장군의 아들'이나..."
1164,2016.05.16.,"용산구 ""면세점 직원 등 일자리 4000여개 창출""","용산은 현재 이태원, 경리단길, 한남동 등지를 중심으로 세계음식, 패션 관련 상권이 날로 커져 서울의 새로운 관광도시로 부상중이다. 특히 미군기지가 이전하면 용산공원 내 다양한 문화 관광 콘텐츠가 조성돼 용산..."
1165,2016.05.09.,"한양도성 내 110만㎡ 재개발 예정구역 해제, 역사·문화 보전한다","서울시, 11일 2025 도시환경정비기본계획(안) 발표 한양도성 내 재개발 예정구역 110만㎡가 재개발... 시는 한양도성 내 도심의 재개발구역은 아직 사업이 시행되지 않은 곳이 남아 있어 골목길, 상권 등 보전가치가 높다고..."
1166,2016.05.21.,"용산구, 이태원 주말문화 축제로 관광객 유치 나서",가구거리를 서울의 몽마르뜨로 변신시키고자 한다. 공사를 6개 구역으로 나눠 순차적으로 진행함으로써... 이태원 앤틱가구거리는 80여 개 고(古)가구점이 모여 있는 아시아 최대의 앤틱가구 특화상권이다. 1970년대...
1167,2016.05.16.,"[人터뷰+] ""맛없는 음식, 맛없다고 해야죠"" vs ""배달앱 피 말린다""","성큼 다가온 모바일 시대가 골목 상권의 모습을 크게 바꾸고 있습니다. 그중 대표적인 게 바로 '스마트폰... &lt;편집자 주&gt; :::::::::::::::::::::::::::::::::::::::::::::::::::::::::::::::::::::::::::: 지난 달 어느 밤, 서울에서 자취하던 20대..."
1168,2016.05.12.,"현대건설, 다음달 '힐스테이트 동탄' 1479가구 분양","SRT(수서발 고속철도)ㆍGTX(수도권광역 급행철도, 2021년 개통 예정) 복합 환승역인 동탄역(예정) 및 중심상권, 서울ㆍ수도권 주요 업무지역 등으로의 접근성이 좋다. 올해 11월 개통을 준비하고 있는 SRT 이용 시..."
1169,2016.05.15.,배달앱에 '맛 없다' 후기 썼다고…욕설에 행패,"&lt;기자&gt; 한밤중에 걸려온 전화, 서울에서 홀로 자취를 하는 20대 여성 최 모 씨는 이 전화를 받고 겁에 질릴... 골목 상권의 모습마저 바꿔놓고 있습니다. (영상취재 : 유동혁, 영상편집 : 오영택, VJ : 김준호, 이종현) 김종원..."
1170,2016.05.12.,남대문 동대문 면세점경쟁 불붙어,신세계는 남대문시장상인회와 중기청 서울시 중구청과 손잡고 남대문 상권 살리기 프로젝트도 진행할 계획이다. 두타면세점은 배우 송중기를 모델로 선정하고 본격적인 마케팅 활동을 펼친다. 사진 두타면세점 제공...
1171,2016.05.10.,고척스카이돔 일대 먹자골목 살린다,"-구로구, 15일 ‘차없는 거리’ 운영에 각종 행사 마련 “야구도 보고, 데이트도 하고 먹고, 즐기자.” 서울 구로구(구청장 이성)가 고척스카이돔 일대 지역 먹자골목 상권 살리기에 나섰다. 구로구는 고척스카이돔..."
