,date,title,contents
1584,2016.05.10.,"구로구, 고척스카이돔 일대 상권 살린다","걷고, 먹고, 즐기고!"" 서울 구로구가 고척스카이돔 일대 지역 먹자골목 상권 살리기에 나섰다. 구는 10일 지역의 랜드마크가 된 고척스카이돔 인근 상권에 활력을 불어넣고, 야구 관람객들에게 보고 즐길 수 있는..."
1585,2016.05.16.,‘쿼바디스’ 박원순 재개발 사업…‘냉탕온탕’ 일관성 결여,"추진한다""며 ""서울시내 개발의 축이 강남권으로 넘어온 측면이 있다. 선택과 집중이라는 측면에서는 공감가는 부분이 있지만 형평성에 문제가 있다""고 말했다. 주변 지역 상권 위축도 고려해야 한다는 지적이 나온다...."
1586,2016.05.01.,"롯데자산개발, 롯데피트인 2호점 2일 오픈","롯데피트인 산본’은 이를 바탕으로 지역상권의 중심지 역할을 하는 ‘로데오거리’와 어우러져... 이와 함께 강남, 홍대 등 서울지역 유명맛집을 포함한 먹거리 브랜드가 새롭게 들어서면서 산본지역의 새로운..."
1587,2016.05.17.,"용산구, 면세점서비스 전문인력 양성 등 대응","(서울=국제뉴스) 정여주 기자 = 최근 용산역 HDC신라면세점이 루이비통 매장 유치를 확정한 가운데 용산구가... 또 이태원, 경리단길, 한남동을 중심으로 세계음식, 패션 관련 상권이 날로 커져가고 있다. 미군기지가..."
1588,2016.05.03.,제1회 신촌 뷰티 페스티벌 열어,"공모’에서 서울 대표축제로 선정됐다. 구는 ‘신촌 뷰티 페스티벌’을, 화장품가게와 헤어숍이 많은 신촌 상권 활성화에 기여하고 봄 여행주간에 남녀노소 누구나 즐길 수 있는 콘텐츠로 꾸몄다. 신촌 연세로..."
1589,2016.05.06.,"소자본 카페창업, 성공확률 높여주는 체크리스트 공개","프랜차이즈 서울에서 참관자를 대상으로 실시한 설문 결과, ‘카페’가 창업 희망업종 1위에 올랐다. 초보... 전문가 도움은 필수 시장동향·상권분석·인테리어·메뉴개발 등 창업 성공을 위한 핵심분야일수록 정보와..."
1590,2016.05.11.,양산시 지방규제개혁 평가 2년 연속 기관표창,"양산시는 지난 10일 정부 서울청사에서 개최된 '2015 지방규제개혁 유공자 및 우수지자체 시상식'에서... 내 상권 활성화를 위해 중앙부처에 관련 법령 개정을 건의, '국토의 계획 및 이용에 관한 법률 시행령'의 개정을..."
1591,2016.05.17.,[좋은 아파트] '흑석뉴타운 롯데캐슬'…흑석동 6년만에 신규 분양,흑석뉴타운 롯데캐슬 에듀포레 투시도 ⓒ롯데건설 [EBN 서영욱 기자]롯데건설이 서울시 동작구 흑석동에서... 단지와 인접해 중앙대학교 병원이 있으며 중앙대 앞 다양한 상권과 농협 하나로마트가 가까워 생활인프라...
1592,2016.05.11.,‘C-페스티벌 2016’ 폐막..1600억원 경제파급 효과 거둬,"KID는 이번 ‘C-페스티벌 2016’이 강남 MICE 관광특구 및 MICE산업의 발전, 지역상권 소득창출에 따른 세수 증대 등 지역경제 활성화에 많은 기여를 했고 서울과 강남 MICE 관광특구를 세계에 알리는 홍보 효과를..."
1593,2016.05.01.,"[유통업계 핫이슈 핫현장(13)] 롯데피트인 산본점, 지역상권과 함께하는 '지역...",지역 상권과의 상생을 콘셉트로 삼은 '지역친화형 쇼핑몰'이 2일 문을 연다. 이곳에는 패션 편집숍을... 서울 동대문점에 이어 두번째로 문을 여는 '롯데피트인 산본'은 지하철 4호선 산본역 2번 출구 인근에 자리잡고...
1594,2016.05.03.,"롯데건설, ‘흑석뉴타운 롯데캐슬 에듀포레’ 545가구 이달 분양",‘흑석뉴타운 롯데캐슬 에듀포레’ 단지 투시도 [이미지=롯데건설 제공] 롯데건설이 서울시 동작구... 단지에 인접하여 중앙대학교 병원이 있으며 중앙대 앞 다양한 상권과 농협 하나로마트가 가까워 생활인프라...
1595,2016.05.11.,"악뮤 이수현 “데뷔후 겉멋들어 ‘중2병’ 사춘기, 오빠 잔소리에 겸손함 찾아...",두 사람 모두 5월11일 오후1시 서울 마포구 YG엔터테인먼트 사옥에서 진행된 인터뷰에서 2년이라는 결코 짧지... 악동뮤지션은 '사춘기' 상권에 이어 올해 내로 발매될 예정인 '사춘기' 하권을 통해 활발한 활동을 이어간다....
1596,2016.05.07.,삼성전자 수원 이전 수혜 한양수자인 호매실 눈길,업계 관계자는 “삼성이 들어서면 그 일대 주택수요가 늘고 도시 기반시설과 상권이 활성화될 가능성이... ‘한양수자인 호매실’ 옆 호매실IC가 위치해 과천-봉담간 고속도로를 이용하기 편리하며 빠르게 서울...
1597,2016.05.08.,삼성~ 잠실 매머드급 강남개발.. 기대심리 급상승,"마땅한 상권이 없어 신천으로 수요가 몰린 것으로 분석된다""면서 ""삼성동은 그동안 큰 이슈가 없었던 만큼 신규 개발로 유동인구가 늘어나면 임대료 상승 여지가 있다""고 설명했다. 박 센터장은 이어 ""서울시가..."
1598,2016.05.10.,[부고종합] 노연상씨(경동원 대표이사) 모친상 외,"■이춘영씨 별세, 노연상(경동원 대표이사)·상권(광주정형외과의원 원장)·주원·혜경씨 모친상, 원봉희(김앤장 법률사무소 변호사)·김재관씨(서울대 교수) 장모상 = 8일, 삼성서울병원, 발인 11일 오전..."
1599,2016.05.10.,에너지 실크로드+문화관광도시…경주의 환한 미래,또 본사이전을 하면서 서울 사무실도 전부 폐쇄했다. 서울로 업무 보러 가는 직원들이 사무실이 없어... 경주시는 경주의 교통`관광`상권`학교`병원 등 생활안내 책자와 경주 관광안내지도 1천500여 부를 나눠주며 빠른...
1600,2016.05.16.,상가 임대시장 재편…상암 `들썩`·강남역 `주춤`,""" 광화문과 함께 서울의 중심상권으로 꼽히는 강남역은 임대료가 올들어 하락했습니다. 올해 1분기 강남역 상가의 3.3㎡당 월 임대료는 14만2천 원으로 지난해 4분기(15만4천 원)보다 8% 떨어졌습니다. 강남역의 대표적인..."
1601,2016.05.14.,"각종 후원에 골목상권 대상...탐앤탐스, 사회공헌 '활발'",골목상권 대상을 수상하는 등 기업의 사회적 책임과 역할 수행에 앞장서고 있다. 업체에서 전해온 관련... '제24회 서울국제휠체어마라톤대회'에 후원품 전달 이에 앞서 탐앤탐스는 지난달 30일 잠실종합운동장에서...
1602,2016.05.12.,"이개호 의원, 유두석 장성군수, 국토부 장관에 ‘KTX 장성역 정차’ 건의",장성군은 11일 유두석 장성군수가 이개호 국회의원과 함께 국토교통부 서울사무소를 방문해 강호인... 지역상권 침체를 상세히 전하면서 고속열차 정차 필요성을 강조했다. 이어 오는 하반기 개통 예정인 수서발...
1603,2016.05.11.,대형유통업체는 골목상권 '저승사자'…매출 '뚝',[중소기업신문=박진호 기자] 대형유통업체는 골목상권에게 저승사자라는 속설이 또 다시 입증됐다.... 지난 2014년 서울시립대 성낙일 경제학부 교수의 '대형 유통업체의 시장진입과 소매업종별 사업체 수의 변화...
1604,2016.05.15.,중소시장까지 노리는 대기업..어디까지 진출할 것인가?,카메라) (서울=국제뉴스) 하성인 기자 = 골목 상권까지 노리는 대기업의 문어발식 기업 확장은 과연 서민 들의 생활속 어디까지 파고 들것인가? 원활한 경제 활동을 이야기 할때 우리는 대기업만이 아니라 중소기업이나...
1605,2016.05.02.,하남돼지집 압구정직영점 오픈... 직영점 10개 돌파,"2010년 6월 본점을 개업한 하남돼지집은 ‘허브앤스포크 전략’에 입각해 경기도 하남과 강남(대치동,논현동), 종로, 강북(노원) 등 서울 시내 주요 거점상권에 집중해 직영점(허브)을 개설하고 그 지역을 중심으로..."
1606,2016.05.02.,금강주택 IT 기업들을 위한 복합공간 오픈,"밀집해 상권이 형성될 것으로 예상된다고 부동산 전문가들은 말한다. 입주 자금이 부족한 업체들을 대상으로 총 분양가의 70~80% 융자 혜택을 제공하는가 하면, 취득세와 등록세도 50% 감면해준다. 특히 서울, 인천 등..."
1607,2016.05.02.,"서초구, 주 1회 구내식당 휴무...지역상권 살린다",서울 서초구는 지역상권 활성화를 위해 매달 1회 구내식당을 휴무하는 '외식의 날'을 이달부터 매주 1회로 확대한다고 밝혔습니다. 이번 결정은 한국외식업중앙회 서초구지회가 제안하고 조은희 구청장이 수용하면서...
1608,2016.05.10.,"원희룡 지사, 2년 연속 '대한민국 유권자 대상' 수상","골목상권살리기소비자연맹, 한국시민사회연합 등 290여 직능․소상공인단체와 시민사회단체가 공동으로 실시하고 있다. 수상자는 원희룡 제주지사를 비롯해 박원순 서울시장, 남경필 경기지사, 국회의원, 기초자치단체장..."
1609,2016.05.15.,입주자는 봉?… 상가 관리비·계약 횡포에 '속수무책',현행 집합건물법 민사소송만 가능… 시대상 반영한 법률 개정 시급 50대 여성 약사인 A씨는 1994년 서울... 수익성이 좋은 영업 장소나 투자처를 찾는 수요가 엄청난 데 비해 목이 좋은 상권에 위치한 상가는 한정돼...
1610,2016.05.15.,입주자는 봉?… 상가 관리비·계약 횡포에 '속수무책',현행 집합건물법 민사소송만 가능… 시대상 반영한 법률 개정 시급 50대 여성 약사인 A씨는 1994년 서울... 수익성이 좋은 영업 장소나 투자처를 찾는 수요가 엄청난 데 비해 목이 좋은 상권에 위치한 상가는 한정돼...
1611,2016.05.09.,한동안 시들했던 주상복합 ‘다시 열풍 조짐?’,상업지역에 들어서는 주상복합 특성상 교통과 상권 면에서 일반 아파트가 따라잡기 힘든 강점을 무기로... 서울에서도 주상복합의 힘은 대단하다. 부동산114에 따르면 서울 광진구 자양동 주상복합인...
1612,2016.05.13.,[영상] 젠트리피케이션에 ‘뿔’났다!…19평땅 작은사옥의 반란,지난해 11월 서울에서 흔히 볼 수 있는 다세대 주택이 옹기종기 들어선 마포구 서교동 뒷골목에도 협소주택... 홍대 문화를 일군 많은 창작자에게 닥친 젠트리피케이션(동네 상권이 살아나면서 임대료가 치솟아 그 안에...
1613,2016.05.13.,갈 곳 없는 뭉칫돈 오피스텔로 몰려…,분양중이어서 주거와 상권이 형성되는 생활NEW타운으로 급부상 할 것으로 예상하였다. 나우뉴스부 nownews@seoul.co.kr 나우뉴스(nownews.seoul.co.kr) [페이스북] [군사·무기] [별별남녀] [기상천외 중국] - 저작권자 ⓒ 서울신문사 -
1614,2016.05.03.,대도시 상가 70.3% 권리금 낸다…평균 4575만원,서울은 서울역 상권에서 중대형상가 공실이 늘었고 도산대로·테헤란로 등은 공실이 일부 해소되는 등 중대형상가 공실률은 7.7%로 소폭(0.2%포인트) 올랐다. 주력산업인 조선업이 침체한 울산은 중대형상가...
1615,2016.05.11.,"인천관광公, 中 크루즈 관광객 입항 환영행사...'인천 관광상품' 출시 기념","공사 관계자는 “중국 관광객들이 단순히 서울의 면세점에서 쇼핑만 하고 가는 것이 아니라, 크루즈 관광이 인천 관광과 주변 상권을 활성화시킬 수 있는 계기를 만들겠다”고 밝혔다. 박은영 sos6997@empal.com"
1616,2016.05.04.,[사회] 편의점 전성시대? 점주들은 아우성!,많이 팔아도 재미 못 보는 담배와 커피 서울 서대문구 충정로에 위치한 한 편의점 주인은 “담배를 제외한... 담배 판매량과 상권에 따라 차등 지급된다고 하지만 정확히 어떤 조건이 적용되는지는 알지 못한다”고...
1617,2016.05.13.,상권도 이젠 '월화수목금금금',■ 비수기 없는 하이브리드 상권 = 업무ㆍ의료ㆍ관광 등이 결합한 하이브리드 상권도 주 7일 상권이다. 서울 동작구 사당동의 사당역 상권이 대표적이다. 이곳은 우성아파트와 래미안 아파트를 배후로 두고 있는 동시에...
1618,2016.05.09.,오늘의 부고 - 2016년 5월 10일,"■이춘영씨 별세, 노연상 경동원 대표이사·상권 광주정형외과의원 원장·주원·혜경씨 모친상, 원봉희 김앤장 법률사무소 변호사·김재관 서울대 교수 장모상=8일 삼성서울병원. 발인 11일 오전 7시30분 (02)3410..."
1619,2016.05.11.,"[악동뮤지션①] ""다양한 음악 스타일과 끊임없는 발전, 그게 악뮤의 색깔""","[스포츠서울 이지석기자] 악동뮤지션(찬혁, 수현)이 2년 만에 컴백, 활동을 시작했다. 지난 4일 새 앨범... -앨범 명 ‘사춘기 상권’에 대해 설명해 달라. 찬혁= 사춘기 당시 아이들 마음 뿐 아니라 사춘기 지난 사람들..."
1620,2016.05.10.,[실시간 현장]수익형 부동산이 뜬다! 강남 서초구 `아르누보시티`,"강남역은 서울에서 가장 큰 번화가들 중 하나로 쇼핑, 문화, 금융, 어학원, 병원, 미용, 호텔, 외식 등 수 많은 산업들이 밀집해 있다. 아르누보시티는 그런 강남역거리 바로 옆에 인접 해 있어 강남역 인근 상권을 이용하기..."
1621,2016.05.02.,건대·이대 상권 주춤…샤로수길·중앙대 뜬다,"2일 매일경제가 BC카드 빅데이터센터에 의뢰해 분석한 결과에 따르면 최근 3년 새 대학상권별 1인당 카드매출액 증가율에서 중앙대·서울대 상권이 각각 2위, 3위를 차지했다. 중앙대 상권은 올해 1분기 기준 1인당..."
1622,2016.05.20.,"롯데건설, 흑석동에서 6년만에 신규아파트…흑석뉴타운 롯데캐슬 이달 분양",[조원익 기자] 롯데건설이 서울 동작구 흑석동에서 이 달 견본주택을 열고 분양에 나선다. 롯데건설은... 단지에 인접해 중앙대학교 병원이 있으며 중앙대 앞 다양한 상권과 농협 하나로마트가 가까워 생활인프라...
1623,2016.05.17.,[기자석] 셧다운제 철폐와 경제유발효과,"셧다운제 폐지하려다 재벌이 골목상권을 침해하고 금산분리가 없어지고, 사람보다 영리가 먼저인 병원이 들어서며, 서울도심에 공장을 막 지어도 되는 그런 주장들에도 힘을 더해야 하기 때문이다. 단순히 우리에게 좋은..."
1624,2016.05.11.,온라인선 전국구로 뛴다...대구백화점의 O2O 전략,최근엔 서울이나 수도권 중심에서 지방으로 상권이 확대되는 추세로 롯대백화점 부산 서면점과 갤러리아 대전 타임월드점도 입점했다. 입점 효과는 나름 괜찮다는 평이다. 월 거래액을 살펴보면 지난해 3월 대비 현재...
1625,2016.05.15.,"‘더 젊게, 더 효율적으로’ 국내 스포츠업체 변신 시도","휠라코리아는 올봄에는 스포츠와 헤리티지를 강조한 신제품을 선보였으며 최근까지 서울을 비롯한 부산, 광주 등 전국 주요 도시 중심 상권에 대형 규모의 메가샵을 잇달아 여는 등 유통망을 재정비했다. 신제품..."
1626,2016.05.10.,"[베일속의 비상장사] ""참 싸쥬?""…백종원, 가격파괴로 골목상권 휘어잡았다",◆소비자 이익 vs 골목상권 침해 하지만 더본코리아를 질시의 시선으로 바라보는 사람도 없지 않다. 특히 ‘백종원 브랜드’와 경쟁해야 하는 자영업자들이 그렇다. 서울 지하철 4호선 혜화역 4번출구 인근에 빽다방이...
1627,2016.05.11.,'광명역세권태영 데시앙 스트리트 상가' 분양문의 이어져,"광명역 태영데시앙 조감도 [중소기업신문=김경호 기자] KTX 광명역 상권에 랜드마크 상업시설인 '광명역세권... 게다가 오는 2023년 개통을 목표로 신안산선 광명역이 예정돼 있어, 이 노선이 개통되면 서울 여의도는 물론..."
1628,2016.05.16.,[지금은 분양중]경기 하남 '현대 베스코아 센트럴 오피스' 분양(영상),여기에 2020년 하남시청역이 개통되면 서울과의 접근성은 더욱 개선될 것이라는 게 분양 관계자의 설명이다. 인근 상권은 ‘스타필드 퍼스트 하남’으로 명칭이 정해진 복합쇼핑몰이 도보 10분 거리에 있고...
1629,2016.05.03.,1분기 상업용부동산 공실률 소폭 상승…상가 권리금 평균 4500만원,"서울은 서울역 상권의 공실이 3.8%포인트 상승해 두드러진 반면, 도산대로와 테헤란로 상권 공실 일부가 해소되면서 전체적으로는 소폭 상승세를 유지했다. 조선산업 침체의 직격탄을 맞은 울산의 경우, 인근 상권..."
1630,2016.05.11.,"빙그레 바나나맛우유, 이색 공간 ‘옐로우 카페’ 살펴보니…“역발상 공략”",빙그레는 지난 3월11일 서울 중구 현대시티아웃렛 동대문점에 카페 형식 공간인 ‘옐로 카페’의 문을... 갈수록 부상하고 있는 이 지역 내 상권 성장성에 무게를 둔 듯하다. 또 현대아울렛 개점 외에도 두산 면세점이...
1631,2016.05.10.,'칙칙폭폭!' 열차 타고 가족 나들이 떠나볼까?,"서울 청량리역에서 출발하는 이 열차는 수~일요일과 정선장이 열리는 2ㆍ7일에 운영된다. 코레일, 팔도 장터... 1890년에 생긴 산골 재래시장으로, 전라ㆍ경상ㆍ충청 상권을 모두 아우르는 전통 5일장이다. 유서 깊은..."
1632,2016.05.10.,「플마제」 글로벌로 Go~,이 회사는 서울 강남 등 핵심 상권 진출을 대비해 ‘블랙라벨’의 추가 상품 개발에 들어갔다. 지금의 매장 콘셉트도 로고 플레이를 보완해 적용할 방침이다. 탄탄한 준비를 거쳐 올해 하반기부터 ‘블랙라벨’ 단독숍도...
1633,2016.05.12.,소자본 성공창업의 허와실?... 2016 유망창업아이템으로 알아보는 창업의 시작...,메인 상권을 다 놓친 다음일 것이다. 창업을 생각하는 예비 창업자들은 유망 창업아이템을 찾아 발빠르게 움직여야 할 시점이다. 뉴미디어국 sjsj1129@sportsseoul.com [기사제보 news@sportsseoul.com] Copyright ⓒ 스포츠서울...
1634,2016.05.05.,"[V앱] 악동뮤지션, 앵콜 요청에 화답 '200% 열창'",5일 서울숲에서는 악동뮤지션의 새 앨범 '사춘기 상권'의 청음회가 열렸다. 이날 악동뮤지션은 새 앨범에 담긴 수록곡들을 들려주는가 하면 '사춘기' 삼행시를 하는 등 다양한 이벤트를 선보였다....
1635,2016.05.03.,중대형 상가 공실 채워지지 않네…1분기 공실률 10.6%,"서울(광화문, 종로, 홍대합정, 이태원 등), 부산(해운대), 대구(수성, 범어) 등 상권이 활성화된 지역이 두드러졌다. 대전(원도심), 강원(춘천), 충북(청주)은 기존 상권의 노후화 등의 영향으로 위축되면서 수익률이..."
1636,2016.05.12.,삼성반도체 길목상권 입지…‘동탄 헤리움’ 근린상가 분양,"분양 관계자에 따르면 ‘동탄 헤리움’ 근린상가는 삼성반도체 길목상권에 위치해 눈길을 끈다.... 경부고속도로, 용인서울 고속도로를 통해 서울 강남권으로 이동이 가능하다. 또한 봉담과천고속화도로..."
1637,2016.05.10.,[부고] 노연상씨 모친상 외,"■노연상씨(경동원 대표) 상권씨(경기 광주정형외과 원장) 주원씨 혜경씨 모친상, 원봉희씨(김앤장 변호사) 김재관씨(서울대 공대 교수) 장모상, 백혜진씨 유혜옥씨 시어머니상=8일 오후 1시 삼성서울병원..."
1638,2016.05.08.,"[성공창업, 상권을 보라] 상가 분양 창업 <상>","이를 목표로 상가를 분양받아 창업할 때에는 지역선정, 점포입지, 상권분석, 아이템 선정, 관리 등을 염두에... 권강수 창업부동산정보원 이사 ▶ '썸 타는' 특별한 뉴스~ '서울경제썸 페이스북' 바로가기~▶ 돈이 보이는 뉴스..."
1639,2016.05.16.,<어떻게 생각하십니까>고척돔구장 인근 상습 정체구간에 ‘車없는 거리’,"“교통대란 부추겨” vs “골목상권 회생책” 서울 구로구는 15일 고척돔구장 인근 고척동 52번지와 76번지 일대 ‘먹자골목’ 800m 구간을 차 없는 거리(보행전용거리)로 시범 운영했다. 이 지역은 안양천로, 고척교..."
1640,2016.05.16.,<어떻게 생각하십니까>고척돔구장 인근 상습 정체구간에 ‘車없는 거리’,"“교통대란 부추겨” vs “골목상권 회생책” 서울 구로구는 15일 고척돔구장 인근 고척동 52번지와 76번지 일대 ‘먹자골목’ 800m 구간을 차 없는 거리(보행전용거리)로 시범 운영했다. 이 지역은 안양천로, 고척교..."
1641,2016.05.10.,"수익형 부동산, 남양주 브릭스 타워 상가분양 실시","선임대 후분양 방식은 임차인 특성이나 성향을 미리 파악할 수 있고 투자 전에 상권 및 임대 활성화 정도를... 서울외곽순환도로와 인접해 있고 남양주 IC로 나와 다산신도시, 가운지구, 남양주 지금동, 도농동, 구리시의..."
1642,2016.05.10.,"구로구, 고척스카이돔 먹자골목 '차없는 거리'로",인근상권 살리기 총력 15일 넥센-두산 경기때 운영 [시민일보=이대우 기자]서울 구로구(구청장 이성)가 고척스카이돔 일대 지역 '먹자골목 상권 살리기'에 나섰다. 구는 지역의 랜드마크가 된 고척스카이돔 인근 상권에...
1643,2016.05.01.,"신세계, 강남 고속터미널에 전문 식당·쇼핑공간 오픈","- 유명맛집,드러그스토어 등 입점 신세계(004170)는 서울 강남 고속터미널에 위치한 복합쇼핑몰... 대형 상권이다. 신세계는 작년 이 곳에 복합쇼핑공간 ‘파미에스트리트’와 식음료 브랜드를 한데 모은 ‘파미에..."
1644,2016.05.01.,"롯데피트인, 군포시 산본에 2호점 열어",롯데피트인 산본은 지난 2013년 5월 롯데자산개발이 서울 동대문에 1호점을 낸지 3년만에 문을 연 패션전문쇼핑몰이다. 롯데자산개발은 새로운 패션과 다양한 먹거리를 앞세워 산본 지역상권에 맞는 지역밀착형...
1645,2016.05.20.,"“O2O 서비스, 소비자 편의와 사회적 가치 높여”",한국인터넷기업협회는 19일 서울 강남 인기협 엔스페이스에서 ‘O2O 산업 세미나’를 개최했다. 이날 행사에... O2O 서비스는 상권이 좋지 않아도 자신들의 매장을 쉽게 알릴 수 있다”고 밝혔다. 이어 “해외에서는...
1646,2016.05.02.,[5/2] 주간 오피스 시세 및 추천 임대 물건,"인근에 롯대캐슬, 트라팰리스 등 아파트와 오피스상권이 밀집 해있어 배후수요도 풍부한 것으로 보여진다. ◆ 서울 몽촌토성역 사무실임대 위치 : 8호선 몽촌토성역 도보 1분 거리. 층수 : 지하 4층/지상 19층 규모...."
1647,2016.05.10.,경의선 숲길공원 완공 앞두고 '숲세권' 부동산 '들썩',이달 말 서울 용산구와 마포구 일대를 지나는 경의선 숲길공원이 전 구간 완공을 앞두고 주변... 늘었다”며 “상권이 형성되면서 권리금과 임대료도 상승 중”이라고 말했다. 주거 환경이 쾌적해지면서 주변...
1648,2016.05.10.,[高임대료의 역습]② 돈이 만든 상권 오래 못가…뜨는 상권엔 문화와 개성 녹...,고준석 신한은행 PWM프리빌리지 서울센터장은 “상권을 형성하고 활기를 이어가기 위해서는 그 지역만의 문화와 특색을 갖추는 것이 상당히 중요하다”며 “대학로나 홍대 상권이 오랜 기간 유지된 것은 확실한 특색이...
1649,2016.05.04.,"악동뮤지션, 새 앨범 ‘사춘기 上권’으로 컴백···전곡 이찬혁 작사·작곡",‘사춘기’는 상권과 하권으로 나눠 두 번에 걸쳐 발표될 예정이다. ‘上권’ 앨범의 타이틀곡은 ‘리-바이... 한편 악동뮤지션은 앨범 발매 다음 날인 오는 5일 어린이날 서울 성동구 서울숲 야외무대에서 새 앨범...
1650,2016.05.16.,특수상권 분석 및 입점 노하우 전달 ‘프랜차이즈 특수상권 전문가 과정` 18일...,서울 경기지역 'B 특수상권'인 터미널내 500평 규모내 비즈니스센터와 키즈카페 와 김밥전문점 창업 및 일부 외식업 입점이 가능한 터미널내 상업시설 MD 구성을 하고 있다. 'C 특수상권'인 영화관내 매표소층 상업시설에...
1651,2016.05.10.,[불법체류 20만 시대]韓中 공존의 공간..'리틀 차이나' 대림중앙시장,"중국인, 조선족들을 중심으로 상권이 몰려 있어 ‘서울 속의 작은 중국’,‘중국인 거리’로 불린다. 김보영 기자 서울 지하철2·7호선 대림역 12번 출구를 나서는 순간 생소한 향신료 냄새가 코끝을 찔렀다. 한자와..."
