,date,title,contents
823,2016.08.24.,"광교신도시 호수공원 상가, 소득수준 높고 유동인구 풍부해 '프랜차이즈 입점...",등 상권 활성화에 긍정적인 영향을 미치는 경우가 많다. 안정적인 운영을 위해 장기 임차하는 경우가 빈번해... 아울러 용인-서울 고속도로와 경부고속도로가 오는 2018년 연결될 예정으로 자가용을 통한 강남 진출입...
824,2016.08.19.,문정8-5블럭 시행사 이레도시개발-비상대책위 법정다툼!,"ⓒ김충열 정치전문기자 서울 송파구 문정동 법조단지는 2017년까지 동부지방법원, 동부지방검찰청... 경제중심지, 상권 활성화에 크게 기여할 것으로 기대된다”고 밝혔다. 시행사인 이레도시개발(조합장 이복희)과..."
825,2016.08.21.,[천안시] 불당 더다움프라자 본격분양,[대전 중도일보] 천안 우수향토기업인 활림건설이 최근 불당신도시 최고 중심상권에 '더다움프라자'를 본격... 아울러 북천안IC의 개통으로 서울까지 1시간대 진입할 수 있으며 번영로를 통한 천안...
826,2016.08.04.,"우이~신설동 경전철, 개통 눈앞서 '올스톱'",우이신설선은 하루 최대 13만여명이 이용할 것으로 예상되는 노선으로 강북지역 수요자와 인근 주택시장 및 상권에 타격이 불가피할 전망이다. 4일 서울시와 건설업계에 따르면 우이신설선 공사 손실 부담과 운영...
827,2016.08.17.,"[대한민국 도시 이야기-청주] ""기업 천국 넘어 살기 좋은 명품도시로 도약하길...",도시브랜드가 경쟁력이다 - '바이오·IT 특별시' 청주 (하) 내 고향 청주 유영희 명동르와지르호텔더파인서울... 그는 “고층 아파트가 들어서고 대형 상권이 조성된 대농지구와 오송생명과학단지를 보면 감탄할 때가...
828,2016.08.02.,‘카카오드라이버’ 기사-업체 갈등 법정으로,"1일 서울중앙지방법원에 냈다”고 2일 밝혔다. 기존 업체가 ‘카카오드라이버’를 이용하는 대리운전... 골목상권 침해, 사업 확장 등으로 논란을 빚어 왔다. 특히 일부 대리운전 업체는 ‘카카오드라이버’를 이용하는..."
829,2016.08.09.,"강남 카카오프렌즈스토어, 한 달만에 45만명 방문",서울 강남역 중심상권에 위치한 카카오프렌즈 플래그십 스토어 강남점은 카카오프렌즈의 17번째 매장이자 첫 번째 로드샵이다. 카카오프렌즈의 18개 매장 중 가장 큰 규모를 자랑한다. 윤민섭 한경닷컴 게임톡 기자...
830,2016.08.02.,특전사 이천 시대 개막...경제효과 연 1천억원 기대,육군 특수전사령부는 44년간의 서울 거여동 시대를 마감하고 이천시에 새롭게 자리를 잡았다. /사진=뉴스1... 특히 월 1회 이상 간부들의 영외 점심식사를 권장해 지역상권 활성화에도 앞장 서는 동시에 장애인 복지시설...
831,2016.08.10.,준비는 끝났다…유통 빅3 ‘강남大戰’,(非) 서울권임에도 압구정점ㆍ무역센터점을 제치고 ‘강남대전’의 핵심 변수가 될 가능성이 높다. 백화점업계 관계자는 “유통 빅3 모두 강남상권을 장악하겠다는 의지가 강한만큼 삼자간 진검승부가 본격화할 것”...
832,2016.08.04.,"소상공인, 대기업 갑질 폭로…대책마련 요구","서울 남서부수퍼마켓협동조합 이윤근 이사장은 ""대기업의 골목상권 위협은 어제 오늘의 이야기가 아니다""라며 ""롯데의 다이소나 CJ올리브영 등과 같이 변형된 유통 체인을 보급하는 것은 대기업답지 않은 눈속임이고..."
833,2016.08.09.,'골목상권자영업자 사드 배치 지지',한국자영업자총연대 소속 단체장들이 9일 오전 서울 중구 프레스센터에서 열린 '골목상권자영업자 생존권 보호를 위한 사드 배치 지지 선언 기자회견'에서 사드 배치를 환영하는 피켓을 들고 있다. 2016.8.9...
834,2016.08.09.,"금강제화 레스모아, 국내 최초 스포츠 퍼포먼스 멀티숍 ‘NEXTEP’ 오픈","멀티숍이다”며 “앞으로 서울 명동을 중심으로 홍대, 영등포, 대전, 대구, 부산 광복동 등 각 지역 핵심상권에 지속적으로 확장해 나갈 계획""이라고 말했다 ▶ 시원하고 화끈하게 fn파스 ▶ 속보이는 연예뉴스 fn스타"
835,2016.08.16.,현대건설 ‘디에이치 아너힐즈’ 분양승인 완료…19일 견본주택 오픈,"또한 개포동역 주변에 산업은행, 치과, 이비인후과, 편의점, KB국민은행을 비롯해 다양한 상권이 즐비하다.... 디에이치 아너힐즈의 견본주택은 양재역 힐스테이트 갤러리(서울시 강남구 도곡1동 914-1) ‘3층 THE H Gallery..."
836,2016.08.12.,‘문 열고 냉방영업’ 43개 매장에 경고장,"산업통상자원부는 서울 명동 등 전국 14개 상권에서 문을 열고 냉방영업을 하는 업소를 단속한 결과, 43개 매장에 경고장을 발부했다고 밝혔습니다. 이번 단속은 산업부를 비롯해 지방자치단체와 에너지공단이 함께..."
837,2016.08.09.,"미래부-문화부, 과학기술+스포츠 융합 모색","주변 상권활성화를 지원하는 내용의 ‘스마트 스타디움’구축 구상을 소개했다. 스포츠마케팅기업인... / [서울경제 바로가기] [인기포토로 보는 오늘]으랏차차 대한민국! Ola 리우! 저작권자 ⓒ 서울경제, 무단 전재 및..."
838,2016.08.11.,동네 빌딩 사들이는 연예인들,주변 상권과 동네 상황을 잘 아는 데다 유명 광역상권에 비해 가격도 저렴한 까닭이다. 11일 원빌딩과 빌딩매매업계에 따르면 빅뱅의 태양(본명 동영배)은 서울 한남동 순천향대병원 인근 건물(사진)을 77억5000만원에...
839,2016.08.02.,"카카오 드라이버, 업무방해 업체 가처분 신청","- 대리기사 4인, 서울지법에 가처분 접수..카카오는 법리적 지원 카카오(035720)의 대리운전 서비스... 기존 대리운전 업체들은 카카오 드라이버의 진입에 ‘골목 상권 침해’라며 반발했다. 일부 대리운전 업체들은 소속..."
840,2016.08.02.,"카카오 드라이버, 업무방해 업체 가처분 신청","- 대리기사 4인, 서울지법에 가처분 접수..카카오는 법리적 지원 카카오(035720)의 대리운전 서비스... 기존 대리운전 업체들은 카카오 드라이버의 진입에 ‘골목 상권 침해’라며 반발했다. 일부 대리운전 업체들은 소속..."
841,2016.08.19.,"대우조선해양, 마곡부지 어쩌나","서울시는 지난 6월 대우조선해양 마곡부지에 대한 사업계획서를 받는 2차 공고를 냈지만, 신청자 없이... 지금처럼 답보상태가 이어진다면, 함께 개발되는 주변 상권 및 주거지역에도 타격을 줄 수밖에 없을 전망이다."
842,2016.08.16.,변하는 부동산 증여 문화,"지하철 5호선 미사역이 2018년 개통을 앞두고 있고, 서울외곽순환고속도로, 올림픽대로 등을 통한 타... 희소가치 높은 광장형 상가로 미사강변도시중심상권의 핵심에 위치한다. 특히, 입지적으로 5호선 미사역..."
843,2016.08.19.,"형우모드, 스위트홈 편집샵 확대 가속",목동은 서울 서부지역 최고상권 중심지로 프리미엄 베딩 상품을 중심으로 꾸며졌다. 스위트홈은 유럽의 가치 있는 라이프스타일 브랜드를 엄선 구성한 수입베딩 편집샵이다. 스위트홈에는 덴마크 유명...
844,2016.08.19.,송도 더블역세권 중심상가에 투자자 '눈길',"아라플라자는 센트럴파크역과 인천대입구역이 인접한 더블 역세권이며, 제2·3경인고속도로와 서울외곽순환고속도로, 인천공항고속도로의 접근성이 높아 일주일 내내 유동인구로 붐비는 복합상권으로 발달할..."
845,2016.08.16.,기준금리 1.25% 시대…용인 오피스텔 등 수익형 부동산에 투자 몰린다,특히 신설되는 서울-세종고속도로(예정)가 개통되면 서울 접근성은 더욱 개선될 전망이다. ◆ 로데오상권의 다양한 생활인프라 누려.. 주거환경도 ‘쾌적’ ‘용인 웰메이드시티337’은 지역 핵심 로데오거리 상권과...
846,2016.08.09.,"레스모아, 스포츠 퍼포먼스 멀티숍 `넥스텝` 열어","레스모아는 넥스텝 매장을 홍대, 영등포, 대전, 대구, 부산 광복동 등 각 지역 핵심상권으로 확대할 계획이다. 오는 12일 서울 명동에 문을 여는 스포츠 퍼포먼스 멀티숍 '넥스텝' 외관 &lt;레스모아 제공&gt; /SNS 바로가기"
847,2016.08.15.,"""재난안전특교세 10억 확보""","[서울=충청일보 김홍민기자] 새누리당 권석창 의원(제천·단양)은 15일 재난안전특별교부세 10억원을... 건립사업 3억원, 제천고추시장 주변 상권 활성화사업 12억원 등 19억원의 행정자치부 특별교부세를 확보했었다."
848,2016.08.24.,트리플 역세권 '신촌 이대역 영타운 지웰 에스테이트' 선착순 분양,"또한 광역 및 시내버스 노선이 풍부해 서울 전역 및 수도권 여러 지역으로 이동하기 쉽다. 여기에 신촌로, 강변북로, 내부순환도로 등이 가까이 있어 자동차를 이용해 타 지역으로 이동하기 편하다. 신촌∙이대상권의..."
849,2016.08.22.,[Real Estate] 전용 85㎡ 넘어도 좋다? 중대형 아파트의 부활-복층·희소성·...,"특히 서울에서 이런 현상이 두드러진다. 국토교통부에 따르면 전국에서 전용 85㎡를 초과하는 아파트... 이들 지역은 2호선 신촌역과 일대 상권을 이용할 수 있는 것이 공통점이지만 신수동은 평지, 대흥동은..."
850,2016.08.16.,[Who Is?] 이갑수 이마트 대표이사,2015년 9월14일 산업통상자원위원회 중소기업청의 국정감사에 골목상권 침해 논란과 관련해 일반증인으로... 홍익표 국회 가습기살균제 특위 위원(더불어민주당)은 7월27일 서울 성동구 이마트 본사에서 열린...
851,2016.08.01.,"음반 소매상과 갈등 빚던 현대카드, 상생방안 마련",서울 이태원에 레코드판(LP) 판매 매장을 내 음반 소매상과 갈등을 빚었던 현대카드가... 그러자 전국음반소매상연합회 등 음반 소매상들은 대기업인 현대카드가 골목상권 영역을 침범한다며 매장 앞에서 시위를 했고...
852,2016.08.12.,전통과 미래의 공존…'사람중심 명품도시' 도약 이끈다,김영종 종로구청장이 11일 오후 서울 종로구청 집무실에서 뉴스1과 인터뷰를 하고 있다. 2016.8.11/뉴스1 ⓒ News1... 지역상권이 살아나고 보행환경도 더 좋아졌다. 현대적인 초고층 빌딩과 청진동의 옛 흔적을 되살린...
853,2016.08.12.,‘문 열고 냉방영업’ 43개 매장에 경고,"［메디컬투데이 신현정 기자］ 산업통상자원부는 11일 서울 명동을 비롯한 강남역, 가로수길 등 전국 14개 상권을 대상으로 산업부, 지자체, 에너지공단이 참여하는 1차 합동단속을 실시해 문을 열고 냉방영업을 한..."
854,2016.08.18.,신도시 부동산 투자 어떻게 해야 하나!,(서울=국제뉴스) 주성진 기자 = 신도시 부동산투자는 타이밍이라 말하는 분들이 많다. 한창 뜨고 있는 광교... 하지만 신도시 내에서도 상권의 급은 천차만별이다. 강남 접근성으로 2기 신도시 중 가장 핫 한 지역인...
855,2016.08.09.,"롯데, ""협력사에 추석대금 8000억 조기 지급""","서울 중구 롯데그룹 본사 ⓒ뉴시스 (시사오늘, 시사ON, 시사온= 최정아 기자) 롯데그룹이 다음달 추석을... 모든 근로자 12만명에게 상품권이 지급될 것""이라며 ""지역 상권이 활성화될 것으로 기대하고 있다""고 밝혔다."
856,2016.08.18.,"저금리 시대, 배후수요, 환금성 풍부한 주거지 오창 “서청주 엘파크” 눈길",서청주 엘파크는 충청북도 청주시 청원구 오창읍 양청리 821-1번지 오창과학산업단지내 중심상권에... 개통예정인 서울~세종고속도로를 이용해 청주권과 세종권으로의 진입이 수월해질 것이다. 전용률이 60%로 기존...
857,2016.08.11.,"이디야커피, 영남권 매장 400개소 돌파","서울 본사와 영남권을 연결해 주는 교두보 역할을 하며, 2011년 33개에 불과했던 운영매장 수를 400개에... 떠오르는 상권 위주로 영남지역에 대한 출점을 강화 해 나갈 예정이다. 영남지역은 수도권을 제외한 최대..."
858,2016.08.02.,'카카오드라이버' 둘러싼 기사-업체 갈등 법정으로,"1일 서울중앙지방법원에 냈다""고 2일 밝혔다. 기존 업체가 '카카오드라이버'를 이용하는 대리운전 기사에게... 골목상권 침해, 사업 확장 등으로 논란을 빚어 왔다. 특히 일부 대리운전 업체는 '카카오드라이버'를 이용하는..."
859,2016.08.17.,안상수 창원시장 '문화의 밤' 행사 검토 지시,"안 시장은 이날 ""서울시는 해마다 도심일원에서 '서울문화의 밤' 행사를 개최하고 있는데 주요행사로... 주변 상권의 활성화에도 도움이 될 것이다. 또한 시청 전광판을 활용한 영화관람이나 예술공연 감상을 할 수..."
860,2016.08.09.,한국자영업자총연대 '사드배치 지지',한국자영업자총연대 회원들이 9일 오전 서울 중구 프레스센터에서 열린 '골목상권자영업자 생존권 보호를 위한 사드 배치 지지 선언 기자회견'에서 사드 배치를 환영하는 피켓을 들고 구호를 외치고 있다....
861,2016.08.12.,"정부,문열고 냉방영업 단속..43개 매장 경고..",산자부는 어제 서울 명동 등 전국 14개 상권에서 2천 350개 매장을 대상으로 지자체 등과 합동점검을 벌여 문을 열고 영업하는 43개 매장을 적발해 이같이 조치했습니다. 정부는 경고장이 발부된 43개 매장이 다시 위반할...
862,2016.08.18.,출퇴근 편리한 강남 30분대 아파트 분양 각축전,동탄2신도시 2차 동원로얄듀크 투시도 [이뉴스투데이 최형호 기자] 서울 강남권역을 30분대로 닿을 수 있는... 단지가 위치한 수지구 성복동은 교통ㆍ교육ㆍ상권 등을 모두 갖춘 주거지역으로 북측으로 판교신도시와...
863,2016.08.31.,여전히 유모차는 갈 수 없는 삼성역 계단,"기자】 서울 지하철 2호선 삼성역에서 가장 많은 인파가 오가는 곳은 5·6번 출구 방향으로 난 길이다. 이 길은 코엑스, 공항터널, 현대백화점, 호텔 등 시설로 가는 가장 빠르고 편한 길이다. 지역 상권에 밝은 이들에..."
864,2016.08.03.,"OK저축은행, 대한미용사회중앙회와 업무협약 체결",송인석 OK저축은행 전무(왼쪽)와 최영희 대한미용사회중앙회장이 서울 방배동 미용회관에서 업무협약 후... 대한미용사회중앙회는 소속 지회·지부와 OK저축은행 영업점 간 공동 마케팅을 통해 상권 활성화에 힘쓰기로...
865,2016.08.02.,육군 특전사 '이천시대' 개막…부대이전 기념행사,특전사가 44년간의 서울 거여동 시대를 마감하고 경기 이천시대를 열었다. 고공낙하하는 특전사 부대원.... 월 1회 이상 간부들의 영외 점심을 권장해 지역상권 활성화에도 앞장서기로 했다. hedgehog@yna.co.kr
866,2016.08.19.,"[기자의눈] 신사업 뛰어드는 제주항공… 투자일까, 모험일까",중국인 관광객을 겨냥해 우후죽순 들어섰지만 정작 이들은 서울 외곽에서 숙박을 해결하거나 호텔 외 다른 시설을 이용한다는 목소리가 다수였다. 다만 홍대는 명동상권과 달리 개별 여행객들이 많아 호텔 이용률이...
867,2016.08.12.,[MK 이슈] 전기료 누진제에 네티즌 열받았다,국내 최대 상권인 강남 일대 임대료가 오르면서 원주민이 내몰리는 '젠트리피케이션'을 겪는 현상을 짚은... 하나투어 본사는 서울 종로구 공평동에 위치해 있다. 그러나 최근 신도림 노원 부평 왕십리 선릉 김포공항...
868,2016.08.19.,"총 1,230세대 '김포 한강 아이파크' 잔여세대 분양",있어 서울 도심지로 출*퇴근이 용이하다. 단지에서 도보거리에 위치한 김포도시철도 구래역을 이용시... 최대 상권지역인 구래동 중심상업지역도 도보거리에 위치해 이마트 병원등 생활편의시설 이용이 편리하다....
869,2016.08.18.,간절곶 '포켓몬고' 특수로 하루 방문객 500→9천명 급증,"포켓몬고 열풍이 지역상권 활성화에도 큰 도움이 되는 것으로 분석됐다. 18일 울주군에 따르면... 울주군이 안내소 방문객을 표본 조사한 결과 울산 인근 부산, 대구, 양산뿐만 아니라 서울과 경기 등 수도권의..."
870,2016.08.19.,"[기자의눈] 신사업 뛰어드는 제주항공… 투자일까, 모험일까",중국인 관광객을 겨냥해 우후죽순 들어섰지만 정작 이들은 서울 외곽에서 숙박을 해결하거나 호텔 외 다른 시설을 이용한다는 목소리가 다수였다. 다만 홍대는 명동상권과 달리 개별 여행객들이 많아 호텔 이용률이...
871,2016.08.12.,[MK 이슈] 전기료 누진제에 네티즌 열받았다,국내 최대 상권인 강남 일대 임대료가 오르면서 원주민이 내몰리는 '젠트리피케이션'을 겪는 현상을 짚은... 하나투어 본사는 서울 종로구 공평동에 위치해 있다. 그러나 최근 신도림 노원 부평 왕십리 선릉 김포공항...
872,2016.08.19.,"총 1,230세대 '김포 한강 아이파크' 잔여세대 분양",있어 서울 도심지로 출*퇴근이 용이하다. 단지에서 도보거리에 위치한 김포도시철도 구래역을 이용시... 최대 상권지역인 구래동 중심상업지역도 도보거리에 위치해 이마트 병원등 생활편의시설 이용이 편리하다....
873,2016.08.18.,간절곶 '포켓몬고' 특수로 하루 방문객 500→9천명 급증,"포켓몬고 열풍이 지역상권 활성화에도 큰 도움이 되는 것으로 분석됐다. 18일 울주군에 따르면... 울주군이 안내소 방문객을 표본 조사한 결과 울산 인근 부산, 대구, 양산뿐만 아니라 서울과 경기 등 수도권의..."
874,2016.08.17.,초역세권 아파트 '고덕 그라시움' 후끈,"상권도 지하철 역을 중심으로 발달하기 때문에 단지 인근에 쇼핑·문화·편의·교육시설 등 풍부한... ‘고덕 그라시움’은 서울시 강동구 고덕동 217에 고덕주공2단지를 재건축한 단지로 지하 3층~지상 35층, 53개동으로..."
875,2016.08.09.,"레스모아, 스포츠 퍼포먼스 멀티숍 'NEXTEP' 오픈","12일부터 서울 명동에 2층 규모로 운영 1층 여성 퍼포먼스 멀티숍, 2층 슈즈 편집숍 마련 아시아투데이... 광복동 등 각 지역 핵심상권에 지속적으로 확장해 나갈 계획”이라고 말했다. 박병일 bipark@asiatoday.co.kr"
876,2016.08.16.,"""수도권 마지막 신도시""..위례·미사·다산으로 몰리는 유통공룡","신도시는 상권의 척도를 결정하는 인구, 소득수준, 잠재력 등의 요소를 골고루 만족시킨다. 서울 강남과 고속도로로 20~30분 거리에 위치해 있다는 점도 한 몫한다. 경기 하남과 성남에 걸쳐 있는 위례신도시에는 오는..."
877,2016.08.25.,[MI특별기획 새내기면세점 차별화전략④] 두타 '동대문상권·SNS플랫폼' 활용,"또 서울시와 공동주최로 365패션쇼 개최, DDP 야시장, 100m 대형 워터슬라이드 DDP 써머 페스타 등 동대문을 알리는 행사를 후원하며 상권 활성화에 힘쓰고 있다. 지난 7월에는 중소기업청, 서울시, 서울중구청, 동대문..."
878,2016.08.18.,[한경매물마당] 광명시 역세권 상가 빌딩 등 8건,"(031)655-5599 평택 태양공인 김중식 ◆서울 강남구 역세권 코너 상가 빌딩=상권 발달된 지하철역 출구 도보 1분 거리 대지 285㎡, 연면적 880㎡의 지하 1층~지상 6층 건물. 보증금 6억원, 월 2200만원. 주변 시세..."
879,2016.08.08.,"현대산업개발, ‘신촌숲 아이파크’ 조경에 제이드가든 참여","신촌이대상권 등이 가까이 있다. 교육시설로는 서강초, 창전초, 광성중, 창전중, 광성고 등의 7개의 초·중·고 학교시설이 단지에서 1㎞ 이내에 자리 잡고 있다. 모델하우스는 서울시 마포구 신수동 95-5번지에 8월 중..."
880,2016.08.02.,"특전사, 경기 이천에 새 둥지, 109만평 야전부대 최대급","월 1회 이상 간부들의 영외 점심을 권장해 지역상권 활성화에도 앞장서기로 했으며, 장애인 복지시설과 양로원 봉사, 환경 정화활동, 학생 대상 안보교육도 지원하기로 했다. / [서울경제 바로가기] [인기포토로 보는..."
881,2016.08.17.,[시각] 시대착오적인 ‘유통업 때리기’,대규모 점포가 들어설 경우 해당 지역뿐 아니라 인접 시군구 상권에도 영향평가를 하는 내용의... 생활산업부 김희원 차장 heewk@sedaily.com [서울경제 바로가기] [인기포토로 보는 오늘]으랏차차 대한민국! Ola 리우! 저작권자...
882,2016.08.17.,희소가치 높은 택지지구 내 상업시설…'미사 푸르지오 시티' 주목,"뿐만 아니라 ‘미사푸르지오 시티’가 위치한 하남 미사강변도시 인근에는 대규모의 업무지구 및 상권이... 미사역을 이용하면 잠실역 10분대, 강남역 20분대로 이동할 수 있어 서울 접근성 또한 향상될 예정이다. ‘미사..."
883,2016.08.16.,좋은 재료가 곧 경쟁력이다,작년 5월 서울 지하철 2호선 서울대입구역 1번 출구 쪽에 182㎡(약 55평) 규모로 마미쿡 1호점을 개점했다.... 가격이 낮은 또 다른 이유는 골목상권 전략을 채택함으로써 점포 고정비와 운영비 부담을 덜었기 때문이다....
884,2016.08.08.,신촌숲 아이파크 단지 조경에 '제이드가든' 참여,"신촌이대상권 등이 가까이 있어 문화 및 편의시설을 쉽게 이용할 수 있으며 서강초, 창전초, 광성중, 창전중, 광성고 등의 7개의 초·중·고 학교시설이 단지에서 1㎞ 이내에 자리잡고 있다. 견본주택은 서울시 마포구..."
885,2016.08.28.,"[오늘밤TV] '먹거리X파일' 선인장 기생충, 연지벌레 추출물 코치닐 색소 햄·...",이는 주변 상권과의 문제가 발생하기 때문이라고. 실제로 정부에서 추산한 푸드 트럭 대수는 2천여 대에... 트럭의 현 실태를 먹거리x파일에서 취재해 보았다. 28일 오후 9시 40분 방송. [스타서울TV 이현지 기자/사진=채널A]
886,2016.08.16.,"'멘디-정재용-셀리오', 이적생 활약에 미소 짓는 울산",FC서울전에서 패한 데 이어 25라운드 성남FC전에서 비기며 두 경기 연속 승리를 챙기지 못했다. 상주는 최근... 지역 상권 발전에 기여하고 있다. '프렌즈샵 스폰서데이'를 맞이해 울산은 이날 경기를 관람하러 온 점주 등...
887,2016.08.18.,풍부한 배후수요 갖춘 ‘미사 푸르지오 시티’ 분양,"우선, 미사강변도시 인근에 약 48만㎡의 대규모 업무지구 및 상권이 개발 중으로 향후 서울 동부권 업무·상업·문화단지의 풍부한 배후수요를 흡수할 것으로 보인다. 상업∙문화∙비즈니스 등이 결합된..."
888,2016.08.09.,"코리아신탁, ‘용인 웰메이드시티337’ 오는 12일 견본주택 개관","특히 신설되는 서울-세종고속도로(예정)가 개통되면 서울 접근성은 더욱 개선될 전망이다. ‘용인 웰메이드시티337’은 지역 핵심 로데오거리 상권과 인접해 의료, 쇼핑, 문화, 행정 등 다양한 생활인프라를 누릴 수..."
889,2016.08.04.,하반기 3만5657가구 공급…10곳서 분양 격전 예고,"중도금 대출 규제 시행으로 분양 열기가 주춤할 것으로 예상됐던 재건축물량 서울 강동구 래미안 명일역... 두 곳 모두 2호선 신촌역과 일대 상권을 이용할 수 있고 신수동은 평지, 대흥동은 신수동 보다 지대가 높아..."
890,2016.08.11.,25일 SETEC서 ‘프랜차이즈창업박람회’ 개최,SETEC(서울무역전시컨벤션센터) 전관에서 열린다. 전시 규모는 총 360여개 부스(7948㎡)에 달하며 200여... 골목상권과 자영업자를 살리고 고용 및 부가가치를 창출하는 등 모두가 함께 성장하기 위해 프랜차이즈 산업이...
891,2016.08.02.,"롯데리아, 강동경희대병원 내 식음·편의시설 오픈","(사진제공=롯데리아)ⓒ News1 ""컨세션 사업 일환…2021년까지 운영"" ㈜롯데리아는 서울 강동경희대병원 내... 일 평균 2700여명의 환자와 병원 직원들이 오고 가는 상권으로 고객들이 선호하는 식음료 브랜드와..."
892,2016.08.09.,카카오프렌즈 플래그십 스토어 인기폭발!,주식회사 카카오프렌즈가 서울 강남역 중심상권에 공식 문을 연 카카오프렌즈의 첫 번째 플래그십 스토어 누적 방문객이 한 달 만에 약 45만명을 돌파해 일평균 1만 5000명의 소비자가 스토어를 다녀갔다고 밝혔다. 특히...
