,date,title,contents
408,2016.08.24.,현대차 노사 임금협상 잠정 합의안 마련···임금 피크제는 추후 논의,"현대차 관계자는 “파업 장기화에 따른 피해가 원청뿐만 아니라 부품업체, 지역 상권으로까지 확산되고... /울산=연합뉴스 [서울경제 바로가기] [인기포토로 보는 오늘]서울경제와 친해지는 가장 확실한 방법..."
409,2016.08.24.,"이바돔, 25일 SETEC서 열리는 프랜차이즈 박람회 참가",나누어 상권 맞춤 상담을 받을 수 있다. 올해 새롭게 런칭한 무한리필 전문점 ‘삼겹이야기’는 외식업계의 트렌드에 맞춰 이바돔이 야심차게 준비한 브랜드로 최소 투자로 최대 매출을 지향한다. 실제로 서울...
410,2016.08.17.,"남대문로 2층 한옥상가, 문화재 됐다",근대 초기 남대문로가 서울 중심 상권으로 자리매김한 곳임을 보여준다. 근대 이래 도시 한옥의 진화 과정을 확인할 수 있어 역사적 의미와 건축사적 가치도 크다. 단층 건물이 주류이던 상황에서 남대문로 일대에...
411,2016.08.23.,강남 대학가 상권 대이동,서울대입구역 인근 재래시장에서 낙성대 인헌초등학교 앞까지 이어지는 600여 m 길이의 샤로수길은 흑석동 중앙대 상권과 함께 강남권 대학가 대표 상권으로 다시 떠오르고 있다. 그간 전통적인 강북 상권으로 꼽히는...
412,2016.08.25.,인천 구월동 상가 ‘Link126’ 분양,"인천 절대상권으로 알려진 구월동 로데오거리 최중심 자리를 차지할 예정인데, 상가 인근에는... 부지 면적기준으로는 서울 잠실에서 개발하고 있는 ‘롯데월드타워&amp;몰(제2롯데월드)’의 1.5배에 달할 것으로..."
413,2016.08.22.,"더민주 전대 D-5…김상곤·추미애, '직능인' 표심 공략","김종인 더불어민주당 비상대책위 대표와 우상호 원내대표가 22일 서울 여의도 국회 도서관에서 열린... 그는 또 ""골목상권 침해 방지를 위한 상생 방안과 자영업자들의 삶의 조건을 개선할 수 있는 권익 보호 방안을 당..."
414,2016.08.25.,"중기청, 카카오와 소상공인 유통판로 개척에 적극 협력키로",25일 서울 팁스타운에서 카카오 플랫폼을 활용해 소상공인의 우수제품를 판매하는 등 유통분야 상생협력을... 그동안 지역 상권과 오프라인 매장에 의존하던 소상공인이 카카오의 온라인·모바일 플랫폼 활용을 통해...
415,2016.08.23.,"신영, 2생활권 랜드마크 ‘세종 지웰 푸르지오’ 26일 분양","또한 정부가 지난해 11월 발표한 서울~세종간 고속도로 건설 등 대형호재도 이어져 담보대출 여신 심사... 메인 상권을 형성할 예정이다. 단지 인근에는 KTX 오송역이 있으며, 단지 앞 도로에는 간선급행버스(BRT) 정류장..."
416,2016.08.24.,74㎡ 희소성·초고층 경관타워 자랑…‘세종지웰푸르지오’ 랜드마크 자신감,도시가 제모습을 갖추고 서울~세종 고속도로 건설 등 개발 호재가 잇따르면서 이미 분양한 단지의 가치는... 국내 최장(1.4㎞)의 스트리트형 상권으로 조성되는 어반아트리움의 수혜도 기대된다. ‘세종 지웰...
417,2016.08.25.,[분양정보]세종시 요지에 35층 주상복합 '세종 지웰 푸르지오',"중앙행정지구 및 중심상업지구 인접한 2-1생활권에 위치 인구 급증·서울~세종 고속도 확정·청약요건 완화... '세종 지웰 푸르지오' 는 중심상권과 주거지역의 경계부에 위치해 있으며, 세종시 내에서 찾아보기 힘든 74..."
418,2016.08.24.,1인 가구 수요 맞춘 신촌 대학가 중심 소형 오피스텔 주목,"풍부해 서울 전역을 비롯한 경기, 인천 등 수도권 전역으로 이동이 수월하다. 여기에 신촌로, 강변북로, 내부순환도로 등이 가까이 있어 차량으로 타 지역 이동도 좋은 편이다. 신촌∙이대상권의 풍부한 생활 편의..."
419,2016.08.25.,"GS, 하반기 사업 포트폴리오 강화",국내는 서울 강남권 도시정비 수주와 사업성 있는 지역을 중심으로 분양사업을 진행해 나갈 예정이다.... GS글로벌은 기존 트레이딩 사업 경쟁력을 강화하기 위해 중동 유럽 중남미 등 원거리 상권을 중심으로 시장을...
420,2016.08.21.,현대백화점 판교점 덕에 성남 상권 활기,"같은 기간 서울 서초구와 종로구에서 발생한 카드 매출은 각각 15.5%, 8.5% 감소했다. 소비 침체를 감안하면 성남 상권은 상대적으로 활기를 띠고 있다고 KB국민카드는 설명했다. [한경닷컴 바로가기] [스내커] [한경..."
421,2016.08.25.,국내 최대 프랜차이즈산업박람회 개막,"국내 190여 브랜드, 360개 부스가 참가하는 박람회는 서울무역전시장(SETEC, 지하철3호선 학여울역) 1·2·3... 또 27일에는 ▲가맹사업법의 이해와 가맹계약 체결 시 주의사항 ▲창업절차 및 상권입지 분석 ▲예비창업자를 위한..."
422,2016.08.25.,[세종소식] 세종시 지역인재육성 위한 장학생 선발 등,"◇ 세종시, ""행복도시 세종으로 귀농·귀촌하세요"" 세종시는 26일부터 28일까지 서울시 양재동 aT센터에서... 이번 도시재생대학교는 종합대학 체제로 운영되며, 공동체활성화대학, 문화·경관대학, 상권활성화대학 등..."
423,2016.08.17.,'문열고 냉방영업' 2차 단속…2개 매장에 과태료,[연합뉴스자료사진] 1천769개 매장 점검…21개 매장에 경고장 산업통상자원부는 16일 서울 명동 등 전국 14개 상권에서 문을 열고 냉방영업을 하는 업소를 단속해 21개 매장에 경고장을 발부했고 2개 매장에...
424,2016.08.30.,[민선‘6기’구청장에 듣는다 박겸수 강북구청장]“북한산 자락 근현대사 기념...,마침내 서울 1등 ‘역사문화관광도시’가 될 수 있는 동력을 얻었다는 기쁨에 가슴이 벅찹니다. ” 민선 6기... 박 구청장은 “주변엔 카페골목이 생기는 등 상권도 활력을 얻고 있다”며 “연간 30만명에 달했던 기존...
425,2016.08.29.,"신촌 이대역 '영타운 오피스텔', 소형 빌트인 설계 및 커뮤니티 시설로 실용성...",최근 신촌 중심상권에서 쾌적하고 안전한 주거생활이 가능한 소형 오피스텔을 분양 중에 있다. 신영건설이 서울시 서대문구 대현동에서 공급하는 ‘신촌 이대역 영타운 오피스텔’이 바로 그곳. 이 오피스텔은...
426,2016.08.29.,1분뉴스(11:00),■ 최근 사람들이 많이 찾는 서울 연남·상수·이태원동과 경리단길 등 이른바 '뜨는 상권'에서 젊은 주민들은 떠나고 음식점이 몰려든 것으로 나타났습니다. ■경술국치 106주기인 오늘 오후 서울 남산 예장자락의 옛 일제...
427,2016.08.26.,영덕 사통팔달 교통망 마지막 퍼즐 완성된다,"▲ ⓒ 이우근 기자 【브레이크뉴스 영덕】이우근 기자=서울~영덕 3시간, 부산~영덕 2시간, 신도청~영덕 1시간... 중심의 상권 활성화 등 지역경제 전반에 큰 영향을 미칠 것으로 보인다. 이에 영덕군은 종합적인 대책을..."
428,2016.08.23.,"SK건설, 광교신도시에 랜드마크 상업시설 공급 나선다",물론 상권형성에 긍정적인 영향을 줄 것으로 기대를 모은다. 광교신도시에 수원고등법원 및... 더불어 용서고속도로(용인~서울)와 경부고속도로가 2018년 연결될 예정으로 완공 시 서울 수도권은 물론 전국적으로...
429,2016.08.27.,[주말N]'한국서 맛보는 뉴욕' 울프강 스테이크하우스 청담,"대표하는 상권으로 꼽히며 일년내내 사람들의 발길이 끊이지 않는다. 유행의 시작점이자 최신 트렌드를 발... ▲위치 : 서울특별시 강남구 청담동 소재 ▲운영시간 : 월요일~일요일 오전 11시30분 ~ 오후 11시 / , 생생한..."
430,2016.08.23.,카카오게임즈 남궁훈-조계현의 '낯 뜨거운 홍보',[스포츠서울 김진욱기자] ㈜카카오(대표 임지훈)의 게임사업을 전담하고 있는 카카오게임즈의 남궁훈... 여기에 카카오게임즈의 모회사인 카카오는 만족스럽지 못한 게임분야의 성과와 골목상권 침해 논란을 빚고...
431,2016.08.26.,"인천 서구 연희동 `청라골드클래스2차` 분양권, 실수요자 중심으로 인기","청라의 메인상권 바로 옆에 분양된 단지로 커널웨이를 걸어서 5분이면 갈 수 있고 인천공항고속도로 청라IC개통과 공항철도 청라역, 경인직선화국도개통 등으로 서울 접근이 수월하다. 이밖에도 청라지구는..."
432,2016.08.22.,"파리바게뜨, 中 서남지역 진출…2020년까지 80개 오픈","(서울=연합인포맥스) 장순환 기자 = SPC그룹은 중국 쓰촨성 청두에 파리바게뜨 청두 완상청점을 열며, 서남... 파리바게뜨 청두완상청점은 면적 270㎡, 100여 개의 좌석을 갖춘 베이커리 카페로 고밀도 주택가 핵심상권에..."
433,2016.08.26.,"[창업] 해리브롬튼, 막바지 여름 가격 할인 이벤트",27일까지 서울 학여울역 SETEC에서 열리는 ‘제37회 프랜차이즈 산업박람회’에 참가한다. 푸디세이는 상권에 맞춰 유동적 변동이 가능한 ‘따복따복’의 매장 운영 전략과 고객 편의성과 가성비에 초점을 맞춘...
434,2016.08.28.,[김학렬의 올댓 부동산] 지방 KTX 역세권 가치 평가법!,"부동산 입지 분석 가장 중요한 요소는 교통, 교육, 상권, 환경 등 4가지 요인이다. 부동산 분석 시 이 4가지 요인을 모두 고려해야겠지만 지역별로 그 각 요소별로 중요도는 다르게 적용해야 한다. 예를 들면 서울 및 수도권..."
435,2016.08.19.,"킨텍스 원시티 상업시설 114점포, 9월 분양",더욱이 GTX 킨텍스역을 이용해 서울 삼성역까지 20분대 이동이 가능해 광역수요 유입에 따른 상권 활성화도 기대된다. 한류월드의 핵심사업으로 꼽히는 K-컬처밸리 사업은 한류문화 콘텐츠 복합단지로 본 단지의...
436,2016.08.27.,우수한 교통여건 갖춘 ‘송파 두산위브’,또한 교통이 잘 발달된 곳 중심으로 상권이 잘 발달돼 있어 유동인구가 풍부해 찾는 수요가 많아 환금성도... 서울 성동구 행당동의 ‘서울숲행당푸르지오’(2011년 5월 입주)는 지하철 5호선 행당역이 도보 10분...
437,2016.08.25.,"""신규 창업자에게 쏜다""…새출발 응원 '통 큰 혜택'","[스포츠서울 김종철기자] 2030 청년실업률 증가와 함께 여성 일자리 부족, 4050 조기 명예퇴직 등 불안정한... 먼저 전략 지역 30곳은 수도권(8곳), 경상권(10곳), 충청권(6곳), 강원도(6곳)으로 구성됐다. 위 30곳은..."
438,2016.08.25.,마곡도시개발구역 초역세권 복합상가 `마곡열린엠타워`,서울시 강서구 마곡지구에 들어서는 '열린엠타워'를 향한 문의가 이어지고 있다. 이화의료원(김포국제공항의원) 바로 옆에 자리하는 열린M타워는 이화의료원을 비롯한 외부인의 유입이 많은 곳으로 안정적인 상권...
439,2016.08.29.,"[2016소비자신뢰대상] ""위기가 곧 기회""…과감한 투자로 산업발전 이끈 '신세...","경북 상권 첫 출점인 동대구점 오픈(오는 12월 오픈 예정) 등 백화점업계가 2년 연속 마이너스 성장을... 서울 본점은 남대문시장과 영등포점은 대신시장, 인천점은 석바위시장, 경기점은 용인중앙시장, 광주점은..."
440,2016.08.25.,늘어나는 소자본 창업… 경쟁력 있는 아이템을 찾아라,"[스포츠서울 김수지기자] 지속되는 경기불황과 20~30대 젊은층의 취업난이 이어지면서 최근 소자본 외식... 이는 백화점 입점, 로드숍 매장 등 다양한 상권에서의 소자본 창업이 가능하기 때문이다. 1인 창업이..."
441,2016.08.25.,[단독] 청춘 + 떡볶이 + 배달… 전통시장 부활의 공식,[서울신문] 2000년 이후 유통 환경과 구매 패턴이 급변하면서 위기를 맞았던 전통시장이 살아나고 있다.... 김현석 소상공인시장진흥공단 상권육성실장은 “구매력이 좋은 청년 고객이 많아야 시장 매출도 오른다”고...
442,2016.08.29.,호매실지구 초역세권 상가 '다인 로얄팰리스 호매실' 수요자 관심↑,"또 서울 강남(과천-봉담고속도로), 서울 서부(수원-광명)와 직접 연결되고 수원역 1호선과 KTX수원역 등도 이용 가능해 유동 인구 유입이 유리하다. 1, 2층에 조성되는 상가 상권은 풍부한 배후수요와 유동 인구 유입을..."
443,2016.08.23.,"단통법 개정 또다시 도마 위에…""지원금 상한제 페지해야""",참여연대와 전국이동통신유통협회는 23일 서울 명동 은행회관에서 '국민참여 대토론회-말 많은 단통법... 자급제 폰을 판매하는 대형 유통점은 각종 포인트와 신용카드 제휴로 사실상 우회보조금을 주고 있어 골목 상권이...
444,2016.08.27.,"외식업계, 매장 테마 맞춰 인테리어도 메뉴도 새롭게",27일 외식문화기업 원앤원에 따르면 최근 오픈한 원할머니 국수·보쌈 논현점은 강남 오피스 상권에 맞춰... bhc는 서울 테헤란로에 비즈니스 콘셉트의 프리미엄 한우전문점 창고43 역삼점을 최근 오픈했다. 역삼점은...
445,2016.08.22.,신촌 명물길·연세로 1층 옥외영업 전면 허용,서울 서대문구 신촌 연세로에서 지난달 14일 열린 ‘제2회 신촌맥주축제’에 참가한 시민들이 야자수... 구는 옥외영업이 가능한 식품접객업소를 개별 방문해 관련 내용을 알리는 등 신촌 지역 상권 활성화에 나설...
446,2016.08.22.,"한식뷔페 풀잎채, 특수상권 창업 및 투자설명회","▲ 프리미엄 한식뷔페 풀잎채는 서울 송파구 본사에서 24일 오후 1시, 27일 오후 2시에 각각 사업설명회를 개최한다고 22일 밝혔다. 이날 설명회에서는 특수상권 특성, 풀잎채 창업 및 투자형 창업제도에 관해..."
447,2016.08.19.,"일산 킨텍스원시티 상업시설, 9월 114개 점포 분양",또 GTX를 통해 서울 삼성역까지 20분대 이동이 가능해 광역수요 유입에 따른 상권 활성화도 기대된다. 한류월드의 핵심사업으로 꼽히는 K-컬처밸리 사업은 한류문화 콘텐츠 복합단지로 본 단지의 바로 아래에...
448,2016.08.26.,신촌 상권 누린다..'신촌이대역 영타운 지웰 에스테이트' 오피스텔 분양,"풍부해 서울 전역을 비롯한 경기, 인천 등 수도권 전역으로 이동이 수월하다. 신촌로, 강변북로, 내부순환도로 등이 가까이 있어 타 지역 이동도 좋은 편이다. 신촌·이대상권의 풍부한 생활 편의 및 문화시설도 누릴 수..."
449,2016.08.25.,영화·TV 나와야 반짝… 전통시장도 ‘빈익빈 부익부’,[서울신문] 청년 상인의 활약과 정부의 집중 투자로 스타급 전통시장이 일부 떠올랐지만 대부분 전통시장은... 구도심 재개발의 역효과로 발생하는 ‘젠트리피케이션’(상권이 좋아지면서 임대료가 올라 임차인들이...
450,2016.08.26.,"현대엔지니어링, 힐스테이트 광교 상업시설 분양",다른 상권에 비해 임대료가 비싸다. 점포라인에 따르면 올해 장항동 1층 상가의 평균 월세는 3.3㎡당... 용인~서울 고속도로와 경부고속도로가 연결되면 교통편이 더 좋아질 전망이다. [고성민 기자 kurtgo@chosunbiz....
451,2016.08.24.,교통ㆍ상권ㆍ임차수요 갖춘 신촌 이대역 영타운 지웰 에스테이트,"신영건설이 신촌 중심상권에서 교통·편의·문화를 모두 누릴 수 있는 소형 오피스텔를 분양중에 있다. 서울시 서대문구 대현동에 있는 ‘신촌 이대역 영타운 지웰 에스테이트’가 그곳으로, 대학 밀집지역 내에..."
452,2016.08.29.,"[서울경제TV] 대우건설, ‘역삼역 센트럴 푸르지오 시티’ 분양","이마트, 롯데백화점, 현대백화점 등 대형 상업시설과 강남역 상권을 비롯해 CGV, 메가박스, 코엑스 등의 이용이 편리하다. 강남세브란스병원, 서울의료원 강남분원과도 인접하고, 낙산공원, 도곡공원, 선정릉 등..."
453,2016.08.23.,단통법 공개 토론회…지원금 상한제 손질 ‘한 목소리’,23일 서울 중구 은행회관 국제회의실에서 열린 단통법 개선 방안 모색을 위한 ‘국민 참여 대토론회’ 현장.... 골목상권 및 소상공인들을 위한 공생의 대안 마련도 시급하다는 목소리도 나왔다. 이동통신시장에서 투명한...
454,2016.08.26.,"""매출 30% ↑""...골프존 가맹사업 전환 '순항'","[기자 스탠딩] ""본사가 직접 나서 가격안정 등 고급화를 추진하고 지역 상권을 고려해 매장이 우후죽순... 서울 강남과 제주, 경남 창원 등에서도 추가 시범운영을 검토할 계획입니다. [인터뷰]이승규 / 골프존네트웍스..."
455,2016.08.25.,'세종 지웰 푸르지오' 분양… 26일 개관,"그 배경으로는 인구의 증가 서울~세종 고속도로 건설 확정 청약요건 완화 등이 거론된다. 세종시에는... '세종 지웰 푸르지오'는 중심상권과 주거지역의 경계부에 위치해 있으며, 세종시 내에서 찾아보기 힘든 74..."
456,2016.08.21.,"[TV까기]""기억해주세요""…'무한도전', 역사 잊은 이들 울린 한 마디","(서울=뉴스1스타) 장아름 기자 = ""기억해주세요. 먼 타지에 있는 이 작은 한인회가 조국의 독립을 위해... 이후 샌프란시스코에서 한국인 인삼 상인 둘이 상권 영역 때문에 싸우는 모습을 보고 협회를 조직하기로 결심하고..."
457,2016.08.23.,아웃도어 「헬리녹스」에 러브콜!,12월3일 서울 한남동에 「헬리녹스」 크리에이티브 센터 ‘HCC(Helinox Creative Center)’가 오픈했다. 아웃도어 매장이 밀집한 상권은 아니지만 모든 라인의 제품군을 갖춘 6층 HCC 건물은 1일 차량 평균 통행량이 29만대...
458,2016.08.23.,"'방석집' 대신 청년공방, 거리가 달라진다","혹자들은 상권도 형성되어 있지 않고, 유해환경도 많은 그 지역에 과연 누가 들어오겠느냐 우려를 보냈지만... 현재 코이로가 지원하고 있는 협동조합 서울가죽소년단이 코이로와 함께 엔젤공방에 들어와 새로운 둥지를..."
459,2016.08.26.,[취재뒷담화] SK텔레콤 '포스트 설현찾기' 분주,헬로비너스 나라가 지난 12일 서울 강남구 논현동 임피리얼 팰리스 호텔에서 열린 SK텔레콤 ‘T 갤럭시... 전국 주요 상권에 자리한 SK텔레콤 대리점 입구에 등신대가 세워지는 것도 화제를 불러일으키기 충분하지요....
460,2016.08.23.,"단통법 대토론회, “지원금 상한제 폐지하고, 분리공시 도입하라”","학계와 시민단체, 유통인 등 12명은 23일 서울 은행회관에서 열린 ‘국민 참여 대토론회’ 패널로 참석... 골목상권의 영업행위는 지원금 및 위약금 상한제 등 각종 규제로 인해 제한되고 있다”며 “보조금 상한제를..."
461,2016.08.25.,"""솔로대첩 뜨니 지역상권도 활성화”",이런 경쟁은 침체된 상권에 활력으로 작용 가능하기에 경제적 측면의 기대감도 큰 상황이다. 이른바... 서울과 수도권 중심의 행사지역은 전국 규모로 넓혀갈 계획이다. 기업의 마케팅 범위가 수도권에 한정되지 않으므로...
462,2016.08.17.,'문 열고 냉방영업' 2차 단속…2개 매장에 과태료,산업통상자원부는 어제(16일) 서울 명동 등 전국 14개 상권에서 문을 열고 냉방영업을 하는 업소를 단속해 21개 매장에 경고장을 발부했고 2개 매장에 과태료를 부과하기로 했다고 밝혔습니다. 지난 11일 1차...
463,2016.08.26.,[자치단체장 25시] 부부가 붕어빵·떡볶이 팔아 장학금 주는 ‘천사표 동구청...,[서울신문] 2014년 7월 취임한 이흥수(56) 인천 동구청장은 이듬해 첫날 구내식당을 폐쇄했다. 600여명에 달하는 구청 직원들이 주변 식당에서 식사하면 인천 구도심 가운데 가장 낙후된 동구의 상권 활성화에 적지 않은...
464,2016.08.23.,줄서먹는 햄버거 `쉐이크쉑` 청담동에도 입성,23일 부동산 관계자·업계에 따르면 SPC는 지난주 서울 청담동 도산공원 인근 대로변에 위치한 신축 빌딩에... 쉐이크쉑 버거 1호점이 위치한 강남대로 인근이 국내에서 가장 대중적인 상권이라면 2호점이 자리하게 될...
465,2016.08.27.,역세권 오피스텔 수익률 성적 'A+',"풍부해 서울 전역을 비롯한 경기, 인천 등 수도권 전역으로 이동이 수월하다. 여기에 신촌로, 강변북로, 내부순환도로 등이 가까이 있어 차량으로 타 지역 이동도 좋은 편이다. 또한 신촌∙이대상권의 풍부한 생활 편의..."
466,2016.08.15.,"CU, 장사 안돼 편의점 문 닫으면 위약금 줄여준다",(서울=연합뉴스) 지난 12일 CU가맹점주협의회 정종안 점주(사진 왼쪽)와 BGF리테일 박재구 사장이 협약... 협약에는 ▲상권변화 등에 의한 손익 부진으로 폐점 시 위약금 감면 ▲250m 영업지역 설정 ▲판촉행사 및...
467,2016.08.23.,'세종 지웰 푸르지오' 분양,"그 배경으로는 ▶인구의 증가 ▶서울~세종 고속도로 건설 확정 ▶ 청약요건 완화 등이 거론된다.... '세종 지웰 푸르지오' 는 중심상권과 주거지역의 경계부에 위치해 있으며, 세종시 내에서 찾아보기 힘든 74㎡ 크기..."
468,2016.08.25.,투자자 몰리는 역세권 오피스텔 왜?,"풍부해 서울 전역을 비롯한 경기, 인천 등 수도권 전역으로 이동이 수월하다. 아울러 신촌로, 강변북로, 내부순환도로 등이 가까이 있어 차량으로 타 지역 이동도 좋은 편이다. 신촌∙이대 상권의 풍부한 생활 편의 및..."
469,2016.08.22.,SETEC서 8월25일 프랜차이즈창업박람회 개최,"한국프랜차이즈산업협회는 오는 25일(목)부터 27일(토)까지 사흘간 서울 대치동 서울무역전시컨벤션센터... 창업아이템 선정, 상권분석, 창업실무 등의 기본이론부터 프랜차이즈 분쟁사례, 임대차 계약, 절세방안..."
470,2016.08.22.,SETEC서 8월25일 프랜차이즈창업박람회 개최,"한국프랜차이즈산업협회는 오는 25일(목)부터 27일(토)까지 사흘간 서울 대치동 서울무역전시컨벤션센터... 창업아이템 선정, 상권분석, 창업실무 등의 기본이론부터 프랜차이즈 분쟁사례, 임대차 계약, 절세방안..."
471,2016.08.25.,"이바돔패밀리, 중대형 자유로운 평수의 창업상담 받아",나누어 상권 맞춤 상담을 받을 수 있다. 올해 새롭게 런칭한 무한리필 전문점 ‘삼겹이야기’는 외식업계의 트렌드에 맞춰 이바돔이 야심차게 준비한 브랜드로 최소 투자로 최대 매출을 지향한다. 실제로 서울 은평구에...
472,2016.08.17.,[르포-문열고 냉방 집중단속]명동 상점들 '99% 준수'… 매출 하락엔 '불만',한편 산업통상자원부는 17일 서울 명동 등 전국 14개 상권에서 문을 열고 냉방영업을 하는 업소를 단속해 21개 매장에 경고장을 발부하고 2개 매장에는 과태료를 부과하기로 했다. 2차 합동단속에서는 1769개 매장을...
473,2016.08.23.,"파리바게뜨, 중국 서남지역 진출…청두·충칭 오픈도 준비중","파리바게뜨 청두완상청점 제공 | SPC [스포츠서울 최신혜기자] SPC그룹은 중국 쓰촨성(四川省) 청두(成都)... 청두완상청점은 면적 270㎡, 100여개의 좌석을 갖춘 베이커리 카페로 고밀도 주택가 핵심상권에 위치한..."
474,2016.08.22.,"롯데면세, 신규면세점 공세에도 실적 ‘호조’","롯데면세점이 서울 시내 신규면세점들의 공세에도 불구하고 올해 상반기 사상 최대 매출을 올리는 등 실적... 같은 명동 상권을 노리는 롯데면세점 소공점(영업면적, 1만6115㎡)과 신세계면세점 명동점(1만5138㎡)이..."
475,2016.08.22.,"SPC 파리바게뜨, 中 쓰촨성 청두완상청점 오픈","[서울=일요신문] 박창식 기자= SPC그룹(회장 허영인)은 중국 쓰촨성 청두에 파리바게뜨 청두완상청... 파리바게뜨 청두완상청점은 면적 270㎡, 100여 개의 좌석을 갖춘 베이커리 카페로 고밀도 주택가 핵심상권에 위치한..."
476,2016.08.23.,호재 넘치는 일산 '킨텍스' 일대 실수요층 관심 뜨겁다,"여기에 지난해 연말부터는 킨텍스와 서울 강남 삼성역을 20분대로 이어줄 GTX A노선(2022년 개통예정)의... 상가가 완공되면 현대백화점 킨텍스점, 이마트타운, 고양원마운트와 더불어 킨텍스를 대표하는 대규모 상권을..."
