,date,title,contents
1235,2016.08.02.,출퇴근 시간 아껴 넘치는 직주근접 수요,교통 편리할수록 상권 활발 동시에… 선호도 높아 2016년도에도 배후세대가 풍부한 지역 수익형 부동산은... 시행사 153PMC에서 서울시 노원구 공릉동에 ‘태릉입구역 미라쉘’ 도시형생활주택을 분양한다. 지하철 6·7호선...
1236,2016.08.04.,"소상공인연합회, 4일 대기업 '갑질' 규탄대회","이윤근 서울 남서부수퍼마켓협동조합 이사장은 ""대기업의 골목상권 위협은 어제 오늘의 이야기가 아니라면서 롯데의 다이소나 CJ올리브영 등과 같이 변형된 유통 체인을 보급하는 것은 대기업답지 않은 눈속임이고 꼼수..."
1237,2016.08.11.,"전국 상점 2,350개소 중 43개소에 '경고장'","이날 합동점검은 문 열고 냉방영업 금지와 냉방온도 준수 계도를 주요 내용으로 전력피크시간대인 오후 2시부터 서울(명동역, 강남역, 가로수길 인근), 부산, 광주 등 전국 주요상권 14개 지역에서 진행됐다. 특히 냉방기..."
1238,2016.08.02.,"특전사, 경기 이천에서 부대이전 기념행사","육군 특수전사령부가 44년간의 서울 송파구 거여동 시대를 마감하고 2일 오전 경기도 이천시에 있는 새... 월 1회 이상 간부들의 영외 점심을 권장해 지역상권 활성화에도 앞장서기로 했으며, 장애인 복지시설과 양로원..."
1239,2016.08.09.,이데일리 '오늘의 경제일정'-새누리당 차기 지도부 선출,"◇경제·산업 08:00 복지부, 제3차 바이오헬스육성민관협의체(서울플라자호텔) 11:00 직능경제인단체총연합회, 골목상권 자영업자를 위한 기자회견(프레스센터) 14:00 식약처, 중소기업중앙회 간담회 14:00 대한항공..."
1240,2016.08.02.,불황인데 임대료 치솟고…명동 빈상가 는다,부동산114가 발표한 ‘2분기 상업용 부동산 리포트’를 살펴보면 종각역을 제외한 대부분 도심권역 상권의 월 임대료가 상승했다. 서울 소재 상가 임대료는 전분기 대비 5.6% 오른 1㎡당 3만700원으로 집계됐다....
1241,2016.08.15.,부동산 길이 뚫리는곳 따라... 교통망 갖춘 지역 ‘주목’,"광역교통망이나 지하철 확충 등의 교통 호재는 서울을 비롯해 다른 지역으로의 이동을 수월하게 하고, 역세권을 중심으로 생활 인프라와 상권이 형성될 가능성이 높으며 이는 지역 활성화로 빠르게 이어진다. 교통망..."
1242,2016.08.11.,"토즈 스터디센터, 골목상권 침해 우려…왜?","골목상권을 침해하고 있는 게 아니냐는 지적이 영세 자영업자들 사이에서 제기된다. 서울 목동역 근처 학원가 지역에서 독서실을 운영하는 자영업자 A씨는 11일 &lt;시사오늘&gt;과 통화에서 ""토즈 스터디센터가 목동역..."
1243,2016.08.04.,[기자 추천 도서]⑭ 박명균의 '나는 언제나 술래'…박정엽 기자,서울 땅은 대부분 건축 쓰레기가 땅 속에 있어서 땅 파기가 아주 고약하다. 삽질이 얼마나 사람을 배고프게... 이 책은 박씨가 20년동안 지켜본 골목상권 속에서 살던 상인들과 그들의 가족의 몰락에 대한 보고서이다. 또...
1244,2016.08.17.,신분당선 연장 개통 최대 수혜 '호매실 다인 로얄팰리스' 상가 주목,"수원 마지막 택지지구로 불리는 호매실지구는 풍부한 주거 수요와 신상권 개발에 따른 미래가치가... 또 서울 강남(과천-봉담고속도로), 서울 서부(수원-광명)와 직통 연결이 가능하며 수원역 1호선과 KTX수원역과도..."
1245,2016.08.09.,"하반기 유망 창업 아이템 전망 ‘복고포차’, 추억 속 동네슈퍼 콘셉트로 인기",[스포츠서울 김수지기자] 여름 휴가철도 끝나가고 8월이 되면서 2016년 하반기 창업시장도 새롭게 밝았다.... 음식만큼은 상권 내 모방브랜드와의 경쟁에서도 이길 수 있도록 품질은 높이기 위해 많은 노력을 했다....
1246,2016.08.11.,"참여연대, 전관비리ㆍ징벌적 손해배상 등 김재형 대법관 후보 검증",3) 임대상인 보호와 법원의 강제집행 지역상권이 활성화되면서 임대료는 급증하고 원주민은 내몰리는 젠트리피케이션 현상이 심각해지고 있는 실정입니다. 최근에는 서울 신사동 가로수길의 ‘우장창창’ 임차인과...
1247,2016.08.04.,한국자영업자총연대 '소상공인 말살하는 갑의횡포 저지대회' 개최,한국자영업자총연대는 4일 오후 2시 서울 여의도 중소기업중앙회에서 ‘소상공인 말살하는 갑의횡포... 되는 상권을 영업지역으로 제공하는 등 갑의 힘을 이용해 골프존 사업자를 벼랑 끝으로 몰아가고 있다”고...
1248,2016.08.02.,투자자라면 꼭 봐야 할 오늘의 10대 투자뉴스-2일,서울 동남권 '황금상권'놓고 …'유통 빅3' 삼국지 개막 서울 동남권이 새로운 '황금상권'으로 떠오르고 있다. 위례·미사 등 신도시와 구리·남양주로 인구유입이 가속화되고 강남·서초 접근성도 좋아 핵심상권으로...
1249,2016.08.04.,천안 도심생활권 중소형 아파트에 1~2인 가구 시선집중,대형 상권이 위치해 편리한 도심생활권을 누릴 수 있다는 장점을 갖춘다. 천안역 우방 아이유쉘은 주변 교통환경이 우수하다. 무엇보다 천안역 역세권이며 도보 5분 거리에 고속버스터미널이 있어 서울까지 빠른...
1250,2016.08.03.,외부세력? 성주 주민 7명을 만나다,서울에 있는 노인단체 대표라고 자신을 소개한 그는 참외 상자에 적힌 이씨의 연락처를 보고 전화를 했다고... 이처럼 성주군 상권은 대부분 참외 농사와 밀접하게 관련돼 있다. 성주 참외가 '사드 참외'라는 오명을...
1251,2016.08.10.,"[장외주식4989] 8월 10일부터 크라우드 펀딩 모금 시작, 의류전문업체 '에스와...","현재는 서울가산디지털 단지 본점이 두고, 인터넷 온라인몰 및 부평지하상가 계양 물류 센터 이렇게 24명의... 현재 9월부터 전국적 가맹점 B2B 유통망 확대에 따른 가맹점 모집이 시작되며, 죽어있던 골목상권, C급 상권..."
1252,2016.08.10.,빅데이터로 비즈니스 성과 개선… 컨설팅 상품화로 수익창출 추진,"10일 서울시 종로구 KB국민카드 본사에서 만난 정성호 KB국민카드 미래사업본부 전무(사진)는 ""급변하는... 이를 위해 KB국민은행의 부동산 시세 빅데이터와 카드 소비 데이터를 융합한 상권평가지수를 개발하고 있고, 향후..."
1253,2016.08.09.,중국인 '부동산 투자'…강남 아파트까지?,"그동안 제주도로 특정됐던 중국인들의 부동산 투자가 최근 서울까지 확산되고 있습니다. 연남동, 망원동 등 이른바 홍대 상권의 마포구 같은 경우, 2014년 18건에 불과하던 중국인 부동산 거래는 이듬해 43건으로 2.5배..."
1254,2016.08.10.,"레스모아, 토털 스포츠 멀티숍 '넥스텝' 론칭","유명 스포츠 브랜드의 상품들을 편안하고 즐겁게 쇼핑할 수 있도록 특화했다. 앞으로 서울 명동을 중심으로 서울 홍대 영등포, 대전 대구, 부산 광복동 등 각 지역 핵심상권에 지속적으로 확장해 나갈 계획”이라고 말했다."
1255,2016.08.05.,[신야인시대]① 호모나이트쿠스…밤을 지배하는 사람들,동대문 상권의 대표상품으로 자리 잡았을 정도다. 조누리 메가박스 동대문점 매니저는 “올빼미족이 느는... 활기찬 밤문화는 서울에서만 즐길 수 있는 재미”라고 웃었다. 전문가들은 더워진 날씨 탓도 있지만...
1256,2016.08.11.,"신촌 이대역 지웰에스테이트, 중심업무지구 접근성 높아",신영건설이 서울시 서대문구 대현동에 직주근접 프리미엄을 누릴 수 있는 오피스텔 '신촌 이대역 영타운 지웰 에스테이트'를 분양중에 있다. 이 오피스텔은 신촌 중심상권지역에 위치해 편리한 문화생활을 누릴 수 있고...
1257,2016.08.09.,"주영섭 중소기업청장, 나들가게 선도지역 현장간담회 개최",등 서울ㆍ경기 나들가게 선도지역 5개 지방자치단체 관계자들과 함께 나들가게 점주들의 의견 청취를 위한 간담회를 개최했다. 나들가게는 중소기업청이 대형마트와 기업형 슈퍼마켓 등 대형 유통업체의 골목상권...
1258,2016.08.05.,"1,2인 가구 증가 속 울산 번영로 상권의 중심 아파텔 인기","[스포츠서울 김수지기자] 최근 1~2인 가구가 증가하면서 중대형보다는 실속 있는 소형 주택거래가... 대형상권이 형성돼 있으며, 울산 태화강공원, 울산대공원을 가깝게 이용할 수 있는 것이 특징이다...."
1259,2016.08.03.,"목포시, 남악 복합쇼핑몰 피해 최소화 대책 마련","남악롯데복합쇼핑몰 입점저지추진위 소상공인들이 지난해 8월 서울 세종로 정부서울청사 후문 앞에서... 복합쇼핑몰 입점과 관련해 시 자체적으로 상권영향 조사 용역을 실시하는 한편, 무안군에 방문해 지역 상공인과..."
1260,2016.08.09.,"한정식 전문 '진진반상', 10월 목동점 오픈","목동 오목공원, 현대백화점 인근 서울 이동통신빌딩 3층에 입점하는 진진반상 목동점은 전용 면적 400평... 현대백화점과 현대41타워 등 맛집들이 밀집되어 있는 이곳 목동 상권에 당당히 도전장을 내민 진진반상..."
1261,2016.08.01.,"여름휴가 시즌, 내수경기 '엔진' 역할 나선 현대차그룹","먼저, 주요 관광지 상권과 연계해 임직원들이 회사에서 지급한 복지포인트를 전국 각지의 관광지에서... 서울인천경기, 충청도, 경상도, 전라도, 강원도, 제주도 등 6개 지역의 도입부에는 주요 관광지와 볼거리를 그림..."
1262,2016.08.11.,[한경매물마당] 은평구 역세권 휘트니스 상가 등 6건,"조근원 ◆서울 도봉구 대기업 주유소 및 상가=대단지 아파트 입구 대지 1500㎡. 보증금 4억원, 월 3300만원에 대기업 주유소로 장기 임대 계약. 입지 여건 우수하고 차량진입 풍부한 주유상권. 환금성 양호...."
1263,2016.08.03.,"경기중기센터, 경기도 소상공인 창업교육 참가자 모집","강의는 성공창업전략, 상권입지분석, 기초노무, 창업기초세무, 소점포 마케팅전략, SNS 마케팅 등 모두... / [서울경제 바로가기] [인기포토로 보는 오늘]으랏차차 대한민국! Ola 리우! 저작권자 ⓒ 서울경제, 무단 전재..."
1264,2016.08.07.,직장인의 '로망' 상업용 부동산,올 1분기 서울 중소형 오피스 공실률은 10%였다. 공실이 발생하면 투자 수익률이 떨어질 뿐 아니라 부동산... 마지막으로 부동산은 즉시 현금화하기 어렵고 상권이 빠르게 변한다는 점도 고려해야 한다. 상업용 부동산...
1265,2016.08.05.,이제는 임차 상인 보호법으로,"2000년대 이후 서울의 홍익대 인근, 삼청동, 신사동 가로수길 등에서 일어나고 있는 현상으로, 도심이 번성해... 이른바 '뜨는' 상권을 중심으로 상업 젠트리피케이션 문제가 발생하며 임차 상인들의 위기가 심화된 것..."
1266,2016.08.08.,대형마트 품은 아파트 인기몰이…하반기 분양 단지는?,"대형 상업시설이 들어서면 지역 내 중심상권으로 거듭나는 경우가 많고, 유동인구가 풍부해지면서... KB 국민은행 자료에 따르면, 단지 내에 이마트가 입점해 있는 서울시 중구 황학동 '롯데캐슬 베네치아(2008년 4월..."
1267,2016.08.12.,캐릭터에 스토리 입히니…불황에도 ‘팬덤’ 급증세,"카카오프렌즈(대표 조항수)가 서울 강남역 중심상권에 공식 문을 연 카카오프렌즈의 첫 번째 플래그십 스토어에는 한 달만에 45만명, 하루 평균 1만 5000명 소비자가 매장을 찾았다. 지난 7월 2일 개장 첫날에는 스토어..."
1268,2016.08.03.,[기자수첩] 임지훈 카카오 대표의 홍보성 발언에서 아쉬운 점,문득 2015년 9월 어느 날 오후 서울 논현동 뒷골목 작은 빌딩 4층에 자리 잡은 모바일 송금서비스 ‘토스(Toss)... 비바리퍼플리카가 그랬듯이 이 분야 소상공인들도 카카오톡의 O2O 진출이 골목상권을 파괴할 것이라고...
1269,2016.08.10.,면세점 전쟁 재발발…코엑스가 접전지?,지난해는 동대문에서 '면세점 유치 전쟁'이 펼쳐졌다면 올해는 서울 삼성동 코엑스로 전쟁터가 옮겨질 전망이다. 외국인 관광객들이 몰리는 강남 상권 중에서도 면세점 사업지로 가장 적합한곳으로 꼽히기 때문이다....
1270,2016.08.16.,"차별화 마케팅으로 국내 최대 규모로 성장 창업아카데미, 중국·미국서 수강생...","신화그룹 산하 신동방요리학원의 최고위 관계자가 지난 5월 서울의 한솔요리학원 본사를 방문했다.... 어떻게 하면 상권을 키울 수 있을까? 부산, 더 나아가 해외에서도 우리 학원을 찾아오게 만들 수 있을까? 이런 고민..."
1271,2016.08.04.,이대 기숙사 현장 소장 왜 자살했을까,지난 7월18일 서울 서대문구 이화여대길 52 소재 이화여대 신축 기숙사 공사현장. 덥고 눅눅한 바람이 살에... 공사현장 인근에서 임대업을 하는 주민들은 상권 파괴로 생존권이 위협받는다며 기숙사 신축계획 철회 시위를...
1272,2016.08.02.,싸게 한 끼 때우는 분식점? 프리미엄 스낵카페 인기,[스포츠서울 김성진기자] 극심한 취업난으로 창업에 고개를 돌리는 젊은이들이 많다. 취업보다는 나만의... 젊은 세대들의 핫플레이스로 통하는 홍대와 건대 상권에서도 성공을 거두며 그 경쟁력을 입증하고 있다....
1273,2016.08.09.,"[현장 행정] 천호동 주꾸미 맛집, 골목의 멋 더하다",[서울신문] 서울 강동구 천호역 근처의 주꾸미를 형상화한 높이 3.5m의 거대 조형물이 행인들의 눈길을... 구는 이곳을 주꾸미 특화골목으로 꾸며 지역 상권을 활성화하고 관광 명소로 육성하기 위해 총 1억원의 예산을...
1274,2016.08.02.,"현대카드, 음반 소매상과 상생 방안 마련",서울 이태원에 레코드판 판매 매장을 냈다가 음반 소매상들의 반대에 직면했던 현대카드가 상생 방안을... 골목상권을 침범한다며 시위를 벌였습니다. ▶ 뉴스 덕후들의 YTN페이스북 ▶ 내가 만드는 뉴스! YTN제보...
1275,2016.08.01.,[포럼] 생계형 적합업종 법제화 필요하다,이로써 대기업집단에서 지정 해제된 37개 재벌의 618개 계열사들은 마음만 먹으면 골목상권에 진출할 수... 위평량 경제개혁연구소 연구위원 [서울경제 바로가기] [인기포토로 보는 오늘]으랏차차 대한민국! Ola 리우!...
1276,2016.08.03.,대단지 브랜드 아파트가 스테디셀러로 인기있는 이유는?,"[스포츠서울 김수지기자] 대단지 브랜드 아파트는 부동산시장에서 꾸준히 인기를 얻으며 ‘스테디셀러’... 또, 적게는 수 천명, 많게는 수 만명의 사람들이 입주하기 때문에 대단지 인근으로 상권 등 다양한..."
1277,2016.08.18.,"㈜터치웍스·㈜앤하우스 업무협약식, 모바일 멤버십 '터칭' 도입",9일 서울시 서교동 앤하우스 본사에서진행했다고 전했다. 9일 진행된 업무협약식에 ㈜앤하우스(대표 하형운)... 등의 상권에 자리를 잡고 있는 브랜드다. 종이쿠폰 사용으로 인한 매장과 고객들의 번거로움을 줄이고자...
1278,2016.08.03.,"슈마커 '핫티', 프리미엄 승부 통했다…매출도 '쑥'","현재 핫티는 서울 명동, 홍대, 여의도를 비롯해 대전 은행동, 대구 동성로, 부산 대학로와 서면 등 주요 상권에 11개 매장을 운영 중이다. 다음달에 강남역과 일산웨스턴돔 인근에 2개 매장을 추가로 연다. 올해 말까지..."
1279,2016.08.05.,패션잡화 캐시카우 ‘면세점’ 신유통 채널로 급부상,"관련사진 ■ 시내 면세점 10년간 연 15% 성장동대문 두타면세점, 명동 신세계 면세점 등 올해 추가로 서울시... 두타 면세점 - K패션 전진기지·동대문 상권 부활, ‘두 토끼’ 잡는다동대문은 원단 공급, 봉제, 생산..."
1280,2016.08.02.,'닥치고 창업' 백번? ‘체험창업’ 한번이 지름길,한국창업전략연구소의 체험창업 프로그램 '올바른창업 생생탐방' 중 서울 광화문 상권 탐방 모습. 사진=리더스비전 초보창업·업종전환 리스크 걱정 된다면 매장운영 체험 통해 사업 검증 창업전략연구소·얌샘김밥...
1281,2016.08.09.,메신저 춘추전국 시대 통일한 ‘카카오톡’,"골목상권 침해에 대한 비판도 거세지고 있다. 실제 인기가 있던 앱 중 스타트업 혹은 개인의 개발작이 다수 카카오에 넘어갔다. ‘김기사’는 카카오네비로, ‘지하철 내비게이션’은 카카오지하철로 ‘서울버스’는..."
1282,2016.08.02.,광화문·강남 등 상가 임대료 상승,서울 핵심상권인 강남권역은 △양재역(13.4%) △교대역(8.9%) △삼성역(6.6%) 중심으로 상승세를 보였다. 이중 삼성역상권은 '영동대로 지하공간 개발' 이슈로 투자자들의 문의가 이어지며 임대료가 상승했다. 오는...
1283,2016.08.09.,대림산업 vs GS건설 ‘종로 혈투’,GS건설 관계자는 “장사가 잘되지 않아 문을 닫은 것은 사실이지만 내부 사정으로 부득이하게 문을 닫은 점포도 있다”며 “그랑서울 상권이 죽었다기보다 콘셉트 등을 잘못 잡은 매장들 사이에서 손 바뀜이 일어나기...
1284,2016.08.09.,신천역 먹자골목 차보다 사람이 먼저!,"송파구, 보행자 우선도로 조성 도막 포장ㆍ교통안전시설 정비 [시민일보=이대우 기자] 서울 송파구(구청장... 골목상권도 활성화 될 것으로 내다보고 있다. 박춘희 구청장은 ""신천동 먹자골목은 수많은 사람들이 이용하는..."
1285,2016.08.05.,"성공적인 소자본 창업, 특별한 아이템과 틈새시장 공략이 관건",[스포츠서울 김종철기자] 경기불황이 지속화되고 취업난에 은퇴시기까지 앞당겨져 중장년층은 물론 젊은... 골목상권을 잡는 틈새시장 공략을 펼치고 있다. 특히 여심을 사로잡는 달달한 메뉴구성은 여성들의...
1286,2016.08.11.,"GS건설, 단지 내 상업시설 ‘은평 스카이뷰 자이’ 선보여","이러한 상업시설의 트렌드 변화되고 있는 가운데, GS건설이 서울 은평구 진관동 은평뉴타운 중심상업... 또한 ‘은평 스카이뷰 자이’는 입주 시점인 2019년 1월이면 주변 상권 개발이 완료될 예정이다. 한편, ‘은평..."
1287,2016.08.09.,"도봉구, 창동신창시장 제2기 상인대학 운영","지역상권 상생협력에 관한 조례' 제정을 추진하고 '상생협력상가협의체' 구성을 지원하는 등 소상인들의 임대료문제 해결을 위해 노력을 기울이겠다""고 밝혔다. 한편 창동신창시장은 서울시 신시장모델 선도시장..."
1288,2016.08.12.,교통 호재 수혜단지 열기 뜨겁다,"유동인구 증가, 상권 발달, 생활 편의성 향상 등의 원인이 되어 지역경제를 활성화 시키기 때문이다. 이에 교통호재 소식이 들리는 시점에 따라 실수요자들이 발 빠른 움직임을 보인다. 실제로 서울~춘천간 고속도로..."
1289,2016.08.05.,형우모드 '스위트홈' 현대백화점 목동점 오픈,"스위트홈 현대목동점은 올해 초 오픈한 롯데백화점 부산본점에 이어 올해 두 번째로 오픈한 매장으로, 현대백화점 목동점이 서울 서부지역 최고급 상권의 중심지에 있는 만큼 프리미엄 베딩상품으로 구성했다. 이에..."
1290,2016.08.02.,불황에 눌리고 임대료에 밀리고…도심 빈 상가 늘었다,부동산114가 발표한 ‘2분기 상업용 부동산 리포트’를 살펴보면 종각역을 제외한 대부분 도심권역 상권의 월 임대료가 상승했다. 서울 소재 상가 임대료는 전분기 대비 5.6% 오른 1㎡당 3만700원으로 집계됐다....
1291,2016.08.09.,"판교 넘은 광교?… 광교신도시 상가 월세, 판교 추월한 이유는",자체적인 상권 경쟁력도 강화됐기 때문으로 풀이된다. 최근 인구 수 증가 추이도 광교의 상가 경쟁력을... 인근에 광교상현IC가 자리한데다 용인-서울 고속도로와 경부고속도로가 오는 2018년 연결될 예정이라...
1292,2016.08.08.,"오신환 의원 ""불법노점 합법화, 자영업자에 대한 역차별""","좋은 상권을 차지하기 위해 수천, 수억원의 권리금을 내면서까지 장사하려 들겠는가""라며 ""박 시장은 노점 합법화 추진을 전면 재검토하고 서울시 자영업자들의 숨통을 틔워줄 수 있는 정책 마련에 더 집중해야 한다""고..."
1293,2016.08.16.,"[더벨]中안방보험, 국내 상업용부동산 사냥 시작하나","이 건물은 명동의 노른자위 땅에 위치해 있으며 명동, 종로 등 주요 상권이 겹칠 뿐 아니라 상징성도 있어... 안방보험은 지난해 말 서울 테헤란로 캐피탈타워 인수 입찰에 참가하기도 했다. 결과적으로 캐피탈타워는..."
1294,2016.08.10.,[국민의당] 제15차 비상대책위원회의 모두발언,"우리 국민의당은 서울 외 지방 첫 방문지로 전주, 전북을 선택했다는 그 의미를 새롭게 다지면서 우리의... 현재 지자체마다 전통시장 살리기에 앞장서고 있는데 제가 볼 때는 골목상권까지도 침해하는 대형마트 등에 대한..."
1295,2016.08.11.,[한경매물마당] 충남 태안군 바다 조망 수익형 펜션 등 8건,"중심상권 사거리 코너 대지 499㎡, 연면적 860㎡. 융자 7억9000만원, 보증금 7억6100만원, 실투자... (042)535-1110 대전 새롬공인 배종훈 ◆서울 강동구 명일동 대로변 신축 부지 빌라ㆍ아파트 밀집지역...."
1296,2016.08.18.,'좋음'과 악덕 사이,최근 서울 등 대도시 일부 초호화 상권지역에서나 나타나는 이른바 '젠트리피케이션(임대료 급등으로 원주민이나 영세업자들이 다른 곳으로 쫓겨나가는 현상)'이 제주에서 현실이 되고 있다. #돈이 세상의 전부가 돼선 안...
1297,2016.08.07.,[한경매물마당] 서대문구 역세권 수익형 신축 부지 등 16건,"(02)511-3390 강남 리얼티코리아 유진석 ◆서울 유명 대학가 중심상권 빌딩=코너 대지 240㎡, 연면적 660㎡의 6층 건물. 유동인구 풍부한 상권. 보증금 3억5000만원, 월 1480만원에 카페, 편의점, 학원 등 우량..."
1298,2016.08.09.,"1천 개 골목에 스토리 입히니, 연 114만 명 찾는 관광지로",상권도 자연스레 형성되고 있다. 이곳은 작년에만 관광객 100만명이 다녀가는 등 전국 관광명소로 명성을 크게 얻고 있다. 김광석 길은 예술공간으로 현재도 계속 진화 중이다. 김광석 거리를 찾은 김현미(48·서울시)...
1299,2016.08.11.,"전기료 누진폭탄, 패션·코스매틱 등 가두 매장으로 불똥?!",본격적인 단속이 시작된 10일 서울 명동 상권의 일부 매장 등은 여전히 문을 열어 둔 채 호객 행위와 함께 영업을 펼치고 있었다. 한 코스매틱 매장 매니저는 “요즈음 같이 어려운 시기에 유커 등 고객 한명이라도 더...
1300,2016.08.09.,"주영섭 중기청장, 부천시 나들가게 점포 방문... 김만수 시장 등과 의견 청취",등 서울ㆍ경기 나들가게 선도지역 5개 지방자치단체 관계자들과 함께 나들가게 점주들의 의견 청취를 위한 간담회를 개최했다고 밝혔다. 나들가게는 중기청이 대형마트와 기업형 슈퍼마켓 등 대형 유통업체의 골목상권...
1301,2016.08.01.,들썩이는 한남뉴타운…3구역 이어 2·4·5구역도 '블록별 특화설계',이후 상권이 형성되면서 상가 입주자를 중심으로 재개발에 반대하는 여론이 커졌다. 서울시는 이 일대를 이태원 관광특구에 걸맞은 상업지역으로 운영하는 것이 적절하다는 결론을 내린 것으로 알려졌다. ◆재개발...
1302,2016.08.09.,"‘힐스테이트 녹양역’, 도보통학 가능해 수요자 관심 집중","지하철 이용 시 서울 북부권 이동이 용이하며, 시청·종로 등 중심업무지구까지 50분 대에 접근할 수 있어... 또한 의정부역을 중심으로 한 중심상권과도 인접하며 반경 5km 내에 백화점, 대형마트, 시외버스터미널..."
1303,2016.08.10.,"하남시, 개발 호재로 가치 상승… 지식산업센터 ‘눈길’","더군다나 하남시는 서울과 인접한데다 교통이 좋고, 풍부한 배후수요까지 갖추고 있다. 반면 임대료는... 주말상권 유입에도 유리할 전망이다. ‘하남테크노밸리(가칭)’의 홍보관은 경기도 하남시 풍산동 375-1번지에..."
