,date,title,contents
409,2016.03.28.,한강변 광진구 자양동 재건축 잰걸음…봄날 오나?,"서울 한강변의 대표적인 저개발지역인 광진구 자양동이 서서히 기지개를 펴고 있다. 28일 서울시와... 추진위는 “건대상권과 다양한 교육환경, 한경변에 인접해 한강 조망권과 한강공원 접근이 쉬운 점 등 명품..."
410,2016.03.25.,‘지루한 시티투어 버스는 가라’..성남 도시樂버스 힘찬 시동,"오는 11월 12일까지 매주 토요일 서울시청역(오전 8시), 교대역(오전 8시 30분), 성남시청(오전 9시)에서... 시는 ‘성남 도시락 버스’ 관광객에게 볼거리와 체험거리가 다양한 관광 상품을 제공하려고 성남시상권활..."
411,2016.03.24.,네이버 '쇼핑윈도' 흥행에 지방 중소도시 상권 '활기',"대표 쇼핑 O2O 플랫폼 네이버 ‘쇼핑윈도’가 서울, 부산, 대구에 이어 김해, 순천, 울산 등 지방 중소도시 상권에서 월 거래액 1억 원 이상을 기록한 스타셀러를 배출했다. 네이버는 쇼핑윈도 내 로드샵을 대상으로..."
412,2016.03.23.,"롯데백화점, 영 스트리트 패션전문점 ‘엘큐브(el CUBE)’ 오픈","한편, 홍대 상권은 일평균 유동인구 30만명이 넘는 서울 도심 핵심상권 중 하나로, 2호선과 공항철도, 경의선이 지나는 교통의 요지다. 홍대입구역 일평균 이용객수는 2014년 7만2000명에서 2015년 7만8000명으로 8% 이상..."
413,2016.03.27.,"용산구, 소상공인 창업아카데미 개최","- 29~30일 용산아트홀 가람에서 개최 - 예비 창업자와 업종 변경 소상공인 대상, 선착순 150명 모집 - 상권 분석, 온라인 마케팅 등 실무교육 진행 - 아카데미 수료자에게 서울시 특별보증자금 신청자격 부여 [서울..."
414,2016.03.23.,"대리기사협의체-대리운전업체, 상생협의회 출범","수도권 대리기사협의체와 대리운전업체 대표들은 23일 서울 여의도 중소기업중앙회에서 '상생협의회'를... 골목상권을 먹잇감으로 여긴 처사""라며 ""기존 대리운전 시장에 문제점이 있다면 업체들과 기사들이 서로 협상해..."
415,2016.03.21.,이대 52번가처럼…'신·홍·합' 청년창업 허브로 뜬다,"인근 대학과 연계해 청년 일자리를 창출하고, 쇠퇴한 지역 상권에 활기를 불어넣기 위한 것이다. 지난 11일 문을 연 ‘이화 스타트업(신생 벤처기업) 52번가’가 대표적인 사례다. 박원순 서울시장은 22일 이화여대에서..."
416,2016.03.30.,서대전역 KTX증편ㆍ동서고속철 등 '재탕ㆍ겹치기' 수두룩,이에 주변상권 매출이 감소하는 등 해당 지역의 민원이 끊임없이 제기된 바 있다. 이에 양당이 동시에... 더민주당이 약속한 ‘동서고속화철도(서울~춘천~속초) 건설사업’은 무려 30년 동안 선거공약으로 제시돼 ‘최장수...
417,2016.03.29.,[재보선 4·13 나요나!] 경기도의원 성남시 제7선거구,"강효석·이나영·서학선·김창균시설 확충·상권활성화 등 공약성남시 제7선거구(분당구 정자1·2동, 금곡... 단국대 행정법무대학원 초빙교수인 그는 ""박사학위를 받은 이후 22년간 국책연구원과 대학교, 서울시청, 기업..."
418,2016.03.30.,대구 선거대책위원회 회의 주요내용[보도자료],"그래서 오늘 포함 자정부터 서울의 첫 선거운동을 시작으로 저는 주로 수도권, 충청권, 인천권, 강원권... 대구경제가 활력을 잃고 일자리가 줄면서 많은 청년들이 다른 도시로 떠나고, 상권이 살아나지 않아서 상인들..."
419,2016.03.25.,한남1구역 `이태원상권` 기대감,원조 '이태원 상권' 임대료가 날로 오르면서 비교적 시세가 낮은 바로 옆 동네 한남뉴타운 1구역으로 상권이 확장됐다. 서울 지하철 6호선 이태원역 1번 출구 바로 앞에 있는 해밀톤호텔 일대는 인근 미군부대와...
420,2016.03.25.,한남1구역 `이태원상권` 기대감,원조 '이태원 상권' 임대료가 날로 오르면서 비교적 시세가 낮은 바로 옆 동네 한남뉴타운 1구역으로 상권이 확장됐다. 서울 지하철 6호선 이태원역 1번 출구 바로 앞에 있는 해밀톤호텔 일대는 인근 미군부대와...
421,2016.03.30.,70억 규모 빅데이터 시범·실증사업 공모,"2013년부터 수행한 빅데이터 시범사업은 서울시의 심야버스 노선정책 수립, 상권분석, 제조공정 효율화 등 산업 활성화와 AI(조류인플루엔자) 사전예측 등 안전관리에 있어 큰 성과를 거두어 왔다. 지난해에는 조선 및..."
422,2016.03.27.,현대시티아울렛 순항중이라는데,지난 11일 서울 도심 핵심상권중 하나인 동대문에 문을 연 ´현대시티아울렛 동대문점´의 개장 초반 인기가 심상치 않기 때문이다. 27일 현대백화점에 따르면 현대시티아울렛 동대문점은 이달 11일 개장 이후 보름 만에...
423,2016.03.28.,[Who Is ?] 이원준 롯데쇼핑 사장,"롯데백화점은 공정거래위원회를 상대로 시정명령 및 과징금납부명령 취소 소송을 제기했으나 서울고법은... 그는 ""롯데쇼핑은 상암 DMC 롯데복합쇼핑몰 입점으로 인근 전통시장 및 골목상권의 지역 상인들에게 경제적..."
424,2016.03.28.,"미래부, 2016년 빅데이터 활용 스마트서비스 시범사업 공모","지난 2013년부터 수행한 빅데이터 시범사업은 서울시의 심야버스 노선정책 수립, 상권분석, 제조공정 효율화 등 산업 활성화와 AI(조류인플루엔자) 사전예측 등 안전관리에 있어 큰 성과를 거두어 왔다. 지난해에는 조선..."
425,2016.03.29.,[실시간 거래]살기 좋은 아파트 대상 수상 이력… 강서구 `화곡푸르지오`아파...,"서울시 강서구 화곡동에 위치한 화곡푸르지오아파트는 2002년 10월 입주한 최고 15층, 총 50개동 2176세대... 향후 마곡지구의 개발로 인해 화곡동의 입주민은 마곡지구의 상권 또한 공유할 수 있을 것으로 이 지역 부동산..."
426,2016.03.23.,홍대에 패션숍 여는 백화점,롯데백화점은 오는 25일 업계 최초로 새로운 형태의 패션 전문점을 서울 홍대입구 상권에 선보인다. 23일 롯데백화점에 따르면 이날 오픈하는 영 스트리트 패션 전문점 '엘큐브(el CUBE)'는 콤팩트 점포로 20~30대 국내...
427,2016.03.29.,"판교 부동산, 삼성물산 이전 효과? “글쎄올시다”","◆ 알파리움, 저층부 상권 활성화가 관건 서울 분당선 판교역 1번 출입구를 나서자 공사 현장 가림막이 눈에 들어왔다. 이 현장을 비롯해 판교역과 맞닿은 총 8개 필지가 다름 아닌 ‘알파돔시티’다. 알파돔시티는..."
428,2016.03.28.,‘대리기사 쉼터’ 1호점 강남에 생겼다,[동아일보] 신논현역 주변에 오후 6시부터 다음날 오전 5시까지 운영 서울 강남구 지하철 9호선 신논현역은 강남권의 교통 중심지다. 교보타워와 리츠칼튼호텔 등 기업과 업무용 빌딩이 밀집해 강남 최고의 상권으로...
429,2016.03.24.,"동네 옷가게 ""네이버 입점하고 월 매출 1억 넘었어요""","쇼핑윈도의 스타일윈도에 입점한 로드숍 아이미마인 서울엔 홍대나 가로수길, 명동 등에 로드샵이 즐비해... 이들은 대부분 쇼핑윈도에 입점하기 전 불리한 가게 위치와 확대되는 모바일 상권에 제대로 대응하지 못해..."
430,2016.03.23.,"롯데백화점, 홍대 상권에 패션 전문점 '엘큐브' 오픈",[사진=롯데백화점 제공] 롯데백화점이 오는 25일 서울 홍대입구 상권에 젊은층을 겨냥한 패션 전문점 '엘큐브'를 선보인다. 엘큐브는 모든 종류의 상품을 판매하는 백화점과 달리 특정 종류의 상품만 판매하는...
431,2016.03.24.,"동네 옷가게 ""네이버 입점하고 월 매출 1억 넘었어요""","쇼핑윈도의 스타일윈도에 입점한 로드숍 아이미마인 서울엔 홍대나 가로수길, 명동 등에 로드샵이 즐비해... 이들은 대부분 쇼핑윈도에 입점하기 전 불리한 가게 위치와 확대되는 모바일 상권에 제대로 대응하지 못해..."
432,2016.03.25.,"성남 관광이 즐겁다, 도시樂 버스 운행","오는 11월 12일까지 매주 토요일 서울시청역(오전 8시), 교대역(오전 8시 30분), 성남시청(오전 9시)에서... 시는 '성남 도시락 버스' 관광객에게 볼거리와 체험거리가 다양한 관광 상품을 제공하려고 성남시상권활성화재..."
433,2016.03.28.,"'한 집 건너 또' 스타벅스, 공격적 출점의 명암은..",실제로 서울 강남역 반경 2km 주변엔 스타벅스 매장이 20개나 밀집해 있을 정도다. 스타벅스 측은 “올해도 작년과 비슷한 규모로 출점할 계획”이라고 밝혔다. 최근 스타벅스는 이면도로에 위치한 B급 상권이나 건물...
434,2016.03.28.,"[이브닝 이슈] '유커'에 지역 산업 '들썩', 역대 최대 단체관광","한꺼번에 많은 사람이 한국에 들어오기 때문에 지역상권 매출 증진에 상당히 기여하는 것으로 알려져... "" ============================== 서울 남대문 시장의 한 상점. [가게 점원] ""꿀 4만 원, 김 1만 5천 원, 초콜릿 1만 원...."
435,2016.03.29.,"[기업하기 좋은, 귀촌하기 좋은 문경 .1] 모두가 꿈꾸는 전원도시",&lt;문경시 제공&gt; 작은 도시에서의 문화생활이 부족하다면 서울이나 대구 등 대도시로의 나들이가 필요하다.... 각종 국제대회 개최뿐 아니라 스포츠산업과 이를 중심으로 한 새로운 상권형성 등 많은 변화가 예상되고 있다....
436,2016.03.28.,"SK건설, ‘성수역 SK V1 tower’ 분양 예정","서울의 센트럴파크로 불리는 약 35만 평 면적의 서울숲과 성동구 테마공원 등도 갖추고 있고, 성수역세권과 세종대, 건국대 인근에 조성된 대형상권까지 끼고 있어 생활 편의시설도 이용가능하다. 부동산 관계자는..."
437,2016.03.25.,[MK분양 현장리포트] 강남역 BIEL106 오피스텔,SK D&amp;D는 서울시 강남구 역삼동 832-16·18 일대에 '강남역 BIEL(비엘) 106 오피스텔'을 25일부터 분양한다고... 오피스텔은 대지 지분이 낮기 때문에 매입 시 시세차익보다는 주변 상권을 보고 접근해야 한다. 상권 발전...
438,2016.03.29.,"롯데백화점, ‘엘큐브’ 홍대점 오픈… 百도 SSM化 우려 목소리 높아",영업시간은 홍대 로드숍 및 주변 상권의 특성을 감안해 낮 12시부터 밤 10시까지 운영된다. 롯데백화점은 연내에 홍대 2호점을 비롯해 서울 신사동 가로수길 등 핫 플레이스와 백화점이 많지 않은 지방 주요 도시 등을...
439,2016.03.22.,남대문로 2층 한옥상가 등록문화재 지정된다,서울시 제공 일제강점기 조선 상권을 장악하려는 일본 상인들 틈에서도 끝까지 조선인이 소유한 것으로 알려진 이 건물은 2000년대 초까지만 해도 철거될 운명에 처해 있었다. 당시만 해도 높이가 다른 세 채의 이층...
440,2016.03.24.,"네이버 쇼핑윈도, 월 거래액 1억 원 이상 판매자 배출","네이버는 쇼핑윈도가 서울, 부산, 대구에 이어 김해, 순천, 울산에서 월 거래액 1억원 이상을 기록한... 이들은 대부분 쇼핑윈도에 입점하기 전 불리한 가게 위치와 확대되는 모바일 상권에 제대로 대응하지 못했다...."
441,2016.03.25.,[MK분양 현장리포트] 강남역 BIEL106 오피스텔,SK D&amp;D는 서울시 강남구 역삼동 832-16·18 일대에 '강남역 BIEL(비엘) 106 오피스텔'을 25일부터 분양한다고... 오피스텔은 대지 지분이 낮기 때문에 매입 시 시세차익보다는 주변 상권을 보고 접근해야 한다. 상권 발전...
442,2016.03.29.,"롯데백화점, ‘엘큐브’ 홍대점 오픈… 百도 SSM化 우려 목소리 높아",영업시간은 홍대 로드숍 및 주변 상권의 특성을 감안해 낮 12시부터 밤 10시까지 운영된다. 롯데백화점은 연내에 홍대 2호점을 비롯해 서울 신사동 가로수길 등 핫 플레이스와 백화점이 많지 않은 지방 주요 도시 등을...
443,2016.03.22.,남대문로 2층 한옥상가 등록문화재 지정된다,서울시 제공 일제강점기 조선 상권을 장악하려는 일본 상인들 틈에서도 끝까지 조선인이 소유한 것으로 알려진 이 건물은 2000년대 초까지만 해도 철거될 운명에 처해 있었다. 당시만 해도 높이가 다른 세 채의 이층...
444,2016.03.31.,"이인제 최고위원 ""새누리당이 세종시 국회분원 설치할 터""","서대전역 주변 상권붕괴와 관련, ""KTX 호남ㆍ경부선의 40%가 오는 6월부터 서울 수서역에서 출발한다""며 ""면허조건에 KTX는 일반철로에서 운행할 수 없게 돼 있지만 (새누리당은) 면허조건을 바꿔서라도 수서에서 출발하는..."
445,2016.03.28.,특색 사라지는 명동 상권,"이러다 보니 명동은 중국인들의 취향에 맞게 상권도 변했습니다. 특히 중국인들이 선호하는 한국 화장품 가게가 크게 늘어나, 현재는 화장품 가게만 141곳에 달합니다. 서울의 중심부에 자리 잡아 일제강점기부터 시작해..."
446,2016.03.30.,"‘더 작게, 골목으로… ’ 편의점·미니백화점 등 일본식 유통모델 확산",택배 보관함 서비스도 서울 독산 동길점에서 시범 운영 중이다. CU 관계자는 “11번가의 경우 택배 픽업과... 롯데백화점 관계자는 “상권에 따라 전략을 달리하고 있다”며 “연내 엘큐브 2호점을 낼 것”이라고 말했다....
447,2016.03.22.,"소상공인 ""대기업 독식 안돼…미니면세점 도입""","현재 정부는 면세점 특허기간을 연장하는 것과 함께 서울시내 면세점 사업자를 추가로 허용하는 방안을... 연합회는 ""우리나라도 일본처럼 지역특화 골목상권 미니면세점 제도 도입이 시급하다""며 ""정부의 면세점 제도..."
448,2016.03.25.,중국 선진시 뤄후구청장 등 강서구 방문한 이유?,병원 등 의료관광특구 탐방과 경제교류 활성화 방안 논의 [ 의료관광특구로 명성을 높여가고 있는 서울... 특히 뤄후구는 홍콩과 인접한 지리적 이점으로 선전시에서 가장 오래된 상권이 있는 지역이다. 노현송...
449,2016.03.25.,"성남시, '도시樂 버스'운행으로 관광 활성화 노린다","오는 11월12일까지 매주 토요일 서울시청역(오전 8시), 교대역(오전 8시 30분), 성남시청(오전 9시)에서... 한편 성남시는 '성남 도시락 버스' 관광객에게 볼거리와 체험거리가 다양한 관광 상품을 제공하려고 성남시상권활..."
450,2016.03.25.,성남 도시락버스···계절별 다양한 관광코스 운영,"11월 12일까지 매주 토요일 서울시청역(오전 8시), 교대역(오전 8시 30분), 성남시청(오전 9시)에서 관광객을... 시는 '성남 도시락 버스' 관광객에게 볼거리와 체험거리가 다양한 관광 상품을 제공하려고 성남시상권활성..."
451,2016.03.30.,"[오늘밤TV] '영재발굴단' 이준혁 사교육없이 영재원 수업, 비밀은 지하철? 19...","주변 상권까지 모조리 외우고 있다. 지하철에 푹 빠진 준혁이를 위해 지하철이 보이는 아파트로 이사를... 정도로 대단하다""며 혀를 내둘렀다. 30일 수요일 오후 8시 55분 방송. [스타서울TV 이현지 기자/사진=SBS '영재발굴단']"
452,2016.03.27.,[한경매물마당] 신림 수익형 빌딩 등 15건,"(02)567-5235 강남 ERA포시즌 신정일 ◆서울 강서구 중심상권 코너 빌딩=대로변 횡단보도 앞 주 통행로 대지 460㎡, 연면적 1050㎡. 보증금 8억원, 월 2500만원. 1층 유명 프랜차이즈 및 휴대폰 대리점 입점...."
453,2016.03.27.,"다양한 아이디어와 콘텐츠 확보, 창의적인 복합문화공간 탄생","[스포츠서울] 커피 업계의 경쟁이 과열 양상으로 치달으면서 커피 전문점이나 카페들이 다양한 모습으로... 입소문을 타고 가맹 요청이 쇄도하자 (주)후프렌즈는 체계적인 물류 유통 시스템, 상권 분석 시스템, 가맹점..."
454,2016.03.24.,'태전IC 효성해링턴 플레이스' 24·25일 1·2순위 청약접수,"이 도로를 통하면 분당까지 10분대, 서울 강남까지 20분대로 이동이 가능하다. 광주역을 비롯해... 신 상권과도 가깝다. 신 상권은 주거지역 내에 위치한 만큼, 학원·어린이집·마트·편의점·병원·약국 등이 발달해..."
455,2016.03.22.,남대문로 마지막 2층 한옥상가 100년전 원형 회복한다,"조선 초 이래로 종로와 함께 시전이 밀집한 대표적인 서울의 상업 지구인 남대문로에 자리잡은 이 상가는 일제강점기 조선 상권을 장악하려는 일본상인들 틈에서도 끝까지 조선인이 소유했으며, 현재까지 원 위치를..."
456,2016.03.24.,"네이버 '쇼핑윈도', 월거래액 1월 이상 스타셀러 나와","[네이버] 네이버 '쇼핑윈도'가 서울, 부산, 대구에 이어 김해, 순천, 울산 등 지방 중소도시 상권에서 월거래액 1억원 이상을 기록한 스타셀러를 배출했다. 24일 네이버에 따르면 로드샵을 대상으로 하는 서비스인..."
457,2016.03.23.,홍대 상권에 패션·화장 전문점 여는 롯데百…이유는,"홍대 상권은 일평균 유동인구가 30만명이 넘는 서울 도심의 핵심 상권 중 하나다. 인근에 홍익대학교 뿐 아니라 연세대·이화여대·서강대 등이 있다. 엘 큐브에 입점한 브랜드로는 보이런던, 어드바이저리, 라인프렌즈..."
458,2016.03.24.,대형 쇼핑테마파크 vs 초미니 백화점,"우선 올해 안에 서울 홍익대 인근에 엘큐브 2호점을 추가로 출점한다. 향후 상권 분석을 통해 생활용품, 화장품 등을 판매하는 전문점 브랜드를 새로 도입할 계획이다. 이미 6종류의 전문점을 113곳에서 운영하는 일본..."
459,2016.03.28.,"닭볶음탕 전문 프랜차이즈, 소자본 성공 창업 아이템으로 주목!","[스포츠서울] 치킨 공세에 밀려 주춤했던 닭볶음탕의 인기가 다시 높아지면서 차별화된 맛으로 성공을... ‘더닭’은 물류 유통 체계와 상권 분석 시스템, 매출 UP 프로그램 등 창업 지원 시스템이 완벽하고 음식..."
460,2016.03.28.,"닭볶음탕 전문 프랜차이즈, 소자본 성공 창업 아이템으로 주목!","[스포츠서울] 치킨 공세에 밀려 주춤했던 닭볶음탕의 인기가 다시 높아지면서 차별화된 맛으로 성공을... ‘더닭’은 물류 유통 체계와 상권 분석 시스템, 매출 UP 프로그램 등 창업 지원 시스템이 완벽하고 음식..."
461,2016.03.23.,G밸리 취업·창업 구로구가 나선다,"위해 서울신용보증재단과 손잡고 소상공인 창업아카데미도 개최한다고 밝혔다. . 내달 19일과 20일 이틀간 구청 강당에서 열리는 이번 아카데미에서는 각 분야 전문 강사진들이 나서 소상공인 창업 준비절차, 상권분석..."
462,2016.03.24.,"네이버 O2O 쇼핑 플랫폼 '쇼핑윈도', 지방에서도 월 거래액 1억 돌파 매장 잇...","네이버는 쇼핑 O2O 플랫폼 '쇼핑윈도'가 서울, 부산, 대구에 이어 김해, 순천, 울산 등 지방 중소도시 상권에서 월 거래액 1억 원 이상을 기록했다고 24일 밝혔다. 네이버 쇼핑윈도 내 로드샵을 대상으로 하는 서비스..."
463,2016.03.23.,홍대에 패션전문점 생긴다… 젊은 층 선호 브랜드 입점,"롯데百, ‘엘큐브’ 25일 오픈 롯데백화점이 서울 홍대입구 상권에 젊은 세대를 겨냥한 패션 전문점을 선보인다. 롯데백화점은 오는 25일 서울 마포구 홍익로에 여러 브랜드를 한데 모은 편집 매장 ‘엘큐브(el CUBE)..."
464,2016.03.23.,'Buy' 가고 'Live' 온다,게다가 지역 내 중심상권의 노후도가 높아 서울 중심부로 소비층이 유출되는 경향까지 나타나 선호 지역으로 매력까지 낮아지고 있다. 그중에서도 특히 파주 운정신도시는 매매가격이 가장 낮은 것으로 나타났다....
465,2016.03.21.,한수원 경주 신사옥서 '첫 업무'…경주시대 개막,한수원은 21일 서울 삼성동에서 근무하던 1200여 명의 임직원이 경주 양북면 장항리 신사옥으로 모두... 이와 함께 청사 현관 및 로비 등에 환영 현수막을 걸고 출근하는 직원들에게는 경주의 교통·관광·상권·학교...
466,2016.03.27.,[창업 현장] 설비 줄이고 인테리어 재활용…알뜰창업이 뜬다,"“동네상권이나 대학가 등에서 적은 비용을 들여 꾸준히 수익을 내려는 소자본 창업자들의 문의가 많다”고... 이지성기자 engine@sed.co.kr ▶ 돈이 보이는 뉴스 '서울경제 페이스북' ""좋아요 클릭클릭~""▶ '썸 타는' 특별한..."
467,2016.03.29.,"스테프핫도그, 2016년 신규 모델 ‘스테프핫도그 3.0’ 출시",또한 서울을 비롯한 5개 지역에서 입점이 진행 중으로 알려졌다. 스테프코리아 점포개발 팀장은 “백화점 및 대형마트 등 다양한 특수상권 내 성공적인 진입으로 ‘특수상권의 강자’ 이미지에서 벗어나 일반...
468,2016.03.25.,"롯데, 2030 패션전문점 ‘엘큐브’ 오픈",홍대입구에 편집 매장 첫선 젊은층 신규고객 창출 포석 롯데백화점이 서울 홍대입구 상권에 젊은 층을 겨냥한 패션 전문점을 선보인다. 새로 문을 여는 영 스트리트 패션 전문점 ‘엘큐브(el CUBE·사진)’는 20~30대 젊은...
469,2016.03.26.,"[토요경제]고시원族 학원비-식비 쓸때, 오피스텔族 여행-쇼핑 ‘펑펑’",지난달 1일 서비스를 시작한 서울시의 ‘우리 마을 가게 상권 분석 서비스’(golmok.seoul.go.kr)는 BC카드에서 제공한 카드 결제명세 등의 빅데이터를 토대로 골목 상권에 대한 분석 자료를 제공한다. 특히 이미 자영업에...
470,2016.03.25.,"롯데, 2030 패션전문점 ‘엘큐브’ 오픈",홍대입구에 편집 매장 첫선 젊은층 신규고객 창출 포석 롯데백화점이 서울 홍대입구 상권에 젊은 층을 겨냥한 패션 전문점을 선보인다. 새로 문을 여는 영 스트리트 패션 전문점 ‘엘큐브(el CUBE·사진)’는 20~30대 젊은...
471,2016.03.21.,"원전 컨트롤타워 한수원, 본격적인 경주시대 개막","건축물로, 서울 삼성동 본사에서 근무하던 1200여명의 임직원이 새 보금자리에 둥지를 틀었다. 최양식... 또 청사 현관 및 로비 등에서 환영 현수막을 걸고 출근하는 직원들에게 경주의 교통·관광·상권·학교·병원 등..."
472,2016.03.26.,"[토요경제]고시원族 학원비-식비 쓸때, 오피스텔族 여행-쇼핑 ‘펑펑’",지난달 1일 서비스를 시작한 서울시의 ‘우리 마을 가게 상권 분석 서비스’(golmok.seoul.go.kr)는 BC카드에서 제공한 카드 결제명세 등의 빅데이터를 토대로 골목 상권에 대한 분석 자료를 제공한다. 특히 이미 자영업에...
473,2016.03.27.,"광주역 개통 앞둔 태전지구, '태전IC 효성해링턴' 분양",제3차 국가철도망구축 계획안에는 서울 강남구 수서역~경기 광주를 연결하는 수서~광주(19.2km) 복선전철... 신 상권과도 가깝다. 태전지구 신 상권은 주거지역 내에 위치한 만큼...
474,2016.03.29.,3658세대 입주하는 '고덕 래미안 힐스테이트'단지 상가 분양,[사진설명: 고덕 래미안 힐스테이트 조감도] 삼성물산과 현대건설이 서울시 강동구 고덕동 670 일대에... 항아리 상권으로 불린다. 항아리 상권은 지역 특성상 독립된 상권이 더 이상 팽창하지 않고 소비자들이 다른...
475,2016.03.25.,[자치단체장 25시] 김은숙 부산 중구청장,[서울신문] ‘만면에 늘 미소가 가득하다. 그에게는 사람을 끄는 매력이 있다. ’ 아마 친화력이리라. 그게... 하지만 부산항 개항 이래 부산의 최고 번화가였던 중구는 시청 등 공공기관이 옮겨가면서 상권 침체와...
476,2016.03.23.,[Who Is ?] 최양하 한샘 회장,"◆ 생애 최양하는 1949년 10월7일 서울에서 태어났다. 서울 보성고를 거쳐 서울대 금속공학과를 졸업했다.... 골목상권 침해, 중국산 저가제품 대량공급으로 문제를 일으키고 있다고 비판했다. 조합 측은 한샘이펙스의..."
477,2016.03.25.,"성남시, 관내 명소 관광 '도시樂 버스' 운행","오는 11월 12일까지 매주 토요일 서울시청역(오전 8시), 교대역(오전 8시 30분), 성남시청(오전 9시)에서... 시는 성남 도시樂 버스 관광객에게 볼거리와 체험거리가 다양한 관광 상품을 제공하려고 성남시상권활성화재..."
