,date,title,contents
823,2016.03.17.,[돈되는 분양] 수익형 상가 투자 `입지·미래가치·배후수요` 세 가지 꼭 따져...,지역개발 호재가 풍부해 앞으로 상권 형성이 기대되는 곳이라면 초기에 상가를 선점하는 것이 유리하다.... 먼저 KTX광명역 이용 시 현재 서울역까지 15분이면 도달 가능하며 KTX광명역에 인천공항 도심터미널을 내년...
824,2016.03.21.,"홍대 상가 수익률, 전국에서 가장 높다",본문 이미지 영역 서울 홍대 인근과 합정의 상가 수익률이 전국에서 가장 높은 것으로 나타났다. 21일... 되면서 상권을 활성화시켰다. 특히 공항철도가 개통하면서 인천공항에서 홍대까지의 이동이 빨라져 홍대를...
825,2016.03.10.,먹고 놀고 쇼핑하고…도심형 아웃렛 이 정도는 돼야,현대시티아웃렛 동대문점 전경 현대백화점이 서울 도심의 핵심 상권인 동대문에 새로운 스타일의 도심형 아웃렛을 선보인다. 기존 도심형 아웃렛이 패션 브랜드 중심의 쇼핑몰이었다면 이번에 오픈하는 현대시티아웃렛...
826,2016.03.10.,"현대百, 체험형 아울렛으로 동대문 상권 진출",현대백화점이 서울 도심의 핵심 상권인 동대문에 체험형 라이프스타일몰을 콘셉트로 한 '도심형 아울렛'을 선보인다. 외국인 관광객 유치 등을 통해 이곳에서 오는 2017년 매출 2천억 원을 달성한다는 목표다. 10일...
827,2016.03.27.,[현장르포] 개포지구 재건축 포문…'래미안 블레스티지',"서울 개포지구 재건축의 포문을 여는 삼성물산의 '래미안 블레스티지'에 대한 수요층의 관심이 집중됐다.... 호텔 제휴 서비스가 도입될 경우 관리비가 얼마나 상승하는지, 단지 앞 4차선 신설 여부가 가능한 지, 상권..."
828,2016.03.11.,"이화여대 골목에 뜬 이대생 사장님들 ""창업 꿈 이뤄…52번가의 기적 일굴 것""",뒷골목 상권에도 '활기' [ 마지혜 기자 ] 최경희 이화여대 총장(오른쪽 세 번째)과 문석진 서대문구청장(맨 왼쪽)이 11일 서울 대현동 이화여대 정문 왼쪽 골목에서 열린 '이화 스타트업 52번가' 개장 행사에서 재학생들이...
829,2016.03.10.,서촌 한옥마을에 프랜차이즈 음식점.카페 개업 사실상 금지,"앞으로 서울 종로구 경복궁과 인왕산 사이 서촌 한옥마을에 새로 프랜차이즈 음식점과 카페를 여는 게... 개인이 운영하는 음식점과 카페도 효자로, 옥인길, 배화여대 주변 등 기존 상권 지역을 빼고는 개점이..."
830,2016.03.18.,[위크엔드]1인가구의 성지 샤로수길 프랜차이즈 메카로 뜬다,2010년 무렵 강남 상권이 팽창하면서 임대료가 천정부지로 오르자 이를 감당하기 어려워진 젊은 창업자들이 인근 대학가 상권을 찾던 중 서울대입구역 인근으로 모여든 것. 세탁소·미용실·가정집 사이사이에 음식점이...
831,2016.03.22.,"브랜드 아파트로 변신한 단독주택 재건축, ""어! 돈되네~""","지하철역이나 상권 등이 잘 조성돼 환금성이 높아 집값 상승률이 높다""는 말도 덧붙였다. 올해도 대형사가 공급하는 서울 단독주택 재건축 사업이 잇따를 예정이다. 특히 실수요자들이 선호하는 중소형 아파트의..."
832,2016.03.17.,"""송도를 잡아라""…현대·롯데·신세계 유통대전 시작됐다",롯데와 신세계는 송도 시내 중심 한복판에서 지역 상권을 놓고 ‘한판 승부’를 벌일 전망이다. 롯데는... 바다와 갯벌을 메워 서울 여의도 면적의 17배 규모로 조성되는 송도국제도시는 지난 1월 말 현재 외국인...
833,2016.03.15.,"5C로 관광객 모으는 중구 전통시장 ‘Oh, Yes’",있는서울 중구(구청장 최창식)가 전통시장의 경쟁력을 향상시키기 위한 '혁신 5C’를 마련하고 전통시장... 상인들 의지와 노력으로 독창적인 아이디어를 개발하고 상권을 활성화하려는 시장에 우선적으로 지원해...
834,2016.03.17.,"성동구 ""젠트리피케이션 막는다""…상호협력위원회 구성",서울 성동구는 지역상권과 공동체를 살리기 위해 각 분야 전문가들이 모인 지역공동체 상호협력위원회를 구성하고 위촉식을 가졌다고 17일 밝혔다. 상호협력위원회는 젠트리피케이션(구도심이 번성하면서 임대료가...
835,2016.03.18.,가로수길 동상이몽…3년간 빌딩거래 `0`,"거래가 될 리 없지요."" 서울 중심 상권으로 떠오른 강남구 신사동 가로수길 일대 건물들의 호가가 천정부지로 치솟으면서 빌딩 거래가 뚝 끊겼다. 18일 부동산 업계에 따르면 압구정로 12길, 도산대로 13길 등 이른바..."
836,2016.03.16.,횡단보도 있어야 vs 지하상권 무너져…이해관계 엇갈려,그러니까 힘들죠.] 실제로 서울시는 여러 차례 횡단보도 설치를 검토했습니다. 하지만 지하상가 상인들의 반발이 커 결정을 못 내리고 있는 상황입니다. 상인들은 횡단보도가 설치되면 지하상가 상권이 무너질 것이라는...
837,2016.03.22.,놀부만의 모던함 더한 세련된 복고풍 콘셉트를 담다… 놀부옛날통닭,서울시 강동구 명일동에 위치한 놀부옛날통닭 매장은 동네 상권이라는 환경에서도 오픈 한달 만에 5천여 명의 방문객을 모으며 예상을 웃도는 일 평균 매출을 기록한 바 있다. 치킨 업계가 포화상태라는 지적도 제기되고...
838,2016.03.21.,"[실시간 거래]베드타운은 옛말…자족형 주거타운 분당구 `이매한신`, 3억 2,8...","단지 근처에는 강남, 건국대, 을지로, 종로 등 서울 주요 지역으로 향하는 다양한 노선의 광역버스들이... 대형 상권이 갖춰져 있다. 또한 분당소방서가 가까운 곳에 있다. [자료제공 : 한신공인중개사사무소]..."
839,2016.03.15.,신도림 보조금 대란…휴대폰 공급 차단 강수,지난 13일 서울 신도림 테크노마트에서 스마트폰 잔금을 치르기 위해 현금을 찾으려는 사람들이 길게 줄 서... 신도림에 국한됐던 불법 영업 지역도 강변 등 다른 상권으로 퍼져나갈 조짐을 보이고 있다. 강변 테크노마트...
840,2016.03.21.,'고양도시관리공사'고양종합터미널 환승주차장 운영 개시,"지역 상권 활성화도 기대된다. 원당역, 화정역에 이어 백석역을 이용하여 서울로 출근하는 시민들의 환승주차장 이용으로 많은 편리성이 예상된다. 임태모 사장은 5월 유료 정상 운영에 맞춰 세심한 현장 안전점검과..."
841,2016.03.13.,"새 노량진 수산시장... ""저기 들어가면 다 망한다""",판매 자리를 1.5평으로 계획한 이유는 현재 면적이 1.5평이고 서울시의 고가도로 계획을 반영하면서 가능한... 합의에 따라 책정된 관리비 수준도 판매 자리가 일류 고정 상권을 유지하고 있으며 대한민국 최고의 수산시장...
842,2016.03.17.,[돈되는 분양] 위례신도시 입주 본격화…상가 몸값 올라간다,"중일 라크리움이 들어서는 위례 우남역 상권 전경. 수도권 신도시 부동산 시장 흐름이 빠르게 변화하고... 위례신도시는 서울 송파구 장지동, 거여동과 경기도 성남시, 하남시 일대 677만4628㎡에 조성되며 2017년까지..."
843,2016.03.10.,패션·식사·체험몰 일석삼조 도심형 아울렛 떴다… 현대시티아울렛 동대문점...,서울 동대문에서 11일 개장하는 현대백화점의 도심형 아울렛 2호점 ‘현대시티아울렛 동대문점’ 전경.... 지하 6층∼지상 9층의 현대시티아울렛 동대문점은 3만7663㎡ 영업면적으로 동대문 상권 내 쇼핑몰 중 최대...
844,2016.03.16.,[돔구장시대] 두고 두고 아쉬운 동대문 구장,고척 | 박진업기자 upandup@sportsseoul.com [고척=스포츠서울 장강훈기자] “두고 두고 아쉬워.” 올해부터... 모 구단 관계자는 “사통팔달 교통망에 동대문 새벽시장까지 위치해 있기 때문에 상권이 살아나지 않았을까”...
845,2016.03.16.,"""'부산 명예의전당' 용두산공원에 만들자""","지역상권 활성화라는 세 마리 토끼를 모두 잡을 것을 촉구한다""고 밝혔다. 안 의원은 ""부산시청 주변지역은... 않다""며 ""서울의 경우 지상 8층 최신 빌딩형 학교를 건립, 3~4층을 옥상 정원으로 특화시켜 학교용지를..."
846,2016.03.18.,"[식음료 특집] 빙그레 바나나맛우유, 바나나의 모든 것 ‘옐로우 카페’","[서울신문] 빙그레가 지난 11일 바나나맛우유 플래그십 스토어인 ‘옐로우 카페’를 현대시티아울렛... 빙그레가 동대문에 첫 플래그십 스토어를 연 것은 근처 상권의 부상과 무관하지 않다. 동대문은 패션 쇼핑몰, 문화재..."
847,2016.03.20.,"가락몰 개장 준비 '한창'…""이전 대상 상가 65% 계약 완료""",게 서울시농수산식품공사 측 설명이다. 공사는 입주자 개별 시설공사가 마무리되고 청과직판 상인 문제가... 아울러 지하철 3호선과 8호선의 추가 연결로 개설과 가락몰 인근 가락시영아파트의 재건축은 상권 활성화의...
848,2016.03.07.,"옛 노량진수산시장 16일 철거…상인들 ""강제철저 육탄저지""","기존의 소매자리 상인 400여명 집단 반발, 제2 용산사태 우려도 [CBS노량진수산시장 (사진=자료사진)서울... 수협에 따르면, 기존 건물의 경우 상권에 따라 1~6등급으로 분류해 1등급 자리의 경우 월 임대료 26만원, 2등급은..."
849,2016.03.17.,"아모레퍼시픽, 즉시환급제 및 테마 패키지 선보여 ""2030요우커를 사로잡아라""",많은 상권에 확대 적용할 계획이다. 단체 관광보다 자신만의 특별한 경험을 찾는 요우커들을 공략하기 위한 마케팅도 전개한다. 아모레퍼시픽의 뷰티 디바이스 브랜드 메이크온은 JW 메리어트 동대문 스퀘어 서울과...
850,2016.03.16.,울산 수암시장 맛집 8곳 선정…부산횟집 등,"이번에 선정된 맛 집 BEST 8곳은 부산횟집, 시골여행, 왕고래, 경북족발, 서울떡집, 서라벌식육, 염서방... 운영 등 상권 활성화를 위한 사업을 하게 된다. jourlkim@ [ⓒ 뉴스1코리아(news1.kr), 무단 전재 및 재배포 금지]"
851,2016.03.13.,영등포 준공업지 재개발 `올스톱`,도시환경정비사업은 제대로 개발되면 도심과 상권에 활기를 불어넣고 주택과 산업시설(지식산업센터)을 같이 짓는 만큼 젊은층이 선호하는 직주(職住) 근접 개발이 가능하다. 13일 서울시 등 부동산 업계에 따르면...
852,2016.03.10.,[르포]현대가 보는 도심아울렛의 정석…현대시티아울렛 동대문돌아보니,현대백화점은 서울 강남·북 내 수도권에서 1시간 이내 도착 가능한 접근성을 무기로 시티아울렛의 강점으로... 동대문 상권과의 차별점으로 내세우고 있다. 명동처럼 맛집이 없고 매장 환경이 노후화돼 있는 동대문 기존...
853,2016.03.10.,"현대백화점, 동대문에 도심형 아웃렛 개점…""새 모델 제시""","현대백화점은 지하철 4개 노선과 버스 60개 노선이 겹치는 대중교통 편리성, 하루 유동 인구가 30만명이 넘는 서울 도심의 핵심 상권을 활용한 외국인 관광객 유치 등을 경쟁력으로 꼽았다. 편리한 대중교통망을 통해..."
854,2016.03.17.,"""200만원 월세가 2년새 400만원""…잔인한 '임대료 풍선'",부동산114에 따르면 지난해 4분기 상수동 상가 평균 임대료는 1㎡ 당 3.52만원으로 홍대상권(3.68만원)에 육박했다. 최근 3년 동안 인상률은 42.8%로 홍대(31.3%)보다 높았다. 서울시는 지역경제 활성화를 위해 지난해 11월 건물주...
855,2016.03.18.,천호뉴타운 사업 탄력 받는다,"천호시장은 상권이 다 죽었어요. 개인적인 생각으로는 빨리 되면 좋을 것 같고 이 부근에 사람들은 다 마찬가지일 거예요. 뭐가 형성돼서 이뤄져야 하는데 그렇지가 않잖아요."" 최근 서울시가 다음 달부터 본격적으로..."
856,2016.03.16.,"서초구, 원주민과 임차상인 보호하는 젠트리피케이션 추진","[시민일보=이대우 기자] 서울 서초구(구청장 조은희)가 테마가 있는 골목길 상권 활성화 및 지역상권 보호를 위해 TF팀구성, 주민협의체 구성, 조례 제정 등 구도심 활성화로 임대료가 올라 원주민과 임차상인이 내몰리는..."
857,2016.03.16.,"노량진 수산시장, 현대식 건물로 바뀌었는데 입점거부 사태 왜?","지으면 상권이 무너지고 물류 이동이 효율적이지 않다는 주장을 한 것은 상인들""이라고 말했다. 그는... 본문 이미지 영역 16일 새벽 서울 노량진수산시장 현대화시장에서 첫 경매가 실시돼 중도매인들이 전국에서..."
858,2016.03.23.,"소상공인연합회, 면세점 제도개선 움직이는 정부…대기업 전유물 전락 '안돼'",(서울=NSP통신) 이광용 기자 = 정부가 면세점 경쟁력 강화차원으로 특허기간 연장과 시내면세점 사업자... 이 같은 우려상황에 대한 개선안으로 일본의 미니면세점 제도가 중소상공인의 면세점 시장 참여와 골목상권에...
859,2016.03.03.,"동부화재, 동해 북평·양양시장에 4억3700만원 지원","【서울=뉴시스】 동부화재는 2일 강원 춘천시 내 강원도청 본관에서 '동부화재와 중소상인 상생을 위한... 또 장바구니 1만개 제작, 주변 벽화그리기 지원, 50개 점포 상가매대 지원 등 상권 활성화 사업도 전개한다...."
860,2016.03.03.,"동부화재, 동해 북평·양양시장에 4억3700만원 지원","【서울=뉴시스】 동부화재는 2일 강원 춘천시 내 강원도청 본관에서 '동부화재와 중소상인 상생을 위한... 또 장바구니 1만개 제작, 주변 벽화그리기 지원, 50개 점포 상가매대 지원 등 상권 활성화 사업도 전개한다...."
861,2016.03.11.,"쫓기듯 개장 아직도 공사중…'반쪽영업' 면세점, 손님이 없다",정부 시책에 맞춰 급히 문을 연데다 명품 유치까지 난항을 겪어 매장 곳곳이 썰렁해 '서울의 관광자원'이... 2개월 후에 핵심상권인 명동과 동대문에 위치한 신세계면세점과 두타면세점까지 영업을 개시하면 '낙동강...
862,2016.03.16.,"[카드뉴스] 2016년판 ""방 빼"" 젠트리피케이션의 현주소","서울에서 가장 ‘핫한’ 장소 홍대, 삼청동, 신사동 가로수길, 경리단길. 이곳의 또 다른 공통점은 무엇일까요. ‘젠트리피케이션’의 대표적인 장소입니다. 젠트리피케이션이란 특정지역의 상권 발달로 임대료가..."
863,2016.03.15.,양천구 골목형시장 육성 탄력… 중기청 공모사업에 4곳 선정,"서울 양천구(구청장 김수영)의 골목형시장 육성 사업이 탄력을 받았다. 양천구는 중소기업청에서... 특히 시장별로 이벤트, 축제, 주변상권 및 아파트와 공동으로 진행하는 마케팅 등을 통해 전통시장이 지역거점..."
864,2016.03.14.,[3/14] 주간 오피스 시세 및 추천 임대 물건,"주력하여 서울 주요 지역에서 유일하게 작년보다 공실률이 줄어들 것으로 보아 약간의 임대료 인상이... 마포역 대로변 오피스 상권 메인에 위치하여 고객 유입이 용이하다. 금융권, 병원, 여행사 등의 업종을..."
865,2016.03.11.,현대시티아울렛 동대문점 11일 오픈,동대문 케레스타 건물(옛 거평프레야)의 지하 6층∼지상 9층에 선보인 현대시티아울렛 동대문점은 영업면적이 3만7663m²로 서울 동대문 상권 내 쇼핑몰 중 가장 크다. 입점 브랜드는 270개로 현대홈쇼핑의 첫 오프라인...
866,2016.03.10.,"현대시티아울렛 동대문점 11일 오픈... ""식품 전문관·체험시설로 외국 관광객...",서울시 중구 동대문 상권에 오픈하는 현대시티아울렛 동대문점. / 현대백화점 제공 현대백화점은 “11일 도심형 아울렛 2호점인 현대시티아울렛 동대문점을 오픈한다”고 10일 밝혔다. 식음료매장(F&amp;B) 전문관과...
867,2016.03.24.,<사설> 전국의 교통 요충지 서대전역 살려야 한다,"지난해 4월 호남고속철 KTX가 개통하면서 단절됐던 서대전~호남 구간의 복원이 서울 수서발 KTX가 개통하는... 이에 따라 서대전역 이용자들의 불편이 계속되고, 서대전역 역세권의 상권 쇠락이 가속화할 것으로 우려된다...."
868,2016.03.23.,"‘안성 당왕지구삼정그린코아 더 베스트’ , 23일부터 정당계약 시작","2025년 개통예정인 서울-세종고속도로가 완공되면, 서울 강남까지 약 30분대로 도달할 수 있다. 안성IC... 안성지역 내 도립안성의료원이 단지 바로 옆으로 확장 이전할 예정이며, 한경대학교 중심상권도..."
869,2016.03.16.,"오피스텔, 제2의 봄 맞나… 하남 미사강변도시 오피스텔 ‘활황’","오피스텔은 입지가 무엇보다 중요하기 때문에 역세권에 위치했는 지를 우선적으로 보고, 교통 및 주변 상권을 꼼꼼하게 살펴본 후에 투자를 하라는 것. 특히 서울의 경우 오피스텔은 이미 포화시장이다. 개발이 충분히..."
870,2016.03.21.,"고양도시관리공사, 고양종합터미널 환승주차장 5월부터 정상 운영","지역 상권 활성화도 기대된다. 원당역, 화정역에 이어 백석역을 이용해 서울로 출근하는 시민들의 환승주차장 이용으로 많은 편리성이 예상된다. 임태모 사장은 ""5월 유료 정상 운영에 맞춰 세심한 현장 안전점검과..."
871,2016.03.24.,"[특별기고]문화관광도시 '울산, 중구로다(中具路多)'",전 세계뿐 아니라 국내에서도 서울을 비롯한 많은 지방자치단체가 관광경쟁력을 높이기 위해 생태도시... 새로운 상권창출로 미래가 기대되는 매력적인 도시다. 더욱이 올해부터 시작되는 원도심 도시재생사업인 '울산...
872,2016.03.17.,[한경매물마당] 경기 동탄2신도시 대기업 프랜차이즈 상가 등 8건,고속ㆍ시외버스터미널 상권. 남향 1층 상가. 2~4층 주택. 융자 8억원. 실투자 8억6000만원에 월 수입... 010-8935-6236 시흥 행운공인 이미향 ◆서울 효창공원역 도보 3분 신축빌라 105㎡ 빌라. 방 3개ㆍ화장실...
873,2016.03.18.,"거성치킨, 치킨창업 '사업설명회' 실시","브랜드로, 서울 경기를 위주로 38개 가맹점을 두고 있다. 이번 사업설명회는 시식회, 제품개발 및 마케팅... 시 상권입지에 따라 매장형, Take-Out, 배달형 점포 중 선택함과 동시에 판매 메뉴 선별도 가능하다. 거성치킨..."
874,2016.03.11.,이화 스타트업 52번가 오픈,'이화 스타트업 52번가' 는 서울의 대표 상권인 이화여대 정문 앞 골목의 빈 점포를 활용해 청년들이 창업을 경험할 수 있도록 예술과 문화가 결합된 청년창업 문화거리를 조성하는 창업지원 프로젝트. 현재 대학생으로...
875,2016.03.21.,유럽형 스트리트 상가 천안에 들어선다,"주로 서울 압구정 로데오거리나 신사동 가로수길, 삼청동길 등에 형성되었으나 최근 신도시나 택지지구의 상가에서 확산되고 있다. 보행로 양쪽에 연이어 배치되어 유동인구의 체류시간이 늘어나는 등 뛰어난 상권..."
876,2016.03.17.,현대百 이어 이랜드도 면세사업 재도전,이랜드는 지난해 7월 서울 시내 신규면세점 입찰에 '홍대 상권'을 입지로 앞세워 참여하며 면세사업에 첫 도전장을 내밀었다. 당시 이랜드는 상품공급 등의 약점을 보완하기 위해 중국 최대 여행사를 운영하고 있는...
877,2016.03.18.,세금 안 내겠다는 ‘法人 서울대’,"서울대가 직접 운영하는 48개 편의시설 매출과 합하면 서울대 상권은 연간 총 650억 원 규모로 알려졌다. 법인화 이후 수익사업에 열을 올리고 있는 만큼, 수익에 상응하는 세금을 당연히 내야 한다는 지적도 힘을 얻고..."
878,2016.03.16.,"서초구, 젠트리피케이션 방지 대책 추진",서울 서초구가 골목길 상권 활성화 및 지역상권 보호를 위해 젠트리피케이션 방지 대책을 적극 추진한다고 16일 밝혔다. 젠트리피케이션은 구도심 활성화로 임대료가 올라 원주민과 임차상인이 내몰리는 현상을 말한다....
879,2016.03.20.,4자 구도… 진보세력ㆍ야권 단일화 최대 변수,"정무부지사에 서울 노원병에서 지역구를 갈아탄 정의당 노회찬 전 의원, 정치신인 국민의당 이재환(36)... 골목상권 침투 억제, 정규직 확대 및 최저임금 현실화, 대기업과 중소기업 간 초과이익공유제 도입, 법인세율 인상..."
880,2016.03.15.,광주지역 홈플러스 조기 영업개시 편법 논란,현행 유통산업발전법에는 골목상권 보호를 위해 대형마트의 영업시간을 새벽 0시부터 오전 10시까지 제한할... 광주네트워크는 유통법이 개정된 지 3년이 지났고 서울지역 모든 홈플러스 매장이 오전 10시부터인 의무...
881,2016.03.10.,"[유통단신] 교촌치킨, K-BPI 브랜드파워 1위 선정 外","[스포츠서울 김자영기자] 교촌치킨은 한국능률협회컨설팅(KMAC)이 주관하는 한국산업의 브랜드파워 조사(K... 특히, 교촌치킨은 가맹점 상권 보호 정책과 관리 및 교육 시스템을 철저히 운영하고 있다. 세대수, 인구수..."
882,2016.03.14.,K뷰티 열풍에…제주서 산청·장흥까지 '화색',유정연 센틀리에 전무는 “서울 홍대 상권 등의 오프라인 매장을 찾은 외국인 관광객에게 ‘서양의 향수에서 찾을 수 없는 독특한 향’이라는 호평을 받고 있다”고 말했다. ‘K뷰티’ 열풍이 국내 지방 중소도시의...
883,2016.03.10.,"김영태 현대百 사장 “동대문 아울렛, 매출 1600억 목표’","특히 동대문 상권은 하루 유동 인구가 30만명이 넘는 서울 도심의 핵심 상권 중 하나로, 대중교통을 통한 접근성이 뛰어나다. 특히 현대백화점 측은 전체 매출의 30% 정도를 외국인 관광객을 통해 달성하겠다는 목표도..."
884,2016.03.21.,"[성동구] 전통시장에 새로운 바람이 분다 - 성동구, 7개 전통시장(상점가)에 ...","이는 올 3월 중소기업청(소상공인시장진흥공단)과 서울시에서 실시한 2016년 전통시장(상점가) 활성화 지원... 주변 상권 활성화 등 지역경제 살리기에 크게 기여할 것으로 기대하고 있으며, 앞으로도 전통시장..."
885,2016.03.09.,[20대총선]강원 원주 을 선거구 예비후보,"또한 13개 공공기관이 들어섰다고는 하지만 저녁만 되면 서울로 향하는 퇴근버스가 줄을 지어 서 있는 등... ▶단구동 지역상권의 활성화 추진과 원주여고 이전에 따른 남부시장 상권 문제, 단독주택지역 도시가스 공급..."
886,2016.03.11.,"신세계, 장재영 대표 재선임 등 주총안건 일사천리",신세계그룹은 서울 중구 한국스탠다드차타드은행 제일지점 4층 대강당에서 제59기 정기주주총회를 열고... 대구·경북 상권 '도심형 럭셔리 쇼핑센터' 대구점 추진 사업 등이다. 한편 이날 신세계그룹은 신세계푸드...
887,2016.03.21.,"[실시간 거래]대표적 자족형 신도시 분당구 삼평동 `봇들8단지휴먼시아`, 보증...","판교역 앞에는 현대백화점이 자리하고 자가용으로 5분 거리인 분당선 서현역에는 AK플라자, 메가박스, 하이마트 등 대형상권이 분포해 있다. 최근 몇 년 사이 판교역 부근 아파트들의 시세가 폭등했다. 서울, 강남으로..."
888,2016.03.24.,[경상시론]울산형 젠트리피케이션에 대한 선제적 대응,"신촌, 압구정, 이태원 등 서울의 대표적인 상권의 주변부였던 이들 지역은 이국적인 카페와 레스토랑, 소규모 문화예술 공연장, 패션숍 등이 점차 입점하고 최신 유행을 선도하는 소비자들을 끌어들이면서 초기 상권을..."
889,2016.03.10.,2세대 타운하우스 뜬다…교통여건 개선,"권역별 거래량 중 수도권(서울·경기·인천)이 2만4315건에서 3만6902건으로 51.77% 증가했다. 부동산 전문가들은 ""대부분의 타운하우스가 도심 외곽에 위치해 교통환경·학군·상권 등의 메리트가 없었다""면서 ""최근..."
890,2016.03.10.,"현대百, 동대문 최대 규모 '현대시티아울렛' 오픈",(서울=연합인포맥스) 장순환 기자 = 현대백화점이 동대문 상권 내 최대 규모의 신개념 '도심형 아울렛'을 선보인다. 현대백화점은 10일 서울 중구 을지로에 도심형 아울렛 2호점인 '현대시티아울렛 동대문점'을...
