,date,title,contents
1496,2017.04.13.,"""왕서방 빈자리 크네""…IPO 늦추고, 매각도 올스톱",이후 서울 명동 거리 /사진=뉴스1 중국 정부와의 사드(THAAD·고고도미사일방어체계) 갈등으로 뷰티·유통... 한국행 단체관광 상품 판매금지 여파로 명동 상권·면세점 등 주요 매장의 매출이 급감하자 기업 가치가 동반...
1497,2017.04.10.,한미 프로야구 대장정 돌입...유통가 마케팅 '열전',"키자니아 서울, 넥센 히어로즈와 상호 할인 등 공동 이벤트 진행 직업체험 테마파크 키자니아 서울은... 특히 일반 로드 상권에서 벗어나 KTX 역사를 비롯한 터미널, 전시장 등 특수상권 공략에도 적극 나서고 있는..."
1498,2017.04.12.,"""중소기업부 승격 근본적 대책 될 수 없어""... 中企정책 차별화 강조","(왼쪽부터)김세종 중소기업연구원장, 박상인 서울대학교 행정대학원 교수, 이덕로 한국시설관리사업협동조합... 아울러 골목상권 보호와 같은 소상공인 보호정책 및 일자리 창출에 필요한 정책 수요를 적극적으로 발굴하고..."
1499,2017.04.12.,수원역 우림필유 웨스트파크원 홍보관 오픈,"수도권이 광역화되면서 서울 및 인근지역으로 출퇴근이 원활한 역세권 아파트의 선호도가 꾸준히 높은 편인데, 역 중심으로 상권이 발달하기 때문에 풍부한 생활인프라가 잘 갖춰져 있기 때문이다. 주택 시장에서는 교통..."
1500,2017.04.03.,"[롯데월드타워 개막] 골든키 돌린 신동빈, ''하늘과 맞닿은 뉴롯데"" 오픈",# 3일 오후 4시45분 롯데월드타워 '시그니엘서울' 호텔 76층. 신동빈 롯데그룹 회장이 허창수... 이들의 체류기간을 증가시키고 소비지출액을 늘리면 지역 상권 활성화에 기여할 수 있을 것으로도 기대하고 있다....
1501,2017.04.04.,"시흥시 월곶항, 수도권 대표어항으로 국가어항 지정·고시","시흥시 월곶항은 영동고속도로 및 제2경인, 서울 외곽순환도로가 인접하여 광역 접근성이 매우 우수... 주변 상권 활성화로 지역경제를 살리는 데 많은 도움이 될 것""이라고 밝혔다 해양수산부는 시흥시 월곶항 및..."
1502,2017.04.03.,'부양의무제 폐지' 공약? 박근혜 따라가진 말자,현재 서울의 한 장애인자립센터에서 중증장애인 독려상담을 한다. 내가 장애인 복지에 관심이 많은 것은... 기초생활수급자가 생필품 구매에 지출을 늘리는 자체가 동네 골목상권을 살리는 길이다. 저소득층의 소득상태가...
1503,2017.04.06.,조립형 공간카페 ‘릴렉스라운지’ 일반 카페보다 매출 높은 이유 있다!,"평수나 인테리어 등을 상권 혹은 자본금에 맞게 변경할 수 있는 맞춤 창업이 인기를 끌고 있는데, 최근에는... 한편, ‘릴렉스라운지’ 본사에선 12일, 26일 오후3시 서울시 송파구 오금로 99 5층 교육장에서 창업설명회를..."
1504,2017.04.08.,[주말N]'남자들의 놀이터' 일렉트로마트 영등포점,덕분에 이곳의 유동인구는 하루 평균 약 12만명으로 추정돼 서울뿐만 아니라 경기권 시민들이 찾는 광역 상권으로 분류된다. 특히 유동인구 중에서도 20대의 비중이 높은 것으로 나타나 젊고 유행에 민감한 상권을...
1505,2017.04.03.,"콘텐츠 입힌 이색 상가, 지역 상권 지도 바꾼다",몇 년 전부터 급격히 방문객이 줄어든 서울 동대문에는 현대백화점이 세운 현대시티아울렛이 들어서며 상권이 살아나고 있다. 특히 젊은 층 인구 유입이 늘면서 주변 상권이 살아나기 시작했다. 지난해 4월...
1506,2017.04.05.,"[일문일답] 조성하 신세계사이먼 대표 ""시흥아울렛, 여주·파주보다 지역 밀착...","아울렛을 서울 서남부를 대표하는 쇼핑, 관광, 문화의 메카로 만들겠다는 포부를 밝혔다. 아동, 리빙관을 확대하고 병원도 입점하는 등 지역상권 맞춤형 인프라도 조성하며 쇼핑 편의를 최대화했다고 강조했다. 다음은..."
1507,2017.04.03.,"""제2경부고속道 청주 경유해야""","청주의 상권을 살릴 수 있다""고 말했다. 특히 ""지난 1991년 당진-청원간 고속도로건설계획이 당진-대전으로... 또한 ""정부는 지난 2015년 11월 제22차 경제장관회의에서 총사업비 6조 7000억 원이 투입되는 서울과 세종을..."
1508,2017.04.04.,독서당로 뒷골목 '고급 데이트코스' 부상…줄 선 투자자들,서울 용산구 한남동 디뮤지엄. /김수현 기자 특히 디뮤지엄이 문을 연 이후엔 이 지역 상권과 결합해 ‘고급 데이트코스’의 하나로 확실히 자리를 잡고 있다는 평가다. 한남동 이탈리안 레스토랑 ‘보’ 김나희...
1509,2017.04.05.,롯데월드타워 개장으로 지역가치↑…송파구 `잠실엘스`,"연평균 약 500만 명의 해외 관광객이 잠실과 송파구를 방문해 지역상권은 향후 5년간 1조5000억원의 매출을... 서울시 송파구 잠실동에 위치한 잠실엘스는 2008년 9월 입주한 최고 34층, 72개동 총 5678가구 규모며..."
1510,2017.04.19.,교통환경 뛰어난 역세권 아파트'수원역 우림필유웨스트파크원'조합원 모집,"수도권이 광역화되면서 서울 및 인근지역으로 출퇴근이 원활한 역세권아파트의 선호도가 꾸준히 높은 편인데,역 중심으로 상권이 발달하기 때문에 풍부한 생활인프라가 잘 갖춰져 있기 때문. 이 같은 이유로 주택..."
1511,2017.04.12.,‘특급조망권’ 확보한 소형 오피스텔.. 수익률이 남다르네,"이들은 대부분 대학생이거나, 직장인 또는 신혼부부 등으로 상권밀집지역과 역세권에 대한 선호도가... 부동산 114자료를 보면 한강 바로 앞에 위치해 있어 조망권이 우수한 서울 영등포구 여의도동의 K오피스텔(2003년..."
1512,2017.04.11.,개발에 밀려나는 원주민…익선동 한옥마을도 젠트리피케이션,살던 서울 도심의 한옥마을까지 젠트리피케이션 현상이 번졌습니다. 외부인들이 몰리면서 갑자기 오른... 급격히 상권이 형성되기 전까지 경제적 형편이 넉넉지 않은 노인들이 주로 주거하던 지역이었습니다. &lt;40년 거주...
1513,2017.04.19.,세대당 상가 전용면적 낮은 `수원 권선 꿈에그린 단지내 상가` 희소성 높아 관...,"실제, 삼성물산이 서울 광진구 구의동에 공급한 '래미안 구의 파크스위트' 단지 내 상가는 지난 2월 총 19개... 대단지기 때문에 풍부한 고정수요를 확보한 것을 바탕으로 독점 상권 효과도 기대가 된다. 또 단지 인근..."
1514,2017.04.05.,4~6월 전국 오피스텔 1만6500여실 분양…수도권 80% 집중,"지역별로는 ▲경기도 6919실 ▲인천 5303실 ▲부산 2004실 ▲서울 1201실 ▲울산 444실 등 분양물량의 80... 또한 홈플러스, 롯데백화점, 신세계 백화점, CGV 등 로데오상권의 다양한 기반시설을 반경 1km 이내에서 이용할 수..."
1515,2017.04.11.,‘과학 사랑’에 사재 턴 우리 회장님,(사진) 김성훈 서울대 교수가 서울 용산구 한남동 카오스재단 강연장에서 4월 5일 ‘단백질’을 주제로... 이어 “상점이 여러 개 들어와야 상권이 생기듯이 과학이란 문화 공간도 우리만으로는 문화 운동 확산이...
1516,2017.04.19.,[대선 D-19] 표심도 양강 文 '2030' 安 '5060' 세대 전쟁,"국민의당 안철수 대선후보가 19일 오전 서울 여의도 한국노총을 찾아 노동 현안에 대한 정책 제안을 받으며... 은퇴 이후 자영업 하는 시민을 위해 골목상권 대책을 추가하는 방안 등도 공약해, 노후가 불안한 중년의..."
1517,2017.04.07.,송도국제도시 브랜드 가치 상승에 대출규제 없는 ‘송도 캐슬센트럴파크’ 주...,[스포츠서울 김수지기자] 지난해 말부터 신규분양 아파트에 대한 규제가 강화되면서 갈 곳을 잃은... 대형상권인 ‘슈퍼블록(Superblock)’이 들어서게 됨으로써 부동산가치도 동시에 상승하게 된다. 특히 송도 최고의...
1518,2017.04.07.,"역시 상가, 수익률 고공행진.. 광명역자이타워 상업시설 주목","역세권의 항아리 상권은 물론 지식산업센터, 아파트의 고정수요를 품은 만큼 높은 수익률에 기대감이... 제2경인고속도로, 서해안고속도로, 서부간선도로, 서울외곽순환도로, 제3경인고속화도로, 수원~광명고속도로..."
1519,2017.04.04.,인천 청라국제도시 '기지개' … 상가·아파트 공급 잇달아,상가는 청라국제도시의 명소인 커낼웨이와 접한 수변·테라스형 상업시설로 서울도시철도 7호선 연장선 커낼웨이역(예정)과 인접해 있다. 현대썬앤빌 더테라스는 주변 상권과 차별화를 위해 1층 뿐 아니라 2~3층도...
1520,2017.04.13.,사드에 두번 우는 유통업계…IPO도 '꽁꽁' 얼어붙어,이와 함께 3월 중순 이후 중국인의 한국 방문이 끊기면서 주요 관광상권 매출이 타격을 입은 점도 상장을... 402억원으로 전년대비 5.9% 줄었다.   ABC마트 서울 가로수길점. 사진/ABC마트   ⓒ맛있는 뉴스토마토
1521,2017.04.12.,당일 배송부터 독립 법인까지… 편의점 ‘택배 전쟁’,"골목상권이나 주택가까지 점포가 두루 입점해 있어 배송 서비스로의 연계가 용이하다”고 말했다. 김희 ▶ 재미있는 세상[나우뉴스], [웰 메이드 N] ▶ [인기 무료만화] [페이스북] ⓒ 서울신문(www.seoul.co.kr)..."
1522,2017.04.05.,"부산 아이파크, 2017시즌 홈 전경기 '구덕운동장'에서","시야와 상권에서 고립되어있던 아시아드주경기장에 비해 경기장 주변으로 카페, 음식점 등 상권이... 앞으로 펼쳐질 구덕운동장에서의 홈경기는 이번 주 일요일(9일) 17시 서울이랜드전 이후로 적용되며 기존 15일(토)..."
1523,2017.04.10.,[데스크칼럼] 대우조선에 마지막 기회를 주자,당장 기업을 퇴출하면 종사자는 물론 지역상권까지 연쇄붕괴한다는 저항에 부딪히면서 ‘살리기’로 가닥을... 임종룡 금융위원장은 지난달 23일 서울 세종로 정부청사에서 열린 ‘대우조선 구조조정 추진방안’...
1524,2017.04.07.,"브리오슈도레, 7일 김포 롯데몰 오픈···하루 만에 핫플레이스로 등극","[서울경제] 프랑스 정통 대표 베이커리 브랜드 브리오슈도레가 오늘(7일) 김포 롯데몰에 12번째 직영점을 오픈했다. 브리오슈도레 김포 롯데몰점은 카페형 매장(Cafe Type)으로 오픈, 운영된다. 입점 공간과 상권..."
1525,2017.04.06.,강남불패의 역사…사교육→한강→재건축→한강변 재건축,"서울편입 55년만 초고층 탈바꿈 도곡ㆍ대치서 압구정ㆍ청담으로 개포ㆍ반포 거쳐 다시 압구정에... ‘강남’이라는 말로 모든 프리미엄이 정당화되던 시기를 벗어나 상권, 교육, 교통, 조망 등 세부 변수에 따라..."
1526,2017.04.10.,"맛과 비주얼로 여심 저격 성공한 수제 오믈렛빵, 디저트업계의 다크호스로 부...",[스포츠서울 김석재기자] 각종 스트레스가 난무하는 가운데 달콤한 디저트를 통해 작은 사치를 누리며... 딸기오믈렛 이 업체는 쇄도하는 가맹점 개설 요청에 힘입어 체계적인 물류 및 상권 분석 시스템을 갖추고...
1527,2017.04.07.,벼랑 끝에 선 자영업 임대료·대출금리·원가 상승 ‘악전고투’,내수 부진·김영란법 여파 자영업 위기 500조 빚더미…‘창업 점포 수만큼 폐업’ 대기업 은퇴 후 퇴직금과 모아둔 돈을 털어 서울 마포구 서교동에 볶음밥 전문식당을 차린 유진홍 씨(가명). 홍대 상권에서도 가장...
1528,2017.04.13.,[양양]양양공영터미널 2019년 송암리 이전,기존 상권과의 연계성이 높다는 분석이다. 그러나 일각에서는 해당 계획은 6년이 지난 것으로 양양읍 내 도시환경이 크게 바뀌고 있다며 조만간 개통하는 서울~양양 고속도로와 연계성이 높은 종합운동장 인근으로...
1529,2017.04.03.,뉴타운 해제지역에 부는 `빌라투자` 열풍,"6000만원에 전세로 들어갈 수 있고 투자하려면 2000만원만 있으면 됩니다"" (서울 서대문구 일대 빌라... 식의 상권 투자가 이뤄지는 마포·용산·성동구 일대와는 매매의 목적이 다른 셈이다. 빌라 시장은 아파트 전세금을..."
1530,2017.04.07.,"강북에 뜬 쉑쉑, 쉐이크쉑 동대문 두타점 가보니…","동대문 상권이 다소 쇠퇴한 상황이긴 하지만, 쉐이크쉑은 연 700만여 명이 방문하는 동대문을 포기하지... 장소는 서울 한복판이지만 쉐이크쉑 1호점인 뉴욕 메디슨스퀘어 공원점의 분위기를 가져온 것이다.   [사진..."
1531,2017.04.04.,"부산, ‘축구 성지’ 구덕운동장으로 돌아간다","또한 대중교통 이용이 편하고, 경기장 주변으로 카페, 음식점 등 상권이 형성되어 있어 팬들이 편의시설을... 부산은 오는 9일 오후 3시 예정된 KEB 하나은행 K리그 챌린지 6라운드 서울 이랜드전을 시작으로..."
1532,2017.04.04.,시흥시 월곶항 ‘국가어항’으로 지정ㆍ고시돼,"월곶항은 영동고속도로 및 제2경인, 서울 외곽순환도로가 인접하여 광역 접근성이 우수하고, 수도권에... 주변 상권 활성화로 지역경제를 살리는데 많은 도움이 될 것”이라고 밝혔다 해양수산부는 시흥시 월곶항 및..."
1533,2017.04.12.,[부동산S토리] 월급처럼… ‘월세’ 받아볼까,‘항아리상권’이라고 불린다. 교통환경도 개선되고 있다. 신안산선이 지날 예정이며 월곶-판교선 건설이 추진된다. 또한 제2경인고속도로·서해안고속도로·서부간선도로·서울외곽순환도로·제3경인고속화도로...
1534,2017.04.11.,'특급조망권' 확보한 소형오피스텔… 수익률 남다르네,"이들은 대부분 대학생이거나 직장인, 신혼부부 등으로 상권밀집지역과 역세권에 대한 선호도가 높다.... 부동산114 자료를 보면 한강 바로 앞에 있어 조망권이 우수한 서울 영등포구 여의도동의 K오피스텔(2003년 12월..."
1535,2017.04.17.,文·洪 지나가던 길에 들린 대전,"실제 문 후보의 선거 운동 첫 날 동선은 대구에서 시작해 대전에서 집중 유세 후 수원시로 이동한 다음 서울... 홍 후보의 소상공인ㆍ골목 상권, 전통 시장 활성화 정책으로는 청국장ㆍ두부 등 영세 생계형 업종은 대기업..."
1536,2017.04.10.,불꺼지는 아파트 상가 늘어난다,"서울의 한 단지 내 상가가 주인을 찾지 못하고 비어있는 모습.ⓒEBN [EBN 서호원 기자] 임대 수요가 꾸준해... 인근 S부동산 관계자는 ""지난해 1차 분양을 했지만 아직 60%정도 밖에 차지 못했다""며 ""대형 단지들로 상권이..."
1537,2017.04.05.,"전통시장, 마트규제 말고 지원정책부터 체크하라","골목상권 보호를 명목으로 대형마트 영업시간 규제 등을 발의하고 있지만, 정작 전통시장은 고객... 서울 중랑구의 한 시장을 자주 찾는다는 김모(여·53) 씨도 “전통시장이 저렴한 물건을 찾기 수월할지 몰라도 쇼핑..."
1538,2017.04.10.,벚꽃 개화와 함께 아파트 공급도 활발…'광진 파밀리에 포레시티' 눈길,"및 상권이 풍부해 편리한 주거환경을 갖추고 있다. 특히 7호선 어린이대공원역, 2, 7호선 건대입구역 더블역세권에 위치해 있으며 동부간선도로, 잠실대교로 강남권 진출입이 용이해 강변북로로 서울 어디든 빠르게 닿을..."
1539,2017.04.03.,"커피전문점 드롭탑, 오는 6일 전국 동시 사업설명회 개최","한편, 드롭탑은 영업본부를 중심으로 서울, 광주호남, 부산경남, 대구경북, 대전충청에 영업지사를 두고 상권조사부터 개설 후 운영 및 관리 서비스를 제공하고 있다. 본사는 가맹점주와 상생하는 관계를 구축해 나가고..."
1540,2017.04.13.,최병오 패션그룹형지 회장 | 부산 고향에 대형쇼핑몰 짓고 금의환향 “노블리...,"외환위기가 왔을 때는 톱모델이 출연하는 브랜드 제품을 B급 상권에서 저가에 팔아 주부들 지갑을 열었고... 패션그룹형지는 서울을 소재지로 두고 있지만, 아트몰링 법인은 부산에 세워졌다. 이는 부산에서 일어난..."
1541,2017.04.07.,뛰어난 교통인프라로 수요자 사로잡는 '수원역 우림필유 웨스트파크 원',"수도권이 광역화되면서 서울 및 인근지역으로 출퇴근이 원활한 역세권 아파트의 선호도가 꾸준히 높은 편인데, 역 중심으로 상권이 발달하기 때문에 풍부한 생활인프라가 잘 갖춰져 있기 때문. 이 같은 이유로 주택..."
1542,2017.04.10.,"신명품 부천역 로데오거리에 우뚝 서다! 복합테마상가 ""피노키오"" 분양","1층과 2층에 들어서는 상업시설의 경우 풍부한 배후 수요와 교통망 개선에 따른 유동인구 유입이 상권 확대를 촉진할 것으로 기대를 모으고 있다. 피노키오 상가는 경인고속도로, 서울외곽순환고속도로, 부천, 중동..."
1543,2017.04.03.,다양한 특화설계 선보일 ‘부천 중동 효성해링턴플레이스’ 이달 분양 예정,"인근으로 서울 양천구, 인천시, 광명시, 시흥시와 접한 지리적 장점으로 다양한 버스 노선도 갖췄을 만큼... 단지 인근 부천역 상권을 비롯해 이마트, 자유시장, 상동종합시장 등을 이용할 수 있으며 인천지방검찰청..."
1544,2017.04.03.,"건설사, 비건설부문 강화로 사업다각화 '잰걸음'",주상절리대 인근에 위치한 호텔은 4개동을 신축해 추가 확장하고 서울에도 호텔을 짓는다. 서울 중구... 광화문 상권을 부활시켰다는 평가를 받았다. 2년전 면세점 사업에 진출한 현대산업개발도 사업 다각화에...
1545,2017.04.14.,[뉴스텔링] 롯데·신세계·현대백화점의 위험한 ‘아울렛’ 전쟁,"현재 백화점 빅3가 운영하는 곳은 23개이며, 이 중 인구가 몰려있는 서울·경기 등 수도권에 12개가 몰려있다 보니 벌써부터 상권이 겹치는 일이 발생하기도 한다. 실제로 경기도 파주에 위치한 롯데 아울렛과..."
1546,2017.04.04.,"양재천 벚꽃축제 5일 개막… 강남구, 9일까지 문화예술공연 야간조명 등 다채","이용만 도곡2동장은 ""벚꽃축제를 통해 양재천의 관광명소화가 더욱 견고해지고 지역상권 활성화에도 기여할 것""이라며 ""서울시민 누구나 와서 양재천 따라 펼쳐진 벚꽃길을 맘껏 즐기길 바란다""고 말했다."
1547,2017.04.15.,"[주간한국] 감사원, 공정위ㆍ골프존 정조준",국회는 국정감사 보고서에서 “김범조 전 공정위 서울사무소장 등이 골프존의 임직원으로 영입된 점에 대한... 가맹점으로 가면 상권보호를 받을 수 있고 업그레이드를 하더라도 본사가 부당하게 폭리를 취할 수 없기...
1548,2017.04.04.,"을지로위원회, ""민주당 시장의 대기업 위한 행정 죄송""",앞서 부천시는 지난 2015년 6월 서울외곽순환고속도로 중동IC 부근의 영상문화단지를 개발하고 복합쇼핑몰로... 그러나 본 계약(토지매매계약) 체결을 앞두고 지역상권 붕괴를 우려하는 인천지역 중소상인들과 시민단체의...
1549,2017.04.12.,"최근 트렌드는 ‘테마형 MD구성’, 높은 집객효과 기대",[서울신문] 전문 업종이 모여있는 상가가 투자자들의 눈길을 끌고 있다. 하나의 업종으로 층이 구성되면 그... 일대 상권 형성에도 영향을 미치는 것은 물론 중심상권으로 자리매김 할 수 있다고 조언한다. 실제로 앞서...
1550,2017.04.13.,영등포 양남시장 주상복합공간 재탄생,"지역 상권에 활력을 불어넣을 것으로 기대하고 있다. 조길형 영등포구청장은 ""사업이 완료되면 양남시장이 매력적이고 경쟁력있는 시장으로 탈바꿈해 전통시장 활성화에 기여할 것""이라고 전했다. [신아일보] 서울..."
1551,2017.04.13.,[한경매물마당] 대전 갈마동 4차선 대로변 5층 근생 상가주택 등 8건,"(041)533-7115 아산 부동산멘토 정남진 ◆서울 강남구 역세권 근린생활시설 빌딩 역세권 대지 330㎡, 연면적 1100㎡의 7층 근생 건물. 보증금 7억원, 월 2500만원에 층별 장기 임대 완료. 7일 상권 형성된..."
1552,2017.04.04.,청라국제도시 상가분양 활기,핵심상권 상가 분양도 활기를 띠고 있다. 인천경제자유구역청은 지난달 '보성산업 컨소시엄'을... 청라 시티타워는 서울 잠실 롯데월드타워(555m)와 삼성동 글로벌비즈니스센터(553m)에 이어 국내 세 번째로 높은...
1553,2017.04.11.,청라국제도시 선임대 후분양 상가 ‘청라스퀘어7’ 눈길,"이 때문에 도시 형성과 함께 상권 안정화에 시일이 소요되는 신도시나 신규 택지지구 일대의 상가에서는 이... 공항철도 청라국제도시역과 인천지하철 2호선을 이용할 수 있고, 인천국제공항고속도로를 통해 서울과 김포..."
1554,2017.04.03.,“더 오른다”vs “너무 올라”…마곡 집값 신경전,31일 서울 지하철 5호선 마곡역 인근에는 공사가 한창이었다. 북쪽으로 800여ｍ 떨어진 9호선 마곡나루역으로... 현재는 발산역을 중심으로 형성돼 있는 마곡지구의 핵심 상권도 조만간 마곡나루역 쪽으로 넘어올...
1555,2017.04.11.,제주 도심에 대규모 쇼핑 삼각 클러스터 형성···상권 구도 바뀔까?,향후 상권 변화가 예고되고 있다. 11일 부동산업계에 따르면 제주의 명동으로 불리는 노형동 중심에 제주... 투자수익률이 서울 강남보다 두 배 이상 높은 것으로 나타날 만큼 분위기가 달아오르고 있다. 제주 도심의...
1556,2017.04.06.,강남 신논현역 역세권 '신논현 리체힐' 상가 분양,"오피스텔의 거주자 및 사업지 바로 옆 다이내스티 호텔 부지에 서울시 청년 임대주택도 들어설 예정이라... 뿐만 아니라 대기업, 벤처기업 등이 밀집된 비즈니스타운과 주거지역의 복합상권으로 풍부한 강남 배후수요 및..."
1557,2017.04.13.,‘해피라움 블루’ 세종 상가 투자 리드하는 대표 상품으로 눈길,"[서울신문] 최근 상가 투자가 아파트나 타 수익형 부동산 보다 큰 인기를 끌고 있다. 실제로 지난해 상가의... 핵심 상권을 주도할 전망이다. 준공 시 세종시는 물론 인근의 대전 유성과 대덕, 신탄진 등 충청권 전역에서의..."
1558,2017.04.04.,우이신설선 호재로 강북구 ‘삼성래미안트리베라2차’ 눈길,"대형 상권이 형성돼 주거 인프라가 풍부하다. 교육시설로는 삼각산고가 단지 옆에 자리하고 영훈국제중, 송천초, 길음초, 길음중, 삼각산중, 영훈고 등이 근처에 있다. 단지 인근에 들어서는 우이신설선은 서울시..."
1559,2017.04.04.,“꽃길 찾아오세요”…강남구 ‘양재천 벚꽃축제’,서울 강남구(구청장 신연희)는 봄을 맞아 오는 5~9일 벚꽃길 명소로 유명한 양재천 일대에서 ‘양재천... 이용만 도곡2동장은 “양재천 벚꽃축제가 지역상권 활성화에도 도움이 되길 바란다”며 “예쁜 카페와 벚꽃길을...
1560,2017.04.09.,[머니+] 오피스·대학가 주변·역세권 따라 배달전문·레스토랑형 등 달리해야,"[성공창업, 상권을 보라-상권별 입지선정] 김용훈 파파존스 개발팀 부장 [서울경제] ‘목을 잘 잡아야 성공한다’는 말이 있다. 일반적으로 ‘목이 좋다’는 것은 자리가 좋아 장사가 잘되는 곳이나 길로, 여기서 목은..."
1561,2017.04.12.,"""경기도형 사회주택 가이드라인 필요""","최경호 서울시 사회주택종합지원센터장이 '네덜란드와 서울시의 사회주택 현황 및 시사점'이라는... 이에 안정희 도시재생주거환경시민연대 대표는 ""지하철 상권 배후지역의 도심은 노후현상이 심화되고 있고 자영업을..."
1562,2017.04.10.,‘수원 권선 꿈에그린’ 단지내 상가 25일 공급,"사진=‘수원 권선 꿈에그린’ 조감도 대단지의 풍부한 고정수요를 바탕으로 독점 상권효과를 누릴 것으로... 또, 봉담IC와 5분거리에 있어 과천~의왕간 고속도로를 이용하면 서울 강남권으로 이동하기 쉽고 수인선..."
1563,2017.04.03.,"[하늘 수놓은 3만여 불꽃] 롯데월드타워, 위대한 기적의 시작","[시사위크=정소현 기자] 3만여발의 불꽃이 서울 하늘을 수놓았다. 123층, 555m 건물 곳곳에서 뿜어져 나온... 증가시키고 소비지출액을 늘리는 등 특히 지역 상권에 크게 기여할 수 있을 것으로 보인다""고 말했다."
