,date,title,contents
1568,2017.07.04.,"""임차인 영업적 가치 보장받기 위해 상가임대차법 적용범위 확대 필요""","젠트리피케이션으로 소위 뜨는 상권에서 임대료가 치솟아 그 동네를 일군 임차인들이 영업적 가치를... 4일 서울 여의도 국회 의원회관에서 박주민 더불어민주당 의원, 홍익표 더불어민주당 의원과 공동으로..."
1569,2017.07.12.,[기고] 일자리 원한다면 카드산업 선진화가 우선,"한국에서 장사가 잘되는 상권은 줄고 있다. 서울 압구정, 강남 상권이 예전만 못하다는 원성이 나온 지 오래다. 망원동, 방배동 등 새롭게 뜨는 상권의 임대료는 연일 치솟고 있다. 카드 수수료 인하로 줄어든 부담은 건물주..."
1570,2017.07.06.,"'프랜차이즈 갑질'에 철퇴…공정위, 대대적 실태 점검","이른바 '골목상권'의 불공정 실태 해결에 강한 의지를 내보이는 가운데, 이번달엔 지자체와 함께 개별 가맹점들을 대상으로 실태를 점검합니다. 우선은 서울과 경기 수도권 일대 가맹점을 대상으로..."
1571,2017.07.04.,"쫓기듯 떠나는 상인들…""임대차법 5년→10년으로 연장해야""",중소기업청은 4일 더불어민주당 박주민·홍익표 의원과 서울 여의도 국회의원회관에서 '젠트리피케이션 방지를 위한 제도개선 공청회'를 개최했다. 젠트리피케이션으로 소위 뜨는 상권에서 임대료가 치솟아 그 동네를...
1572,2017.07.04.,"산업단지 인근 오피스텔, 오산 ‘르마레시티’ 분양 중","- 산업단지 입주기업 근로자, 인근 오피스텔 두터운 실수요층 형성 [서울경제] 풍부한 배후수요를 바탕으로... 스트리트형 상가는 보행로 양쪽에 연이어 배치되어 유동인구의 체류시간이 늘어 뛰어난 상권이 형성되는..."
1573,2017.07.11.,"'이노빌더스', ""배후수요 탄탄한 신축빌라로 소비자 활기"" 입증","대형 상권일수록 더 좋다. 신축빌라 분양전문 이노빌더스는 배후수요가 탄탄한 신축빌라를 소개하여... 또한 서울 강서구 화곡동 신축빌라 및 등촌동 신축빌라는 1억9,000만 원 선, 양천구 신월동과 목동, 신정동..."
1574,2017.07.13.,역세권 고품격 오피스텔 ‘운정 야당역 헤리움’ 분양,지하철역 근처에 자리한 단지는 편리한 교통은 물론 활발한 상권이 형성돼 있는 경우가 많아 탄탄한... 이렇게 되면 강남 등 서울 주요 도시로의 이동이 20분대로 단축돼 서울생활권도 누릴 수 있다. 이밖에 오는 2020년...
1575,2017.07.20.,"[송기훈 사무금융노조 코리안리재보험지부장] ""노조 위축시키는 집회 소음기준...","송기훈 지부장은 19일 오전 서울 수송동 지부사무실에서 &lt;매일노동뉴스&gt;와 만나 ""집시법상 소음기준이 집회... 소음기준치 초과로 상업지역 상권에 악영향을 끼친다거나 대중에게 심대한 불편을 끼치는 경우에 한해..."
1576,2017.07.05.,"'도청사 이전 빈자리 채워라'…수원시, 지역상권 살리기 추진",도청 주변 상권은 50년 전부터 형성됐다. 1946년 경성부가 서울특별시로 승격하면서 경기도청이 수원으로 이전함에 따라 도청사 구관건물이 1967년 6월 23일 지금의 도청사 자리에 들어섰다. 도청사 주변으로 자연스럽게...
1577,2017.07.19.,"[사설] ‘갑질’ 프랜차이즈 업주, 전 재산 날릴 각오해야",[서울신문] 공정거래위원회가 마침내 가맹본부의 갑질에 칼을 빼들었다. 부도덕한 행위로 브랜드 이미지를... 골목상권 보호에 팔소매를 걷어붙인 김 위원장의 결기에 기대를 건다. 걱정인 것은 공정위의 이런 의욕이...
1578,2017.07.02.,노량진역 주변 고도제한 풀어 상업 중심지로,"업그레이드 서울, 구청장이 뛴다 / ⑥ 이창우 동작구청장 ◆ 동작구는 서울시 25개 자치구 중 가장 저평가된... 아직 구체적 시설계획은 미정이지만 청년들이 많이 몰리는 지역 특성상 지역 상권에 도움이 되는 시설과..."
1579,2017.07.08.,[부동산캘린더]식지않는 분양열기…전국 15곳 청약 접수,단지 인근에는 중앙공원과 수변공원이 있고 학교 계획부지와 중심상권이 가깝다. 제2영동고속도로를 이용해 서울과 경기 등으로 이동하기 쉽고 무실~만종 간 서부순환도로는 2020년 완공 예정이다. △7월 둘째 주...
1580,2017.07.20.,강동 고덕지구 쇼핑 지형 흔들…주양쇼핑 재건축결의 무효확인 의미는?,주양쇼핑은 서울 강동구의 인근 거주자들이 주로 찾는 상권에 자리 잡고 있다. 연면적 4만㎡ 이상의 위용으로 고덕지구 최대 쇼핑시설로 평가받으며 주민들의 사랑을 받아왔다. 주양쇼핑 재건축추진위원회에서는 지난...
1581,2017.07.12.,김포 풍무역 초스피드 초역세권 바로 앞 ‘김포 풍무 아트리온’ 들어서,"역 주변은 유동인구가 많고 상권 등이 발달해 학생 및 젊은 직장인들이 모여 지하철 역과 가까울수록... 15분, 서울역까지 30분, 광화문까지 45분, 신논현까지 50분대로 도달 가능하다. 또한 외부순환로, 올림픽대로..."
1582,2017.07.06.,"'틈새투자처' 지식산업센터 내 상가, 장·단 따져보니…","6일 상가정보연구소에 따르면 서울의 대표 지식산업센터 상권인 가산디지털단지역 상권의 음식점 업종 월 매출은 3월 기준 3800만~5500만원 수준으로, 서울 평균인 3791만원을 훌쩍 넘어섰다. 이와 함께 일반상가 보다..."
1583,2017.07.04.,성동구 서울숲길 대기업·프랜차이즈 입점 제한,뚝섬주변지역 지구단위계획과 지역공동체 상호협력 및 지속가능발전구역 지정에 관한 조례를 근거로 서울 중심부가 아닌 곳에서 입점을 제한하는 것은 성동구가 처음이다. 정원오 성동구청장은 “특색 있는 골목상권...
1584,2017.07.14.,"[머니+ 단지내 상가 투자전략은] 1,000가구 이상 대단지는 기본, 전용률 따른...",안민석 에프알인베스트먼트 선임연구원은 “수익형 투자를 위해서는 반드시 현장을 다녀오고 상권 분석 등이 철저해야 손해 보지 않는다”고 설명했다. /이완기기자 kingear@sedaily.com [서울경제 바로가기]1997년 이래...
1585,2017.07.07.,"정우현 전 미스터피자 회장 구속, 보복출점으로 업주 자살..100억대 부당이득...","구속됐다. .서울중앙지검 공정거래조세조사부(이준식 부장검사)는 6일 오후 정우현 전 미스터피자 회장을... 주변의 상권 규모와 매장 특성 등을 고려하면 의도적 보복이라고 보기 어렵다”며, '공짜급여' 의혹에 대해선..."
1586,2017.07.07.,"동탄생활권 대단지 오피스텔, 오산 ‘르마레시티’ 주목","역세권 ·중심상권 등 임대수요가 풍부한 지역에 위치해 수익률 역시 높기 때문에, 투자자들은 소규모... 또한 경부고속도로 오산 IC가 700m 내에 위치하고 용인-서울고속도로가 인접해 수도권 및 화성, 평택, 용인 등으로..."
1587,2017.07.12.,"수익형 부동산 투자, 스트리트형 상가에 ‘눈길’","이런 상가들은 자연스런 유동인구 확보할 수 있고, 이용객의 체류시간을 증가시켜 상권활성화에 도움을... 서울지하철 8호선 암사역이 가까워근린생활시설로의 접근성이 뛰어나다. 현대엔지니어링은 세종특별시 3..."
1588,2017.07.16.,자영업이 ‘프랜차이즈’ 먹잇감으로 전락한 현실,"그래서 서울 변두리 골목이라고 하더라도 ‘손맛’ ‘인심’ 이런 것들은 자영업자들에게 더 이상 경쟁력이... 가맹점 상권에 낀 자영업자와 가맹점 간판을 단 가맹점주, 양자의 처지는 별로 다르지 않다. 한식에 죽으나..."
1589,2017.07.01.,[UP&DOWN]도심 속 흉물 '상암쇼핑몰' 부지…4년째 잡초만,"© News1 인근 상인들 상권침해 반대로 인허가 지연 집값 상승 호재는 분명 ""착공만 기달려"" 지난 29일 오전... ◇역세권 알짜 부지 4년째 흉물로 롯데쇼핑은 2013년 서울시로부터 상암동 2만㎡ 규모 상업용 부지를..."
1590,2017.07.14.,김포 풍무역 역세권 앞 오피스텔 ‘김포 풍무 아트리온’ 공급,예상되면서 서울에 인접한 김포 풍무역 일대 오피스텔 또한 조기 매진될 것이라는 예상이 부동산 업계에서... 핵심상권이다. 김포시에 4년제 대학 유치 예정으로 일대의 개발도 활발하다. 마곡 LG사이언스파크도 7월...
1591,2017.07.13.,[한경매물마당] 동탄신도시 편의점 본사 직영점 등 8건,"없는 상권 건물. 보증금 2억원, 월세 1640만원, 융자 14억원, 실투자 19억원. 수익률 8.03%. 급매가 35억원. (02)557-8979 강남 노블에셋 이지현 ◆서울 논현동 초역세권 재건축용 수익형 상가주택=9호선 도보 2분..."
1592,2017.07.04.,"건국대, 첫 드림학기제 성과발표회 실시",건대 서울캠 행정관에서 자신들의 성과를 발표했다고 4일 밝혔다. [베리타스알파=나동욱 기자] 건국대는... 이들은 창업정부지원사업 신청 아이템 기획 및 시스템 고도화 마케팅 기획 B2B(화양동 상권)영업 B2C(건국대...
1593,2017.07.07.,스타필드 창원 최대 수혜지.. 어반브릭스 아파텔 주목,"기대감↑ [서울경제] 스타필드 하남, 고양에 이어 신세계가 선보이는 수도권 밖 첫 스타필드 지점이... 랜드마크 상권으로 자리매김 할 것으로 기대를 모으고 있다. 여기에 통합 창원시에 들어서는 어반브릭스..."
1594,2017.07.17.,양산신도시 '다인 로얄팰리스 물금' 1~3차 단지상가 막바지 분양,"1~2차 상가는 중앙고속도로, 경부고속도로 등의 접근이 수월해 부산을 비롯해 울산, 서울로 연결되는 쾌속... 따라서 상권 확대도 빠르게 전개될 것으로 보인다. 부산 2호선 지하철 남양산역 초역세권을 비롯해 부산대..."
1595,2017.07.09.,"전주시, 도시관광 현장 길거리 탐방 추진","지역상권과 길거리문화를 돌아보고 발전방안 등을 논의했다, 전주 객리단길은 다가동 객사 1~2길 인근 지역을 풍패지관 '객사'와 서울의 '경리단길'을 합쳐 부르는 신조어로 지난해 3월 구도심인 이 일대의 재개발구역이..."
1596,2017.07.04.,[단독] 증시 덮친 `오너 리스크`…MP그룹 주가 20% 급락,서울중앙지검 공정거래조세조사부(부장검사 이준식)는 이날 정우현 전 미스터피자 회장에 대해 구속영장을... 문 대통령은 후보 시절부터 경제 질서 확립을 강조했고 김상조 공정거래위원장도 취임 일성으로 골목상권...
1597,2017.07.07.,"공정위에 떨고있는 프랜차이즈, 김상조에게 빈말은 없다","7일 공정위에 따르면 서울지방공정거래사무소는 교촌치킨 가맹본부인 교촌F&amp;B와 김밥천국 가맹본부인... 취임 전인 5월 공정위원장에 지명되자 기자회견에서 ""취임 초기에 골목상권과 가맹·대리점에 집중할 계획""이라고..."
1598,2017.07.04.,"유영민 ""휴대전화 분리공시제 강력 추진""","4일 서울 여의도 국회에서 열린 인사청문회에서 통신비 인하를 기업에 강제할 수 없다며 사회적 논의기구를... 골목상권을 위협하고 있다는 지적에 대해선 ""배달 앱은 기본적으로 공공제가 돼야 한다는 생각에 동의하고..."
1599,2017.07.03.,"전동평 영암군수, 하나된 군민의 힘, 독보적 성과 거둔 민선 6기 3년","또한, 산성대 등산로 개설에 따른 관광객을 유도하여 읍시가지 상권을 살리기 위해 96억원 규모의... 5월 서울과 6월 영암에서 전격 발표하고 2018년 상반기에 전기자동차 시제품을 제작 ·완료하여 2019년 하반기에는 연간..."
1600,2017.07.06.,"K쇼핑, 미디어센터 오픈 ‘새 시대 열다’",KTH T커머스 채널 ‘K쇼핑’이 5일 서울 목동 방송회관에 자체 미디어센터를 오픈했다. 서용원 한진... 여기에 ‘동행관’을 통해 중소기업·소상공인·지역상권·농어촌을 대상으로 T커머스 동반성장 모델을 제시할...
1601,2017.07.04.,"주택시장 돈줄 죄자, 상가로 '투자 유턴'","하지만 상가는 주택, 오피스텔과 달리 입지뿐 아니라 미래 상권 형성이 중요하기 때문에 투자에 신중을 기하라고 전문가들은 조언했다. 3일 현대엔지니어링에 따르면 지난달 30일 서울 송파구 풍납동에 문을 연..."
1602,2017.07.18.,정용진 신세계 부회장이 자택에 '키즈 매장' 연 사연은,"서울 마포와 강서, 영등포, 경기도 파주와 김포, 양주 등 30분 이내 거리에 약 300만명이 거주하는 초대형 상권에 위치해 있다. 앞서 채용박람회에 참석한 정 부회장이 고양 스타필드를 유아동 컨텐츠로 차별화시키겠다는..."
1603,2017.07.14.,"국수나무 엔젤 캠페인, 지역기업들과 협력해 ‘동대문구 팀창업아카데미’ 개...",[서울신문 나우뉴스] 국수나무 본사 해피브릿지 협동조합이 개최한 동대문구 팀창업 아카데미의 모습.... 국수나무 엔젤캠페인 김철환이사장은 “지역상권에서 사업을 영위하는 가맹점주님들이 ‘국수나무엔젤...
1604,2017.07.10.,편맥·테라스·루프탑 모두 ‘불법’...‘夜놀이터’ 된 편의점의 ‘민낯’,"명백한 상권 침해라는 주장이 나온다. 단속에 나서야 할 해당 구청은 점주들의 인식변화가 선행돼야 한다고 말한다. 규제가 강화되지 않는 이상, 모든 편의점을 일일이 단속하기는 무리라는 것이다. 서울의 한 구청..."
1605,2017.07.04.,무늬만 위탁관리계약…이런 가맹본부 주의하세요,가맹본부와 서울 을지로 국립중앙의료원 건물 1층에 입점한 점포에 대한 위탁관리계약을 체결했다. A씨가... 특히 공정위가 처리한 사건 중에는 가맹본부들이 병원이나 대형마트 등 안정적인 상권에 위치한 점포를...
1606,2017.07.04.,젠트리피케이션 방지법 본격논의…박주민·홍익표·중기청 공동 공청회,"젠트리피케이션은 유명세를 탄 상권의 임대료가 치솟아 상권 형성에 기여한 임차인이 초기 투자비용을 회수하지 못한 채 떠밀려나는 현상이다. 서울 홍대, 상수동, 연남동, 망리단길, 경리단길, 성수동, 등이 대표적이다...."
1607,2017.07.02.,동서고속도로 개통 후 첫 주말 ‘명과 암’,이는 평소 서울~춘천 고속도로 이용차량이 18~19만대였던 점을 고려하면 2배가까이 증가한 수치입니다.... 또 경유지인 인제와 홍천지역의 국도변 상권침체를 우려하는 목소리도 높아지고 있습니다. 이런 부정적인 시각을...
1608,2017.07.19.,최저임금은 죄 없다! 김상조 “을의 고통은 공정위 탓”,"편의점, 피자·치킨 등 동네상권을 장악한 프랜차이즈지만 요즘 검찰수사로까지 확대된 프랜차이즈 갑질에... 4% 오른 7천530원으로 확정된 지 이틀이 지난 17일 오후 서울의 한 프랜차이즈 매장에서 직원이 업무를 보고..."
1609,2017.07.10.,"예덕상무사 보부상놀이 보존회, 도전한국인 전통예술 분야 대상 수상","[중부매일 최현구 기자]  예덕상무사 보부상놀이 보존회(접장 윤철현)가 지난 8일 서울어린이대공원... 덕산면 상권 활성화에도 기여할 수 있도록 최선을 다하겠다""고 말했다. 예덕,상무사,보부상,보존회..."
1610,2017.07.09.,규제 무풍에 고정 수요까지…단지 내 상가 인기,"같은 날 대우건설이 서울 강동구 고덕동에 공급한 '고덕 센트럴 푸르지오' 단지 내 상가인 '메가스퀘어... 확보해 상권 활성화가 빠르고 투자 안정성이 높은 편이라 인기가 많다""고 말했다.  &lt;ⓒ세계를 보는 창 경제를..."
1611,2017.07.18.,"김포한강신도시 수변상가 ‘한강블루’, 임대계약 쑥쑥...키즈테마파크 5년 임...","또한 지하철 9호선이 연장되면 인구유입이 증가될 뿐만 아니라 핵심상권으로서 자리매김할 것으로 전망된다. 도로망으로는 김포한강로, 48번국도, 서울외곽순환도로 등과 진출입이 쉬워 이용객들의 유입이 수월할..."
1612,2017.07.13.,창원 KTX 중앙역 인근 유동인구 증가... 신상권 형성 기대감 상승,[문화뉴스MHN이우람] 창원 KTX 중앙역 인근이 유동인구가 증가하면서 창원의 새로운 상권으로 떠오르고... KTX 서울 수서-창원중앙역 노선이 작년 말에 신설된 데 이어 앞으로 창원 중앙역을 기점으로 전국으로...
1613,2017.07.10.,"유통/화장품, 한 주 따라잡기 - IBK",화장품 외 과자·음료·잡화까지···골목상권 침해하는 H&amp;B스토어 (경향비즈 2017.07.09) 화장품과... 아르노 회장은 지난 6일 서울 동대문디자인플라자에서 열린 루이뷔통 전시회 전야제를 찾았다. 두타 마케팅팀 관계자는...
1614,2017.07.11.,"광주프린지페스티벌, 명품축제 성장 가능한가(3)","한때 대전의 중심지였던 이곳은 관공서들이 빠져나가면서 상권쇠락으로 침체에 빠졌다. 대전시는... 프린지페스티벌 주관단체였던 대전대중문화예술협회 손호득 사무국장은 ""지역 쪽에서는 서울 수준으로..."
1615,2017.07.10.,단말기 자급제 찬반 '논란',"서울의 한 휴대폰 판매점 앞을 시민들이 지나가고 있다. 사진/뉴시스   시민단체는 소비자들의 합리적인... 업계 관계자는 ""일선 판매점은 대부분 중소 상인들""이라며 ""일자리 감소와 함께 또 하나의 골목상권 붕괴로..."
1616,2017.07.09.,상가투자의 ‘틈새시장’ 지식산업센터내 상가 주목,가산디지털단지역 상권의 음식점 업종 월매출은 3월 현재 3800만~5500만원 수준으로 금천구(2722만원) 및 서울시 평균(3791만원)을 훌쩍 넘어서는 것으로 나타났다. 또 일반상가에 비해 상대적으로 저렴해 높은 수익률을...
1617,2017.07.13.,"성일종 의원, 자유한국당 소상공인특위 위원장 선임","골목상권, 전통시장 보호 등을 통한 경제활성화를 위해 더욱 노력하겠다”고 밝혔다. 한편, 한국당... 소상공인이 체감할 수 있는 성장에 있다고 판단, 신설된 기구로 당내 및 외부위원 26인으로 구성돼 있다. 서울=황명수 기자"
1618,2017.07.11.,"<노동계 夏鬪 비상>기세 오른 노동계, 숨 죽이는 기업… 줄줄이 이어지는 파업","오전 서울 광화문광장 세종대왕상 앞에서 ‘시급 1만원 실현’을 위한 양대노총 공동 기자회견을 열고 있다.... 골목상권 살리기, 재벌개혁 등에 강한 드라이브를 걸고 있는 신정부 정책에 재계가 눈치 보기로 일관하고..."
1619,2017.07.19.,[동서고속철도 인제·양구 역사 위치 어디로]인제 덕산리·갈골마을 택일 촉구...,"이에 따라 인제읍·북면 원통지역 통합 도심 개발에 적합지이자 서울~양양 고속도로 진입로인 국도 31호선과... 국도 44호선과도 연계, 북면 용대리 백담사 관광지, 인제읍·남면 시가지 등 인제읍 상권 중심지로 철도 이용객..."
1620,2017.07.10.,박영선 의원 초대 중기부장관으로 급부상,또 지역구인 구로을의 경우 서울지역 최대 중소기업과 벤처기업들이 밀집해 있는 디지털단지가 있어 중소 및 벤처업계에 대한 이해도 상당한 점도 회자되고 있다. 아울러 2011년 중소기업과 골목상권을 지키는 의원...
1621,2017.07.10.,"예덕상무사 보부상놀이 보존회, 2017 도전한국인 전통예술 분야 대상 수상","예덕상무사 보부상놀이 보존회(접장 윤철현)가 지난 8일 서울어린이대공원 능동숲속의 무대에서 열린... 덕산면 상권 활성화에도 기여할 수 있도록 최선을 다 하겠다""고 말했다. 예산=이회윤 기자 leehoiyun@ggilbo.com..."
1622,2017.07.14.,[화제의 분양현장]선릉역 먹자골목 중심에 ‘상업시설’ 공급,확보하여 상권평가 1등급을 받은 지역으로 현재 공실 없는 상업지역으로 유명하다. 이번 마지막 회사 보유 물량은 사전 예약제로 분양하고 있다. 홍보관 및 현장은 서울 강남구 대치동 894에 있다. ▶ 동아일보 단독...
1623,2017.07.04.,[발언대] 프랜차이즈 기업의 氣를 살리자,강병오 FC창업코리아 대표 [서울경제] 새 정부가 들어서자마자 프랜차이즈 본사의 ‘갑질’ 논란이... 이런 현상이 김상조 공정거래위원장이 가맹점 이익보호와 골목상권 문제를 집중 들여다보겠다는 첫 일성에 과잉...
1624,2017.07.06.,"서초구 반포동 랜드마크 `아크로리버파크`, 최근 매매가가...","생활편의시설로는 신세계백화점, 뉴코아아울렛, 킴스클럽, 터미널지하상가와 같은 대형 상권이 풍부하다. 인근에 계성초, 반포초, 반포중, 신반포중, 세화고, 세화여고, 덜위치칼리지서울영국학교 등이 있다...."
1625,2017.07.10.,[충청브리핑] 문재인 대통령 “한반도 6·25이후 최고 위기”,또한 대전 화상경마장 이전 본격화조짐을 보이면서 상권 공동화를 우려하고 있는 상황과 조선일보는 충남... ◇조선일보 -천안 부자들 모인 ‘천안의 타팰’ 처음 10억 돌파 [인슈와 진짜 집값] 서울가는 급행 전철 2대...
1626,2017.07.04.,"행자부 골목경제사업, 강진읍 구도심 활성화 추진","이번에 선정된 5곳은 전남 강진군을 포함해 서울 마포구, 부산 사하구, 충남 공주시, 전북 남원시이다. 앞서... 골목경제사업은 해당 지역 사업성격에 따라 상인교육, 앵커시설 조성, 매대제작, 상권재구조화, 시설 개선 등..."
1627,2017.07.05.,"반포동 대장주 아파트 ‘아크로리버파크’, 최근 동향은?","신세계백화점, 뉴코아아울렛, 킴스클럽, 터미널지하상가와 같은 대형 상권이 풍부하다. 교육시설로는 계성초, 반포초, 반포중, 신반포중, 세화고, 세화여고, 덜위치칼리지서울영국학교가 있다. 단지 바로 앞에..."
1628,2017.07.03.,6월 독자권익위원회,조선일보 등 서울 쪽 언론은 에너지 문제 측면에서 원전을 보는 것 같다. 지역신문은 지역민의 불안감을... ▶한원우= '부산 골목상권 육성 6000억 푼다' 기사도 눈여겨봤다. 법조인으로서 평소 자영업자 몰락 문제에 관심이...
1629,2017.07.03.,'갑질논란' 혐의 정우현 전 MP그룹 회장 검찰 출석,보복 출점과 관련해서도 해당 점포 주변의 상권 규모와 매장의 특성 등을 고려하면 의도적 보복이라고 보기 어렵다고 호소하는 것으로 전해졌다. 이날 정 전 회장이 서울중앙지검에 들어가는 길에...
1630,2017.07.15.,저금리·부동산 대책 영향…투자자들 상가 분양시장으로 ‘눈길’,[서울신문] 대전 유성구 등 지방 수익형 부동산에 투자자 관심↑ 저금리 기조가 계속되고 정부가 6·19... 사진=대전 유성구 디오토몰 조감도.부동산시장 관계자들은 지방 상가의 경우 특화된 상권으로 소비자들의 발길이...
1631,2017.07.13.,"남은 물량을 잡아라! 코오롱 건대 ‘더프라우’, 마감 임박","서울시 광진구 자양동 3-7번지 일원에 들어서는 주상복합 코오롱 건대 ‘더프라우’가 공동주택은... 더프라우가 들어서는 건대역 사거리는 강북 최대상권으로, 일 10만 소비인구와 일일 총 642억의 매출이 발생되는..."
1632,2017.07.05.,"동네 상권 20평 소규모 점포로 월 매출 3,000만 이상 올리는 비결은?","동네상권 20평 소규모점포로 월 매출 3,000만 이상을 기록하는 가맹점 비율이 50%에 달한다. 실제 2017년 기준 월 매출 3,000만 이상 돌파 매장으로는 금천광장점(17평), 오산세교점(20평), 용암점(23평), 영주가흥점(23평), 서울..."
1633,2017.07.14.,둥지내몰림 위기 상인에 공공상가 지원,"[내일신문] 성동구 17일 입주자 모집 서울 성동구가 둥지내몰림(젠트리피케이션) 위기에 처한 상가... 지역상권이 함께 상생의 희망을 만들어 갈 수 있도록 지원하겠다""고 말했다. Copyright ⓒThe Naeil News. All rights..."
1634,2017.07.13.,[일문일답] 김성영 이마트24 대표 “매년 1천곳 신규 출점…직영점은 최소화”,김성영 이마트24 대표가 13일 서울 삼성동 코엑스에서 열린 기자간담회에서 기자들의 질문에 답을 하고... 또 직영점이 운영을 하다가 가맹 전환을 하면 초기에는 직영점이 늘어날 텐데 골목상권 침해라는 비판에...
