,date,title,contents
1094,2017.07.05.,"K쇼핑, 인프라·콘텐츠 두 마리 토끼 동시에",K쇼핑은 5일 서울 목동 방송회관에 자체 미디어센터를 열고 하반기 신규 서비스를 발표했다. 총 1천700평... 경험 부족과 비용 부담 등으로 TV쇼핑 입점에 어려움을 겪었던 중소기업·소상공인·지역상권·농어촌을...
1095,2017.07.17.,[라이프&]기능성 높이고 스타일 살리고 '프로를 입은' 골프웨어,현재 서울과 수도권 주요상권 등에 총 40개 매장을 운영 중이며 연내 60개 점까지 확대한다는 계획이다. 침체 됐던 업계에 이처럼 골프웨어 열풍이 불자 각 업체들은 발빠르게 새 브랜드 유치전을 펼치고 있다. 최근...
1096,2017.07.21.,(MONEY MEN 토지편)떠오르는 상권 '마포구'를 주목하자,"원부동산개발자문상담소 송병현 대표는 마포구가 과거부터 난지도 이슈로 서울 부동산 내에서 큰 주목을 받지 못했으나 상암, 홍대 상권 개발이 이뤄지면서 3년 연속 공시지가 상승률 1위를 기록하고 있다고..."
1097,2017.07.05.,잘 고른 역세권 상가 “월급통장 보다 낫다”,"한국감정원의 올해 1분기 집합상가 기준 상권별 투자수익률을 살펴보면 서울권역에서는 홍대역과 합정역 인근으로 분포한 홍대합정 상권이 3.04%를 기록, 전국에서 가장 높다. 경기도의 경우 Δ의정부역 상권이 2.15..."
1098,2017.07.21.,‘동탄2신도시 A7블록 공공분양주택’ 8월 21일~23일 계약 진행,"지방도318호선으로 서울을 빠르게 연결해준다. 또한 동탄역 주변으로 형성되어 있는 편리한 상권 및 생활환경 또한 눈에 띄는 장점 중 하나이며, 북쪽으로 이케아, 롯데프리미엄아울렛, 코스트코 등이 개발되거나..."
1099,2017.07.21.,럭셔리 복층형 오피스텔 제주 ‘세인트스톤 더 부티크‘,"부동산시장 분석업체 부동산인포에 따르면 지난해 서울에서 공급한 55곳의 오피스텔을 조사 결과 일부... 단지는 무엇보다 제주 최고의 중심상권 연동에 자리하여 바오젠거리, 대형마트 및 특급호텔 등이 인접해 있어..."
1100,2017.07.13.,편의점 위드미 ‘emart24’로 새 출발…정용진 승부수 통할까,최근 정치권과 정부가 골목상권 보호를 위해 제도 개선을 추진하는 등 유통대기업의 입지가 좁아진 상황에서 정 부회장의 이 같은 승부수가 통할지 주목된다. 김성영 이마트위드미 대표이사는 13일 서울 코엑스몰에서...
1101,2017.07.10.,최저임금 1만원 현실화?,우리나라에서도 최저임금을 보완하기 위한 생활임금제도가 서울과 일부 지방자치단체에서 시행되고 있기는... 자영업자와 영세상공인이 어려움을 겪는 이유는 골목상권을 파고드는 대기업의 이기주의와 갑질의 횡포를...
1102,2017.07.14.,"[인터뷰]최치영 여기어때 이사 ""프랜차이즈 가맹점, 3년 안에 200개 오픈""",""" 최치영 여기어때 프랜차이즈사업부 이사는 지난 7일 서울 강남구 삼성동 여기어때 본사에서 기자와 만나... 들어오면 상권이 더 좋아진다고 생각하다보니 주변 업주들과의 관계도 좋다""고 밝혔다. 여기어때는 특급..."
1103,2017.07.14.,"셀렉토커피, 사업설명회 통해 카페창업 성공솔루션 제시","18일 서울 구로동 본사에서 카페창업에 관심 있는 예비창업주들을 위한 사업설명회를 진행한다. 셀렉토커피... 짚어보고 상권분석, 운영 및 매출 노하우 등 셀렉토커피만의 차별화된 창업 지원전략에 대해 공개할..."
1104,2017.07.05.,"풀잎채, 생면쌀국수 전문점 `랑포` 론칭",쌀국수 마을이라는 의미의 랑포는 이날 서울 송파 문정법조단지 내 대명벨리온 빌딩에 1호점을 열었다. 문정법조단지는 대형 지식산업센터를 중심으로 폭넓은 오피스 상권이 형성돼 있는 곳으로 쌀국수를 선호하는...
1105,2017.07.14.,상업용지 비율 낮은 2기 신도시 상가 물량 눈길,김포 한강신도시에서는 신도시 중심부의 장기동 상권과 서울 접근성이 좋은 운양동 상권을 주목할 만하다. 장기동 상권인 한강신도시 수변상업용지 C6-2블록에서는 신우R&amp;D건설이 '한강블루' 상가를 분양 중이다....
1106,2017.07.18.,‘에너지 줄줄’···문 열고 냉방영업 단속,17일부터 오는 21일까지 닷새가 추진되는 이번 실태점검을 서울을 비롯한 전국 광역도시를 비롯한 12개 지역 18개 주요 상권을 대상으로 현황점검 및 계도활동을 벌인다. 산업부에 따르면 ‘문열고 냉방영업’을 할 경우...
1107,2017.07.03.,"""포털 횡포 심각…사이버 골목상권 보호법 제정해야""(종합)",사이버 골목상권 보호 위한 특별법 추진(서울=연합뉴스) 백승렬 기자 = 자유한국당 김성태 의원과 중소상공인연합회 온라인공원위회외 위원들이 3일 국회 정론관에서 사이버 골목상권 보호를 위한 특별법 추진촉구...
1108,2017.07.18.,영화와 드라마로 보는 공무원 한국사,"12월호) - 미래엔 고등학교 한국사 교과서에 실린 위 사료는 2017년 서울시 7급 한국사 문제에서 그대로... 중심 상권은 외형적으로 크게 발전한 반면, 거적을 둘러친 토막집에 사는 도시 빈민층도 크게 늘어났다. 이는 '모던..."
1109,2017.07.19.,"강남구의회 행정재경위, 현장의정 활발","기자] 서울 강남구의회 행정재경위원회(위원장 김병호) 의원들이  최근 제259회 임시회 상임위원회... 바라며 아울러 주변상권 또한 탄력을 받아 지역경제 활성화에 기여되기를 바란다""며 소감을 밝혔다."
1110,2017.07.11.,[전국 주요 신문 톱뉴스](11일 조간),"한겨레(서울) = '골목상권' 대기업 진출, 특별법 도입해 막는다 ▲ 한국일보(서울) = 文정부 두 달, 아직도 '반쪽 정부' ▲ 매일경제(서울) = 韓ㆍ中정상회담후 더 독해진 사드보복 ▲ 서울경제(서울) = 국내 2위 KR모터스..."
1111,2017.07.13.,"동네 사진관들 ""이력서 사진 부착금지 철회하라""","13일 오전 한국프로사진협회는 서울 세종대로 광화문1번가 국민인수위원회 앞에서 기자회견을 열고 ""이력서... 골목상권을 죽여선 안된다""고 목소리를 높였다. 이들은 ""입사지원서에 출신지역·가족관계·신체조건·학력..."
1112,2017.07.21.,[복합몰 규제 발표후 아이파크몰 가보니…] 입점상인들 “우리도 소상공인인데...,"“불경기에 매출 줄었는데…상권 죽이는 격” “이용객 입장서도 편의성 상실” 의견도 영화팬들 “조조... 21일 현재 서울시내에 위치한 복합쇼핑몰 7곳(현대아이파크몰, 롯데몰 은평점ㆍ김포점, 롯데월드타워, 스타필드..."
1113,2017.07.24.,13번의 올림픽 참가한 사라 루이스 국제스키연맹(FIS) 사무총장이 말하는 평창...,뿐만 아니라 서울~평창 간 고속철(KTX) 개통은 평창 지역에 더 많은 관광 인프라를 구축하는 데에도 도움이 되어 자역 상권도 좋아질 것입니다. 평창의 높은 산악지대는 겨울은 물론 여름철 휴양을 위해서도 좋을 것...
1114,2017.07.05.,[단독]정우현 일가 '공짜급여' 수십억 챙겼다…구속영장 혐의 적용,5일 사정 당국에 따르면 서울중앙지검 공정거래조세조사부(이준식 부장검사)는 전날 정 전 회장에게... 또 '보복 출점'과 관련해서도 해당 점포 주변의 상권 규모와 매장 특성 등을 고려하면 의도적 보복이라고 보기...
1115,2017.07.20.,[한경매물마당] 명동역 역세권 게스트하우스 급매 등 9건,"주거 상가 복합상권으로 지가상승률 상위 지역. 급매 38억원 (02)543-2588 서초 두바이 이세연 ◆서울 명동역 게스트하우스=역 도보 3분, 퍼시픽 호텔 인근 대지 266㎡. 연면적 484㎡의 지하 1층~지상 3층 5년..."
1116,2017.07.13.,성수동에 임대료 걱정 줄인 공공안심상가,한국감정원에 따르면 성수동의 최근 2015~2017년 사이 임대료 상승률은 6.45%로 서울 주요 상권 중 경리단길(10.16%)에 이어 두번째로 높다. 서울 평균인 1.73%의 4배에 가깝다. 성동구는 △젠트리피케이션 방지 조례 제정...
1117,2017.07.18.,이것이 리얼 수변상가 ‘라베니체 마치 에비뉴’ 서서히 위용 드러내,확보 [서울경제] 호수나 강 인근에 위치해 쾌적성과 조망 등이 우수한 수변상가가 인기 상권으로 떠오르고 있어 화제다.   수로를 중심으로 조성되는 수변상가는 조망과 공간적 심미성이 우수해 방문객들이 많다....
1118,2017.07.05.,쌀국수도 이제 생면으로 즐긴다,이날 오픈하는 랑포 1호점은 서울 송파의 문정법조단지 내 대명벨리온 빌딩 지하 1층에 위치한다. 문정법조단지는 대형 지식산업센터들을 중심으로 폭넓은 오피스 상권이 형성된 곳으로 쌀국수를 선호하는 20~30대 오피스...
1119,2017.07.19.,[문재인 정부 5개년 계획]카드수수료 인하·상가임대차 보호법 개정 등 추진,"소상공인 수익성 높여 일자리 10만개 창출 2022년까지 고성장 소상공인 1만5,000명 집중 양성 [서울경제]... 골목상권 소상공인의 수익성과 생존율을 높인다는 취지다. 지역상권 내몰림 방지를 위해 생계형 적합업종도..."
1120,2017.07.13.,"다산신도시 상가 노린다면… ""위례·광교 참고하라""",다산신도시는 서울과 가장 인접한 경기도권 신도시로 가격경쟁력까지 갖추면서 수요자 이목을 집중시켰다.... 다만 신도시나 택지지구 상가는 상권형성 기간이 일정치 않아 장기공실 위험성을 인지해야 한다. 따라서...
1121,2017.07.18.,인건비 부담 없는 1인 창업 아이템… 소자본 프랜차이즈 창업 세계맥주 전문점...,"줄였고, 상권분석 및 시장분석팀을 통해 특급 추천 점포 상권 브리핑을 전개해 창업 성공 확률을 높였다.... 한편, '쿡플(cookpl)'은 전국 파트너 지사와 가맹점을 모집 중이며, 현재 서울 강남, 서울 강북, 경기 일산, 경기..."
1122,2017.07.03.,"김성태 ""포털 횡포 방지""…사이버골목상권보호특별법 추진",사이버 골목상권 보호 위한 특별법 추진(서울=연합뉴스) 백승렬 기자 = 자유한국당 김성태 의원과 중소상공인연합회 온라인공원위회외 위원들이 3일 국회 정론관에서 사이버 골목상권 보호를 위한 특별법 추진촉구...
1123,2017.07.16.,전북도내 재생 뉴딜사업 대상지 관심,"특히, 재개발ㆍ뉴타운 지구가 많은 서울 및 수도권지역의 신청이 주를 이루겠지만, 전북지역 역시 구도심... 주거환경 정비, 상권 기능회복, 공동체 활성화, 경제 거점형성 등과 같이 지역의 여건과 필요에 맞는 재생..."
1124,2017.07.14.,[위기의 세계 1위 면세점-상]“과도한 규제 벗고 경쟁력 강화해야”,[편집자주] 서울 시내 한 면세점 매장 전경. 사드 여파로 중국 단체 관광객의 발길이 뚝 끊겼다. ⓒ데일리안... 면세점의 경우 매출의 70% 이상이 외국인으로부터 나오고 골목상권이나 전통시장과 겹치는 품목이 거의 없다....
1125,2017.07.17.,월 2회 의무휴업 복합쇼핑몰까지 확대…일자리 안정자금 대책 전담반 도구성,"&lt;yonhap photo-1766=""""&gt; 고형권 기획재정부 차관(왼쪽 세번째)이 지난 11일 서울 영등포구 한국수출입은행에서 열린... 우선 대규모 점포에 대한 입지 및 영업제한 규제를 강화하고, 상권영향평가 등 등록제도도 객관성과..."
1126,2017.07.16.,"""제품 값 인상"" ""폐업"" 뿔난 자영업자들","김씨 가게 반대편에서 삼겹살 집을 운영하는 최 모씨(56)는 ""가뜩이나 상권이 아직 형성되지 않은 곳인데... 이날 서울 강서구에서 식당을 운영하는 박 모씨(61)는 ""이 동네는 최저임금으로 모집하면 지원자가 한 명도 없어..."
1127,2017.07.11.,광주 도심 어떻게 발전할까… 송정역·한전공대 '변화 주도',"서울 거주자의 송정역 인근 지출은 요식업(16%), 숙박업(8.7%), 쇼핑(6.9%) 순으로 늘었다. 향후 송정역 인근 상권의 발전 가능성을 점칠 수 있는 대목이다. 반면 KTX에 이어 SRT 개통으로 고속버스 이용객이 심하게..."
1128,2017.07.18.,지하철 천호역 6번 출구 에스컬레이터 9월 착공,"[서울신문] 주민의 숙원사업이었던 천호역 6번 출구 에스컬레이터가 드디어 9월에 착공한다. 천호역 6번... 지역상권 활성화에도 긍정적인 역할을 할 것으로 기대한다”고 설명했다. 더불어, “주민의 이동편의를..."
1129,2017.07.11.,창원SM타운 최대 수혜단지 '힐스테이트아티움시티' 홍보관 19일 오픈,27-1 서울아동빌딩 4층)을 19일 오픈한다고 11일 밝혔다. 사업지 내 위치한 기존 견본주택은 18일까지만... 창원 SM타운이 문을 열면 한류 관광객이 방문할 것이라는 전망도 나오고 있어 상업시설은 SM타운과 함께 상권을...
1130,2017.07.11.,창원SM타운 최대 수혜단지 '힐스테이트아티움시티' 홍보관 19일 오픈,27-1 서울아동빌딩 4층)을 19일 오픈한다고 11일 밝혔다. 사업지 내 위치한 기존 견본주택은 18일까지만... 창원 SM타운이 문을 열면 한류 관광객이 방문할 것이라는 전망도 나오고 있어 상업시설은 SM타운과 함께 상권을...
1131,2017.07.18.,"사통팔달 교통망 갖춘 지식산업센터, 동탄 ‘루체스타비즈’ 주목",또한 교통 인프라가 잘 갖춰진 지역 주변으로는 상권이 형성되고 편의시설이 늘어나 주변여건도 개선된다는... 또한 KTXSRTGTX 동탄역(예정)을 이용하면 강남까지 20분대에 도달할 수 있어 서울 접근성이 탁월한...
1132,2017.07.16.,"[최저임금 대책]정부, '상권보호 임대차 안정화' 대책 쏟아내",김동연 부총리 겸 기획재정부 장관은 이날 오후 정부서울청사 영상회의실에서 고용노동부 산업통상자원부... 인건비 부담이 커진 영세사업자를 보호하기 위해 대규모 점포의 출점을 제한하고 상권을 보호하겠다는 것....
1133,2017.07.17.,가정주부가 월 3천 매출 사장님 됐다,현재 서울 부산 대구 광주 대전 등 전국 5개 광역시 중심상권에 총 19개 체험점포가 운영되고 있다. 신사업창업사관학교는 철저하게 준비된 창업을 유도해 실패없이 오래 생존할 수 있는 소상공인 육성을 목적으로...
1134,2017.07.04.,"검찰, 정우현 전 MP그룹 회장 구속영장 청구…100억원대 부당이득(종합)",[서울신문] 정우현 전 MP그룹 회장이 가맹점을 상대로 한 ‘갑질 논란’에 휩싸인 가운데 부당하게 빼돌린... 보복 출점과 관련해서도 해당 점포 주변의 상권 규모와 매장 특성 등을 고려하면 의도적 보복이라고 보기...
1135,2017.07.18.,(참고자료) 전국 주요상권에서“문 열고 냉방영업”일제점검 시행,"합동 실태점검 대상 전국 주요 18개 상권 &gt; 지역 장 소 서울 서울 홍익대, 강남역, 명동역, 가로수길 인근 부산 부산 서면, 남포동 인근 인천 인천 부평역 인근 강원 강원 춘천시 명동 인근 대전 대전 갤러리아백화점..."
1136,2017.07.22.,판교 '운중 더 디바인' 등 인기 완성형 택지지구막바지 물량 잡아라,"또한 제2의 테크노밸리로 불리는 창조경제밸리를 비롯해 경부~용인서울고속도로의 연결(2018년 예정)... 구래동의 이마트, 중심상권, 의료시설 등 생활편의 인프라가 다양하고 단지 앞 수변공원도 위치해 있어 쾌적하다...."
1137,2017.07.05.,음성쇼핑·웹드라마 제작…`K쇼핑` 1위 굳히기,"오세영 KTH 사장(사진)은 5일 서울 목동 K쇼핑 미디어센터에서 열린 기자간담회에서 ""연 1조8000억원으로... 이밖에 KTH는 중소기업 전용관인 '동행관'을 운영, 중소기업·소상공인·지역상권·농어촌을 상대로 일정 기간..."
1138,2017.07.13.,"‘KBS스페셜’ 저성장·저출산·고령화 시대, 늘어나는 '빈집' 대책은?","[서울경제] 13일 방송되는 KBS1 ‘KBS스페셜’에서는 ‘불안한 미래, 빈집쇼크’ 편이 전파를 탄다. 도쿄 인근... 그러나 반백년의 세월이 흐른 지금은 물리적 쇠퇴가 가속화 되면서 상권이 죽고 인구가 감소해 대로와..."
1139,2017.07.15.,[맛집로드] 유서 깊은 골목 ‘연희맛길’,"주택가 초입의 오래된 외식상권만이 중장년층 미식가들의 단골 방문코스였을 뿐이다. 그러다 지난 몇년간... 서울 서대문구 연희동 130-13/ 어란 파스타 2만1000원, 제노베제 1만9000원/ (점심)12:00~15:00 (저녁)17:00~22:00..."
1140,2017.07.13.,'한화·두산·롯데 면세점게이트'…업계 '역사''현재''미래' 재조명,"특히 두산이 내세운 동대문 두산타워는 일전에 롯데가 제안하였으나 탈락했던 동대문 상권을 내세우고... 4월 서울 시내면세점 4곳을 추가 입찰 진행했다. 이 과정에서 박근혜 정부의 비선실세 최순실의 개입, 롯데와..."
1141,2017.07.03.,정우현 '치즈통행세·보복출점' 부인…檢 구속영장 적극검토,3일 법조계에 따르면 서울중앙지검 공정거래조세조사부(이준식 부장검사)는 이날 오전 정 전 회장을 피의자... 보복 출점과 관련해서도 해당 점포 주변의 상권 규모와 매장의 특성 등을 고려하면 의도적 보복이라고 보기...
1142,2017.07.17.,제주 연동 럭셔리 오피스텔 ‘세인트스톤 더 부티크’ 분양,"단지는 제주 최고의 중심상권 연동에 위치해 있다. 바오젠거리, 대형마트 및 특급호텔 등이 인접해 있어... (주)아세아 건영 관계자는 “최고급 프리미엄 레지던스 오피스텔은 서울 청담동과 강남 등지에 단 몇 곳만..."
1143,2017.07.04.,'갑질 논란' 미스터피자 정우현 前 회장에 구속영장 청구,"서울중앙지검 공정거래조세조사부(이준식 부장검사)는 4일 업무방해, 공정거래법 위반, 횡령 등의 혐의로 정... 보복 출점과 관련해서도 해당 점포 주변의 상권 규모와 매장의 특성 등을 고려하면 의도적 보복이라고 보기..."
1144,2017.07.21.,이대역 트리플 역세권의 '이대 더가온' 선착순 분양...마감임박,"또한 다양한 버스노선과 광역버스, 공항버스 등을 이용한 서울 주요도심으로의 접근이 빠른 교통망이 구축되었다. '이대 더가온'은 이대 중심상권에 위치하여 현대백화점, 그랜드마트, M 밀레오레, 에스에이피엠, CGV..."
1145,2017.07.06.,국내최초 가전매장 ‘전자랜드 용산점’ 리뉴얼한다,사진은 6일 그랜드오픈한 용산본점 모습.] 용산전자랜드를 운영해 온 전자랜드프라이스킹은 1985년 서울시... 용산 전반 상권이 쇠퇴했기 때문이다. 현대아이파크몰이 들어서고 HDC신라면서점이 입점하며 용산을...
1146,2017.07.13.,"글로벌텍스프리 ""유럽 시장 진출로 세계 2위 기업 도약""","글로벌텍스프리는 13일 서울 여의도에서 기자간담회를 갖고 유안타제1호스팩(204620)과의 합병 상장에 따른... 특히 국내 대표 상권이자 외국인 쇼핑 중심지인 명동 상권 내 택스리펀드 가맹점 점유율 1위로, 명동 상권..."
1147,2017.07.16.,"[머니+ 성공창업, 상권을 보라] 프랜차이즈 아이템 선정","추천 [서울경제] 예비 창업주가 준비 단계에 있어서 가장 먼저 선택해야 하는 것은 아이템 선정, 즉 업종을... [서울경제 바로가기]1997년 이래 대한민국 최고의 과학자 DB [바로가기]서울경제의 모든 연재물!... 서경Cube..."
1148,2017.07.19.,여전히…문열고 에어컨 ‘빵빵’…오늘도 명동거리는 ‘개문냉방’,안그래도 장사 안되는데.” 19일 오전 서울 중구 명동거리. 장마가 지나간 후 찾아온 무더위로 오전부터... 산업통상자원부는 최근 폭염으로 전력 수요가 급증함에 따라 지난 17일부터 21일까지 전국 주요상권에서 냉방영업...
1149,2017.07.21.,경기도 운정신도시 ‘야당역 센트럴파크리움’ 분양,수많은 인파를 형성하는 곳은 지하철이 가까운 활발한 상권이 주변에 위치하거나 다수의 업종이 몰려 있는... 이러한 교통개발은 향후 서울접근성을 높이면서 더욱 폭넓은 수요층을 끌어들일 것으로 분석된다. 특히...
1150,2017.07.13.,하반기 집값 상승폭… 0.3%로 둔화 예상,"감정원이 젠트리피케이션(임차료가 올라 기존 주민과 상인이 떠나는 현상)이 이슈가 된 서울 주요 상권의 임대료를 분석한 결과, 최근 2년간 용산구 이태원동 경리단길이 10.16%로 가장 많이 올랐다. ▶ 동아일보 단독..."
1151,2017.07.14.,"셀렉토커피, '카페창업 완전정복' 사업설명회 개최",18일 서울 구로동 본사에서 카페창업에 관심 있는 예비창업주들을 위한 사업설명회를 진행한다고 14일 밝혔다. 이번 사업설명회에서는 '카페창업 완전정복'을 주제로 2017년 하반기 창업 동향 및 전망을 짚어보고 상권분석...
1152,2017.07.13.,오늘 회식은 맥주 대신 질소커피?,몫 [서울경제] 올해 커피 업계의 신 상품 중 하나가 ‘질소커피’다. 말 그대로 커피에 질소를 주입한... 모두 직장인들이 밀집한 오피스 상권이다. 이들 매장에서 하루에 팔리는 나이트로 콜드브루는 평균 60잔 내외로...
1153,2017.07.14.,"우리은행, 의정부 외국인금융센터 개점···외국인고객 ‘금융허브망’","김태형 서울랜드 마케팅 이사, 엠디 쟈히둘 이슬람 뷰이얀 주한 방글라데시 대사관 서기관, 사멘 속카 주한... 지난달 29일부터 영업을 시작한 의정부 외국인금융센터는 경기북부지역 최대 외국인 상권인 의정부..."
1154,2017.07.10.,한양 주택사업본부장에 서홍 전 대림AMC 대표,"신임 서홍 부사장은 서울 출신으로 건국대 법학과를 졸업하고, 1991년 우성건설을 시작으로 2000년부터... 파이낸싱, 상권기획(MD), 임대, 운영, 관리 등 가치 사슬을 확대해 ㈜한양이 디벨로퍼 기능을 지닌 건설명가로..."
1155,2017.07.18.,신세계發 복합쇼핑몰 '스타필드' 내달 고양에도 정식 오픈,"◆서북부 최대 쇼핑몰 스타필드 고양은 고양시와 서울 서북부(은평·서대문) 등 반경 3km이내 핵심 상권에 180만명이 거주하고 있다. 서울 강서, 마포, 영등포와 경기도 파주, 김포, 양주 등 30분내 접근 가능한 지역을..."
1156,2017.07.13.,[밀착카메라] 종일 땡볕에…'인간 현수막' 논란 시끌,"[분양사무소 관계자 : 하나당 벌금이 25만원에서 45만원이면, 벌금보다는 개인이 드는 게 낫잖아요.] 서울에... 입간판이 상권에 많아서 자주 묻히거든요. 저희는 구석진 곳에 위치해 있기 때문에 홍보 효과가 훨씬 많아서..."
1157,2017.07.05.,"""지니야 방송상품 주문해줘"" K쇼핑, 대화형 쇼핑 선보인다","서울 목동 방송회관에 미디어센터를 개관한 것을 기점으로 T커머스 사업을 더욱 공고히 해 올해 말에는... 이 외에도 중소기업 전용관인 '동행관'을 열고 일부 수수료를 면제해 주는 등 중소기업과 소상공인, 지역상권..."
1158,2017.07.02.,SKT가 공개한 '유동인구 빅데이터' 기반 공공·민간 서비스 봇물,서울·부산 등 지자체 40여 곳에 빅데이터 제공…행정 효율 높여 #. 장애인 전용 휠체어 내비게이션... SK텔레콤은 상권분석 등 위치기반 빅데이터 플랫폼 ‘지오비전’에 담긴 각종 시장정보와 공공 데이터를 결합해 △내...
1159,2017.07.21.,"정관신도시 ‘더조은몰’, 스타마케팅 이어 파격 경품 마케팅 ‘눈길’","[서울신문] 글로벌 금융위기 이후 분양광고에서 자취를 감췄던 연예인 모델이 다시금 등장하는 추세다.... 또한 다 방향 출입구 개설로 핵심 상권의 유동 인구를 자연스럽게 이끌 수 있도록 설계되어 노출성, 흡인성을..."
1160,2017.07.11.,"도심 중소유통·소상공인 75%, 복합쇼핑몰로 경영악화","서울 은평, 수원 등 도심 중소 유통·소상공인 75%가 복합쇼핑몰 진출로 인해 경영이 악화됐다는 조사 결과가... 주변 상권 영향 실태조사' 결과를 발표했다. 조사결과 중소유통업자 및 소상공인의 66.3%가 복합쇼핑몰..."
