,date,title,contents
550,2017.07.25.,"[화제의 분양현장]반도건설, 원주기업도시 첫 교육특화 아파트 선보인다","교육특화…서울까지 50분 ‘범수도권’ 입지 다져… 반도건설, 전국에 5만여 가구 분양…‘신도시 강자’... 단지는 원주기업도시 메인 상권인 중심생활권에 위치해 편리한 쇼핑과 문화생활이 가능할 것으로..."
551,2017.07.28.,[오늘의 인사]경찰청 교육부 제주특별자치도 外,이재열 ▲ 서울지방경찰청 차장 정창배 ▲ 광주지방경찰청장 배용주 ▲ 경남지방경찰청장 원경환 -교육부... 골목상권살리기추진팀장 조순여 ▲ 농업기술원 서귀포농업기술센터소장 허종민 ▲ 인재개발원 사회교육과장...
552,2017.07.18.,스타필드 고양 내달 개장… 수도권 서북부 상권 쟁탈전,인접한 서울 은평구의 ‘롯데 은평몰’과 상권이 겹쳐 유통 ‘빅2’ 간 경쟁이 본격화하는데다 올해 하반기 롯데 아웃렛과 이케아 쇼핑몰 2호점도 고양에 들어설 예정이라 수도권 서북부 상권 경쟁도 더욱 치열해질...
553,2017.07.25.,위례 택지지구 유일한 대로변 복합상가 '센트럴메디타운’ 분양,"[스포츠서울 김종철기자] 최근 다양한 상가가 등장하고 있어 투자자들의 상가 투자에 대한 관심이 커지고... 강남, 송파, 성남의 수요를 흡수하는 광역상권인 ‘약진로’에 위치해 있어 인근 상가 중 유일한 상가로..."
554,2017.07.27.,성안길 17년 명맥 향토 쇼핑몰 `쥬네쓰' 300억 매물로 나왔다,"매각 희망금액은 총 분양가의 절반 수준인 300억원 선이며, 현재 서울의 업체와 물밑협상을 벌이는 것으로... 결국 한때 청주 상권의 상징이었던 쥬네쓰는 청주 외곽지역의 대형 백화점과 아울렛이 들어선 이후 쇠락의..."
555,2017.07.17.,'에너지 줄줄 새는 개문냉방 영업 안돼요',"산업통상자원부는 오는 17일부터 21일까지 서울 명동, 홍대 등 전국 18개 상권에서 ‘문 열고 냉방영업’ 실태점검을 시행한다고 밝혔다. 2017.7.17/뉴스1 sowon@ ▶ 놓치면 후회! 최신 만화 보기 / 2017년 나의 운세 보기..."
556,2017.07.24.,[단독]손오공에 일감몰아받는 '초이락'…오너家와 165억 부동산거래,"◇오너家 소유 부동산…초이락이 사옥으로 매입 &lt;뉴스1&gt;이 24일 서울 구로구 온수동 11-1번지에 위치한... 기업들은 상권이 발달한 오피스 밀집 지역을 선호한다""고 말했다. 실제 이 일대 빌딩은 매매가 좀처럼 이뤄지지..."
557,2017.07.16.,"산업부, ‘문 열고 냉방영업’ 점검 나선다","합동 실태점검 대상 전국 주요 18개 상권 △서울: 홍익대, 강남역, 명동역, 가로수길 주변 △부산: 서면, 남포동 주변 △인천: 부평역 주변 △강원: 춘천시 명동 주변 △대전: 갤러리아백화점 주변 △대구: 중앙로역..."
558,2017.07.22.,지하철 역세권마다 잘 되는 업종 '각양각색',"[뉴스데스크] ◀ 앵커 ▶ 지난해 이용객들이 가장 많았던 서울 지하철역 상위 5곳은 고속터미널역과... 집에서 반찬 하기 귀찮고 이럴 때..."" 유동인구가 가장 많은 지하철 역 주변 상권 5곳을 분석했더니, 편의점..."
559,2017.07.25.,"'충격' 강훈 대표... ""망고식스 가맹사업 한계에 봉착"" 논란 급부상","최근 망고식스를 운영하는 강훈 대표의 KH컴퍼니는 서울회생법원에 회생절차 개시 신청서를 제출한... 상권의 포화로 가맹점 개설이 늘지 않아 개설 수익이 급격히 줄거든 것이 가장 큰 원인""이라고 분석했다, 이에..."
560,2017.07.18.,"정용진 고심작 '스타필드 고양', 8월24일 오픈…""일자리 3000개 창출""","스타필드 고양은 고양시와 서울 서북부(은평·서대문) 등 반경 3km 이내 핵심 상권에 180만명이 거주하고, 서울 강서와 마포, 영등포와 경기도 파주, 김포, 양주 등 30분 내 접근 가능한 지역을 포함해 총 500만명 이상이..."
561,2017.07.25.,"'충격' 강훈 대표... ""망고식스 가맹사업 한계에 봉착"" 논란 급부상","최근 망고식스를 운영하는 강훈 대표의 KH컴퍼니는 서울회생법원에 회생절차 개시 신청서를 제출한... 상권의 포화로 가맹점 개설이 늘지 않아 개설 수익이 급격히 줄거든 것이 가장 큰 원인""이라고 분석했다, 이에..."
562,2017.07.26.,[르포] 재래시장 살리는 진짜 해결책은 ‘마트 규제’ 아닌 ‘경쟁력 제고’,골목상권을 살리는 근본적 해결책은 정부 개입의 규제가 아닌 골목상권만의 경쟁력 지원이라는 목소리가... 서울 동대문구의 한 재래시장 상인은 “서울시가 그간 재래시장 지원정책을 펼쳤지만 상인들 피부에 와 닿지...
563,2017.07.27.,일산타운하우스 성석동 삼성캐슬 더 테라스…성석동에서 분양 초읽기,파주에서 서울까지 통행 시간이 상당시간 단축된다는 이점이 있다. 또한 고속도로 개통 시 교통량 증가에 따른 상권형성 및 추가적인 집값 상승도 충분히 노려볼 수 있다고 분양관계자는 덧붙였다. 본격적인 분양...
564,2017.07.21.,이낙연 “대기업 과잉주도 폐해… 중견기업 생태계 육성”,"이 총리는 서울 롯데호텔에서 열린 중견기업인의 날 기념식에 참석해 “작은 기업들은 자금, 인력, 기술... 골목상권 침범이 생각난다”고 말한 바 있다. 대기업은 글로벌 시장에 나가 경쟁하라는 취지였다. 이 총리는..."
565,2017.07.18.,"스타필드 고양, 스타필드 하남과 차이점은?","스타필드 고양은 고양시와 서울 서북부 등 반경 3㎞ 이내 핵심 상권에 180만명이 거주하고 있으며, 30분 내 접근 가능한 지역을 포함하면 총 500만명 이상이 거주하는 초대형 상권 내에 있다. 수도권 서북부에는 앞서 롯데..."
566,2017.07.18.,"공정위, 프랜차이즈 ‘통행세’ 뿌리 뽑는다",김상조 공정거래위원회 위원장(왼쪽)과 박용만 대한상의 회장이 17일 오전 서울 중구 대한상공회의소... 이번 대책은 김상조 공정거래위원장이 지난달 취임한 후 처음으로 발표하는 골목상권 보호 정책이다. 이날 김...
567,2017.07.19.,감정원 젠트리피케리션 맞춤해법 만든다…성동구와 협약 체결,감정원은 서울 성동구청에서 성동구와 젠트리피케이션(gentrification) 방지를 통한 지역상권 보호와 도시재생 활성화를 위한 업무협약을 체결했다고 19일 밝혔다. 젠트리피케이션이란 낙후됐던 구도심이 번성해 중산층...
568,2017.07.25.,오피스·업무시설 조기완판 ‘삼성어반타워’ 상가 특별분양,- 지식산업센터 독점 고객 동탄테크노밸리 배후 수요 풍부 [서울경제] 동탄테크노밸리 내 지식산업센터... 이는 기존에 공급된 지식산업센터 상가들이 업무시설 중심의 주중상권을 이루는데 반해 ‘삼성어반타워’...
569,2017.07.19.,[文정부 5개년 국정] 中企 청년 3명 뽑으면 1명은 정부가 월급 준다,"국정기획위, 중소기업인과 만남(서울=연합뉴스) 문재인 정부 인수위원회 역할을 하는... 생계형 적합업종 특별법을 제정, 민생에 영향이 큰 업종을 적합업종으로 지정하고 복합쇼핑몰의 골목상권 입지 등을 대형마트..."
570,2017.07.19.,[文정부 5개년 국정] 中企 청년 3명 뽑으면 1명은 정부가 월급 준다,"국정기획위, 중소기업인과 만남(서울=연합뉴스) 문재인 정부 인수위원회 역할을 하는... 생계형 적합업종 특별법을 제정, 민생에 영향이 큰 업종을 적합업종으로 지정하고 복합쇼핑몰의 골목상권 입지 등을 대형마트..."
571,2017.07.28.,"총 1,967세대 '화성 반정동 리버인 서해그랑블' 조합원 모집… 모델하우스 운...",따른 상권 활성화와 인프라 확충이 이뤄져 매매가 상승에도 큰 영향을 주는 대기업 호재를 뜻한다. 그... 통해 서울 강남까지 20분대면 진입할 수 있다. 그리고 경부고속도로 수원 나들목이 단지 가까이에 있어...
572,2017.07.26.,"[GTX시대] ④교통혁명, 부동산 넘어 생활문화도바꾼다",서울 강남역 인근의 상점에 임대를 알리는 현수막 모습 &lt;사진=이형석 사진기자&gt; 많은 사람들이 GTX를 이용하게 되면 생활문화도 변화한다. 먼저 상권은 도심에 집중되는 현상이 나타날 수 있다. 수도권 외곽에서...
573,2017.07.24.,"강북구 ‘SK북한산시티’, 우이신설선 초역세권 단지로 주목",서울 첫 경전철인 우이신설선이 9월부터 운행을 시작한다. 이번 개통으로 철도 사각지대였던 정릉... 지하철이나 도로가 새롭게 개통되면 주거수요가 몰리고 주변 상권이 활성화돼 부동산 시장에서 인기요소로...
574,2017.07.24.,"""동대문 육성 위해 판로 개척과 전압법 개정 이뤄져야""","서울 주요 상권에서도 선보일 예정이다. 박 회장은 ""상가 앞 철조망 담벼락을 미디어 아트로 바꾸면서 상가 주변 환경을 개선하는 조닝 디자인에 상인들이 큰 기대를 하고 있다""며 ""특히 육성사업단은 중국 의존도를..."
575,2017.07.18.,'스타필드 고양' 서북부 최대 쇼핑 테마파크...내달 24일 개장,"스타필드 고양은 경기도 고양시와 서울 서북부 등 반경 3㎞ 이내 핵심 상권에 180만명이 거주하고 있으며, 30분 내 접근 가능한 지역을 포함하면 총 500만명 이상이 거주하는 초대형 상권 내에 있어 서북부 최대..."
576,2017.07.27.,[국가안보 희생 67년_동두천의 눈물과 분노] 2. 황량한 사막도시,이 거리에서 20년 넘게 식당을 운영하고 있다는 김을수 보산 관광특구 상가연합회 부회장은 “지금의 서울... 보산 관광특구 상권 붕괴에 직격탄이 된 것이다. 400곳 정도 되던 미군 관련 점포 가운데 70% 정도가 휴·폐업을...
577,2017.07.27.,부동산 과열 자화상…한 집 건너 ‘중개업소’,[인터뷰] 김은경 삼성증권 연구위원 “해외와 비교하더라도 국내 중개수수료율 자체가 높지 않은 편이고 거래가 빈번한 시장이라면 모르지만 거래가 급격하게 줄었을 때는 문제가 있을 수 있고요.” 실제 서울시 상권분...
578,2017.07.27.,"광교 SK VIEW 레이크몰, 희소성 높은 상업시설로 독점 상권 형성",이런 가운데 인근 오피스 내 상업시설 비율보다 약 10.7% 낮아 상권 활성화에 최적화된 광교 SK VIEW 레이크몰에 투자자들의 시선이 모이고 있다. 또한 국토교통부 자료에 따르면 서울 평균 오피스 내 상업시설 비율은...
579,2017.07.19.,"마포구, 노상주차장 200면 조성···연간 1.2억원 세수 기대","= 서울 마포구(구청장 박홍섭)는 주차장 확충을 위해 주택지역 이면도로 등에 총 200면의 노상... 아울러 불법 주·정차 근절과 교통 체증 완화는 물론 지역 상권 활성화, 쾌적한 주차환경 제공 등 '1석4조'의 효과가..."
580,2017.07.19.,"한국감정원, ‘젠트리피케이션 방지’에 앞장",한국감정원은 19일 서울 성동구청에서 성동구와 젠트리피케이션 방지를 통한 지역상권 보호와 도시재생 활성화를 위한 업무협약을 체결했다. 이번 협약으로 한국감정원은 그동안 축적한 부동산 조사·통계 전문역량을...
581,2017.07.18.,스타필드 고양 내달 24일 오픈..수도권 서북부 최대 쇼핑 테마파크,"스타필드 고양은 고양시와 서울 서북부 등 반경 3㎞ 이내 핵심 상권에 180만명이 거주하고 있으며, 30분 내 접근 가능한 지역을 포함하면 총 500만명 이상이 거주하는 초대형 상권 내에 있다. 수도권 서북부에는 앞서 롯데..."
582,2017.07.28.,상가투자 필승법칙 ‘고정수요’…안정적 수익을 고려한 상가 인기↑,"[서울신문] 광교호수공원 앞자리에 대규모 업무단지, 주거단지 등을 배후수요로 갖춘 광교 SK VIEW... 특히 5천여 명 이상의 상주인구를 확보하거나 오피스와 결합돼 주야간 상권을 형성한 상업시설들은 매번 관심이..."
583,2017.07.25.,권선택 대전시장 “과학도시서 4차산업혁명 특별시로… 정부 뒷받침 절실”,서울을 비롯해 부산 대구 인천 등 전국 도시 10여 곳이 트램 도입을 추진하고 있다. ‘응원군’이 늘면서... 노선에 따라 길거리 상권이 살아나면 도시 경관과 도시 재생 등 지역 발전의 기폭제가 될 것이다. ” ―청년...
584,2017.07.25.,"""일본 롯폰기·긴자식스를 보라…도시재생, 영세상인에겐 새 기회""",대림산업이 서울 종로구 청진동 2·3지구를 정비해 2014년 10월 준공한 광화문 D타워의 상업시설을 비롯해 명동... 그는 다만 “상업시설은 유행을 빨리 타 5년이 지나면 상권이 쇠퇴하기 때문에 지금 인기있는 D타워도 앞으로...
585,2017.07.19.,"공정위, 하림그룹 직권조사 착수...공정위, 재벌개혁 속도내나",/연합뉴스 [서울경제] 공정거래위원회가 하림그룹의 일감 몰아주기 혐의에 대한 직권조사에 전격 착수했다.... 김 위원장은 취임과 동시에 골목상권 보호와 재벌개혁을 공정위의 정책 목표로 제시했지만 지난 한 달여간은...
586,2017.07.16.,"정부, 내일부터 '문 열고 냉방영업' 실태점검","산업통상자원부는 내일(17일)부터 21일까지 닷 새 간 서울 명동과 강남역, 부산 서면 등 전국 18개 상권에 총 3백여 명을 투입해 점검을 실시한다고 밝혔습니다. 정부는 문을 연 채 냉방영업을 하는 상점을 방문해..."
587,2017.07.25.,"[Startup’s Story #342] 자투리 공간으로 돈 버는 스타트업, ‘스위트스팟’","규모, 가시성, 유동 인구 흐름은 물론 해당 장소에 특정한 팝업스토어를 열었을 때, 주변 상권에 악영향을... 우리 플랫폼에 들어와 있는 부동산 건물들이 대부분 서울의 랜드마크들이다. 그 아래 단계로는 쉽게 확보할 수..."
588,2017.07.24.,[팀장칼럼] 도시재생 뉴딜이 적폐 청산 대상에서 벗어나는 법,사람들의 발길이 뜸했던 이곳이 도쿄의 핵심 상권으로 급부상한 것은 2014년 도라노몬 힐스가... 다만 공약집에 나온 도시재생 뉴딜사업을 보면 한국의 도시재생은 서울 창신·숭인동처럼 정부가 공적 자원을 투입해 도로...
589,2017.07.25.,"4차 산업혁명의 풍경…편의점 ‘AI 스피커’ 점원, VR몰서 자갈치시장 쇼핑","서울 종로구에 있는 한 CU 편의점 매장에서 직원이 SK텔레콤의 인공지능 스피커 ‘누구’의 도움을 받아... 여기에 동대문시장, 자갈치시장 등 전통시장과 홍대, 인사동 등 유명 거리 상권도 VR 환경 속에서 구경할 수..."
590,2017.07.18.,서북부 최대 쇼핑테마파크 문 연다,"이 지역은 서울 강서, 마포, 영등포와 경기도 파주, 김포, 양주 등 30분내 접근 가능한 지역을 포함해 총 500만명이 거주하는 대형상권이다. 또 외곽순환도로와 제2자유로 등주요 간선도로가 관통하고 있고, 지하철..."
591,2017.07.17.,'문 열고 냉방영업' 점검 첫날…대체로 지키지만 반발도 여전(종합),""" 산업통상자원부가 17일 오후 올 여름 처음으로 서울을 비롯한 전국 주요 상권에서 문 열고 냉방하는 개문냉방 집중 점검에 나섰다. 21일까지 전국 18개 상권에서 지자체와 합동으로 실시되는 이번 점검이 미리..."
592,2017.07.16.,"폭염에 전력수요 급증…정부, '문 열고 냉방' 실태점검",/뉴스1DB 17~21일 서울 부산 등 전국 주요상권서 진행 산업통상자원부는 최근 폭염이 이어지면서 전력 사용량이 급증함에 따라 17일부터 21일까지 전국 주요 상권을 대상으로 '문 열고 냉방영업' 점검에 나선다고 16일...
593,2017.07.28.,[인사] 보건복지부 외,소상공인정책관 ▲김형영 서울지방중소벤처기업청장 ▲조종래 부산지방중소벤처기업청장 ▲김진형... 시장상권과장 □대구지방국세청 ◇부이사관 전보 ▲조사1국장 김대원 ◇과장급 전보 ▲북대구세무서장 고현호...
594,2017.07.26.,"신세계-반포, 현대-삼성동, '콘트롤타워' 이동",신세계백화점(대표 장재영)이 서울 중구 명동에서 강남 반포 센트럴시티로 본사를 이전한다. 이곳은 지난해... 신세계 강남점이 신세계백화점을 대표하는 매장으로 자리매김한 것이 가장 큰 의미로 보이며 강남상권이...
595,2017.07.27.,‘의정부 청과 야채 도매시장’ 살리기… 상인들 스스로 변화 택했다,상인들은 중소기업청 지역 선도 시장으로 선정된 것을 계기로 의정부시 상권활성화재단과 함께 협동조합을... 초기 경기ㆍ서울 북부 인근에 청과 야채 도매시장이 없었던 탓에 경기북부 대표 시장으로 빠르게 자리...
596,2017.07.26.,"아모레퍼시픽 , 올 상반기 매출 6.1% 감소 영업이익은 30.2% 급감","관광 상권 매장 위축으로 매출 및 영업이익 성장율이 감소했다.  국내 사업 매출은 전년동기... 한편, 제주 이니스프리 숲 '마이 시크릿 포레스트(My Secret Forest)' 개장, 재활용 소재를 활용한 서울..."
597,2017.07.25.,‘상가 시장’에 부는 키즈 바람… 어린이 관련 소비 커지며 투자처 각광,그렇다고 상권형성이 덜된 신도시 신규 상가를 무턱대고 투자하기엔 상권형성 기간 동안의 공실 리스크를... 서울 송파구 위례신도시에는 ‘아이온스퀘어’ 상가가 분양중이다. 상가 4층에 151㎡ 규모의 뽀로로파크가...
598,2017.07.19.,‘스타필드 고양’ 쇼핑大戰 불댕긴다,신세계그룹은 서울 강서·마포·은평·서대문구와 경기 고양·파주·김포시에 이르는 서울·수도권 서북부 상권의 잠재적 가능성을 높게 평가하고 있다. 스타필드 고양에서 차로 30분 내 접근이 가능한 지역의 거주...
599,2017.07.25.,가재울뉴타운 'DMC 에코자이' 견본주택엔 무슨 일이?,가재울 뉴타운은 도시정비 사업이 완성 단계에 접어들며 서울 서북권 미니신도시로 탈바꿈하고 있다. 인근 상암 DMC 업무지구가 국내 최대 미디어밸리로 완성되고 일대 상권이 크게 활성화되면서 인근 배후지인...
600,2017.07.25.,가재울뉴타운 'DMC 에코자이' 견본주택엔 무슨 일이?,가재울 뉴타운은 도시정비 사업이 완성 단계에 접어들며 서울 서북권 미니신도시로 탈바꿈하고 있다. 인근 상암 DMC 업무지구가 국내 최대 미디어밸리로 완성되고 일대 상권이 크게 활성화되면서 인근 배후지인...
601,2017.07.28.,[화제의 분양현장]구파발역 대로변 상가… 배후수요 탄탄,서울 서북부 마지막 핵심 상권으로 평가받는 구파발역 상권에 위치해 있는데다 롯데몰 은평·가톨릭대학병원·소방행정타운 등 탄탄한 배후수요를 갖추고 있다. 신한 헤센 스마트 상업시설은 지하 2층∼지상 2층...
602,2017.07.18.,신세계 복합쇼핑몰 ‘스타필드 고양’ 8월 24일 개장,"스타필드 고양은 고양시와 서울 서북부 등 반경 3㎞ 이내 핵심 상권에 180만명이 거주하고 있으며, 30분 내 접근 가능한 지역을 포함하면 총 500만명 이상이 거주하는 초대형 상권 내에 있다. 수도권 서북부에는 앞서..."
603,2017.07.27.,"롯데마트, 강남권 진출 '서초점' 오픈…이랜드와 '프리미엄 마켓' 경쟁↑","27일 유통업계에 따르면 롯데마트가 국내 대형마트 최초로 '그로서란트 마켓'을 서울 서초역 일대에 오픈... 지역 상권을 감안, 고품질 신선상품 등 차별화된 상품 구색을 내세우는 프리미엄 점포다. 그로서란트..."
604,2017.07.20.,'가동 중단' 군산조선소 되살린다..정부가 선박 발주,조선소를 재가동해 연관업체와 골목상권 등 지역경제를 되살리겠다는 것이다. 정부는 20일 정부서울청사에서 제5회 국정현안점검조정회의를 열어 '군산조선소 가동 중단에 따른 지역지원 대책'을 확정했다. 주무부처는...
605,2017.07.18.,‘스타필드 고양 내달 24일 오픈’ ··· 수도권 서북상권 판도 바뀌나,이 지역은 경기 고양과 은평·서대문구 등 서울 서북부 등 반경 3km 내 180만 명이 거주하는 초대형 상권으로 주목받고 있다. 서울 강서·마포·영등포구와 경기 파주·김포·양주 등 30분 거리 인구까지 포함하면 잠재...
606,2017.07.27.,"""불황 맞나"" 줄서는 고객들…백화점 '식품관 전쟁'",서울 잠실과 경기 분당·용인 등 수도권 남부상권 주요 백화점 점포에 웬만한 국내·외 유명 맛집이 모두 들어서 있을 정도다. ◇'을밀대'도 품었다…맛집 전쟁 치열한 백화점=26일 관련 업계에 따르면 신세계백화점은 올해...
607,2017.07.24.,[푸드테크]① '배달 혁신' 메쉬코리아...100여명 엔지니어들이 개발한 '부릉',[편집자주] 서울시 강북구 수유동에서 닭발집을 운영하는 성문경씨는 지난 2015년부터 배달 대행 서비스... 성씨를 비롯해 인근 상권의 많은 소상공인이 자체 배달직원 외에 ‘부릉’ 같은 배달 대행서비스를 이용한다....
608,2017.07.27.,[인사] 중소벤처기업부 인사(국장급·과장급),권대수 ▲서울지방중소벤처기업청장 김형영 ▲부산지방중소벤처기업청장 조종래... 박종학 ▲시장상권과장 조재연 ▲인천지방중소벤처기업청장 박선국 ▲대전충남지방중소벤처기업청장 이인섭...
609,2017.07.13.,"정용진, 편의점에 승부수…""대형마트 이을 주력사업으로 육성""",편의점 브랜드 'emart24' 13일 오전 서울 강남구 코엑스에서 신세계 그룹 편의점 '위드미'의 브랜드명 'emart24... 경쟁 격화로 포화 상태에 이른 데다 골목상권과의 갈등과 각종 규제로 신규 출점도 쉽지 않다. 여기에...
610,2017.07.18.,스타필드 고양 내달 24일 개장···“하남과 다른 점은”,주변 상권 특성을 반영해 가족 단위 고객을 위한 차별화한 쇼핑몰로 준비했다”며 “쇼핑과 여가를 아우르는 수도권 서북부 대표 랜드마크가 될 것으로 기대한다”라고 말했다. /윤경환기자 ykh22@sedaily.com [서울경제...
611,2017.07.24.,"달콤커피, 2017 프랜차이즈 창업박람회 참가",[컨슈머타임스 이화연 기자] 다날의 카페브랜드 달콤커피는 27~29일 서울 삼성동 코엑스에서 개최되는... 달콤커피 강영석 본부장은 “지역상권에 맞는 맞춤 개설 상담과 안정적인 카페 창업정보와 다양한 혜택을...
612,2017.07.24.,"망원동 주민들 ""젠트리피케이션 가속화···포털에 '망리단길' 이름 없애달라...",이는 상권 활성화에 도움이 된다”고 주장했다. /김민제 인턴기자 summerbreeze@sedaily.com [서울경제 바로가기]1997년 이래 대한민국 최고의 과학자 DB [바로가기]서울경제의 모든 연재물!... 서경Cube [바로가기▶] 저작권자...
613,2017.07.18.,"정용진 부회장의 야심작, '스타필드 고양' 내달 24일 문 연다",[데일리한국 동효정 기자] 정용진 신세계그룹 부회장의 야심작이자 경기 고양·파주·김포와 서울 강서·마포·은평·서대문구 등 서울 수도권 서북부 상권을 아우르는 복합 테마형 쇼핑몰 ‘스타필드 고양’이 8월 24일...
614,2017.07.27.,"애주가 정용진, 문 대통령과 ‘호프미팅’서 꺼낼 화두는",앞서 정부는 골목상권 보호를 위해 내년부터 복합쇼핑몰에 대해 대형마트 수준의 월 2회 휴무와 영업시간... 서울 외곽 등에 위치해있는 특성상 평일보다는 주말 방문객이 몰리는 복합쇼핑몰의 특성상 신세계그룹의...
615,2017.07.17.,[포토]개문냉방 실태점검,"산업통상자원부는 오는 21일까지 서울 명동, 홍대 등 전국 18개 상권에서 '개문냉방' 현황을 살펴보고, 미준수 상점에 계도 및 절전 실천요령 등을 안내하는 등 자발적 참여를 유도하겠다고 밝혔다. &lt;ⓒ세계를 보는 창..."
616,2017.07.25.,개발 막바지 접어든 아현뉴타운…남은 단지는 어디?,[미디어펜=김관훈 기자] 서울 강북권 신흥 주거지역으로 탈바꿈하고 있는 '아현 뉴타운' 개발사업이... 홍대·합정·연남동 상권 등도 인접해 있어 관심이 더욱 부각되는 곳이다. 이 같은 입지적 강점으로 집값...
617,2017.07.28.,인천일보 2017년 7월 28일(금),부평 좁은골목 '젊은 피'로 살아나네…'평리단길' 커튼골목 새로운 상권 기대https://goo.gl/khXLgR 10. 인천지방검찰청 신임 검사장에 공상훈 서울서부지검장 임명https://goo.gl/V61PHh ●제2회 애인...
