,date,title,contents
814,2017.10.20.,"오피스텔 흔들리는 수익형부동산 시장, 풍선효과 누리는 지식산업센터&상가",[스포츠서울 김수지기자] 부동산 시장 내 투기세력을 겨냥해 강도 높은 규제들을 선보인 8.2 부동산 대책에... 지식산업센터는 현대프리미엄아울렛(예정)이 바로 앞 상권에 위치해 편리한 인프라를 자랑한다. 도보 10분...
815,2017.10.16.,"""장관 부재로 개점휴업""…중기부 '힘빠진 국감'(종합)","최수규 중소벤처기업부 차관이 16일 오후 서울 여의도 국회에서 열린 산업통상자원중소벤처기업위원회... 이와 함께 골목상권 보호대책, 중소기업 연구개발 제도의 미흡 등에 대한 질의가 이어졌지만 최저임금 보다..."
816,2017.10.21.,초역세권 오피스 상가 '마곡역 메트로비즈' 분양,"마곡 상가분양 중인 '마곡역 메트로비즈'는 안정적인 수요를 바탕으로 상권이 활성화될 것으로 기대돼... '마곡역 메트로비즈'는 서울시 강서구 마곡지구 C13-2BL, C13-10BL에 위치하며 지하 4층~지상 10층으로 조성된다...."
817,2017.10.16.,중기부 이케아 영업규제 검토…與野 장관공백 장기화 질타,오전 서울 여의도 국회에서 열린 산업통상자원중소벤처기업위원회 중소벤처기업부에 대한 국정감사에서 의원들의 질의에 답하고 있다. /사진=이동훈 기자 정부가 골목상권 보호를 위해 복합쇼핑몰을 비롯해 글로벌...
818,2017.10.10.,"경북 화장품, 동남아 유혹",베트남에 해외 첫 상설판매장 시장 판로 개척 교두보 마련 [서울경제] 경북 화장품이 베트남에 해외 첫... 하루 평균 유동인구가 18만명에 이르는 호찌민 도심 핵심 상권에 자리를 잡았다. 이곳에서는 앞으로 경북...
819,2017.10.13.,"[종합]LH, PF사업 7년간 누적손실만 1조4000억원 달해","실제 LH가 공모한 9개 PF사업 중 화성동탄 메타폴리스, 서울남부교정 비채누리, 남양주별내 메가볼시티... 하지만 부동산 경기 침체 및 인근 분당 및 죽전 상권에 밀려 분양실적이 저조함에 따라 쥬네브의 경영이..."
820,2017.10.16.,"[2017 국감]여야 ""소상공인·중소기업 보호육성"" 한목소리(종합)","오전 서울 여의도 국회에서 열린 산업통상자원중소벤처기업위원회 중소벤처기업부에 대한 국정감사에서... ◇중기부, 이케아 등 가구전문점도 영업규제 검토=이날 국감에서 중기부는 골목상권 보호를 위해 복합쇼핑몰을..."
821,2017.10.13.,"[종합]LH, PF사업 7년간 누적손실만 1조4000억원 달해","실제 LH가 공모한 9개 PF사업 중 화성동탄 메타폴리스, 서울남부교정 비채누리, 남양주별내 메가볼시티... 하지만 부동산 경기 침체 및 인근 분당 및 죽전 상권에 밀려 분양실적이 저조함에 따라 쥬네브의 경영이..."
822,2017.10.16.,새로 문 연 스타필드 고양에 가봤더니···,"이런 계산에는 반경 3km 이내에 인구 밀집 지역인 고양시와 서울 서북부 지역이 위치해 있고, 서울 강서·마포를 비롯해 김포시 등 30분 내 거리에 인구 500만 명 이상이 거주하는 등 초대형 상권이라는 기대감이 반영돼..."
823,2017.10.23.,아파텔에 테라스를 갖춘 다인건설 '울산 다인로얄팰리스 일산지',(서울=국제뉴스)  김영명 기자 = 다인건설은 울산에 공급한 '다인 로얄팰리스 테라스 일산지'가 실거주자... 인근 상권의 변화가 예상된다. 이러한 앵커 테넌트는 시설의 임대료와 분양가에도 영향을 주고 안정적인...
824,2017.10.18.,4분기 분양시장 수도권 서남부 알짜단지 잡아볼까,또 항동지구 내 개교 예정인 초등학교와 중학교가 도보권에 위치해 있고 역곡역 상권 등도 인접해 생활이 편리하다 지금까지 서울과 연결되는 지하철 노선이 없었던 시흥시는 내년부터 지하철 개통이 연이어...
825,2017.10.16.,중소형 건물 거래 상승,"이는 강남, 홍대, 이태원 등 소위 서울 메인상권의 이면도로에 위치한 매물들의 거래가 가장 활발했던 것과 관련이 있는 것으로 분석된다. 명동(3.3㎡당 5억), 강남 가로수길(2억), 세로수길·연트럴파크(1억) 등..."
826,2017.10.24.,"GS건설, 광안대교 조망권과 풍부한 생활 인프라 갖춘 부산 `광안자이` 아파트...","자동차로는 10분 거리에 위치한 번영로 대연램프를 이용해 서울 방향 경부고속도로를 이용할 수 있다.... 이로 인해 주변 상권의 변화를 기대할 수 있으며, 향후 수영구를 대표하는 주거타운으로 자리잡을 전망이다...."
827,2017.10.12.,"‘구호의 집’은 어떤 모습? 삼성물산 구호, 첫 번째 플래그십스토어 오픈",구호가 서울 한남동에 첫 번째 플래그십스토어를 개장했다. /사진=삼성물산 패션부문 삼성물산... “앞으로 상권 활성화가 기대되는 한남동에서 구호가 새로운 랜드마크로 자리잡길 기대한다”고 말했다. 한편...
828,2017.10.11.,"""웃픈 캐릭터 전문""…'7호실' 신하균이 돌아왔다","다 죽은 상권인지도 모르고, 게다가 10년전 트렌드인 DVD방을 개업한 두식은 파리만 날리는 가게에서 희망... 한편, '7호실'은 서울의 망해가는 DVD방 7호실에 각자의 비밀을 감추게 된 DVD방 사장과 알바생이 점점 꼬여가는..."
829,2017.10.18.,8.2대책 후속조치 꾸준... 아파트 열기 수익형 부동산으로,"앞 상권에 위치했으며 도보 10분 거리 내에 1만여 배후세대를 품고 있다. 에이엠플러스자산개발(시행)은 이달 중 서울특별시 성동구 성수동1가 일원에 ‘서울숲 AK밸리’를 분양할 예정이다. 지하 5층~지상 15층, 연..."
830,2017.10.18.,8.2대책 후속조치 꾸준... 아파트 열기 수익형 부동산으로,"앞 상권에 위치했으며 도보 10분 거리 내에 1만여 배후세대를 품고 있다. 에이엠플러스자산개발(시행)은 이달 중 서울특별시 성동구 성수동1가 일원에 ‘서울숲 AK밸리’를 분양할 예정이다. 지하 5층~지상 15층, 연..."
831,2017.10.25.,정부 잇단 주택규제에 '브랜드 상가' 관심..이달 분양하는 상가는,"시행사 네오밸류는 상권 활성화를 위해 마스터리스, 통합운영관리 등을 적용하기로 했다. 집객력이 높은 CGV... 이달 중 서울시 영등포구 영등포동에서는 ‘영등포뉴타운 꿈에그린 스퀘어’이 투자자들을 맞는다...."
832,2017.10.03.,자영업자 20% 연 1천만원도 못벌어…생존율도 갈수록 하락,이와 관련해 정부는 업종과 상권 특성 등을 반영한 자영업자 대책을 추석 연휴 이후 가계부채 대책에 포함해 발표할 예정이다. 식당 폐업증가에 중고주방용품 재고 산더미(서울=연합뉴스) 김현태 기자 = 국세청이...
833,2017.10.24.,"동대문구, 전통시장-대형마트 상생의 길 찾는다","[시민일보=이대우 기자]  서울 동대문구(구청장 유덕열)가 25일 오후 2시 구청 기획상황실에서... 지역 상권 활성화에 기여할 수 있도록 노력한다. 또 이마트는 상생스토어 내 노브랜드 매장, 어린이 놀이터..."
834,2017.10.12.,"구호, 한남동에 첫 번째 플래그십 스토어 오픈","&lt;아이뉴스24&gt; [아이뉴스24 윤지혜기자] 삼성물산 패션부문의 여성복 브랜드 구호(KUHO)는 서울 한남동에 첫... 계획""이라며 ""가로수길 상권이 세로수길로 확대된 것 같이 상권 확장성이 기대되는 한남동에서 구호가 새로운..."
835,2017.10.11.,중소·중견면세점 ‘대량 판매’ 한시적 허용… 영업장소 이전 가능,본문 이미지 영역 서울 시내 한 중소면세점 매장 전경. 고객이 없어 한산하다. /사진=박효선 앞으로 중소... 이번 조치로 중소·중견 면세점이 관광객 방문지역·상권 변화 등 시장환경에 보다 탄력적으로 대응할 수 있을...
836,2017.10.25.,"지역주택조합 불안감은 옛말, 안정성 대폭 높인 ‘오산 세교 건영아모리움 센...","등으로 서울을 비롯한 수도권으로의 이동이 편리하다. 여기에 세교신도시와 동탄신도시를 연결하는... 향후 이 개발호재들을 중심으로 인근에 다양한 상권이 형성될 것으로 기대하고 있으며, 테마파크의 경우 국내 최대..."
837,2017.10.19.,"[르포] 롯데하이마트 '카메라 전문관', 하이엔드 유저 위한 '메카'","롯데하이마트는 김포공항점을 시작으로 상권 특성에 맞는 다양한 프리미엄 전문관을 확대할 계획이다.... 한국마이크로소프트, 산업통상자원부, 서울시청, 보건복지부 등과 업무협약을 체결한 롯데하이마트는 다양한..."
838,2017.10.21.,"작은 도시의 행복 생존 비결 ""집중·압축하라""…『지방도시 살생부』","인구가 줄어든다고 예상한 지자체는 서울시가 유일하다. 이렇게 뻥튀기한 인구를 모두 합치면 1천300만 명... 저자는 매년 도시재생사업에 들어간 1천500억원 외에 일자리사업, 환경개선사업, 상권활성화사업 등의..."
839,2017.10.10.,울산시 “울산대공원 장미축제 지역경제에 도움됐다”,"또 외부 방문객의 지역 내 상권이용 비율은 43.9%, 방문객 연령대는 40대 30.4%, 30대 30.1%, 50대 19.9% 순으로... 외부 방문객의 유입 비율은 33.4%였으며 부산 12.6%, 경남 5.6%, 경북·대구 5.9%, 서울·경기 1.8% 기타 7.5% 순으로..."
840,2017.10.22.,전라도 역사이야기-15. 남도의 보물 강진 병영성,덕수궁 돌담길은 저리 가라할 정도입니다(특히 서울사람들에게는 비교개념을 제시해주는 것이 중요하다)... 개성상인들과 함께 조선 상권을 좌우하던 병영상인들이 태동된 곳이기도 하다. 하멜일행으로 대변되는...
841,2017.10.18.,정부 규제 걸린 오피스텔… 빠르게 변하는 수익형부동산 ‘트렌드’,에이엠플러스자산개발(시행)은 이달 서울특별시 성동구 성수동1가 13-270번지 외 3필지 일원에 지식산업센터... 현대프리미엄아울렛(예정)이 바로 앞 상권에 위치했고 도보 10분 거리에 1만여 배후세대를 품고 있는 것이...
842,2017.10.18.,50년 만에 새 단장 ‘세운상가’ 가보니,"지난 10월 11일 서울 종로구 종묘 맞은편의 세운상가가 완전히 탈바꿈한 모습으로 눈에 들어왔다. 1970년대에... 1980년대에 강남 개발로 상권이 한강 이남으로 옮겨가기 시작하고 1987년 용산 전자상가, 1998년 강변..."
843,2017.10.17.,"수의사 의료상담 앱 '펫닥', 반려동물 '생로병사' 책임진다","수의사 의료상담 애플리케이션 펫닥.© News1 동물병원 상권분석·마케팅 가능한 '펫닥파트너' 앱도 별도 출시... 한편 펫닥은 현재 앱 다운로드수 6만4000건을 기록중이며 서울특별시수의사회, 한국동물병원협회와 업계..."
844,2017.10.23.,"부평 룩소르 주상복합 ""1룸~3룸, 다양한 평면구성""","부지의 위치 주변 반경 내에 교통, 학군, 상권, 공원 등 다양한 인프라를 도보로 이용이 가능하다. 도보 5분 내 인천지하철 1호선, 서울지하철 1호선을 이용 가능하며 도보 3분 내 거리에 인천 부평서초등학교..."
845,2017.10.19.,"이재명 시장 만난 두산건설 대표 ""두산그룹 성남 이전 확고""","외에 서울에 있는 두산중공업과 두산인프라코어도 이전할 것을 약속했다. 이에 따라 성남으로 이전하는... 주변 상권활성화 뿐만 아니라 지역경제에 선순환이 이루어질 것으로 기대하며, 시민들이 각종 의혹이..."
846,2017.10.13.,"판교에가면-판교상인연합회, ‘지역문화·상권 활성화’를 위한 MOU체결","【서울=뉴시스】 지역포털 기업 판교에가면(대표 박진석, 왼쪽)은 판교테크노밸리 상인연합회(회장 명기석)와 지역 문화·상권 활성화를 위한 업무협약(MOU)을 13일 오전 경기 성남 판교에가면 회의실에서 체결했다...."
847,2017.10.19.,"[착한규제]④""담배·쓰레기봉투만 안 팔면 SSM 입점 반대 안해""","- 수퍼마켓연합회도 ‘무조건 반대 no’ - “대형유통업체, 골목상권에 집객효과” - ‘상생스토어’ 입점... 서울 마포구 창천동에서 작은 식료품 가게를 운영하는 이 모(60·여)씨는 “동네슈퍼는 주로 담배를 사러..."
848,2017.10.20.,장기적 수익 확보가 가능한 배후수요 풍부한 주7일 상권 ‘인천 구월 지웰시티...,"7일 상권’이 투자자들의 눈길을 사로잡고 있다. ‘주 7일 상권’이란 대규모 업무 및 주거 시설을 배후에... 자리했으며, 서울외곽순환고속도로 장수IC, 영동고속도로 및 제2경인고속도로 서창JC, 제2경인고속도로..."
849,2017.10.19.,[자치단체장 25시] 20개동 6개 권역 나눠 균형발전…‘100년 명품도시 강서’,[서울신문] 균형발전은 문재인 정부의 주요 국정과제다. 전 지역을 고르게 잘살도록 하는 게 핵심이다.... 강서구청 주변 상권도 지금보다 더 활성화시키기 위해 용도지역 변경 용역을 의뢰했다. ▶공항 주변은 어떻게...
850,2017.10.12.,"이케아, 잇단 논란에도 온·오프 ‘전방위 생태계’ 구축 박차…“고객 속으로...","이를 위해 이케아는 부산시·서울 강동구와 매장 건립 양해각서(MOU)를 맺은 데 이어, 용인시 기흥구와 충남... 다만, 사그라들지 않는 ▷의무휴업 배제 ▷지역상권 초토화 논란은 이케아의 사업 확장에 걸림돌이다. 이에..."
851,2017.10.17.,양꼬치·꽃게찜… 불금엔 대명여울빛거리,12월까지 ‘별빛야시장’ 운영 매주 금요일 저녁 서울 금천구에는 다양한 먹거리와 문화 공연 등 즐길거리가 어우러진 야시장이 열린다. 금천구는 전통시장 고객 확보와 지역 상권 활성화를 위해 대명여울빛거리시장...
852,2017.10.21.,[S스토리] 퇴락한 도심 재생 사람들이 몰려든다,"최근 개장한 서울역 고가보행길, ‘서울로 7017’의 롤모델이 하이라인 파크다. 하이라인 파크는 2009년 개장... 경남 창원 마산 창동은 한때 경남에서 상권이 가장 번성한 곳이었다. ‘경남의 명동’으로 불리며 수많은..."
853,2017.10.20.,[기고-서동록] 더 포용적인 도시를 향해,"이러한 서울시의 노력은 새로운 변화로 이어지고 있다. 임차인이 마음 편히 안정적으로 영업할 수 있도록 임대료 인상 자제를 약속한 ‘안심상가’가 늘어나고, 임차인과 임대인은 상생 협약을 통해 건강한 상권을 위해..."
854,2017.10.10.,"롯데그룹 50년 발자취 사사(社史) 발간…신격호 총괄회장 ""과다한 차입금은 만...","/롯데 제공 “1000실, 40층 이상으로 지어라.” 1970년대 중반 서울 소공동 롯데호텔 설계 때 신격호 롯데... (완공되면) 1년 만에 교통 체증이 날 정도로 상권이 발달할 것”이라고 했다. 롯데의 잠실 프로젝트는 이렇게..."
855,2017.10.24.,<시사금융용어> 복합쇼핑몰과 내몰림 효과,"소상공인, 소비자 등이 함께하는 상권협의체의 운영과 소상공인 경영 어려움을 지원하기 위해 근·원거리 구역제도(zoning) 도입이 필요하다""고 조언했다. (정책금융부 노현우 기자) (서울=연합인포맥스) hwroh@yna.co.kr (끝)"
856,2017.10.24.,백종원의 푸드트럭│② 외식업 종사자들에게 물어본 ‘백종원의 장사학개론’,"“자신 있는 메뉴 한 가지로 승부하라.” 김혜준: 서울시 도깨비 야시장에 공모한 90대가량의 푸드트럭을... “상권 분석은 손님의 입장에서 생각하는 것부터 해라.” 안경두: 첫 레스토랑을 할 때, 아예 상권 분석을 하지..."
857,2017.10.04.,"""치킨집 넘기고 주변에 또 개업하면 손해배상""","A씨는 ""B씨가 동일한 상권에 치킨집을 열고 손님을 끌어가는 바람에 매출이 줄었다""며 모두 1억 원을 배상하라는 소송을 냈습니다. 서울중앙지법 이원 부장판사는 B씨가 '경업금지 의무'를 어겼다고 보고 A씨의 손을..."
858,2017.10.18.,지하상가를 지상에서 만나다 '지하도상가 프리마켓',"이는 서울시 지하도상가 상인들이 지상공간으로 올라와 시민들과 직접 만나는 문화축제형 프리마켓으로, 상권 활로 모색과 시민 볼거리 제공을 위한 취지로 마련됐다. 지난 6월 처음 열린 데 이어 올해 두 번째다. 이날은..."
859,2017.10.16.,노른자 땅에 '도서관' 지은 구청장,"마포구청장 서울시 25개 자치구 가운데 올해 '땅값 상승률'이 가장 높은 곳은 어딜까. 홍대 상권이 상수, 합정, 망원, 연남동으로 확장되고 경의선철도 공원화 등으로 거주 여건이 획기적으로 개선되고 있는 마포구다. 이..."
860,2017.10.18.,[씨줄날줄] 펫시장까지 진출한 대기업/최광숙 논설위원,[서울신문] 한 애견인이 키우는 강아지를 한 달에 60만원 하는 강아지 유치원에 보냈다. ‘학부모’로서... 이에 기존 반려동물 영세 업소들은 ‘골목상권 침해’를 주장하며 대기업의 펫시장 진출에 거세게 반발하고...
861,2017.10.18.,29일 종로도 ‘보행자 천국’으로,"시 관계자는 “휴일 종로가 보행전용 거리가 되면 세종대로와 청계천, 서울로7017을 잇는 보행 네트워크가 만들어져 공동화(空洞化)에 시달리는 상권도 살릴 수 있다”고 설명했다. 시는 교통전광판과 현수막 등으로..."
862,2017.10.12.,"캠코, 한국씨티은행 18개 점포 공개경쟁입찰 매각","있으며, '서울시 성동구 행당동' 부동산(행당역점)도 5호선 행당역과 1분 거리의 대형상가시설에 위치해... '경기도 성남시 분당구' 씨티은행 점포의 경우 감정가 대비 110%에 낙찰되는 등 최근 핵심 상권에 위치한 시중은행..."
863,2017.10.23.,"강릉 중심권 위치, KTX역 바로 앞 '강릉역 오피스텔' 분양","빠르게 상권을 활성화시킬 것으로 기대되며 사업지 인근으로는 강릉 커피거리, 경포 해수욕장, 올림픽... 복선철도, 서울~강릉KTX역이 개통 예정으로 원활한 이동이 이루어질 것으로 전망돼 강릉의 교통 요충지로..."
864,2017.10.15.,"[이슈클릭] ""우리 동네는 안 돼!""…'님비' 해법 없나?","아파트 단지 바로 앞에 들어설 서울시의 '역세권 청년주택' 건설 계획을 철회하라는 건데 주민 5천여 명이... "" 반면 일부 주민들은 연구소가 들어오면 편의시설이 늘고 주변 상권도 살아날 것이라고 주장합니다...."
865,2017.10.12.,"구호, '패션의 중심' 한남동 메인거리에 플래그십 스토어 오픈",구호는 서울 한남동에 첫 번째 플래그십 스토어를 오픈했다고 12일 밝혔다. 한남동 플래그십 스토어 오픈을... “가로수길 상권이 세로수길로 확대된 것 같이 상권 확장성이 기대되는 한남동에서 구호가 새로운...
866,2017.10.10.,"김범수 카카오 의장, 국감 불출석 의사···대리 출석 요청","【서울=뉴시스】 카카오 김범수 의장. 이병선 부사장 대리출석 요청 이해진 네이버 창업자 출석 여부는 내일... 산자위는 카카오의 골목상권 침해 논란과 관련해 질의하고자 이 부사장을 증인으로 출석 요청했고, 이..."
867,2017.10.23.,"""대로변 4면코너"" 위치한 상가 인기 고공행진","비롯한 서울 서남권까지의 이동도 편리해 질 것으로 기대된다. 인근에 스타필드 하남, 이마트, 홈플러스 등 생활 편의시설이 위치해 있고, 코스트코, 이케아 등 대형 상가도 들어설 예정으로 상권 공유를 통한 시너지..."
868,2017.10.18.,"[마이머니] 도움 필요한 창업자들, 은행 문 두드리세요","창업자들은 점포 입지·상권 분석, 창업 절차 및 인허가 사항, 각종 금융상품, 절세 방안 등 사업 운영 전반에 관한 폭넓은 상담을 받을 수 있다. 서울 양평동, 광화문, 서초동, 쌍문동, 사당동 5곳에서 운영 중이다...."
869,2017.10.15.,"공릉·공덕동 철길 옆 주택, 상가로 속속 변신",있는 상권이 형성된 서울 노원구 공릉동의 공트럴파크(사진 왼쪽)와 경의선 숲길 주변 단독주택 등이 상가로 변신하고 있는 마포구 공덕동 공트럴파크. 김형규 기자 폐선된 철길에 조성한 공원 주변에 새 상권이 들어서고...
870,2017.10.17.,"""중랑천 따라 자전거 타요"" 숲세권 아파트 창동주공4단지","교육시설로는 창일중, 창일초, 월촌초, 노곡중, 서울외고 등이 가까워 자녀의 안전한 도보 통학이 가능하다. 창동역을 중심으로 이마트, 은행, 병원, 약국, 카페, 식당 등 각종 상권이 잘 형성돼 편리하게 이용할 수 있다...."
871,2017.10.18.,"LH, 대구신서혁신도시 유통업무용지, 체육시설용지 등 공급","(서울=국제뉴스) 박종진 기자 = LH는 대구신서혁신도시 내 유통업무용지 1필지, 체육시설용지 1필지... 혁신도시점으로 상권 활성화가 가속화 되는 만큼, 투자자들의 높은 관심을 모을 것으로 기대한다""고 말했다."
872,2017.10.18.,"[단독]검찰, 경안흥업 사장ㆍ경우회 ‘금고지기’ 줄소환","18일 검찰 관계자와 재향경우회 관계자의 말을 종합하면 서울중앙지검 특수2부(부장 송경호)는 경우회에서... 골목상권살리기소비자연맹, 한국시민사회 등의 상임대표 등을 공동으로 역임하고 있다. 구 전 회장과 오..."
873,2017.10.13.,"[2017 국감]LH, PF사업 총체적 부실, 7년간 1.4조 누적손실","LH가 공모한 9개 PF 사업 중 화성동탄 메타폴리스, 서울남부교정 비채누리, 남양주별내 메가볼시티 사업... 그러나 부동산 경기 침체 및 인근 분당 및 죽전 상권에 밀려 분양실적이 저조함에 따라 쥬네브의 경영이..."
874,2017.10.16.,'일미옥불고기'처럼 독점적 환경을 구축하라,홍성읍 자체가 최고의 상권은 아닌데다가 ‘홍성마당’은 홍성읍에서도 변두리에 자리 잡았다. 가장 큰... 서울 유명 한정식집 출신 조리사에게 불고기 전수교육도 받았다. 이때 임 대표의 조리 경력이 빛을 발했다....
875,2017.10.18.,`온라인·편의점·전문점`으로 틈새 파고든다,"한국수퍼마켓협동조합연합회는 지난달 서울 신세계백화점 본점 앞에서 집회를 열고 ""'위드미'를 이마트24로 재편해 마트의 모든 역량을 집중하겠다는 정 부회장의 발언은 동네 유통 상권을 싹쓸이하겠다는 기업 이기주의..."
876,2017.10.12.,용산 나진상가에 청년창업 거점공간 개관,숙명여대는 크로스 캠퍼스를 토대로 창의융합디자인 연구센터 등 숙명여대의 우수 연구센터를 유치해 인근 용문전통시장의 상권 활성화와 청년창업 활성화 등을 목표로 서울시 캠퍼스타운 사업을 추진하고 있다....
877,2017.10.17.,이주 수요 몰리는 강동구 `래미안강동팰리스` 최근 동향은?,"[사진제공 : 강동스카이공인중개사사무소] 부동산114에 따르면, 10월 둘째 주 서울 아파트 매매가격은... 이마트, 2001아울렛, 천호시장 등 주변 상권이 잘 형성돼 생활이 편리하다. 광나루한강공원, 천호공원..."
878,2017.10.18.,"가족 건강 챙기는 주부들이 반했다, 자연발효 유기농식빵 전문점","[스포츠서울 신재유기자] 식생활의 서구화로 빵 소비량이 증가하는 가운데 웰빙 트렌드에 따른 건강빵이... 특히 C급 상권 10평 매장에서 월 매출 5,000만 원을 기록할 정도로 호조를 보임으로써 한나식빵은 창업..."
879,2017.10.16.,'스타필드고양' VS '이케아+롯데아울렛'···수도권 서북부 '유통 빅2' 경쟁...,"16일 업계에 따르면, 해당 상권은 고양시와 서울 서북부(은평·서대문구) 등 반경 3km이내에 180만명이 거주하고 있으며, 서울 강서, 마포, 영등포와 경기도 파주, 김포, 양주 등 30분내 접근 가능한 지역을 포함, 총..."
880,2017.10.17.,양기대 “‘광명동굴’ 대박 여세 몰아 경기지사 큰 그림 그릴 것”,"광명이 서울 구로구와 금천구 일대, 경기 의왕시와 시흥시, 부천시, 인천시 주민 등 최대 700만 명을 거느린 중심 상권이라는 점을 역설해 유치할 수 있었다. 대형쇼핑몰 입점은 KTX 활성화에도 영향을 미쳤다. KTX광명역은..."
881,2017.10.17.,[현장 행정] 즐기는 비어 시름은 비워 열정을 채워,●도심 속 피크닉… 침체된 상권 살리기 구·상인·주민 합작품 신촌은 과거 젊은이들의 아지트이자 서울의 대표 상권이었으나 2000년대부터 침체기에 놓여 있었다. 변화는 연세로를 대중교통전용지구로 조성하면서...
