,date,title,contents
408,2017.10.26.,각양각색 콘텐츠가 있는 상가… 관심은 2배로!,"대표하는 상권으로 발전하기도 한다. 마포구 서교동에 자리 잡은 메세나폴리스는 특색 있는 테마 접목과 MD... 이로써 세종시는 물론 대전, 충청, 나아가 서울 및 수도권 등에서도 찾는 랜드마크급 상가로 거듭날..."
409,2017.10.24.,"현대리바트, '윌리엄스 소노마 논현' 오픈 ""홈퍼니싱 트렌드 선도""","[ 현대리바트가 미국 유명 홈퍼니싱 브랜드 '윌리엄스 소노마' 대형 매장을 서울 강남에 선보인다.... 대표 상권인 만큼 국내 소비자에게 쇼핑 편의를 강화하고, 브랜드를 알릴 수 있는 최적의 장소라 판단해 3개 브랜드를..."
410,2017.10.27.,"신한종합건설(주), ‘안양 센트럴 헤센’ 11월 분양",특히 금정역은 광역급행고속열차(GTX) C노선이 예정되어 있어 개통 시 서울 강남•북으로 이동이 더욱... 또한 1호선 안양역 주변에 조성된 상권인 안양1번가도 가까워 다양한 상업시설을 이용할 수 있고 수리산과...
411,2017.10.27.,"‘불금’ 포기한 행원들, 주 6시간 부동산법 씨름",사진은 20일 오후 서울 중구 신한은행 부동산투자자문센터에서 있었던 이 과정의 수업 모습. 박영대 기자... 이날 역시 부동산 사법과 상권분석 강의를 듣기 위해 퇴근 후 잠시 숨을 돌릴 새도 없이 강의 장소로 모여든...
412,2017.10.27.,임대료 내리니...활기 도는 압구정 로데오,서울시 강남구와 지역상인·건물주들이 힘을 합쳐 임대료 인하와 문화공연 개최 등 상권 활성화에 힘을 쏟으면서 로데오거리 상권이 살아날 조짐을 보이고 있다. 지난 25일 압구정 로데오 메인 거리 곳곳에는...
413,2017.10.23.,"BNK부산銀, 연 6% 수준 '사모 부동산 펀드' 판매",'파인아시아 전문투자형 사모부동산투자신탁2호'는 서울 동작구에 위치한 홈플러스 남현점을 매입하는... 독점적인 상권이 확보된 지역으로 영업면적당 매출실적이 홈플러스 상위 10% 안에 드는 우량점포로 알려져...
414,2017.10.25.,태조 이성계의 사냥 행렬은 어땠을까,[서울신문] ‘조선 시대 왕들의 사냥 행렬은 어땠을까.’ 26일 서울 성동구가 조선 시대 왕들의 대표적인... 지역 상권 활성화에 기여하고 있다”고 24일 밝혔다. 태조 이성계 축제는 1999년 시작됐다. ‘사냥’을 주제로 한...
415,2017.10.30.,"대방건설, 구리갈매1차 '대방디엠시티 메트로카운티 오피스 선착순 동호지정 ...","차이로 서울 접근성이 매우 뛰어나다. 구리갈매 대방디엠시티에 많은 관심이 쏠리는 이유는 총 356실 대규모 오피스텔의 수요와 더불어, 후면 모다아울렛 방문객과 우측 상권의 유동인구를 흡수할 수 있어, 투자자들의..."
416,2017.10.25.,압구정·신사역·이태원 상가공실 급증,"서울의 평균 공실률은 7.4%로 전 분기 대비 0.4%포인트 상승했다. 압구정·신사·이태원 상권의 공실률 상승이 두드러졌다. 압구정은 16.6%로 3.5%포인트 늘었고, 신사는 12.8%로 5.9%포인트 늘었다. 상가 신규 공급이..."
417,2017.10.26.,“왜 대전 화상경마장은 2021년까지 두나”,ㆍ상권 위축·교육 환경 열악…주민들 “용산처럼 폐쇄를” 대선을 앞둔 지난 3월 더불어민주당 대선후보... 2015년 문을 연 서울 용산 화상경마장 폐쇄 결정 이후 대전 월평동 화상경마장 조기 폐쇄를 요구하는 주민들의...
418,2017.10.30.,"[더벨]우체국-미래에셋대우, 금융복합점포 '주춤'","서울 금천우체국은 금천구 중심상권 내에 위치해 확장가능성이 크고, 리모델링을 할 경우 지역 내 랜드마크가 될 수 있다는 분석이다. 서안양우체국 또한 구도심과 신도심을 연결하는 곳에 위치해 유동인구가 많아..."
419,2017.10.26.,[국감] 창업 5년 내 자영업자 폐업율 73%,경기부진 겹치면서 자영업자 소득증가율은 0.4% 그쳐 [서울경제] 10명의 자영업 창업가 중 7명이 5년 내... 골목상권 진출도 증가한 것으로 나타났다. 최저임금 미만 근로자의 68.2%가 소상공인·영세중소기업(10인미만)...
420,2017.10.26.,[국감] 창업 5년 내 자영업자 폐업율 73%,경기부진 겹치면서 자영업자 소득증가율은 0.4% 그쳐 [서울경제] 10명의 자영업 창업가 중 7명이 5년 내... 골목상권 진출도 증가한 것으로 나타났다. 최저임금 미만 근로자의 68.2%가 소상공인·영세중소기업(10인미만)...
421,2017.10.24.,"스타벅스, 모바일 주문·결제 시스템 '사이렌오더' 누적 3,000만 주문 돌파","여의도하나금융투자점(23.9%), 서울중앙우체국점(22.6%) 등 사이렌오더가 많이 쓰인 다른 점포 역시 오피스 상권에 위치해 있었다. 시간대별로는 출근 시간대인 오전 8~9시 사이 접수된 주문이 전체의 24%로 가장..."
422,2017.10.27.,풍부한 유동인구 확보한 공원 인근 상가 주목도↑,"뿐만 아니라 지난 8월 서울 마포구 공덕동 아현뉴타운 '마포로 6구역'에서 분양한 '공덕 SK리더스뷰'의 단지... 업계 관계자에 따르면 ""공원 인근 상권의 상가 시세가 주변 지역보다 더 높은 것은 공원 접근성 차이..."
423,2017.10.30.,이해진 시장지배적 규제 도입에 대해 “전세계 점유율을 놓고 봐야”…뉴스배...,(서울=NSP통신) 이복현 기자 = 네이버 이해진 전 이사회 의장이 네이버 뉴스 배치 조작에 대해 사과의 뜻을... 외에 네이버가 골목상권에 피해를 주고 있다는 지적에 대해 “1달에 10만원 이하 광고가 절반이 넘는다”며...
424,2017.10.27.,"""대기업 대유위니아, 빨래방 사업 진출은 안 될 일""","추광규 서울지역 소상공인협동조합 협업단 정석규 회장은 ""소상공인특별위원회 간사로서 우리셀프빨래방협동조합이 하시는 일에 대해 행정적으로 최대한 돕도록 하겠다. 대기업인 만도가 골목상권 적합업종인..."
425,2017.10.27.,‘힐스테이트 광교중앙역’ 단지 내 상가 분양… 대세는 ‘스트리트형 상가’,또한 지난 3월 롯데건설이 분양한 서울 금천구 ‘롯데캐슬 골드파크 4차’의 상업시설인 ‘마르쉐도르... 주변 상권 활성화에 따른 시너지 효과도 기대할 수 있다. 롯데아울렛(광교점)이 단지 바로 옆에 위치했고...
426,2017.10.28.,[맛집로드] 지금 들러야 할 ‘잇’플레이스,"잡으면서 상권 부활의 날갯짓을 펼친다. 레스토랑가이드 &lt;다이어리알&gt;과 함께 영원한 젊음의 거리 대학로... 서울 종로구 동숭동 1-41 / 순대국 7000원, 순대스테이크 1만4000원 / 24시간 영업 / 02-742-5338 본문 이미지 영역..."
427,2017.10.25.,"[분양특집] 우미건설, 11월 ‘광교 브릭스톤’ 분양",이 같은 영국 브릭스턴 상권과 적벽돌 건물의 이미지를 브릭스톤을 통해 좀 더 현대적이고 세련되게 재해석했다는 것이 우미건설의 설명이다. 서울 및 수도권 전역에서의 진출입 여건도 갖춰져 있다. 상가 앞을 지나는...
428,2017.10.30.,삼성전자·수원 R&D사이언스파크 등 임대수요 풍부한 '아주 리센 테라스파크'...,"42호선으로 서울 및 수도권으로 쉽게 닿을 수 있다. 2017년 개통예정인 비송-매송간 도시고속화도로, 천천IC... 현장 바로 옆에는 홈플러스를 비롯한 호매실 일대 중심상권이 형성돼 있고, 제2실내체육관, 호매실 도서관 등..."
429,2017.10.29.,"[책으로 배우는 재테크] ""발품 팔아라, 입지 따져라, 시작은 강남에서""","같은 돈이라도 서울 외곽이나 경기도로 가면 더 크고 좋은 집을 얻을 수 있기 때문이다. 예비 신혼부부들에게... 대로변에 위치해야 하고, 업무시설과 상권이 발달한 곳이 좋다. 반대로 고급 빌라촌의 경우 대중교통과..."
430,2017.10.26.,[현장에선] 중기장관 후보자에 바란다,종종 들르는 서울의 한 시장은 영 딴판이다. 전체 점포의 절반가량은 문을 닫아 흉물처럼 방치됐다. 지하철... 대형마트와 맞서 자영업자와 소상공인이 골목상권을 지켜낼 지가 의문이다.   나기천 산업부 차장 새 정부...
431,2017.10.30.,"편의점·온라인 성장 속 대형마트 '부진'… ""체험형 몰링으로 승부수""",롯데마트의 경우 지역 상권 맞춤형 전략으로 신규 점포 및 기존 점포 리뉴얼을 진행해 고객 끌오모으기에 나섰다. 지난 4월 문을 연 서울 양평점의 경우 1층을 '어반 포레스트'라는 휴식 공간으로 꾸리면서 파격적인...
432,2017.10.27.,"프랜차이즈 '을의 반격'...김상조, 힘 실어주나","박기영 한국프랜차이즈산업협회장(왼쪽)과 김상조 공정거래위원장이 지난 7월 28일 서울... 골목상권 등 경제적 약자에 대한 보호를 위해 가맹점 등 민생현안을 최우선적으로 들여다보겠다""며 갑의 횡포에 대한 근절..."
433,2017.10.25.,"하얏트 리젠시 제주, 2017 제주관광대상 종합대상 수상",지역 상권 활성화와 문화 예술 산업 발전에 기여한 공로가 인정됐다. color@sportsseoul.com ▶스포츠서울 공식 페이스북 ▶스포츠서울 공식 유튜브 채널 [기사제보 news@sportsseoul.com] Copyright ⓒ 스포츠서울&amp;sportsseoul....
434,2017.10.22.,"""개통 눈앞"" 상승 여력 남은 역세권 아파트 어디?","이 지역은 지난해 말 동탄역이 완공되면서 서울 강남권으로의 접근성이 대폭 개선됐다. 동탄역에서... 확대, 상권 발달 등으로 매수 수요가 늘기 때문에 결과적으로 집값 상승을 기대할 수 있다”고 설명했다. 이소은..."
435,2017.10.24.,"광운대역 창업타운, SNK-스타트업 스테이션 개소","앞서 광운대는 지난해 11월 서울시 캠퍼스타운 조성사업에 선정, 대학 자원과 공공 지원을 결합해 대학... ‘창업문화 특성화 거리’로 조성하는 등 광운대역 상권을 활성화한다는 계획이다. ▶ 속보이는 연예뉴스 fn스타"
436,2017.10.30.,"SKB “개인사업장 통신비, 최대 178만원까지 줄여드립니다”","서울 송파구 석촌동에서 명함가게를 운영하고 있는 유 모씨는 ""월 2만2900원이던 가게 통신비를 사장님... 골목상권 활성화 및 대기업과 개인사업자 등 자영업자가 상생할 수 있는 방안을 지속적으로 마련해 나가겠다""고..."
437,2017.10.25.,오피스·상가 3분기 자산가치↑·임대수익↓,"한편, 지역별로는 중국인 관광객 감소의 영향이 이어지면서 서울 명동과 신사역, 압구정 상권 등의 임대료가 하락했다. 제주 지역은 중국인 관광객 감소에도 불구하고 내국인 관광객 증가와 인구 유입 등이 동시에..."
438,2017.10.29.,"광진구, 구의시장 시장정비사업 추진","[시민일보=여영준 기자]  서울 광진구(구청장 김기동)에 소재한 구의시장에 판매시설 및 공동주택... 콘텐츠로 주변지역과 연계성을 높여 지역상권 활성화와 경쟁력을 회복하도록 노력하겠다""고 밝혔다."
439,2017.10.29.,"김동연 ""전통시장 상권 내몰림 방지·시장 활성화 나설 것""","전통시장 상권 내몰림 방지를 위한 법령 보완에 나서겠다""고 말했다. 김 부총리는 이날 강원도... 울산 남창옹기종기 시장 부스를 방문한 자리에서는 울산시 울주군의 대표 제품인 배를 구입했고, 서울..."
440,2017.10.29.,"김동연 ""전통시장 상권 내몰림 방지·시장 활성화 나설 것""","전통시장 상권 내몰림 방지를 위한 법령 보완에 나서겠다""고 말했다. 김 부총리는 이날 강원도... 울산 남창옹기종기 시장 부스를 방문한 자리에서는 울산시 울주군의 대표 제품인 배를 구입했고, 서울..."
441,2017.10.25.,"빛바랜 을지로 조명거리, 다시 빛난다","서울디자인재단 제공서울 중구는 서울디자인재단과 공동으로 다음달 1일부터 5일 동안 ‘을지로, 라이트웨이 2017’을 연다고 24일 밝혔다. 1980년대까지 조명 산업의 중심지로 호황을 누렸던 을지로 조명 상권에는 값싼..."
442,2017.10.24.,"文정부 가계부채대책 3탄, 新DTI-HUG보증하향 대출고삐 더 죈다","23일 오전 서울 여의도 국회 본청에서 열린 가계부채 종합대책 당정협의회에서 참석자들이 취재진을 향해... 개인사업자가 여신심사를 할때는 내년 3월부터 업황, 상권특성, LTI(소득대비 대출비율)이 종합활용된다...."
443,2017.10.26.,"가을 지역축제, 활성화 위해서는 홍보 중요해","대표적인 축제로는 민둥산억새꽃축제와 장성백양단풍축제, 서울빛초롱축제, 벌교꼬막축제, 문경사과축제... 지역과 주변 상권이 함께 살아나는 가을 지역축제 활성화를 위해서는 가을 여행객들에게 축제에 대해..."
444,2017.10.27.,2017 전통시장 가을축제 행사 절정...'한우' 먹으러 '마장시장' 가자,"이번 축제는 '떠나요 가을여행, 즐겨요 가을시장'이란 슬로건 하에 침체된 전통시장 활력 회복을 통해 상권활성화 및 지역경제를 진작시키기 위해 마련됐다. 서울지역은 동대문시장, 마장축산물시장과 중랑동부시장..."
445,2017.10.23.,"BNK부산은행, 연 6% 수준 사모 부동산 펀드 판매",파인아시아 전문투자형 사모부동산투자신탁 2호는 서울 동작구에 위치한 홈플러스 남현점을 매입하는... 독점적인 상권이 확보된 지역으로 영업면적당 매출실적이 홈플러스 상위 10% 안에 드는 우량점포로 알려져...
446,2017.10.23.,"북촌은 지금, 관광객 탓 주민 떠나는 ‘투어리스티피케이션’",서울시는 1월 정주환경 개선과 골목상권 보호 대책을 골자로 하는 북촌 지구단위계획 재정비에 착수했다. 하지만 이마저도 이해관계에 따라 입장이 서로 달라 난항을 겪고 있다. 이성호 시 한옥조성팀장은 “현재 민관...
447,2017.10.27.,"롯데백화점, 중구청과 명동 상권 활성화 MOU",(서울=연합뉴스) 27일 오전 서울 중구청에서 최창식 중구청장(왼쪽)과 박영환 롯데백화점 마케팀담당임원 상무가 명동 상권 활성화를 위한 MOU를 체결하고 있다. 2017.10.27 [롯데백화점 제공=연합뉴스] photo@yna.co.kr...
448,2017.10.28.,[대박땅꾼의 땅스토리]토지지가상승과 관광지의 역할,대게 산업단지가 조성되고 그 안에서 일할 사람들이 몰리면 자연히 주변은 상권과 주거지가 형성된다.... 대부분 인천과 서울지역에서 쇼핑이 주가 된 소비가 이뤄졌기 때문이지만 상당한 효과로 볼 수 있다. 그런데 이러한...
449,2017.10.23.,올 3분기 상가분양 지난해보다 2배 증가…분양가도 10% 상승,주요 공급지역은 서울 금천구의 가산디지털단지와 경기 시흥시 등으로 이들 지역에 지식산업센터와... 높은 상가 분양가는 높은 임대료로 이어지고 이는 물가상승이나 지역상권 침체로도 연결될 수 있다. 김민영...
450,2017.10.27.,"안양 센트럴 헤센, 복합주거단지 11월 분양","특히 금정역은 광역급행고속열차(GTX) C노선이 예정되어 있어 개통 시 서울 강남,북으로 이동이 더욱... 또한 1호선 안양역 주변에 조성된 상권인 안양1번가도 가까워 다양한 상업시설을 이용할 수 있고 수리산과..."
451,2017.10.25.,광교에 영국풍 상가 '브릭스톤' 분양,"상권이 잘 발달한 곳으로 유명한 이 도시는 영국풍의 적벽돌이 인상적인 곳이다. 영국풍 외관과... 광교상현IC와 동수원IC를 통해 서울-용인고속도로, 영동고속도로를 이용하기 쉽다. 상현역에서는 220m거리다...."
452,2017.10.24.,"현대리바트, ‘윌리엄스 소노마’ 논현 전시장 개장",가구ㆍ생활 소품 4500여 종 전시ㆍ판매… 서울 가구 매장 중 최다(多) 미국 유명 홈퍼니싱 브랜드인... 그러나 논현동 가구 거리는 가구 구매 수요가 집중되는 상권이어서 국내에 브랜드를 알릴 수 있는 최적의 장소라...
453,2017.10.27.,마곡지구 완성 눈앞...강서구 마곡동 `마곡엠밸리15단지` 수혜 기대,"그중 서울시 강서구 마곡동에 위치한 '마곡엠밸리15단지'아파트는 2014년 5월 입주한 최고 16층, 13개동, 총... 주변으로 상권이 빠르게 형성되고 있다. 이러한 영향으로 마곡지구 아파트 전세 물량은 거의 없는 상황이다...."
454,2017.10.26.,"기예르모 카레이 크리스탈라군 부회장 ""한국에 인공해변 4곳 조성""",카레이 부회장은 지난 24일 서울 용산에서 국내 진출을 위한 첫 단계로 라군코리아파트너스(LKP)와 독점권... 조성한다”며 “상권이 개발되면서 주변 부동산의 가치도 함께 올라가는 효과가 나타날 것”이라고 말했다....
455,2017.10.22.,이틀뒤 공개되는 가계부채 종합대책 주요 내용은,22일 정부는 오는 24일 서울청사에서 합동 브리핑을 열어 '가계부채 종합대책'을 발표한다고 밝혔다.... 업종과 상권 등에 맞춰 대책이 공개된다. 정부의 이번 대책에는 사정이 더 어려워질 것으로 예상되는 취약 차주를...
456,2017.10.27.,규제 비켜난 상가투자… 지식산업센터 상가 이목 집중!,"51개(서울 오류 29개, 시흥 은계 4개, 시흥 은계 10개, 대구 금호 8개) 상가가 모두 완판됐다. 상가의 낙찰가... 더욱이 일반 아파트 단지 내 상가와 다르게 소비력이 좋은 기업 근로자들이 주된 대상이기 때문에 상권도..."
457,2017.10.24.,"[혁신도시] ""원원 관계 형성하는 공유가치 창출에 노력해야""","주민들은 서울과 수도권에 정부기관 및 공공기관들이 존재하는 것을 당연한 것처럼 여겨왔다""며 ""혁신도시... 지역 상권은 어려움을 겪고 있는 실정이다. 상대적으로 부족한 문화시설과 열악한 교육여건은 부모의..."
458,2017.10.25.,수도권 역세권에서 1만가구 연내분양,25일 업계에 따르면 연말까지 서울·경기·인천 역세권에서 일반분양 물량 기준 총 1만1164가구가 분양을... 지하철역 주변에 버스 등 대중교통망도 조성되는 만큼 유동인구를 바탕으로 지역상권이 형성돼 주거선호도가...
459,2017.10.25.,"3분기 상업용 부동산 공실률, 오피스 줄고 중대형상가 늘고",서울역 상권은 인테리어 비용 지원 등 임차인 유치노력으로 대형 오피스 공실을 해소했다. 용산 상권은 도심과 가까운 입지와 저렴한 임대료로 임차 수요가 증가하면서 공실이 감소했다. 인천은 공실률이 비교적...
460,2017.10.27.,"광진구 구의시장, 13층 규모 '新 전통시장' 건립","구는 이같은 내용의 구의시장 시장정비사업(구역면적 3232㎡) 추진계획(안)이 지난 23일 서울시 시장정비사업... 주변지역과 연계성을 높여 지역상권 활성화와 경쟁력을 회복하도록 노력하겠다""라고 밝혔다. 한강타임즈"
461,2017.10.23.,"BNK부산은행,연6% 수준 '사모 부동산 펀드' 판매",‘파인아시아 전문투자형 사모부동산투자신탁2호’는 서울 동작구에 위치한 홈플러스 남현점을 매입하는... 독점적인 상권이 확보된 지역으로 영업면적당 매출실적이 홈플러스 상위 10% 안에 드는 우량점포로...
462,2017.10.24.,"현대리바트, 강남에 ‘윌리엄스 소노마’ 대형 매장 오픈",현대백화점그룹 계열 생활문화기업인 현대리바트는 오는 31일 서울 강남구 논현동에 포터리반·포터리반... 현대리바트는 본격적으로 윌리엄스 소노마의 유통망을 지방 광역상권으로 확대해 나갈 방침이다. 이는 그룹...
463,2017.10.24.,광운대역 창업타운 ‘SNK-스타트업 스테이션’ 개소식 개최,"광운대는 지난해 11월, 서울시 캠퍼스타운 조성사업에 선정됐다. 서울시 캠퍼스타운 조성사업은 박원순... 광운대역 상권을 활성화하기 위한 계획도 마련되었다. 특히, 이번에 개소되는 ‘SNK-스타트업 스테이션’을..."
464,2017.10.27.,규제 적용 전 막바지 공급 수익형부동산 반사이익 얻을까,"7블록은 상권 활성화를 위한 마스터리스, 통합운영관리가 적용되며 CGV 입점이 확정됐다. 우성건영은 경기... 서울시 영등포구 영등포동에서는 '영등포뉴타운 꿈에그린 스퀘어'가 분양을 앞뒀다. 5호선 영등포시장역과..."
465,2017.10.25.,최저임금 인상·금리 상승·대출규제…'사면초가' 자영업,"암담하기만 합니다” 서울시내에서 24시간 편의점을 운영 중인 K(남.42세)씨는 한숨을 내쉬었다. 내년부터... 또 내년 3월부터는 자영업자들이 금융사로부터 대출을 받을 때 신용등급과 소득은 물론 업종별 업황, 상권..."
466,2017.10.27.,대형마트 도보 1분 오피스텔 ‘보미 더 리즌타워’ 11월 분양,단지 바로 옆 이마트… 중심상업지구 인접해 다양한 생활인프라 갖춰 [서울경제] 오피스텔 등 수익형부동산... 인근 상권이 함께 활성화되는 경우가 많다. 또 대형마트가 들어서면 고용창출 효과뿐만 아니라 유동인구가...
467,2017.10.27.,"동탄의 3대 교통호재 집결, 동탄2신도시가 주목받는 이유","이용해 서울~수서까지 15분대 이동, 부산 등 전국 어디든 2~3시간이면 도달할 수 있다. 특히 현재 동탄... 주변 상권도 활성화 될 전망이다. 특히 ‘반도유보라 아이비파크 9.0’은 교육 특화시설인 단지 내 별동학습관과..."
468,2017.10.29.,여전히 불편한 전통시장… 대형쇼핑몰 휴업한다고 전통시장 살아날까,"특히 대구는 전통시장의 33.9%만이 주차장을 보유하고 있으며 울산 37.5%, 서울 41.7% 로 저조한... 골목상권·전통시장 활성화 효과를 거두기 어렵다고 입을 모은다.  근본적으로 전통시장의 경쟁력을..."
469,2017.10.25.,3분기 오피스 임대료 떨어지고 중대형상가는 올랐다,"서울 중대형상가의 공실률은 보합을 기록했다. 명동역과 신사역 상권은 중국인 관광객이 감소해 공실이 증가해 임대료가 떨어졌고, 수유역과 왕십리역 상권은 교통 호재와 개발사업에 영향을 받아 임대료가 올랐다."
470,2017.10.24.,"현대리바트, 강남에 '윌리엄스 소노마' 대형 전시장 오픈",매장을 서울 강남에 선보인다. 현대리바트는 오는 31일 서울 강남구 논현동에 포터리반·포터리반 키즈... 또 논현 전시장 오픈을 계기로 본격적으로 윌리엄스 소노마의 유통망을 지방 광역상권으로 확대한다....
471,2017.10.26.,한강 조망의 힘! 성동구 옥수동 `옥수하이츠` 매물 귀해…,"동호대교를 건너면 압구정이 있어 현대백화점, 가로수길 등의 상권을 편리하게 이용할 수 있다. 달맞이봉공원, 응봉산, 한강, 서울숲, 매봉산공원 등 주민들이 여가를 즐길 수 있는 녹지공간이 풍부하다. 교육시설로는..."
472,2017.10.26.,`책 한권의 여유` 쇼핑몰서 누린다,"손님 휴식용 서점·도서관 늘려 체류 시간 ↑ … 매출 상승 효과 서울 삼성동 스타필드 코엑스몰 내 별마당... 서점과 도서관의 볼거리를 활용해 관련 상품을 체험하는 기회를 만들고, 체류 시간을 늘려 주변 상권의 매출도..."
473,2017.10.28.,"[금주의 中企 뉴스] “다이소, 문구서 ‘통큰’ 양보 부탁합니다”",사실 소비자 편의와 골목상권 상생 등을 모두 종합해서 봤을 때 이번 건은 쉽게 해결되기 어려운 일입니다.... AGM이 몽골 고비사막 현지에 자원 채굴을 위해 보유한 전체 면적은 서울의 4분의 1 규모에 달한다고 합니다....
474,2017.10.25.,"수도권 역세권, 연말까지 1만1100여 가구 분양",25일 업계에 따르면 연말까지 서울·경기·인천 역세권에서 일반분양 물량 기준으로 총 1만1164가구가 분양을... 지하철역 주변으로 버스 등 대중교통망도 조성되는 만큼 유동인구를 바탕으로 지역 상권이 형성돼 주거...
475,2017.10.26.,동대문주차장 지상상가 갈등 끝…이제 ‘디디피 패션몰’로,-서울시ㆍ일부 상인 충돌 ‘마침표’ -‘소통’ 앞세워 새 공간으로 탈바꿈 서울시와 일부 상인들 간... 있었던 것”이라며 “이제는 상권 활성화 대책에 전력을 다하겠다”고 말했다. yul@heraldcorp.com ▶오늘의 운세 날씨
