,date,title,contents
1223,2017.08.08.,"[Daily New식품] CJ제일제당, 오뚜기, 하이트진로 外","골목상권 보호, 도민화합, 사회공헌이라는 목표를 통해 '착한축제'를 표방하고 있다. '오늘 생산한 맥주를... ◇ 캘리스코, '타코벨 대치점' 그랜드 오픈외식전문기업 캘리스코는 서울 강남구 도곡로에 캘리포니아 스타일..."
1224,2017.08.04.,[화제의 분양현장]안정적 임대수익 창출하는 ‘미군 렌털하우스’,제2의 이태원으로 불리는 로데오상권 사거리 코너 초입에 최초로 공급되는 렌털하우스로서 부대 복귀가... 미군 렌털하우스 캐피토리움 홍보관은 서울 강남구에 위치하며 선착순 호수 지정 후 분양계약이 이뤄진다....
1225,2017.08.08.,국내 최대 홍등가 대구자갈마당을 아십니까?,"조선 후기 대구는 서문시장, 약령시, 남문시장 등 큰 시장이 상권을 이루고 있었다.  1876년 강화도조약 이후 서울은 이미 일본 상인의 유입이 많고 지대가 비싸졌고 부산 개항으로 부산 역시..."
1226,2017.08.02.,[단독]기름도 커피도 카드 대신 자동차로 척척 결제,"[동아일보] 신한카드 ‘커넥티드카 서비스’ 체험기 동아일보 기자가 7월 말 서울 강남구 GS칼텍스... 주변 상권, 도로 환경 등도 크게 바뀔 수 있을 것”이라고 분석했다. :: 커넥티드카(Connected Car) :: 차량에 디지털..."
1227,2017.08.07.,"'통신비 논란' 여파, 집단상가 유통망 개편하나","현재 전국에 15개 집단상가가 영업 중으로 알려졌는데, 서울에서는 강변·신도림 테크노마트에 입점한... 집단상가가 단말기유통구조개선법(단통법)의 지원금 상한제를 어기며 영업해온 경우가 많아 골목상권을..."
1228,2017.08.17.,일산 식사동 유럽형 테라스하우스빌라 ‘아이비힐’ 신축빌라 분양,"식사동 신축빌라 아이비힐 관계자에 따르면, “은행, 쇼핑몰, 병원 등 이미 상권이 잘 형성된 대단지 위시티... 풍산역과 서울외곽순 환도로등과 인접해있어 도심으로의 접근성이 높으며, 근처에 동국대병원과 초,중,고가..."
1229,2017.08.10.,'이회창 회고록' 이르면 다음 주에 나온다,오는 22일에는 서울 세종문화회관에서 기자간담회를 열고 회고록 집필 배경 등을 설명할 예정이다. 회고록은 상`하 두 권으로 나뉘었으며 상권은 이 전 총재가 가진 철학이나 사상과 관련한 내용이 대부분을 차지한...
1230,2017.08.01.,5번째 맞은 '신촌 물총축제' 이면엔…아쉬운 시민의식,서울의 대표적인 여름 축제로 자리잡고 있지만 불만의 목소리도 있습니다. 밀착카메라로 취재했습니다.... 고데기도 하고 왔는데…] 물총축제는 신촌 상권을 살려 보겠다는 취지로 시작됐습니다. 하지만 정작...
1231,2017.08.03.,아르바이트 자리 많은 대학가 ‘톱10’은?,"알바몬 관계자는 “대학가별로 모집하는 아르바이트 분야도 차이를 보였다”며, “상권이 발달한 홍익대, 건국대, 서울교대, 연세대 등은 음식점 및 서빙 분야가 상대적으로 많았다. 경기권인 인하대와 부천대..."
1232,2017.08.03.,정부 대책에도 '역세권 아파트'는 프리미엄 '기대',또한 대중교통 이용이 편리하고 유동인구가 풍부해 상권이 쉽게 형성되며 거주환경이 좋아진다. 최근에는... 산성역에서 한정거장 거리에 서울 송파구 복정역이 위치해있어 서울 접근성이 우수하다. 또한 SRT 및...
1233,2017.08.18.,66만 매머드급 배후수요 갖춘 은평뉴타운 마지막 핵심상가 배후수요 풍부한 프...,"상권 활성화로 인근 삼송권역, 지축권역, 응암권역, 연신내권역, 불광권역의 수요를 충족시킬 서울 서북부의 새로운 랜드마크 상권이 형성될 전망이다. 신한 헤센 스마트 상가 분양홍보관은 서울 은평구 통일로 1020..."
1234,2017.08.11.,"일본 캐주얼 레스토랑 도쿄스테이크, 성신여대점 오픈","아기자기한 일본풍의 소품들과 오픈식 주방 그리고 2인에서 4인 테이블까지 폭 넓은 수용과 인테리어로 캐주얼한 일본식 레스토랑이 컨셉인 도쿄스테이크는 건대, 홍대, 대학로 등 서울의 주요 상권에 입점함과 동시에..."
1235,2017.08.08.,"SPC그룹, 라그릴리아 아홉 번째 매장 홍대점 오픈","(서울=NSP통신) 박유니 기자 = SPC그룹이 운영하는 라그릴리아가 홍대에 새 매장을 열었다. 라그릴리아... 라그릴리아 관계자는 ""새로운 상권에 진출할 때마다 지역적 특성에 맞는 다양한 메뉴를 선보이고 있다”며..."
1236,2017.08.09.,할리스 가봤어? 1인 독서실·야외정원·한옥 매장…진격의 '빨간 왕관' 19년째...,"지역 상권마다 다른 매장 컨셉 Flagship 랜드마크에 플래그십 스토어 Trend '카공족' 공략 1인 독서실 인테리어... 지난 1년 새 서울 종로, 광화문, 여의도 등 도심 곳곳에 대형 플래그십 스토어가 들어섰다. 새하얀 건물에..."
1237,2017.08.16.,부산 광복에서 만나는 카카오프렌즈 플래그십 스토어,"8월 15일, 부산 중심 상권인 광복동에 카카오프렌즈 단독 플래그십 스토어가 개장했다. 카카오프렌즈 부산 광복점은 서울 이외 지역에 최초로 개장한 캐릭터 플래그십 스토어다. 카카오프렌즈의 매력을 체험할 수 있도록..."
1238,2017.08.06.,"최저임금 인상에 ‘김밥천국’ 점주들, “2000원도 버겁다”",지난해 말 서울의 주요 상권을 중심으로 기본 김밥 가격이 1500원에서 2000원으로 오른데 이어 지방이나 서울 외곽 수도권 등에서도 가격 인상 대열에 동참하고 나선 것이다. 경기도 부천시 오정동에서 ‘김밥천국’을...
1239,2017.08.16.,"'마곡 GMG엘스타 상가' 역세권 유동인구, 관광지 관광수요 모두 확보한 매력적...","대기업입주, 서울식물원, 근린공원 등의 호재와 우수한 교통망까지 갖춰진 알짜배기 입지의 상가로써 마곡지구를 대표하는 메카상권으로 급부상하고 있으며, 이용객을 위한 다양한 MD구성에도 중점을..."
1240,2017.08.09.,상권 성공 키워드는 '활성화'…차별화 전략 확산,"최근 서울 중구 신당동, 신당5동, 동화동 등의 의류 봉제산업 밀집지역이 서울시의 특화상권 활성화지구로 지정됐다.  중구는 향후 3년간 5억5000만원을 투입해 동대문 일대 패션시장과의 네트워크 조직과..."
1241,2017.08.08.,"SPC그룹, 라그릴리아 홍대점 오픈","라그릴리아 아홉 번째 매장인 홍대점은 서울 마포구 홍대입구역 인근에 140석 규모로 자리잡았다.... 라그릴리아 관계자는 ""새로운 상권에 진출할 때마다 지역적 특성에 맞는 다양한 메뉴를 선보이고 있다""며 ""합리적인..."
1242,2017.08.07.,[가업 잇는 100년 기업] 의정부 제일시장 수덕신발,젠트리피케이션(gentrificationㆍ원래의 거주자가 상권 활성화로 다른 지역으로 쫓겨나게 되는 현상) 등 최근 자영업자들의 하루하루가 불투명한 상황에서 이들의 권리를 보장할 울타리가 필요하다는 뜻이겠다. 더욱이 서울...
1243,2017.08.09.,서병수 시장 만난 청년 소상공인들 “젠트리피케이션으로 상권 무너져”,"골목상권 스마일 프로젝트 일환 지역 상인 11명 만나 간담회 - 상인들, 임대료·대출문제 호소부산시가... 이곳에서 식당 도쿄가다를 운영하는 이병석 대표는 “서울 홍대, 가로수길 등이 한때 다 잘나가다가 지금은..."
1244,2017.08.08.,[로컬발언대] 행정수도(行政首都)의 조건 2,이전으로 상권등의 피해를 입고 계신 분들도 있다. 신도시 개발로 급격히 주거환경이 변하여 어려움을 겪고... 한편 이 도시로 이주해 온 공무원들은 잦은 서울 출장과 인사이동에 따른 근무지 변경으로 가족과 떨어져 사는...
1245,2017.08.10.,"상가정보연구소, 2017 하반기 실전 상가 투자 세미나",상가정보연구소 (소장 박대원)는 오는 18일 오후 2시 서울 양재역 1번 출구 앞 서희타워 5층 상가정보연구소... 1부에서는 수도권 유망 물건 ‘지역(상권) 및 물건 투자성 분석’시간을 갖고 2부에서는 앞서 소개 된...
1246,2017.08.02.,[사회] 불처럼 일어나 이슬처럼 사라지다,매장도 서울 강남 등 주요 상권에 오픈했다고 해서 사업이 잘되는 줄로만 알았다”고 말했다. 강 대표는 국내 커피 프랜차이즈 업계에서 신화적 존재였다. 평사원으로 시작해 전문 경영인으로 성공한 뒤 자신만의...
1247,2017.08.09.,[비즈 르포] '대프리카 핫플레이스' 급부상 신세계 대구점…골머리 앓는 토착...,신세계(004170)는 대구점의 올해 매출이 서울 명동에 있는 본점 매출을 뛰어넘을 것으로 예상한다. 신세계... 대구에 거주하는 이승연(23·경북대 3학년) 씨는 “대구의 대표 상권은 대구백화점 본점이 있는 동성로...
1248,2017.08.18.,"물금 신도시 입성, 다인건설의 ‘다인 로얄팰리스’ 상가 1~3차 분양 마감 눈...","경남 양산시 물금읍 범어리 2715-29번지에 들어서는 3차 상가는 남양산역 초역세권 프리미엄 상권을 기반으로... 상가 주변에 중앙고속도로, 경부고속도로 등이 가까이 위치해 부산을 비롯해 울산, 서울로 연결되는 쾌속..."
1249,2017.08.08.,동탄2신도시 완공 앞둔 선임대 후분양 상가 동탄 베라프라자,서울생활권을 공유하면서 탁월한 교통망까지 갖추고 있어 동탄2신도시는 성공적인 투자처로써 각광받는... 중동탄 항아리상권 최초의 상가로 모든 업종을 선점할 수 있어 임대경쟁도 치열할 전망이다. 상가는 공실률...
1250,2017.08.04.,8.2부동산대책 발표…非규제지역 풍선효과 기대,"이번 규제로 3일부터 서울 25개구, 경기도 과천, 세종시가 투기과열지구로 지정된다. 투기과열지구에서는... 금오지구 상업지역 인근에 위치해 홈플러스 등의 행정타운 상권과 은행가 이용이 편리하다. 또 행복로..."
1251,2017.08.07.,[한줌뉴스] 시민의 쉼터 '경의선 숲길'도 쉬게 해주세요,숲길은 서울 시민의 사랑을 받으며 시민을 위한 공간으로 자리매김하는데 성공했다. 그러나 최근 경의선 숲길을 따라 곳곳에서 공사가 진행되면서 시민의 휴식에 불편을 끼친다. 숲길과 공원을 끼고 상권이 발달하면서...
1252,2017.08.06.,"""43㎡ 매장서 월 1억원어치 팔기도…가맹점주와 머리 맞대고 영업 전략""",부엉이돈가스는 2015년 신촌과 동대문에 직영점을 추가로 연 뒤 서울 수도권에 12개의 가맹점을 운영하고... 프랜차이즈 박람회에 우연히 들러 캐주얼 일식 가맹점을 홍대 상권에 열었다. 전세자금을 통째로 가게에...
1253,2017.08.11.,[인터뷰] 3년 연속 실적 1위 '석관동 아는 형님' 홍윤선 지점장,요즘 속속 퇴장하고 있는 주가 시세판이 가동되고 있을 정도로 석관동은 서울의 '외진 곳'이다. 주택재건축정비구역으로 묶여 소박한 주택들이 끝없이 이어져 있고 이렇다할 상권이나 대기업을 찾기가 쉽지 않다....
1254,2017.08.03.,[메트로] 숲으로 잇다… ‘녹색특별시’ SEOUL,"이투데이=김정웅 기자 | 서울시, 공원녹지 사업 활발 고가도로 위에 만든 ‘서울로 7017’·폐철길 따라 지은... 홍대상권과 단절돼 왔던 연남동을 젊은이들이 꼭 찾아야 할 ‘핫플레이스’로 바꾸어 놓았다. 이밖에 옛..."
1255,2017.08.06.,밥상 물가 고공행진…골목상권은 더 울상,"&lt;남미숙 / 서울시 성수동&gt; ""얼갈이를 사러 나왔는데 너무 비싸더라고요. 그래서 그냥 버섯 종류 사가지고 시장 봐서 들어갈려고요."" 그런데 연일 오르고 있는 물가는 장보는 사람만이 아니라 골목상권 상인들에게도 큰..."
1256,2017.08.02.,세계 금융의 심장부에 ‘라인 프렌즈’가 떴다,"미국 최대 상권으로 세계 금융 중심이자 글로벌 문화 트렌드를 주도하는 뉴욕 중심부에 첫 거점을 확보한... 2015년 독립 법인으로 분사한 라인프렌즈는 그동안 서울과 상하이, 베이징, 홍콩, 도쿄 등 11개국에 84개의..."
1257,2017.08.01.,'점주 불통'에 'PB 논란'까지...'이마트 덫'에 걸린 ‘이마트24’,"골목상권 반발 우려, 거부 움직임도 - 정용진 '지시' 탓 사업 무리하게 추진했다는 지적도 신세계그룹이... 서울 성동구에 있는 위드미 본점과 위드미 스타필드코엑스몰 1·2·3호점이 위드미를 지우고 그 자리에..."
1258,2017.08.11.,"봉제업, 마을공방에서 제2의 도약을 꿈꾼다",또 대형상권인 동대문 시장과도 인접해 있어 지리적으로도 자연스럽게 관심을 가질 수 밖에 없었지요.” 이재복 서울 성동구청 일자리정책과 일자리창출팀장의 설명처럼 성동구의 의류 제조업 특화도는 서울시 2위다....
1259,2017.08.15.,[文정부100일]롯데·신세계 등 유통대기업 ‘정조준’…고강도 규제 잇따라,"특히 문 정부는 김상조 체제의 공정거래위원회를 본격적으로 출범시키면서 재벌기업과 골목상권에 대한... 도입하고, 서울에서만 있는 분쟁조정기구를 시도별로 확대하겠다고도 밝혔다. 업계에서 가장 큰 논란이 된 것은..."
1260,2017.08.13.,"유통업계, 공정위 '불공정거래 근절대책'에 난색…'당근 없는 채찍'",실제로 롯데의 서울 상암동 복합쇼핑몰은 주변 상권의 반발에 따른 인허가 문제로 인해 4년째 진척되지 못하고 있다.   신세계는 부천 상동 영상복합단지 내 조성하기로 했던 복합쇼핑몰 부지 토지 매매계약을 무기한...
1261,2017.08.11.,"‘플랫폼창동61’, 확실한 성과 내야",낡은 구도심을 활성화하는 도시재생 뉴딜정책과 맞닿아 있는 서울시 소규모 재생사업에 관심이 집중되고 있다. 낙후된 도심의 역사·문화·환경 등을 보존한 채로 주변 상권과 생활 인프라 시설 등이 대거 확충...
1262,2017.08.01.,오피스 내 상업시설.. 돈이 보이는 지름길!,명품 투자처로 각광 [서울경제] 최근 오피스 내 상업시설이 투자자들에게 많은 인기를 끌고 있다. 오피스... 정도로 상권 활성화가 잘 돼있다.   이런 선례가 있어 투자자들 사이에서 오피스 내 상업시설은 꾸준한...
1263,2017.08.15.,금융침탈 맞선 고종황제…이육사 도운 보험사 회장,1899년 일제에 맞서 우리의 상권을 보호하기 위해 고종황제가 황실자금을 기초로 대한천일은행을 설립했다.... 대한천일은행에서 조선상업은행으로 바뀌어 운영되던 1915년에는 현재의 서울특별시청인 경성부청과 금고...
1264,2017.08.15.,[기고] 최저임금 현실화 핵심은 재벌 구조개혁/권오인 경실련 경제정책팀장,"[서울신문] 권오인 경실련 경제정책팀장최저임금위원회가 결정한 2018년 최저임금 7530원이 확정 고시되면서... 만리장성보다 높은 진입 장벽을 쌓고 있고, 골목상권까지 진출해 더 많은 이윤을 손쉽게 창출하고 있다...."
1265,2017.08.07.,강원도 관광ㆍ숙박ㆍ맛집 정보 한손에 쏙 ‘설악로드’ 앱 출시,"- 메이트네트웍스, 재능기부 차원 지역정보 제공 앱 무료 배포 [서울경제] 강원도 속초에 본사를 둔... 지역관광과 상권 활성화를 위해 무료로 어플리케이션을 만들어서 관심을 끌고 있다.   강원도 속초에 본사를 둔..."
1266,2017.08.10.,"㈜동일스위트, 대전 금강변 일대 신흥주거지 변신에 일조","이런 가운데 시공사인 ㈜동일과 ㈜동일스위트는 영남권과 서울, 수도권 등지에서 35년간 5만여 세대의... 적었던 상권과 편의시설이 상전벽해로 바뀔 것이 예상된다. 이에 따라 분양 시기 등을 문의하는 전화가 많은..."
1267,2017.08.04.,[화제의 분양현장]구파발역 인근… 전후면 출입문 설치 상가,서울 서북부 마지막 핵심 상권으로 평가받는 구파발역 상권에 위치해 있다. 소비자 집객력이 높은 롯데몰 은평·가톨릭대학병원·소방청으로 승격된 소방행정타운 등 탄탄한 배후수요에 2km 지점에 스타필드고양이...
1268,2017.08.10.,[고발뉴스 브리핑] 8.10 신문을 통해 알게 된 이야기,문재인 대통령이 9일 오후 서울 서초구 서울성모병원에서 건강보험 보장강화정책을 발표하고 있다. 1.... BBQ치킨이 푸드트럭에 대한 상표권 출원을 마치면서 골목상권 침해 우려가 커지고 있습니다.  프랜차이즈...
1269,2017.08.11.,[단독] [커버스토리] 팍팍한 살림살이… 푼돈 뜯는 조폭들,[서울신문] 지난 4일 대전에서 라이벌 조직폭력배 일당에게 집단폭행을 당한 대전 Y파 조직원 A(25)씨의... 유성과 둔산신도시 상권이 이들 세력 싸움의 거점이다. 대전경찰이 관리하는 조폭은 6개 파 210명이지만 Y·H파를...
1270,2017.08.04.,[이슈분석] 되풀이되는 대형마트 규제 '악몽',"골목상권과 전통시장을 살리기 위해, 대형마트 규제에서 더 나아가 복합쇼핑몰까지 규제하겠다는 건데요.... "" 서울 송파구에 문을 연 현대시티몰과 은평구에 위치한 롯데몰은 지역주민들을 대거 고용해 눈길을 끌기도..."
1271,2017.08.08.,"스타필드 고양, 체험형 콘텐츠로 고객 오래 잡는다",고양시는 신도시 특성상 만 0~4세 인구 비중이 전체 인구의 4.02%로 서울 전체(3.92%)보다 높다. 베이비서클은... 베이비서클은 매장 크기를 확 키우고 체험 콘텐츠를 촘촘히 심어 고양·은평 상권의 많은 인구를...
1272,2017.08.04.,100일 맞은 롯데마트 양평점…'힐링 실험' 通通,신규 매장인 만큼 목표치가 높기도 했지만 상권 경쟁이 치열한 탓이다. 이에 롯데마트 양평점은 지난 달부터 본격적으로 서울 서남부 지역 유통강자로 꼽히는 코스트코 양평점과 가격전쟁을 시작했다. 코스트코는...
1273,2017.08.11.,"구로구, '문 열고 냉방 영업 자제' 캠페인 실시",(서울=국제뉴스) 김석진 기자 = 구로구가 여름철 에너지 절약을 유도하기 위해 중심 상권을 대상으로 '문 열고 냉방 영업 자제' 캠페인을 펼친다. 구청 환경과 직원이 2인 1조로 팀을 구성해 지난달 26일부터 이달 31일까지...
1274,2017.08.16.,다인 로얄팰리스 삼덕 비규제지역으로 인한 관심 늘어,"이번 부동산 대책은 조정대상지역, 투기과열지구, 투기지역으로 나뉘며 서울 전역, 경기 과천, 성남... 등의 상권과도 가까워 풍부한 배후수요를 갖췄다. 지하8층부터 지상 33층까지 1,122세대의 대단지를 형성해 전..."
1275,2017.08.14.,프랑스 파리의 젠트리피케이션 해법… 자발적 '노블레스 오블리주'와 '공생',전쟁으로 허물어진 거리 곳곳에 대규모 자본이 침투해 대형 상권을 이뤘고 소상공인들은 높은 임대료를... 거리 외관만 보면 서울과 가장 닮은 지역이기도 하다. 루브르박물관·오르세미술관·노트르담성당을 지나 저...
1276,2017.08.01.,"월세 2배로 껑충...학원가, 여름방학 특강생 폭주로 원룸 전쟁",서울지역 학원 여름방학 특강을 듣는 학생들이 늘면서 학원가 인근 원룸 월세가 평소보다 2배 가까이 오르는 등 수강생들의 원룸전쟁이 치열해지고 있다. 학원가 인근 상권은 어학원발 특수를 누리고 있다. 1일...
1277,2017.08.16.,"다인건설, 경남 물금신도시 ‘다인 로얄팰리스 물금’ 1~3차 상가 분양","상가 주변에 중앙고속도로, 경부고속도로 등이 가까이 위치해 부산을 비롯해 울산, 서울로 연결되는 쾌속... 따라서 상권 확대도 빠르게 전개될 것으로 보인다. 부산대학교 양산캠퍼스를 비롯해 부산대병원, 부산..."
1278,2017.08.14.,[문재인 정부 100일] 복합쇼핑몰도 의무휴업…유통업계 ‘일자리 창출’ 공염...,"명분은 중소기업과 골목상권, 소상공인 보호다. 하지만 전문가들은 ‘일자리 창출’을 강조하는 문 정부가... 일례로 롯데쇼핑은 서울 상암동 복합쇼핑몰 사업에 좀처럼 속도를 내지 못하고 있고, 신세계는 부천 상동..."
1279,2017.08.01.,‘최강 배달꾼’ 고경표 “채수빈 생각하며 시나리오 쓴 적 있어”,"1일 오후 서울 영등포 타임스퀘어 아모리스홀에서 KBS 2TV 금토드라마 ‘최강 배달꾼’ 제작발표회가 열려... 청춘들의 통쾌한 성장, 로맨스, 골목 상권을 둘러싼 파란만장한 격투기를 조화롭게 그려낸 드라마로, 8월 4일..."
1280,2017.08.07.,"[직격인터뷰]'푸드트럭' 김준수 PD ""영세 상인 살리는 백종원의 손 주목""",[스포츠서울 김효원기자] ‘백종원의 푸드트럭’이 ‘재미+의미’ 두마리 토끼를 다 잡으며 예능의 바른... 푸드트럭존의 상권이 활기를 띠고 있다. ‘푸드트럭’ 김준수 PD는 “최근 ‘푸드트럭’이 방송되고 난 뒤...
1281,2017.08.14.,"골목상권 샤로수길, 성수동, 망리단길을 가다","오늘은 골목상권으로 뜨고 있는 샤로수길, 성수동, 망리단길에 대해 알아보겠습니다. (사진=월간맛집)      ■ 샤로수길 ‘세계 맛집투어’  샤로수길은 서울대학교 정문 모양에서 따온 ‘샤’와 가로수길을 더한 골몰..."
1282,2017.08.11.,"정의당, 스타필드 현장조사 ""상권 피해·교통정체 심각""",하남·서울 마포·경기 부천 '신세계 스타필드(복합쇼핑몰)'에서 현장 조사를 벌였다. 정의당 경남도당은 대형 복합 쇼핑몰 입점이 지역 상권에 미치는 영향을 면밀하게 조사하고자 △복합 쇼핑몰 입점 지역 피해 실태...
1283,2017.08.14.,부산 ‘명지국제신도시 삼정그린코아 더 시티’ 분양 임박,"고강도 규제인 8.2 대책은 서울 전 지역과 경기 과천, 세종시 등을 투기과열지구로 지정했으며 청약 1순위... 해당 상권 내 최대 대지면적 등 뛰어난 상품가치로 중심상권 내 랜드마크로 거듭날 것”이라고 밝혔다. 한편..."
1284,2017.08.08.,"이마트, 스타필드 고양서 '체험형 컨텐츠'로 승부",한편 고양시는 신도시 특성상 만 0~4세 인구 비중이 시 전체 인구의 4.02%로 서울 전체(3.92%)보다 높다. 이... 베이비서클은 매장 크기를 확 키우고 체험 콘텐츠를 촘촘히 심어 고양·은평 상권의 많은 인구를 담아내면서...
1285,2017.08.11.,"상권 활성화가 핵심, 골목상권 살리기 지자체도 나서","서울 중구 신당동에서는 최근 신당동과 신당5동, 동화동 등의 의류 봉제산업 밀집지역이 서울시의 특화상권 활성화지구로 지정됐다. 이에 따라 중구는 향후 3년 간 5억 5천만 원을 투입해 동대문 일대 패션시장과의..."
1286,2017.08.06.,"[머니+ 성공창업, 상권을 보라]역세권 상권, 장점도 단점도 있다",이사 [서울경제] 최근 인생 이모작을 꿈꾸는 은퇴자부터 취업 대신 사장님을 꿈꾸는 청년까지 창업에 대한 관심은 어느 때 보다 높다. 창업자 절반 이상이 점포 창업을 준비하게 되는데 점포 창업의 경우 상권 입지가 사업...
1287,2017.08.02.,"[지방 수익형 부동산 투자] 산업단지 인근 오피스텔, 배후수요 풍부","업계 전문가는 “지방 소재 상가는 시장이 서울보다 작지만 입지가 좋을 경우 상대적으로 임대수익률이 높은 곳이 많다”며 “상권과 공실 가능성, 실질적인 임대수익률 등을 꼼꼼히 살핀 뒤 투자 여부를 결정해야..."
1288,2017.08.11.,박원순 혈세사업 수혜상권 ‘낡고 허름하고 썰렁’,사진은 창동역 1번출구 앞 거리 ⓒ스카이데일리 서울시 도봉구의 창동 상권은 1911년 10월 경의선이 개통으로 창동역이 생겨나면서 처음 만들어졌다. 창동역은 1985년 4월 4호선 상계-한성대입구 구간이 개통되면서...
1289,2017.08.09.,"서병수 부산시장-소상공인, 골목상권 운영 개선·발전 위해 소통","골목 상권프로젝트 간담회’를 가졌다. 이번 간담회는 실제 소상공인의 고민을 듣고, 골목상권 애로사항에... 이승언 대표는 “서울의 성수동 골목에서는 현재 건물주가 마음대로 월세를 급격히 올릴 수 없도록 규제하고..."
