,date,title,contents
1361,2017.12.12.,"김천, 적극적 스포츠마케팅 ‘눈에 띄네’",김천시는 지난 8일 서울올림픽파크텔에서 열린 문화체육관광부가 주최한 ‘제13회 대한민국 스포츠산업대상... 이로 인해 지역 상권은 비수기 없이 연중 호황을 누리고 있어 이제 스포츠이벤트가 지역에 없어서는 안 될...
1362,2017.12.01.,"문재인 대통령 “재벌대기업 중심 경제, 미래를 보장하지 못해”","오후 서울 영동대로 코엑스에서 열린 ‘중소벤처기업부 출범식’에서 언급한 발언의 일부다. 문재인... 경제성장의 혜택이 골목상권으로, 전통시장으로, 가계로 퍼져나가도록 하겠습니다. 중소벤처기업부의 첫 출발을..."
1363,2017.12.13.,"사통팔달 교통망 확충, 속초서 이달 22일 ‘양우내안애 오션스카이’ 상륙 예...",사업지인 속초 지역은 서울-속초간 90분 시대가 개막된 가운데 춘천-속초 고속화철도도 개통 예정으로... 속초 고속버스 터미널 최인접 단지로써 이마트 및 터미널 인접 상권 형성을 바탕으로 우수한 정주여건이...
1364,2017.12.05.,트리플 생활권 누리는 부천 옥길지구… 옥길동 ‘호반베르디움’,"시흥 IC, 안현 JC를 통해 서울외곽순환, 제2경인고속으로의 진입이 가능해 부천 로데오거리, 인천시청, 광명역, 구로역 등 대형 쇼핑몰과 상권, 업무지구가 밀집한 지역을 모두 차량으로 20분 내외로 이동 가능하다...."
1365,2017.12.06.,"계명문화대, 벤처창업대전에서 우수대학으로 선정",30일 서울 코엑스에서 개최된 벤처창업대전에서 창업우수성을 인정받아 ‘중소벤처기업부 장관상’을... 골목상권으로 급부상하고 있다. 계명문화대 산학협력단 김윤갑 단장은 “그동안 우리대학교가 지역사회에...
1366,2017.12.16.,"코스트코 회장 ""한국서 장사 너무 잘돼 '눈물' 날 정도로 좋다""","이후 코스트코 측은 상권 영향평가서 및 지역협력 계획서를 보완해 세종시에 제출했고, 지난해 6월 개설... 실제로 전 세계 코스트코 매장 중 가장 매출이 높은 지점은 코스트코 서울 양재점인 것으로 알려졌다. 세네갈..."
1367,2017.12.04.,"현대백화점, 남성복·패딩이 실적견인...목표가↑-대신",[서울경제] 대신증권은 4일 현대백화점(069960)의 4·4분기 실적은 남성복과 패딩이 견인하며 내년에는... 현대백화점은 올해 경쟁사가 대규모 출점해 동일 상권의 점포가 피해를 입으면서 밸류에이션(시장평가...
1368,2017.12.02.,안양 센트럴 헤센 주거복합단지 내 상가 탄탄한 고정수요로 인기,[스포츠서울 김수지기자] 최근 상가에 관심 있는 수요자들이라면 주거복합단지 내 상가를 노려볼 필요가... 또 대규모로 조성되기 때문에 빠른 상권 활성화가 가능하다. 업계 관계자는 “대규모 고정 수요를 확보한...
1369,2017.12.12.,초역세권 생활형숙박시설‘야당역 케이힐스더테라스’분양,"이용으로 서울·수도권 접근성이 양호하다. 또한, 야당역을 중심으로 활발하게 형성되는 운정신도시 중심상권의 풍부한 생활편의시설 이용이 가능하며, 이마트, 메가박스, 홈플러스 등 편의시설이 근거리에 위치해..."
1370,2017.12.07.,12월 2주 '가 볼만한 곳' 추천,12월 7일 목요일 ■ 서울디자인페스티벌 2017 (장소 : 서울시 강남구 코엑스 1층 B홀) 12월 7일부터... 축제는 부산 광복동의 상권 활성화에 기여하는 등 성공 축제로 평가받고 있는 '부산...
1371,2017.12.08.,"‘인기명’, 신규 오픈과 함께 하남 맛집으로 눈길","해당 매장은 서울 강동구 상일동에 있어 다세대의 아파트 및 마트, 삼성엔지니어링 글로벌센터와 강동 첨단업무단지 등이 밀집되어 있는 부근으로 직장인들과 주민들이 많은 상권에 위치하고 있다. 상권 특성에 맞게 큰..."
1372,2017.12.11.,[한경 매물마당] 동탄신도시 수익형 1·2층 은행 상가 등 16건,"◆서울 강남구 대로변 중심상권 수익 및 사옥용 빌딩=역 도보 2분 대지 600㎡, 연면적 2500㎡. 안정적인 임차수요 및 시세 차익 예상되는 지역. 보증금 10억원, 월 5500만원에 공실 없이 운영 중. 사정상 급매...."
1373,2017.12.12.,국내 연예계·스포츠 스타가 좋아하는 부동산은,상권 형성도 이뤄지지 않은 상태였습니다.그는 빌딩 매입 후 건물에 스타벅스를 입점시켜 투자금액 대비 연 8... 키 테넌트 교체가 얼마나 중요한가를 보여주는 사례입니다.송승헌은 서울 서초구청 주변 빌딩을 매입한 후...
1374,2017.12.01.,[주목! 이 단지] 진주혁신도시 첫 스트리트형 상가 '중흥S-클래스 애비뉴',"증가시켜 상권 활성화에도 도움을 준다. 한 상가 부동산시장 전문가는 ""스트리트형 상가의 경우 일반... 실제로 지난 2월 롯데건설이 서울 금천구에서 선보인 스트리트형 상가 '마르쉐도르 960'은 청약 당시 최고 304대 1..."
1375,2017.12.08.,세종파라곤상가 푸드존 특별분양,[서울신문] 유럽풍의 프리미엄 주거복합단지인 세종파라곤상가 내 푸드존이 특별분양한다.... 특히 관계자에 따르면 단순히 분양으로 끝나는 것이 아닌 중개 법인과 브랜드 유치 연계를 통해 상권을 조기 활성화하고...
1376,2017.12.13.,"들러붙는 호객꾼, 떨어지는 상권","계산택지 한 공인중개사는 ""상권 포화로 3층 이상부터 공실률이 높으니 노래주점, 안마방 등만 차지하고 있다""며 ""교통 인프라가 좋은 계양구는 가깝게는 부천·김포 멀리는 서울까지 소비자 유출이 심각하다""고..."
1377,2017.12.04.,교통 요충지·재개발… ‘강북 거점도시’ 속도 내는 청량리역세권,일대 상권 및 문화가 활성화되면서 발전의 축이 형성된다”고 말했다. 청량리 4구역 인근에서는 서울 내 가장 규모가 큰 시장 정비사업인 청량리 동부청과시장도 변신을 준비 중이다. 2021년까지 사업이 완료되면...
1378,2017.12.07.,"사드에 덴 동대문…박서원, 두타몰 탈바꿈 ""내수고객 모셔라""",中관광객에서 무게중심 이동 키즈카페 오픈 ·노브랜드 입점 가족단위 쇼핑 편의시설 변신 서울 동대문... 중국인 관광객 대상 영업이 주를 이루는 동대문 상권은 올해 사드 직격탄을 맞았다. 중국 정부가 한국 단체관광...
1379,2017.12.11.,대형병원 수요 품은 상가 분양 잇따라,또한 병원이 들어서면 자연스레 유동인구가 늘어나고 상권활성화도 빠르게 진행된다. 실제로 병원이 들어선 후 상가의 자산가치가 올라간 사례도 있다. 서울 서대문구 대신동에 위치한 가든빌딩은 2005년 4월 개원한...
1380,2017.12.04.,"올리브영 명동점 리뉴얼, 다국적 명동 상권 공략",사진제공｜올리브영 H&amp;B 스토어 브랜드 올리브영은 외국인 관광객이 많이 찾는 서울 명동점을 ‘라이프스타일 트렌드 큐레이션 스토어’로 리뉴얼했다. 외국인 관광객이 많이 찾는 매장 특성을 반영해 강북 쇼핑의...
1381,2017.12.02.,경제학으로 보는 골목길의 미래,"서울의 홍대,성수동,이태원,삼청동 등의 골목길이 특유의 문화적 자원을 바탕으로 핫플레이스로 부활했지만... 저자는 골목상권의 생존력을 ‘장인 공동체 구성’이라고 밝히며 건물주와 상인은 같은 배를 탄 운명..."
1382,2017.12.11.,"「로이드」 홍대 매장 오픈, 신규 10개점 추가로 연다","이랜드월드(대표 정수정)에서 전개하는 주얼리 브랜드 「로이드」가 서울 마포구 홍대입구역 8번 출구... 이 브랜드 관계자는 ""홍대 지역 상권의 장점을 살려 단순히 주얼리만 판매하는 공간이 아닌 체험형 문화..."
1383,2017.12.01.,최고의 입지조건 자랑하는 서초구 반포동… ‘반포리체’,"고속터미널역 가까이로 신세계백화점과 뉴코아아울렛, 파미에스테이션 등 상권이 잘 발달해 있고 가톨릭 대학교 서울 성모병원과 서울 법조 타운이 가까워, 단지 주위에서 쇼핑, 여가, 고급 의료 서비스..."
1384,2017.12.10.,[한경 매물마당] 성북구 대로변 초역세권 상가 빌딩 등 17건,"(02)511-3390 강남 리얼티코리아 유진석 ◆서울 강남구 역세권 빌딩=역삼동 중심상권 상업·판매시설 집중지역 대지 562㎡, 연면적 1710㎡의 내외관 수려한 준신축 6층 건물. 주차 편리. 보증금 5억원, 월..."
1385,2017.12.14.,"송혜교 송중기 부부, 110평 단독주택 신혼집 알고보니… '부러워'","송중기는 지난 1월 서울 용산구 이태원의 단독주택을 구입했다. 3층 규모의 이 주택은 602㎡(182평) 대지에... 때문에 상권이 화려한 지역보다 조용하고 아늑하고 '그들만의 리그지역'으로 만들어지는 것으로 보고 있다""고..."
1386,2017.12.11.,"탈바꿈한 폐철길, 지역상권 부활 도와",이처럼 폐선된 철길에 조성된 공원을 중심으로 형성된 상권에는 자연환경을 바탕으로 특색있는 카페나 레스토랑이 들어서 있어 젊은 층에게 ‘핫 플레이스’로 떠오고 있다. 서울 노원구 공릉동에 위치한...
1387,2017.12.14.,청주 테크노폴리스 수혜 톡톡히 누리는 ‘청주 테크노폴리스 지웰’ 관심 집중,"테크노폴리스 중심상권이 인접해 있다. 차량 5분 거리 이내에 현대백화점, 롯데아울렛 등이 위치하며... 2022년 개통 예정인 천안~청주공항 복선전철사업이 확정되면서 북청주역(가칭)의 신설이 완료되면 서울역까지..."
1388,2017.12.19.,"'영종 힐스테이트',영종도와 청라 잇는 제3연륙교 수혜 기대로 화제","인근 상권과 생활인프라가 빠르게 발전할 것으로 예상된다. 또한 단지는 직주근접의 장점도 누릴 수 있다. 스테츠칩팩코리아, 파라다이스시티, 씨사이드파크, BMW드라이빙센터 등이 차량 20분 거리에 위치해 있고 서울역..."
1389,2017.12.06.,[르포] ‘저축은행·대부업 성지’ 선릉역을 가다,"서울에 금융 중심지가 3곳 있다. 여의도와 명동, 그리고 선릉이다. 여의도는 은행·증권 등 금융기관은 물론... 선릉역은 직장인 상권이 특히 발달한 지역이다. 직장인 하루 유동인구가 40만명 이상으로 한때 국내 2위를..."
1390,2017.12.06.,"대형유통사, '중소기업 제품→ PB 전환' 금지","김상조 공정거래위원장(가운데)이 지난달 29일 서울 중구 대한상공회의소에서 유통업계 대표들과 간담회를... 납품업체·골목상권과의 상생협력 자율 실천방안'을 발표했다. 간담회에는 체인스토어협회, 백화점협회..."
1391,2017.12.15.,"영천시, 완산동 일대 '도시재생 뉴딜 공모사업' 선정","국토교통부는 지난 14일 정부서울청사에서 이낙연 국무총리 주재로 도시재생특별위원회를 개최하고... 주요 사업은 지역의 역사, 문화, 유휴자원을 활용한 원 도심 지역상권 활성화 사업, 중심기능 및 정체성 강화..."
1392,2017.12.01.,분당구 백현동 `판교푸르지오그랑블` 11월 월세 거래가는?,"주요 업무지구로 출퇴근이 편리할 뿐만 아니라, 역을 중심으로 각종 편의시설이 들어서 상권을 형성하기... 차량으로 경부고속도로, 서울 외곽 순환 고속도로 등에 진입이 수월하여 서울, 수도권까지 이동이 편리하다...."
1393,2017.12.01.,“진안군 인구 감소 50년 만에 멈췄다!,특히 올해 4월부터는 서울 가락시장의 지자체 농산물 홍보관에 진안군 35개 업체가 입점해 진안군 농산물의... 이를 통해 지역 상권을 활성화하겠습니다. 지역 주민이 생산한 진안고원 청정 농특산물이 잘 팔릴 수...
1394,2017.12.11.,탄탄한 공공기관 배후수요 갖춘 ‘진주혁신도시 중흥S-클래스 센트럴에비뉴’...,수변상권을 아우르는 지역 명소로도 발돋움 할 전망이다. 한편 ‘진주혁신도시 중흥S-클래스 센트럴에비뉴’ 분양홍보관은 경남 진주시 충무공동 31-7번지에 위치한다. /김동호 기자 dongho@sedaily.com [서울경제 바로가기]...
1395,2017.12.01.,문 대통령 “불공정한 중소기업 환경 해결해야”,"문 대통령은 이날 오후 서울 코엑스에서 홍종학 장관 등이 참석한 가운데 열린 중소벤처기업부 출범식에... 골목상권으로,전통시장으로,가계로 퍼져 나가도록 하겠다”고 약속했다. 문 대통령은 이 자리에서 “무엇보다도..."
1396,2017.12.06.,CMB-KT 동등결합 상품 업무협약 체결,"▶ 이민정 기자 / CMB충청방송 네, 오늘 오전 서울 KT 광화문 빌딩에서 CMB와 KT의 동등결합 상품 업무협약식이... CMB 권역에 속한 KT IPTV 가입자들에게 지역 광고를 제공함으로써 지역상권 활성화에 기여했고, 침체된..."
1397,2017.12.01.,"부천 옥길, 수도권 서남부권 유통 중심지 된다","수도권 서남부권 쇼핑특구로 자리매김 - 이마트타운 방문객으로 새로운 수도권 서남부 중심상권 옥길지구에 형성 예상 [서울경제] 부천, 광명, 시흥 등 수도권 서남부권 유통 흐름이 바뀌고 있다. 기존까지는 광명역..."
1398,2017.12.06.,"강동구, 천호동 로데오거리 약 280m 구간 LED조명으로 은하수길 조성","천호동 은하수길 (서울=국제뉴스) 김성민 기자 = 강동구(구청장 이해식)가 연말을 맞아 천호동 로데오거리를... 많은 방문객들이 로데오거리를 찾도록 유도함으로써 지역상권 활성화에도 기여할 것으로 기대된다""고 말했다."
1399,2017.12.13.,"불평등 사회·경제 조사연구 포럼, ‘젠트리피케이션’ 국회토론회 개최",(서울=NSP통신) 강은태 기자 = 기존 지역의 상권이 활성화되면서 발생하는 임대료 폭등 등으로 창의적 예술가와 소상공인 및 건물주의 갈등을 해결하기 위한 ‘젠트리피케이션’ 국회 토론회가 개최된다. 정동영...
1400,2017.12.01.,"‘광명역 어반브릭스’ 분양, 광명역세권 개발호재 다양해","서울-광명간 고속도로(예정), 신안산선(예정), 월곶-판교선 복선전철(예정) 등도 개발이 예정돼 개통 시... 광역 상권 형성도 기대된다. 광명역어반브릭스 판매시설은 약 300m의 스트리트형 구조의 설계를 통해 집객..."
1401,2017.12.04.,인프라 뛰어난 백현동 ‘판교푸르지오그랑블’ 12월 매물 시세는?,"뿐만 아니라 경부고속, 용인서울고속도로 진입이 쉬워 주변 경기지역 이동도 빠르게 가능하다. 현대백화점이 역 바로 옆에 위치해 이용하기 좋고, 상권이 잘 발달된 서현동과도 멀지 않아 생활하기 편하다. 보평초..."
1402,2017.12.04.,"역세권,배후수요 갖춘 ‘이천부발역 리슈빌 상가’ 주목",지하철은 기존의 열악한 교통여건을 개선해 유동인구 및 임대수요가 풍부해져 상권이 활성화되기 쉽다. 이렇다 보니 실제로 분양시장에서 역세권 상가들은 큰 인기를 얻었다. 지난 8월 SK건설이 서울 공덕동에서...
1403,2017.12.06.,"비즈니스의 경쟁력을 높혀라, 업무 효율 극대화시킨 '다산신도시 블루웨일'","또한 서울 및 외곽지역 이동이 편리함은 물론 실별 발코니를 제공하는 등 업무 효율성을 높여줄 장점을... 현대프리미엄아울렛(예정) 바로 앞 상권에 위치해 패션, F&amp;B, 라이프, 금융, 메디컬 등 조닝별 MD 구성을 갖춘..."
1404,2017.12.10.,맹추위 이겨낸 열정…동해바다 가르며 새출발 다짐,"추운 날씨에도 불구하고 대구·경북에서 650여 명의 인간 돌고래가 출전했고, 서울과 포천 등 수도권에서도... 지국현 대구일보 이사는 개회식 인사말을 통해 돌고래 수영대회 참가자와 관람객이 매년 늘면서 지역 상권..."
1405,2017.12.11.,전통시장 ‘사면초가’… 생존 몸부림,"“요즘은 대형마트보단 중대형 마트들이 골목상권에 침투하고 있어, 전통시장도 변해야만 살아남을 수... 이 시장은 인천뿐 아니라 서울·경기 지역에서 찾아오는 젊은 고객들을 늘리기 위해 지난 6월부터 매주 금요일과..."
1406,2017.12.06.,강동구 “로데오거리에서 은하수길 걸어요”,-거리 곳곳 LED조명 장식 서울 강동구(구청장 이해식)는 연말을 맞아 내년 4월까지 천호동 로데오거리를... 구 관계자는 “은하수길이 천호동 로데오거리에 활력을 실어주며 상권 활성화에도 도움주길 바란다”고...
1407,2017.12.16.,"관악구, 샤로수 길 창의적 디자인 간판 교체사업 마무리",서울 관악구는 '샤로수 길' 내 낡은 간판 20개를 대상으로 추진한 '개성있는 간판 조성사업'을 최근... 구는 관광 명소로 주목받는 샤로수 길의 도시미관을 정비하고 지역 상권을 활성화 하고자 샤로수...
1408,2017.12.06.,영화 [7호실]에 비친 우리의 맨얼굴,조선족 캐릭터를 다루는 풍부한 결 영화는 서울 압구정동 로데오거리의 몰락한 상권을 간신히 지탱하고 있는 ‘을들의 분투’를 다룬다. 한국은 ‘사장님의 나라’다. 전체 취업자 중 자영업자가 26.8%로 넷 중 한...
1409,2017.12.10.,[특별인터뷰] 한·중·미 공동번영 포럼 여는 안병용 경기 의정부시장,"장암 아일랜드 캐슬 조기 개장을 유도하고, 지역선도시장 육성사업을 통해 지역상권의 균형적인 성장을... 서울과 인접해 주거기능 위주의 개발에만 편중돼 베드타운으로 형성됐다. 이 때문에 지속가능한 자족기능..."
1410,2017.12.05.,"계명문화대, 벤처창업대전에서 우수대학으로 선정",(대구=NSP통신) 김을규 기자 = 계명문화대학교 산학협력단이 지난달 30일 서울 코엑스에서 개최된... 골목상권으로 급부상하고 있다. 계명문화대학교 산학협력단 김윤갑 단장은 “그동안 우리대학교가 지역사회에...
1411,2017.12.15.,"[전통시장이 살면, 한국이 산다] ⓹경기 수원남문시장연합 vs 청주 육거리 종...","이 지역은 청주 지역에서 가장 번화한 거리로, 청주 상권의 중심지이기도 했다. 서울로 치면 명동과 강남역과 같은 곳이다. 시장을 방문한 한 관광객은 ""손님과 관광객이 찾아오고 싶은 재래시장을 만든 것 같다""며..."
1412,2017.12.01.,"포털 규제 놓고 국회서 `공방`…""포털 영향력 크다"" vs ""역차별 우려""","골목상권을 침해한다는 등의 문제가 제기된다면 포털사에서도 책임지는 게 맞다""며 ""역차별 문제에 대해서는... 김현경 서울과기대 교수는 ""대표적인 포털 규제 법안인 '뉴노멀법'은 헌법상 '평등의 원칙' '비례성 원칙'을..."
1413,2017.12.01.,화천 군민들 “우리는 이외수 강제퇴출을 원한다”,"서울에서 거나하게 기념회나 팬싸인회 하고, 여하간 여기서는 한번도 한 적이 없어. 자기가 약속한... 이외수는 다목리 상권에 아무 도움이 안되는데... (그러니까 주민들이 불만을 터뜨리는 거지)""     편의점 앞에서..."
1414,2017.12.06.,"“아침마다 출근 전쟁, 김치찌개 한 끼에 8000원”",출근시간대 서울 강남의 도로보다 더 막힌다는 게 최 사무관의 설명이다. 세종시에서 만난 공무원들은... “아직 상권이 제대로 형성돼 있지 않아 상인들 손해도 만만치 않은 상황”이라고 설명했다. 세종시청 관계자는...
1415,2017.12.01.,태영건설 ‘광명역 어반브릭스’ 12월 1일 견본주택 오픈,"교통, 상권의 중심으로 개발호재도 풍부하다. 우선 KTX광명역, 지하철 1호선 등이 정차하는데다 지난해 강남순환고속도로가 광명역에서 강남까지 1차 개통됐다. 서울-광명간 고속도로(예정), 신안산선(예정) 및 월곶..."
1416,2017.12.14.,경기 북부 테크노밸리에 구리시 선정...'구리갈매1차 대방디엠시티' 오피스텔...,"차이로 서울 접근성이 매우 뛰어나다. 구리갈매 대방디엠시티에 많은 관심이 쏠리는 이유는 총 356실 대규모 오피스텔의 수요와 더불어, 후면 모다아울렛 방문객과 우측 상권의 유동인구를 흡수할 수 있어..."
1417,2017.12.02.,안양 센트럴 헤센 주거복합단지 내 상가..탄탄한 고정수요로 '인기',안정적 투자가능 소비력 왕성한 1인 가구 2030세대의 고정수요 확보에도 유리 [서울경제] 최근 상가에 관심... 또 대규모로 조성되기 때문에 빠른 상권 활성화가 가능하다.   업계 관계자는 “대규모 고정 수요를...
1418,2017.12.12.,부동산 시장에 부는 규모의 경제학··· 국내 최대 지식산업센터 금강주택 ‘...,- 대규모 부동산 중심으로 발달하는 지역상권… 랜드마크로 자리매김 미래가치 高 - 금강주택… 연면적 6.3빌딩 1.5배에 달하는 국내최대규모 지식산업센터 선보여 [서울경제] 부동산 시장에 규모의 경제학 바람이 불고...
1419,2017.12.12.,"소상공인·농어민·중기 ""새로운 사회적 유통시스템 모색""","이 자리에 참석한 최재섭 남서울대 교수는 '사회적 유통시스템 구상과 제안'이라는 주제로 발표했다. 최... 골목상권까지 지배하며 자영업자들의 생존권을 위협하는 현상이 발생했다""고 설명했다. 그러면서 ""이 같은 문제가..."
1420,2017.12.05.,"대구 중구청, 젠트리피케이션 방지 조례 제정 추진","서울시를 비롯해 서울시 성동구·중구 등에 조례가 이미 마련, 시행 중이다. 조례에는 분쟁 발생 시 신속한 권리구제 지원, 상권 유지 발전을 위한 지원책 등이 포함돼야 효과를 거둘 것으로 보인다. 이 밖에도..."
1421,2017.12.04.,[Scene # City]1980년대 ‘혼수 예물’ 중심지… 중저가 패션 주얼리 뜨며 휘...,끼쳐… 서울형 특화산업 지정 부활 꿈꿔 3일 서울 종로귀금속보석거리의 한산한 모습(위 사진). 큰길가에는... 늘며 상권이 흩어졌다. 외환위기를 거치며 경기침체도 영향을 미쳤다. ‘작은 결혼식’ 바람이 불며...
1422,2017.12.07.,"쫄깃달콤한 과육 맛보러 ""곧 감""","지난해에는 영동읍 난계국악당에서 축제를 열었지만 올해는 주민 편의와 접근성, 골목상권 회복을 위해... 연계행사로 부산역과 서울 용산역에서 각각 8개 지역 농가가 참여해 대도시 소비자에게 영동곶감을 판매하는..."
1423,2017.12.03.,"[머니+ 성공창업, 상권을 보라]프랜차이즈 교육에 주목하라",이어져 [서울경제] 최근 예비창업자 상담을 하면서 가장 많이 듣는 질문이 있다. “가맹점 교육이 왜 이렇게... [서울경제 바로가기]1997년 이래 대한민국 최고의 과학자 DB [바로가기▶]서울경제의 모든 연재물!... 서경Cube...
1424,2017.12.15.,'차별화'된 매장으로 '고객몰이'… '출점 절벽' 대형마트에 새로운 활로,"이마트가 1993년 서울 도봉구 창동에 국내 최초로 대형마트를 연 이후 점포 수가 감소한 것은 올해가... 많은 상권 특성에 맞춰 교육, 문화, 체험 중심 쇼핑몰로 꾸몄다. 대형마트는 출점 제한, 월 2회 의무휴업 등..."
1425,2017.12.10.,"남성청결제 '재클린', 올리브영 입점 기념 이벤트","엑스컴퍼니 관계자는 ""재클린이 서울 명동 본점과 가로수길 중앙점에 입점함으로써 서울과 부산에서 가장 핫한 대표 상권에 입점할 수 있게 됐다""며 ""청결과 피부 관리에 신경을 쓰는 그루밍족의..."
1426,2017.12.05.,애플스토어 오픈하면 이통사 아이폰 개통행사 사라질까,"김위수 기자 wikiwiti@ajunews.com &lt;yonhap photo-3056=""""&gt;지난달 22일 서울 강남구 신사동 가로수길의 국내 첫... 골목상권을 침해라며 반발하고 있는 상태다. 이 상황에서 애플까지 이통유통시장에 진출하게 된다면 피해가 막심할..."
1427,2017.12.05.,"한강 조망, 녹지환경, 교통 우수… 금호동 ‘서울숲푸르지오2차’ 매물 부족","대형 상권이 모여 있는 압구정, 고속터미널, 건대입구, 왕십리역이 차량으로 10분 이내의 거리에 있어, 신세계백화점, 롯데백화점, 현대백화점, 엔터식스몰 등 대형 쇼핑몰을 입맛에 따라 이용할 수 있고, 주변에 서울..."
1428,2017.12.05.,‘사람 우선’ 인식전환·환경개선 필요,주변 상권 활성화와 보행환경을 모두 고려한 계획이 수립돼야 한다”고 말했다. 박 교수는 서울시가 지난 2012년부터 추진하고 있는 ‘보행친화도시 조성 사업‘을 벤치마킹할 수 있는 사례로 꼽았다. 서울시는 2020년까지...
