,date,title,contents
950,2017.11.12.,유커의 귀환…기대 부푼 명동 상권,'유커'(遊客)로 불리는 중국인 단체 관광객이 돌아오기를 기대하는 서울 명동 매장들은 휴일인 12일 저마다 문 앞에 중국어로 안내하는 간판을 준비하는 등 한껏 기대를 하고 있다. 2017.11.12 kimsdoo@yna.co.kr...
951,2017.11.17.,"떠오르는 홍대·합정상권 속 숨은 진주 찾기, ‘딜라이트 스퀘어’ 주목",한국감정원 임대동향 상업용부동산 자료에 따르면 서울특별시 홍대·합정상권 집합상가의 투자수익률이 2017년 1분기 최고치로 나타났다. 실제로 2017년 1분기 홍대·합정상권의 집합상가 투자수익률은 3.04%로 서울...
952,2017.11.20.,"요거프레소, 탄탄한 디저트 음료 라인이 창업비용 낮춰","사람들이 모이는 서울의 일명 '황금상권'의 3.3㎡당 임대료는 최소 30~50만원 선이다. 특히 커피 프랜차이즈 창업은 대학가와 역세권, 오피스상권을 중심으로 이뤄지고 있는데, 이 같은 대형 상권일수록 임대료 부담은..."
953,2017.11.20.,‘압구정 로데오’ 재도약 꿈틀… 옛 명성 되찾나,"(사진=강남구) 서울 강남구가 압구정 로데오 거리의 르네상스를 열기 위해 올 초부터 주민과 힘을 합쳐 상권 활성화 사업을 추진하고 있다. 20일 강구에 따르면 구는 동 주민센터와 건물주, 입점 상인, 지역 주민, 다양한..."
954,2017.11.21.,"정치권, 옆 지역 상권 몰아내기...""도 넘은 이익집단 보호""",인천과 부천의 접경지대인 이 지역에 대형상권이 들어설 경우 지역구 내 소비 인구가 빠져나갈 것으로 본... 신세계 복합쇼핑몰이 들어설 예정이었던 부천 상동 지역은 서울외곽순환도로를 끼고 있어 부지 자체는...
955,2017.11.20.,2000여 은행원 거리 나앉은 날 … 인천의 돈 타지로 흘렀다,"시중은행은 돈이 전부 서울로 빠져 나가잖아. 그래서 인천이 배고픈 거야. 힘든거야."" 그는 사회적기업... 지역 상권을 분석하고, ‘남의 집 살이’ 하던 기업에 제 집 마련을 돕고 이제는 무료 반찬도 지원하고…. 하루도..."
956,2017.11.22.,"양우건설, 12월 초고층 주상복합 아파트 ‘양우내안애 오션스카이’ 분양",사업지인 속초는 지난 6월 30일 서울-양양고속도로 전구간이 개통되며 서울-속초간 90분 시대를 열었다. 춘천... 속초 고속버스터미널 최인접 단지로 이마트 및 터미널 인접 상권 형성을 기반으로 우수한 정주여건이...
957,2017.11.19.,"전남도의회 4명 의원, 매니페스토 약속대상 수상 쾌거","김태균 의원(광양2)은 광양시 항만 기업유치 방안과 문화예술분야 지원 방안을 마련하고, 전라남도 상권... 이번에 선정된 수상자에 대한 시상식은 12월 13일 서울 영등포아트홀에서 개최될 예정이다. 한편..."
958,2017.11.17.,희소가치 누린다.. 역세권 수익형부동산 선호도 상승,[서울경제] 갈수록 강화되는 부동산대책 및 규제로 인해 갈 곳 잃은 투자자들이 주택시장 대신... 광역 상권 형성 기대감도 높다. 섹션오피스는 호실 조합을 통해 맞춤형 공간으로 꾸밀 수 있어 기업부터 소규모...
959,2017.11.17.,깐깐해지는 대출로 인한 수익형 부동산 투자 고민… ‘잠실 포레디움’ 관심 ...,"잠실 '포레디움'이 위치하게 될 서울 잠실 일대는 강남의 주요 교통망과 편의시설들이 집중되어 있어... 특히, 이러한 대규모 개발사업의 순항이 이뤄짐에 따라, 잠실 일대는 각종 상권 및 주거 단지가 활발히 형성되고..."
960,2017.11.16.,'가을의 전설' 깊은 만추 속으로 떠나는 대전 세종 손바닥 여행,com [대전·세종=글·사진 스포츠서울 황철훈기자]전국이 완벽한 만산홍엽 속에 갇힌 지난주. 대한민국의... 특히 대전역과 도청을 중심으로 상권이 발달하면서 이 일대는 대전에서 최고의 번화가가 됐다. 대흥동...
961,2017.11.19.,[한경 매물마당] 역삼동 수익형 꼬마빌딩 등 16건,"(02)533-8339 강남 스카이 허봉환 ◆서울 논현동 영동시장 먹자상권 빌딩=대지 212㎡, 연면적 250㎡의 지하 1층~지상 3층 건물. 24시간 유동인구 풍부한 한신포차 인근 상권 중심가로 보증금 3억원, 월세 1200만원에..."
962,2017.11.08.,"소상공인 ""대기업, 건자재 도소매까지 진출하지 마라""",오전 서울 여의도 중소기업중앙회에서 긴급 기자회견을 열고 유진그룹의 산업용재·건자재 도소매업 진출에 대해 비판하고 있다. 중소기업중앙회 제공. 대기업이 골목상권 침투에 이어 건자재 도소매업까지 진출을...
963,2017.11.22.,빈티지 마을은 어떤 디자인으로 부가가치가 높아졌나 낡은 것에 대한 익숙함,"서울의 인구가 줄어들기 시작했고, 뉴타운 같은 개발 사업을 진행해봤자 더 이상 발생할 수요가 없다는... 해방촌과 망원동에 젊은이들이 몰리고 상권이 커지는 핵심적인 이유는 ‘낡음 그 자체’에 있는 게 아니다...."
964,2017.11.20.,국민의당 바른정당과 통합 21일 끝장 토론,"이 의원의 이같은 발언은 박 전 대표가 안 대표가 추진하는 바른정당과의 통합에 대해서 ""골목상권 2개가... 20여명이 참여하고, 궁극적으로 40여명 전부가 함께하게 될 것으로 생각한다""고 말했다. /서울=김영묵기자"
965,2017.11.13.,대학캠퍼스 조성에 부동산 ‘들썩’… 분양권 웃돈 2배나,"서울대 시흥캠퍼스 21일 선포식 배곧신도시 분양권 웃돈 '껑충' 성균관대도 평택 브레인시티에 대규모... 부동산 업계 관계자는 ""대학 캠퍼스가 조성되면 유동인구 증가는 물론 상권이 확대됨에 따라 인근 부동산 시장에..."
966,2017.11.09.,"김동연 “최저임금 인상, 우리 경제 뿌리내리도록 모든 노력 다할 것”(전문)","△김동연 부총리 겸 기획재정부 장관이 9일 서울 영등포구 은행로 한국수출입은행 본점에서 열린... 둘째, 200만 임차상인 및 골목상권을 보호하기 위한 3대 패키지 프로그램을 추진할 계획입니다. 임대차계약의 90% 이상이..."
967,2017.11.19.,"[르포] ‘유커’의 귀환...""명동 상가 권리금 1억 올라""",한한령(限韓令)으로 인해 매출이 반토막으로 떨어졌던 서울 중구 명동 상권이 최근 사드(THAAD·고고도방어미사일체계)를 둘러싼 한·중 간 화해 분위기에 다시 기지개를 켜고 있다. ◆ 권리금 없이 내놓던 점포...
968,2017.11.20.,"산업단지 인근 상가, 풍부한 배후수요와 주거 수요로 ‘인기’","[서울신문 나우뉴스] 입주 기업 배후수요를 갖춘 산업단지 주변 상가에 수요자의 관심이 쏠리고 있다.... 일대 상권이 활발해진 케이스다. 넥슨코리아, 카카오게임즈, NHN엔터테인먼트, 네오위즈, SK플래닛, 포스코ICT 등..."
969,2017.11.19.,"도봉구, 한글문화거리 · 평화문화진지 명소화 박차",이뿐만 아니라 구는 2016년 11월 '서울시 도봉구 지역상권 상생협력에 관한 조례'를 제정해 건물주가 임대료를 낮출 경우 행정·재정적 지원을 할 수 있는 법적 토대를 마련하기도 했다.   ■ 방학천변...
970,2017.11.19.,"도봉구, 한글문화거리 · 평화문화진지 명소화 박차",이뿐만 아니라 구는 2016년 11월 '서울시 도봉구 지역상권 상생협력에 관한 조례'를 제정해 건물주가 임대료를 낮출 경우 행정·재정적 지원을 할 수 있는 법적 토대를 마련하기도 했다.   ■ 방학천변...
971,2017.11.18.,"내년 양도소득세 중과, 예비창업자들 '인테리어 사업'에 눈길","양도세율 가산 때문인데 서울 전역과 경기도 7개 시, 세종ㆍ부산 일부 등 40개 시ㆍ군ㆍ구의 2주택자는 앞으로... 입지와 상권에 구애를 받지 않고, 소자본 투자 안정 창업 할 수 있는 리테리어가 관심을 끌고 있다...."
972,2017.11.14.,"""유커가 온다""…가라앉던 상권도 들썩","“중국 관광객은 하다못해 연필 한 자루라도 사 가는데, 상인들이 반길 수밖에 없죠.” 고고도 미사일 방어체계(THAAD·사드)로 경직됐던 한국과 중국 간 갈등이 완화할 조짐을 보이면서 서울 주요 지역 상권이 ‘중국..."
973,2017.11.16.,"거제시 투자설명회 성료, 해양신도시 '거제빅아일랜드' 사업 눈길",-권민호 거제시장…거제빅아일랜드 등 거제시 전략사업에 투자독려 거제빅아일랜드 서울시 강남구 강남구... 복합적인 상권의 장점과 많은 유동인구가 예상되기 때문에 그 미래가치에 대한 투자자들의 문의가...
974,2017.11.19.,"한성대학교 스마트융합컨설팅학, 석박사 과정 2018년 신입생 모집",본문 이미지 영역 한성대학교 지식서비스&amp;컨설팅대학원은 서울지역에서 중소벤처기업부의 지원을 받는 컨설팅대학원으로 프랜차이즈 분야에서는 ▲ FC전략 컨설팅방법론 연구 ▲ FC마케팅/상권분석 및 매출예측...
975,2017.11.07.,현대백화점 판교점에 명품 브랜드 `까르띠에` 문 열어,"이로써 현대백화점 판교점은 서울 강남 수준의 명품 라인업을 구성하게 됐다. 현재 판교점은 루이비통... 판교점이 위치한 분당 상권이 소득 수준이 높은 30~40대 젊은 고객이 많아 명품 소비가 활발한데다, 최근 교통..."
976,2017.11.14.,[특집 | 국내 기업 역차별] 규제는 피하고 로열티만 쏙!,홍 의원 등은 문재인 대통령의 대선공약 가운데 하나인 ‘골목상권 보호’를 내세우며 관련 규제 강화를... 하지만 신세계는 커피전문점의 성장 가능성을 내다보고 100억 원을 투자해 1999년 서울 서대문구 이화여대 앞에...
977,2017.11.15.,박윤희 전 고양시의장 시장출마 기자회견,"지역상권 하락, 교통문제 등의 다양한 내적 문제가 심화돼 왔다고 지적했다. 특히 경기도 내 수원, 성남... 또 박 전 의장은 경쟁력을 잃고 서울의 위성도시로 전락하는 위기에서 고양시를 일으켜 세우기 위해, 절망 위기..."
978,2017.11.22.,"'공룡 中企' 더본코리아·다이소, 홍종학 타깃되나",(서울=연합인포맥스) 변명섭 기자 = 홍종학 중소벤처기업부 장관이 공식 취임하면서 그동안 골목상권 침해 논란을 빚었던 더본코리아와 다이소 등 이른바 '공룡 중소기업'이 바짝 긴장하고 있다. 공룡 중소기업들은...
979,2017.11.06.,광주은행 소상공인 위해 6억 출연,"[서울경제] 송종욱(왼쪽) 광주은행장, 박종광 광주신용보증재단 이사장이 6일 광주 동구 대인동 광주은행... 이번 특별출연은 올해 초 ‘골목상권·전통시장 특례보증 금융지원 특별출연’ 5억원에 이어 두 번째..."
980,2017.11.17.,재건축 속도 내는 송파구 잠실동 `잠실주공5단지` 최근 매매가는?,"서울시 송파구 잠실동에 위치한 잠실주공5단지는 1978년 4월 입주한 최고 15층, 30개동, 총 3930가구 규모... 잠실역을 중심으로 형성된 롯데월드타워, 롯데마트, 롯데백화점, 에비뉴엘, 롯데월드몰, 홈플러스 등의 상권을..."
981,2017.11.15.,[한국부동산금융대상] 베스트 부동산금융사 '이지스자산운용',"골목상권 활성화에도 나서고 있다. /고병기기자 staytomorrow@sedaily.com [서울경제 바로가기]1997년 이래 대한민국 최고의 과학자 DB [바로가기]서울경제의 모든 연재물!... 서경Cube [바로가기▶] 저작권자 ⓒ 서울경제, 무단..."
982,2017.11.13.,"수원시, 지자체·정부기관 통틀어 카톡친구 수 1위",26만578명 서울시가 25만5488명으로 뒤를 잇고 있다. 상반기까지만 해도 대한민국 정부 서울시에 이어... 관람객이 늘어나면서 관광체험 및 부대시설 수입은 29% 증가하는 효과와 관광지 주변 지역상권 활성화에도...
983,2017.11.21.,"CJ올리브영, 명동-강남 ‘왕좌’ 지키기 ‘총력’",매장은 과거 이랜드 ‘미쏘’가 위치했던 서울 중심상권에 터를 잡았다. ‘스마트 스토어’로 차별을 꾀한 강남본점은 최신 디지털 기술을 접목시킨 체험형 매장이다. 체류시간을 늘리기 위해 휴대전화를 충전할 수...
984,2017.11.22.,"평창 알펜시아, 용평리조트 입구에 위치한 '티롤빌리지(아도르프)' 주목","'티롤빌리지(아도르프)'는 서울~평창~강릉 KTX 개통예정으로 인해 강남~평창은 1시간 거리로 되며, 남양주... 길목상권이 되어 독점력 있는 상가가 될것이라 예상하고 있다. 세 번째 상가분석의 체크사항은 상가가 다른곳과..."
985,2017.11.17.,"상가 투자의 정석, ‘샤워효과’ 누리는 상가를 잡아라!",김포 한강신도시 ‘마스터 비즈파크’ 등 위층 고객 잡는 지식산업센터 상가 등 인기 [서울경제] 건물... 구조로 상권이 형성되었으며 하루 매출도 상당한 것을 확인할 수 있다. 직장인들이 밥을 먹고 차를 마시고...
986,2017.11.22.,대형 키즈카페 등 앵커 테넌트(Anchor Tenant) 유치...‘인천 구월 지웰시티몰...,"키 테넌트는 고정 수요층 확보가 가능해 상권 활성화가 용이하다는 장점이 있기 때문이다. 키 테넌트란... 서울외곽순환고속도로 장수IC, 영동고속도로 및 제2경인고속도로 서창JC, 제2경인고속도로 남동IC 접근성도..."
987,2017.11.17.,[광교 브릭스톤②입지]학생·교직원·학부모 3500명 품은 '학세권' 가치,서울 및 수도권 전역에서의 진출입 여건도 잘 갖춰져 있다는 평가다. 광교신도시는 동쪽과 동북쪽에 대단위 아파트 단지가 조성된 것에 비해 기타 건물이 들어설 부지가 상대적으로 적다. 소상공인시장진흥공단 상권분...
988,2017.11.15.,"HDC신라면세점, 3분기 연속 흑자 달성","새로운 상업∙주거 시설이 들어서면서 주변 상권이 폭발적으로 성장하며 이 일대는 서울 최대의 관광 타운으로 변모할 예정이다. 여기에 KTX와 광역철도, 도심 지하철이 지나는 용산역의 교통망도 관광객 유치에 큰..."
989,2017.11.16.,복합 쇼핑몰 '피에스타' 새 주인을 찾습니다,"이미 지역 내 중견 기업과 서울의 투자 자문사들이 문의하고 있다""면서 ""제3자 매각이 되든, 매각에... 피에스타는 부산의 최대 상권인 서면에서도 유동인구가 많은 쥬디스태화 인근에 자리 잡고 있고, 건물 규모가 크고..."
990,2017.11.20.,"[미리보는 이데일리신문]""일자리 늘리는 기업 확실히 대우 하겠다""","윤석열 서울중앙지검장 -“JSA 탈북자, 軍간부 3명이 구해” 국방부, 미담 조작 의혹에 반박 △올해도... 역설…골목상권 상가 임대료 급등 -2020년 1~2인 가구 58.4%…소형아파트 ‘귀한몸’ 예약 -“플랜트 공사 계약..."
991,2017.11.12.,성동구 사근동길 지중화로 명소거리 변신,"(9만5000㎡)가 서울시 재개발 해제지역 맞춤형 희망지사업 대상지로 선정돼 한양대와 한영여대, 청계천 등 지역자원 활용을 연계, 지역상권을 활성화하기 위한 다양한 환경개선 사업을 추진 중에 있다. 박종일 기자 dream..."
992,2017.11.14.,강릉사회단체 “경강선 KTX 상시 할인” 요구,경강선(서울~강릉 간 KTX)을 타고 지난 4일 진부역에 도착한 고객평가단이 기념 촬영하고 있다. 강원도... 지역상권에도 부정적인 영향을 미칠 것이라고 입을 모았다. 이들 사회단체들은 예상보다 높은 요금으로 당초...
993,2017.11.15.,부천 신세계백화점 건립 결국 '백지화',인천지역 상권의 반발을 불러일으키며 지자체간 갈등으로까지 비화됐던 부천 상동 영상복합단지 내... 시는 또 신세계 측의 사업 협약 불이행에 따른 협약이행보증금 115억 원도 서울보증증권에 청구했다. 신세계는 이달...
994,2017.11.22.,이마트 PB전문 '노브랜드 스토어' 6개월 만에 점포수 3배로 껑충...성장 전망...,이마트는 최근 경기도 여주 한글시장과 서울 경동시장 등에 ‘노브랜드 상생스토어’를 출점하는 등 지역 상권과 노브랜드 스토어가 조화롭게 공존할 수 있는 방안을 찾으며 소비자들에게도 ‘’가성비‘ 좋은 상품을...
995,2017.11.15.,"롯데, 인천터미널 소송전서 신세계 이겼지만 숙제 '산적'","신세계백화점 인천점의 연매출 규모는 8000억원대로 서울 강남점, 부산 센텀시티점, 서울 본점에 이어 매출... 다만 지난 20년간 상권을 함께 일궈온 협력사와 협력사원, 직영사원들의 혼란과 피해를 최소화할 수..."
996,2017.11.12.,강북 59㎡도 9억시대 열리나,"주춤했던 서울 집값에 다시 상승 탄력이 붙는 가운데 전용면적 59㎡의 호가가 9억원을 넘나드는 강북... 데다 상권, 교통은 물론 학군까지 뛰어나 실수요자와 투자자 관심이 높다. 이달 초 들어 전용 59㎡의 호가가..."
997,2017.11.14.,엠시에타개발 '미디어 아트밸리' 기공식 진행,"광명역세권은 수도권 교통, 상권의 중심으로 KTX광명역, 지하철 1호선 등이 정차하며, 지난해 강남순환고속도로가 광명역에서 강남까지 1차 개통돼 개발호재도 풍부하다. 아울러 서울·광명 간 고속도로(예정), 신안산선..."
998,2017.11.12.,"유통 새 트렌드 ‘무인점포’, 셀프결제 편의점 가 봤더니…","위험부담도 서울 소공동 서울조선호텔 사무동에 위치한 이마트24 조선호텔점 무인점포 매장(왼쪽). 오른쪽... 이마트24 관계자는 ""현재 오피스 상권과 대학교 점포에만 무인점포를 운영 중인데 오피스 상권은 퇴근 시간..."
999,2017.11.14.,한국타이어·놀부·도드람FC '가맹법 위반' 공정위 제재,"B씨는 2008년 놀부와 가맹계약을 맺고 서울의 한 지역 역세권에 부대찌개 식당을 열었다. 하지만 상권이 계속 약화하면서 매출이 시원치 않자, B씨는 점포를 다른 사람에게 넘기기로 하고 공인중개사에 내놨다. 이 과정에서..."
1000,2017.11.08.,"김주수 군수 ""의성군, 스포노믹스로 지역경제 성장 물꼬 텄다""","= 김주수 경북 의성군수가 8일 서울 중구 을지로 롯데호텔에서 열린 '2017 스포노믹스' 포럼에서 ''지역... 지역축제와 씨름대회를 융합해 전통시장과 같은 지역상권 활성화를 도모했다. 김 군수는 ""의성군은..."
1001,2017.11.14.,사라지는 '고가도로'…상권 회복 '희비',"전문가들은 그러나 고가도로 철거만으로는 상권 회복에 한계가 있다고 말합니다. 대표적인 사례는 서울의 첫 고가도로인 아현고가도로. 고가도로가 사라진 지 3년이 지났지만, 이곳 상권은 여전히 침체돼 있습니다...."
1002,2017.11.15.,강남구청 '소송전 청담삼익' 재건축 강행,힘들듯 [서울경제] 강남구청이 잇단 소송전으로 얽혀 있는 청담삼익아파트 재건축 사업 강행에 나섰다.... 있지만 상권이 형성되지 않았기 때문에 상업시설의 임대수익 상승을 기대하기는 어렵다”며 “외부 유동인구가...
1003,2017.11.05.,"[유커의 귀환] 기대 부푼 명동 상권…""빨리 깃발부대 보고 싶어요""",'한산 vs 북적'(서울=연합뉴스) 정빛나 기자 = 중국의 사드(THAAD·고고도미사일방어체계) 보복 완화 조짐이 있다는 소식이 알려지면서 명동 상권도 기대감에 부풀었다. 왼쪽은 지난 8월 당시 명동거리의 모습이고...
1004,2017.11.15.,"""안정된 임차 수요 노려라""...안양 센트럴 헤센 상가 '주목'","더욱이 위 자료에서는 서울 홍대합정과 화곡 상권은 풍부한 유동인구와 인근 개발사업으로 상가 투자수요가 발생하면서 높은 투자수익률을 보였고, 부산 온천장 상권은 인근 아파트단지 입주의 영향으로 높은..."
1005,2017.11.02.,"KB국민은행, 소상공인 창업아카데미 개최","KB국민은행과 서울신용보증재단이 공동으로 주최한 무료 창업강좌다. 이번 아카데미는 창업절차, 상권 및 입지분석 활용방안, SNS를 활용한 홍보방법, 창업자금 준비, 소상공인지원사업 등 예비창업자와 자영업자가..."
1006,2017.11.16.,"노원구, 상가 건물주와 상생협약 추진",소상인·지역상권 보호 위해 / 임차료 상승 억제·환경 조성 서울 노원구는 젠트리피케이션을 예방해 소상인과 지역상권을 보호하기 위해 건물주와 상생협약을 추진한다고 16일 밝혔다. 젠트리피케이션은 낙후된 지역이...
1007,2017.11.21.,주 7일 내내 사람 붐비는 복합상권 상가에 관심 `쑥쑥`,"주 7일 내내 사람들로 붐비는 복합상권 내 들어서는 상가에 대한 관심이 높다. 주중, 주말 할 것 없이 인근... 실제로 지난 8월 SK건설이 서울 마포구 아현뉴타운에서 선보인 '공덕 SK 리더스뷰' 단지 내 상가는 평균 10대..."
1008,2017.11.15.,"SOC 4조 삭감, 건설업계 호소문…“건설이 복지이고 일자리입니다”","[서울=경기일보/민현배 기자] 건설인들이 SOC(사회간접자본) 삭감을 우려하며 대 국회 호소문을 발표했다.... SOC에 1조원을 투자하면 1만4천개의 새로운 일자리와 철물점, 식당, 소형마트 등 상권을 활성화시켜 지역..."
1009,2017.11.07.,"현대百 판교점, '까르띠에' 부띠끄 유치",까르띠에 부띠끄 오픈으로 현대백화점 판교점은 서울 강남 수준의 명품 라인업을 구성하게 됐다. 현재... 분당 상권이 소득 수준이 높은 30~40대 젊은 고객이 많아 명품 소비가 활발한데다 최근 교통 접근성이 개선되고...
1010,2017.11.21.,"협동조합형 프랜차이즈 밥FULL, 10평 매장 사장에서 전국구 프랜차이즈가 되기...",주로 대학가 상권에 가장 많은 오픈이 이뤄지고 오피스 상권에도 조금씩 창업이 이뤄지고 있다. 곧 오픈할 예정인 광주 동강대점이나 서울 용산 쪽을 포함하면 약 20개 정도의 매장이 생길 예정이다. 문화뉴스 이우람...
1011,2017.11.17.,"현대시티아울렛 가산점, 지역 신규 브랜드 판로 확대 설명회 진행","지역 상권 고객들을 위해 '쇼핑, 놀이가 되다'를 테마로 어린이 직업 체험 프로그램 '키자니아', 금천구 불우아동 돕기 '가상현실(VR) 체험' 등을 진행하고 있다. 지난달에는 인근 직장인들을 대상으로 서울시 거리예술존과..."
1012,2017.11.16.,"거제시 투자설명회 성료, 해양복합도시 '거제빅아일랜드' 사업에 투자자 관심",[한국경제TV 고정호 기자] 권민호 거제시장…거제빅아일랜드 등 거제시 전략사업에 투자독려 15일 서울시... 복합적인 상권의 장점과 많은 유동인구가 예상되기 때문에 그 미래가치에 대한 투자자들의 문의가 이어지고...
1013,2017.11.20.,(MONEY MEN 토지편)강남구 부동산의 불패는 계속된다,"서울 최대 상권인 강남역, 신사동 가로수길, 코엑스, 대치동 학원가 등을 중심으로 가격 상승이 진행됐으며 주거시장 역시 교통 편의, 상권 발달, 좋은 학군의 삼박자를 통해 높은 가격이 형성됐다. 게다가..."
1014,2017.11.17.,"[이데일리N] 외환당국 ""환율 하락 속도 빠르다…예의주시"" 外","현대차·SK·한화, 5백억 원 규모 AI 펀드 조성 &lt;간추린소식&gt; - 포항 영일만항 부두 하역작업 재개 - 지난달 주택매매 거래량 작년보다 42% 감소 - 서울 명동, 세계 8번째 임대료 높은 상권 - 수험생 항공권 변경·환불..."
1015,2017.11.15.,"알뜰주유소, 왜 알뜰하지 않은가",서울시내 한 주유소에서 직원들이 승용차에 주유를 하고 있다. 최근 국제유가가 오르면서 주유소 기름값도... 소비자 입장에서는 알뜰주유소가 경쟁이 치열한 도심 상권이 아닌 도시 외곽이나 고속도로 휴게소...
1016,2017.11.17.,"상가정보연구소, 유망 수익형 부동산 합동설명회",서울 역세권 오피스텔을 비롯해 임대가 맞춰진 수도권 상가 등이 순차적으로 소개된다. '2017 상가시장 뜨는 상권과 트렌드 분석'이라는 주제로 박대원 상가정보연구소장의 특강도 진행된다. 참가비는 무료로...
1017,2017.11.17.,"세종시 분양시장, 연말까지 이어진다 … 세종 리더스포레 분양 주목",중심상권이 형성 될 것으로 보인다. 단지 주변 교육환경도 좋다. 단지 인근에 유치원이 예정되어 있고... 서울~세종고속도로(2022년 개통예정)가 개통되면 향후 교통환경은 더욱 쾌적해질 전망이다. 단지 인근에 BRT...
