,date,title,contents
815,2017.08.17.,[로터리] 소상공인의 영원한 스마트 등대,김흥빈 소상공인시장진흥공단 이사장 [서울경제] 지난 1997년 외환위기 이후 소상공인의 어려움이 커진... 소모적 과잉 경쟁을 줄이고 준비된 창업을 늘리려는 것인데 그 내용의 하나로 상권정보시스템이 들어 있다....
816,2017.08.10.,"""스타필드 입점 후 소상공인 매출 30-40% 급감""","예정지인 서울 마포, 인천 부평 등의 경우도 주변 상권 몰락을 비롯해 교통정체를 가장 큰 문제로 예상하고 있었다""고 우려했다. 정의당 경남도당은 이번 조사를 통해 수집한 자료를 바탕으로 9월 중 복합쇼핑몰 입점과..."
817,2017.08.09.,"신세계 강남점, 리뉴얼 1년새 매출 22%↑ 비결은?",늘려 서울지역 최대면적 백화점으로 재탄생했다. 오픈 이후 올해 7월까지 전체 매출 실적은 전년보다 21.8... “고속버스터미널과 인접한 강남점의 전국적인 상권광역화는 더욱 확대될 것”이라고 전망했다.
818,2017.08.20.,"배달의민족, 광고주 5만명 전수조사를 해보니","특히, 서울 역삼동 야식업소 밀집 지역 등 경쟁이 매우 치열한 곳에서 배달의민족 슈퍼리스트 광고 낙찰을... 지역 상권을 지배하는 ‘승자 독식’의 폐해도 없음을 내부 데이터로 지속 확인하고 있다는 것이..."
819,2017.08.11.,"김영주 ""9월중 최저임금 제도개선 TF 구성""","= 김영주 고용노동부 장관 후보자가 11일 오후 서울 여의도 국회 환경노동위원회 회의실에서 속개된... 신뢰하지 않고 골목상권이 더 어려워진다고 말한다""고 덧붙였다. positive100@newsis.com 뉴시스 SNS [페이스북] [트위터]"
820,2017.08.14.,"카카오프렌즈, 부산 광복에 단독 플래그십 스토어 오픈","[로이슈 편도욱 기자] 카카오프렌즈가 15일, 부산 중심상권 광복동 패션 거리에 단독 플래그십 스토어를 오픈한다. 카카오프렌즈 플래그십 스토어 부산점은 서울 이외 지역에 최초로 오픈하는 캐릭터 플래그십..."
821,2017.08.08.,"`개봉박두` 스타필드 고양, 정용진 부회장 추천 `핫플레이스`는","특히 고양시는 신도시 특성상 만 0~4세 인구 비중이 시 전체 인구의 4.02%로 서울 전체(3.92%)보다 높다. 신세계그룹이 이 지역 상권의 육아맘 소비자들 공략에 힘쓰는 이유다. 신수경 이마트 베이비팀장은 ""하남점의 경우..."
822,2017.08.28.,(박성현의 만인보로 읽는 한국사-78화)청계천 변천사,"서울에는 청계천이 꾸물꾸물 흘러간다 밤에는 별무리 몰래 내려와 흘러가는 물굽이에 떠내려간다 하지만... 그럼에도 불구하고, 청계천은 복원 공사 이후 시민들이 찾는 휴식 공간이 됨으로써 주위 상권의 확장과 부동산..."
823,2017.08.20.,[한경 매물마당] 동대문구 역 출구 앞 사거리 코너 빌딩 등 16건,"(02)519-3040 서초 제이에스 차상혁 ◆서울 강남구 신사동 역세권 명품 빌딩=유동인구 풍부한 중심상권 대지 180㎡, 연면적 590㎡의 6층 건물. 보증금 3억5000만원, 월 2400만원에 전 층 근생시설로 임대 중. 임차..."
824,2017.08.17.,‘e편한세상 추동공원2차’ 분양… 공원·브랜드 프리미엄을 ‘한번에’,서울 마포구 창전동의 경우 와우공원과 인접한 ‘신촌태영데시앙(2003년 11월 입주)’ 전용면적 84㎡는 지난... 생활 인프라로는 단지가 의정부 핵심생활권인 금오지구 상업지역 인근에 있어 홈플러스와 행정타운 상권...
825,2017.08.11.,"강동구,'강풀만화거리'로 매니페스토 도시재생 최우수상",(강동구 제공)© News1 서울 강동구(구청장 이해식)는 2017 전국 기초단체장 매니페스토 우수사례... 지역상권 활성화를 이뤘다. 최근 강풀만화거리는 ‘2017 아시아 도시경관상’ 수상작으로 선정되기도 했다. 이밖에...
826,2017.08.17.,강원도 부동산시장 맑음! 주목받는 반도건설 ‘원주기업도시반도유보라’,"지난 2일 정부는 서울시 전역과 과천시를 투기과열지구로 지정하고 강남 4구를 포함한 서울 11구, 세종시를... 단지는 원주기업도시 메인상권이 가까운 중심생활권에 위치해 편리한 쇼핑과 문화생활이 가능할..."
827,2017.08.09.,"'정유경의 리뉴얼'…신세계 강남, 매출 2조 '청신호'",지난 1년간 강남점의 지역별 고객 구성을 살펴보면 주력 상권인 서울을 제외한 수도권 및 지방고객 매출 비중은 절반에 달하는 48.9%에 이르고 이중 수도권을 제외한 순수 지방고객 매출은 전체 매출 중 25.2%로...
828,2017.08.09.,이회창 전 총재 내주 회고록 출간,나뉘었으며 상권은 이 전 총재가 가진 철학이나 사상과 관련한 기술이 대부분을 차지한 것으로 전해졌다. 하권에서는 정치에 입문한 후의 스토리가 주로 소개되는 것으로 알려졌다. /하정연기자 ellenaha@sedaily.com [서울...
829,2017.08.17.,상업시설 절대부족.. 은평뉴타운 내 프리미엄 상가 어디,"노른자 상권으로 형성될 전망이다. 은평뉴타운 신한 헤센 스마트 분양관계자는 “서울 서북부 개발의 최중심 입지에 위치한 신한 헤센 스마트 상가는 삼송택지지구, 지축택지지구, 은평구를 모두 수요할 수 있는..."
830,2017.08.22.,"[新용산 시대]공원·호텔·쇼핑의 메카, 트렌드를 이끌다",2000년대에 들어서면서는 ‘포스트 경리단길’이라고 불리며 새로운 상권으로 각광받고 있다. 특히 서울의 옛 주거지와 이국적인 환경이 조화를 이루는 이태원의 독특한 풍경은 4050세대에게는 향수를 불러일으키고...
831,2017.08.21.,상가시장에 큰 장 선다,또한 지하철 9호선이 연장되면 인구유입이 증가돼 핵심 상권이 될 전망이다. ▲동탄2신도시 동탄 베라프라자= 남부 수도권의 최대 규모 자족형 복합도시로 동탄2신도시가 주목 받고 있다.  서울생활권...
832,2017.08.21.,"스타필드 3개점 1조8000억 목표, 안성·인천 등으로 확장","고양시 인구는 100만명으로 22만명 정도인 하남 상권의 몇 배로 높을 뿐 아니라, 서울 강서·마포, 경기도 김포 등 30분 내에 접근이 가능한 지역에 500만명 이상이 거주하는 초대형 상권이 있기 때문이다. 여기에 맞춰..."
833,2017.08.16.,'인천 더샵 스카이타워' 18일 견본주택 오픈 예정,있어 서울 이동이 편리하다. 또한 주변에 3개의 대학교와 13개의 초중고등학교가 위치해 우수한 교육환경을... 기존 상권과는 차별화된 '상업시설 활성화' 시스템이 적용된다. 우선 수분양자는 계약과 동시에 시행사와...
834,2017.08.13.,"급속한 도시화의 상징, 지하차도가 사라진다","건널목이 사라지면서 주변 상권도 영향을 받고 있습니다. [양준욱 / 서울시의회 의장 : 지하차도를 만들면서 상권이 보다시피 단절이 됐습니다. 차량도 단절되고, 사람 왕래도 단절되다 보니 성내동 여기는 완전히..."
835,2017.08.22.,온라인·복합몰·아웃렛…위기의 百 변신 돌파구,"서울 목동점과 판교점에는 올 하반기 일본 소니의 게임 콘솔기기를 구비한 ‘플레이스테이션 라운지’가... 애경 관계자는 “국내 유통업계는 이제 고객 니즈에 맞는 브랜드를 선별, 상권을 찾아 입점하는 맞춤형..."
836,2017.08.18.,2억 원대 수익형 상가 우성르보아파트2 분양 마감 임박,"상권에서 가장 중요한 배후수요는 지하철역과 주변 아파트 단지의 규모라 볼 수 있다. 미사역 주변은 지하철 개통과 신도시 프리미엄 등으로 향후 프리미엄 형성 가능성이 크다”고 전했다. 한편, 모델하우스는 서울..."
837,2017.08.08.,"이마트, 스타필드 고양 베이비&토이 매장 확대…체험형 콘텐츠로 승부수",고양시는 신도시 특성상 만 0~4세 인구 비중이 시 전체 인구의 4.02%로 서울 전체(3.92%)보다 높다. 이 같은... 베이비서클은 매장 크기를 확 키우고 체험 콘텐츠를 촘촘히 심어 고양/은평 상권의 많은 인구를 담아내면서...
838,2017.08.16.,[포커스]‘도시재생 뉴딜사업’의 길을 묻다,‘일관성’을 보여주는 하이라이트는 서울을 투기과열지구로 지정해 문재인 대통령의 대선 공약인... 성수동 수제화거리와 인근 건대입구 등의 상권과 묶여 개발될 가능성이 크다. 금씨는 “오래 살던 동네라 정도 들고...
839,2017.08.16.,굵직한 호재 이어지는 `래미안용산` 거래 활발,"서울시가 연내 발표를 예고한 용산마스터플랜도 주목 받고 있다. 용산마스터플랜은 한강과 용산전자상가... 부동산세상공인 관계자는 ""교통, 상권 등 우수한 주거 환경에 비해 시세가 저렴한 편이다""며 ""8.2 부동산..."
840,2017.08.16.,굵직한 호재 이어지는 `래미안용산` 거래 활발,"서울시가 연내 발표를 예고한 용산마스터플랜도 주목 받고 있다. 용산마스터플랜은 한강과 용산전자상가... 부동산세상공인 관계자는 ""교통, 상권 등 우수한 주거 환경에 비해 시세가 저렴한 편이다""며 ""8.2 부동산..."
841,2017.08.17.,"스타필드 고양 오픈, 엔터테인먼트 차별화… ""맛집·쇼핑브랜드 총집약""","스타필드 고양은 반경 핵심상권인 3km 이내에 인구 밀집 지역인 고양시와 서울 서북부 지역이 위치하고 있다. 서울 강서, 마포, 경기도 김포, 파주 등 30분내 접근 가능한 지역에 500만명 이상이 거주하는 초대형 상권을..."
842,2017.08.14.,‘카카오프렌즈 캐릭터 상품’ 부산서도 구매 가능,중심상권 광복동 패션 거리에 단독 플래그십 스토어를 오픈한다고 14일 밝혔다. 플래그십 스토어는 카카오프렌즈 캐릭터 관련 상품을 총망라한 브랜드 체험 공간으로 서울 이외 지역에선 최초로 문을 열게 됐다....
843,2017.08.09.,"'리뉴얼 1년' 신세계 강남점, 매출 22% 증가…매출 2조 '청신호'",지난 1년간 강남점의 지역별 고객 구성을 살펴보면 주력 상권인 서울을 제외한 수도권과 지방고객 매출비중은 절반(48.9%)에 이릅니다. 수도권을 제외한 순수 지방고객 매출만 25.2%로 나타났습니다. 강남점을 찾았던...
844,2017.08.16.,주거입지 뛰어난 성북구 `월곡래미안루나밸리`,특히 교통 호재는 역세권을 중심으로 상권이 형성되는 등 집값 상승에도 긍정적인 영향을 미쳐 성북구 일대 주민들의 기대가 높아지고 있다. 서울시 성북구 하월곡동에 위치한 '월곡래미안루나밸리'아파트는 2007년 10월...
845,2017.08.18.,정용진표 부츠 파격 실험 '백화점 축소판이네…',[일요신문] 신세계 이마트가 서울 명동에 국내 최대 규모의 헬스앤뷰티(H&amp;B)스토어 ‘부츠’ 본점을 열었다.... 이마트 부츠 관계자는 “영국처럼 매장 규모에 따라 3가지 형태로 출점할 수 있으며 아무래도 상권이 좋은...
846,2017.08.08.,"SPC그룹, 라그릴리아 홍대역에 9번째 점포 오픈","SPC그룹은 서울 마포 홍대입구역 인근에 140석 규모의 서양식 레스토랑 라그릴리아의 아홉 번째 매장을... 라그릴리아 관계자는 ""양재점, 광화문점, SPC 스퀘어점 등에 이어 홍대에 9번째 매장을 열었다""며 ""새로운 상권..."
847,2017.08.23.,'경기북부청사 광장 조성'… 상인들 '찬성',찬반 논란이 일고있는 경기도 북부청사 광장 조성 사업에 대해 지역 상권에서는 대부분 찬성하는 것으로... 없애고 서울시청 광장 2배 규모의 광장(4만1천436㎡)을 조성하는 사업이다. 조윤성·서희수기자 &lt;독자 신뢰도...
848,2017.08.24.,“상사 욕설에 자살충동까지”…충북 청주상권활성화재단 직원들 상사 갑질·...,청주시상권활성화관리재단 권오덕·이대원 대리는 24일 청주시청 브리핑룸에서 기자회견을 열고 “재단... 전에 서울의 모 업체를 사업자로 미리 선정했다”며 “상인회장이 사전에 100% 찬성했다고 거짓말을 했다”고...
849,2017.08.21.,맞춤정장 브랜드 HK테일러 전국 가족점 모집,"상권을 보장하며 전국 24개 HK테일러 매장이 윈-윈 하는 원동력 중 하나이다. HK테일러의 6대 광역시 가맹점 모집 지역은 인천, 대전, 울산, 광주 2호점을 추가 모집 중 이며 천안, 세종, 포항, 제주도 등 지방 대리점과 서울..."
850,2017.08.15.,"이마트, 노후점포·미개발 부지 매각 속도…부평점도 판다","2013년 매입한 5300평 규모 부지로, 인근에 또 다른 이마트 사업부지가 있어 상권중복 등으로 개발 매력도가... 계획""이라며 ""연말까지 서울 가양점, 수원점, 대구 월배점, 안산 고잔점 등 대형점 리뉴얼을 완료해..."
851,2017.08.21.,"[더벨]미래에셋, 인베스코 홍대 '대아빌딩' 매입",미래에셋자산운용(이하 미래에셋)이 서울 마포구 동교동에 있는 '대아빌딩(사진)'을 매입한다. 미국계... 여기에 더해 홍대 상권이 각광받으면서 대아빌딩 3.3㎡당 거래가가 2000만 원 이상이 될 것이라는 전망이...
852,2017.08.09.,"리뉴얼 1주년 신세계 강남점, 1년 새 매출 22%↑",지난 1년간 강남점의 지역별 고객 구성을 살펴보면 주력 상권인 서울을 제외한 수도권 및 지방고객 매출비중은 절반에 달하는 48.9%에 이르고 이중 수도권을 제외한 순수 지방고객 매출은 전체 매출 중 25.2%로...
853,2017.08.18.,[화제의 분양현장]8·2부동산 규제 피한 청라지역 오피스텔에 쏠린 눈,"연장과 서울 7호선 청라 연장 사업이 포함되어 있어 교통개발 호재도 기대를 모으고 있다. 한편, 지상 4... 현재 청라국제도시는 호수공원 동쪽으로 아파트 등 주거시설 위주의 상권이 존재하는데 앞으로는 반대편이..."
854,2017.08.01.,"제주맥주, '제주 위트 에일' 출시","제주 위트 에일 제공 | 제주맥주 [스포츠서울 임홍규기자]국내 최대 규모의 크래프트 맥주 브랜드... 생산 제품은 신선도 관리 및 지역 상권과의 상생을 위해 제주지역의 한식당, 향토 음식점 등을 중심으로 우선..."
855,2017.08.18.,[2기 부동산 아카데미 클럽]① 꼬마빌딩 건물주 되기 10주 프로젝트,"강의는 오는 9월 18일부터 매주 월요일 10주간 서울 광화문 태성빌딩 3층 교육장에서 열린다. 올해 상반기... 꼬마빌딩 건물주 되기 10주 프로젝트 강좌에서 김 대표는 1~4강, 9~10강을 맡아 빌딩투자 기본 개념과 상권..."
856,2017.08.11.,"에이블씨엔씨, 2Q 영업익 24억원…'사드직격탄'에 전년比 '반토막'(상보)","서울 명동 소재 화장품 매장도 문을 닫아야할 정도로 상황이 악화돼 브랜드숍 중심 에이블씨엔씨도 직격탄을 피할 수 없었던 것으로 풀이된다. 양지혜 메리츠종금증권 연구원은 ""브랜드숍 경우 명동 상권 매장들이..."
857,2017.08.25.,"더조은 IT아카데미 컴퓨터학원, 빅데이터 분야 연구성과에 관련 업계가 주목","학술대회를 통해 '공공데이터를 활용한 서울시 골목상권 분석'이란 논문을 발표한 오흥록 씨는 ""처음에는 비전공자인 제가 빅데이터 과정을 도전하기로 결심했을 때는 두려움이 많았지만, 더조은 IT아카데미..."
858,2017.08.21.,새 정부 출범 100일…울고 웃는 주식들,▲ 지난 9일 서울 중구 서울중앙우체국에서 우정사업본부 직원들이 제19대 문재인 대통령 취임 기념우표'를... 유통업종 역시 물가관리와 골목상권 보호 화두에 따라 규제 리스크가 더 커질 것으로 보인다. 김병연...
859,2017.08.16.,차별화된 MD구성으로 고정 수요 확보한 미사 트레비타워 주목,[스포츠서울 김수지기자] 최근 수요자들의 입맛에 맞춰 다양한 점포구성을 선보이는 상업시설이 인기다.... 이후 마포구의 랜드마크 상권으로 자리잡기도 했다. 또 다인건설이 경남 창원시 진해구에서 분양중인...
860,2017.08.14.,"카카오프렌즈, 부산 광복에 단독 플래그십 스토어 오픈","[한국경제TV 이송이 기자] 카카오프렌즈가 8월 15일, 부산 중심상권 광복동 패션 거리에 단독 플래그십 스토어를 오픈한다. 카카오프렌즈는 서울에 이어 제 2의 도시 부산에 소비자들이 브랜드 매력을 다양하게 경험하게..."
861,2017.08.17.,"""대북문제 '레드라인' ICBM에 핵탄두 탑재""","[서울=충청일보 이득수기자] 문재인 대통령은 17일 북핵·미사일 문제의 '레드라인'은 북한이 ICBM... 우리가 상권 부문에선 이익을 보지만 서비스 부문에선 적자를 보고 있다""고 설명하고, ""이런 점을 제시하면서 당당한..."
862,2017.08.15.,K-뷰티 2Q 실적 '사드직격탄'에 반토막…반등은 언제?,중국의 사드보복 본격화 이후 단체관광객(유커) 수가 60% 이상 급감하면서 면세점 채널 실적이 급격히 악화됐고 주요관광 상권(서울 명동) 브랜드숍 채널에서도 사드보복 타격을 받았기 때문이다. 잇츠한불의 경우...
863,2017.08.03.,전국에서 알바 자리 가장 많은 대학가는?,"알바몬 관계자는 ""대학가별로 모집하는 아르바이트 분야도 차이를 보였다""면서 ""상권이 발달한 홍익대, 건국대, 서울교대, 연세대 등은 음식점 및 서빙 분야가 상대적으로 많았고, 경기 지역에 있는 인하대와..."
864,2017.08.21.,"8.2 부동산대책 풍선 효과의 반사이익 전망, ‘마곡 그랑 트윈타워’ 9월 공개","시 다양한 유동인구를 확보한 역세권 상권 형성이 예상된다”고 전했다. 홍보관은 서울시 강서구 강서로 395, 3층 303호(마곡동, 플레이스H)에서 운영 중으로 홍보관은 9월 중 정식오픈 예정이다. ▶ 속보이는 연예뉴스 fn스타"
865,2017.08.11.,김영주 고용노동부 장관 후보자 청문보고서 채택,"[서울신문] 국회 환경노동위원회가 11일 김영주 고용노동부 장관 후보자의 인사청문회를 열고, 청문회가... 골목상권이 더 어려워진다는 얘기를 한다”고 지적했다. 국민의당 김삼화 의원도 “최저임금의 대폭 인상으로..."
866,2017.08.07.,"강남구 ""외국인환자 20만명 유치""…의료관광 5개년 계획 발표","외국인 의료 관광 (PG)[제작 최자윤] 일러스트 서울 강남구가 외국인환자 20만명 유치를 목표로 한 의료관광... 지출을 하기 때문에 주변 상권까지 혜택을 받게 된다""고 설명했다. chopark@yna.co.kr 최신 유행 트렌드 총집결(클릭!)"
867,2017.08.17.,"국순당, 깔끔하게 '짠'하세요","국순당에 따르면, 짠은 지난해 말부터 서울 강남상권처럼 젊은이들이 많이 모이는 곳에서 테스트 마케팅을 거쳐 맛과 향, 디자인 등을 보완한 뒤 출시한 제품이다. 짠이란 이름은 젊은이들의 건배 용어이자 '맛있는..."
868,2017.08.01.,"소상공인업계, 최저임금 지역별 차등화 방안 도입 요구","서울 여의도 중소기업중앙회에서 기자회견을 열어 ""우리나라 특성에 맞는 지역별 최저임금 차등화 방안을 적용해 우리 경제 체질을 강화해야 한다""며 이렇게 밝혔습니다. 소상공인 대표단은 ""고객이 많은 주요 상권과..."
869,2017.08.23.,[춘천]관중 유입 상경기 활력 ‘원정팬 효과’ 노린다,"춘천으로 원정 응원을 오는 수도권 등 외지 관중들의 소비를 통해 지역 상권에 도움을 주겠다는 것이다. 특히 시는 경춘선 복선전철,서울춘천고속도로 개통 등을 통해 수도권과의 접근성이 획기적으로 개선,K리그에서..."
870,2017.08.15.,춘천~속초 고속화철도 현재안 고수…인제군민 ‘혼란’,장범영 백담마을(용대2리) 이장은 “서울~양양고속도로 개통으로 인해 상권이 죽고 있는 백담지역은 치유를 받고 위로를 받아야 하는 입장인데 안타깝다”며 “최문순 지사님께서 돈 이야기를 하셨는데 저희...
871,2017.08.08.,"'쇼퍼테인' 시대… 스타필드고양, 체류형 전문점 버젼 2.0",고양시는 신도시 특성상 만 0~4세 인구 비중이 시 전체 인구의 4.02%로 서울 전체(3.92%)보다 높다. 이 같은... 베이비서클은 매장 크기를 확 키우고 체험 콘텐츠를 촘촘히 심어 고양/은평 상권의 많은 인구를 담아내면서...
872,2017.08.18.,명동서 맞붙은 올리브영·부츠…H&B숍 성장세 확대,"신세계이마트가 서울 명동에 국내 최대 규모 H&amp;B숍 '부츠'를 열었다. ⓒ맥스클리닉 CJ올리브네트웍스의 H&amp;B... 있도록 상권과 지역에 맞는 다양한 형태의 매장으로 차별화할 계획이다""라고 전했다. 데일리안 손현진..."
873,2017.08.21.,도산공원 사거리 인근 중소형 빌딩 실거래 사례 및 추천매물,"이번 주 '상업용 빌딩 매매 사례 및 추천매물'에서는 도산공원 사거리 상권에 대해 알아보려 한다.... C지역은 차량 전시 매장, 카페, 중학교, 서울본부세관, 건설회관 등이 있어 직장인들의 유동인구가 많은..."
874,2017.08.17.,[르포] 베일벗은 '스타필드 고양'…즐길거리 '풍성'-교통편의 '글쎄',"제공 | 신세계 [삼송(고양) | 스포츠서울 김자영기자] 신세계그룹 정용진 부회장의 야심작 ‘스타필드 고양... 특히, 3040 젊은 부부들이 많은 상권을 고려해 가족 단위 방문객을 겨냥한 각종 체험·엔터테인먼트 시설이..."
875,2017.08.17.,프리미엄 남다른 공세권+브랜드대단지 'e편한세상 추동공원2차',KB부동산시세자료를 보면 서울 마포구 창전동 와우공원과 인접한 '신촌태영데시앙(2003년 11월 입주)... 또한 의정부 핵심생활권인 금오지구 상업지역 인근에 위치해 홈플러스 등의 행정타운 상권과 은행가 이용이...
876,2017.08.17.,"부동산 중개업소, 강남구 2324곳 ‘최다’","서울 강남권의 마지막 택지지구라 불리는 위례신도시 개발을 비롯해 문정·장지지구, 잠실주공 재건축 등 대규모 개발이 진행되고 있어 가격상승에 대한 기대감이 높다. 실제로 이 일대 상권을 방문해보면 상가의..."
877,2017.08.06.,韓 중기 우수제품 싱가포르에 뜬다,/사진제공=중진공 [서울경제] 싱가포르의 번화가에 한국의 우수 중소기업 제품을 전시판매하는 전용 공간이 등장했다. 중소벤처기업부와 중소기업진흥공단은 5일 싱가포르 상권 중심지에 한국 중소·중견기업 제품을...
878,2017.08.07.,"주세훈 ""동네·온라인 서점 결합한 O2O서비스로 승부""",7일 서울 삼성동 인터파크에서 만난 주세훈 인터파크 도서부문 대표는 “이번 송인서적 인수를 통해 출판계... 지역 상권의 한계나 마케팅 능력 부족으로 이를 알릴 기회가 거의 없는 게 현실”이라고 말했다. 그는...
879,2017.08.23.,"상가시장 불패, `항아리상권`‥지형을 알아야 투자가 보인다","8.2 부동산 대책으로 서울, 수도권 등 신규 아파트에 대한 투자에 제동이 걸리면서 상대적으로 규제에서 자유로운 수익형 부동산에 대한 수요자들의 관심이 높아지고 있다. 이에 따라 항아리상권이 다시 한번 조명받고..."
880,2017.08.21.,"‘앨리웨이 인천’, 앵커테넌트 유치로 함박웃음",최근 ‘앵커테넌트(Anchor Tenant)’가 상권 활성화에 가장 중요한 요소로 떠오르면서 브랜드 영화관... 위치해 서울 등 수도권 이동이 편리해 투자자들의 관심이 더욱 쏠리고 있다. ‘앨리웨이 인천’ 상업시설 위로는...
881,2017.08.21.,마곡 GMG엘스타 상가투자 1석2조 효과 누려,최근 가장 핫플레이스로 떠오르는 곳은 서울 강서구 마곡지구 공항대로변이라 할 수 있다. 부동산 관계자에... 분양관계자는 “마곡의 대표상가라는 자부심으로 마곡 공항대로변 북쪽 핵심상권에서 이용객들이 실속 있게...
882,2017.08.21.,[횡성]옥스필드 골프장 회생 횡성군 재정 숨통,횡성군에 따르면 서울회생법원에서 열린 서원면 옥스필드 골프장 변경계획안 관계인 집회에서 채권자 전원... 지역 상권 활성화에 힘을 모으기로 했다. 앞서 지난해 11월 우천면 청우골프장 회생인가안이 최종 확정됨에...
883,2017.08.22.,"[J노믹스, 임대료를 잡아라] '갓물주'와 '세입자의 눈물'",서울의 대표적인 젠트리피케이션(상권 발달로 임대료가 급등해 원주민이 떠나는 현상) 지역으로 꼽히는 용산 경리단길의 인기있는 상가임대료는 월 250만∼350만원 수준이다. 경리단길에서 15년 동안 음식점을 운영한...
