,date,title,contents
406,2017.08.28.,[한경매물마당] 고려대 법대 옆 수익형 원룸 등 14건,"◆서울 압구정역 중심상권 수익형 빌딩=성형외과 및 대형 카페, 프랜차이즈 상권 중심가 대지 600㎡, 연면적 2308㎡. 접근성 및 유동인구 풍부, 안정적인 임차 수요로 수익 및 사옥용 적합. 보증금 10억원..."
407,2017.08.27.,[<새연재> 소문난 자치 리더] “안양에 ‘제2 평촌신도시’ 만들겠다”,경기남부법무타운 조성사업(안양교도소 이전)은 안양교도소와 의왕시 소재 서울구치소 및 서울소년원 등의... 안양로 등 주요 도로의 상습적인 교통 혼잡을 어느 정도 해소할 수 있고 역 주변으로 새로운 상권의 형성도...
408,2017.08.27.,"""조선족 비하했다""...'청년경찰' 상영 금지 신청한 중국 동포들","지난 23일과 24일 재한동포총연합회, 중국동포한마음협회 등 국내 중국 동포 단체들은 서울 영등포구 대림동... 대책위는 ""중국 동포 이미지를 범죄자로 낙인찍고 대림동 등 중국 동포 밀집 지역 상권을 어렵게 만드는 영화..."
409,2017.08.20.,[르포] '인천서 14시간'…한중 최초 카페리길 웨이하이를 가다,"웨이하이 외에도 한중 카페리가 취항하는 도시마다 부두를 중심으로 상권이 형성돼 특수를 누리고 있다.... 리커창(李克强) 중국 총리는 2015년 11월 서울에서 열린 한중일 비즈니스 서밋 축사에서 ""25년 전 웨이하이에서..."
410,2017.08.27.,"""조선족 비하했다""...'청년경찰' 상영 금지 신청한 중국 동포들","지난 23일과 24일 재한동포총연합회, 중국동포한마음협회 등 국내 중국 동포 단체들은 서울 영등포구 대림동... 대책위는 ""중국 동포 이미지를 범죄자로 낙인찍고 대림동 등 중국 동포 밀집 지역 상권을 어렵게 만드는 영화..."
411,2017.08.20.,[르포] '인천서 14시간'…한중 최초 카페리길 웨이하이를 가다,"웨이하이 외에도 한중 카페리가 취항하는 도시마다 부두를 중심으로 상권이 형성돼 특수를 누리고 있다.... 리커창(李克强) 중국 총리는 2015년 11월 서울에서 열린 한중일 비즈니스 서밋 축사에서 ""25년 전 웨이하이에서..."
412,2017.08.23.,"스크린골프 가맹점, 영업지역 설정기준 '유명무실'",전 서울사무소장의 부당한 영향력 행사 때문이라는 의혹을 제기했다. 감사 결과에 따르면 스크린골프장 운영... 하지만 골프존의 가맹본부가 “상권규모 감안하여 가맹점 사업자와 개별협의”라고만 기재했는데도 다음달...
413,2017.08.28.,성동구 성수동 상생마을 공유공간 '상원마실' 문 열어,"지난해 8월 서울시 주민참여형 사업으로 선정, 지난 6월에는 5개 아파트 주민 13명이 모여 상원마을 주민협의체(대표 정현주)를 구성했다. 주민들 마을의제를 함께 고민, 세대간 화합할 수 있는 프로그램 운영과 지역상권도..."
414,2017.08.25.,"웃음+공감 신속배달…'최강배달꾼', '품위녀' 떠난 金土 배달통 될까(종합)","배달부에 대한 부정적인 시선을 유머러스하게 비틀고 동네 상권을 잠식하는 대기업의 갑질을 꼬집었다.... 25일 오전 10시 30분 서울 서울 강남구 삼성동의 한 카페에서 진행된 기자간담회에서 고경표는 ""우리 드라마를..."
415,2017.08.28.,"(리포트)LH, 낡고 쇠퇴한 도시 살린다","천안 원도심은 신도심 개발로 인구유출과 상권쇠퇴가 심화하자 복합문화특화공간을 조성하는 도시재생... 올 초 서울시 구로구 , 양천구와 업무협약 체결을 맺은데 이어 성남시와 성남관리공단을 연계한 산단재생사업도..."
416,2017.08.30.,"강남1타 메가스터디 신화, 730억대 알짜부동산",강남역 인근에 위치한 한 부동산 관계자는 “에임하이타워가 위치한 대로변의 경우 임대수익률이 보통 3.5~4% 정도로 서울 평균에 비해 좀 낮은 편이다”며 “하지만 서울 대표 상권 중 하나인 ‘강남역’이라는...
417,2017.08.29.,공정위에 밉보일라…유통3사 정규직 전환 경쟁(상보),"(서울=연합인포맥스) 변명섭 기자 = 롯데, 신세계, 현대백화점 등 유통 대기업 3개사가 비정규직 해소와 신규... 정용진 신세계 부회장은 지난달 대통령과의 만찬 간담회에서 ""골목상권과 상생할 수 있는 일자리 창출을..."
418,2017.08.29.,"김성태 의원, 송파구 삼전동서 당협사무실 개소식 열어","[공감신문] 자유한국당 김성태 의원(서울 송파을)은 29일 오후 3시 서울시 송파구 삼전동에서 당협사무실... 20대 국회에 등원해 가계통신비 절감방안 대안인 완전자급제, 온라인 골목상권 지키지 정책방안 마련 등을 통해..."
419,2017.08.28.,'원주기업도시 반도유보라 아이비파크' 견본주택 북새통,"제2영동고속도로 서원주IC와 서원주JC 진입도 수월해 서울 강남권까지 50분대 이동이 가능하다. 단지는 원주기업도시 내에서도 메인상권이 가까운 중심생활권에 위치하며, 단지 앞 수변공원과 인근으로 중앙공원..."
420,2017.08.26.,막오른 가을 분양…다음주 14곳서 1순위 청약,이 단지는 메인상권과 수변공원 등이 가까운 원주기업도시 중심생활권에 위치해 원스톱 라이프를 누릴... 교통여건으로는 경강선(판교~이천~여주) 이천역이 지난 해 9월 개통돼 서울 및 수도권 진출입 여건이...
421,2017.08.22.,'스타필드 효과'에 인근 아파트 가격도 '들썩',【서울=뉴시스】 경기도 스타필드 고양이 17일 프리오픈했다. 스타필드 고양은 수도권 서북부 최대... 연면적 3만159㎡규모에 상가 240호실로 구성된 이 단지는 청라의 핵심상권인 중봉대로~호수공원 사이...
422,2017.08.26.,"[현창용의 공간·공감] 덩어리 건축, 걷기싫은 도시","서울의 삼성동 코엑스까지 그 범위를 넓혀왔으며 이번 청라를 비롯해 향후 송도, 안성, 부천 등에도 건립을 추진 중에 있다. 청라의 경우 부지 인근에 부동산을 소유하고 있어 직접적인 이득을 보는 주민들과 지역상권과..."
423,2017.08.30.,사드보복 여파에 면세·화장품 업계 “하반기 더 걱정”,"주력 계열사 아모레퍼시픽은 면세 채널 및 관광 상권 매장 위축으로 2분기 연결기준 매출·영업이익도... 사드 보복이 풀릴 기미가 보이지 않고 장기화 될 것 같아 걱정""이라고 말했다. 서울=뉴시스"
424,2017.08.29.,대전국세청 3년간 지낼 임시 이전지…옛 LH 대전·충남본부 유력,[충청투데이] 서구 지역상권 활성화 기대신청사 착공을 앞둔 대전국세청이 임시 청사로 대전 서구... 지난해 조달청 심사를 거쳐 서울에 본사를 둔 행림종합건축사사무소가 최종 설계용역사로 선정됐다....
425,2017.08.29.,"동작구 상도4동 도시재생대학, 31일부터 5주간 명사초청 강의","마지막주는 김종익 서울시 도시재생센터장이 나서 국토 도시재생, 사회적경제, 골목상권 살리기 등의 설명을 통해 도시재생사업을 폭넓게 알려준다.   아울러 구는 주민이 직접 원하는 교육 프로그램을..."
426,2017.08.17.,베일 벗은 스타필드 고양 가보니…곳곳에 오락·레저시설·맛집(종합),"지난해 9월 개장한 '스타필드 하남'의 경험에 수도권 서북부 상권 특성을 반영, 쇼핑·문화·레저·힐링... 신세계 스타필드 고양 기자간담회(서울=연합뉴스) 17일 오전 경기도 고양시 스타필드 고양 3층에서 열린 프리오픈..."
427,2017.08.25.,"“시청률20%, 포상휴가 원해” ‘최강배달꾼’, KBS 주력상품을 꿈꾸다(종합)",""" 8월 25일 오전 서울 강남구 삼성동 한 카페에서 KBS 2TV 금토드라마 '최강 배달꾼'(극본 이정우/연출 전우성)... '최강배달꾼'은 최근 최강수와 이단아의 썸이 시작되는 동시에 오진규가 동네 상권을 위협하는 브랜드체인..."
428,2017.08.24.,"""김구 '나의 소원'에 이광수의 흔적이 보인다""","백범이 밝힌 '나의 소원' 취지  김구는 1947년 11월 13일에 쓴 &lt;백범일지&gt; 출간사에서 이 책의 상권을 중국... 백범이 책을 펴내면서에서 밝힌 '모스크바, 워싱턴을 일방 따르지 말고 우리의 서울은 오직 우리의 서울이 되어야..."
429,2017.08.23.,[전국 주요 신문 톱뉴스](23일 조간),"▲ 경향신문(서울) = 사법부 '토대'를 바꾼다 ▲ 서울신문(서울) = 미군 수뇌부 ""북핵, 외교해법이 우선... 열악한 상권에서 고군분투 ▲ 인천일보(인천) = 송도 개발이익금 사업 끝날 때마다 환수 '합리적' ▲ 일간경기(인천)..."
430,2017.08.28.,8.2 부동산 대책으로 수익형 상가 '반사이익' 하남미사 3면 개방 코너 상가 '...,"이번 대책에는 기존의 6.19 대책에서 지정한 조정대상지역에 투기과열지구(서울 25개구, 경기 과천시... 컬처로드 상권의 '랜드마크'로 자리잡을 것으로 기대를 모으고 있다. 라파르코는 경기 하남 미사강변도시..."
431,2017.08.22.,1만원 내면 와인이 무제한,[서울신문] 1만원으로 와인을 무제한으로 즐기는 박람회가 열린다. 대전마케팅 공사는 새달 1일~3일... 아울러 지역 상권과의 연계를 위해 와인 입장료와 20여 개의 레스토랑 식사비를 상호 할인해주는 이벤트도...
432,2017.08.25.,"상가정보연구소, 올 하반기 실전 상가 투자 세미나 개최","ⓒ상가정보연구소 상가정보연구소는 오는 9월1일 오후 2시 서울 양재역 1번 출구 앞 서희타워 5층... 체크와 상권, 입지, 매입가 등을 객관적으로 파악해주는 순서로 진행된다. 이상혁 상가정보연구소 선임연구원은 ""이번..."
433,2017.08.25.,"카자모피, 현대백화점대구점 단독초청전 전개",지방상권에서도 다양한 라인을 선보이고 소비자에게 선택의 기회를 제공해야 한다는 의견을 수렴해 이번 팝업초청전을 진행하게 됐다”고 소감을 밝혔다. 더불어 박 대표는 “서울에 버금가는 패션의 메카로 불릴...
434,2017.08.24.,신세계 ‘스타필드 고양’ 그랜드 오픈…정용진의 승부수는,"특히 지난해 12월 오픈한 서울 은평구의 ‘롯데은평몰’과 3km 떨어진 거리라 상권이 겹치는데다, 오는 10월 ‘이케아 고양점’이 들어설 예정이라 치열한 상권 경쟁도 전망되고 있다. 스타필드 고양의 가장 큰 특징은..."
435,2017.08.29.,"'대기업, 휴대폰 못 판다'...휴대폰판매업 중소기업 적합업종 지정 가시화",동반위의 중소기업 적합업종 제도는 특정 사업 분야를 골목상권으로 지정해 대기업의 사업활동을 제한하는... 한편 지난해 말 서울시가 발표한 ‘통신기기 소매업’ 실태조사에 따르면 2014년 1분기 휴대폰 판매점의...
436,2017.08.24.,[주목! 이 단지] 3.3㎡당 670만원대 '원주기업도시 반도유보라',여기에 제2영동고속도로 서원주IC와 서원주JC 진입도 쉬워 서울 강남권까지 50분대 이동이 가능하다. 풍부한 생활인프라를 가까이 누릴 수 있는 것도 장점이다. 단지는 원주기업도시 내에서도 메인 상권이 가까운...
437,2017.08.25.,"배후수요, 수익률 보장된 ‘공덕 SK 리더스 뷰’ 단지 내 상가 분양 임박","이 뿐만 아니라 서울 금천구 독산동에 위치한 ‘롯데캐슬 골드파크’의 경우 2차 단지의 상가는 595대 1, 3차... ‘공덕 SK 리더스 뷰’ 단지 내 상가가 위치한 공덕역세권 상권은 최근 3년간 평균 7% 이상 수준의..."
438,2017.08.24.,"정용진 ""복합쇼핑몰 규제 형평성 '문제'…이케아 포함돼야""",(서울=연합인포맥스) 김용갑 기자 = 정용진 신세계그룹 부회장이 문재인 정부의 복합쇼핑몰 규제가... 2018년부터 복합쇼핑몰에 대해 대형마트 수준의 영업제한 등을 시행해 골목상권을 보호할 방침이다. ygkim@yna.co.kr (끝)
439,2017.08.17.,베일 벗은 신세계 스타필드 고양···어떤 쇼핑 콘텐츠 담겼나?,"【서울=뉴시스】 17일 오전 경기도 고양시 스타필드 고양 3층에서 프리오픈 기념 기자간담회가 열린 가운데... 지역 상권 특성을 반영해 스타필드 고양을 완성했다""며 ""고객들의 체류 시간을 늘리기 위해 키즈 관련 체험..."
440,2017.08.22.,"인천도시공사, 검단신도시 공동주택 잔여용지 9월 공급",[헤럴드경제(인천)=이홍석 기자] 인천도시공사는 서울과 가장 가까운 2기 신도시인 검단신도시내... &lt;조감도&gt; 이번에 공급하는 2개 필지는 오는 2024년 개통 예정인 인천지하철 1호선 연장선과 중심상권이 1km이내...
441,2017.08.23.,덩치 커진 '다이소' 동네 문방구 생존권 위협,생활용품 저가매장 '다이소'가 창립 20년 만에 매출 2조원 달성을 앞두고 있는 가운데 중소 문구유통업 등 골목상권을 침해하고 있다는 비판의 목소리가 높아지고 있다. 사진은 서울 시내 한 다이소 매장. 생활용품...
442,2017.08.28.,공정거래법도 진화해야 한다,또한 '총 매출기준'으로만 보는 것은 중앙집권적이고 서울 기준의 시각이다. 지역 상권의 시각에서 보면 '상권영향 기준'으로 보아야 한다. 영세한 자영업자들이 많기 때문에 지역 상권에 미치는 영향이 훨씬 더...
443,2017.08.25.,[화제의 분양현장]배후수요 탄탄한 구파발역 인접 상가,서울 서북부 마지막 핵심 상권으로 평가받는 구파발역 상권에 위치해 있는 데다 롯데몰 은평·가톨릭대학병원·소방행정타운 등 탄탄한 배후수요를 갖추고 있다. 특히 최근 정부의 부동산대책에 따른 수익형...
444,2017.08.26.,고양 시니어 기술창업센터 개소,"한편, 고양시와 진흥원은 서울, 경기 남부 등과 비교, 상대적으로 크게 부족한 고양시 내 창업 생태계 구축을... 경우, 상권 포화 등으로 실패 사례가 빈발하는 만큼 시니어 센터가 중장년 창업의 새로운 돌파구가 될 수..."
445,2017.08.28.,[핫 플레이스를 가다]1. 경주 황리단길,불과 2~3년 전만 해도 오래된 가게가 다닥다닥 붙어있어 경주의 대표적인 침체 상권을 이루고 있던 지역이... △젊은이의 거리 ‘황리단 길’ ‘황리단길’은 서울 이태원의 경리단길에서 힌트를 얻어 황남동이...
446,2017.08.21.,[빅데이터MSI]시장심리 톱5...신세계·대우조선해양·롯데케미칼·GS·오리온,신세계 측은 지난 3월 청라국제도시 최대 규모인 이 쇼핑몰에 대해 건축 허가를 신청했으나 지역 상권... 서울북부지법 민사11부(최남식 부장판사)는 지난 17일 오리온 전 사장인 조경민 씨가 담 회장 부부를 상대로...
447,2017.08.23.,"할리스커피, 직영 100개점 돌파…선진적 프랜차이즈 모델 제시","할리스커피 100번째 직영점은 서울 용산구에 위치한 이태원점으로, 이태원역에서 나오면 바로 할리스커피... 김유진 할리스커피 대표는 “할리스커피는 가맹으로 입점하기 어려운 주요 상권에 직영점을 입점시킴으로써..."
448,2017.08.21.,"엔제리너스커피, 착한 가격의 ‘천사 커피 및 주스’ 출시",오피스 상권 인근 매장에서 먼저 선보인 이후 테스트 기간을 걸쳐 전 매장으로 확대할 예정이다”고 말했다. soul@sportsseoul.com ▶스포츠서울 공식 페이스북 ▶스포츠서울 공식 유튜브 채널 [기사제보 news...
449,2017.08.21.,"휠라 광주 충장로 스토어, '헤리티지 뮤지엄'으로 새단장",[서울경제] 휠라코리아는 광주광역시 동구 충장로에 위치한 ‘휠라 충장로 메가스토어’(사진) 리뉴얼 오픈을 단행했다고 21일 밝혔다. 휠라 광주 충장로 메가스토어는 지난해 휠라가 전국 주요 도시 핵심 상권에 오픈한...
450,2017.08.17.,"신세계, 스타필드 고양 프리 오픈···""첫 1년차 매출 6500억원 목표""","스타필드 고양은 반경 핵심상권인 3㎞이내에 인구 밀집 지역인 고양시와 서울 서북부 지역이 있다. 서울 강서, 마포, 경기도 김포, 파주 등 30분내 접근 가능한 지역에 500만명 이상이 거주하는 초대형 상권을 배경으로..."
451,2017.08.28.,황금단지 여기 있었네! GTX 새길 따라 집값도 ‘쑥쑥’,강남상권 지역으로의 이동이 매우 가까워질 전망이다. GTX A노선인 파주~일산 구간이 연장(예정)되면 강남 삼성역까지 도착 시간도 크게 줄어 서울로의 출퇴근이 보다 수월해질 것으로 예상된다. 이밖에 2020년에는...
452,2017.08.23.,[원주기업도시 반도유보라 아이비파크②입지]중심상업지구·수변공원 가까워 ...,단지가 원주기업도시 내에서도 메인상권에 가까운 입지에 들어서 다양한 편의시설을 편리하게 이용할 수... 제2영동고속도로 서원주IC 진입도 수월해 서울 강남권까지 50분대 이동이 가능하다는 게 분양 관계자의...
453,2017.08.29.,[2018 예산안] 소상공인 상생자금 200억원 투입…재도전 지원한다,정부는 29일 정부서울청사에서 열린 국무회의를 통해 ‘2018년 예산안’을 확정하고 소상공인 지원 방안을... 상권내몰림 현상 방지 차원에서 상가 임대인‧임차인간 상생협력을 전제로 60억원의 상권활성화 지원...
454,2017.08.23.,"[창업성공탐구] 펫코노미 산업의 성공 전도사, 러브펫코리아 최인영 대표",서울 영등포 타임스퀘어점을 비롯해 가맹본사는 직영점 운영을 통해 충분한 수익을 내고 있어 가맹본사... /러브펫코리아 제공 사업모델 설계는 상권이나 입지 특성에 따라 조금씩 달라진다. 운영 효율성이 높은 평수는 66...
455,2017.08.24.,중소형+α특화설계… 기업도시 최초 별동학습관 조성,수월해 서울 강남까지 50분대에 이동할 수 있다. 또 3.3㎡당 평균 670만원대의 착한 분양가를 책정... 김지호 반도건설 소장은 “단지는 원주기업도시 내에서도 메인 상권이 가까운 중심생활권에 위치해 있고 단지 앞...
456,2017.08.17.,"[공식]NEW, 프리미엄 영화관 '씨네큐' 1호점 오픈",주변상권의 기대를 모으고 있다. 또한 경북지역을 필두로 추후 서울 신도림/ 충북 충주/ 전남 목포/ 남양주 진접 등 관객수요가 있는 사이트들을 차례로 오픈하며 점진적으로 멀티플렉스 체인을 전국규모로 확장해...
457,2017.08.22.,"반도건설, '원주기업도시 반도유보라 아이비파크' 25일 분양",또 제2영동고속도로 서원주IC와 서원주JC 진입이 수월해 서울 강남까지 50분대에 이동할 수 있다. 풍부한 생활인프라도 누릴 수 있다. 단지는 원주기업도시 내에서도 메인 상권이 가까운 중심생활권에 위치해 있다....
458,2017.08.17.,"LG전자 ""3년내 미국 빌트인 가전시장 톱5 올라서겠다""","있는 서울 논현동 가구 거리 중심가에 지상 5층, 지하 1층 규모 대형 전시관을 열었다. 외부에는... ◆세계 첫 빌트인가전 모델하우스 LG전자의 논현동 전시관은 월 임대료만 1억원에 달하는 핵심 상권에 있다...."
459,2017.08.29.,“미시령 터널 통행요금 무료화땐 재정악화 불가피”,인제군이 서울~양양고속도로 전면 개통에 따른 44번 국도 통행량 감소로 미시령터널 통행 요금 무료화를... 자유한국당 김시성(속초) 의원은 “경기 침체가 계속되는 인제 지역 상권 활성화를 위해서는 대안이 마련돼야...
460,2017.08.17.,"LG전자 ""3년내 미국 빌트인 가전시장 톱5 올라서겠다""","있는 서울 논현동 가구 거리 중심가에 지상 5층, 지하 1층 규모 대형 전시관을 열었다. 외부에는... ◆세계 첫 빌트인가전 모델하우스 LG전자의 논현동 전시관은 월 임대료만 1억원에 달하는 핵심 상권에 있다...."
461,2017.08.29.,“미시령 터널 통행요금 무료화땐 재정악화 불가피”,인제군이 서울~양양고속도로 전면 개통에 따른 44번 국도 통행량 감소로 미시령터널 통행 요금 무료화를... 자유한국당 김시성(속초) 의원은 “경기 침체가 계속되는 인제 지역 상권 활성화를 위해서는 대안이 마련돼야...
462,2017.08.23.,"PC방 창업, 업체 광고만 믿고 계약하면 위험해",실제로 한 프랜차이즈 PC방을 오픈해 서울에 매장을 운영하고 있는 최 모씨(35세)는 “창업 전 접했던 광고... 상권 분석부터 매장 오픈과 운영 관리에 세심한 길잡이 역할을 하는 피에스타PC방은 체계화된 시스템과...
463,2017.08.29.,핵심 가두상권 주간 리포트,"서울 명동, 부산 광복 상권과 달리 외국인 관광객 비중이 낮지만 젊은 층 유동인구가 많아 SPA 세일이 집객력을 크게 좌우한다. 여름 세일을 끝내고 가을 장사를 준비하는 전환기에 일시적인 소강 현상을 보이고 있는..."
464,2017.08.24.,성공적인 상가투자 0순위 ‘역세권’ 갖춘 ‘공덕 SK 리더스 뷰’ 단지 내 상...,"서울 지하철 공덕역 출구 바로 앞에 위치한 ‘신영 지웰’ 상가의 경우, 공급 당시 3.3㎡당 5100만원대의... 실제로 ‘공덕 SK 리더스 뷰’ 단지 내 상가가 위치한 공덕역세권 상권의 경우 최근 3년 간 평균 7% 이상 수준의..."
465,2017.08.21.,"엔제리너스커피, 2,000원대 커피로 중저가 커피시장 공략",오피스 상권 인근 매장에서 먼저 선보인 이후 테스트 기간을 걸쳐 전 매장으로 확대할 예정이다”고 말했다. /박윤선기자 sepys@sedaily.com [서울경제 바로가기]1997년 이래 대한민국 최고의 과학자 DB [바로가기]...
466,2017.08.20.,[특별좌담]극작가 4인 '세월호를 이야기로 쓴다는 것',폐업까지는 아니지만 상권이 죽었다고. 그분들도 직접 당사자는 아니지만 영향을 받았다는 얘기를 했던 게... 게다가 ‘세월호2016’ 참여작이었던 &lt;킬링 타임&gt;이 광화문 블랙텐트와 서울변방연극제에서도 재공연됐다....
467,2017.08.24.,[비즈니스맨 레스토랑] 강남 역삼동 `나폴리회관`,"이탈리아서 전수받은 피자·리소토…한국선 못본 맛 서울 신논현역과 강남역 사이 강남대로 메인거리... 강남 상권 '만남 명소' 중 하나로 꼽히고 있다. 나폴리회관을 연 최정태 셰프는 전 일식집 셰프로, 무려 7년여 동안..."
468,2017.08.27.,[한겨레 사설] 4천원짜리 구내식당까지 재벌이 손대야 하나,서울의 한 구내식당에서 직원들이 점심식사를 하기 위해 줄을 서서 차례를 기다리고 있다. 한겨레 자료사진.... 2012년 재벌의 골목상권 침투가 사회문제로 불거지자 이명박 정부는 재벌의 공공기관 구내식당 운영을...
469,2017.08.23.,[주목! 하반기 분양] 교육특화 '원주기업도시 반도유보라 아이비파크',"수월해 서울 강남권까지 50분대 이동이 가능하다. 풍부한 생활 인프라를 가까이 누릴 수도 있다. 단지는 원주기업도시 내에서도 메인상권이 가까운 중심생활권에 위치하며, 단지 앞 수변공원과 인근으로..."
470,2017.08.25.,"상가정보연구소, '2017 하반기 실전 상가 투자 세미나' 개최","상가정보연구소는 다음달 1일 서울 양재역 1번 출구 앞 서희타워 5층 상가정보연구소 세미나실에서 ‘2017... 체크와 상권, 입지, 매입가 등을 객관적으로 파악해주는 순서로 진행된다. 이상혁 선임연구원은 “이번 행사는..."
471,2017.08.16.,"LG전자, '신시장' 이라크에 프리미엄 브랜드숍 오픈",방문객들(서울=연합뉴스) LG전자는 중동의 새로운 시장으로 떠오르는 이라크에 역대 최대 규모 프리미엄 브랜드숍을 개장했다고 16일 전했다. 15일(현지시간) 이라크 에르빌의 핵심 상권에 문을 연 프리미엄...
472,2017.08.24.,정용진 부회장 “한차원 더 높은 고객가치 드리겠다”,반경 핵심 상권인 3㎞ 이내에 인구 밀집 지역인 고양시와 서울 서북부 지역이 위치하고 있다. 신세계백화점과 이마트 트레이더스 등 신세계의 대형 쇼핑매장을 비롯해 아쿠아필드와 스포츠몬스터 등 엔터테인먼트...
473,2017.08.17.,"NEW, 프리미엄 영화관 '씨네 큐' 개점 '극장사업 시작'","복합상권이 방문객들의 편의를 돕는다. 약 300대의 차량을 수용할 수 있는 대형 주차타워를 보유한... 또한 경북지역을 필두로 추후 서울 신도림, 충북 충주, 전남 목포, 남양주 진접 등 관객수요가 있는 지역들에 차례로..."
