,date,title,contents
476,2017.04.25.,[포토]명동 상권 '휘청',[ 중국 정부의 방한금지령이 42일 지난 25일 서울 중구 명동쇼핑거리에 폐점포가 속출하고 있다. 요우커 수요에 의존해 품목을 집중적으로 들여오던 몇몇 상점들이 높은 임대료를 내지 못해 내쫓기듯 문을 닫고...
477,2017.04.27.,봄바람 따라 목포 여행 단체 관광객 ‘북적’,"시는 올해 초 서울에서 관광설명회를 개최하는 등 다양한 홍보마케팅을 펼쳐오고 있다. 1박2일, 2박3일 등... 이를 위해 평화광장을 ‘스토리가 있는 연인의 거리’로 명명해 상권을 관광상품화하고, 전국대상..."
478,2017.04.27.,메디컬센터 프리미엄 투자가치 기대되는 ‘대치3차 아이파크’ 상가,"메디컬센터가 들어서는 상가는 핵심점포 확보로 고정 고객들이 유입되면서 상권 활성화를 이끌기 때문에... ‘대치3차 아이파크’는 서울 강남구 대치동 945-20, 30번지 일원에 위치하며 지하 4층~지상 15층 1개동 규모로..."
479,2017.04.27.,[미주통신]25년 전의 그 불길을 기억하자,당시 서울에서 다니러 온 아버지는 모든 것을 잃고 무너진 아들과 딸의 모습에 충격을 받고 쓰러져서 못... 흑인들이 북쪽을 향해 올라오자 공권력은 그 저지선을 백인 지역으로 정했기에 중간지역에 상권을 펼치고 있는...
480,2017.04.27.,[미주통신]25년 전의 그 불길을 기억하자,당시 서울에서 다니러 온 아버지는 모든 것을 잃고 무너진 아들과 딸의 모습에 충격을 받고 쓰러져서 못... 흑인들이 북쪽을 향해 올라오자 공권력은 그 저지선을 백인 지역으로 정했기에 중간지역에 상권을 펼치고 있는...
481,2017.04.26.,김포 '자이' 물결…매머드급 '한강메트로' 내달 분양,"GS건설(006360)이 최근 서울 근교 주거지로 주목받고 있는 김포에서 매머드급 단지인 ‘한강메트로자이’... 1만명 이상이 거주하다 보니 교통, 상권이 아파트를 따라 집중된다. ‘도시공원 및 녹지 등에 관한 법률’..."
482,2017.04.24.,브랜드 가치 1조원 동대문 패션몰 ‘유어스’ K-패션 교두보,유어스 상권이 무조건 살아 있어야한다”고 입을 모았다. /김동호기자 dongho@sedaily.com [서울경제 바로가기]'장미전쟁'의 승자는...5월 대선 실황중계 [바로가기]서울경제의 모든 연재물!... 서경Cube [바로가기...
483,2017.04.28.,철도·도로 뚫리는 지역 부동산 ‘눈길’,"비롯한 서울 서부권 교통망의 허브로 기대된다. 청라국제도시에서 분양도 이어진다. 현대BS&amp;C가 공급하는 ‘현대썬앤빌 더테라스’ 상업시설은 청라지구 중심입지인 중봉대로와 시티타워 사이, 청라 커낼웨이 상권에..."
484,2017.04.27.,"NH농협금융, NH농협금융PLUS+ 삼성동금융센터 개점","이번 삼성동 금융센터 개점으로 NH농협금융은 광화문, 여의도, 강남까지 서울 핵심상권에 총 3개의 거점 복합점포를 갖추게 됐다. 삼성동 금융센터에서는 세무, 부동산, 법률자문 등 각 분야 전문가들이 금융자산관리..."
485,2017.04.26.,"수제맥주와 수제버거, 프랜차이즈 창업 어때요","맥주시장을 보면, 3~4년 전만 해도 수제맥주는 서울 이태원이나 홍대 인근에서만 볼 수 있었다. 그러나 2014년... 골목상권에서 단단한 입지를 굳히고 있다. 실시간 재테크 경제뉴스│창업정보의 모든 것 강동완 기자..."
486,2017.04.26.,“영화 속 가상공간처럼 새로운 쇼핑 공간을 제공합니다”,특히 서울 주요 상권에만 입점하는 ‘자라’와 ‘H&amp;M’이 ‘트리플스트리트’에 메가몰 형태로 입점한다는 것은 주목할 필요가 있지 않을까요?” ‘트리플스트리트’는 4월 29일 그랜드 오픈을 맞아 인기 애니메이션...
487,2017.04.25.,"6만 4천여세대 배후수요, 동탄 호수공원 '우성 애비뉴타워'",실제 한국감정원에 따르면 지난해 4분기 기준 항아리 상권으로 불리는 서울 목동의 경우 집합상가 투자수익률이 서울 평균 투자수익률 1.54%보다 0.41% 높은 1.95%를 기록했다. 대표적인 항아리 상권에는 동탄신도시를 꼽을...
488,2017.04.28.,공실률 낮고 수익률은 높아… 상업시설 ‘인기몰이’,대림산업이 시공하는 상업시설은 서울 금천구 독산동 1007-19번지 일대에 위치해 있으며 지하 1층~ 지상 2층... 대규모의 상권을 형성할 전망이다. 온라인 뉴스팀 기자(sungahmanse@sbs.co.kr) ☞ 의견 있는 경제채널 SBSCNBC...
489,2017.04.24.,'삼송2차 원흥역 동원로얄듀크 비스타' 개관 후 북적북적,"공급 [서울경제] 동원개발이 짓는 경기 삼송2차 원흥역 동원로얄듀크 비스타 아파트와 비스타 에비뉴 상가... 하지만 사업이 마무리 단계에 공급되는 아파트는 교통체계가 정비되고, 교육시설 및 상권이 형성되는 등..."
490,2017.04.26.,[천자춘추] 경기도의 공공임대상가 실험,"코오롱이 임대한 사유지에 컨테이너로 60여개의 상가를 조성한 이 쇼핑몰은 저개발지역이었던 주변 상권에까지 활력을 불어넣으며 외국인까지 끌어 모으고 있다. 고려대의 ‘개척마을 파이빌’, 서울시의 ‘무중력지대..."
491,2017.04.27.,"NH농협금융, 11번째 복합금융 센터 개점","이번 삼성동 금융센터 개점으로 NH농협금융은 광화문, 여의도, 강남까지 서울 핵심상권에 3개의 초대형 거점 복합점포를 갖추게 됐습니다. 삼성동 금융센터는 세무, 부동산, 법률자문 등 각 분야의 우수한..."
492,2017.04.24.,강남·잠실…은행 `알짜 점포` 줄줄이 급매물,등 서울시내 핵심 상권에 위치한 시중은행 점포들이 최근 잇달아 매물로 쏟아져 나오고 있다. 오프라인 영업지점 대신에 모바일·온라인을 통한 비대면 영업이 기하급수적으로 확산되면서 시중은행들이 임대 비용이...
493,2017.04.25.,대형 쇼핑몰 호재에 `배곧3차호반베르디움` 관심,단지 앞으로 중심 상권이 형성되면서 상업시설과 편의시설도 잘 갖춰지고 있다. 지하철 4호선·수인선... 지난해 서울대학교 시흥캠퍼스 실시협약도 체결되면서 기대를 모으고 있다. [매경 부동산센터 [매일경제 공식...
494,2017.04.26.,"[표지 이야기]우클릭 안보, 좌클릭 복지 ‘가속도’",19대 대통령 선거에 출마한 5개 원내 정당 후보들이 4월 19일 서울 여의도 KBS에서 스탠딩 형식으로 열린 두... 골목상권 출점 규제를 강화하겠다는 공약을 내놨다. 유 후보 역시 공정거래위원회 전속고발권 폐지...
495,2017.04.24.,건대 앞 영화관 ‘삼국지’,"내년 CGV이어 메가박스 곧 진출 롯데시네마 ‘아성’에 도전장 CJ CGV가 서울 건국대학교 주변에 신규 멀티플렉스를 짓고, 이 일대 영화 상권을 장악하고 있는 롯데시네마에 도전장을 던진다. 메가박스도 성수동으로..."
496,2017.04.25.,"롯데백화점 부산, 가구 최대 수요지로 부상","서울특별시 7.2%, 경기도 11.2%보다 높은 증가세를 보였다.   또한 지난해부터 부산지역 신규 분양 대단지 아파트에 입주가 본격적으로 시작 된 것도 가구 수요 증가를 이끈 요인으로 지목되고 있다.   롯데백화점 상권분..."
497,2017.04.27.,2017 실전 상가투자 세미나,"부터 서울 양재역 1번 출구 바로 앞 서희타워 10층 상가정보연구소 세미나실에서 ‘2017 실전 상가투자... 세부적으로 대선이후의 상가시장 기상도를 전망하고 상가투자 공실 위험성이 높은 상권과 입지 구분법, 상가의..."
498,2017.04.20.,용산 '해방촌' 도시재생활성사업 본격 추진,그러나 1990년대 이후 지역산업 쇠퇴와 주거 환경 노후화로 인구 유출과 지역 상권 침체가 이어졌다. 이에 서울시는 새로운 주거지 재생모델 정립과 확산을 위해 2015년 3월에 해방촌 지역을 ‘서울형 도시재생...
499,2017.04.24.,"부산지역 롯데백화점, ""가구 최대 수요지로 급부상""","9%, 서울특별시 7.2%, 경기도 11.2%보다 높은 증가세를 보였다. 또한 지난해부터 부산지역 신규 분양 대단지 아파트에 입주가 본격적으로 시작 된 것도 가구 수요 증가를 이끈 요인으로 지목되고 있다. 롯데백화점 상권분석..."
500,2017.04.20.,해방촌·가리봉동 도시재생사업 본격화,"하지만 이후 급속하게 쇠퇴하며 주거 노후화와 인구 감소, 상권 침체로 이어졌다. 그런가 하면 서울 서남부인 구로구 가리봉동 일대는 이보다 빠른 1960~1970년대 구로공단을 위시한 산업 발전의 중심지였다. 하지만..."
501,2017.04.24.,"부산지역 롯데백화점, ""가구 최대 수요지로 급부상""","9%, 서울특별시 7.2%, 경기도 11.2%보다 높은 증가세를 보였다. 또한 지난해부터 부산지역 신규 분양 대단지 아파트에 입주가 본격적으로 시작 된 것도 가구 수요 증가를 이끈 요인으로 지목되고 있다. 롯데백화점 상권분석..."
502,2017.04.25.,"한국자산신탁, 오산 '르마레시티' 5월 분양","용인-서울고속도로도 인접해 수도권 및 화성, 평택, 용인 등으로 편리하게 이동할 수 있다. 동탄의... 스트리트형 상가는 보행로 양쪽에 연이어 배치돼 유동인구의 체류시간이 늘어 뛰어난 상권이 형성되는 장점이..."
503,2017.04.27.,[미리보는 이데일리 신문]'JY 결단'..삼성전자 지주사 접었다,"트럼프 ‘반전카드’ △금융 -“상권분석·경매전략..부동산투자, 은행서 상담하세요” -Sh수협은행... △부동산 -서울 강남 60㎡ 아파트, 올해 재산세 10만원 오른다 -이건희 회장의 ‘서초 트라움’ 66억원..공동주택..."
504,2017.04.25.,"롯데백화점, 황금연휴 '외국인 프로모션' 열어 동남아·일본인 잡는다",롯데백화점은 25일 서울시 산하 서울관광마케팅과 업무협약(MOU)을 맺고 연휴 기간 외국인 프로모션 협업... 오는 28일부터 다음달 7일까지 명동관광정보센터 내에서 명동 상권 영수증을 소지한 외국 관광객을...
505,2017.04.26.,"이통사, 휴대폰 집단상가 모니터링 가이드라인 제정","활용 서울 구로구 신도림 테크노마트 9층 휴대폰 판매점. [휴대폰 불 ·편법 영업이 자행되는 집단상가에... 주별 최대 신고건수는 5건, 상권별로는 최대 2건이다. 26일 업계에 따르면 한국정보통신진흥협회(KAIT)는..."
506,2017.04.28.,"크린위드, ""차별화된 세탁시스템과 적극적인 마케팅 지원""","[서울=일요신문] 김원규 기자= 프랜차이즈 세탁편의점 `크린위드`는 차별화된 세탁 시스템과 본사의... 때 상권조사 및 입지분석, 합리적인 비용, 오픈 교육 등 체계적인 개설절차에 대한 설명을 듣고 계약하게 됐다”고..."
507,2017.04.24.,제주도 고급 오피스텔 ‘세인트스톤 더 부티크’ 인기↑,"부동산 업계에 따르면 서울 시내 30억원 이상 아파트 매매 거래는 지난해 기준 4년 전보다 3배 늘어났으며... 단지는 무엇보다 제주 최고의 중심상권 연동에 자리하여 바오젠거리, 대형마트 및 특급호텔 등이 인접해..."
508,2017.04.28.,[대선후보 공약 대해부 <5> 경제 활성화 방안] 文 재정 확대 vs 安 민간 중심...,[서울신문] 대통령 파면과 북핵 안보위협 등 안팎으로 극심한 혼돈 속에 치러지는 대선이지만 국민들의... ●劉 “中企·골목상권의 밑바닥에 온기” 바른정당 유승민 후보도 중소기업과 골목상권을 지켜 바닥에서부터...
509,2017.04.27.,"관광지 일대 수익형 부동산, 신주거상품으로 인기↑","[서울신문] 제주도는 관광객 증가를 비롯한 지속적인 인구 유입, 다양한 개발계획 시너지로 전국에서... 핵심상권에 위치해있어 편리한 생활 인프라를 누릴 수 있다. 또한, 광양초, 제주제일중, 오현고, 제주대가 인접해 초..."
510,2017.04.27.,"관광지 일대 수익형 부동산, 신주거상품으로 인기↑","[서울신문] 제주도는 관광객 증가를 비롯한 지속적인 인구 유입, 다양한 개발계획 시너지로 전국에서... 핵심상권에 위치해있어 편리한 생활 인프라를 누릴 수 있다. 또한, 광양초, 제주제일중, 오현고, 제주대가 인접해 초..."
511,2017.04.19.,"코리아세일페스타, 추석 연휴에 열린다···VR 쇼핑몰도 눈길","지난해 9월 열린 ‘코리아 세일 페스타’ 기간에 서울 중구 롯데백화점이 쇼핑을 하러 나온 고객들로... 특히 민·관이 함께 구축하는 유통업체, 전통시장, 거리상권 등 가상현실(VR) 매장이 눈길을 끈다. 소비자들은..."
512,2017.04.24.,"롯데百, 부산! 가구 최대 수요지로 급부상","9%, 서울특별시 7.2%, 경기도 11.2%보다 높은 증가세를 보였다. 또 지난해부터 부산지역 신규 분양 대단지 아파트에 입주가 본격적으로 시작 된 것도 가구 수요 증가를 이끈 요인으로 지목되고 있다. 롯데백화점 상권분석시..."
513,2017.04.26.,파리바게뜨ㆍ뚜레쥬르의 新 BI는 ‘스내킹(Snacking)’,[사진=뚜레쥬르 공덕해링턴점] 공덕해링턴점은 이보다 한단계 더 진화한 상권특화형 매장이다. 대표적인... [사진=파리바게뜨 마켓 신논현점] 파리바게뜨는 2015년 11월 서울 신논현역 인근에 ‘파리바게뜨 마켓’을...
514,2017.04.26.,[현장스케치] 대형마트 ‘혈투’ 지역 영등포에 뛰어든 롯데마트…“차별화로...,"경쟁이 치열한 서울 서남부 상권에다 신규 출점한 것에 대해 신주백 롯데마트 상무는 “양평점이 입지한 상권은 영등포구는 물론 양천구, 구로구까지 150여만 명이 거주하는 지역”이라며 “자체 조사 결과 이 지역에서..."
515,2017.04.21.,교보문고 합정점 21일 문 열어,합정역 딜라이트스퀘어에 700평 규모 [CBS교보문고 합정점.교보문고 합정점이 4월 21일 서울 마포구 합정동... 특히 20~30대가 편안하게 즐겨 찾는 공간으로 구성하여 홍대상권을 합정역까지 확장시키는 효과를 기대하고...
516,2017.04.25.,112 신고 하루 100건… 한국서 가장 바쁜 홍익지구대 가보니,홍대 앞은 물론 최근엔 망원동 등 인근 상권도 팽창하면서 서울에서도 가장 많은 젊은이가 몰려드는 동네다. 사건 사고도 끊이지 않는다. 홍익지구대도 말 그대로 밤낮없이 돌아간다. 다른 지구대보다 배로 많은 경찰...
517,2017.04.23.,“자영업은 지옥…카드 수수료 1% 미만 내릴 때 안 됐나”,20일 서울 합정역 근처 한 카페에 40~50대 ‘사장님’ 여섯 명이 모였다. 젊은 시절 일찌감치 자영업에 둥지를... 시장진흥공단에서 상권을 조사해보니 반경 5~10km의 상인들의 피해가 심각했다. 평균 매출이 56% 하락했다고...
518,2017.04.24.,"가구업계, ""매장 넓혀라"" 치열한 대형화 리뉴얼 경쟁",주요 상권에 쇼룸 형태의 프리미엄샵을 확대 하고 있다. 단순히 제품을 나열하는 기존 방식에서 벗어나 각... 창립 46주년 기념일에 맞춰 서울 논현 직매장을 멀티플렉스샵으로 리뉴얼했고 광주 서구 치평동에 프리미엄...
519,2017.04.21.,"대형 서점, 홍대 인근으로 몰린다…교보문고 합정점 개설",교보문고 합정점 모습[교보문고 제공] '젊음의 거리' 서울 홍익대 인근 상권에 대형 서점들이 앞다퉈 진출하고 있다. 교보문고는 21일 서울 합정동에 10만여권의 책을 갖춘 합정점을 개설했다고 밝혔다. 합정역...
520,2017.04.21.,"대형 서점, 홍대 인근으로 몰린다…교보문고 합정점 개설",교보문고 합정점 모습[교보문고 제공] '젊음의 거리' 서울 홍익대 인근 상권에 대형 서점들이 앞다퉈 진출하고 있다. 교보문고는 21일 서울 합정동에 10만여권의 책을 갖춘 합정점을 개설했다고 밝혔다. 합정역...
521,2017.04.21.,"KEB하나은행, 전문가가 찾아가는 ‘부동산 투어 세미나’ 개최",KEB하나은행 부동산 전문가 및 PB들이 지난 20일 서울 성수동에서 ‘제3회 부동산 투어 세미나’에 참석해... 이날 참석자들은 부동산 및 금융 전문가들과 함께 성수동 명소와 인근 상권을 걸으며 투자포인트와...
522,2017.04.20.,"세븐일레븐, 특급호텔 노하우 담은 프리미엄 디저트 출시","[서울경제] 편의점 세븐일레븐이 본격적인 프미리엄 디저트 강화에 나섰다. 세븐일레븐은 올해(1~3월)... 세븐일레븐은 이들 상품을 수도권 주요 상권에 위치한 1,100여점에서 테스트 운영한 후 전국 매장으로 확대해 나갈..."
523,2017.04.25.,"'홍보트럭부터 관광패스카드까지' 롯데百, 외국인 잡는다",이에 롯데백화점은 서울관광마케팅과 전략적 제휴를 추진하고 다양한 외국 고객을 위한 프로모션을... 오는 28일부터 5월 7일까지 명동관광정보센터 내에서 명동 상권 영수증을 소지한 외국 관광객을 대상으로 백화점...
524,2017.04.26.,지역 상권 잡아먹는 공룡 유통망,하남 스타필드 또한 하남은 물론 서울 강동·광진구와 구리·남양주 상권 수요를 빨아들이고 있다. 오는 11월쯤 개장 예정인 고양 삼송 스타필드가 등장하면 서울 은평권과 고양·파주권이 큰 타격을 입을 게 분명하다. 대형...
525,2017.04.25.,"[SK텔레콤, 4.5G 혁신 선도]무선 1Gbps 머지않았다","현재 서울 강남과 홍대 지역에서 시범 서비스 중이며 전국 핵심 상권, 대학가로 확대할 계획이다. SK텔레콤은 “단말과 칩셋이 지원되면 4~5밴드 CA에 4×4 MIMO를 추가 적용, 최대 1Gbps 이상 속도를 제공할 수..."
526,2017.04.27.,[충청브리핑] 보성파워텍 “투표하면 1만원 줍니다”,"이어 서울서도 의혹 ‘논란’ 민주당, 동원증거 확보 선거관리위원회 신고 -“KTX세종역 신설 깔끔하게... 골목상권구도심 활성화” 이용섭 민주당 비상경제단장 ‘충북 10대 지원대책’ 제시 -충북교육청, 개청이래..."
527,2017.04.26.,"“이젠 중국인 대신 동남아-일본인 공략”… 백화점 중국어 안내문, 영어로 바...",이에 롯데백화점은 25일 서울시 산하 서울관광마케팅과 관광객 유치를 위한 양해각서(MOU)를 체결했다. 28일부터 다음 달 7일까지 명동 상권에서 구매한 영수증을 갖고 온 외국인 관광객에게 롯데백화점 전용 1만 원...
528,2017.04.19.,"올해 코리아세일페스타, 오는 9월28일~10월31일 열린다",정부는 19일 서울 광화문 정부서울청사에서 제7차 경제장관회의에서 이같은 내용의 ‘2017... 민·관 공동으로 유통업체·전통시장·거리상권 등의 VR 가상스토어를 시범 구축해 가상현실 환경에서 업체·상점별...
529,2017.04.18.,"성수동 상권 가파른 성장…""신규 창업 주의해야""",성수동 상권은 서울숲 주변에 고급 주거단지가 들어서고 지식산업센터 등 대형 업무시설이 자리를 잡으면서 급격히 활성화됐다. 그러나 임대료가 오르면서 신규 진입장벽이 높아지고 기존 상인도 재계약 시...
530,2017.04.27.,역세권 넘어 다세권으로…’신풍역 메트로카운티’ 조합원 모집,"지하철역과 가깝다는 의미로 만들어진 신조어로, 편리한 교통환경과 함께 상권이 발달해 있어 편리한... 또한, 1만여세대 신도시급 뉴타운으로 조성될 신길뉴타운과 바로 옆에 있어 떠오르는 중심지인 서울 남서부..."
531,2017.04.27.,"[황금연휴 두 얼굴④]""해외로 다 빠질텐데…"" 외식업체는 '무덤'","최장 11일 연휴, 해외여행객 200만명 전망 ""시내는 텅텅 빌텐데"" …오피스 상권 식당은 한숨 [5월1일... 이처럼 황금연휴 기간동안 해외로 빠져나가는 내국인이 크게 늘면서 서울 시내 식당들은 한숨을 쉬고 있다. 서울..."
532,2017.04.28.,명지국제신도시 포스코 3천여 세대 앞에 위치한 ‘명지 대산골든스퀘어’,"[서울신문 나우뉴스] 제2의 송도로 불리며 각종 개발 호재들로 주목받고 있는 부산 명지국제신도시에서는... 상권과 유동인구, 잠재고객, 기대수요 하나하나 따져보고 투자하면 안정적인 고정수입과 시세차익으로 인한..."
533,2017.04.24.,수익형 투자 ‘교통·미래가치’ 따져라,"동백역 앞에 입지한 동백 스퀘어일레븐은 동백지구 1만7000가구, 5만여 명의 배후수요를 가진 역세권 상권... 서울에서는 서울 성동구 ‘왕십리뉴타운 센트라스 153타워’가 분양 중이다. 상왕십리역세권 대로변..."
534,2017.04.25.,"한국자산신탁, 오산 일대 오피스텔 5월 분양예정","1호선 오산역과 오산버스터미널이 가까이에 위치해 대중교통 이용이 수월하며 오산 IC, 용인-서울고속도로... 스트리트형 상가는 보행로 양쪽에 연이어 배치되어 유동인구의 체류시간이 늘어 뛰어난 상권이 형성되는..."
535,2017.04.19.,"KT·신한카드, IoT 및 금융 플랫폼 업무 협약",&lt;아이뉴스24&gt; [아이뉴스24 양태훈기자] KT(대표 황창규)는 19일 신한카드와 서울시 중구 소재 신한카드... 또 KT가 보유한 기가(GiGA) 지오펜싱 플랫폼을 도입해 신한카드 가맹점 인근상권에 있는 고객에게 위치기반...
536,2017.04.24.,"치킨매니아, 21회 부산창업박람회 참가‥ 소자본 맞춤치킨창업 지원","[서울경제] 오는 4월 27일부터 29일까지 부산 벡스코(BEXCO)에서 ‘제21회 2017 부산창업박람회’가 개최된다.... 치킨매니아는 창업자의 투자자금과 상권의 특성에 따라 배달전문형, 홀&amp;배달형, 홀형 중 선택해 창업 할 수..."
537,2017.04.27.,"[머니워치쇼]재테크 깜깜이, 부자 아빠 꿀팁 '한가득'",주최로 서울 여의도 금융투자교육원에서 열린 '머니워치쇼 시즌4'에서는 부동산 및 해외 채권 투자부터... 중심으로 상권을 바라봐야 한다는 조언이 나왔다.   부동산 전문가인 박원갑 국민은행 WM스타자문단...
538,2017.04.26.,전주 객리단길 지속발전 특성화 전략 필요,이 같은 '젠트리피케이션 현상'(낙후됐던 구도심이 번성해 중산층 이상의 사람들이 몰리면서 임대료가 오르고 원주민이 내몰리는 현상)이 전국으로 확산되는 가운데 서울시 성동구는 구청이 주도로 상권을 지켜내고 있어...
539,2017.04.24.,[조물주 위 건물주]용적률 완화로 상가 임대료 묶는다,"-서울시 ·성동구, 이르면 5월부터 지자체 첫 시행 -용적률 20~30% 인센티브 대신 임대료 책정 권한 일부 소유 -구속력 있는 임대료 제한 방안 첫 마련 [서울시와 성동구가 '뜨는' 상권인 서울숲길 카페거리 상가의 임대료를..."
540,2017.04.24.,‘대치3차 아이파크’ 주말 3일간 2만5000명 방문,"‘대치3차 아이파크’는 서울 강남구 대치동 945-20, 30번지 일원에 위치하며 지하 4층~지상 15층 1개동... 상가는 유명 맛집이 한 공간에 모여 있는 컨셉형 레스토랑 ‘셀렉다이닝’이 입점해 주변 상권이 더욱 활기를..."
541,2017.04.25.,"배상면주가, 각 지역 막걸리 제조&유통 참여 ‘동네방네양조장’ 론칭","동네 상권의 음식점과 중소형 수퍼마켓 등으로 판매가 이뤄진다. 현재까지 ‘동네방네양조장’을 통해 막걸리 제조·유통에 나선 양조장은 총 8개로, 서울 마포 대흥동 양조장에서 만드는 ‘공덕동막걸리’, 구미..."
542,2017.04.19.,34일간 쇼핑대축제…'코리아세일페스타' 9월28일부터 개최,"지난해의 경우 서울 도심의 대형백화점 ·면세점 등 수도권 일부 지역에서만 할인 행사가 활발하게 열려... 올해 코리아세일페스타에서는 가상현실(VR)을 통해 백화점, 유명 거리상권 등을 체험하고 쇼핑까지 할 수 있는..."
543,2017.04.28.,용인 전원주택형 타운하우스 ‘동백 라온프라이빗 테라스파크’ 5월 분양,또 서울~세종고속도로가 오는 2022년 개통될 예정으로 향후 서울 접근성은 더욱 개선될 것으로 전망된다. 다양한 상권 인프라도 주목된다. 먼저 단지 앞에는 많은 유동인구와 활발한 상권을 자랑하는 용인동백지구가...
544,2017.04.23.,정부 “경제 훈풍”…기업·가계는 “글쎄”,게다가 사드 터지면서 서울 도심 상권이 다 날아갔다”고 전했다. 백웅기 KDI 수석이코노미스트는 “세계 경제가 회복되면서 지표가 조금씩 개선되고 있지만 업종 간 명암 차이가 크다”며 “북핵 리스크나 한·미 FTA...
