,date,title,contents
1491,2017.11.10.,동계올림픽의 중심지 평창의 알프스 테마마을 ‘아도르프’ 선착순 분양,[서울경제] 강원도 평창군 대관령면 용산리 383-3번지 일대에 알프스 테마마을 ‘아도르프’가 들어선다.... 길목상권이 되어 독점력 있는 상가가 되는 것은 물론 좋은 교통망으로 많은 관광 방문객이 늘어날 것으로...
1492,2017.11.02.,"KB국민은행, 소상공인 위한 무료 창업아카데미 개최","KB국민은행과 서울신용보증재단이 공동으로 주최하는 무료 창업 강좌다.  이번 아카데미는 창업절차, 상권 및 입지분석 활용방안, SNS를 활용한 홍보방법부터 창업자금 준비, 소상공인지원사업에 이르기까지..."
1493,2017.11.03.,"상가정보연구소, 10일 상가·오피스텔 합동설명회","듣고 상권과 입지‧분양가 등에 대한 투자성을 비교하고 판단해보는 자리가 마련된다. 박대원 상가정보연구소 소장의 '수익형부동산, 월세 패턴 분석 X파일 공개' 특강도 진행된다. 설명회는 서울 강남 역세권 상가..."
1494,2017.11.08.,"초역세권 오피스텔, 고덕역 더 퍼스트 '눈길'","2부동산 대책 이후 부동산 업계의 전문가들이 ""지하철역과 인접할수록 이동이 편리하고 주변 상권이 잘 갖춰져 있어 임차인들의 선호도가 꾸준하다""며 진단한 부동산 시장 상황이다. 위퍼스트(시행사)가 서울 강동구..."
1495,2017.11.16.,수익형부동산 투자 … 해답은 교통!,그리고 역을 중심으로 생활 인프라와 상권이 형성돼 투자 시 안정성이 더해 진다. 상업시설은 방문객이... 오는 2022년 개통을 앞둬 향후 이를 통해 서울 강남권까지 30분대에 도달 가능하다.    디지털 뉴스부
1496,2017.11.10.,[한경 매물마당] 수원시 치과병원 상가 등 9건,"◆서울 강남구 도곡동 대로 코너 사옥 부지=대로변 코너 나대지 860㎡. 사옥, 병원, 학원... (02)381-3478 ◆경기 일산 동구지역 상가=신규 일반 빌라 택지지구 700여 가구 항아리 상권. 상가 전면에 고등학교..."
1497,2017.11.11.,천혜의 속초 해변이 한 눈에 펼쳐지는 ‘양우내안애 오션스카이’ 12월 공개,사업지인 속초는 지난 6월 30일 서울-양양고속도로 전 구간이 개통되며 서울-속초간 90분 시대를 열었다.... 속초 양우내안애 오션스카이는 속초 고속버스 터미널 최인접 단지로 이마트 및 터미널 인접 상권 형성으로...
1498,2017.11.16.,"금성백조주택, 한강신도시 중심상업지구서 `한강신도시 구래역 예미지` 이달 ...","5km 이내에 3만여 가구가 거주하고 있어 빠른 상권 활성화가 예상된다. 단지 바로 서측으로 이마트... 개통돼 서울 출퇴근이 편리해질 전망""이라고 말했다. 모델하우스는 경기 김포시 장기동 일원에 마련되며, 이달 말..."
1499,2017.11.09.,"저금리 시대 뜨는 수익형부동산, 성수동 알짜배기 입지 확보한 서울숲 AK밸리",뿐만 아니라 서울숲과 뚝섬역 인근 공장건물이 카페나 식당으로 탈바꿈해 상권이 활발해졌고 서울의 센트럴파크로 불리는 서울숲과 성수동 테마공원 등과 인접해 도심 속 휴식과 산책도 즐길 수 있다. 업계 관계자는...
1500,2017.11.09.,"저금리 시대 뜨는 수익형부동산, 성수동 알짜배기 입지 확보한 서울숲 AK밸리",뿐만 아니라 서울숲과 뚝섬역 인근 공장건물이 카페나 식당으로 탈바꿈해 상권이 활발해졌고 서울의 센트럴파크로 불리는 서울숲과 성수동 테마공원 등과 인접해 도심 속 휴식과 산책도 즐길 수 있다. 업계 관계자는...
1501,2017.11.08.,[충청브리핑] 1000숍 다이소 “골목상권 잠식” 위기,전 서울경찰청장 ‘IDS홀딩스 뇌물수수’ 혐의 구속기소   ◇충청일보 -기록유산 국제기구 유치… ‘직지... “골목상권 잠식” 위기감 고조 성안길 흥업백화점 인수 후 대형매장 오픈 등 1년새 11곳 몸집 불리기…입점...
1502,2017.11.06.,"[단독] 굽네치킨, 인도네시아 진출…동남아시아 공략 '박차'",제공 | 굽네치킨 [스포츠서울 김자영기자] 치킨프랜차이즈 굽네치킨이 오는 12월 인도네시아 시장에... 모여있는 상권에 위치해 있다. 이번 인도네시아 매장은 홍콩·중국·마카오·일본 등에 이은 굽네치킨의 3번째...
1503,2017.11.02.,"소상공인의 든든한 버팀목… 국민은행, 무료 창업아카데미 개최","KB국민은행과 서울신용보증재단이 공동 주최하는 무료 창업강좌다. 이번 아카데미에서는 창업절차, 상권 및 입지분석 활용방안, SNS를 활용한 홍보방법부터 창업자금 준비, 소상공인지원사업에 이르기까지..."
1504,2017.11.03.,창원시 청년 2000명에 구직수당 준다,"상권 활성화라는 연쇄효과가 발생할 것으로 기대된다""고 밝혔다. 온누리상품권 주요 가맹점은 서점, 식당, 의류업, 이·미용업, 문구업, 안경점, 약국 등이다. 현재 구직수당(청년수당)을 지급하는 광역 지자체는 서울..."
1505,2017.11.07.,재벌개혁·골목상권 지키기 '올인'한 공정위 예산,"[사진 = 공정거래위원회][세종=국회가 6일부터 본격적인 예산심사에 돌입한 가운데, 재벌개혁과 골목상권... 또 신고사건을 도맡는 서울사무소의 비총액인건비성 기본경비도 올해 대비 52% 증가한 23억6000만원으로..."
1506,2017.11.05.,"“눈치를 왜 봐, 당당하게 들어와!”","홍대 앞 상권은 홍익대 입구를 기점으로 서울지하철 2호선 홍대입구역, 합정역, 서울지하철 6호선 상수역까지 확장돼 있는데 이 안에 서교초, 서강초, 성산중 등 학교가 있어 이를 피해 입점해야 한다. 물론 법률을 지키는..."
1507,2017.11.01.,[한중해빙]사드 직격 면세·화장품업계 기대감 속 신중론…왜?,"© News1 임세영 기자 ◇아모레·LG생건 ""사업포트폴리오 재정비 등 사드 위기를 기회로"" 화장품 업계 역시 3월 중순 이후 서울 특수상권 브랜드숍 채널과 면세점 채널 등에서 큰 타격을 받았다. 화장품산업의 성장을..."
1508,2017.11.03.,"상가정보연구소, 2017 상가·오피스텔 합동 설명회 개최","상권과 입지 및 분양가 등을 통해 투자성을 비교, 판단해 볼 수 있는 자리로 마련된다. 특히 상가정보연구소 박대원 소장의 '수익형부동산, 월세 패턴 분석 X파일 공개' 특강이 진행되며 설명회는 서울..."
1509,2017.11.09.,길 따라 상가 형성되니 '핫플레이스'…스트리트형 상권 인기 여전,"스트리트형 상권으로 형성돼 있는 경우가 많다.  대표적인 곳으로는 신사동 가로수길, 성수동... 실제로 롯데건설이 올 2월 서울 금천구 일대에서 분양한 스트리트형 상가인 '마르쉐도르 960'은 청약에서..."
1510,2017.11.06.,경의중앙선 가좌역 역세권 `DMC파크뷰자이5단지` 5억원대 거래돼…,"대학 상권을 쉽게 이용할 수 있다. 주변에 아파트 단지가 많아 홈플러스, 병원, 약국, 우체국, 은행, 음식점 등 각종 생활 편의시설이 모여있다. 교육시설로는 서울가재울초, 가재울고, 가재울중, 연희중, 연가초..."
1511,2017.11.01.,'워렌버핏 아이스크림' 9조원 한국 디저트 외식시장 첫발,"미국의 명물 '무중력 아이스크림' 데어리퀸 국내 첫 매장이 오는 4일 서울 종로구 대학로에 문을 연다. ⓒEBN... 푸트앤트리트는 내달 2호 매장인 이태원점을 비롯해 향후 5년간 강남, 홍대 등 주요 상권을 중심으로 50개..."
1512,2017.11.06.,[르포]한·중 '사드 외교합의' 후 1주일...온기 도는 명동 상권,"앓아온 서울 명동 상권 일대에 온기가 돌고 있다. 한·중 외교부가 10월31일 양국관계 정상화에 대한 의지를 밝히면서 서울 명동 일대 매장과 면세점, 백화점 등을 찾는 유커(遊客·중국인 관광객)도 점차 늘고 있다. 특히..."
1513,2017.11.17.,"[한강T-인터뷰] 정원오 성동구청장 ""2년 간의 젠트리피케이션 실험 속에서 '희...","지난 2년 서울숲길과 방송대길, 상원길 3곳을 지속가능발전구역으로 시범 지정해 건물주와 임차인... 특히 조례에는 상권이 발전함에 따라 대형 프랜차이즈 등이 입점해 소상공인들이 피해를 보지 않도록 하는데도 중점을..."
1514,2017.11.02.,"마스턴투자운용, 강남대로 1200억원대 빌딩 매입",지하철 9호선 개통 이후 강남역~신논현역에 이르는 서울 강남대로 상권의 가치는 치솟았다. 최근 중국인 관광객 감소로 임차료 상승세가 다소 주춤하지만 여전히 임차료는 비싼 편이다. 현재 강남대로변 1층 상가...
1515,2017.11.02.,주차난 시달리는 상암DMC… 숨통 트인다,많은 사랑을 받고 있다는 방증”이라며 “최소한 운영기간 동안에라도 주변 지역의 주차난 해소는 물론 상암 DMC 지역 상권 발전에 도움이 될 것으로 기대한다”고 말했다. [신아일보] 서울/이준철 기자 jclee@shinailbo.co.kr
1516,2017.11.08.,"유진그룹, 대형 산업용재 마트 진출…중소업계 ""총력저지""","한국열쇠협회는 서울 여의도 중기중앙회에서 기자간담회를 열고 이같은 내용을 담은 성명서를 발표하는 한편, 소상공인의 상권 보호를 위해 시장진출 저지에 나설 것임을 밝혔다.   장호성 한국산업용재협회 회장은..."
1517,2017.11.01.,'이번엔 甲질' 파도파도 나오는 홍종학 과거,"을지로위원회는 당시 ""임대료 폭탄과 권리금 약탈로 삶의 벼랑 끝으로 내몰리는 상인들이 부지기수""라며 ""현행 상가건물임대차보호법의 보호범위가 지나치게 비현실적이어서 서울의 경우 상권의 26%가 배제된다""고..."
1518,2017.11.10.,"‘노년의 희망’ 듬뿍 담은 빵, ‘맛 날개’ 달고 훨훨","서울에서 바리스타로 일하며 각종 자격증을 섭렵할 정도로 열심히 살았던 그였지만, 고향 전주로 돌아오니... 창업을 꿈꾸는 사람에겐 조언을, 일자리를 원하는 어르신에게는 일자리를, 일이 필요한 지역 상권에는..."
1519,2017.11.02.,퇴근 후 전원생활 누릴 수 있는 `인천서창LH6단지`,"하나공인 관계자는 ""다른 지역에 거주하던 매수인은 주변의 환경과 학군, 상권 등이 좋아 현장 답사 후... 차량 이용 시 영동고속도로, 제2경인고속도로로 진입이 쉬워 서울과 수도권 전역으로 빠르게 이동할 수..."
1520,2017.11.02.,퇴근 후 전원생활 누릴 수 있는 `인천서창LH6단지`,"하나공인 관계자는 ""다른 지역에 거주하던 매수인은 주변의 환경과 학군, 상권 등이 좋아 현장 답사 후... 차량 이용 시 영동고속도로, 제2경인고속도로로 진입이 쉬워 서울과 수도권 전역으로 빠르게 이동할 수..."
1521,2017.11.13.,고향사랑 상품권 전북예산 무일푼,골목상권에 활력을 불어넣고 있다. 특히 문재인정부가 아동수당 일부를 고향사랑상품권으로 지급할 수... 행안부는 지난 9월 정부서울청사에서 일선 시군 등 지자체를 대상으로 '고향사랑 상품권 설명회'를 열고 정부...
1522,2017.11.11.,"""쇼핑부터 외식까지 한번에"" 스트리트형 상가에 쏠린 눈","11일 업계에 따르면 고객 동선을 고려해 형성된 스트리트형 상권에 투자자들의 이목이 쏠리고 있다고 한다. 지난 2월 분양한 서울 금천구 일대 스트리트형 상가인 '마르쉐도르 960'은 청약에서 최고 304대 1, 평균 29.8대..."
1523,2017.11.06.,‘앵커시설’ 인근 초역세권 상업시설 ‘슈퍼블록’ 송도 아트윈몰 시선집중,"‘소상공인진흥공단 매출현황 데이터(6월 기준, 카드사 가맹점 매출통계 기반)’에 따르면, 서울 고덕역 상권의 월 평균매출은 6340만원이었다. 고덕역 주변에는 명일근린공원, 강동그린웨이캠핑장 등의 앵커시설이..."
1524,2017.11.13.,오피스 상권 메카…엘리트 직장인 ‘엑소더스’ 비상,금융기관의 이탈과 함께 시범·은하·삼부·장미·미성·서울아파트 등 30년 이상 된 노후 아파트들의 재건축 역시 여의도 상권의 악재로 작용하고 있다. 재건축이 진행되면서 기존 배후수요의 이탈 현상마저 발생하고...
1525,2017.11.08.,대전지역 대규모 사업장…지금은 ‘파업 중’,그러나 이 호텔이 폐업을 강행할 경우 200여명의 직원들은 일자리를 잃게 되고 유성지역의 상권 활성화... 8일 파업 30일째인 을지대학병원은 지난 7일 대전을지대학병원과 서울 을지대을지병원에서 파업이후 첫...
1526,2017.11.14.,4·7호선 이수역 도보 1분 거리 더블역세권 ‘방배마에스트로몰’ 주목,[서울신문] 하나의 역이 아닌 두 개의 역을 모두 누릴 수 있는 더블 역세권 상가는 단일 역세권에 비해... 역세권 상가라고 했지만 정작 지하철 역과 멀거나 상권 형성에 어려움을 겪는 경우들이 종종 있다. 부동산업계...
1527,2017.11.09.,"[비즈&] 표준협회, '제43회 국가품질경영대회' 개최 外",(8일) 서울 코엑스 오디토리움에서 개최됐습니다. 대회에선 국가 산업 경쟁력 향상에 이바지한 유공자와... 소용량 와인과 양주 등 18종의 상품으로 구성한 세븐바는 우선 주요 상권 1천여개 점포에서 시범 운영을 거쳐...
1528,2017.11.03.,"상가정보연구소, 2017 상가·오피스텔 합동 설명회",상가정보연구소는 10일 서울 서초 양재역 외교센터에서 수익형부동산 투자자를 대상으로 '2017 유망 수익형부동산 합동 설명회'를 연다고 3일 밝혔다. 다양한 수익형부동산 정보를 들을 수 있으며 상권과 입지 및 분양가...
1529,2017.11.08.,'철탑'이지연 대표·'석탑'김진업 협회장 수상,"지난달 30일 서울 중구 굿모닝시티쇼핑몰에서 '함께 만드는 우리 동네, 함께 누리는 대한민국!'이라는... 김병근 중기부 소상공인정책실장은 대회 축사에서 ""최근 사회적인 이슈로 떠오르는 '복합쇼핑몰 골목상권 침해..."
1530,2017.11.03.,엇갈린 상가 임대료… 합정역·종각 ↑ 강남·신사역 ↓,"이미지를 크게 보려면 국민일보 홈페이지에서 여기를 클릭하세요 3분기 서울 상권, 강북 오르고 강남 내려 합정역 13%↑… 종각, 3분기째 상승 익선동은 젠트리피케이션 우려까지 강남은 신사동 가로수길도 하락세..."
1531,2017.11.08.,"연이은 부동산 대책으로 상가 인기↑, 합정역 NO.1 입지 ‘딜라이트 스퀘어’...",‘딜라이트 스퀘어’는 대우건설이 서울 마포구 월드컵로 1길 14에 시공한 초대형 상가로 축구장 7개 크기인... 있어 상권의 활성화가 원활하다. 또 상가 간 오픈 브릿지를 통해 이어지도록 설계돼 빠르고 편리한 쇼핑...
1532,2017.11.06.,대형쇼핑몰 품은 미니신도시… 김포 ‘캐슬앤파밀리에 시티’ 12월 분양,대형쇼핑몰은 우수한 교통여건과 함께 수많은 유동인구가 형성된 활발한 상권에 들어서는 경우가 많다.... 서울 마곡지구까지 10분대다. 이와 함께 한강과 불과 2㎞ 정도 떨어진데다 사업지구 내 국제규격 축구장 약 7....
1533,2017.11.17.,(재테크)지식산업센터 투자 각광…교통·입지조건 잘 따져봐야,"전문가들은 3만평(약 9만9173.6m²) 이상 급 자체 독립상권이 형성된 곳에 투자하는 것이 필요하다고 조언했다.... 서울 성수동의 경우 강남과 광화문 등과 인접해 있으면서도 임대료가 70% 수준인 점, 주거인구가 밀집돼..."
1534,2017.11.15.,저금리 시대.. 다산신도시 알짜배기 입지 확보한 ‘다산신도시 블루웨일’ 각...,"㈜유승종합건설은 다음달 우수한 서울접근성과 다양한 생활인프라로 각광받는 다산신도시 내 최초의... 현대프리미엄아울렛(예정) 바로 앞 상권에 위치해 패션, F&amp;B, 라이프, 금융, 메디컬 등 조닝별 MD 구성을 갖춘..."
1535,2017.11.25.,"‘핫플레이스’ 연남동 음식점, 재방문율은?",서울 주요 상권. 사진=연합뉴스 [한스경제 김서연] 홍대 못지않은 번화가로 떠오른 연남동을 찾는 고객들의 재방문율이 20%에도 미치지 못하는 것으로 나타났다. 신한트렌드연구소는 목동(주거형) 여의도(오피스)...
1536,2017.11.03.,"KEB하나은행, 체험형 투자 자문 서비스 '부동산 투어 세미나' 개최","총 4회째를 맞은 이번 행사는 북촌, 홍대, 성수동에 이어 역사와 문화가 결합돼 독특한 상권으로 급 부상한 서울 성북동 일대에서 진행됐다. 심우장, 수연산방, 최순우 옛집 등 고스란히 보존돼 있는 예술인들의..."
1537,2017.11.02.,"[뉴스투데이 E] 국민銀, 소상공인 50여명 창업 고민 해결사로 나서","KB국민은행과 서울신용보증재단이 공동으로 주최하는 무료 창업강좌다.   이번 아카데미는 창업절차, 상권 및 입지분석 활용방안, SNS를 활용한 홍보방법부터 창업자금 준비, 소상공인지원사업에 이르기까지..."
1538,2017.11.07.,저금리 시대… 다산신도시 최초 지식산업센터 '다산신도시 블루웨일' 각광,"㈜유승종합건설은 이달 우수한 서울접근성과 다양한 생활인프라로 각광받는 다산신도시 내 최초의... 현대프리미엄아울렛(예정) 바로 앞 상권에 위치해 패션, F&amp;B, 라이프, 금융, 메디컬 등 조닝별 MD 구성을 갖춘 스트리트..."
1539,2017.11.09.,"비주얼골프, “중기 밀집지역 실내골프연습장 성공률 높아”","대상은 서울을 비롯한 경기 인천, 대구경북, 부산, 광주, 대전 등 5개 광역시를 기준으로 했다. 대상매장은... 우선 입지적 특성의 유사성을 보면 일반적으로 상권 노른자위로 알려져 있는 역세권이나 번화가 지역이 아닌..."
1540,2017.11.02.,수익형 부동산 시장에서도 ‘미니멀라이징’이 인기!,입지로 서울 및 광역 접근성이 우수하다. 또한 바로 앞 부천시청역 지하도와 연결된 이마트(중동점)... 현대프리미엄아울렛(예정)이 바로 앞 상권에 위치한 이 지식산업센터는 도보 10분 거리 내에 1만여 배후세대를...
1541,2017.11.06.,몰려오는 악재들 파장은?,"서울 인기 지역에만 청약 통장이 몰리는 양극화 현상이 짙어질 것이란 목소리도 나온다.... 분양계획 차질 내년 사업도 조정 한 부동산 전문가는 ""상가는 상권과 입지에 따라 임대료와 투자가치가..."
1542,2017.11.22.,'구리갈매1차 대방디엠시티 메트로카운티' 오피스텔·상업시설 선착순 계약 중,"그 중에서도 서울 접근성이 우수하고, 개발호재나 미래가치가 높은 지역이 인기가 높다. 경기도... 356세대 대규모 오피스텔의 배후수요를 기본으로 좌측 갈매역, 후면 모다아울렛과 우측 갈매지구 중심상권이..."
1543,2017.11.01.,“궁궐을 모르고서는 조선의 정치도 역사도 알 수 없다”,"책의 상권은 궁궐을 이해하기 위한 개론서로 궁궐이 자리한 서울을 둘러보는 것으로 시작해 궁궐이 어떤 곳이었는지, 어떻게 짜인 공간이었는지를 설명하고 궁궐의 역사를 따라가며 각 궁궐의 탄생과 운영, 변천을 살핀다...."
1544,2017.11.16.,"노원구, '상가 내몰림' 막기 위한 상생 협약 추진",/노원구청 [메트로신문 | 이범종 기자] 서울 노원구가 소상인들과 지역상권을 보호하기 위해 건물주와의 상생협약을 추진한다고 16일 밝혔다. 구는 이달 말까지 노원역 일대 상가를 대상으로 노원구상공회와 노원구...
1545,2017.11.09.,미디어 복합도시 '광명역 어반브릭스' 12월 분양,"광명역세권은 수도권 교통, 상권의 중심으로 개발호재도 풍부하다.  KTX광명역, 지하철 1호선이 정차하고 강남순환고속도로가 광명역에서 강남까지 1차 개통됐다. 서울-광명간 고속도로(예정), 신안산선..."
1546,2017.11.04.,"울산 남구, 최진홍 주무관 청백봉사상 본상 수상",(울산) 정하균 기자 a1776b@ajunews.com [사진=울산 남구 제공] 울산 남구(구청장 서동욱)는 지난 3일 서울... 지역상권·경제 활성화에도 적극 노력한 공로를 인정받았다. 그는 1991년 7월 4일 최초 지방공무원으로 임용돼...
1547,2017.11.10.,[전국N] 규제가 뭐예요? 훨훨 나는 마포구,- &lt;상암DMC 다시 개발한다…상권·교통망 확충&gt; 보시는 것처럼 서울시는 마포구 상암동 주변으로 성산동과 수색 일대 개발을 진행한다는 계획입니다. 상권을 강화하고 교통망을 확충하는 사업이 먼저 추진될 것으로...
1548,2017.11.02.,올리브영 ‘뷰티 강남시대’ 순항중,CJ올리브네트웍스가 운영하고 있는 헬스앤뷰티 스토어 올리브영은 지난 9월 서울 강남역 중심상권에 개장한 강남본점&lt;사진&gt;이 오픈 한달 만에 누적 방문객 50만명을 돌파했다고 2일 밝혔다. 이는 올리브영 일반 매장과...
1549,2017.11.12.,"한화건설, 역세권상가 ‘영등포뉴타운꿈에그린 스퀘어’ 분양","소상공인 상권정보시스템 매출통계에 따르면, 올 7월 기준 서울 강동구 전체 업종별 월평균 매출은 3,854만원인 반면 강동구 고덕역 일대는 월평균 매출이 6,507만원으로 두배 가까이 차이가 난다. 부동산 전문가는..."
1550,2017.11.02.,"""유커 돌아온대"" 명동·강남·압구정 상권 '기대감 솔솔'","중국의 사드(THAAD·고고도미사일방어체계) 보복으로 전면 중단됐던 중국인 단체 관광객 ''유입이 재개될 조짐을 보이면서 서울 명동과 홍대, 압구정, 강남 등 핵심 상권들이 기지개를 켤 준비를 하고 있다. 이들 지역은..."
1551,2017.11.05.,상가정보연구소 '유망 수익형부동산 합동 설명회' 개최,"듣고 상권과 입지 및 분양가 등을 통해 투자성을 비교, 판단해 볼 수 있는 자리로 마련된다. 특히, 상가정보연구소 박대원 소장의 '수익형부동산, 월세 패턴 분석 X파일 공개' 특강이 진행되며 설명회는 서울 강남 역세권..."
1552,2017.11.05.,[분양단지 들여다보기] 신영 '청주 테크노폴리스 지웰' 대규모 산단에 배후수...,특화설계로 개방감 탁월 336가구 모두 84㎡ 중소형 단지 바로 앞 중심상권 조성 청주 테크노폴리스 지웰 B타입 거실 유닛 [서울경제] SK하이닉스·LG생활건강·LG화학 등 대기업들의 입주로 배후 수요가 풍부할 것으로...
1553,2017.11.10.,부동산 바람이 부는 곳 그곳으로 가네,국세청이 발표한 상업용 건물 기준시가(2016년 기준)에 따르면 서울시 노원구 중계동의 은행사거리 일대... 경기도 분당 서현역 인근 상권의 개방형 상가도 한면만 개방된 상가보다 평당 440만원(2015년 기준)가량 가격이...
1554,2017.11.08.,"[기획] 진주대첩광장, 도심활성화 원동력으로",서울 광화문 광장도 동상이 2개 뿐으로 이는 대첩광장 건설 취지에 맞지 않다. 광장 조성에 의견이 있다면 광장조성위원회에 참여해 의견을 내면 된다. 무엇보다 기존 공모안대로 지역상권에 활력을 불어넣고 관광객이...
1555,2017.11.03.,‘구색만 갖춘’ 각종 유통정책…시장반응은 ‘시큰둥’,"[사진=적한 서울시내의 한 복합쇼핑몰 모습] 코리아세일페스타 특수를 전혀 보지 못했다는 평가가 나온다.... 정부의 영세상권과 전통시장 살리기 정책도 마찬가지다. 전통시장의 현대화에만 정부가 급급할 뿐, 내용..."
1556,2017.11.09.,바잉 전문 'KJ컴퍼니' 패션카페 컨설팅 진행,이곳은 서울 중구 신당동에 위치한 작은 카페로 다음달 회기역에 2호점을 연다. 현재 컨설팅을 진행하고 있으며 이 공간도 단순한 카페가 아닌 패션을 입은 세련된 공간으로 재탄생한다. KJ컴퍼니는 상권 분석을 통해 지역...
1557,2017.11.14.,끝나지 않는 ‘젠트리피케이션 갈등’…최근 서촌 음식점 강제집행 중 부상자...,지역 상권 발전으로 기존 임차인이 높이 오른 임대료를 감당하지 못해 건물주와 갈등을 벌이는 ‘젠트리피케이션’이 서울 도심 곳곳에서 번져나가고 있다. 관할 구청도 마땅히 손쓸 방법이 없다. 종로구청 관계자는...
