,date,title,contents
475,2017.11.21.,더 길어지는 서울로… 더 걷고픈 길 만든다,서울시는 “서울로 개장 이후 지금까지 660만명의 국내외 방문객이 찾아오면서 서울역 일대 지역 상권 활성화와 재생에 대한 주민 기대가 큰 상황”이라며 “도시재생활성화계획이 다음 달 확정 고시되면 법적인 효력을...
476,2017.11.27.,한국인은 어떻게 이동하고 어디에서 시간을 보내나? '2017 카카오 모빌리티 리...,"예를 들어 이태원의 경우 택시의 출발 호출수가 도착수보다 월등히 많았으며, 반대로 수원 나혜석거리나 일산 라페스타와 같은 서울 외 상권에서는 호출수보다 도착수가 월등히 많은 것을 확인할 수 있다. 이는 해당..."
477,2017.11.26.,"경기도, 지자체 최초 음악산업 육성 위한 전문위원회 출범","지역상권 활성화 대책을 담은 음악산업과 지역경제 상생방안, 해외 음악도시와 네트워크 구축, 공동사업 등의 구상을 담은 음악산업 글로벌 협조체계 구축, 인디밴드로 유명한 서울 홍대 같은 음악명소를 경기도에도..."
478,2017.11.27.,"배산임수 지형 갖춘 하월곡동 아파트, `월곡래미안루나밸리`","단지 앞에는 일신초가 있어 자녀 통학이 편리하고 서울사대부설중, 서울사대부설고 등 명문 학교도 인근에 위치했다. 동덕여대, 경희대, 고려대, 한국외대 등의 유명 대학도 멀지 않아 대학 상권을 누릴 수 있다...."
479,2017.11.28.,"저금리 시대, 투자자에게 주목받는 역세권 상가 ‘영등포뉴타운 꿈에그린 스퀘...","인근으로 상권이 활성화될 것으로 보인다. '영등포뉴타운 꿈에그린 스퀘어'는 서울시 영등포구 영등포동 7가 29-1번지 일대에 연면적 1만2,085㎡, 지하 1층~지상 2층, 총 129실 규모다. 준공시기는 2020년 10월 예정이다...."
480,2017.11.28.,"저금리 시대, 투자자에게 주목받는 역세권 상가 ‘영등포뉴타운 꿈에그린 스퀘...","인근으로 상권이 활성화될 것으로 보인다. '영등포뉴타운 꿈에그린 스퀘어'는 서울시 영등포구 영등포동 7가 29-1번지 일대에 연면적 1만2,085㎡, 지하 1층~지상 2층, 총 129실 규모다. 준공시기는 2020년 10월 예정이다...."
481,2017.11.23.,"우원식, 한국당에 예산안 협조 촉구…""역사예산 삭감, 민족 정체성 부정""","= 22일 오전 서울 여의도 국회 더불어민주당 원내대표실에서 열린 대한민국재향소방동우회 정책간담회에서... 골목상권 침해 대책을 종합적으로 만들도록 정부여당이 긴밀히 협의하겠다""고 약속했다. 한편, 우..."
482,2017.11.28.,"신세계百 '팩토리스토어', 가격·편의성 만족…강남 멋쟁이 득템 장소 각광","실제로 팩토리스토어의 고객 비중 분석을 해본 결과 인근 상권인 고양시와 서울은평구 거주 고객이 46%에 불과했고, 다른 지역에서 거주하는 소비자가 53%로 더 많았다. 젊은 층이 많이 거주하는 서울 마포구와 서울..."
483,2017.11.20.,감고을 영동 ‘2017 영동곶감축제’ 내달 15일 개막,골목상권 회복을 위해 영동천 하상주차장과 영동특산물거리(계산로 1길)에서 개최한다. 올해 영동포도축제... 연계행사로 부산역과 서울 용산역에서 각각 8개 지역농가가 참여하는 곶감 대도시 판매행사를 개최해...
484,2017.11.26.,혁신기업 지원 팔 걷은 KB금융,"올 16곳 발굴...36개 스타트업 육성 [서울경제] KB금융이 혁신기업 및 중기벤처를 지원하는 생산적 금융에... 이곳에서는 창업컨설팅과 금융 노하우를 접목해 상권분석, 창업절차 및 인허가 사항, 각종 금융상담..."
485,2017.11.27.,"미사강변도시 수변스트리트상가 ‘D스트릿’ 분양, 新랜드마크 기대감 ↑",[서울경제] 2018년 개통예정인 지하철 5·9호선 연장노선인 미사역과 도보 5분 거리에 들어서는 수변스트리트... 사업지는 경기도 하남시 미사강변 신도시의 새로운 핵심 상권으로 주목 받는 옛 미사리 라이브카페촌으로...
486,2017.11.20.,압구정 로데오거리 다시 활기 찾는다,강남구 상권활성화 사업 성과 착한임대료 사업...임대료 20~50%↓ 젊은층 겨냥 공연·행사 관광객 불러 = 서울 강남구(구청장 신연희)는 압구정 로데오 거리 활성화를 위해 올초부터 주민과 힘을 합쳐 상권 활성화사업을...
487,2017.11.24.,"SK행복나눔재단, 장신대와 지역경제 발전 위한 MOU","두 기관은 협약식 후 장신대가 있는 서울 광장동을 중심으로 청년 창업과 일자리 창출, 청년 주거 안정을 위한 사업 발굴, 지역상권 활성화 등 대학과 지역이 발전을 위해 협력할 수 있는 방안을 논의했다. 김용갑..."
488,2017.11.28.,두 번의 좌절…‘35층 은마’ 이젠 달릴수 있을까,상징’ 서울 대치동 은마아파트/ 한국경제신문 [한경비즈니스 = 심재문 편집위원] 서울 강남구 대치동... 비교적 상권이 잘 형성돼 있는 은마 상가는 협의 과정이 만만치 않을 전망이다. 그런데 아파트 단지와 같은...
489,2017.11.23.,"홍종학, 복합쇼핑몰부터 손본다",홍종학 신임 중소벤처기업부 장관이 23일 소상공인 상권 침해 논란을 빚는 복합쇼핑몰과 관련해 “규제가 필요하다”며 “대기업과 상의하며 피해를 최소화하는 방식으로 노력하겠다”고 말했다. 홍 장관은 이날 서울...
490,2017.11.23.,"모바일 패션 기업 슈피겐코리아, 오프라인 직영점 열어",소비자 접점 확대 나서 슈피겐 영등포 직영점 매장 전경/사진제공=슈피겐코리아 [서울경제] 모바일 패션... 이번 매장은 스마트폰 액세서리 시장의 핵심상권인 영등포구청역 근처 영등포 유통상가 내에 위치해 있어...
491,2017.11.27.,아파트값 견인하는 강남 재건축 단지… 압구정동 ‘현대5차’,"서울시 강남구 압구정동에 위치한 현대5차는 1977년 12월 입주한 최고 14층, 총 2개동 224가구 규모다. 이번... 인접해 상권과 문화, 편의시설이 잘 갖춰져 이용하기 좋다. 교육 시설로는 압구정초, 중, 고가 모두 단지 내에..."
492,2017.11.23.,골목마다 볼거리 가득…서대문구 이화여대 골목길 축제,서대문구 이화여대길 골목길 축제 포스터(서대문구 제공)© News1 서울 서대문구(구청장 문석진)는 25일 오후... 개그맨 안상태씨와 함께하는 프로그램 ‘문화로 신촌재생’에서는 지역 상권과 상생을 재미있게...
493,2017.11.20.,"LH, 안성아양지구 상업용지 첫 공급","주변 상권(이마트, CGV 등 건축예정)과의 연계로 안성시를 대표하는 신흥상권으로의 발전이 기대된다.... 급증했다""며 ""경부·중부고속도로, 서울~세종 고속도로, 38번국도 등으로 수도권 접근성이 우수한 경기남부권..."
494,2017.11.20.,임대료 낮춘 '압구정로데오' 상권 부활 시동 걸었다,"[서울 강남구 제공=연합뉴스] 서울 강남구가 상권 쇠퇴로 옛 명성을 잃었다는 지적이 나오던 압구정로데오 거리 부활에 팔을 걷어붙이고 나섰다. 20일 강남구에 따르면 구는 동주민센터, 건물주, 입점 상인, 지역 주민..."
495,2017.11.22.,"울산 젊음의거리 상인회, 공동마케팅 지원사업 우수시장 선정","이번에 선정된 시장은 젊음의거리 상인회를 비롯해 서울 청량리농수산물시장과 종로광장전통시장, 부산... 지역상권 활성화에도 크게 기여했다는 평가를 받았다. 아울러 축제가 청년층을 중심으로 기획되면서..."
496,2017.11.20.,"롯데, 코엑스 면세점 공모 `나홀로` 도전","롯데면세점 서울 코엑스점 내부 롯데면세점 제공 롯데면세점이 서울 시내면세점 사업자 공모에 '나홀로... 강남 상권의 매출은 늘어나는 추세였기 때문에 단체관광객들이 완전히 돌아오면 더 장점이 있을 것""이라고..."
497,2017.11.25.,[길따라 멋따라] 그곳에 가면 누구나 '별 그대'…감악산 출렁다리→파주 프로...,당시 글로스터 연대 1대대와 왕립 제170 박격포대 C소대 용사들은 설마리 235고지에서 수도 서울을 함락하기... 또 남프랑스의 목가적 조경이 조화를 이룬 상권으로 구성돼 국내 방문객뿐만 아니라 2010년 이후 지속하고...
498,2017.11.23.,"도시의 미래, 골목길에 있다","서울 부산 등 대도시 곳곳에 이처럼 사람을 끌어모으는 많은 골목상권이 탄생했다. 저자인 모 교수는 ""이젠 매력적인 골목길로 태어나는 것이 도시재생의 중요한 방향성이 되고 있다""며 ""이제는 도시재생과 골목산업..."
499,2017.11.27.,[시장보고서] 다산신도시 지금·진건 신규입주아파트 어디가 좋을까?,"다산역, 서울-세종 고속도로등 서울 못지 않은 교통편 개통 예정인 곳이다. 그중에서도 한양 수자인... 다산신도시 최고의 대단지 아파트이며 상권과 학군을 갖춘 자리에 있으며 전세가 비교적 저렴한 편이다...."
500,2017.11.24.,"""우리가 쉬면 시장이 사나""…쇼핑몰 9개사 '영업규제' 추진 반발","생각도 방법도 너무 다르니까.” 24일 서울 한국프레스센터에서 열린 ‘복합쇼핑몰 업계 간담회’에 참석한... 유통사들은 ‘복합쇼핑몰이 골목상권 침해 업태가 될 수 없다는 것’, ‘복합쇼핑몰이 영업규제 대상이 돼야..."
501,2017.11.28.,"""마산 자산솔밭 천상병 시인 공원으로""","창원시의회 김재철(자유한국당, 완월·자산·오동동) 의원은 27일 5분 발언에서 천상병 시인이 거주했던 서울... 모든 상권이 흡수되고 말 것이며, 도심 공동화 현상으로 그 여파는 고스란히 창원 소상공인들에게 전해지게 될..."
502,2017.11.26.,새로운 트렌드...가성비로 승부하는 '강소점포' 노려라,/서울경제DB 골목상권을 파고드는 강소점포 업종으로 김치찌개 전문점도 주목을 끈다. 사골김치찌개 전문점 ‘종로냄비’ 점포 모습. /서울경제DB [서울경제] 창업 시장에서 규모는 작지만 골목상권에서 진가를...
503,2017.11.27.,[유통업계 무너지는 경계] 화장품 늘리는 편의점···고추장 파는 H&B,판매도 [서울경제] # 편의점 GS25에서 요즘 잘 나가는 제품 중 하나는 화장품이다. 올 10월까지 화장품... 편의점들은 대형 H&amp;B스토어가 흡수하지 못하는 상권 사각지대를 노리고 있다. 편의점 관계자는 “대로변에 주로...
504,2017.11.27.,대출에 의존하지 않는 공략법은?,이에 따라 모란 프라임타워는 모란전통시장으로 가는 길목에 위치한 항아리상권형 독점상가로 서울분당 방면 사거리코너에 위치해 접근성은 물론 가시효과가 뛰어나다. 신도시와 달리 5층까지 가로...
505,2017.11.28.,젠트리피케이션- 김희진 정치부 기자,말(馬)은 나면 제주로 보내고 사람은 서울로 보내라는 옛말이 있다. 새로운 문물 등 온갖 것이 집중돼 있는... ▼사람들이 떠난 구도심을 살리기 위해 10여년 전부터 환경·시설을 개선하고 상권을 회복시키기 위한 다양한...
506,2017.11.29.,"네오나오 컬러 엔 클리닉, 업종전환 창업 모델 제시해","또한 서울시가 ‘우리마을가게 상권분석 서비스’를 분석한 결과 1년 내 폐업률은 미용실(11%)이 가장 높게 나타났다. 미용실 폐업률이 가장 높은 이유는 손님 1명이 머리 하는데 오랜 시간이 필요하고, 손님 한명 당 직원..."
507,2017.11.27.,"'인천 효성해링턴 타워 인하' 단지 내 상가, 대학 유동인구 흡수","서울 혜화동 로터리부터 마로니에 공원까지 어이지는 대학로 상권 인근에는 서울대학교 연건캠퍼스, 성균관대 인문사회과학캠퍼스, 카톨릭대학교 성신교정을 비롯해 여러 학교들과 서울대학교병원이 위치해..."
508,2017.11.23.,"가평군, 내년 예산안 3070억원 편성","지역상권 회복을 위해 복합건축물 건립 ▲노인일자리 사업 ▲치매예방센터 건립 운영 등을 밝혔다. 또... 확대, 서울지역에 가평장학관 운영으로 학부모의 경제적 부담을 덜어주고 126개 전체마을의 참여 속에..."
509,2017.11.24.,"하이트진로, 청년창업 응원…""실패 두려워 마세요""",이날 대상으로 선발된 '농부라다스(밀리밀)'는 1000만원의 상금과 함께 서울 마포구 홍대 상권에서 3개월간 팝업스토어를 운영할 수 있는 기회를 얻었다. 최우수상 '오소야'에게는 500만원의 상금과 부상이 주어졌다. 우수상...
510,2017.11.28.,"국내 대표 AR플랫폼 ㈜소셜네트워크, 삼성전자로부터 특허권 양도받아 ‘눈길...","소셜네트워크는 서울 한남동 블루스퀘어에서 8월부터 11월까지 약 100일간 프로모션으로 진행했던 국내... 이어 단기간 유아 체험전시로는 높은 관객 수를 기록하며 지역 상권의 매출에 크게 이바지하였으며, 이를..."
511,2017.11.27.,[공기업 감동경영]전통시장 활성화 ‘공동브랜드’가 답이다,"중심상권을 형성해온 ‘문화시장’ 등은 2016년 소상공인시장진흥공단의 문화관광형시장 육성사업에... 이 외에도 서울중곡제일시장의 아리청정(수제 참기름), 서산동부전통시장의 갯마을이야기(김, 감태, 홍마늘 액기스..."
512,2017.11.28.,다산신도시 내 최초 지식산업센터 ‘다산신도시 블루웨일’.. 경기북부 제2차...,"[서울경제] 경기북부 제2차 테크노밸리 유치 소식이 전해짐에 따라 새로운 개발호재로 인해 인근... 또한 현대프리미엄아울렛(예정) 바로 앞 상권에 위치한다. 패션, F&amp;B, 라이프, 금융, 메디컬 등 조닝별 MD 구성을 갖춘..."
513,2017.11.20.,“쫀득한 곶감 맛보세요”…영동서 ‘곶감축제’,골목상권을 회복한다는 취지로 행사장을 영동천 하상 주차장과 영동특산물 거리(계산로 1길)로 옮겼다.... 축제 기간 부산역과 서울 용산역에서 각각 8개 지역 농가가 참여하는 햇곶감 대도시 판매행사도 연다....
514,2017.11.22.,납품사 매출 연 1.8조 피해에도… 마트 규제 법안 25건 '대기 중',"통해 상권이 살아났다”고 말했다. 유통업 규제가 고용에 악영향을 미칠 것이란 우려도 나왔다. 서울 잠실 롯데월드몰은 직접 고용이 6000명, 간접 고용을 포함한 취업 유발 효과가 1만3200명이었다. 신세계 하남..."
515,2017.11.27.,"마곡나루역보타닉푸르지오시티 오피스텔 1층 상가, 월세 실거래가가…","특히 상가도 활발히 들어서며 상권이 형성되고 있는 중""이라며 ""시세는 보합세다""라고 설명했다. 기업 이주 외에도 개발 호재가 풍부하다. 마곡지구 인근에 들어서는 서울식물원에는 열린숲마당, 호수공원, 생태천이원..."
516,2017.11.26.,"경기도, 음악산업 육성 위한 전문위원회 출범","지역상권 활성화 대책을 담은 음악산업과 지역경제 상생방안 △해외 음악도시와 네트워크 구축, 공동사업 등의 구상을 담은 음악산업 글로벌 협조체계 구축 △인디밴드로 유명한 서울 홍대 같은 음악명소를 경기도에도..."
517,2017.11.21.,홍종학 장관 임명 “대기업 불공정 행위 뿌리 뽑겠다”,[서울신문] 홍종학 신임 중소벤처기업부 장관이 21일 취임하면서 “대기업과 중소기업이 더불어 발전하는... 골목상권을 보호할 획기적인 방안도 마련하겠다”고 말했다. 구체적으로 영세 자영업자의 카드수수료를...
518,2017.11.26.,“골목 소상공인 살리겠다고 소상공인 쇼핑몰도 쉬라니”,논란도 [서울경제] “복합 쇼핑몰 규제가 관련 산업 위축 뿐 아니라 형평성 문제를 불러 올 수 있습니다.... 이 회사 관계자는 “골목상권의 소상공인을 살리려고 결국 쇼핑몰 내 소상공인에 대해 규제하는 모양새”라며...
519,2017.11.28.,‘잠실까지 20분대’ 복층형 오피스텔 ‘갈매 파크위버’ 분양 돌입,"[서울신문 나우뉴스] 경기 구리 갈매지구 역세권에 복층형 오피스텔이 분양에 나섰다. 국제자산신탁은... 황금상권으로, 수익형 오피스텔로 주목을 받고 있으며 투자수요와 임대수요가 기대된다""고 설명했다. 한편..."
520,2017.11.28.,‘잠실까지 20분대’ 복층형 오피스텔 ‘갈매 파크위버’ 분양 돌입,"[서울신문 나우뉴스] 경기 구리 갈매지구 역세권에 복층형 오피스텔이 분양에 나섰다. 국제자산신탁은... 황금상권으로, 수익형 오피스텔로 주목을 받고 있으며 투자수요와 임대수요가 기대된다""고 설명했다. 한편..."
521,2017.11.23.,"슈피겐, 첫 오프라인 직영점 ‘슈피겐 영등포점’ 오픈",모바일 패션 전문 기업 슈피겐코리아가 서울 영등포구에 첫 직영점인 ‘슈피겐 영등포점’을 오픈한다고... 24일 문을 열 이번 매장은 스마트폰 액세서리 시장의 핵심상권인 영등포구청역 근처 영등포 유통상가 내에...
522,2017.11.27.,‘안양 센트럴헤센’ 분양…개발호재와 미래비전 품은 복합주거단지,특히 금정역은 광역급행고속열차(GTX) C노선이 건설될 예정이어서 앞으로 서울 강남ㆍ북 접근성이... 또한 1호선 안양역 주변에 조성된 상권인 안양1번가도 가까워 다양한 상업시설을 이용할 수 있고 단지 주변 수리산과...
523,2017.11.25.,애플스토어에서 휴대전화 개통도 된다고?,이 때문에 이동통신 유통업계에서는 “글로벌 기업인 애플이 골목상권을 침해하려 한다”며 반발하고... 애플은 서울 강남구 가로수길에 국내 최초의 애플스토어를 열 예정으로 현재 공사 중에 있다. 당초 12월 말쯤...
524,2017.11.21.,"'재벌 저격수' 홍종학, 대기업 불공정행위 철퇴·중기 지원 강화(종합)",문재인 대통령과 홍종학 장관(서울=연합뉴스) 김주형 기자 = 문재인 대통령이 21일 오전 홍종학... 골목상권을 보호할 획기적인 방안도 마련할 계획이다. 아울러 영세 자영업자의 카드수수료를 지속해서 인하하고 새로운...
525,2017.11.27.,[영주 도시재생 사업] <중>중앙시장의 변신,"1982년 영주 시가지 구도심 상권 회복을 위해 영주역 이전 부지에 신축, 개장한 현대식 시장이 바로... 런던대, 서울시립대학원, 대구가톨릭대, 국토연구원 등 국내외 대학 및 연구기관 관계자의 방문이 잇따르고 있다...."
526,2017.11.20.,"LH, 안성아양지구 상업용지 첫 공급","또 이마트, CGV 등이 들어설 주변 상권과 연계해 신흥상권으로의 발전도 기대할 수 있습니다. 공급일정은... 유진하 LH 경기지역본부 토지판매부장은 ""경부·중부고속도로, 서울~세종 고속도로(예정), 38번국도 등으로..."
527,2017.11.22.,"주거,업무,쇼핑 올인원..안양 만안에 뜨는 '주거 신대륙'","특히 금정역은 광역급행고속열차(GTX) C노선이 건설될 예정이어서 앞으로 서울 강남,북 접근성이... 또한 1호선 안양역 주변에 조성된 상권인 안양1번가도 가까워 다양한 상업시설을 이용할 수 있고 수리산과..."
528,2017.11.20.,금천구 나들가게 공동물류센터 운영한다,"= 서울 금천구(구청장 차성수)는 나들가게 경쟁력 강화를 위해 금천협동조합과 함께 '금천구 나들가게... 금천협동조합 임승윤 이사장은 ""골목 상권 경쟁력 강화를 위해 나들가게들이 힘을 모아 협동조합을 설립하게..."
529,2017.11.23.,"제빵기사 직고용, 꼬리가 머리 흔드나","“가맹점 상권에 따라, 가맹점주의 이해에 따라 근무시간, 업무 강도(하루 생산량 등) 등을 조절합니다. 본사... 가맹점주의 OK 사인 한번에 끝날 것을 본사 규율에 따른다면 복잡하고 힘들어지게 되는거죠.”(서울 지역..."
530,2017.11.27.,"쌀·콩·약과의 기막힌 변신…청년 창업가, 푸드혁명을 꿈꾸다","모고디저트 스튜디오 팀은 서울카롱을 근사하게 패키징하면 외국인 관광객들에게 충분히 어필할 수 있는 아이템이 되리라고 판단합니다. 일단 인사동, 홍대, 이태원 등 외국인들이 즐겨 찾는 상권에 있는 카페, 기념품점..."
531,2017.11.26.,12월 수도권서 전매 6개월·1년 단지 1만 8000여 가구 분양,서울 시내 아파트 전경(사진제공=뉴스웨이 DB) 연말 수도권 비규제지역에서 1만 가구가 넘는 막바지 분양... 또한 1호선 안양역 주변에 조성된 상권인 안양1번가도 가깝게 이용할 수 있다. 호반건설은 12월 경기도...
532,2017.11.26.,"[머니+ 성공창업, 상권을 보라] 유행 아이템도 흐름이 있다",권강수 한국창업부동산정보원 이사 카스테라 등 뜨는 디저트 오픈 땐 안정기인지 성장기인지 따져봐야 [서울... [서울경제 바로가기]1997년 이래 대한민국 최고의 과학자 DB [바로가기▶]서울경제의 모든 연재물!... 서경Cube...
533,2017.11.23.,자유주의자의 눈에 비친 골목길 경제,가치는 ‘상권’이다. 미국 스탠퍼드대에서 경영학 박사 학위를 받은 모종린 연세대 국제학대학원 교수는... 그는 이런 관점에서 ‘다음’ 설립자인 이재웅의 소셜벤처투자기업 ‘소풍’이 자리 잡은 서울 성수동...
534,2017.11.20.,뜨는 골목상권에 상가도 ‘소형’이 강세···임대료 2년새 12.6% 올라,이상혁 상가정보연구소 선임연구원은 “경제불황과 취업난의 여파로 소자본 창업 자영업자들이 늘면서 작은 상가를 찾는 수요가 늘어난 것이 임대료에도 반영된 것”이라며 “서울 곳곳의 골목상권이...
535,2017.11.20.,[S마켓] 여의도 하나금투빌딩서 스타벅스 밀어낸 할리스,핵심 상권에 직영점을 신규 설립해 기업 가치를 높이는 데 집중하고 있다. /임세원·박시진기자 see1205@sedaily.com [서울경제 바로가기]1997년 이래 대한민국 최고의 과학자 DB [바로가기▶]서울경제의 모든 연재물!......
536,2017.11.26.,"‘사통팔달’ 교통 좋은 입지, 산업단지 분양 성패 가른다",또한 교통 인프라가 잘 갖춰진 지역 주변으로는 상권이 형성되고 편의시설이 늘어나 주변여건도... 이외에도 서울~세종 간 제2경부고속도로도 예정돼 있어 개통 시 수도권 접근성은 더욱 개선될 것으로 기대된다....
537,2017.11.23.,"광운대, 집토스와 청년 주거난 해소 및 일자리 창출 MOU 체결","이번 MOU는 광운대와 집토스가 서울 동북권의 청년 주거난 해소와 청년 일자리 창출을 위해 뜻을 같이하며 마련됐다. 광운대는 청년 일자리 부족과 주거 불안정, 대학의 학생수 감소 및 재정 악화, 지역의 상권 침체..."
538,2017.11.26.,"경기도, 전국 최초 음악산업 육성 위한 전문위원회 출범","지역상권 활성화 대책을 담은 음악 산업과 지역경제 상생방안 △해외 음악도시와 네트워크 구축, 공동사업 등의 구상을 담은 음악산업 글로벌 협조체계 구축 △인디밴드로 유명한 서울 홍대 같은 음악명소를 경기도에도..."
539,2017.11.27.,[한경 매물마당] 마곡역세권 대로변 신축 빌딩 등 16건,"(02)511-2297 강남 리얼티코리아 유진석 ◆서울 강남구 역삼동 임대수익형 빌딩=역세권 중심상권 내 대지 562㎡, 연면적 1710㎡의 준신축 지상 6층 건물. 내외관 수려하고 주차 편리. 상업·판매시설 집중 지역...."
540,2017.11.27.,성동구 금남시장에 ‘청년점포’ 3곳 입점,서울 성동구(구청장 정원오)는 전통시장 활성화의 일환으로 오는 28일 금호동 금남시장 제1구역에서... 한편 금남시장은 지난 1960년대 점포와 노점이 몰리면서 자연스레 상권이 형성됐다. 한때 서민 공간으로...
541,2017.11.20.,수익형 부동산도 '소형'이 강세…임대료 2년간 12.6% ↑,"대형 프랜차이즈 상점과 쇼핑몰에 밀려 주목을 받지 못하던 서울지역 곳곳의 골목상권이 최근 젊은이들이 몰려드는 명소로 변모하며 재조명 받은 것이다. 이상혁 상가정보연구소 선임연구원은 ""과거에는 접근성..."
542,2017.11.27.,콘솔게임 체험존 속속 등장 '어디로 갈까?',"소니 등 콘솔게임업체들이 판교, 영등포 등 유동인구가 많은 핵심상권에 체험존을 속속 개설하고 있다.... 서울 용산 롯데시네마에 위치한 'X박스원' 시연대를 'X박스원X' 시연대로 업그레이드 해 영화관을 찾는..."
