,date,title,contents
1151,2017.10.15.,[한경 매물마당] 성남시 분당 역 출구 앞 유명 브랜드 빌딩 등 17건,"(02)590-6016 서초 제이에스 차상혁 ◆서울 강남구 논현동 영동시장 먹자상권 빌딩=유명 한신포차 인근 24시 유동인구 풍부한 중심 상권 대지 212㎡, 연면적 250㎡의 지하 1층~지상 3층 건물. 보증금 3억원, 월..."
1152,2017.10.22.,"가구·인테리어업계, 강남대전 돌입","특히 한화L&amp;C와 LG하우시스, 현대리바트는 모두 논현동 가구거리에 터를 잡아 같은 상권에서 직접 경쟁을 피할 수 없게 됐다. 한화L&amp;C는 17일 서울 강남구 논현동 가구거리에 직영 인테리어 전시장 갤러리Q를 열었다...."
1153,2017.10.09.,"[소문난 자치 리더] “ 동굴, 이케아, 명문학교 無에서 有 창조 ”","“그때만 해도 서울 주변의 베드타운, 구로·금천공단의 배후도시로 여겨졌죠. 사람들은 광명이 어디... 주거환경과 상권이 뛰어난 명품도시로 거듭나고 있죠.” ▼광명역세권은 정말 눈부시게 발전해 ‘고급스러운..."
1154,2017.10.10.,매머드 단지 들어서는 `북아현3구역` 최근 매매가가…,"이화여대, 연세대, 서강대, 홍익대 등 서울 명문 대학이 모여있는 신촌, 홍대가 가까워 상권 형성이 잘 됐으며 대학생 수요도 풍부할 것으로 보인다. 안산, 서대문독립공원, 안산공원 등 녹지공간이 풍부해 쾌적한..."
1155,2017.10.01.,"안철수, 옛 지역구 노원 방문…보궐선거 초읽기?","국민의당 안철수 대표는 추석을 사흘 앞둔 1일 국회의원 시절 지역구였던 서울 노원 지역을 방문해... 안 대표는 노원중앙시장, 마들역 상가, 세이브존, 공릉동 도깨비시장 등 노원 지역의 대표 상권을 찾아 추석 물가를..."
1156,2017.10.20.,탁월한 정주여건 모두 갖춘 `부천시청역 솔라리움 오피스텔` 미래가치 돋보여,서울 전역 및 경기 일부 지역을 투기과열지구로 지정하며 주택 투기 수요를 억제하겠다는 포부를 강력하게... 중동 상권의 새로운 핵심 지역으로 자리매김할 예정이다. 이처럼 부천 중동 및 상동의 핵심 인프라를 동시에...
1157,2017.10.16.,"유통업계, AR(증강현실)·VR(가상현실) 기술로 젊은 고객 유치",롯데백화점은 최근 미니백화점 엘큐브 서울 홍대점 3층에 VR 체험관을 오픈했다. 젊은 층이 몰리는 ‘핫 플레이스’ 상권에 입점한 이점을 살려 주타켓층인 젊은 층을 강화하겠다는 목표다. VR 체험관에는...
1158,2017.10.19.,"문경시, 21~27일 4개 전통시장서 축제 경품이벤트","이번 전통시장 마케팅 투어 행사는 대도시(서울, 경기, 인천) 거주 주민 560여명이 전통시장의... 고윤환 시장은 “전통시장에서 문화행사를 개최해 전통시장 활성화는 물론, 문화와 상권이 공존하는 새로운..."
1159,2017.10.12.,[축제현장] 안동국제탈춤페스티벌2017,"축제 기간 서울에서 출발하는 외국인 관광객 모객프로그램은 예약과 동시에 마감이 되는 등 국내 거주하는... ■시장가면, 퍼레이드, 마스크 버스킹 등 온 시가지가 들썩~ 축제장을 찾은 문재인 대통령 내외 시내상권..."
1160,2017.10.17.,저금리 기조에 수익형 상가 떠올라…‘옥석 고르기’ 필요,"[서울신문] 연이은 저금리 기조와 8.2부동산 대책 등으로 ‘알짜’ 수익형 부동산 투자처를 찾는 사람들이... 또 상가가 위치한 입지와 상권, 금융혜택 등 찾아봐야 할 요소도 복잡한 만큼 알짜 상가를 선별해내기란..."
1161,2017.10.10.,자이 최초의 AI(인공지능) 아파트 ‘잠실 미성크로바’ 미래지향적인 첨단 설...,"GS건설이 서울 잠실 미성크로바 아파트 재건축 사업 제안서를 제출했다. 미성크로바 재건축 사업은 예상... 올림픽공원, 잠실역 상권과 맞닿은 입지여서 사업성이 매우 뛰어나다는 평가다. GS건설은 앞서 잠실에서 여러..."
1162,2017.10.17.,제63차 원내대책회의 모두발언,오늘 여러 군데에서 국감이 진행되는데 특히 주목되는 국감은 오전에 있을 행안위의 서울시에 대한... 골목시장 현장에서 재래시장 상권과 자영업자들을 위협하는 프랜차이즈 갑질을 반드시 바로잡아야한다....
1163,2017.10.01.,"안철수, 추석 앞두고 옛 지역구 노원 방문…'與 견제' 해석도","국민의당 안철수 대표는 추석을 사흘 앞둔 오늘(1일) 국회의원 시절 지역구였던 서울 노원 지역을 방문해... 안 대표는 노원중앙시장, 마들역 상가, 세이브존, 공릉동 도깨비시장 등 노원 지역의 대표 상권을 찾아 추석..."
1164,2017.10.19.,수원 최고층 주상복합 아파트 '수원 아너스빌 위즈' 상가 분양,"기사이미지 1 ▲ 수원 최고층 주상복합 아파트 '수원 아너스빌 위즈' (사진제공 = 수원 아너스빌 위즈) [서울... 대부분 단지 내 상권과 다르게 아너스빌 상가에는 유명 패스트푸드, 가전제품 대리점, 자동차 판매 전시장..."
1165,2017.10.12.,푸드트럭 10대 중 7대 `불법영업`,"지역별로는 수도권에서 326대, 비수도권에서 224대가 운영 중인 것으로 확인됐고 수도권은 서울이 164대... 지정하는 한편 전통시장 상권에 미치는 영향을 면밀히 검토해 소상공인 보호에도 앞장서야 한다”고 말했습니다."
1166,2017.10.15.,"국민은행, 중기 대상 상생 인프라 구축 '박차'","주요 제공 서비스로는 점포입지·상권분석, 창업 절차 및 인허가 사항, 각종 금융상담, 자금관리 및 절세방안 등 폭넓은 창업정보와 함께 필요시 서울신용보증재단과의 협업을 통한 추가컨설팅 및..."
1167,2017.10.02.,"백화점·마트·전통시장, 쉬는날 체크하세요","도심에 위치한 서울 광장시장은 3일부터 5일까지 사흘간 공식 휴무이고 나머지 날짜는 점포의 자율에... 편의점의 경우는 24시간, 365일 문을 여는 것이 기본이지만, 빌딩내에 입점해 있는 등 특수상권이거나 점주들이..."
1168,2017.10.13.,"「구호」 한남동 입성, 토털 라이프스타일로 영층 잡는다","삼성물산(패션총괄 박철규)에서 전개하는 「구호」가 서울 한남동에 첫 번째 플래그십 스토어를 오픈했다.... 계획'이라며 ""가로수길 상권이 세로수길로 확대된 것처럼 상권 확장성이 기대되는 한남동에서 「구호」가..."
1169,2017.10.10.,전세 매물 귀한 성남시 수정구 ‘위례센트럴푸르지오’,"서울과 수도권 지역으로 이동할 수 있다. 단지 내 상가가 있어 학원, 병원, 슈퍼 등등 편의시설 이용이 쉽다. 위례중앙광장과 약 1.5㎞의 스트리트형 상가 트랜짓몰도 가깝다. 위례신도시는 대표적인 항아리 상권으로..."
1170,2017.10.17.,"역세권, 낙수효과 누릴 수 있는 상가는 어디? 명품설계로 무장한 ‘천안연세메...","20분대, 서울역 30분, 대전 20분대, 청주공항 30분대면 이동이 가능하다. 상가 인근에는 유동인구의 유입을 돕는 이마트, 갤러리아 백화점, 이마트 트레이더스, 롯데마트 등 대형 상권이 자리 잡고 있다. ◆ 명품설계로..."
1171,2017.10.09.,저금리·규제 ‘더블폭탄’ 맞은 부동산 시장…알짜상가 주목,"서울지역 상업·업무용 상가 거래량은 올해 1분기 6863건에서 2분기 8205건으로 20% 가까이 급증했다.... 이 상가는 유동인구가 풍부한 당진 중앙로 로데오상권에서도 최중심에 위치한데다, 인근 석문국가산업단지..."
1172,2017.10.13.,"교통호재 풍부한 인천 부평, 주거복합단지 '부평 아이파크'에 주목","최근 서울 분양시장에 대한 규제가 강화되면서 서울 접근성이 뛰어난 인근 지역으로 눈을 돌리는... 교통여건이 개선되면 유동인구가 증가함에 따라 상권이 활기를 띠고, 생활 인프라가 잘 갖춰진다. 이는 곧 지역의..."
1173,2017.10.11.,"'춘천 시대' 강원FC, 지역 밀착 마케팅으로 도민과 가까이",또 지역사회 골목 상권 후원 유치와 상생활동을 통한 후원의 집 유치 활동도 전개하는 등 능동적으로 지역사회 업체를 방문해 구단을 알리고 있다. kyi0486@sportsseoul.com ▶스포츠서울 공식 페이스북 ▶스포츠서울 공식...
1174,2017.10.07.,"[젠트리피케이션②]연남동, 화교상권서 철길따라 '길맥'상권으로",당시 화교들의 주된 경제활동인 중국 음식점들이 맛집으로 입소문 타면서 상권이 확대됐다. 연남동 지역에도 화교를 대상으로 하는 식료품점과 중국음식점이 다수 분포하게 됐다. 2008년에는 오세훈 전 서울시장의...
1175,2017.10.02.,제조업 젖줄 문래동 살린다…영등포구 소공인 기술교육,영등포구 소공인 기술교육(영등포구 제공) © News1 서울 영등포구(구청장 조길형)는 12일부터 11월30일까지 ‘문래동 소공인 대상 전문기술 특화 교육’을 실시한다고 밝혔다. 문래동 금속제품타운 상권 활성화를...
1176,2017.10.15.,임대주택이어 청년주택까지 반대…집값 하락 우려에 님비 심화,"청년주택 입주자는 승용차 보유제한이 있어 교통체증과 관련이 없고, 오히려 상권 활성화도 기대해볼 수 있다고 판단하고 있다. 서울시는 청년주택 반대 민원과 관련해 일조권 침해 등의 불편함이 있는지 현장 조사에..."
1177,2017.10.01.,"면세점·프랜차이즈·복합쇼핑몰…국감, 유통업계 쟁점 즐비",(서울=연합뉴스) 유통팀 = 말도 많고 탈도 많은 유통업계의 이슈들이 올해 국정감사에서도 쟁점이 될 것으로... 골목상권 보호 등 유통업계 주요 현안이 감사 대상이 될 것으로 예상된다. 전 국민에게 충격을 줬던 살충제...
1178,2017.10.19.,"(청년상인 In 전통시장)②“실력 앞에 평등한 세상, 전통시장 택한 이유죠”",최근 들어 서울 은평구 증산종합시장이 변화의 바람을 맞고 있다. 청년상인들이 하나둘씩 전통시장 내... 상권 분석 후 ‘확신’...“실력만 있다면 문제없어”   증산종합시장에는 특이하게 손톱관리 매장이 있다. 매장...
1179,2017.10.15.,"코레일, '수색역세권 DMC역 구역' 개발 첫 발…롯데쇼핑과 협약","이후 서울시가 상생 태스크포스(TF)를 꾸려 상권 영향을 분석하고 골목상권과 상생 방안 등을 마련하도록 유도하면서 본격적인 개발에 돌입하게 됐다. 코레일은 DMC역 구역 우선 개발을 추진한 뒤, 수색역 부지와..."
1180,2017.10.12.,"캠코, 씨티은행 전국 18개 점포 공개경쟁입찰 매각","있으며, '서울시 성동구 행당동' 소재 부동산(행당역점)도 5호선 행당역과 1분 거리의 대형상가시설에... '경기도 성남시 분당구' 소재 씨티은행 점포의 경우 감정가 대비 110%에 낙찰되는 등 최근 핵심 상권에 위치한..."
1181,2017.10.09.,추석 연휴 맞춤형 진주남강유등축제 대통(大通)했다!,"계층과 서울, 부산, 대전 등을 비롯한 전국에서 많은 관광객이 축제장을 찾아 일간 역대 최고 관람객 수를... 내·외 상권 활성화에 크게 기여했다. 이에 따라 시와 축제 단체에서 지난해 수준으로 준비한 축제 홍보물도..."
1182,2017.10.13.,"“이마트는 문 닫는데, 이케아는 왜 장사하나”","이케아고양점과 불과 5㎞ 떨어진 스타필드 고양점으로 만들어진 거대상권이, 100만 인구의 고양시뿐만 아니라 넓게는 파주시와 서울시 은평구의 유동인구까지 흡수할 가능성이 매우 높아졌기 때문이다. 유통업계..."
1183,2017.10.13.,사통팔달 교통망과 풍요로운 생활인프라 누리는 동래 롯데캐슬 퀸,"[서울경제] 부산 지하철 동래역 바로 앞에 들어서는 ‘동래 롯데캐슬 퀸’의 분양이 10월 시작된다. 동래역... 있는 상권이다. 하루 평균 유동인구는 3만 6,000여 명에 달해 서면역에 이어 두 번째로 많은 인구가 몰리는..."
1184,2017.10.11.,'울산장미축제' 지역 경제에 효자...주변 상가 하루 매출 8% 늘었다,"133개 업종 빅데이터 분석 [서울경제] 지난 5월 열렸던 울산대공원 장미축제로 인근 상권의 하루 평균 매출이 평소 보다 11억6,100만원(7.9%) 증가했던 것으로 나타났다. 한국지역진흥재단은 장미축제 기간을 전후해..."
1185,2017.10.09.,"[뉴스터치] 서대문구, 13일부터 '신촌맥주축제'",[서울경제] 서울 서대문구는 ‘제3회 신촌맥주축제’를 오는 13~15일 신촌 연세로에서 진행한다. 이 축제는 지역상권 활성화를 위해 2015년 시작됐으며 3회째인 올해는 ‘도심 속 피크닉’이란 테마 아래 수제...
1186,2017.10.10.,세종 최대규모 랜드마크 상가… ‘어반아트리움 파인앤유 퍼스트원’ 인기,"중심 상권을 형성하기도 한다. 이렇다 보니 세종시에는 최대규모로 지어지는 상가 어반아트리움 파인앤유... 4km의 스트리트형 상가로 지어져 세종시는 물론 대전, 충청, 나아가 서울 및 수도권 등에서도 찾는..."
1187,2017.10.09.,"""웃다가 배꼽 빠지겠네""… 관광객 123만명 몰려 `역대 최다`","축제 기간 서울에서 출발하는 외국인 관광객 모객 프로그램은 예약과 동시에 마감이 되는 등 탈춤축제의... 이밖에도 시내상권 활성화를 위해 `시장가면`, `마스크 버스킹 대회` 등 전통시장과 시가지에서 마련한 축제..."
1188,2017.10.16.,"정우택, '밑 빠진 독에 물 붓기'식 나들가게 사업","[충북일보=서울] 정부가 1천억원의 예산을 들여 추진한 '나들가게 사업'이 뚜렷한 성과 없이 '밑 빠진 독에... 나들가게는 SSM 등 대기업의 골목상권 침투에 대응, 골목슈퍼의 경영개선과 정보화 등을 지원하는 사업으로..."
1189,2017.10.10.,"안동국제탈춤페스티벌, 세계적인 축제로 도약","축제 기간 서울에서 출발하는 외국인 관광객 모객프로그램은 예약과 동시에 마감이 되는 등 국내 거주하는... ◇ 시장가면, 퍼레이드, 마스크 버스킹 등 온 시가지가 들썩~시내상권 활성화를 위해 전통시장과 시가지에..."
1190,2017.10.11.,"[도시재생의 역설①]""다 같이 잘살자고 세금 썼더니 건물주만 웃어""",인근 주택가 ·골목 상권 또한 마찬가지다. 지난달 서울로와 인접한 만리동 만리시장 골목에 관광객들을 위한 편의점이 처음으로 들어섰다. 주택 가격 ·상가 임대료도 상승 일로다. 서울로 출입구에서 약 300m정도...
1191,2017.10.19.,"문경, 전통시장 빅 세일ㆍ이벤트 ‘팡팡’","이번 전통시장 마케팅 투어 행사는 대도시(서울, 경기, 인천) 거주 주민 560여 명이 전통시장의... 고윤환 문경시장은 “전통시장에서 문화행사를 개최해 전통시장 활성화는 물론, 문화와 상권이 공존하는 새로운..."
1192,2017.10.20.,지하철 연장선 상권 주목 … `별내역 아이플레이스` 8호선 연장선 `별내역` 초...,풍부해져 상권이 활성화되기 쉽다. 업계에 따르면 수익형 부동산의 핫 플레이스로 떠오른 대표적인 연장선은 8호선 별내선이다. 남양주에서 도심을 거치지 않고 서울 강남권까지 직접 갈 수 있어 '신 골드라인'이라는...
1193,2017.10.17.,"1인보쌈 혼밥프렌차이즈 '싸움의고수', 경희대점주의 청년창업 스토리",Q: 싸움의고수 체인점 창업하시기 전에 어떤 일을 하셨나요?A: 저는 이전에 서울시립대 세무학과를 졸업하고... 좋은 상권을 선점하는것이 기회이기도 하기 때문입니다. 저 또한 경희대점 수익을 차곡차곡 모아서 다른 곳에...
1194,2017.10.10.,랜드마크시티역 초역세권 ‘웨스턴파크 송도’ 투자상품으로 각광,역세권 수익형 부동산 불황기에도 ‘승승장구’ [서울경제] 지하철 개통 등 교통 호재가 있는 지역의... 중심으로 상권이 발달해 생활 편의성이 높아진다”면서 “역세권 단지는 매매 거래가 활발한 만큼 향후 뛰어난...
1195,2017.10.01.,"안철수, 추석 앞두고 옛 지역구 노원 방문…왜?","국민의당 안철수 대표가 추석을 앞둔 1일 국회의원 시절 지역구였던 서울 노원 지역을 방문해 지역 민심을... 안 대표는 노원중앙시장, 마들역 상가, 세이브존, 공릉동 도깨비시장 등 노원 지역의 대표 상권을 둘러봤다...."
1196,2017.10.10.,㈜원더풀플랫폼,"중소기업용에서부터 골목상권용 등 다양한 챗봇 구현이 가능해 콜센터, 호프봇, 김밥봇, 커피봇... 지난 9월 14일 서울 코엑스에서 있었던 제3회 한-이란 협력기업 매칭 컨퍼런스장에서 구승엽 대표가 이란 기업과 업무..."
1197,2017.10.10.,추석에 굴비 팔아 돈 번 이커머스...전통시장 '천적' 부상,"정부가 골목상권 보호명목으로 대형 유통시설에 대한 규제를 강화하고 있지만, 정작 전통시장을 위협하는... 서울 남대문시장과 부천 자유시장, 역곡 상상시장 등에서 만난 상인들은 일제히 “예년보다 추석 장사가..."
1198,2017.10.07.,"[단독]""영등포 롯데백화점 30년 점용이익 7500억원 가져가""","오전 서울 영등포구 롯데백화점에서 열린 '민자역사 국가귀속' 관련 임차업체 간담회에서 한국철도시설공단 관계자가 국가 귀속 처리 일정 등을 설명하고 있다. 2017.9.21/뉴스1 © News1 이승배 기자 국토부 ""인근 상권..."
1199,2017.10.12.,대학 학생식당까지 침투한 대기업..4500여개 중소업체 '고사위기',"서울대를 비롯한 6개 국공립 대학의 학생식당까지 위탁·운영하고 있으며 연세대, 이화여대, 건국대 등의... 골목상권 침해라는 인식아래 현 정부의 국정기조인 대.중소기업 상생협력과 공정경쟁을 위한 제도개선이..."
1200,2017.10.10.,"안동 국제탈춤페스티벌·민속축제, 세계인의 축제로 '우뚝'",축제 기간 서울에서 출발하는 외국인 관광객 모객프로그램은 예약시작과 동시에 마감이 되는 등 국내... 시내상권 활성화를 위해 전통시장과 시가지에 마련한 축제 프로그램이 더욱 다채로워지면서 시가지도...
1201,2017.10.20.,다산신도시 최초 지식산업센터 `다산신도시 블루웨일` 모델하우스 개관,"㈜유승종합건설이 오는 11월 공급하며 우수한 서울접근성과 다양한 생활인프라로 일찌감치 투자 수요의... 현대프리미엄아울렛(예정) 바로 앞 상권에 위치해 패션, F&amp;B, 라이프, 금융, 메디컬 등 조닝별 MD 구성을 갖춘..."
1202,2017.10.10.,추석 지나고 큰 장 선다,유입되면서 서울 등 수도권 교통요충지나 개선지역을 중심으로 공급되는 수익형 부동산이... 안정적인 상권이 형성돼 있다. 출퇴근 용이 불황에 강해 출·퇴근이 용이해 실수요자는 물론 교통...
1203,2017.10.14.,"초역세권 위치한 '마곡역 메트로비즈', 눈길'","신흥 상권으로써 이동인구의 흡입률이 높을 것으로 전망되며, 입지적 희소가치까지 부각되면서 뜨거운 관심을 받고 있다. 교통환경도 뛰어나다. 지하철(5호선, 9호선, 공항철도)을 통해 도심지(강남지역, 서울역)와..."
1204,2017.10.16.,강남구청역 사거리 인근 중소형 빌딩 실거래 사례 및 추천매물,특히 강남구청역 사거리 상권은 유동인구가 꾸준하고 배후세대가 풍부한 상권으로 안정적으로 강남권에 투자하고자 하는 투자자들이 선호하는 지역이다. ◆실거래 사례(강남구청역 사거리 인근) A지역의 서울세관사...
1205,2017.10.13.,직주근접 단지 '부평 룩소르 주상복합' 눈길,"단지 인근 부평역은 인천 1호선과 서울 1호선 환승역으로 부평 지하상가를 비롯해 롯데마트, 롯데백화점, 2001아울렛 등 대형상권이 인근에 밀집됐다. 단지 바로 옆에는 11만 3123㎡ 규모 부평공원이 있고 부평서초..."
1206,2017.10.18.,"비(非)규제지역 부천시, 개발호재 갖춘 중동에 오피스텔 공급","- 교통, 생활환경 등 주거여건 우수한 부천시청역 최중심 입지 - 정부가 서울 전역 및 경기 일부 지역을... 중동 상권의 새로운 핵심 지역으로 성장할 예정이다. ‘부천시청역 솔라리움’ 오피스텔은 부천 중동과 상동의..."
1207,2017.10.04.,"치킨집 팔고 근처에 또 치킨집 개업…法 ""1200만원 배상해야""","서울중앙지법 민사합의18부(이원 부장판사)는 치킨집을 운영하는 A씨가 자신에게 치킨집을 넘긴 뒤 근처에... 재판부는 다만 ""치킨집의 영업이익은 경영자의 능력이나 총 영업시간뿐만 아니라 주변 상권의 변화, B씨의..."
1208,2017.10.10.,상가투자 시 ‘키 테넌트’ 유무 중요해 인천 구월 지웰시티몰 분양 중,"키 테넌트는 고정 수요층 확보가 가능해 상권 활성화가 용이하다는 장점이 있기 때문이다. 키 테넌트란... 자리했으며, 서울외곽순환고속도로 장수IC, 영동고속도로 및 제2경인고속도로 서창JC, 제2경인고속도로..."
1209,2017.10.11.,"소자본 프랜차이즈 창업 '쿡플', 지속적인 신메뉴 출시로 입맛 ‘취향저격’","또한 소자본 프랜차이즈 창업 '쿡플'은 상권분석 및 시장분석 전문 팀을 구축해 예비 창업주들을 상대로 특급... 한편 쿡플은 현재 전국 파트너 지사와 가맹점을 모집 중이며, 현재 서울 강남, 서울 강북을 비롯해 김포..."
1210,2017.10.11.,"소자본 프랜차이즈 창업 '쿡플', 지속적인 신메뉴 출시로 입맛 ‘취향저격’","또한 소자본 프랜차이즈 창업 '쿡플'은 상권분석 및 시장분석 전문 팀을 구축해 예비 창업주들을 상대로 특급... 한편 쿡플은 현재 전국 파트너 지사와 가맹점을 모집 중이며, 현재 서울 강남, 서울 강북을 비롯해 김포..."
1211,2017.10.16.,"‘마곡 GMG엘스타 상가’, 마곡역 공항대로변 진입 시 첫 상가로 눈길",있는 서울 강서구 마곡지구 공항대로변 북쪽이 눈길을 끌고 있다. 실제로 LG사이언스파크 등 30여개가 넘는 기업들의 입주 행렬이 줄을 잇고 있다. 마곡지구 공항대로변 북쪽 상권 중에서도 특히 마곡역 기점으로...
1212,2017.10.18.,"다인 로얄팰리스 물금, 상가 1~3차 이어 4~5차도 홍보관 개관","울산, 서울로 연결되는 쾌속 도로망까지 갖췄으며 양산의 쇼핑, 문화 트랜드의 중심이 될 라피에스타(예정)... 남양산역 초역세권 프리미엄 상권을 기반으로 동선을 고려한 차별화된 최신식 특화설계와 풍부한..."
1213,2017.10.17.,[부동산 칼럼] 수익형 부동산 투자 시 고려해야 할 몇 가지 사항들,하지만 경기불황이 장기화하거나 상권이 미약하고 임차인의 영업 부진이 이어질 경우 임대료 연체 및 공실... 더욱이 8·2 부동산대책으로 투기과열지구(서울 전역) 및 조정대상지역에서 분양되는 오피스텔이...
1214,2017.10.17.,"[포토 경기의정에세이] ""제대로 하겠다는 약속 지키려 노력"" - 남종섭의원","그는 ""올해 경기도에 이어 서울시도 조례를 제정해 국가유공자 지원에 나서고 있다. 경기도가 시작한... 골목 상권 육성이 필요하다""고 제시했다. 또 ""기흥저수지 문제도 농업용 저수지로서 기능이 퇴화되고 있는 만큼..."
1215,2017.10.12.,[인터뷰] 순호한국부동산감정평가연구소 배순호 대표,"순호한국부동산감정평가연구소 배순호대표 (서울=국제뉴스) 김민건 기자 =올해로 15년째 대표로써 업무를... 이 때, 자연스럽게 인구유입이 되기 때문에 당연히 상권에 대한 전망이 밝다. 보통 좋은 상권은 대도시를..."
1216,2017.10.16.,"[한강T-국감] 홍익표, ""'신세계ㆍ롯데' 반려동물업 진출... 적합업종 제도 보...",[한강타임즈 윤종철 기자] 더불어민주당 홍익표 의원(서울 중구성동갑)이 중소기업의 적합업종 제도 보완이 시급하다며 주장하고 나섰다. 대기업의 골목상권 진출로 영세상인들의 생존권이 크게 위협받고 있지만 현재...
1217,2017.10.13.,산업단지 인근 상가 ‘높은 몸값 이유있네’,"일대 상권이 활발해진 케이스다. 넥슨코리아, 카카오게임즈, NHN엔터테인먼트, 네오위즈, SK플래닛... 한국감정원 자료에 따르면 기업들이 많이 밀집한 서울 대표 오피스 단지인 광화문 일대 중대형상가 공실률(2017년..."
