,date,title,contents
887,2017.12.20.,[2017 패션·뷰티업계 결산] 군살 빼고 '희'…사드 탓에 '비',"아모레퍼시픽은 서울 용산구에 마련한 신본사가 '원대한 기업(Great Company)'이란 비전을 이루기 위한 구심점... 면세 채널 부진과 관광 상권 매장 위축으로 인력과 브랜드, 고객 경험에 대한 투자가 늘었기 때문이다. 매..."
888,2017.12.22.,트윈복층형 오피스텔 ‘호매실 에이스카운티 포유’144구 분양,"사업지인 호매실 중심상업지구 1-3-1블록은 지구 내 상권의 중심을 형성할 전망으로 교통, 문화, 생활 등... 수원~광명간 고속도로로 서울, 경기권까지 접근이 쉽고 구운사거리 연결도로 개통으로 서수원터미널 3분..."
889,2017.12.05.,"노점상·지역상권 상생모델…서대문구, '신촌 박스퀘어' 건립",노점상을 강제철거하지 않고 경쟁력있는 자영업자로 키우고 청년창업도 지원해 이대 앞 상권의 부활을 꿈꾼다. 서울 서대문구(구청장 문석진)는 경의중앙선 신촌역 앞에 '신촌 박스퀘어'를 건립한다고 5일 밝혔다....
890,2017.12.14.,강릉시 옥천동 새롭게 거듭난다…도시재생 뉴딜 사업,"정부는 14일 정부서울청사에서 열린 ‘제9차 도시재생특별위원회’에서 강릉시를 포함한 도시재생 뉴딜... 주요 사업은 원도심 지역상권 활성화를 위한 중앙시장 환경개선과 상인 역량 강화사업, 상점가 빈 점포..."
891,2017.12.18.,'바우네나주곰탕' 대전 둔산점 석점주 성공사례,"뿐만 아니라 상권분석에서 점포개발까지, 인테리어 가이드와 메뉴개발을 대신해주기 때문에 실보다는 득이... 마침 서울에 볼 일이 있어 올라갔다가 바우네를 찾아서 식사를 하려고 했는데 점심 시간에 줄이 한참 서..."
892,2017.12.18.,"현대엔지니어링, 편리한 교통망 갖춘 ‘가산 테라타워’ 12월 분양",서울 가산동 일대에 또 하나의 지식산업센터가 들어설 예정에 있어 수요자들이 주목하고 있다. 12월 중... 등으로 상권의 활성화가 예상된다. 상품도 우수하다. 가산 테라타워는 지하 2층에서 지상 5층까지 ‘드라이브...
893,2017.12.06.,코엑스몰 상권 살린 ‘별마당 도서관’,서울 강남구 스타필드 코엑스몰의 ‘별마당 도서관’이 긍정적 가능성을 보여주고 있다. 코엑스몰의... 이에 2016년 12월 영업권을 인수한 신세계가 ‘상권 부활’ 프로젝트로 내건 테마가 도서관이었다. 인구는...
894,2017.12.06.,"KT, 케이블업계와 '미디어 생태계' 구축 앞장","서울을 비롯 대전, 대구, 광주 등 광역시를 중심으로 약 160만 가입자에 서비스를 제공 중이다. KT는... 이는 지역 광고시장에 활력을 불어 넣고 상권 활성화에도 기여했다는 평가다. 임헌문 사장은 ""KT는 중소..."
895,2017.12.20.,"김해·동부산 '한동네 시대'로… ""동남권 경제 살릴 대동맥""","■동부산으로 쇼핑, 관광 유출될까 동부산권과 접근성이 좋아지면서 김해지역 상권과 관광 시장의 일부가... 지도에 고속도로 선을 그을 때 김해가 문제 제기를 했어야 됐다""며 ""서울외곽순환도로도 많은 구간이 경기도를..."
896,2017.12.20.,"착한 외식 프랜차이즈 창업 '고씨네카레', 창업지원 인프라 구축","현재 30여개의 서울, 경기 지역 지점 외에도 창원 시티세븐점 오픈을 시작으로 대구 경북대 본점까지 오픈 준비 중으로 경상권에서도 많은 러브콜을 받고 있는 상황이다. 고씨네카레는 갑질 없는 프랜차이즈로 입지를..."
897,2017.12.20.,"신세계, 뷰티편집숍 '시코르' 최대 규모로 강남 오픈","(22일) 서울 강남역에 최대 규모 플래그십 스토어를 오픈한다. 강남점은 대구, 광주, 고양 등에 이은 국내 6번째 매장이자 첫번째 로드숍이다. 시코르 강남점은 대표 복합 중심상권 중 하나인 강남역 메인스트리트 내..."
898,2017.12.19.,"대규모 개발호재 갖춘 '마곡지구, 광명역세권, 영종도' 일대 주목","경기도 광명역세권은 수도권 교통, 상권의 중심으로 개발호재가 풍부한 지역이다. 광명역은 현재 KTX와 수도권전철 1호선 환승역으로 이용되고 있으며 서울-광명 간 고속도로(예정), 신안산선(예정), 월곶-판교선..."
899,2017.12.14.,"정부, 50조 도시재생뉴딜 시범사업지 68곳 확정",정부는 이낙연 국무총리 주재로 14일 오후 정부서울청사에서 '제9차 도시재생특별위원회'를 열어 도시재생... 경북 포항시는 청년 창업을 위한 리빙랩 지원사업과 상권 활성화를 위한 스마트 광고 등 스마트 서비스를...
900,2017.12.13.,"김태균 전남도의원,‘한국매니페스토 약속대상’수상","한국매니페스토실천본부는 13일 오후 2시 서울 영등포 아트홀에서 시상식을 가졌다. 김태균 의원은 2014년 지방선거에 출마하면서 지역 경제와 상권 살리기, 관광 인프라 조성 등 15개 공약사항을 발표해 이 중 9개..."
901,2017.12.11.,"창원 중소상인들, 신세계 스타필드 입점계획 철회촉구","늘어 상권이 흡수되는 빨대효과가 발생한다고 했다""며 우려했다. 대책위는 ""이미 각종 프랜차이즈, 대형마트, 백화점 등 인구 대비 78% 이상 초과 상태인 창원 지역 경제에서 지역의 돈이 서울로 집중될 뿐이고..."
902,2017.12.08.,"이랜드월드 로이드, 홍대점 그랜드 오픈","로이드는 서울 마포구 홍대입구역 8번 출구 인근에 로이드 홍대점을 그랜드 오픈했다고 8일 밝혔다.... 이랜드월드 로이드 관계자는 ""홍대 지역 상권의 장점을 살려 단순히 주얼리만 판매하는 공간이 아닌, 체험형 문화..."
903,2017.12.15.,"통영, 1조 들여 문화-관광 허브로… ‘제2 말뫼’ 변신 꿈꾼다","이번 시범 사업지는 지역 간 형평성을 고려해 서울을 제외한 전국 16개 시도에 골고루 퍼져 있다. 신청이... 구도심의 골목 상권과 주거지역을 함께 재생하는 ‘일반 근린형’은 광주 남구 등 15곳이, 20만 m² 규모의..."
904,2017.12.22.,"서대문구, 신촌골목 상인전문가 14명 위촉",초보 상인에 1대1 창업 상담 서비스 제공 [시민일보=고수현 기자] 서울 서대문구는 창업을... 또 연 2차례 간담회를 열어 초보 상인들의 고민과 애로사항을 공유하고 지역상권 활성화를 위한 토론의...
905,2017.12.05.,늦어지는 트램·트랜짓몰… 위례신도시 '울상',위례신도시 내 신교통수단인 ‘트램’과 대중교통전용지구인 ‘트랜짓몰’이 주변 부동산 시장 및 상권... 한 상업시설 관계자는 “서울시와 LH가 트램과 트랜짓몰 조성을 늦추면서 입주민과 상가 분양자만 손해를...
906,2017.12.23.,"소상공인과 함께 한 7년... 시장경제신문, '올해의 보도대상' 수상",소상공인연합회(회장 최승재)는 지난 21일 서울 여의도 웨딩컨벤션에서 '소상공인연합회 선정 2017 올해의... 목표는 전통시장과 골목상권이 융성하는 살맛나는 세상이다. 자영업이 무너지면 퇴직자들이 먹고 살 방법이...
907,2017.12.18.,SK하이닉스 효과 대기업 특수 노리는 대농지구 롯데캐슬 시티 오피스텔 인기,아파트 시세와 수익형 부동산 임대수익률에 큰 영향 [서울경제] 대기업이 들어서 있는 지역은 경기 침체... 거래와 상권도 크게 영향을 받는다. SK하이닉스가 위치한 청주 복대동 일대는 SK하이닉스 관련 기업 근무자...
908,2017.12.15.,춘천 약사동 도시뉴딜 시범사업 선정···4년간 487억원 투입,15일 시에 따르면 지난 14일 정부서울청사에서 열린 '제9차 도시재생특별위원회'에서 발표한 도시재생 뉴딜... 약사동은 원도심인 명동과 중앙시장이 인접한 지역으로 지속적인 인구유출로 인해 지역상권이 쇠퇴하고...
909,2017.12.18.,"수원시, 도시재생 공모사업에 잇따라 선정","정부는 정부서울청사에서 ‘제9회 도시재생특별위원회’를 열고, 수원시를 비롯한 68곳을 도시재생 뉴딜... 도시재생은 ‘수원역 앞길 살리기 사업’, ‘지역 상권 살리기 사업’, ‘청년 기 살리기 사업’, ‘문화..."
910,2017.12.12.,그래도 부동산…수익형부동산 인기,작더라도 상권이 있어야 건물 가치가 있을 거 아녜요. 강남권에서 수요자들은 많죠. (매물이) 별로 없어요.... 보통 토지보상금은 서울 강남 재건축시장 등으로 흘러 들어가는데 최근 주택에 대한 규제가 강화되면서...
911,2017.12.22.,"청라 7호선 연장 예비타당성 통과 발표예정, 유럽풍 수변테라스 스트리스상가...",(서울=국제뉴스) 김영명 기자 = 인천광역시 서구 청라에메랄드로 79 일원에 조성되는 ‘청라 커낼에비뉴’가... 이러한 청라국제도시의 중심상권으로 부상하고 있는 청라 커낼웨이는 풍부한 임대수요와 경제성 창출효과가...
912,2017.12.15.,김상조 “특수한 국내 대·중소기업 관계...소가 천리 걷듯 우직히 해결해나갈...,중기중앙회·더민주 중기특위 공동개최 김상조 공정거래위원장이 15일 서울 여의도 국회 내 국회도서관에서... 박성택 중기중앙회장은 “과거 산업화 과정에서 성장한 재벌대기업들이 골목상권과 생계형 업종까지...
913,2017.12.18.,[에경|분양핫클릭] 목동생활권에 들어서는 신규 스트리트 상가…GS건설 '목동...,GS건설 ‘목동파크자이’ 상업시설 투시도 (사진=GS건설) GS건설은 서울시 양천구 신정동 171-61번지에 있는... 주변 상가가 대부분 노후했기 때문에 신규 상업시설이 들어설 경우 유동 인구의 증가로 상권이 더 활발해질...
914,2017.12.07.,'사설 폭력'은 어떻게 '공무 집행'으로 둔갑되나,건물인 서울 강남구 신사동 가로수길 빌딩이 팔렸다는 게 이슈가 됐다. 언론에서는 이 건물의 매도 가격에... 상권 내모는 투기다. 무법천지의 불로소득인 셈이다. 강제집행으로 1년 만에 20억 넘게 벌 수 있게 된 것이다....
915,2017.12.06.,스타필드 별마당도서관… 6개월새 1000만명 ‘Book적Book적’,"명사들 강연과 다양한 이벤트 도서문화 확산에 상권도 부활 신세계프라퍼티의 서울 강남구 삼성동 코엑스 ‘별마당 도서관’(사진)이 개관 6개월 만에 방문객 1000만 명(코엑스몰 방문 기준) 돌파, 시민 기부도서 증가..."
916,2017.12.14.,"수익형 상품까지 품은 민간 건설사, 브랜드 파워와 노하우로 투자수요 집중","현대프리미엄아울렛(예정) 바로 앞 상권에 위치해 패션, F&amp;B, 라이프, 금융, 메디컬 등 조닝별 MD 구성을 갖춘... 우수한 서울 접근성과 교통환경도 주목할 만하다. 화물업체 등의 경우 가까이에 있는 구리IC를 통해..."
917,2017.12.14.,재건축 기대감 반영된 양천구 ‘신월시영’ 주목,"부동산 114에 따르면 서울 아파트 매매가격은 0.28% 상승했다. 그중 양천이 전주 대비 0.71% 상승으로 서울... 현대백화점, 행복한백화점, 이마트 등 대형 쇼핑몰과 상권이 모여있는 목동역, 오목교역 일대에 차량으로..."
918,2017.12.21.,"치솟는 금리, 강해진 부동산 대출 규제 '중도금 무이자' 청주 테크노폴리스 지...",2022년 개통 예정인 천안~청주공항 복선전철사업이 확정되면서 서울까지 1시간 40분대 접근이 가능해진다.... 단지 바로 앞에 테크노폴리스 중심상권과 근린상권이 조성돼 생활편의 시설도 편리하게 이용할 수 있다....
919,2017.12.12.,독특한 설계로 볼거리 풍성한 상가 ‘인기’,"실제 올 2월 서울 금천구 일대에서 분양한 스트리트형 상가 ‘마르쉐도르 960’은 평균 29.8대 1, 최고 304대 1의... 영국 브릭스톤 상권과 붉은 벽돌 건물의 이미지를 좀 더 세련되게 재해석했다. 상가실제 런던 남부에..."
920,2017.12.15.,상주시 국토부 도시재생 뉴딜 공모사업 선정,"상주시는 이 사업을 통해 공동체 활성화, 골목상권 살리기, 생활인프라 확충 등 쇠락한 근린지역을 활성화해 삶의 질이 높아져 인구를 증가시킬 수 있을 것으로 보고 있다. /이현종기자 ldhjj13@sedaily.com [서울경제..."
921,2017.12.07.,'맛있는 제주만들기' 19호점…'차이나마씸' 재개장,호텔신라는 박씨와의 면담과 주변상권 조사를 통해 19호점만의 차별화된 음식 메뉴를 개발해 노하우를... 특히 후 자문은 서울신라호텔 중식당 '팔선'의 총주방장으로 중국 최고의 보양식인 '불도장'을 1987년 국내 첫...
922,2017.12.07.,가좌천 일대 '진주의 홍대거리' 만든다,이 사업이 성공리에 완료되면 오는 2020년 경상대 내에 들어설 스포츠 콤플렉스와 자연스럽게 연계돼 이 일대가 서울의 '홍대 거리'나 대구의 '김광석 거리'와 유사한 대학 문화 및 새 상권이 형성될 것으로 기대된다. 이날...
923,2017.12.15.,"수원시 매산동 일원, 국토부 도시재생뉴딜 시범사업지로 선정","정부는 이날 정부서울청사에서 '제9회 도시재생특별위원회'를 열고, 수원시를 비롯한 68곳을 도시재생 뉴딜... 도시재생은 '수원역 앞길 살리기 사업', '지역 상권 살리기 사업', '청년 기 살리기 사업', '문화 다(多)..."
924,2017.12.14.,[보도자료 및 모두말씀] 제9차 도시재생특별위원회,"정부서울청사에서 제9차 도시재생특별위원회를 열고, ｢2017년도 도시재생 뉴딜 시범사업 선정안｣을... 지원사업과 상권 활성화를 위한 스마트 광고 등 스마트 서비스를 제공할 계획입니다.      * ICT 기술을 현장에..."
925,2017.12.22.,"㈜미소부동산연구센터, 데이터 분석 결과 '강남 중소형 빌딩 거래량 증가'","전체 서울시 강남구의 최근 3년 전체 거래 건수는 2014년 729건, 2015년 986건, 2016년 1,235건으로 크게... 아직 상권이 형성이 되지 않은 지역의 노후 된 건물을 사서 신축 및 리모델링으로 바꾸는..."
926,2017.12.21.,미식거리에선 현대카드 M포인트를 기억하세요,"현대카드는 서울과 부산의 미식 지역 10곳을 선정, 해당 지역의 레스토랑과 카페, 바 등에서 상시... 골목 상권 활성화에도 기여 이제 고객은 미식거리서 '현대카드 M포인트'만 기억하면 즐거운 외식과..."
927,2017.12.19.,내년도 토지보상금 수익형부동산으로 옮겨탈까,보통 토지보상금은 서울 강남 재건축시장 등으로 흘러 들어가는데 최근 주택에 대한 규제가 강화되면서... 사업지 일대는 세종시를 대표하는 최고급 주거타운 및 랜드마크 상권이 형성될 전망이다. 우미건설은...
928,2017.12.06.,"KT, CMB 상생 MOU..'케이블+모바일' 상품 출시 목표",양사는 이날 오전 서울 종로구 KT 광화문빌딩 East 사옥에서 KT Mass총괄 임헌문 사장과 CMB 김태율 대표이사... 이는 지역 광고시장에 활력을 불어 넣고 상권 활성화에도 기여했다는 평가를 받았다. KT와 CMB 양사는...
929,2017.12.11.,유비쿼터스 세상을 풍요롭게 사는길,"서울 삼성동 코엑스의 한 의류매장에는 사물인터넷 기능이 있는 스마트 거울이 있다. 이거울은 손님이... 반면, 대형마트가 생기면서 지역상권을 빨아들였듯이 변화에 따라가지 못하거나 준비가 부족한 기업은 생존마저..."
930,2017.12.12.,"SK건설·SK D&D, 지식산업센터 '성수 SK V1 센터' 분양","역세권 상권을 비롯해 서울숲, 중랑천, 어린이대공원 등이 있어 도심 속에서 휴식의 여유도 누릴 수 있다. 성수 SK V1 센터는 차별화된 공간설계로 효율적인 업무환경을 제공한다. 입주하는 기업의 특성에 맞게..."
931,2017.12.05.,신촌 박스퀘어 사업 설명 하는 문석진 서대문구청장,"서울특별시청 브리핑룸에서 열린 서대문구 신촌 박스퀘어(컨테이너몰) 조성 기자설명회에서 사업 설명을 하고 있다. 신촌 박스퀘어 건립은 노점상들의 자영업자 전환, 청년창업을 통한 일자리 창출, 지역상권..."
932,2017.12.13.,[변호사 복덕방 유죄] “중개사 자격없는 변호사의 중개업은 불법”,com 지난 7월 12일 서울 중구 프레스센터에서 열린 신사업 발표 간담회에서 공승배 트러스트 대표가 서비스에... 골목상권을 침범하는 것과 다르지 않다”고 말했다. 반면 공 대표는 이번 판결에 불복해 상고를 준비할...
933,2017.12.14.,[2017 유통가 10대뉴스]최저임금·사드보복·갑질 등 악재로 몸살,현대백화점 역시 5월 아울렛과 복합쇼핑몰을 결합한 형태의 상권 맞춤형 매장 '현대시티몰 가든파이브점'을... 오는 2020년까지 서울 시내 호텔 객실 숫자는 10년 전에 비해 3배 이상 늘어날 것으로 전망된다. 지난...
934,2017.12.20.,"[단독] 이마트, 강남대로에 '일렉트로마트' 첫 로드샵 낸다","강남대로에 오픈하는 일렉트로마트는 진정한 의미의 첫 로드샵 뿐 아니라 첫 강남상권 진출, 플래그십스토어 등의 역할을 할 것으로 보인다.   20일 관련업계에 따르면 이마트는 서울 강남구 논현동 164-7번지 일대에..."
935,2017.12.14.,"공덕역 초역세권, `대우월드마크마포` 8억원대 거래..","통한 서울의 대표 업무 중심지역인 종로, 여의도, 용산, 강남권역 등으로의 이동이 편리하며 공덕역을 중심으로 마포시장, 공덕시장, 공덕동족발골목과 마포전골목 등의 상권과 의료시설·은행·관공서·각종 음식점..."
936,2017.12.20.,"[강제 워커홀릭 직장인②]“주말도, 저녁도 없다보니…” 노는 법 잊은 ‘타임...",연구소가 서울과는 거리가 있어 집도 연구소 근처로 얻은 엄 씨는 대학생 때까지만 해도 ‘스포츠광’이었다. 그러나 엄 씨의 취미는 ‘집에서 TV보기’로 바뀐 지 오래다. 매일 이어지는 야근에 주변 상권도 좋지 않아...
937,2017.12.07.,"""1억만 있으면 700만원 월세"" 상가투자 고수의 비법",[[피플]김종율 보보스 부동산연구소 대표] 지난 11월 서울 강남 한 카페서 만난 김종율 보보스 부동산연구소... 한국 최고의 상권으로 꼽히는 강남역 주변도 사람들이 자주 다니지 않는 곳이라면 피해야 한다는 것이다....
938,2017.12.11.,"스타필드 '배틀필드'<싸움터, 논쟁거리>","창원시 중소상공인, 시장보호대책위는 11일 시청프레스센터에서 기자회견을 열고 ""창원의 돈이 서울로... 대책위는 중소기업연구원의 자료와 일부 언론의 보도를 인용해 ""근거리 상권은 기존 소상공인들이 일자리를 잃는..."
939,2017.12.16.,'푸드트럭'→'골목식당' 백종원의 새로운 도전…내년 1월 첫 방송,"그동안 '장사의 神' 백종원이 서울 강남역, 경기도 수원, 부산 등 전국 각지의 '푸드트럭' 창업인들에게... 골목상권 살리기'에 나선다. '백종원의 골목식당' 제작진은 ""하루 평균 3000명이 식당을 시작하고, 하루 평균..."
940,2017.12.18.,"사물인터넷(IoT) 도시조성 실증 사례 발표, IoT센터서 열려","핵심기술인 사물인터넷을 적극 활용해 도시문제와 시민 요구사항을 해결할 것”이라 전했다. 한편, 서울 사물인터넷 실증사업은 2015년 북촌을 시작으로 2016년까지 주거·관광·상권지역 7곳의 조성을 마무리했다."
941,2017.12.07.,"누더기 지붕 즐비한 인사동, 한옥보전구역 맞습니까?",온 서울 종로구 인사동 한옥촌이 11월 22일 기와 지붕의 멋스러운 곡선 대신 마구잡이로 덮어 씌운 천막과... 지붕에 멍에처럼 덧씌워진 천막은 전통문화가 밀려나면서 골목 상권마저 위협받는 인사동의 현실을 상징한다....
942,2017.12.10.,"[현장 In] 한강이남최대 대구도매시장, 이전·재건축 대신 시설확장 가닥","반면 ""현재 상권을 포기할 수 없으니 재건축하는 게 맞다""며 찬성하는 상인도 있었다. 이런 까닭에 사업... 추진협의회 구성원들은 또 지난 5월 시설현대화에 나선 서울 가락도매시장과 인천 구월도매시장을 찾아가 두..."
943,2017.12.06.,"CMB-KT 협약 체결, 상생 협력 본격화","(수) 서울 종로구 KT 광화문빌딩 East에서 KT(회장 황창규)와 동등결합 상품 출시를 위한 상생·협력... 이를 통해 침체된 지역광고시장에 활력을 불어넣는 것은 물론, 지역 상권 활성화에도 크게 기여했다는 업계..."
944,2017.12.14.,쾌적한 주거환경 상도동 ‘상도더샵1차’ 최근 동향은?,등 서울 주요업무지구와 김포공항으로의 이동이 가능하다. 차량 이용 시 여의도 업무지구가 인접해 출퇴근이 편하고 올림픽대로에 진입하기 좋다. 아파트 단지가 모여있는 지역으로 단지 주변 상권과 영동시장을...
945,2017.12.15.,"수원시 매산동 일원, 국토부 도시재생 뉴딜 시범사업지로 선정","정부는 정부서울청사에서 ‘제9회 도시재생특별위원회’를 열고, 수원시를 비롯한 68곳을 도시재생 뉴딜... 도시재생은 ‘수원역 앞길 살리기 사업’, ‘지역 상권 살리기 사업’, ‘청년 기 살리기 사업’, ‘문화..."
946,2017.12.20.,[부동산 칼럼] 밝아오는 2018년 새해 부동산시장을 전망해본다,"신정부가 출범한 이후 연이어 쏟아진 온갖 부동산 규제책에도 서울 강남권을 포함한 수도권 일부지역의... 주택시장과 마찬가지로 상권의 경우에도 양극화가 예상되는바, 풍부한 유동인구 및 배후지 확보 여부와 함께..."
947,2017.12.03.,'트렌드 리더' 올리브영 명동본점 새 단장,스킨케어제품 1층 전면배치 매장 한가운데 고객 휴게공간 [서울경제] 올리브영은 첫 번째 플래그십 스토어... 이번에 새단장한 명동본점은 국내외 고객들에게 트렌드 1번가로 꼽히는 명동 상권에 걸맞게...
948,2017.12.18.,"안양 센트럴 헤센, 아파트 18~20일 3일간 계약 진행","특히 금정역은 광역급행고속열차(GTX) C노선이 건설될 예정이어서 앞으로 서울 강남,북 접근성이 개선될... 또한 1호선 안양역 주변에 조성된 상권인 안양1번가도 가까워 다양한 상업시설을 이용할 수 있고, 수리산과..."
949,2017.12.22.,"물금 신도시의 입지 호재를 누려라! 다인로얄팰리스 물금 4,5차' 막바지 분양...","(서울 =국제뉴스) 김영명 기자 = 현재 물금 신도시에서는 다인로얄팰리스 물금 4,5차 분양이 한창이다.... 접근성을 바탕으로 한 물금 4,5차 상가는 남양산역 초역세권 프리미엄 상권을 기반으로 복층형 높은 층고를 비롯해..."
950,2017.12.05.,‘신촌 박스퀘어’ 이대앞 노점상 새 보금자리 될까,/서대문구 제공 [서울경제] 서대문구가 컨테이너를 겹겹이 쌓아 만든 최신 공간에 이화여대 앞 노점상들을... 노점상의 안정적 영업활동을 지원하기 위해 상권 분석 및 재창업 교육도 진행하기로 했다. 유명 셰프를...
951,2017.12.16.,뉴타운 프리미엄 누리는 '영등포뉴타운 꿈에그린 스퀘어',"기대 서울 뉴타운 신규분양지가 인기를 모으는 가운데 사업초기 단계인 '영등포뉴타운'이 더욱 주목받 고... 특히 뉴타운 주민들이 직접적으로 이용하는 지하철역이 영등포시장역인 만큼, 이 일대를 중심으로한 상권이..."
952,2017.12.19.,"강남문화 깃든 다리건너 옥수동, 상권은 시골풍경",일단 부동산 관계자들은 옥수동 상권을 일컬어 ‘서울의 시골’ 같은 지역이라고 말한다. 대규모 주거인구·교통요지 호재 불구 상권 활성화 미비 옥수동의 대표 상권으로는 지하철 3호선 옥수역 6번 출구 중심으로...
953,2017.12.16.,속초 선호 주거지 조양동에서 '속초 양우내안애 오션스카이' 22일 오픈 예정,"인접 상권 형성으로 우수한 정주여건이 구축된다. 우수한 교육 인프라와 더불어 동해, 청초호, 호수공원 등이 인접해 쾌적한 주거환경이 마련된다. 한편 지난 6월 30일 서울-양양고속도로 전 구간이 개통되며 서울-속초간..."
954,2017.12.21.,"관악구-서울대, '녹두zip' 사업 추진","지원하고, 서울대는 인적·지적 자원을 활용해 창업을 원하는 청년들에게 강의 등을 통해 창업 노하우를 전수한다.  나아가 지역상인과 연계한 상권 활성화 사업 등도 추진할 계획이다. 거점센터는 총..."
