,date,title,contents
410,2017.12.26.,"㈜뉴딘플렉스, 신개념 스크린 낚시 카페 '피싱조이' 2호점 오픈","㈜뉴딘플렉스는 올해 서울 송파구에 세계 최초의 도심 속 스크린 낚시 카페 '피싱조이' 직영 1호점을 런칭한... 특성과 상권에 맞춰 자유롭게 운영할 수 있다는 강점이 있어, 매주 평균 20~30건의 창업 문의가 쏟아지고 있다...."
411,2017.12.25.,인천 부평에 커플 위한 VR카페 '#VR' 오픈 '이색 데이트 부각',서 대표는 서울대 기계공학과 4학년이다. 20대의 감각을 내세워 10~30대가 즐길 수 있는 VR 콘텐츠 발굴... 베이크는 앞으로 수도권과 지방 주요 상권을 중심으로 지점을 계속 확대할 예정이다. #VR 점포 개설을 담당하는...
412,2017.12.18.,"대구시, 도시재생 뉴딜사업 본격 '시동'","18일 대구시 등에 따르면 정부서울청사에서 열린 '제9차 도시재생특별위원회'에서 도시재생 뉴딜 시범... 구청은 이곳에 4년간 동구시장 상권 활성화, 공용주차장 조성 등의 사업을 벌인다. 동구 관계자는 ""이번..."
413,2017.12.31.,"[보도자료]바른정당, 책과 함께하는 독서상권 신년하례식 개최","바른정당, 책과 함께하는 독서상권 신년하례식 개최 바른정당은 1월 1일 오전 10시에 서울 동작구 국립서울현충원 현충탑을 참배한 뒤 여의도 중앙당사에서 ‘讀書相勸’(독서상권) 신년하례식을 진행한다. “2018..."
414,2017.12.18.,"GS건설, 목동파크자이 상업시설 12월 분양","모든 호실 도로변에 전면 배치, 스트리트형 상가…자이만의 특화설계로 많은 관심 [ GS건설은 서울시 양천구... 다소 노후된 상가 위주로 구성된 인근 상권도 목동파크자이 상업시설 신규 공급으로 인해 새로운 활기와..."
415,2017.12.25.,개별 상가임대료·투자수익률…인터넷서 손쉽게,"그동안 서울·경기, 중대형 상가·소규모 상가 등 큰 분류로 임대료나 공실률 등의 정보만 제공했다면... 한국감정원은 현재 전국 232개 상권에 대해 일반 건축물(사무용 건물·중대형 상가·소규모 상가) 5655동..."
416,2017.12.27.,모던선술집&이자카야 '경성주막1929' 지금이 창업 적기!,기사이미지 1 ▲(사진제공=경성주막1929) [서울=내외경제TV] 이수정 기자 = 국민들의 소득 및 생활수준이... '경성주막1929'는 상권 및 매장규모에 구애 받지 않고 고객들의 입소문만으로 꾸준한 고객 유입을 자랑하고 있다....
417,2017.12.27.,"GTX, SRT 등 대형개발호재 수혜 누리는 ‘오산 세교 건영아모리움 센트럴포레...","예정으로 서울을 비롯한 수도권으로 이동이 용이한 사통팔달의 교통망을 갖출 것으로 보인다. 여기에 2019년... 향후 이 개발호재들을 중심으로 인근에 다양한 상권이 형성될 것으로 기대하고 있으며, 테마파크의 경우..."
418,2017.12.21.,47년 된 성남 중앙시장 시설 현대화 본격화,중앙시장은 성남시가 출범(1973년)하기 전인 1970년 무렵 서울시 철거민 집단 이주 단지(광주대단지) 시절에... 갖춘 공설시장으로 탈바꿈해 성남 본시가지의 중심에서 지역 상권을 부흥하게 될 것으로 기대된다.
419,2017.12.27.,"캐주얼 분식 브랜드 얌샘김밥, ‘제46회 프랜차이즈 창업박람회’ 참가… 내달...",서울 강남구 코엑스에서 열리는 이번 박람회는 2018년 창업 트렌드를 가장 먼저 만나볼 수 있는 자리로 국내... 특히 한국프랜차이즈 산업 연구원이 진행하는 상권 분석이나 창업 컨설팅부터 매출 증대를 위한 마케팅...
420,2017.12.26.,프랜차이즈 갑질·불법파견에 `규제 칼날`… 복합몰 역차별 논란도,"공정위는 가맹분야 공정거래 '옴부즈맨'까지 가동했으며 최근엔 서울시, 경기도와 함께 가맹분야 합동... 두 브랜드는 공격적인 출점과 광범위한 상품 구성으로 골목상권 침해 논란이 제기되고 있지만 대규모 유통업법..."
421,2017.12.21.,명품 영동곶감 전국 여행객 입맛 사로잡았다,"특산물거리, 서울 용산역을 거치며 릴레이 곶감 판매행사를 벌여 총 6억 500만원어치를 판매했다. 군과... 골목상권 활성화와 식당 등 지역경제에 보탬이 됐다""며 ""설 명절 전까지 자매결연 지자체 등을 순회하며..."
422,2017.12.20.,"제주공항 면세점, 호텔신라 품으로…롯데면세점 석패",다만 이날 심사에서는 특허기간이 만료된 서울 코엑스 면세점을 롯데면세점이 다시 수성했다. 앞서 롯데면세점은 코엑스에 위치한 시내면세점을 단독입찰해 확정이 유력시 됐다. 이미 강남상권에는 현대와 신세계...
423,2017.12.18.,'청와대 앞길 개방' 6개월… 동네가 '엉망'이 됐다,화장실을 이용하려는 집회 참여자들만 몰립니다. ” 수년 전부터 서울 효자동에서 식당을 운영하고 있는... 인근에서 음식점을 운영하는 김모씨(65)는 “청와대 앞길을 24시간 개방한다고 해서 상권이 살아날 수도 있겠다...
424,2017.12.20.,성남 90억원 규모 소상공인 특례보증,"[서울신문] 경기 성남시는 영세 소상공인 특례보증 규모를 90억원으로 책정했다고 20일 밝혔다. 시는 내년... 전통시장 상인은 물론 5명 미만의 직원을 둔 음식.슈퍼마켓.세탁소 등 골목상권 영세 점포 운영자, 10명..."
425,2017.12.26.,[전국 주요 신문 톱뉴스](26일 조간),건설경제(서울) = 고삐 풀린 건자재가격 새해에도 줄줄이 뛴다 부산일보(부산) = 담배 연기 못 끊는 금연 아파트 국제신문(부산) = 핫한 광복로…다시 대표상권 넘본다 경남신문(창원) = '지엠 비정규직 사태' 정부 노동정책...
426,2017.12.22.,상가 임대료 인상률 9%→5%로 인하…소상공인 지원 대책 추진,상권에 따른 지역별 편차가 큰 점을 고려한 것으로 풀이된다. 서울의 경우 현행 4억원인 환산보증금 상한을 6억1000만원으로 올리는 등 50% 이상 대폭 인상된다. 한편 이번 개정안은 20일간의 입법예고 기간을 거쳐 다음달...
427,2017.12.21.,"상가임대료 인상률 상한, 5%로 대폭 인하",환산보증금 인상 범위는 상권에 따른 지역별 편차가 큰 점을 고려해 지역별 ‘주요상권’의 상가임차인 90% 이상이 보호를 받을 수 있도록 정했다. 서울 지역의 경우 현행 4억 원인 환산보증금 상한을 6억 1천만 원으로 2억...
428,2017.12.27.,8.2대책 수혜지역 '구리갈매1차 대방디엠시티' 오피스텔·상업시설 선착순 계...,"구리갈매 대방디엠시티는 경춘선 갈매역 도보 3분 거리로 초역세권에 위치하고 있으며, 서울 신내역까지... 지상 1층~3층으로 이뤄지는 상업시설 역시, 후면 모다아울렛과 우측 상권의 유동인구를 흡수할 수 있으며..."
429,2017.12.20.,"성동구, 젠트리피케이션 방지정책 브랜드 '상생성동' 제작","【서울=뉴시스】 서울 성동구 '상생성동' 심벌. 2017.12.20. (사진 = 성동구 제공) photo@newsis.com = 서울 성동구... 지역 상권 보호와 임대료 안정화가 필요하다는 판단에서 이뤄졌다. 정원오 성동구청장은 ""상생성동은..."
430,2017.12.20.,"성동구, 젠트리피케이션 방지정책 브랜드 '상생성동' 제작","【서울=뉴시스】 서울 성동구 '상생성동' 심벌. 2017.12.20. (사진 = 성동구 제공) photo@newsis.com = 서울 성동구... 지역 상권 보호와 임대료 안정화가 필요하다는 판단에서 이뤄졌다. 정원오 성동구청장은 ""상생성동은..."
431,2017.12.22.,"SBS 측 “남창희 고재근 ‘백종원의 골목식당’ 합류, 1월5일 첫방”","골목상권 살리기'에 성공할 수 있을지 기대가 모아진다. 새롭게 론칭하는 '백종원의 골목식당'은 죽어가는 골목을 살리고, 이를 새롭게 리모델링하는 과정을 담는 ‘거리 심폐소생 프로젝트’다. 그 첫 거리로 서울..."
432,2017.12.18.,"SBA, 2017년 사물인터넷 도시조성 실증사업 사례발표회 개최","주거·상권지역 및 4개 공공시설지역(어린이대공원, 전통시장, 서울로7017, 공영주차장)에 실제 IoT 서비스를 적용·실증하고 그동안의 성과를 공유하는 자리다. 2020년까지 총 50개 실증지역 조성을 목표로 추진 중인 서울..."
433,2017.12.20.,특화설계로 경쟁력 갖춘 지식산업센터 ‘가산 테라타워’ 분양,가산디지털단지는 서울 도심에 위치한 지식산업센터 밀집지로 수많은 기업들이 자리잡고 있다. 가산... 등으로 상권의 활성화가 예상된다. 상품도 우수하다. 가산 테라타워는 지하 2층에서 지상 5층까지 ‘드라이브 인...
434,2017.12.22.,한국판 실리콘앨리 꿈꾸는 '신림동 고시촌',기자 ] 서울대 인근 신림동 고시촌은 ‘합격’이라는 꿈을 이루기 위해 모여든 청년들로 늘 붐볐다. 그러나 사법시험이 폐지되고 고시생들이 떠나자 일대 상권은 급격히 몰락했다. 1990년대까지도 이곳엔 서점만 100개가...
435,2017.12.27.,대방건설 '구리갈매1차 대방디엠시티' 오피스텔·상업시설 선착순 계약,"지상 1층~3층으로 이뤄지는 상업시설 역시, 후면 모다아울렛과 우측 상권의 유동인구를 흡수할 수 있으며... 게다가, 서울과학기술대학교, 서울여자대학교, 삼육대학교가 인접하여, 대학생 수요까지 흡수할 수 있다...."
436,2017.12.27.,"평창 알펜시아, 용평리조트 입구의 위치한 ‘티롤빌리지(아도르프)’의 핵심상...",이에 ‘티롤빌리지(아도르프)’는 서울~평창~강릉 KTX 개통예정으로 인해 강남 ~ 평창은 1시간 거리로 되며... 길목상권이 되어 독점력 있는 상가가 될것이라 예상하고 있다. 세 번째 상가분석의 체크사항은 상가가...
437,2017.12.18.,"GS건설, 목동파크자이 상업시설 12월 분양","[한국경제TV 이지효 기자] GS건설은 서울시 양천구 신정동에 위치한 '목동파크자이 상업시설'을 이번 달... GS건설 관계자는 ""다소 노후된 상가 위주로 구성된 인근 상권도 목동파크자이 상업시설 신규 공급으로 인해..."
438,2017.12.22.,"[현장]""H&B숍과 다른 매력""…신세계 '시코르', 뷰티 랜드마크 도전",신세계백화점의 화장품 편집숍 '시코르'가 22일 서울 강남대로 중심지에 플래그십 매장을 냈다. 시코르... 젊은 유동인구가 많은 상권 특성상 시코르 강남역점은 2030 여성이 주 타깃이다. 이들을 위한 전략 중 하나는 해외...
439,2017.12.28.,㈜신영 ‘지웰’ 브랜드…특화평면 도입으로 신주거문화 선도,테크노폴리스 중심상권과 근린상권이 바로 앞에 위치한 단지로써 생활편의시설을 보다 편리하게 이용... 여기에 오는 2022년 개통 예정인 천안~청주공항 복선전철사업이 확정되면서 향후 서울(역)까지 1시간 40분대...
440,2017.12.28.,㈜신영 ‘지웰’ 브랜드…특화평면 도입으로 신주거문화 선도,테크노폴리스 중심상권과 근린상권이 바로 앞에 위치한 단지로써 생활편의시설을 보다 편리하게 이용... 여기에 오는 2022년 개통 예정인 천안~청주공항 복선전철사업이 확정되면서 향후 서울(역)까지 1시간 40분대...
441,2017.12.28.,조치원 상가의 세대교체 '세종 럭스 스퀘어' 분양,"차별화된 상권을 형성할 예정""이라며 ""원스톱 쇼핑이 가능한 공간으로 규모면이나 입지면이나 투자자들에게는 메리트가 큰 곳""이라고 말했다. 스트리트형 상업시설의 흥행은 이미 서울의 가로수길, 세로수길, 지역의..."
442,2017.12.28.,"50여가지 다양한 메뉴, 뉴욕야시장 강서구청점 오픈","[CCTV뉴스=김진영 기자] 소울프드·크래프트 비어창업을 꿈꾸는 뉴욕야시장이 서울 강서구에 뉴욕야시장... 지역별 상권에 맞춘 특색있는 맞춤 창업의 성공포인트를 제시하고 있다.   브랜드 관계자는 ""새로운 사람들과..."
443,2017.12.28.,"현대백화점, 천호점 리빙관 리뉴얼 오픈","천호점 리빙관은 가전, 가구, 홈 인테리어 등 리빙 전 분야에 걸쳐 총 100개의 브랜드로 구성되며, 특히 이 중 30여 개 브랜드는 서울 강동상권에 처음으로 선보인다. 현대백화점은 가전·식기·침구 브랜드로 구성된..."
444,2017.12.29.,[2017 키워드/유통]中사드보복에 '눈물'…편의점 4차산업 '도약',"올 초 중국 당국의 금한령이 내려진 뒤, 주로 중국 단체 관광객으로 붐볐던 서울 명동 거리는 한산했다. 서울... 문재인 정부는 골목상권을 보호하고 소상공인 편에 서 유통질서를 바로 잡겠다고 선언하며 유통규제법을..."
445,2017.12.13.,"홍종학 장관 ""지진피해 포항 죽도시장에 120억원 지원""","중기부, 지진피해 포항 죽도시장에 활성화 비용 지원(서울=연합뉴스) 홍종학 중소벤처기업부 장관(오른쪽)... 시장현대화, 상권 살리기 등을 패키지로 지원해 중기부가 중소·소상공인의 수호천사 역할을 충실히..."
446,2017.12.26.,[더벨]'고립형' 이촌역 상권의 잠재력,통한 서울 전역으로의 뛰어난 접근성도 보유하고 있다. 이러한 장점들로 인해 전통적으로 부촌이 형성되었고 여기에 거주하는 소득수준 높은 배후세대들로 인해 이촌역 상권은 경기를 타지 않는 안정적인 상권이...
447,2017.12.28.,제72차 정책조정회의 모두발언,"서울의 경우 환산 보증금 4억까지가 보호대상이지만, 개정안이 시행되면 6억 1천만 원까지 보호대상이 확대된다. 더불어민주당과 정부는 지역상권 내몰림 방지, 임차인 지위 강화를 국정과제에 포함하여 골목상권 보호에..."
448,2017.12.14.,'도시재생 뉴딜 시범사업' 68곳 선정…내년부터 본격 추진,정부는 14일 정부서울청사에서 이낙연 국무총리 주재로 제9차 도시재생특별위원회를 개최해 도시재생 뉴딜... 경상북도 포항시는 청년 창업을 위한 리빙랩 지원사업과 상권 활성화를 위한 스마트 광고 등 스마트 서비스를...
449,2017.12.22.,"네이버 ‘스마트렌즈’, 상점 외관만 비춰도 정보검색 OK",(서울=NSP통신) 류진영 기자 = 네이버의 비쥬얼서치 서비스 ‘스마트 렌즈’가 지난 11월 쇼핑렌즈에 이어... GPS 정보 활용과 함께 이미지를 통해 검색하는 방식으로 상점이 밀집해 있는 상권에서도 보다 효과적으로...
450,2017.12.26.,"훌랄라치킨 동탄청계1점, “우수가맹점 선정은 장기간 유지한 높은 수익구조 ...","[서울경제] 연말 시즌이 되며 ‘창업 성수기’가 도래함에 따라, 각 분야에서는 저마다 자신의 사업에... 창업연구지원센터를 통한 지원 혜택은 물론, ‘훌랄라 창업마스터’ 제도로 주변 상권 환경과 예상 소비자 수요..."
451,2017.12.26.,"홍종학 ""중기·소상공인 최저임금 부담 덜겠다""","홍 장관은 이날 오후 서울 여의도 중소기업중앙회에서 장관 취임 이후 처음으로 중소기업 간담회를 열고... 카드수수료 체계 개편, 인터넷 포털 불공정 행위 방지 등 '골목상권 지킴이 4종 정책'을 적용하겠다고 소개했다."
452,2017.12.26.,"[2018년 주목! 여기] <1> 판교, '알파돔시티' 등 잇단 대형 호재에 아파트 이...","제2·3판교테크노밸리 조성 최근 한두달새 시세 1억원↑ 집주인 기대감에 매물 회수 [서울경제] 정부의 강도... 업계 관계자들은 내년 알파돔시티 기업 입주, 역세권 상권 조성, 중국 자본의 판교 투자 등 개발 호재..."
453,2017.12.21.,"시코르, 플래그십 강남역점 22일 오픈","서울 대표 복합 중심상권 중 하나인 강남역 메인스트리트에 오픈한다. 이번 플래그십 스토어에서는 기존에 선보이던 색조, 스킨, 멘즈 등 카테고리 구성에서 퍼퓸, 네일, 뷰티툴, 키즈, 룸프레그런스까지 카테고리를..."
454,2017.12.26.,"[공단·재래시장 세밑 현장에선]""20년 장사했지만 적자는 처음...인건비 오를...",유통업체의 상권 침탈이 심해지면서 이벤트 세일이나 공연 개최 등 상인들의 판촉 역량이 무의미해진 상황”이라며 “이런 상황에서 신규 고용은 엄두도 내지 못한다”고 호소했다. /박해욱기자 spooky@sedaily.com [서울경제...
455,2017.12.28.,일자리예산 34% 1분기 집행…‘조선·해운·자동차’ 재건 박차,정부서울청사에서 발표한 ‘2018년 경제정책 기본방향’을 발표하면서 내년을 ‘3만 불 시대의 원년’이라고... 소상공인 경영비용 부담 완화 등 골목상권도 보호한다. 카드수수료 부담 완화 마련 및 소공인 특화자금도...
456,2017.12.14.,[종합]'도시재생 뉴딜 시범사업' 68곳 선정…내년 로드맵 발표,정부는 14일 정부서울청사에서 이낙연 국무총리 주재로 제9차 도시재생특별위원회를 개최해 도시재생 뉴딜... 경상북도 포항시는 청년 창업을 위한 리빙랩 지원사업과 상권 활성화를 위한 스마트 광고 등 스마트...
457,2017.12.21.,영동곶감의 대박 행진 릴레이 특판행사'계속',"특산물거리, 서울용산역을 거치며 릴레이 곶감 판매행사를 벌여 총6억5백만원어치를 판매했다. 군과... 군 관계자는 ""지난해에 비해 올해는 관내 행사장을 확대하고 다양한 콘텐츠를 담아내 침체된 구도심의 골목상권..."
458,2017.12.28.,"[에경|부동산] 올해 상업·업무용 부동산 거래량 역대 최고치…내년은 ""보수적...","골목상권은 새로운 쇼핑 명소로 부각됐다. 서울의 샤로수길, 망리단길, 연트럴파크 등 외곽지역이 핫플레이스로 떠오르면서 외부수요를 끌어들였다. 다만, 급등한 임대료에 원주민지 쫓겨나는..."
459,2017.12.18.,"'SK 후원' 전주비빔빵, ‘2017 한국사회적기업상’ 수상",14일 서울시 성동구 성수동 소셜캠퍼스 온에서 열린 ‘2017 한국 사회적기업상 시상식’에서 ‘한국... 매장이 위치한 구도심 주변 상권이 활성화되고 지역 전통시장에서의 재료구매 등으로 지역공유경제가...
460,2017.12.26.,[월요기획] 정용진·유경 남매 '신세계 뷰티' 시대 연다,"최근 서울 명동 플래그십스토어까지 사세를 확장했다. 부츠의 경우 명동점을 제외하고는 이마트, 스타필드 등 대형 유통 내 입점한 방식이기 때문에 로드숍 위주의 올리브영과 상권이 아직까지는 크게 겹치지 않는다...."
461,2017.12.26.,"[금한령 해제 한 달]""'싹쓸이 쇼핑' 보따리상이 돌아와야…"" 명동 상권, 회복...",지난 3월15일 중국이 사드 배치를 명분삼아 금한령을 발동한 이후 중국인들의 필수 관광코스인 명동과 서울시내 주요 상권에서는 요우커들이 썰물빠지듯 사라졌다. 지난 10월 한중 정상회담 이후 한달만에 중국이...
462,2017.12.21.,47년된 성남 중앙시장 시설 현대화,"중앙시장은 성남시가 출범(1973년)하기 전인 1970년 무렵 서울의 철거민 집단 이주단지(광주대단지)가... 지역상권 활성화에 기여할 것으로 기대된다""고 밝혔다. Copyright ⓒThe Naeil News. All rights reserved. [저작권자..."
463,2017.12.10.,을지로·퇴계로 6→4차로 축소 검토…'도로 다이어트' 본격화,"서울시는 ""도로공간재편을 통해 보행공간이 확충되면 사람이 모이고, 지역상권·관광이 활성화될 것으로 기대된다""고 밝혔다. 광화문 사거리에서 서울역에 이르는 세종대로 차로 축소는 광화문광장 재구조화와..."
464,2017.12.22.,"'SBS 골목식당' 백종원X남창희X고재근, 이대 앞 '남고식당' 오픈[공식]","상권 살리기'에 성공할 수 있을지 기대가 모아진다. 한편, 새롭게 론칭하는 '백종원의 골목식당'은 죽어가는 골목을 살리고, 이를 새롭게 리모델링하는 과정을 담는 ‘거리 심폐소생 프로젝트’다. 그 첫 거리로 서울..."
465,2017.12.27.,"[경기콘텐츠진흥원 ‘Big-Fi’ 프로젝트] 4차산업혁명 시대… 더 쉽게, 더 많...",사드 배치에 따른 서울 지역과 경기도 지역 관광 매출 및 매출변화를 집중분석하고 경기도와 타시도에... 경기도 상권영향 등도 분석해 이를 활용할 수 있도록 했다. 119 구급차 배치 및 운영 최적화 분석은 지난 3월...
466,2017.12.20.,"[New 유통인] ""스타벅스 18년 노하우, 더종로점에 모두 담았죠""","요즘 뜨는 핫플레이스나 강남권이 아닌, 다소 '올드'하다는 평을 듣는 상권인 종로를 택한 것은 의외라는 평도 있었다. 이에 대해 정 팀장은 ""종로는 서울 시내 교통의 요지인 동시에 다양한 연령층과 유동인구가..."
467,2017.12.15.,"논란 커지는 스타필드 창원 입점, 해법은 없나?","이들은 또 ""중소기업청의 조사에 따르면, 서울지역 등 대형쇼핑몰 입점이 소상공인 매출 감소가 원인이 아니라 자기들끼리 경쟁이 심해졌기 때문이다""고 했다. 이들은 ""롯데백화점, 대형마트와 가까운 창원 상남동 상권이..."
468,2017.12.20.,"롯데면세점, 코엑스점 특허 유지…5년 더 운영한다",하지만 서울 시내면세점 수가 많아지면서 경쟁이 더 치열해진데다 면세점 개점에 적합한 관광상권 입지도 마땅치 않아 기존 사업장을 그대로 유지했다. 코엑스점 특허권 입찰에 뛰어들어 롯데와 경쟁을 벌일 것으로...
469,2017.12.21.,"""스타필드, 창원 번화한 지역에 입점... 장점 많지 않아""","이 실장은 서울 강서구 공항시장, 김포 장기동, 판교지역의 사례를 들며 ""인근에 대형몰이 들어서면서 주변 상권은 매우 힘들어졌고 상인들은 절규하고 있다""고 했다. 또 그는 ""대형매장이 들어서면 인근 주택가까지 차량이..."
470,2017.12.26.,수도권 접근성 높은 성남 오피스텔 'BNB그라티아' 분양,"서울외곽순환도로 성남IC, 수서분당간고속도로 탄천IC 등을 5분 이내로 접근할 수 있어 인근 도시로의 이동성과 연계성이 높은 것으로 나타났다. 하루 유동인구 10만 여 명에 달하는 성남 상권에 입지한..."
471,2017.12.27.,상업용 부동산 임대동향 조사 관심도 높아,"한국감정원은 상업용 부동산 임대동향조사자료는 소상공인시장진흥공단, 서울시등에 제공되어 창업 활성화를 위한 상권정보 제공에 활용되고 있고,학계, 민간에서 관심도가 높아 꾸준히 정보공개 확대요구가 있다고..."
472,2017.12.22.,노른자위 입지 ‘속초 양우내안애 오션스카이’ 견본주택 오늘(22일) 공개,"인접 상권 형성으로 우수한 정주여건이 구축된다. 우수한 교육 인프라와 더불어 동해, 청초호, 호수공원 등이 인접해 쾌적한 주거환경이 마련된다. 한편 지난 6월 30일 서울-양양고속도로 전 구간이 개통되며 서울..."
473,2017.12.20.,[전국 주요 신문 톱뉴스](20일 조간),"▲ 경향신문(서울) = 가습기 살균제 무해 광고 '면죄부'는 잘못 ▲ 서울신문(서울) = 文대통령 ""美에 연합훈련... 골목상권에 돈 붓기' 현실 ▲ 중도일보(대전) = 대전에 있는 공공기관, 대전 출신 수장이 없다 ▲ 경상일보..."
474,2017.12.26.,상가 공실률 낮은 `딜라이트 스퀘어’에 투자자 관심,"딜라이트 스퀘어가 위치하는 홍대, 합정상권의 올해 3분기 투자수익률은 1.92%로 전국평균을 상회하는... 딜라이트 스퀘어는 대우건설이 서울 마포구 월드컵로 1길 14에 시공한 초대형 복합문화상가로 축구장 7개 크기인..."
475,2017.12.28.,"죽전문점 `맛깔참죽`, 4년 연속 우수 프랜차이즈 수상",지난 12월 22일 서울 양재동 엘타워에서 개최된 '2017 우수프랜차이즈 지정식'에서 맛깔참죽은 2016년에 이어... 원하는 상권에 대한 맞춤형 상권분석 브리핑을 무료로 해주는 특별 이벤트도 진행한다. 해당 이벤트는...
476,2017.12.25.,"서대문구, '신촌골목 상인전문가' 14명 위촉",이대 앞 골목상권 모습 (사진=서대문구) 서울 서대문구가 오는 26일 오후 3시 구청 기획상황실에서 신촌골목 상인전문가 14명을 위촉한다고 25일 밝혔다. 이들은 신촌에서 오랜 기간 영업하며 풍부한 현장 경험을 쌓은...
477,2017.12.26.,"GS건설 목동파크자이 상업시설, 12월 중 분양 예정",gs건설 목동파크자이 상업시설 조감도     ©브레이크뉴스 박수영 기자=GS건설이 서울시 양천구 신정동에... 또한 다소 노후된 상가 위주로 구성된 인근 상권도 목동파크자이 상업시설 신규 공급으로 인해 새로운 활기와...
