,date,title,contents
135,2019.10.26.,[26일 낙찰/계약 동향] 동호동 261번지선 외 1개소 도로건설공사 실시설계 용...,"계약기관 : 서울특별시서부교육청 예일여자중학교, 계약일자 : 2019-10-18, 계약방법 : 일반경쟁, 발주처... ▲ 낙찰업체 : 엔터컴, 계약금액 : 66,081,360(원), 계약명 : 2019 울산 U-창업페스티벌 행사대행 용역. 계약기관..."
136,2019.10.30.,"장시문 에스엠로지스틱스 대표 ""전 세계 물류 시장을 하나로 연결하는 선봉에...",또 서울 시청에 따르면 2019년 8월 기준 서울시 등록된 국제물류주선업체(포워딩업체) 수는 2455곳으로 신규등록한 업체는 81개업체에 달한다. 한편 올 1월~7월 기준으로 자발적으로 폐업을 하거나 영업자격을 박탈당한...
137,2019.10.31.,“본부만 잘 사는 프랜차이즈 안녕... 가맹점주가 주인인 프랜차이즈 협동조합...,"연합회는 이번 강좌를 통해 프랜차이즈 가맹점이 3년 이내 폐업하는 비율이 50%를 넘어서고 있고 특히... 대표가 참가한다. 김동홍 기자 쿱차이즈연합회, 예비 창업자를 위한 전국(부산, 서울, 대전) 공개강좌 열어"
138,2019.10.16.,[안창현의 법정관리 전략] 질서 있는 폐업 ...사업정리 컨설팅 받아라,"사업정리지원 제도란 최근 정부는 내놓은 '질서있는 사업정리 지원'은 이와 같이 폐업과 재창업에 대한... 서울 역삼동에 있는 재도전종합지원센터에서는 매주 화요일 변호사, 월요일과 목요일 노무사, 상주 회계사의..."
139,2019.10.23.,[강창동 大기자의 자영업이야기] 60대가 창업전선에 내몰리는 이유,1998년 봄부터 대기업과 금융기관에서 명퇴한 실업자들이 서울 근교 등산로를 가득 메웠다. 이후 이들이... ‘60대 창업-폐업-빈곤층 편입’이 늘면서 OECD(경제개발협력기구) 36개국 최고의 한국 노인빈곤율은 개선될...
140,2019.10.09.,전통시장 청년점포 생존율 2배 높아져 '청년상인 안착' 기대감,국회 산업통상자원중소벤처기업위원회 소속 더불어민주당 이훈 의원(서울 금천)이 9일 중소벤처기업부... 중기부 국감자료에서 청년몰 창업점포의 폐업 사유(무응답 29.3%)로는 ‘경영 악화’(18.3%)가 단일사유로...
141,2019.10.11.,"[한입뉴스] 넷마블 웅진코웨이 인수전 참가, 금융위 사모펀드 규제 강화, 유튜...",정부서울청사에서 국정현안점검조정회의를 열고 '중소기업ㆍ소상공인 규제 혁신방안'을 발표. 정부는 중소기업과 소상공인 부담을 줄이고 적극적인 창업을 유도하기 위해 관련 규제 140건을 수정. 창업 단계의 경우...
142,2019.10.02.,[비바100] 가맹사업 어려워진 시대…탄탄한 브랜드 고르는 방법은?,사진은 대표적 소상공인 밀집지역인 서울 중구 명동.(연합)서울 시내에 임대 문의 문구가 붙어있는 폐업 상점. (사진=연합) 창업전 가격대·점포 콘셉트 우선 고려해야 포지션·능력 두마리 토끼 잡아야…과학적·분석적...
