,date,title,contents
136,2018.06.10.,[포토] 땡처리 500원!,김세구 기자 k39@ajunews.com [연합뉴스] 10일 서울 종로구의 한 폐업처분 할인점. 560만 자영업자들의 수익... 가장 낮은 수준으로 떨어지는 등 위기다. 심지어는 폐업률이 창업률을 앞지르는 현상까지 나타나고 있다.
137,2018.06.13.,최악의 자영업 경기…내수시장 안정화가 급선무,"com &lt;yonhap photo-4300=""""&gt; 지난 10일 서울 종로구의 한 폐업처분 할인점. 560만 자영업자들의 수익 증가율이 6년... 심지어는 폐업률이 창업률을 앞지르는 현상까지 나타나고 있다. [연합뉴스] 올해 3% 경제성장 달성 목표가..."
138,2018.06.15.,"외국인관광객 대상 무허가 민박 우후죽순..""사고라도 터지면""",[서울=뉴스핌] 박진범 기자 = 서울 이태원동에서 외국인 관광객을 상대로 숙박업을 하는 김모씨는 최근 우후죽순 들어선 불법 숙박업소 탓에 손님이 줄어 폐업을 고민 중이다. 김씨의 민박집은 3년 전과 비교해 매출이...
139,2018.06.12.,[공공돋보기] '빚방석' 앉은 숙박·음식점들..최악 경기에 한숨만,"늘고 폐업 등이 늘어나는 결과로 이어질 수 있다""고 비판했다. ◆숙박ㆍ음식점업 최저임금 여파로 서울 창업 법인 수 22.4% ↓ 한편, 숙박ㆍ음식점업의 대출 수요가 지속되는 가운데 올해 최저임금이 대폭 오르면서..."
140,2018.06.12.,[공공돋보기] '빚방석' 앉은 숙박·음식점들..최악 경기에 한숨만,"늘고 폐업 등이 늘어나는 결과로 이어질 수 있다""고 비판했다. ◆숙박ㆍ음식점업 최저임금 여파로 서울 창업 법인 수 22.4% ↓ 한편, 숙박ㆍ음식점업의 대출 수요가 지속되는 가운데 올해 최저임금이 대폭 오르면서..."
141,2018.06.16.,"중기부, 재도전 기업인의 투자·판로 위한 '재도전 한마당' 개최","중기부)는서울창업허브에서 재도전 기업인의 투자·판로 위한 재도전 한마당을 개최했다고 16일 밝혔다.... 정책금융기관이 보유한 부실채권 정리를 통해 실패기업인의 채무부담을 완화하고, 기업의 폐업 시 세무절차..."
142,2018.06.15.,[이슈 비틀기] 자영업의 위기가 오롯이 최저임금만의 문제일까,"임대료의 경우, 한 단위 상승에 폐업 위험도는 1.5% 정도 증대되는 것으로 나타났다. 서울지역의 소규모... 자영업 창업에 상당한 초기 투자비용이 투입되기 때문이다. 한국은행 경제연구원에 따르면 대출이자율이 0.1..."
143,2018.06.08.,"[6.13인터뷰-서대문]이은석 ""전시행정 벗어나 관광특구 조성할 것""",[편집자주] 6·13지방선거 열기 속에 서울 구청장 후보들의 경쟁도 치열하다. 뉴스1은 서울 25개 구 구청장... 청년창업을 돕는 '꿈꾸는 청년가게'가 폐업한 뒤 폐허가 된 모습으로 이미 언론에 보도됐다. 지금 구에서...
144,2018.06.18.,재기 지원 정책이 최고의 창업정책,"홍종학 중소벤처기업부 장관은 6월 15일(금) 서울창업허브에서 개최된 '재도전 한마당' 행사에서 ""최고의... ""고 말하면서, ""정책금융기관이 보유한 부실채권 정리를 통해 실패기업인의 채무부담을 완화하고, 기업의 폐업 시..."
145,2018.06.17.,"""실패해도 괜찮아""… 중기부, 재창업 기업 돕는다","홍종학 중소벤처기업부 장관은 지난 15일 서울창업허브에서 열린 '재도전 한마당'에서 ""최고의 창업정책은... 그는 ""정책금융기관이 보유한 부실채권 정리를 통해 실패기업인의 채무부담을 완화하고, 기업의 폐업 시..."
146,2018.06.10.,[김세구의 포토다이어리] 오늘의 컷,[연합뉴스] ▶유세 지켜보는 시민 서울 잠실새내역 사거리에서 한 정당의 합동유세가 열린 10일 선글라스를... 심지어는 폐업률이 창업률을 앞지르는 현상까지 나타나고 있다.   [사진=센토사 공식 페이스북 캡처]...
147,2018.06.10.,"임대윤 대구시장 후보, 자영업자·소상공인 6대 공약 발표",정책으로는 ▲자영업자 폐업 시 소득 중단에 대응한 ‘대구형 자영업자실직안전망’ 추진 ▲피고용자처럼 자영업자와 특수직에도 ‘대구형 유급병가’ 도입 ▲자영업자의 창업부터 실패 가능성을 줄일 수 있도록...
148,2018.06.13.,[6.13 선택] '어차피 시장은 박원순' vs '박원순 7년 끝내야',"김 후보는 최근 TV토론회에서 ""박원순 시장의 7년 동안 7대 적폐가 쌓였다""며 실업률 상승·자영업 폐업률... 안 후보는 과거 벤처사업가 출신인 점을 내세워 서울을 창업도시로 바꾼다는 구상을 제1공약으로 내놨다...."
149,2018.06.13.,울산지역 주택시장 침체…부동산 중개업소 '한숨',"휴·폐업 등으로 타개책을 모색하고 있지만, 매년 공인중개사 자격증을 취득한 여성과 퇴직자 등의 창업... 지역별로는 연간 중개건수는 인천 12.3건, 부산 10.6건, 광주와 대전 각 10.0건, 대구 9.7건, 서울 7.9건, 울산..."
150,2018.06.18.,"[사설] 백년기업 지원, 자영업 과잉 문제도 살펴야",[서울경제] 정부가 자영업자 지원책을 또 내놓았다. 이번에는 100년 이상 존속·성장할 ‘백년가게’를... 매년 소상공인 지원에 조(兆) 단위의 예산이 투입되는데도 여전히 창업과 폐업을 되풀이하고 있다. 새 정부에서도...
151,2018.06.14.,[성태윤의 경제 인사이트] 자영업발 위기를 경계하라,[서울신문] ‘리먼 브러더스’ 파산과 함께 미국 금융시장을 흔들며 세계를 충격에 빠뜨렸던 글로벌... 그러나 다른 업종으로 창업할 기회를 얻거나 괜찮은 기업에 취업해 일자리를 구하며 이동하는 것이 아니고 폐업으로...
152,2018.06.15.,"""실패해도 괜챦아""…정부 차원의 실패 극복 캠페인","20대에 인테리어 역경매 서비스 '하우스 아이'를 창업했으나, 이내 폐업하고, 30대 초에 건설 시행사 설립해... 실패를 거듭하며 재창업에 성공한 이들 세 기업인이 15일 서울창업허브에서 열린 「재도전 한마당」..."
153,2018.06.13.,네이버 쇼핑몰의 7가지 성공 법칙,플랫폼의 창업 성장 현황을 분석한 ‘D-커머스 리포트’를 12일 발표했다.   해당 리포트는 20만개로... 넘어야=서울대학교 경영학과 유병준 교수 연구팀에 따르면 최고 월 거래액이 200만원 미만인 판매자의 이탈율(폐업...
154,2018.06.07.,성공창업을 위한 자금 운영방법은 어떻게,"소상공인상권분석시스템을 살펴보면, 지난해 전국 폐업률(2.5%)이 창업률(2.1%)을 앞질렀다. 더불어... 2시 서울창업허브 대강당(서울 마포구 공덕역 소재)에서 진행된다. 참가방법 및 자세한 사항은 창업경영신문 홈페이지를..."
155,2018.06.10.,"최저임금 날벼락 '홀로' 맞은 자영업자들의 절규 ""폐업하는 것 보면 모르나""",경영난으로 폐업하는 사업체들이 늘고 있다. 이로 인해 본인 의사와 무관하게 직장을 잃거나 옮기는... 퇴직자들의 창업 1순위 중 하나인 편의점도 대폭 늘어난 인건비 부담으로 폐점 쓰나미를 겪고 있다. 국내 편의점...
156,2018.06.10.,자영업자 수익 증가율 6년 만에 최저,폐업률이 창업률을 앞지르는 등 자영업 위기가 심화했다. 서울 종로구의 한 잡화매장이 10일 폐업처분 할인행사를 하고 있다. 연합뉴스 [한경닷컴 바로가기] [글방] [모바일한경 구독신청] ⓒ 한국경제 &amp; hankyung.com...
157,2018.06.10.,"임대윤 민주당 대구시장 후보 ""자영업자 유급 병가 도입""","자영업자가 폐업할 때 소득 중단에 대응한 ‘대구형 자영업자 실직 안전망’ 추진을 비롯해 자영업자와 특수직에 ‘대구형 유급 병가’ 도입, 자영업자의 창업부터 실패 가능성을 줄이는 지원책 마련, ‘서울 페이’를..."
158,2018.06.02.,먹을수록 빠져드는 깊고 슴슴한 이 맛,"우래옥은 서울에서 가장 오래된 평양냉면집이다. 평양 유명 냉면가게인 명월관 주인이 개업해 3대째 명맥을 잇고 있다. 을지로 본점은 창업주 고(故) 장원일 씨의 손녀 경선 씨(66)가, 대치동 분점은 손주 근한 씨(64)가..."
159,2018.06.09.,"“요즘 뜨는 소자본 창업아이템” 딜라이트 보청기, 6회 창업설명회 개최","[서울경제] 의학 기술의 발달로 기대수명이 점차 늘어나면서 먼 미래의 얘기일 것만 같았던 ‘100세 시대’... 통계청의 발표로는 1년 새 폐업한 자영업자가 10만 명에 이를 정도다. 그만큼 창업은 신중하게, 특히 아이템..."
160,2018.06.04.,朴 스마트시티·金 교통혁명·安 창업도시… 재원·실현성 의문,"세 번째 핵심 공약은 자영업자 폐업 시 소득 중단에 대응해 ‘서울형 자영업자실직안전망’을 추진하는 등의... 바른미래당 안 후보는 공동창업캠퍼스 구축, 도시문제 해결을 위한 서울벤처 육성 등의 ‘일자리 넘치는..."
161,2018.06.04.,사상 최악 자영업자는 최저임금 영향 없습니까,"창업이 둔화했고 최저임금 인상 영향으로 임시 일용 근로자 고용이 원활하지 못했기 때문으로 풀이된다. 특히 도ㆍ소매업(8만6000명), 숙박ㆍ음식점업(3만6000명)의 고용 감소 폭이 컸다는 점이 이를 보여준다. 폐업, 불황..."
162,2018.06.10.,"‘6.13지방선거’ 박원순 김문수 안철수, 누가 중소기업인 마음 읽었나",구체적인 창업 지원책 등을 내세워 자리를 고수하겠다는 방안이다. 10일 업계 및 정치권 등에 따르면... 이와 함께 “폐업자의 회생을 돕는 ‘서울형 자영업자실직안정망’도 구축하겠다”고 박 후보는 공언한 상태다....
163,2018.06.11.,"변호·변리·회계·세무사회, 경쟁적 무료 컨설팅… 중기부·국세청 제휴 활발","11일 중기부에 따르면 서울지방변호사회, 대한변리사회와 ‘중소기업 기술보호 법무지원단‘ 운영을 위한... 또한 창업자·폐업자 멘토링, 현장상담실 운영을 통한 찾아가는 서비스 등 사업주기별 맞춤형 서비스를..."
164,2018.06.11.,공공의료기관 유치ㆍ수상레저 관광거점 조성ㆍ수중보 수면 관광자원 활용,"인구유출 방지를 위해 일자리창출(청년·노인·여성·장애인)확대, 청년 창업보육센터 및 장애인 보호작업장... 서울병원 폐업으로 응급의료체계가 붕괴되며, 제천·원주로 후송되는 시간동안 환자들의 상태완화 또는..."
165,2018.06.05.,"[임금정책 패싱]""최저임금 인상 최대 피해자인데""...자영업자의 분노","자영업자들의 분노 ""인건비 폭탄에 폐업"" 퇴직자 창업 1순위 편의점도 '폐점 쓰나미' 엉터리 통계에 뿔났다... 그러나 서민이 체감하는 현실이 '상식'이고, 우리가 힘들다고 하면 힘든 것 아닙니까?"" 서울 영등포구에서..."
166,2018.06.14.,전통시장 활성화 ‘스모킹건’은 청년창업이다,"요식업, 공예, 체험공방 등에 편중된 창업아이템은 시작부터 시한부 폐업시계를 달고 전입하는 악순환을... 서울 신설동 서울풍물시장에 라온미나 대표인 임하나 CEO의 이야기를 들어보면 청년들이 전통시장에 창업을 하기..."
167,2018.06.14.,"요즘 뜨는 프렌차이즈 ‘일미리 금계찜닭’, 차별화된 아이템으로 업종 변경 ...",소상공인시장진흥공단이 조사한 2017년 하반기 서울지역 소상공인의 월평균 창업률과 폐업률이다. 임대료와 인건비 인상으로 인한 매장 운영을 감당하기 힘들어 문을 닫는 자영업자들이 늘고 있다는 것이다. 이는 거리를...
168,2018.06.01.,"국세청, 영세납세자지원단 나눔세무사ㆍ회계사 1704명 위촉","자료/국세청 [서울=경기일보/백상일 기자] 지식 재능기부를 통해 세정지원 활동에 참여할 제8기... 무료세무자문, 창업자ㆍ폐업자 멘토링, 현장상담실 운영을 통한 찾아가는 서비스 등 사업주기별 맞춤형 서비스를..."
169,2018.06.06.,"이윤재 희망재단 이사장 ""데스밸리 건너는 성장 사다리 되겠다""","© News1 성동훈 기자 (서울=뉴스1) 대담=서명훈 부장 = ""중소상공인들은 창업 3년 후 절반 이상 죽음의 계곡을 넘지 못해 폐업하는 실정입니다. 우리 재단은 데스밸리를 건너는 중소상공인들에게 일종의 성장 사다리가 되고..."
170,2018.06.12.,"(우리동네 ‘핫’공약-⑪중구)""강북투자권 집중 유치, 7대권역 특화발전""","4% 줄어 서울에서 가장 소비 하락폭이 큰 권역으로 조사됐다.   장기침체로 인쇄업체 등 폐업 속출   지역의... 서울시 프로젝트를 확대하고, 청년창업공간과 중장년창업공간을 추가하는 내용이다.   서 후보 관계자는..."
171,2018.06.14.,"[제8회 대한민국 강소기업포럼] ""실패 통해 배운 노하우도 자산.. 재도전 기업...","14일 서울 여의도 콘래드호텔에서 개최된 '제8회 대한민국 강소기업 포럼'에 참가한 귀빈들이 기념촬영을... 김 사장은 ""소상공인과 자영업자의 경우 창업 후 1년 이내 폐업 비율이 31%이고 3년 이내 폐업 비율은 61%, 5년..."
172,2018.06.07.,"자유한국당 강원도당, ""이번 선거는 무능과 유능의 대결…도민 곁에서 충실히...","제가 한 가지 통계사례를 말씀드리면 지난해 하반기 서울지역 소상공인 창업률 조사 결과, 창업률이 월평균 2.4%이고 폐업률은 4.3%라고 합니다. 새로 생기는 가게보다 문 닫는 가게가 더 많다는 겁니다. 일부 세무서에는..."
173,2018.06.05.,"[생존 절벽 자영업②]최저임금發 패닉…1분기 음식업 폭망, 실업자 속출","[ 서울 중구 다동의 한 골목에서 비빔밥집을 운영하는 사장 박모씨(43)는 ""올해 초 최저임금이... 최저임금 인상 영향으로 임시 일용 근로자 고용이 원활하지 못한데다 청년층 창업이 둔화한 것이 원인으로 풀이된다..."
174,2018.06.06.,[가상화폐 시장 진단-③] ‘가상화폐’ 개념 정의는 언제쯤…7월 윤곽 잡힐까,그러나 다음날인 31일 최종구 금융위원회 위원장은 '은행권 청년창업재단 출범 6주년 행사'에 참석해... 지난 2월에는 정태옥 자유한국당 의원이 ‘가상화폐업에 관한 특별법’을 발의하고 가상화폐를 불특정 다수인 간에...
175,2018.06.07.,"한국당 ""330만 당원 사전투표 총동원""","홍 본부장은 “문재인정부는 지난 1년 경제가 파탄 수준에 이르렀고, 실업률과 공장 폐업률이 최악... 정론관에서 서울시내 52개 대학 주변을 4차 산업혁명 특구로 조성해 청년들이 자유롭게 연구와 창업을 할 수 있는..."
176,2018.06.09.,"[6.13 지방선거 현장] 안철수 ""박원순, 4년 더 하면 안 돼…허송세월할 순 없...",그는 “지난 7년간 서울이 자꾸 뒷걸음질 치는 것이 너무 안타깝다”며 “일자리·실업률·폐업률이 모두... 이어 그는 “의사·IT 전문가·벤처창업자·대학교수로서 서울을 바꾸기 위해 나왔다”며 “서울개벽...
177,2018.06.09.,“살아 있는 우리 삶의 비늘들이 다 문화재”,"업종의 폐업률은 2.5%로 창업률(2.1%)을 앞지른 것으로 나타났다. 새로 생겨나는 업소보다 사라지는 가게가 더... 1939년에 창업한 서울 하동관은 지금도 점심시간마다 직장인들이 줄을 서지만, 하루 단 500그릇만 팔고 문을..."
178,2018.06.04.,[주간보도계획]6월 4일~6월 8일,"실시 △교육부, 창업경진대회 '창업유망팀 300' 열려 ◇5일(화) △기재부, 제4차 국가경쟁력정책협의회 개최... 퇴직·폐업·육아휴직자 학자금대출 상환유예 기준 등 마련 ◇7일(목) △기재부, 제17차 한-러시아..."
179,2018.06.01.,"[이사람] 장윤영 ""교수직 버리고 뛰어든 사회적기업···일자리 빵빵하게 불...",[서울경제] “‘떡갈비빵’은 안 먹어봤죠? 잡내를 잡기 위해 약간 매울 수도 있어요. ‘비빔빵’도 좀 맵죠?... 지난 2015년 때마침 영업악화로 폐업 직전까지 몰렸던 천년누리를 운영하던 후배들이 장 대표에게 도움을...
180,2018.06.11.,[사설] 자영업자들의 한숨소리 들리지 않는가,대표적 자영업종인 음식업은 지난해 하반기 폐업률이 3.1%로 창업률(2.8%)보다 훨씬 높았다. 자영업이 심각한... 서울 서촌의 한 족발집 주인이 건물주를 둔기로 폭행한 며칠 전의 사건도 임대료를 한꺼번에 대폭 올린 게...
181,2018.06.12.,소자본창업도 차별화가 필요하다! 아이스크림 할인점에 세계맥주를 더한 '굿샵...,"[사진='굿샵' 제공] [사진='굿샵' 제공] [서울와이어 이명철 기자] 창업 시장에 불어온 소자본창업 열풍 속에... 하루 평균 3,000명이 창업하고 2,000명이 폐업한다는 국세청의 통계가 자영업자는들의 현실을 여과 없이..."
182,2018.06.11.,"'그냥 쉬는' 사람들, 200만명 육박","#서울신문(사설/'그냥 쉰다' 200만명 시대에 50ㆍ60대가 124만명)은 ""고용노동부가 어제 발표한 '5월 노동시장... 지난해에는 창업률보다 폐업률이 더 높게 나타났다. 50대 이상의 상당수가 수입과 일자리 부족에 시달리다가..."
183,2018.06.12.,광주 新 상권 현장을 가다 동구 동명동- 카페·맛집거리로… 인스타 감성 입은...,"서울의 가로수길, 경리단길 등에 위치한 음식점과 카페는 사진이 예쁘고 느낌 있게 나와 유명세를 타며... 올해 창업률과 폐업률의 차이가 큰 업종(창업률-폐업률)은 음식배달 서비스(10.3%), 양식(3.0%), 제과제빵떡케익..."
184,2018.06.08.,소액창업아이템 아이스크림 할인점 여름시즌 인기아이템으로 급부상,"(서울=국제뉴스) 송미숙 기자 = 소액 창업 아이템에 대한 높은 관심 속에서, 아이스크림 할인점 창업이... THE달달은 업계최다 매장인 130여개 가맹점을 오픈하면서 업계 유일 폐업률 0%달성했다. 업계 1위 자리에 있는..."
185,2018.06.11.,[사설] ‘그냥 쉰다’ 200만명 시대에 50ㆍ60대가 124만명,[서울신문] 근로 능력이 있으면서도 별다른 이유 없이 일을 하지 않는 50ㆍ60대가 늘고 있다. 최근 통계청에... 지난해에는 창업률보다 폐업률이 더 높게 나타났다. 이에 따라 50대 이상의 상당수가 수입과 일자리 부족에...
186,2018.06.08.,"[쓰다, 창업기 39] 양치승 바디스페이스 관장이 그리는 ‘운동 철학’",요새 운동할 시간도 잘 없다는 양 관장을 지난 7일 서울 강남구 논현동 바디스페이스 본점에서 만났다.... 헬스장을 전전하던 양 관장은 두 번째 창업을 결정했다. 그는 곧 폐업을 앞둔 헬스장을 인수했다. 헬스장에서...
187,2018.06.02.,The clock is ticking (KOR),"기사는 전국적으로 창업보다 폐업하는 소상공인들이 많으며, 그중에서도 서울 강남지역에서 이런 현상이 더 심각하다는 내용이었다. 또 설문조사를 통해 소상공인들은..."
188,2018.06.01.,박성효 대전시장후보 10공약 발표,"유성 역시 관광특구가 몰락하며 호텔 폐업이 잇따르는 등 쇠락의 길을 걷고 있습니다. 저는... 청년창업지원시스템도 미흡한 편이고, 정부·대전시의 청년정책은 현장에서 괴리감이 발생하고 있습니다. 이에 저는 우선..."
189,2018.06.07.,벼랑 끝 내몰린 소상공인… 협동조합 만들어 경쟁력 높여야,"지역 내 소상공인들의 창업·폐업 및 경영안정 지원, 교육 및 기술개발 등을 돕기 위해 센터가 세워졌지만 지원 예산이 없어 단순 상담에 그치고 있는 것이 현실이다. 센터 관계자는 ""서울은 올해 68억 원, 경기도는 130억..."
190,2018.06.05.,"분식창업 '얌샘김밥', 성공이유 살펴보니… 운영 효율 높이고 인건비 절감시켜",인해 창업과 폐업의 악순환이 이어지는 사례도 많아 신중할 것이 당부된다. 현재 국내 창업시장 1순위는... 관심과 창업문의를 소화하기 위해 오는 6월 7일~9일까지 학여울역 세텍에서 개최되는 '제 17회 서울 프랜차이즈...
191,2018.06.12.,"[창업! 칼럼] 간판만 바꿔 단다고 '업종변경?', 두 번 망하실래요?",서울와이어] 사람이 죽음을 앞두고 겪는 심리의 단계는 부인→분노→타협→우울→수용이다. 비단 죽음 뿐 만 아니라 삶의 곳곳에서 죽음과 같은 느낌을 자아내는 상황을 우리는 맞닥뜨리게 된다. 장사를 하는 사람이 폐업...
192,2018.06.01.,개인사업자에서 법인으로 전환했더니 대표님이 죽어버렸다?!,"개인 사업자를 자랑스럽게 폐업하고 법인사업자 등록증을 발부받아, 다시 한번 피칭에 성공해 시드머니를 투자받은 신 씨. “제2의 창업”을 메신저 상태 메시지로 걸어 놓은 신 씨! 공격적으로 거래처·협력업체를 확장한..."
193,2018.06.09.,"홍준표 공동선거대책위원장, '가자! 부산지키러' 총력 유세 주요내용[보도자료...","중소기업은 전부 베트남으로 탈출하든가 아니면 폐업준비를 하고 있다. 서울 강남에 가장 부자가 산다는... 그리고 창업 생태계를 만들어서 우리 젊은이들이, 그들이 가지고 있는 아이디어를 십분 발휘해서 창업을 할 수..."
194,2018.06.02.,신용한 충북지사 후보와 육거리시장 상가방문 및 유세 주요 내용,"바른미래당 중앙선대위원장 겸 안철수 서울시장후보 선거대책위원장 손학규다. 오랜만에 뵙는다. 여러분.... 육거리시장 상인 여러분, 저는 정부 청와대에서 청년 취업,창업,일자리를 담당했다. 소상공인 여러분들과 함께..."
195,2018.06.01.,[최저임금 긍정효과 90%] 대통령 경제인식 급변까닭?,특히 서울 강남의 경우 폐업이 창업보다 3배나 많다고 보도됐다. 신문은 이를 '길거리 경제'의 신음소리라고 규정하며 최저임금 인상으로 고용감소 영향이 없다는 청와대 측 논리를 비판한 것이다. 문 대통령이 최저임금...
196,2018.06.11.,[브릿지 인터뷰] 박원순 “자영업자 위한 서울 만들겠다” 약속,"둘째, 폐업자의 회생을 돕는 ‘서울형 자영업자실직안전망’ 구축하겠다. 자영업자들의 평균생존율은 20... 자영업자의 창업부터 실패 가능성을 줄일 수 있도록 빅데이터를 이용해 컨설팅과 기술자문을 지원하겠다. 셋째..."
197,2018.06.15.,"'골목식당' 백종원 ""배윤경·테이? 연예인 식당도 준비 안되면 폐업""",앞서 진행된 '골목식당' 촬영에서 두 사람은 서울시 성동구 성수동 뚝섬 골목에 본인들의 이름 앞 글자를... 실제로도 햄버거 가게 창업에 관심이 많았던 테이는 유독 '골목식당'에 엄청난 열정을 내비쳤다. 가게 오픈에...
198,2018.06.19.,"[자영업자의 눈물①]한국 경제의 지주, 자영어자가 흔들리는 이유",출처= 통계청 [이코노믹리뷰=견다희 기자] #입시학원과 고시학원이 밀집한 서울 노량진에서 6년째 식당을... 이렇다 보니 폐업률이 창업률을 앞지르는 현상까지 나타나고 있다. 상가정보연구소가 소상공인시장진흥공단...
