,date,title,contents
0,2018.05.31.,6·13 공식 선거전 막 올라…3파전 서울시장 필승전략은,"자영업자의 카드 수수료 부담을 줄이기 위해 '서울페이'를 도입하고, 폐업 때 소득 중단에 대응한 '서울형... 넘치는 창업 도시를 만든다는 계획이다. 첫 3자 구도…야권 단일화는 이번 서울시장 선거는 1995년 제1회..."
1,2018.05.31.,"[팩트체크] 안철수 “실업률 IMF 이래 최악, 서울이 전국 꼴찌?”","다만 모든 업종의 창업과 폐업을 집계하는 것은 현실적으로 불가능하고, 서울시에서 제공하는 상권분석데이터와의 수치 차이는 0.5%포인트가량 차이가 난다. 따라서 안 후보의 폐업률 발언은 절반의 사실이라고..."
2,2018.05.31.,"[6·13 지방선거- 에너지 공약] ①서울시 박원순·김문수·안철수 ""미세먼지 ...","테스트베드와 창업벤처 단지 조성과 자치구별 캠퍼스타운 25곳에 민간투자와 국내외 대기업 R&amp;D센터를 유치... 자영업자의 카드 수수료 부담을 줄이기 위해 ‘서울페이’를 도입하고, 폐업 때 소득 중단에 대응한..."
3,2018.05.24.,"서울시-서울산업진흥원, 외국인 무역기업의 지속적인 성장을 위한 동반자가 되...",큰 창업자들의 상당수가 비자연장의 벽을 넘지 못하고 폐업을 하는 경우가 발생했다. SBA는 외국인... 서울글로벌센터가 무역업 초기 창업자들의 실무역량 강화를 위해 운영하고 있는 ‘외국인 무역아카데미...
4,2018.05.22.,[서울시장후보 연쇄 인터뷰] 안철수 바른미래당 후보,"도시가 활력을 갖기 위해선 창업기업이 폐업기업보다 많아야 하는데, 서울에선 소상공인 하나가 창업할 때 두 개가 문을 닫는 셈이었죠. 심각한 문제죠.”  박원순 후보의 정책이 잘못됐다고 보는 건가요.  “다른 지자체..."
5,2018.05.16.,[Who Is ?] 박원순 서울시장,"청년 창업사와 제조사 입주 공간, 시민문화공간 등으로 새롭게 탄생한다. 2017년 2월 비정규직과 영세사업장... 책임지는 서울 △폐업, 실직, 빈곤의 두려움 없는 서울 △청년의 꿈을 이루는 서울 △고르게 발전하는..."
6,2018.05.20.,"박원순 '서울 10년 혁명' 66개 공약 발표… ""자영업자 카드수수료 제로 수준으...","박 후보는 20일 ‘내 삶을 바꾸는 서울의 10년 혁명’을 주제로 자영업자 지원과 가족 돌봄, 청년 창업·취업... 박 후보는 또 자영업 폐업 시 실업급여를 받을 수 있도록 중앙정부와 함께 고용보험료의 50%를 지원하기로..."
7,2018.05.17.,"'서울 쟁탈전' 박원순·김문수·안철수, 3인 3색 공약 뜯어보니","책임지는 서울 ▲폐업, 실직, 빈곤의 두려움 없는 서울 ▲청년의 꿈을 이루는 서울 ▲고르게 발전하는 서울... 서울을 바꾸는 데 쏟아 붓겠다고 강조했다. 그러면서 ▲미래 인재 키우는 교육 도시 ▲일자리 넘치는 창업..."
8,2018.05.15.,"박원순 ""서울 구청장 전승"" vs 안철수 ""놀라운 정책으로 뒤집기""","그는 ""지난 7년간 박 시장의 시정을 보면 달라진 것이 없다는 게 서울시민 대다수의 평가""라며 ""실업률은 전국 최하위고, 소상공인 가게 1개가 창업할 때 2개가 폐업을 하고 있어서 서울 상황이 지금..."
9,2018.05.07.,국내외 예비 창업자…서울시가 도와드립니다,"서울시는 다양한 지원사업을 통해 국내외 예비창업자들의 안정적인 토대를 마련할 계획입니다. [기자] 지난해 하반기 전국 여가·오락시설, 음식 등 8대 업종의 자영업자 폐업률은 2.5%. 이는 2.1%인 전체 창업률을..."
10,2018.05.24.,"서울시, 협동조합형 ‘소셜프랜차이즈’ 도입…실효성은?","/ 연합뉴스 [메트로신문 | 유재희 기자] 프랜차이즈업계의 갑질 논란이 연일 물의를 빚고 있는 가운데 서울시... 세종사이버대 외식창업프랜차이즈학과 어윤선 교수는 ""지나친 개입은 산업을 위축시킬 수 있다고 생각된다...."
11,2018.05.31.,‘토종’ 카페베네 가까스로 회생 인가 최종 결정…다음 행보는,‘사업자 폐업’ 위기에 몰렸던 커피프랜차이즈전문점인 카페베네가 30일 서울회생법원 회생13부로부터... 제2의 창업을 한다는 각오로 가맹점 매출 증대에 마케팅 역량 등을 집중하겠다”라고 밝혔다. 한편 카페베네는...
12,2018.05.31.,"[창업 브랜드 리포터] 코코이찌방야,10년 연속 매출상승 비결","◆매장에 따라서는 오픈 당시보다 20~50%까지 매출 상승 서울 합정동에 있는 메세나폴리스점 역시 89.1m2(27평)... 창업 1년후 폐업률이 25% 이상, 2년후에는 50%, 3년후에는 80~86%가 폐업하는 게 현실이다. 이렇게 수명이 짧다..."
13,2018.05.29.,울산 동구·거제·목포 등 5곳 '산업위기지역' 지정,김동연 부총리 겸 기획재정부 장관은 29일 정부서울청사에서 산업경쟁력강화 관계장관회의를 열어 이 같은... 해당하는 창업기업에 5년간 법인·소득세 면제 △신산업 기반 및 지역 인프라 조기 구축 등의 혜택을 집중...
14,2018.05.30.,[경제이슈] '폐업·빚'… 위기의 소상공인,"바로 작년 하반기, 서울 지역 소상공인의 창업률과 폐업률입니다. 그러니까 길거리에 점포가 100개 있다면 이 중에 방금 문 연 곳은 2개, 장사가 안돼 문 닫는 곳은 4개란 이야기입니다. 폐업이 창업보다 두 배 가까이..."
15,2018.05.30.,‘자영업자 무덤’ 서초구…“폐업하려 번호표 대기”,"서울시내 100개 점포 가운데 매달 새로 문을 여는 곳은 2.4곳. 문을 닫는 점포는 훨씬 많은 4.3곳으로 조사됐습니다. 특히, 소득 수준이 상대적으로 높은 서초구는 폐업률이 창업률의 3배에 달합니다. 폐업이 잇따르고..."
16,2018.05.31.,"박성효 후보, 6.13 지방선거 10大공약 발표","유성 역시 관광특구가 몰락하며 호텔 폐업이 잇따르는 등 쇠락의 길을 걷고 있습니다. 저는... 청년창업지원시스템도 미흡한 편이고, 정부ㆍ대전시의 청년정책은 현장에서 괴리감이 발생하고 있습니다. 이에 저는 우선..."
17,2018.05.31.,‘카페일리터‘ 커피배달 프랜차이즈 소자본창업으로 인기,"(서울=국제뉴스) 김영명 기자 = 작년 기준 전국 9만 여점의 카페가 개점하며, 카페창업이 포화상태에... 하지만 커피전문점을 창업하더라도 경영에 어려움이 많아 얼마 안되어 폐업하는 곳들이 너무나 많다. 차별화된..."
18,2018.05.31.,'강남불패'도 옛말…서초·신사동 약국들 폐업 속출,"실제 소상공인시장진흥공단이 조사한 지난해 하반기 서울지역 소상공인의 월 평균 창업률과 폐업률을 보면 서초구의 경우 창업률이 1.9%인데, 폐업률은 3배에 가까운 5.5%로 나타났다. 강남구 역시 창업률은 2%에 그친 반면..."
19,2018.05.27.,1리터짜리 부대커피 '군바리스타'를 아시나요,뉴스카페 [ 김기만 기자 ] 통계청에 따르면 창업한 지 3년 안에 폐업하는 자영업자가 61.2%에 달한다. 그래도... ‘군바리스타’는 서울 용산에 본점이 있는 커피전문점이다. ‘태양의 후예’라는 드라마가 인기를 끌던...
20,2018.05.30.,전통시장 청년몰 사업 지지부진…4곳 중 1곳 휴·폐업,창업 현황' 자료에 따르면 지난 2016년 이 사업에 선정돼 개점한 22개 시장 209개 점포 중 24%인 65개가 3월 기준으로 휴업 또는 폐업을 했다. 휴·폐업한 점포 대부분은 지원 기간인 2년이 끝나자 문을 닫았다. 특히 서울...
21,2018.05.31.,여성 전용 쉐어하우스 어떻게 선택해야 할까?,서울 시내 한적한 주택가에 여자 혼자 산다는 것. 갈수록 수위가 높아지는 여성 타깃의 강력 범죄 뉴스를... 인도네시아에서 성업 중인 ‘고젝 샤리’는 창업자의 친언니가 대중교통을 이용하다 성추행을 당한 이후 이런...
22,2018.05.23.,"중소상공인희망재단, 지원공간 '점프업 허브' 구축(종합)","희망재단은 23일 서울 여의도 인근에서 기자간담회를 열고 ""올해 3월 매입한 지상 6층, 지하 2층의 구로구... 이윤재 신임 이사장은 ""국내 창업기업의 절반 이상은 창업 후 3년 전후로 폐업하고, 70%가 5년 이내 2차..."
23,2018.05.30.,"[폐업119] 준비된 폐업, 새로운 출발의 시작입니다","지난달 매경폐업지원희망센터(폐업119 대표 고경수)에서 컨설팅을 받은 서울시 소재의 박 모씨 역시 마찬가지였다. 프랜차이즈 가맹본부에서의 오랜 직무경험을 바탕으로 큰 기대를 갖고 커피숍 창업을 진행했고, 사업..."
24,2018.05.23.,전통시장 청년몰 사업 지지부진…4곳 중 1곳 휴·폐업,청년몰 창업 현황' 자료에 따르면 2016년 이 사업에 선정돼 개점한 22개 시장 209개 점포 중 24%인 65개가 3월 기준으로 휴업 또는 폐업했다. 휴·폐업한 점포 대부분은 지원 기간인 2년이 끝나자 문을 닫았다. 특히 서울...
25,2018.05.29.,[산업위기지역 5곳 추가지정]실업률 되레 오르는데...또 반짝 진통제 처방만,"[서울경제] 정부가 또 다시 경기침체 지역에 세제혜택과 재취업 지원 혜택 등을 부여하는 ‘진통제 처방’... 특별지역으로 지정되면 지역 내 창업 기업과 근로자의 법인세·소득세 100% 감면, 재직 근로자 능력 개발, 실직..."
26,2018.05.30.,"(피플)전현배 교수 ""서비스는 진입·퇴출하며 크는 산업…제조업과 달라""","전현배 서강대학교 경제학과 교수가 지난 28일 서울 마포구 서강대에서 &lt;뉴스토마토&gt;와의 인터뷰를 갖고... 과거 2011~2015년 사업체의 창·폐업 자료를 봤을 때 최저임금 인상은 영세 자영업자의 폐업을 늘리고, 창업도..."
27,2018.05.27.,"‘그것이 알고싶다’ 故 염호석 시신탈취, 삼성의 분노유발 첩보전(종합)",부산에서 빈소가 차려진 서울까지 택시를 타고 간 어머니는 아들을 확인한 후 전남편과 마주치는게 불편해... 노조 가입자가 많은 센터가 폐업하는 상황도 생겼다. 노조를 와해하기 위해 기획된 치밀한 작전이라는 의심이...
28,2018.05.26.,[카드뉴스] 청년상인 육성 '청년몰' 4곳 중 1곳 휴·폐업,자료 / 중소벤처기업부 2016년에 선정된 청년몰 창업지원 현황(2018년 3월 기준) 점포 수 274개 영업중(휴폐업)... 계획과 대안이 필요해 보입니다. (서울=연합뉴스) 이상서 기자·박효연 ▶기사제보 및 문의   ▶사진구매 문의
29,2018.05.28.,[유망업종 창업스쿨] 청소대행업 1위 기업 성공 비결,지난해 말 국세청 통계에 따르면 음식점 폐업 증가로 국내 외식업체수가 전체 사업자에서 차지하는... 조선비즈가 함께 하는 ‘CEO의탄생 유망업종 창업스쿨’은 오는 5월 29일 오후 7시부터 9시까지 서울 신사역 3번...
30,2018.05.23.,[연합뉴스 이 시각 헤드라인] - 08:00,창업 현황' 자료에 따르면 2016년 이 사업에 선정돼 개점한 22개 시장 209개 점포 중 24%인 65개가 3월 기준으로 휴업 또는 폐업했다. 휴·폐업한 점포 대부분은 지원 기간인 2년이 끝나자 문을 닫았다. 특히 서울...
31,2018.05.27.,정부부처 주간일정 및 보도계획(28~6월1일),"보건의료빅테이터 창업성공의 길을 열다(오전) 29일(화) △박능후 복지부 장관, 국무회의(오전10시, 서울청... 피해보전직접지불‧폐업지원 지급품목 확정(오전) △농식품부, ICT 적용 느타리버섯 재배 정밀관리 신기술..."
32,2018.05.24.,지금은 미(美)식 전성시대? '인스타용 맛집 탐방 갑니다',태평양 전쟁 시기에 한 2년 동안 물자가 없어서 식당이 다 폐업을 했었죠. 경성 그러니까 서울의 옛 식민지... 왜냐하면 청년창업이라는 말은 청년이 창업해서 무슨 로봇공학이나 무슨 기계공학 할 것 같지만 실제 할 게...
33,2018.05.28.,[지상중계] '청년들이 꿈꾸는 농업의 미래-청년농부 육성방안' 좌담회,폐업으로 버려지는 시설을 활용해 창업농에게 비용을 줄여주는 것이다. △이소희 부회장=농장을 방문하는... △김의성 회장=서울시는 청년들을 지방으로 내려 보내고자 힘쓰고 있는 반면 농촌은 소멸의 위기를 겪고 있다....
34,2018.05.24.,[경제이슈] 프랜차이즈 치킨집 사장의 '눈물',"2,700개가 폐업하고, 동시에 3,900개가 개업하는 식의, 그야말로 레드오션의 극치를 보이고 있습니다. 실패할 걸, 힘들 걸 알지만 어떻게 해서든 입에 풀칠하기 위해 창업할 수밖에 없는 현실, 안타깝습니다. 그렇다면..."
35,2018.05.28.,[유망중소기업-㈜피플카] 밀착형 車 공유 서비스 전문기업,"그 결과 지난해 27개 도시에 진출했고 특히 서울에도 입성했습니다. 전국 렌터카 사장님들과 사업을 공유한... ""피플카를 창업하기 전에 사업을 하고 있었어요. 당시 회사가 폐업의 위기에 직면할 정도로 사정이 어려웠던..."
36,2018.05.29.,"만화카페 프랜차이즈 콩툰, 진입장벽 낮춰 업종변경창업 인기",콩툰 [서울와이어 정시환 기자] 이미 포화를 이루었고 수시로 변화하는 창업시장에서 살아남기란 쉽지... 이러한 현상 때문에 많은 창업자들은 폐업이나 업종변경창업을 선택하고 있다. 최근 업종변경창업자들에게 많은...
37,2018.05.29.,"비용과 시간 줄인 네일아트 인기 프랜차이즈 창업, 업종변경창업으로 눈길",핑거네일투고 [서울와이어 정시환 기자] 자영업자 1000만 시대. 폐업이 속출하는 현 상황에서 업종변경창업을 고려하는 사람들이 전보다 부쩍 늘었다. 이들은 폐업이라는 극단적인 선택보다 업종변경창업을 하는 경우가...
38,2018.05.28.,<금주 주요 일정> (28일~6월 2일),행사(서울) △멜라민 수지 주방용품 안전하게 사용하세요(배포시) 30일(수) ◇과학기술정보통신부 △유영민 장관 15:00 과학 3色 콘서트 △방송통신설비 기술기준 설명회 개최(석간) △실험실 특화형 창업선도대학...
39,2018.05.18.,"""나는 안마사... 영혼도 주무르고 싶다""","""신현희 강남 구청장은 제가 다니던 안마센터를 폐업시켰죠. 2011년 6월 30일이었어요. 그 직장은 내게는..."" 두... 서울 노원복지관의 발 마사지 창업반에서 강의도 했고, 틈틈이 무료 강의도 하면서 4년을 버텼다...."
40,2018.05.27.,[전북일보·전북CBS 공동 주최 6·13 지방선거 장수군수 후보 초청 토론회] 전...,"심지어는 폐업을 할 수밖에 없는 상황으로 내몰리게 되었습니다. "" 이영숙 ""거기 까집니다. 그러면 제가... 그리고 젊은 청년 창업시절에는 광산업부터 시작했습니다. 그래서 지역주민과 서비스, 생산업, 그리고 농업을..."
41,2018.05.24.,"안철수 ""표심단일화로 야권 대표선수 선택해달라""","청년실업률 1등, 자영업자 폐업률 같은 것들은 전국 최악입니다. 미세먼지 대책이라며 버스 지하철... 세계적 플랫폼 기업들의 동아시아 본사가 서울로 몰려들 게 할 것입니다. 우리의 첨단 창업기업과 견실한 중소..."
42,2018.05.28.,[보도자료] 온라인 전자문서 규제혁신,"□ 이낙연 국무총리는 5월 24일(목) 오전, 정부서울청사에서 제39회 국정현안점검조정회의를 주재하고... (6건)  ㅇ 그동안 온라인 사업장에도 오프라인과 동일한 시설ㆍ장비 요건을 적용하여 창업 등에 어려움이..."
43,2018.05.28.,[취재수첩] 지원 끊기자마자 청년상인 절반 떠난 이대상권,김정훈 자유한국당 의원이 중소벤처기업부로부터 받은 ‘청년몰 창업 현황’(3월 기준) 자료에 따르면 2016년 이 사업에 선정돼 개점한 22개 시장 209개 점포 중 65곳(24%)이 휴업 또는 폐업했다. 휴·폐업한 점포 대부분은...
44,2018.05.19.,[쉿! 우리동네] 수원은 어떻게 갈비의 본고장이 됐나,"좋은 서울로 올라온데 힘입어 크게 성장했다. 조선 시대에는 종묘사직이 있는 한양 도성 내에서의 도축이... 갈빗집 창업 배경을 전했다. 화춘옥은 초기 설렁탕, 육개장, 해장국 등을 주메뉴로 하면서 갈비를 선보였는데..."
45,2018.05.15.,‘삼성 노조와해’ 총괄 TF 책임자 구속…윗선 수사 급물살,오후 서울 서대문구 전국금속노조 삼성전자서비스지회 사무실에서 한 조합원이 노조활동과 관련해 문구가... 그는 노조 활동이 활발한 서비스센터 4곳의 대표들에게 위장 폐업을 지시하고 그 대가로 2억여원의 회삿돈을...
46,2018.05.25.,[창간기획]두 남자의 극과극 창업기,"힘들어 폐업했다""고 회고했다. 박 씨는 창업에 실패한 원인으로 자본금과 영업에 대한 자신감을 꼽았다.... 당시 경험을 발판삼아 다시 창업을 준비 중이다. 최근 서울시 소상공인 아카데미에서 지원하는 창업교육을..."
47,2018.05.16.,"안철수 “지하철역·버스정류장, 미세먼지 프리존 만들겠다”",“통계를 보면 전국은 한 곳 창업될 때 한 곳 폐업인데 서울은 한 곳 창업에 두 곳이 폐업되고 있다. 하루에 폐업하는 회사 숫자가 550개에 이른다. 경제문제가 굉장히 심각하다. 미세먼지에 대해 박 시장이 오히려...
48,2018.05.20.,"박원순·김문수·안철수, D-24 격돌…공약 발표·실정 비판",또한 격차 없는 서울을 위해 Δ폐업 때 소득 중단에 대응한 '서울형 자영업자 실직 안전망' 추진... 벤처기업을 창업하고 경영하고 많은 일자리를 창출한 사람이다. 그런 일을 해보지 않은 분이 저한테 하실 말씀은...
49,2018.05.23.,'미군 떠나는' 이태원 스케치,서울 용산구 이태원역 인근 녹사평대로서 20여년 동안 터줏대감 노릇을 하던 한 신발 전문매장이... 지난해 이태원역 인근 상점 폐업률은 창업률을 훨씬 웃돌았다.  소상공인시장진흥공단에 따르면...
50,2018.05.15.,"경남지사 후보 '3김', 경제 등 다양한 정책 쏟아내","김태호 '청년창업육성' ... 김유근 '실버타운 설립' [ ▲  경상남도청 전경. ⓒ 경남도청 경남지사에 도전하는... 했다""며 ""서울시가 개발 중인 서울페이 시스템을 경남에 적용, 수수료 없는 '경남페이' 도입으로 신용카드..."
51,2018.05.24.,전통시장 청년몰 4곳 중 1곳 휴·폐업,"창업 현황’ 자료에 따르면 2016년 이 사업에 선정돼 개점한 22개 시장 209개 점포 중 24%인 65개가 3월 기준으로 휴업 또는 폐업했다. 휴·폐업한 점포 대부분은 지원 기간인 2년이 끝나자 문을 닫았다. 특히, 서울..."
52,2018.05.24.,"이윤재 희망재단 이사장 ""소상공인 성장 허브 역할 하겠다""",""" 23일 서울시 여의도에서 만난 이윤재(사진) 소상공인희망재단 이사장은 희망재단 역할을 '인큐베이팅과... 국내 창업기업의 절반 이상은 창업 후 3년 전후로 소위 '죽음의 계곡'(Death Valley)을 넘지 못해 폐업 하고..."
53,2018.05.23.,"청년몰 창업 2년후, 4곳중 1곳 문 닫아",발표한 '청년몰 창업 현황' 자료에 따르면 2016년 사업에 선정된 전국의 14개 시장 274개 점포 중 65개 점포가 휴·폐업해 3월 말 기준 영업률이 76.3%에 머물렀다. 4곳 중 1곳이 문을 닫은 셈이다. 22개 점포가 입점했던 서울...
54,2018.05.21.,"권영찬, ‘고객 니즈 읽고 소통하고 창업하면 대박나’ 강연서 박수갈채","스타트업 창업을 하신 CEO나 관련 임직원들은 매출을 많이 올려도 걱정, 적게 올려도 걱정이죠. 많이 올리면 계속해서 매출 목표가 오르고 적게 오르면 적은대로 동기부여가 안 되거나 폐업을 걱정해야 되고..."
55,2018.05.18.,“경쟁자? 나 자신”이라는 박원순에 맹공 퍼붓는 김문수·안철수,기업이 창업될 때 두 개가 폐업이 되고 있다”고 박 시장의 일자리 정책을 꼬집었다. 최근 미세먼지 문제가 장기화 되면서 ‘미세먼지 대책’이 서울시장 선거의 주요 쟁점이 될 것 이라는 관측도 잇따르고 있다. 이를...
56,2018.05.20.,소자본 유망 창업 아이템으로 떠오른 ‘아이스크림 할인점’,[스포츠서울 신재유기자] 여름에나 먹던 아이스크림이 사계절 내내 사랑받는 디저트로 자리 잡으면서... 없으며 폐업 시 위약금과 계약 갱신비용이 들지 않아 창업 부담이 적다. 특별한 관리가 요구되는 전문...
57,2018.05.17.,4년 만에 갈 곳 잃은 푸드트럭…폐업 러시 왜?,화물차에서 음식을 조리해 파는 '푸드 트럭'은 규제 개혁과 청년 창업의 상징으로 꼽혔는데요.  등장... 서울시에 영업신고된 푸드트럭 626대 가운데 폐업한 트럭은 192대.  3분의 1 정도가 폐업 중인 셈입니다.   [이준엽...
58,2018.05.18.,비즈플랜 폐업자영업자 무료 취업교육 '인기',"비즈플랜 관계자는 ""서울의 강남, 구로, 마포 지역과 경기 안양, 안산, 부천지역에 마련된 비즈플랜... 자영업종의 창업률이 상반기 대비 1.6% 상승했다. 하지만 폐업률은 2.5%로 상반기 대비 1.9%나 상승해 자영업자들이..."
59,2018.05.20.,"[머니+ 성공창업, 상권을 보라] 카페시장 시니어창업 증가",여기에 치킨집 창업시장이 비대해지면서 5높아진 폐업률도 문제점으로 남았다. 카페창업이 선호되면서 복지센터나 교육훈련 아카데미에서도 시니어들의 니즈를 반영해 커피 관련 훈련프로그램을 마련하고 있다. 서울노...
60,2018.05.16.,박원순 등판에 김문수ㆍ안철수 견제구…막오른 '한강 삼국지',"한 기업이 창업될 때 두 개가 폐업이 되고 있습니다. "" 이제 지방선거까지 불과 한 달도 남지 않았습니다. 이번 선거 최대 관심지역인 서울시장 선거 열기도 본격적으로 달아오르고 있습니다. 연합뉴스TV 최덕재입니다...."
61,2018.05.21.,<금주 주요 일정> (21일~27일),"피해보전직접지불‧폐업지원 지급품목 확정(배포시) ◇국토교통부 21일(월) △김현미 장관 10:00 상임위... 서울중앙지법 형사30부, 311호. [산업] 21일 (월) △무협 조간 &lt;인텔차이나, 중국에 혁신‧창업 생태계를..."
62,2018.05.21.,"유망 프랜차이즈 삼겹살 창업 ‘숙달돼지’, “가맹주 매출 보장으로 안정성 ...",[서울경제] 여름을 앞두고 있음에도 소비심리의 위축과 더불어 내수경제의 불황으로 창업 시장의 체감... 작년부터 이어져온 대형 프랜차이즈 본사의 갑질 논란과 프랜차이즈 가맹점의 매출 부진으로 인한 자영업 폐업율...
63,2018.05.09.,"국세청, 9~18일까지 제8기 영세납세자지원단 모집","무료세무자문, 창업자·폐업자 멘토링, 전통시장·다문화센터 찾아가는 서비스 등 다양한 세무지원을 하게 된다. 국세청과 한국세무사회, 한국공인회계사회는 영세납세자지원단 제도를 활성화하기 위해 이날 서울지방..."
64,2018.05.16.,"[취재파일] 모순된 일자리 창출 정책, 겉은 노동친화 속은 구조조정",국내 산업단지 가운데 가장 많은 중소기업이 몰려 있다는 시화 반월 산업단지와 서울 성동구의 도금업체... 아예 공장 문을 닫아 빈 공장에 자재가 뒹구는 폐업 회사도 간간이 눈에 띄었다. 한 때 2만 개가 넘는...
65,2018.05.02.,"중기부-통계청, 과학적인 중소기업 통계 개발","중기부-통계청, 통계품질 개선 MOU 체결(서울=연합뉴스) 이상훈 중소벤처기업부 중소기업정책관(왼쪽)과... [중소벤처기업부 제공=연합뉴스] photo@yna.co.kr 중소벤처기업부는 통계청과 손잡고 창업과 폐업 등 다양한..."
66,2018.05.09.,"[해보니 시리즈 29] 아이스크림 할인점 가보니, 도대체 진짜 가격은?","물론 아이스크림 할인점에 대해 초기 창업 비용이 1,000만 원이라는 둥 광고성 기사가 기승을 부리고, 제조사가 가격을 올리거나 성수기가 지나면 쉽게 폐업할 수 있다는 지적이 이어지고 있다. 하지만 소비자 입장에서..."
67,2018.05.10.,최저임금·혼밥족에 음식점업 사업자 비중 10% 첫 붕괴,[서울경제] 급격한 최저임금 인상에 따른 인건비 부담과 혼밥족 증가가 겹치면서 전체 사업자에서... 올 1월 16.4%의 최저임금 인상을 앞두고 부담을 느낀 영세 사업자들이 사업을 접거나 창업을 포기했다는...
