,date,title,contents
136,2018.05.15.,"박원순, 첫 공식 일정 소화 ""압도적 승리""… 安 ""자신있다""","그는 이어 ""지난 7년간 박 시장의 시정을 보면 달라진 것이 없다는 게 서울시민 대다수의 평가다""며 ""실업률은 전국 최하위고, 소상공인 가게 1개가 창업할 때 2개가 폐업을 하고 있어서 서울 상황이 지금 굉장히 심각하다..."
137,2018.05.18.,"한솔요리학원-외식창업아카데미, 2018 소상공인 재창업패키지 교육생 대모집 ","재창업패키지 교육'은 업종전환 소상공인 및 폐업자를 대상으로 성공적인 재창업을 위한 실전... 한솔외식창업아카데미는 서울 종로2가 사거리 '지오다노 건물' 7층에 위치하며, 종각역 도보 5분 거리에 있다."
138,2018.05.13.,"정금종, 절망의 '죽도 시간'이 빚어낸 희망의 숨결",왼쪽은 공동 저자 박정옥(사진=하명남 기자) (서울=국제뉴스) 하명남 기자 = ‘스타트업 스타트인’ 출판기념... 공장을 폐업하며 절망의 시간 ‘죽도’에서 희망을 찾아낸 이야기로 본인의 창업 경험을 독자와 나누는...
139,2018.05.15.,업종변경 창업아이템으로 부상하고 있는 커피전문점 '감성커피',"실제로 경쟁에서 밀린 자영업자들은 버티지 못하고 폐업을 하는 경우가 상당수다. 또한 최저 임금 인상이 본격적으로 시행되면서 자영업자들의 근심, 걱정은 더욱 커졌다. 창업 전문가들은 아이템 낙후, 서비스 부족..."
140,2018.05.15.,업종변경 창업아이템으로 부상하고 있는 커피전문점 '감성커피',"실제로 경쟁에서 밀린 자영업자들은 버티지 못하고 폐업을 하는 경우가 상당수다. 또한 최저 임금 인상이 본격적으로 시행되면서 자영업자들의 근심, 걱정은 더욱 커졌다. 창업 전문가들은 아이템 낙후, 서비스 부족..."
141,2018.05.26.,"서울 시장 후보 릴레이 인터뷰③ 박원순 ""'내 삶을 바꾸는 서울' '사람이 행복...","둘째, 폐업자의 회생을 돕는 '서울형 자영업자실직안전망'을 구축하겠습니다. 자영업자들의 평균생존율은 20... 서울시가 가입보험료 지원을 통해 고용보험 안전망으로 편입시키겠습니다. 또한 자영업자의 창업부터 실패..."
142,2018.05.10.,"진이찬방, 인천경기 프랜차이즈 창업박람회 참가해 창업 노하우 전해","이에 서울과 경기지역뿐만 아니라 경인 지역 예비창업자와 기창업자 그리고 업종전환 예정자에게 유망... 도입, 창업 6개월 이내에 매출 부진으로 인한 폐업의 위기를 가맹본사의 적극적인 지원 운영을 통해 극복할 수..."
143,2018.05.02.,"중기부, 데이터 기반 과학적 행정 본격 드라이브","사진/연합뉴스 [서울=경기일보/백상일 기자] 중소벤처기업부가 데이터에 기반한 과학적 행정을 본격... 먼저 개인과 법인 기업의 창업과 폐업 통계, 지식기반서비스업 통계 작성 등 신규통계 개발한다. 다름으로 기업체..."
144,2018.05.11.,"기업탐방-징코푸드) ""기업은 내 것이 아니다""",징코푸드와 피오레의 성공사를 창업자인 문요환 전무이사(58)에게 직접 들어보았다. 맨손에서 200억 까지... 군산에서 하던 사업을 정리하고 2008년도에 부안으로 내려와 새로운 둥지를 마련한 그는 주산면에서 폐업한...
145,2018.05.03.,'자영업자 무덤'된 편의점…점포당 매출 반등의 '비밀',"효과 [#서울 중구 오피스 빌딩 1층 상가에서 커피숍을 운영하던 백모씨(60대)는 올해 1월 A편의점과... 믿고 창업했는데 아르바이트 직원 한 달 인건비 180만원 등 매월 적자만 누적되고 있다""면서 ""폐업을 신청했지만..."
146,2018.05.04.,‘페북 정보 유출’ 애널리티카 폐업,[서울신문] 2016년 미국 대선에서 수천만 명의 페이스북 이용자 개인정보를 공화당 도널드 트럼프 후보... 속에 폐업을 결정했다. 이날 애널리티카의 모회사인 SCL 그룹의 창업자 나이젤 오크스는 성명을 통해 “더는...
147,2018.05.05.,[리스타트 10인10色] ➀ 세계 시장 제패할 '기타왕' 꿈꾸는 정금종 대표,하지만 2009년 세계금융위기 여파로 한국악기는 5년을 버티지 못해 결국 2014년 폐업했다.   [사진=박정옥... 그는 서울창업허브에서 창업 멘토로 활동하면서 다른 창업자들을 돕고 있다. 이를 위해 그는 매주 수요일 밤...
148,2018.05.14.,"레드오션 창업시장에서, 소자본기술창업아이템으로 성공한 입주이사청소 하하...","하하크린 [서울와이어 정시환 기자] 경기 불황에 창업 경쟁까지 치열해지면서 창업시장은 레드오션이 된지... 중소벤처기업부와 통계청이 26일 국회에 제출한 자료에 따르면, 소상공인들은 창업 후 1년 이내 폐업 비율이..."
149,2018.05.02.,"정상회담보다 뜬 '평양냉면', 동대문이라고 못 만들까","국세청 개인사업자 폐업 현황(2016년 9월 기준)을 보면 음식점 폐업률은 전체 폐업의 21.6%로 가장 높게... 청년외식 창업인큐베이팅 사업의 특이점 중 하나는 지방자치단체(서울시, 동대문구청)와 사회적경제 중간지원조직..."
150,2018.05.11.,반찬 브랜드 진이찬방 “불경기일수록 대중적인 아이템이 창업에 유리”,"2명은 폐업의 위기에 직면하고 있는 현실에서 근본적인 해결책을 찾아야 한다. 이에 창업 전에 관련된... 2001년 설립 이후 축적해온 노하우를 바탕으로 성장세를 이어가고 있는 진이찬방은 서울, 경기권을 비롯한 전국에서..."
151,2018.05.02.,[최원호 박사의 인성으로 경영하라] 인성경영은 청지기 정신의 실천이다,[최원호 서울한영대학교 겸임교수] 인성경영은 ‘청지기정신’의 의미를 띠고 있다. 창업주나 오너... 그런 곳은 온갖 비리가 얼룩져 있고 모두가 알고도 모른 척 숨죽이고 있을 뿐 결코 존경받는 기업이 아니라 폐업의...
152,2018.05.02.,"2018 인천경기 프랜차이즈 창업박람회 5월 개최, 카페아이템 강세…신규 참가...","박람회 현장에서는 부대행사로 마케팅 및 폐업 등에 관한 창업자가 꼭 알아야 할 정보 제공을 위하여 무료... 한편, 제일좋은전람은 5월 인천에 이어, 6월 서울, 7월 대구, 8월 광주, 10월 창원에서도 창업박람회 개최..."
153,2018.05.04.,"5월 종합소득세 신고, 장부 기장 사업자는 세금 혜택 세무사와 상의해야","태송세무회계사무소 [서울와이어 정시환 기자] 매년 5월은 종합소득세 신고 기간으로, 2017년 중 사업소득이 있었던 납세자는 사업자등록의 휴·폐업 여부와 관계없이 이달 중 종합소득세를 신고·납부해야 한다...."
154,2018.05.03.,[창업! 칼럼] 할 것 없다고 창업? 지옥을 맛보고 싶다면 얼마든지,"[서울와이어] 우리가 자주 하는 우스갯소리에 ""남의 돈 벌어 먹고 살기가 힘들다""는 말이 있다. 때에 따라... 지난해 자영업자의 폐업률은 2%대 중반까지 치솟으며 사상 처음으로 창업률을 앞질렀다. 은행권의..."
155,2018.05.25.,"[서울시장 후보 릴레이 인터뷰①] 안철수 ""서울이 다시 살아나려면 4차산업혁...","문재인 정부의 급격한 최저임금 인상으로 자엽업자들은 폐업하거나 일자리를 줄이고 상품가격을 올릴... 혁신적인 인재들이 서울로 모여 두려움 없이 창업하고, 서로 교류하면서 아이디어와 혁신성을 더욱 키워 성공적인..."
156,2018.05.23.,전통시장 청년몰 4곳 중 1곳 휴·폐업… 사업관리 '뒷전',받은 '청년몰 창업 점현황' 자료에 따르면 이 사업으로 개장한 22개 시장 209개 점포 중 24%인 65개가 3월... 또 휴·폐업한 점포 대부분은 지원 기간인 2년이 끝나면서 문을 닫은 것으로 파악됐다. 실제 서울 서대문구...
157,2018.05.18.,증여일 5년 내 대표이사 취임해야 가업승계 증여세 경감 받아,창업을 위한 재산을 받으면 증여세가 감면된다 18세 이상인 거주자가 세법에서 정하는 업종을 영위하는... ① 가업에 더 이상 종사하지 않거나 가업을 휴업(1년 이상)하거나 폐업하는 경우 ② 주식 등을 증여받은 사람...
158,2018.05.15.,[천지일보 이슈종합] 美대사관 예루살렘 이전·핵실험장 폐기는 비핵화 시작·...,"◆당정, 소셜벤처 활성화 일자리 대책 마련… 최대 1억원 창업비용 지원☞(원문보기) 정부와... 법원에 따르면 서울중앙지법 허경호 영장전담 부장판사는 이날 오전 삼성전자서비스 최모 전무, 폐업 실무를 추진한..."
159,2018.05.10.,최저임금 인상에 식당 줄줄이 폐업… 전체 사업자 중 음식업자 비중 10% 이하...,최저 임금 인상 여파로 폐업하거나 창업을 포기하는 이들이 크게 늘어났기 때문인 것으로 풀이된다. 사진은 임대 문의 문구가 붙어있는 서울 시내의 문닫은 음식점 모습.(연합)
160,2018.05.10.,최저임금 인상에 식당 줄줄이 폐업… 전체 사업자 중 음식업자 비중 10% 이하...,최저 임금 인상 여파로 폐업하거나 창업을 포기하는 이들이 크게 늘어났기 때문인 것으로 풀이된다. 사진은 임대 문의 문구가 붙어있는 서울 시내의 문닫은 음식점 모습.(연합)
161,2018.05.13.,"음식점·주택·영화...'공유'의 이름으로, 1인가구 시대 역발상 단면 셋","◆ 공유주방...음식점 창업 위험부담 ↓ 서울연구원의 서울시 외식산업의 실태분석에 따르면, 2013년 기준... 또한 외식업 창업자들이 1년 이내에 폐업하는 경우가 대다수로 창업 및 폐업이 빈번한 특성을 보인다. 수천만..."
